date,language,stargazers,starsToday,description,owner,name,url
2023-05-15,svelte,1074,62,Open source codebase powering the HuggingChat app,huggingface,chat-ui,https://github.com/huggingface/chat-ui
2023-05-15,svelte,7712,12,An open-source & self-hostable Heroku / Netlify alternative.,coollabsio,coolify,https://github.com/coollabsio/coolify
2023-05-15,svelte,2469,7,The UI toolkit for Svelte and Tailwind.,skeletonlabs,skeleton,https://github.com/skeletonlabs/skeleton
2023-05-15,svelte,1824,1,"A Svelte library for building dynamic, infinitely customizable node-based user interfaces and flowcharts",open-source-labs,Svelvet,https://github.com/open-source-labs/Svelvet
2023-05-15,svelte,20528,22,"The most popular, free and open-source Tailwind CSS component library",saadeghi,daisyui,https://github.com/saadeghi/daisyui
2023-05-15,svelte,974,2,Cybernetically enhanced Firebase apps,codediodeio,sveltefire,https://github.com/codediodeio/sveltefire
2023-05-15,svelte,137,2,A Git-based lightweight headless CMS. A modern alternative to Netlify/Decap CMS.,sveltia,sveltia-cms,https://github.com/sveltia/sveltia-cms
2023-05-15,svelte,102,0,Create a custom league page for your Sleeper fantasy football league!,nmelhado,league-page,https://github.com/nmelhado/league-page
2023-05-15,svelte,131,1,Website for ReVanced,revanced,revanced-website,https://github.com/revanced/revanced-website
2023-05-15,svelte,558,4,ChatGPT web interface using the OpenAI API,Niek,chatgpt-web,https://github.com/Niek/chatgpt-web
2023-05-15,svelte,436,1,The official IOTA and Shimmer wallet,iotaledger,firefly,https://github.com/iotaledger/firefly
2023-05-15,svelte,91,0,Ultra customizable hud featuring a unique and robust settings menu. Change eveything about your experience!,Project-Sloth,ps-hud,https://github.com/Project-Sloth/ps-hud
2023-05-15,svelte,1106,23,Recreating Windows 11 with Svelte.,yashash-pugalia,win11-svelte,https://github.com/yashash-pugalia/win11-svelte
2023-05-15,svelte,2435,4,"Database manager for MySQL, PostgreSQL, SQL Server, MongoDB, SQLite and others. Runs under Windows, Linux, Mac or as web application",dbgate,dbgate,https://github.com/dbgate/dbgate
2023-05-15,svelte,889,6,Official Svelte components built for Flowbite and Tailwind CSS,themesberg,flowbite-svelte,https://github.com/themesberg/flowbite-svelte
2023-05-15,svelte,244,1,,StephDietz,watch-this,https://github.com/StephDietz/watch-this
2023-05-15,svelte,156,0,Mobile Web component library based on Svelte and Tailwind,dufu1991,stdf,https://github.com/dufu1991/stdf
2023-05-15,svelte,1691,1,"A simple standalone program which automates the installation, removal and maintenance of BetterDiscord.",BetterDiscord,Installer,https://github.com/BetterDiscord/Installer
2023-05-15,svelte,2159,0,Svelte implementation of the Carbon Design System,carbon-design-system,carbon-components-svelte,https://github.com/carbon-design-system/carbon-components-svelte
2023-05-15,svelte,162,0,Example showing how to use Auth.js with SvelteKit.,nextauthjs,sveltekit-auth-example,https://github.com/nextauthjs/sveltekit-auth-example
2023-05-15,svelte,323,0,Static webpage that allows you to use your OpenAI API key for the same experience as you get with ChatGPT!,patrikzudel,PatrikZeros-ChatGPT-API-UI,https://github.com/patrikzudel/PatrikZeros-ChatGPT-API-UI
2023-05-15,svelte,212,0,A Flood (https://github.com/Flood-UI/flood) clone for Transmission,johman10,flood-for-transmission,https://github.com/johman10/flood-for-transmission
2023-05-15,svelte,482,0,A faithful implementation of Microsoft's Fluent Design System in Svelte.,Tropix126,fluent-svelte,https://github.com/Tropix126/fluent-svelte
2023-05-15,svelte,2783,0,Build and ship your app faster https://fireship.io,fireship-io,fireship.io,https://github.com/fireship-io/fireship.io
2023-05-15,svelte,25,0,emojimix implemented in Svelte,svelteland,emojimix,https://github.com/svelteland/emojimix