date,language,stargazers,starsToday,description,owner,name,url
2023-12-24,markdown,26283,133,Linuxå‘½ä»¤å¤§å…¨æœç´¢å·¥å…·ï¼Œå†…å®¹åŒ…å«Linuxå‘½ä»¤æ‰‹å†Œã€è¯¦è§£ã€å­¦ä¹ ã€æœé›†ã€‚https://git.io/linux,jaywcjlove,linux-command,https://github.com/jaywcjlove/linux-command
2023-12-24,markdown,3198,4,Kotlin Evolution and Enhancement Process,Kotlin,KEEP,https://github.com/Kotlin/KEEP
2023-12-24,markdown,1461,1,The source repository of all translated content for MDN Web Docs,mdn,translated-content,https://github.com/mdn/translated-content
2023-12-24,markdown,14167,2,â¬†ï¸ Free uptime monitor and status page powered by GitHub,upptime,upptime,https://github.com/upptime/upptime
2023-12-24,markdown,14739,2,This maintains proposals for changes and user-visible enhancements to the Swift Programming Language.,apple,swift-evolution,https://github.com/apple/swift-evolution
2023-12-24,markdown,2167,2,Protect your data against global mass surveillance programs.,privacyguides,privacyguides.org,https://github.com/privacyguides/privacyguides.org
2023-12-24,markdown,121539,18,"åˆ·ç®—æ³•å…¨é å¥—è·¯ï¼Œè®¤å‡† labuladong å°±å¤Ÿäº†ï¼English version supported! Crack LeetCode, not only how, but also why.",labuladong,fucking-algorithm,https://github.com/labuladong/fucking-algorithm
2023-12-24,markdown,8839,5,Improve your README.md profile with these amazing badges.,alexandresanlim,Badges4-README.md-Profile,https://github.com/alexandresanlim/Badges4-README.md-Profile
2023-12-24,markdown,5508,2,RFCs for changes to Rust,rust-lang,rfcs,https://github.com/rust-lang/rfcs
2023-12-24,markdown,4593,1,"An awesome list of awesome YouTubers that teach about technology. Tutorials about web development, computer science, machine learning, game development, cybersecurity, and more.",JoseDeFreitas,awesome-youtubers,https://github.com/JoseDeFreitas/awesome-youtubers
2023-12-24,markdown,1507,0,This repository provides SAP style guides for coding and coding-related topics.,SAP,styleguides,https://github.com/SAP/styleguides
2023-12-24,markdown,3934,2,Rust ç¨‹åºè®¾è®¡è¯­è¨€ï¼ˆ2021 edition æ–½å·¥ä¸­ï¼‰,KaiserY,trpl-zh-cn,https://github.com/KaiserY/trpl-zh-cn
2023-12-24,markdown,46766,12,ğŸ“š Collaborative cheatsheets for console commands,tldr-pages,tldr,https://github.com/tldr-pages/tldr
2023-12-24,markdown,2837,6,A curation of awesome portfolio website ideas for developers and designers to draw inspiration from. Raise a pull request to add more. ğŸ’œ,Evavic44,portfolio-ideas,https://github.com/Evavic44/portfolio-ideas
2023-12-24,markdown,8400,1,The content behind MDN Web Docs,mdn,content,https://github.com/mdn/content
2023-12-24,markdown,4483,3,Ethereum.org is a primary online resource for the Ethereum community.,ethereum,ethereum-org-website,https://github.com/ethereum/ethereum-org-website