date,language,stargazers,starsToday,description,owner,name,url
2024-10-07,svelte,5046,4,"shadcn/ui, but for Svelte. ✨",huntabyte,shadcn-svelte,https://github.com/huntabyte/shadcn-svelte
2024-10-07,svelte,2476,4,"Bittorrent streaming software for cats. Stream anime torrents, real-time with no waiting for downloads.",ThaUnknown,miru,https://github.com/ThaUnknown/miru
2024-10-07,svelte,33447,13,"🌼 🌼 🌼 🌼 🌼  The most popular, free and open-source Tailwind CSS component library",saadeghi,daisyui,https://github.com/saadeghi/daisyui
2024-10-07,svelte,1284,3,"A modern SaaS template/boilerplate built with SvelteKit, Tailwind, and Supabase. Includes marketing page, blog, subscriptions, auth, user dashboard, user settings, pricing page, and more.",CriticalMoments,CMSaasStarter,https://github.com/CriticalMoments/CMSaasStarter
2024-10-07,svelte,145,0,LOA Logs - Modern DPS Meter for Lost Ark,snoww,loa-logs,https://github.com/snoww/loa-logs
2024-10-07,svelte,2117,1,"A modern, easy-to-use and performant custom Home Assistant dashboard",matt8707,ha-fusion,https://github.com/matt8707/ha-fusion
2024-10-07,svelte,359,0,A mod manager for easy installation of mods and modloader for Satisfactory,satisfactorymodding,SatisfactoryModManager,https://github.com/satisfactorymodding/SatisfactoryModManager
2024-10-07,svelte,2413,4,3D framework for Svelte,threlte,threlte,https://github.com/threlte/threlte
2024-10-07,svelte,1467,6,"Transcribe any audio to text, translate and edit subtitles 100% locally with a web UI. Powered by whisper models!",pluja,whishper,https://github.com/pluja/whishper
2024-10-07,svelte,5229,3,"Database manager for MySQL, PostgreSQL, SQL Server, MongoDB, SQLite and others. Runs under Windows, Linux, Mac or as web application",dbgate,dbgate,https://github.com/dbgate/dbgate
2024-10-07,svelte,512,0,"FreeShow is a free and open-source, user-friendly presenter software.",ChurchApps,FreeShow,https://github.com/ChurchApps/FreeShow
2024-10-07,svelte,1769,0,"A simple standalone program which automates the installation, removal and maintenance of BetterDiscord.",BetterDiscord,Installer,https://github.com/BetterDiscord/Installer
2024-10-07,svelte,107,1,A Radio Script for Fivem Server,SOH69,mm_radio,https://github.com/SOH69/mm_radio
2024-10-07,svelte,1248,3,Full-sized drag & drop JavaScript event calendar with resource & timeline views,vkurko,calendar,https://github.com/vkurko/calendar
2024-10-07,svelte,687,0,Find the best Neovim plugins,codicocodes,dotfyle,https://github.com/codicocodes/dotfyle
2024-10-07,svelte,2229,2,,PuruVJ,macos-web,https://github.com/PuruVJ/macos-web
2024-10-07,svelte,448,0,"Paaster is a secure and user-friendly pastebin application that prioritizes privacy and simplicity. With end-to-end encryption and paste history, Paaster ensures that your pasted code remains confidential and accessible.",WardPearce,paaster,https://github.com/WardPearce/paaster
2024-10-07,svelte,303,0,🌐 Website for ReVanced,ReVanced,revanced-website,https://github.com/ReVanced/revanced-website
2024-10-07,svelte,4927,2,"A complete design system and component solution, built on Tailwind.",skeletonlabs,skeleton,https://github.com/skeletonlabs/skeleton