date,language,stargazers,starsToday,description,owner,name,url
2022-10-29,markdown,20948,95,Linux命令大全搜索工具，内容包含Linux命令手册、详解、学习、搜集。https://git.io/linux,jaywcjlove,linux-command,https://github.com/jaywcjlove/linux-command
2022-10-29,markdown,13751,4,This maintains proposals for changes and user-visible enhancements to the Swift Programming Language.,apple,swift-evolution,https://github.com/apple/swift-evolution
2022-10-29,markdown,3155,3,Rust 程序设计语言（2021 edition 施工中）,KaiserY,trpl-zh-cn,https://github.com/KaiserY/trpl-zh-cn
2022-10-29,markdown,1400,23,A curation of awesome portfolio website ideas for developers and designers to draw inspiration from. Raise a pull request to add more.,Evavic44,portfolio-ideas,https://github.com/Evavic44/portfolio-ideas
2022-10-29,markdown,12010,2,Free uptime monitor and status page powered by GitHub,upptime,upptime,https://github.com/upptime/upptime
2022-10-29,markdown,1160,0,This repository provides SAP style guides for coding and coding-related topics.,SAP,styleguides,https://github.com/SAP/styleguides
2022-10-29,markdown,111432,26,"刷算法全靠套路，认准 labuladong 就够了！English version supported! Crack LeetCode, not only how, but also why.",labuladong,fucking-algorithm,https://github.com/labuladong/fucking-algorithm
2022-10-29,markdown,89,0,Solutions (that we managed to find) for the 2021 PicoCTF,vivian-dai,PicoCTF2021-Writeup,https://github.com/vivian-dai/PicoCTF2021-Writeup
2022-10-29,markdown,4884,5,Official Discord API Documentation,discord,discord-api-docs,https://github.com/discord/discord-api-docs
2022-10-29,markdown,3478,4,Ethereum.org is a primary online resource for the Ethereum community.,ethereum,ethereum-org-website,https://github.com/ethereum/ethereum-org-website
2022-10-29,markdown,1779,0,A Collection of GitHub Profiles with awesome readme,coderjojo,creative-profile-readme,https://github.com/coderjojo/creative-profile-readme
2022-10-29,markdown,1728,1,Airbnb's Swift Style Guide,airbnb,swift,https://github.com/airbnb/swift
2022-10-29,markdown,6560,3,The content behind MDN Web Docs,mdn,content,https://github.com/mdn/content
2022-10-29,markdown,1005,0,All translated MDN content in raw form,mdn,translated-content,https://github.com/mdn/translated-content
2022-10-29,markdown,41264,13,Collaborative cheatsheets for console commands,tldr-pages,tldr,https://github.com/tldr-pages/tldr
2022-10-29,markdown,1219,2,SatoshiLabs Improvement Proposals,satoshilabs,slips,https://github.com/satoshilabs/slips
2022-10-29,markdown,3758,2,Solutions to Introduction to Algorithms Third Edition,walkccc,CLRS,https://github.com/walkccc/CLRS
2022-10-29,markdown,2566,6,A collection listing all Achievements available on the GitHub profile,Schweinepriester,github-profile-achievements,https://github.com/Schweinepriester/github-profile-achievements
2022-10-29,markdown,6112,2,Improve your README.md profile with these amazing badges.,alexandresanlim,Badges4-README.md-Profile,https://github.com/alexandresanlim/Badges4-README.md-Profile