date,language,stargazers,starsToday,description,owner,name,url
2022-12-20,php,20900,10,"Nextcloud server, a safe home for all your data",nextcloud,server,https://github.com/nextcloud/server
2022-12-20,php,2140,8,A multiple proxy protocol manage panel application interface,v2board,v2board,https://github.com/v2board/v2board
2022-12-20,php,948,22,è‚¥ç¾Šçš„4K/8Kè¶…é«˜æ¸…IPTVç›´æ’­æº&&ç›´æ’­ä»£ç ä»“åº“,youshandefeiyang,IPTV,https://github.com/youshandefeiyang/IPTV
2022-12-20,php,1068,8,Nextcloud AIO stands for Nextcloud All In One and provides easy deployment and maintenance with most features included in this one Nextcloud instance.,nextcloud,all-in-one,https://github.com/nextcloud/all-in-one
2022-12-20,php,5253,9,An Application dashboard and launcher,linuxserver,Heimdall,https://github.com/linuxserver/Heimdall
2022-12-20,php,2067,3,"Stay motivated and show off your contribution streak!  Display your total contributions, current streak, and longest streak on your GitHub profile README",DenverCoder1,github-readme-streak-stats,https://github.com/DenverCoder1/github-readme-streak-stats
2022-12-20,php,18394,13,"Personal CRM. Remember everything about your friends, family and business relationships.",monicahq,monica,https://github.com/monicahq/monica
2022-12-20,php,43729,19,"SecLists is the security tester's companion. It's a collection of multiple types of lists used during security assessments, collected in one place. List types include usernames, passwords, URLs, sensitive data patterns, fuzzing payloads, web shells, and many more.",danielmiessler,SecLists,https://github.com/danielmiessler/SecLists
2022-12-20,php,162,31,"AdapterMan for Workerman. Run almost any PHP app asynchronously with Workerman, without touch 1 line of code in your fw or app.",joanhey,AdapterMan,https://github.com/joanhey/AdapterMan
2022-12-20,php,14290,1,Better Markdown Parser in PHP,erusev,parsedown,https://github.com/erusev/parsedown
2022-12-20,php,10903,2,PHP Email address validator,egulias,EmailValidator,https://github.com/egulias/EmailValidator
2022-12-20,php,1396,3,,pentestmonkey,php-reverse-shell,https://github.com/pentestmonkey/php-reverse-shell
2022-12-20,php,15846,4,A PHP parser written in PHP,nikic,PHP-Parser,https://github.com/nikic/PHP-Parser
2022-12-20,php,11207,0,Supercharged Excel exports and imports in Laravel,SpartnerNL,Laravel-Excel,https://github.com/SpartnerNL/Laravel-Excel
2022-12-20,php,8794,9,YÌ²our OÌ²wn UÌ²RÌ²LÌ² SÌ²hortener - the ğ‘‘ğ‘’ ğ‘“ğ‘ğ‘ğ‘¡ğ‘œ standard self hosted URL shortener in PHP,YOURLS,YOURLS,https://github.com/YOURLS/YOURLS
2022-12-20,php,3447,3,"Single-file PHP file manager, browser and manage your files efficiently and easily with tinyfilemanager",prasathmani,tinyfilemanager,https://github.com/prasathmani/tinyfilemanager
2022-12-20,php,18785,1,The PHP Unit Testing framework.,sebastianbergmann,phpunit,https://github.com/sebastianbergmann/phpunit
2022-12-20,php,7412,5,SSPanel V3 é­”æ”¹å†æ¬¡ä¿®æ”¹ç‰ˆ,Anankke,SSPanel-Uim,https://github.com/Anankke/SSPanel-Uim
2022-12-20,php,7223,1,Assertions to validate method input/output with nice error messages.,webmozarts,assert,https://github.com/webmozarts/assert
2022-12-20,php,222,1,,yankovalenko94,Webdev2019,https://github.com/yankovalenko94/Webdev2019
2022-12-20,php,12982,3,PHP Image Manipulation,Intervention,image,https://github.com/Intervention/image
2022-12-20,php,71787,12,"Laravel is a web application framework with expressive, elegant syntax. Weâ€™ve already laid the foundation for your next big idea â€” freeing you to create without sweating the small things.",laravel,laravel,https://github.com/laravel/laravel
2022-12-20,php,5272,12,"Admin panel, form builder and table builder for Laravel. Built with the TALL stack. Designed for humans.",filamentphp,filament,https://github.com/filamentphp/filament
2022-12-20,php,3976,2,"The Config component helps you find, load, combine, autofill and validate configuration values of any kind, whatever their source may be (YAML, XML, INI files, or for instance a database).",symfony,config,https://github.com/symfony/config
2022-12-20,php,14276,5,A personal music streaming server that works.,koel,koel,https://github.com/koel/koel