date,language,stargazers,starsToday,description,owner,name,url
2024-03-09,php,16756,80,A PHP parser written in PHP,nikic,PHP-Parser,https://github.com/nikic/PHP-Parser
2024-03-09,php,9420,214,A free open source IT asset/license management system,snipe,snipe-it,https://github.com/snipe/snipe-it
2024-03-09,php,2880,21,"OPNsense GUI, API and systems backend",opnsense,core,https://github.com/opnsense/core
2024-03-09,php,2232,0,"WordPress Develop, Git-ified. Synced from git://develop.git.wordpress.org/, including branches and tags! This repository is just a mirror of the WordPress subversion repository. Please include a link to a pre-existing ticket on https://core.trac.wordpress.org/ with every pull request.",WordPress,wordpress-develop,https://github.com/WordPress/wordpress-develop
2024-03-09,php,3158,29,Fast and beautiful Log Viewer for Laravel,opcodesio,log-viewer,https://github.com/opcodesio/log-viewer
2024-03-09,php,112,21,PHP SDK for Worken,paidworkco,worken-sdk-php,https://github.com/paidworkco/worken-sdk-php
2024-03-09,php,28147,4,Dependency Manager for PHP,composer,composer,https://github.com/composer/composer
2024-03-09,php,31120,12,The Laravel Framework.,laravel,framework,https://github.com/laravel/framework
2024-03-09,php,3951,4,🚀A multiple proxy protocol manage panel application interface,v2board,v2board,https://github.com/v2board/v2board
2024-03-09,php,21508,5,A full-stack framework for Laravel that takes the pain out of building dynamic UIs.,livewire,livewire,https://github.com/livewire/livewire
2024-03-09,php,14177,0,"Yii 2: The Fast, Secure and Professional PHP Framework",yiisoft,yii2,https://github.com/yiisoft/yii2
2024-03-09,php,5856,1,🚀 A coroutine framework that focuses on hyperspeed and flexibility. Building microservice or middleware with ease.,hyperf,hyperf,https://github.com/hyperf/hyperf
2024-03-09,php,3915,2,"Leantime is a goals focused project management system for non-project managers. Building with ADHD, Autism, and dyslexia in mind.",Leantime,leantime,https://github.com/Leantime/leantime
2024-03-09,php,13076,18,"A collection of beautiful full-stack components for Laravel. The perfect starting point for your next app. Using Livewire, Alpine.js and Tailwind CSS.",filamentphp,filament,https://github.com/filamentphp/filament
2024-03-09,php,994,0,The TYPO3 Core - Enterprise Content Management System. Synchronized mirror of https://review.typo3.org/q/project:Packages/TYPO3.CMS,TYPO3,typo3,https://github.com/TYPO3/typo3
2024-03-09,php,3718,4,"GLPI is a Free Asset and IT Management Software package, Data center management, ITIL Service Desk, licenses tracking and software auditing.",glpi-project,glpi,https://github.com/glpi-project/glpi
2024-03-09,php,20392,4,The classic email sending library for PHP,PHPMailer,PHPMailer,https://github.com/PHPMailer/PHPMailer
2024-03-09,php,16007,3,Debugbar for Laravel (Integrates PHP Debug Bar),barryvdh,laravel-debugbar,https://github.com/barryvdh/laravel-debugbar
2024-03-09,php,4902,2,MISP (core software) - Open Source Threat Intelligence and Sharing Platform,MISP,MISP,https://github.com/MISP/MISP
2024-03-09,php,5291,3,Moodle - the world's open source learning platform,moodle,moodle,https://github.com/moodle/moodle
2024-03-09,php,2319,1,"Drush is a command-line shell and scripting interface for Drupal, a veritable Swiss Army knife designed to make life easier for those who spend their working hours hacking away at the command prompt.",drush-ops,drush,https://github.com/drush-ops/drush
2024-03-09,php,12462,5,PHP Static Analysis Tool - discover bugs in your code without running it!,phpstan,phpstan,https://github.com/phpstan/phpstan
2024-03-09,php,9947,18,Free and open source laravel eCommerce platform,bagisto,bagisto,https://github.com/bagisto/bagisto
2024-03-09,php,4383,6,"⚡ Dynamically generated, customizable SVG that gives the appearance of typing and deleting text for use on your profile page, repositories, or website.",DenverCoder1,readme-typing-svg,https://github.com/DenverCoder1/readme-typing-svg
2024-03-09,php,6910,1,A MongoDB based Eloquent model and Query builder for Laravel (Moloquent),mongodb,laravel-mongodb,https://github.com/mongodb/laravel-mongodb