date,language,stargazers,starsToday,description,owner,name,url
2024-02-19,scala,5525,1,"The Scala 3 compiler, also known as Dotty.",lampepfl,dotty,https://github.com/lampepfl/dotty
2024-02-19,scala,3145,2,A simple client for Android,xxf098,shadowsocksr-v2ray-trojan-android,https://github.com/xxf098/shadowsocksr-v2ray-trojan-android
2024-02-19,scala,60801,15,Source code for Twitter's Recommendation Algorithm,twitter,the-algorithm,https://github.com/twitter/the-algorithm
2024-02-19,scala,225,0,"Open, Modular, Deep Learning Accelerator",apache,tvm-vta,https://github.com/apache/tvm-vta
2024-02-19,scala,8736,0,"A fault tolerant, protocol-agnostic RPC system",twitter,finagle,https://github.com/twitter/finagle
2024-02-19,scala,9036,0,"A Git platform powered by Scala with easy installation, high extensibility & GitHub API compatibility",gitbucket,gitbucket,https://github.com/gitbucket/gitbucket
2024-02-19,scala,1252,0,A tidy SQL-based DB access library for Scala developers. This library naturally wraps JDBC APIs and provides you easy-to-use APIs.,scalikejdbc,scalikejdbc,https://github.com/scalikejdbc/scalikejdbc
2024-02-19,scala,24,0,Rawls service for DSDE,broadinstitute,rawls,https://github.com/broadinstitute/rawls
2024-02-19,scala,282,0,Functional Kafka Streams for Scala,fd4s,fs2-kafka,https://github.com/fd4s/fs2-kafka
2024-02-19,scala,41,0,Notebook service,DataBiosphere,leonardo,https://github.com/DataBiosphere/leonardo
2024-02-19,scala,1998,0,Scala language server with rich IDE features 🚀,scalameta,metals,https://github.com/scalameta/metals
2024-02-19,scala,37834,7,Apache Spark - A unified analytics engine for large-scale data processing,apache,spark,https://github.com/apache/spark
2024-02-19,scala,796,0,Refactoring and linting tool for Scala,scalacenter,scalafix,https://github.com/scalacenter/scalafix
2024-02-19,scala,41,0,workbench identity and access management,broadinstitute,sam,https://github.com/broadinstitute/sam
2024-02-19,scala,10493,3,"Removes large or troublesome blobs like git-filter-branch does, but faster. And written in Scala",rtyley,bfg-repo-cleaner,https://github.com/rtyley/bfg-repo-cleaner
2024-02-19,scala,128,0,,bambosan,Bicubic-Shaders-BE,https://github.com/bambosan/Bicubic-Shaders-BE
2024-02-19,scala,0,0,Домашние работы курса ФИЛП 2024,filp-2024,exercises,https://github.com/filp-2024/exercises
2024-02-19,scala,236,0,The repository for the free Scala at Light Speed mini-course,rockthejvm,scala-at-light-speed,https://github.com/rockthejvm/scala-at-light-speed
2024-02-19,scala,4934,1,Simple and Distributed Machine Learning,microsoft,SynapseML,https://github.com/microsoft/SynapseML
2024-02-19,scala,2935,3,Rocket Chip Generator,chipsalliance,rocket-chip,https://github.com/chipsalliance/rocket-chip
2024-02-19,scala,3624,2,Chisel: A Modern Hardware Design Language,chipsalliance,chisel,https://github.com/chipsalliance/chisel
2024-02-19,scala,780,0,The Daml smart contract language,digital-asset,daml,https://github.com/digital-asset/daml
2024-02-19,scala,1070,1,This is the github repo for Learning Spark: Lightning-Fast Data Analytics [2nd Edition],databricks,LearningSparkV2,https://github.com/databricks/LearningSparkV2
2024-02-19,scala,12883,1,"Build highly concurrent, distributed, and resilient message-driven applications on the JVM",akka,akka,https://github.com/akka/akka
2024-02-19,scala,955,5,"Build highly concurrent, distributed, and resilient message-driven applications using Java/Scala",apache,incubator-pekko,https://github.com/apache/incubator-pekko