date,language,stargazers,starsToday,description,owner,name,url
2024-08-06,php,56080,31,"SecLists is the security tester's companion. It's a collection of multiple types of lists used during security assessments, collected in one place. List types include usernames, passwords, URLs, sensitive data patterns, fuzzing payloads, web shells, and many more.",danielmiessler,SecLists,https://github.com/danielmiessler/SecLists
2024-08-06,php,4811,7,📦 The official Nextcloud installation method. Provides easy deployment and maintenance with most features included in this one Nextcloud instance.,nextcloud,all-in-one,https://github.com/nextcloud/all-in-one
2024-08-06,php,6433,3,"Pterodactyl® is a free, open-source game server management panel built with PHP, React, and Go. Designed with security in mind, Pterodactyl runs all game servers in isolated Docker containers while exposing a beautiful and intuitive UI to end users.",pterodactyl,panel,https://github.com/pterodactyl/panel
2024-08-06,php,19437,12,Empowering People Ethically with the leading open source alternative to Google Analytics that gives you full control over your data. Matomo lets you easily collect data from websites & apps and visualise this data and extract insights. Privacy is built-in. Liberating Web Analytics. Star us on Github? +1. And we love Pull Requests!,matomo-org,matomo,https://github.com/matomo-org/matomo
2024-08-06,php,5690,3,The Roundcube Webmail suite,roundcube,roundcubemail,https://github.com/roundcube/roundcubemail
2024-08-06,php,29531,4,The Symfony PHP framework,symfony,symfony,https://github.com/symfony/symfony
2024-08-06,php,6913,4,Mautic: Open Source Marketing Automation Software.,mautic,mautic,https://github.com/mautic/mautic
2024-08-06,php,15088,10,Firefly III: a personal finances manager,firefly-iii,firefly-iii,https://github.com/firefly-iii/firefly-iii
2024-08-06,php,3243,0,A server software for Minecraft: Bedrock Edition in PHP,pmmp,PocketMine-MP,https://github.com/pmmp/PocketMine-MP
2024-08-06,php,11687,8,"Self-hosted Speed Test for HTML5 and more. Easy setup, examples, configurable, mobile friendly. Supports PHP, Node, Multiple servers, and more",librespeed,speedtest,https://github.com/librespeed/speedtest
2024-08-06,php,3070,1,"Kimai is a web-based multi-user time-tracking application. Works great for everyone: freelancers, companies, organizations - everyone can track their times, generate reports, create invoices and do so much more. SaaS version available at https://www.kimai.cloud",kimai,kimai,https://github.com/kimai/kimai
2024-08-06,php,4932,5,openmediavault is the next generation network attached storage (NAS) solution based on Debian Linux. Thanks to the modular design of the framework it can be enhanced via plugins. openmediavault is primarily designed to be used in home environments or small home offices.,openmediavault,openmediavault,https://github.com/openmediavault/openmediavault
2024-08-06,php,7962,1,PrestaShop is the universal open-source software platform to build your e-commerce solution.,PrestaShop,PrestaShop,https://github.com/PrestaShop/PrestaShop
2024-08-06,php,2540,5,Speedtest Tracker is a self-hosted internet performance tracking application that runs speedtest checks against Ookla's Speedtest service.,alexjustesen,speedtest-tracker,https://github.com/alexjustesen/speedtest-tracker
2024-08-06,php,2774,3,Async PHP client API for the telegram MTProto protocol,danog,MadelineProto,https://github.com/danog/MadelineProto
2024-08-06,php,13220,34,Free and open source laravel eCommerce platform,bagisto,bagisto,https://github.com/bagisto/bagisto
2024-08-06,php,7147,3,A web interface for MySQL and MariaDB,phpmyadmin,phpmyadmin,https://github.com/phpmyadmin/phpmyadmin
2024-08-06,php,2377,2,A PoC that exploits a vulnerability to bypass the Xiaomi HyperOS community restrictions of BootLoader unlocked account bindings.,MlgmXyysd,Xiaomi-HyperOS-BootLoader-Bypass,https://github.com/MlgmXyysd/Xiaomi-HyperOS-BootLoader-Bypass
2024-08-06,php,7822,4,Online Accounting Software,akaunting,akaunting,https://github.com/akaunting/akaunting