date,language,stargazers,starsToday,description,owner,name,url
2022-03-29,php,5144,0,Instant Upgrades and Automated Refactoring of any PHP 5.3+ code,rectorphp,rector,https://github.com/rectorphp/rector
2022-03-29,php,3124,3,"Dolibarr ERP CRM is a modern software package to manage your company or foundation's activity (contacts, suppliers, invoices, orders, stocks, agenda, accounting, ...). It is open source software (written in PHP) and designed for small and medium businesses, foundations and freelancers. You can freely install, use and distribute it as a standalon…",Dolibarr,dolibarr,https://github.com/Dolibarr/dolibarr
2022-03-29,php,16112,2,Liberating Web Analytics. Star us on Github? +1. Matomo is the leading open alternative to Google Analytics that gives you full control over your data. Matomo lets you easily collect data from websites & apps and visualise this data and extract insights. Privacy is built-in. We love Pull Requests!,matomo-org,matomo,https://github.com/matomo-org/matomo
2022-03-29,php,2443,4,独角数卡(自动售货系统)-开源式站长自动化售货解决方案、高效、稳定、快速！,assimon,dujiaoka,https://github.com/assimon/dujiaoka
2022-03-29,php,2433,2,Self-hosted Image Hosting solution. Start your own Flickr/imgur alternative with your own rules.,rodber,chevereto-free,https://github.com/rodber/chevereto-free
2022-03-29,php,6392,5,"PrestaShop is an Open Source e-commerce platform, committed to providing the best shopping cart experience for both merchants and customers.",PrestaShop,PrestaShop,https://github.com/PrestaShop/PrestaShop
2022-03-29,php,37827,27,"SecLists is the security tester's companion. It's a collection of multiple types of lists used during security assessments, collected in one place. List types include usernames, passwords, URLs, sensitive data patterns, fuzzing payloads, web shells, and many more.",danielmiessler,SecLists,https://github.com/danielmiessler/SecLists
2022-03-29,php,74,11,A thin and light scaffolded Laravel Dusk environment.,stevebauman,laravel-husk,https://github.com/stevebauman/laravel-husk
2022-03-29,php,4767,6,The RSS feed for websites missing it,RSS-Bridge,rss-bridge,https://github.com/RSS-Bridge/rss-bridge
2022-03-29,php,8699,3,A PHP Blogging Platform. Simple and Powerful.,typecho,typecho,https://github.com/typecho/typecho
2022-03-29,php,5959,6,A free open source IT asset/license management system,snipe,snipe-it,https://github.com/snipe/snipe-it
2022-03-29,php,913,2,Freenom 域名自动续期。Freenom domain name renews automatically.,luolongfei,freenom,https://github.com/luolongfei/freenom
2022-03-29,php,34,8,Simply monitor your Cron,yoanbernabeu,Cronify,https://github.com/yoanbernabeu/Cronify
2022-03-29,php,4289,4,"A modern, powerful, and robust URL shortener",cydrobolt,polr,https://github.com/cydrobolt/polr
2022-03-29,php,3751,0,"The Config component helps you find, load, combine, autofill and validate configuration values of any kind, whatever their source may be (YAML, XML, INI files, or for instance a database).",symfony,config,https://github.com/symfony/config
2022-03-29,php,2170,1,"The Universal Device Detection library will parse any User Agent and detect the browser, operating system, device used (desktop, tablet, mobile, tv, cars, console, etc.), brand and model.",matomo-org,device-detector,https://github.com/matomo-org/device-detector
2022-03-29,php,21648,1,"Guzzle, an extensible PHP HTTP client",guzzle,guzzle,https://github.com/guzzle/guzzle
2022-03-29,php,8201,0,"Library that provides collection, processing, and rendering functionality for PHP code coverage information.",sebastianbergmann,php-code-coverage,https://github.com/sebastianbergmann/php-code-coverage
2022-03-29,php,11797,3,"Loads environment variables from `.env` to `getenv()`, `$_ENV` and `$_SERVER` automagically.",vlucas,phpdotenv,https://github.com/vlucas/phpdotenv
2022-03-29,php,3873,2,"SQLI labs to test error based, Blind boolean based, Time based.",Audi-1,sqli-labs,https://github.com/Audi-1/sqli-labs
2022-03-29,php,2898,3,"The best web based PHP File Manager in single file, Manage your files efficiently and easily with tinyfilemanager",prasathmani,tinyfilemanager,https://github.com/prasathmani/tinyfilemanager
2022-03-29,php,1699,3,It counts how many times your GitHub profile has been viewed. Free cloud micro-service.,antonkomarev,github-profile-views-counter,https://github.com/antonkomarev/github-profile-views-counter
2022-03-29,php,2998,8,"A collection of tools for rapidly building beautiful TALL stack interfaces, designed for humans.",laravel-filament,filament,https://github.com/laravel-filament/filament