date,language,stargazers,starsToday,description,owner,name,url
2022-07-29,elixir,1837,1,Blockchain explorer for Ethereum based network and a tool for inspecting and analyzing EVM based blockchains.,blockscout,blockscout,https://github.com/blockscout/blockscout
2022-07-29,elixir,19,2,A pluggable storybook for your LiveView components.,phenixdigital,phx_live_storybook,https://github.com/phenixdigital/phx_live_storybook
2022-07-29,elixir,329,3,Phoenix + Live View HEEX Components,petalframework,petal_components,https://github.com/petalframework/petal_components
2022-07-29,elixir,5536,0,A toolkit for data mapping and language integrated query.,elixir-ecto,ecto,https://github.com/elixir-ecto/ecto
2022-07-29,elixir,2496,15,WireGuard®-based VPN server and firewall,firezone,firezone,https://github.com/firezone/firezone
2022-07-29,elixir,4,3,,AdRoll,meandro,https://github.com/AdRoll/meandro
2022-07-29,elixir,18316,7,Peace of mind from prototype to production,phoenixframework,phoenix,https://github.com/phoenixframework/phoenix
2022-07-29,elixir,4712,2,"Rich, real-time user experiences with server-rendered HTML",phoenixframework,phoenix_live_view,https://github.com/phoenixframework/phoenix_live_view
2022-07-29,elixir,2894,0,Simplify deployments in Elixir with OTP releases!,bitwalker,distillery,https://github.com/bitwalker/distillery
2022-07-29,elixir,5,0,FeatureFlag abstract the communication with Launch Darkly SDK,solfacil,feature-flag,https://github.com/solfacil/feature-flag
2022-07-29,elixir,2287,2,"Robust job processing in Elixir, backed by modern PostgreSQL",sorentwo,oban,https://github.com/sorentwo/oban
2022-07-29,elixir,234,1,AppSignal for Elixir package,appsignal,appsignal-elixir,https://github.com/appsignal/appsignal-elixir
2022-07-29,elixir,455,0,Open API Specifications for Elixir Plug applications,open-api-spex,open_api_spex,https://github.com/open-api-spex/open_api_spex
2022-07-29,elixir,17,0,The fusion_auth library provides an Elixir API for accessing the FusionAuth Developer APIs.,leo-technologies-llc,fusion_auth,https://github.com/leo-technologies-llc/fusion_auth
2022-07-29,elixir,223,4,Fastest way to access data in Elixir,hissssst,pathex,https://github.com/hissssst/pathex
2022-07-29,elixir,11905,8,"Simple, open-source, lightweight (< 1 KB) and privacy-friendly web analytics alternative to Google Analytics.",plausible,analytics,https://github.com/plausible/analytics
2022-07-29,elixir,1055,1,An Elixir implementation of gRPC,elixir-grpc,grpc,https://github.com/elixir-grpc/grpc
2022-07-29,elixir,2809,4,Interactive and collaborative code notebooks for Elixir - built with Phoenix LiveView,livebook-dev,livebook,https://github.com/livebook-dev/livebook
2022-07-29,elixir,20531,5,"Elixir is a dynamic, functional language designed for building scalable and maintainable applications",elixir-lang,elixir,https://github.com/elixir-lang/elixir
2022-07-29,elixir,838,1,Package manager for the Erlang VM,hexpm,hex,https://github.com/hexpm/hex
2022-07-29,elixir,1730,1,"Realtime dashboard with metrics, request logging, plus storage, OS and VM insights",phoenixframework,phoenix_live_dashboard,https://github.com/phoenixframework/phoenix_live_dashboard
2022-07-29,elixir,2950,7,A self-hosted data logger for your Tesla,adriankumpf,teslamate,https://github.com/adriankumpf/teslamate
2022-07-29,elixir,640,0,A pure Elixir implementation of Google Protobuf.,elixir-protobuf,protobuf,https://github.com/elixir-protobuf/protobuf