date,language,stargazers,starsToday,description,owner,name,url
2022-07-29,php,27239,80,The Symfony PHP framework,symfony,symfony,https://github.com/symfony/symfony
2022-07-29,php,40486,80,"SecLists is the security tester's companion. It's a collection of multiple types of lists used during security assessments, collected in one place. List types include usernames, passwords, URLs, sensitive data patterns, fuzzing payloads, web shells, and many more.",danielmiessler,SecLists,https://github.com/danielmiessler/SecLists
2022-07-29,php,5585,6,Instant Upgrades and Automated Refactoring of any PHP 5.3+ code,rectorphp,rector,https://github.com/rectorphp/rector
2022-07-29,php,8066,1,"A customizable, open-source eCommerce platform built on WordPress. Build any commerce solution you can imagine.",woocommerce,woocommerce,https://github.com/woocommerce/woocommerce
2022-07-29,php,6548,2,"PrestaShop is an Open Source e-commerce platform, committed to providing the best shopping cart experience for both merchants and customers.",PrestaShop,PrestaShop,https://github.com/PrestaShop/PrestaShop
2022-07-29,php,18484,6,The classic email sending library for PHP,PHPMailer,PHPMailer,https://github.com/PHPMailer/PHPMailer
2022-07-29,php,18562,3,The PHP Unit Testing framework.,sebastianbergmann,phpunit,https://github.com/sebastianbergmann/phpunit
2022-07-29,php,9558,0,PHP_CodeSniffer tokenizes PHP files and detects violations of a defined set of coding standards.,squizlabs,PHP_CodeSniffer,https://github.com/squizlabs/PHP_CodeSniffer
2022-07-29,php,2805,1,Community-based GPL-licensed network monitoring system,librenms,librenms,https://github.com/librenms/librenms
2022-07-29,php,4043,16,"Admin panel, form builder and table builder for Laravel. Built with the TALL stack. Designed for humans.",filamentphp,filament,https://github.com/filamentphp/filament
2022-07-29,php,4212,5,Open Source PHP Framework (originally from EllisLab),codeigniter4,CodeIgniter4,https://github.com/codeigniter4/CodeIgniter4
2022-07-29,php,70461,19,"Laravel is a web application framework with expressive, elegant syntax. We’ve already laid the foundation for your next big idea — freeing you to create without sweating the small things.",laravel,laravel,https://github.com/laravel/laravel
2022-07-29,php,14245,1,Laravel Debugbar (Integrates PHP Debug Bar),barryvdh,laravel-debugbar,https://github.com/barryvdh/laravel-debugbar
2022-07-29,php,21991,5,"Guzzle, an extensible PHP HTTP client",guzzle,guzzle,https://github.com/guzzle/guzzle
2022-07-29,php,9298,3,Doctrine Object Relational Mapper (ORM),doctrine,orm,https://github.com/doctrine/orm
2022-07-29,php,6135,1,A MongoDB based Eloquent model and Query builder for Laravel (Moloquent),jenssegers,laravel-mongodb,https://github.com/jenssegers/laravel-mongodb
2022-07-29,php,143,1,这是一套开源、免费、自建的短链接生成程序，可以通过本套程序快速自建属于自己的短链接生成平台，有丰富的功能和便捷的API，可以帮助你进行各项推广任务！,likeyun,liKeYun_Dwz,https://github.com/likeyun/liKeYun_Dwz
2022-07-29,php,9362,16,A deployment tool written in PHP with support for popular frameworks out of the box,deployphp,deployer,https://github.com/deployphp/deployer
2022-07-29,php,2383,5,"Real-time monitoring of IT components and services, such as networks, servers, VMs, applications and the cloud.",zabbix,zabbix,https://github.com/zabbix/zabbix
2022-07-29,php,103,2,CUYUNIVERSE THE FREEDOM OF CODE,deaaprizal,laract9,https://github.com/deaaprizal/laract9
2022-07-29,php,10163,4,"All Submissions you make to Magento Inc. (""Magento"") through GitHub are subject to the following terms and conditions: (1) You grant Magento a perpetual, worldwide, non-exclusive, no charge, royalty free, irrevocable license under your applicable copyrights and patents to reproduce, prepare derivative works of, display, publically perform, subli…",magento,magento2,https://github.com/magento/magento2
2022-07-29,php,1559,1,"WordPress Develop, Git-ified. Synced from git://develop.git.wordpress.org/, including branches and tags! This repository is just a mirror of the WordPress subversion repository. Please include a link to a pre-existing ticket on https://core.trac.wordpress.org/ with every pull request.",WordPress,wordpress-develop,https://github.com/WordPress/wordpress-develop
2022-07-29,php,2250,2,"Drush is a command-line shell and scripting interface for Drupal, a veritable Swiss Army knife designed to make life easier for those who spend their working hours hacking away at the command prompt.",drush-ops,drush,https://github.com/drush-ops/drush
2022-07-29,php,2278,4,Hexagonal Architecture + DDD + CQRS in PHP using Symfony 6,CodelyTV,php-ddd-example,https://github.com/CodelyTV/php-ddd-example
2022-07-29,php,1930,4,Shopware 6 is an open commerce platform based on Symfony Framework and Vue and supported by a worldwide community and more than 1.500 community extensions,shopware,platform,https://github.com/shopware/platform