date,language,stargazers,starsToday,description,owner,name,url
2024-08-08,scala,1105,0,Gluten is a middle layer responsible for offloading JVM-based SQL engines' execution to native engines.,apache,incubator-gluten,https://github.com/apache/incubator-gluten
2024-08-08,scala,4534,0,Open-source high-performance RISC-V processor,OpenXiangShan,XiangShan,https://github.com/OpenXiangShan/XiangShan
2024-08-08,scala,3860,3,Chisel: A Modern Hardware Design Language,chipsalliance,chisel,https://github.com/chipsalliance/chisel
2024-08-08,scala,738,0,An open protocol for secure data sharing,delta-io,delta-sharing,https://github.com/delta-io/delta-sharing
2024-08-08,scala,39074,13,Apache Spark - A unified analytics engine for large-scale data processing,apache,spark,https://github.com/apache/spark
2024-08-08,scala,874,0,Apache Livy is an open source REST interface for interacting with Apache Spark from anywhere.,apache,incubator-livy,https://github.com/apache/incubator-livy
2024-08-08,scala,61853,10,Source code for Twitter's Recommendation Algorithm,twitter,the-algorithm,https://github.com/twitter/the-algorithm
2024-08-08,scala,662,1,educational microarchitectures for risc-v isa,ucb-bar,riscv-sodor,https://github.com/ucb-bar/riscv-sodor
2024-08-08,scala,3311,1,"TheHive: a Scalable, Open Source and Free Security Incident Response Platform",TheHive-Project,TheHive,https://github.com/TheHive-Project/TheHive
2024-08-08,scala,1527,0,"An Agile RISC-V SoC Design Framework with in-order cores, out-of-order cores, accelerators, and more",ucb-bar,chipyard,https://github.com/ucb-bar/chipyard
2024-08-08,scala,5758,1,"The Scala 3 compiler, also known as Dotty.",scala,scala3,https://github.com/scala/scala3
2024-08-08,scala,849,0,FireSim: Fast and Effortless FPGA-accelerated Hardware Simulation with On-Prem and Cloud Flexibility,firesim,firesim,https://github.com/firesim/firesim
2024-08-08,scala,7333,3,"An open-source storage framework that enables building a Lakehouse architecture with compute engines including Spark, PrestoDB, Flink, Trino, and Hive and APIs",delta-io,delta,https://github.com/delta-io/delta
2024-08-08,scala,4781,0,"sbt, the interactive build tool",sbt,sbt,https://github.com/sbt/sbt
2024-08-08,scala,4043,2,"ZIO — A type-safe, composable library for async and concurrent programming in Scala",zio,zio,https://github.com/zio/zio
2024-08-08,scala,217,0,A Library of Chisel3 Tools for Digital Signal Processing,ucb-bar,dsptools,https://github.com/ucb-bar/dsptools
2024-08-08,scala,158,1,A Chisel RTL generator for network-on-chip interconnects,ucb-bar,constellation,https://github.com/ucb-bar/constellation