date,language,stargazers,starsToday,description,owner,name,url
2024-08-08,typescript,286111,238,"Interactive roadmaps, guides and other educational content to help developers grow in their careers.",kamranahmedse,developer-roadmap,https://github.com/kamranahmedse/developer-roadmap
2024-08-08,typescript,397980,196,freeCodeCamp.org's open-source codebase and curriculum. Learn to code for free.,freeCodeCamp,freeCodeCamp,https://github.com/freeCodeCamp/freeCodeCamp
2024-08-08,typescript,16412,143,"Enhanced ChatGPT Clone: Features OpenAI, Assistants API, Azure, Groq, GPT-4 Vision, Mistral, Bing, Anthropic, OpenRouter, Vertex AI, Gemini, AI model switching, message search, langchain, DALL-E-3, ChatGPT Plugins, OpenAI Functions, Secure Multi-User System, Presets, completely open-source for self-hosting. More features in development",danny-avila,LibreChat,https://github.com/danny-avila/LibreChat
2024-08-08,typescript,36789,334,"There can be more than Notion and Miro. AFFiNE(pronounced [ə‘fain]) is a next-gen knowledge base that brings planning, sorting and creating all together. Privacy first, open-source, customizable and ready to use.",toeverything,AFFiNE,https://github.com/toeverything/AFFiNE
2024-08-08,typescript,40724,171,"Dify is an open-source LLM app development platform. Dify's intuitive interface combines AI workflow, RAG pipeline, agent capabilities, model management, observability features and more, letting you quickly go from prototype to production.",langgenius,dify,https://github.com/langgenius/dify
2024-08-08,typescript,64528,43,"Playwright is a framework for Web Testing and Automation. It allows testing Chromium, Firefox and WebKit with a single API.",microsoft,playwright,https://github.com/microsoft/playwright
2024-08-08,typescript,23413,48,人人都能用英语,ZuodaoTech,everyone-can-use-english,https://github.com/ZuodaoTech/everyone-can-use-english
2024-08-08,typescript,1992,1,This repository is for active development of the Azure SDK for JavaScript (NodeJS & Browser). For consumers of the SDK we recommend visiting our public developer docs at https://docs.microsoft.com/javascript/azure/ or our versioned developer docs at https://azure.github.io/azure-sdk-for-js.,Azure,azure-sdk-for-js,https://github.com/Azure/azure-sdk-for-js
2024-08-08,typescript,7105,8,"Visual Development for React, Vue, Svelte, Qwik, and more",BuilderIO,builder,https://github.com/BuilderIO/builder
2024-08-08,typescript,207528,28,"This is the repo for Vue 2. For Vue 3, go to https://github.com/vuejs/core",vuejs,vue,https://github.com/vuejs/vue
2024-08-08,typescript,83668,10,"Storybook is the industry standard workshop for building, documenting, and testing UI components in isolation",storybookjs,storybook,https://github.com/storybookjs/storybook
2024-08-08,typescript,14739,7,"The world's #1 JavaScript library for rich text editing. Available for React, Vue and Angular",tinymce,tinymce,https://github.com/tinymce/tinymce
2024-08-08,typescript,754,2,AWS-native chatbot using Bedrock + Claude (+Mistral),aws-samples,bedrock-claude-chat,https://github.com/aws-samples/bedrock-claude-chat
2024-08-08,typescript,26024,32,The headless rich text editor framework for web artisans.,ueberdosis,tiptap,https://github.com/ueberdosis/tiptap
2024-08-08,typescript,11161,11,📱🚀 🧩 Cross Device & High Performance Normal Form/Dynamic(JSON Schema) Form/Form Builder -- Support React/React Native/Vue 2/Vue 3,alibaba,formily,https://github.com/alibaba/formily
2024-08-08,typescript,13562,51,"♾ Infisical is the open-source secret management platform: Sync secrets across your team/infrastructure, prevent secret leaks, and manage internal PKI",Infisical,infisical,https://github.com/Infisical/infisical
2024-08-08,typescript,43956,9,Delightful JavaScript Testing.,jestjs,jest,https://github.com/jestjs/jest