date,language,stargazers,starsToday,description,owner,name,url
2022-01-15,php,5337,72,Open Source Invoicing Solution for Individuals & Businesses,crater-invoice,crater,https://github.com/crater-invoice/crater
2022-01-15,php,4585,3,A static analysis tool for finding errors in PHP applications,vimeo,psalm,https://github.com/vimeo/psalm
2022-01-15,php,9037,3,Doctrine Object Relational Mapper (ORM),doctrine,orm,https://github.com/doctrine/orm
2022-01-15,php,1171,2,"WordPress Develop, Git-ified. Synced from git://develop.git.wordpress.org/, including branches and tags! This repository is just a mirror of the WordPress subversion repository. Please include a link to a pre-existing ticket on https://core.trac.wordpress.org/ with every pull request.",WordPress,wordpress-develop,https://github.com/WordPress/wordpress-develop
2022-01-15,php,26338,8,The Symfony PHP framework,symfony,symfony,https://github.com/symfony/symfony
2022-01-15,php,9067,5,PHP_CodeSniffer tokenizes PHP files and detects violations of a defined set of coding standards.,squizlabs,PHP_CodeSniffer,https://github.com/squizlabs/PHP_CodeSniffer
2022-01-15,php,4879,17,Instant Upgrades and Automated Refactoring of any PHP 5.3+ code,rectorphp,rector,https://github.com/rectorphp/rector
2022-01-15,php,10480,6,Supercharged Excel exports and imports in Laravel,SpartnerNL,Laravel-Excel,https://github.com/SpartnerNL/Laravel-Excel
2022-01-15,php,25880,13,The Laravel Framework.,laravel,framework,https://github.com/laravel/framework
2022-01-15,php,4216,1,"An easy to use, free and open source laravel eCommerce platform to build your online shop in no time.",bagisto,bagisto,https://github.com/bagisto/bagisto
2022-01-15,php,1589,1,Shopware 6 is an open commerce platform based on Symfony Framework and Vue and supported by a worldwide community and more then 1.500 community extensions,shopware,platform,https://github.com/shopware/platform
2022-01-15,php,4927,2,Mautic: Open Source Marketing Automation Software.,mautic,mautic,https://github.com/mautic/mautic
2022-01-15,php,13865,0,"Yii 2: The Fast, Secure and Professional PHP Framework",yiisoft,yii2,https://github.com/yiisoft/yii2
2022-01-15,php,3977,3,Moodle - the world's open source learning platform,moodle,moodle,https://github.com/moodle/moodle
2022-01-15,php,6229,1,"PrestaShop is an Open Source e-commerce platform, committed to providing the best shopping cart experience for both merchants and customers.",PrestaShop,PrestaShop,https://github.com/PrestaShop/PrestaShop
2022-01-15,php,5026,0,A DOMPDF Wrapper for Laravel,barryvdh,laravel-dompdf,https://github.com/barryvdh/laravel-dompdf
2022-01-15,php,21433,3,"Guzzle, an extensible PHP HTTP client",guzzle,guzzle,https://github.com/guzzle/guzzle
2022-01-15,php,10367,5,JSON Web Token Authentication for Laravel & Lumen,tymondesigns,jwt-auth,https://github.com/tymondesigns/jwt-auth
2022-01-15,php,13569,2,Laravel Debugbar (Integrates PHP Debug Bar),barryvdh,laravel-debugbar,https://github.com/barryvdh/laravel-debugbar
2022-01-15,php,2055,2,"Laravel Cashier provides an expressive, fluent interface to Stripe's subscription billing services.",laravel,cashier-stripe,https://github.com/laravel/cashier-stripe
2022-01-15,php,7554,16,"A customizable, open-source eCommerce platform built on WordPress. Build any commerce solution you can imagine.",woocommerce,woocommerce,https://github.com/woocommerce/woocommerce
2022-01-15,php,10092,7,Associate users with roles and permissions,spatie,laravel-permission,https://github.com/spatie/laravel-permission
2022-01-15,php,2377,1,"Open Source Data & Experience Management Platform (PIM, MDM, CDP, DAM, DXP/CMS & Digital Commerce)",pimcore,pimcore,https://github.com/pimcore/pimcore
2022-01-15,php,2091,9,Web GUI for youtube-dl,Rudloff,alltube,https://github.com/Rudloff/alltube
2022-01-15,php,15814,7,Liberating Web Analytics. Star us on Github? +1. Matomo is the leading open alternative to Google Analytics that gives you full control over your data. Matomo lets you easily collect data from websites & apps and visualise this data and extract insights. Privacy is built-in. We love Pull Requests!,matomo-org,matomo,https://github.com/matomo-org/matomo