date,language,stargazers,starsToday,description,owner,name,url
2022-12-12,kotlin,2145,50,Patches for ReVanced,revanced,revanced-patches,https://github.com/revanced/revanced-patches
2022-12-12,kotlin,303,64,A Kernel based root solution for Android GKI,tiann,KernelSU,https://github.com/tiann/KernelSU
2022-12-12,kotlin,43309,19,The Kotlin Programming Language.,JetBrains,kotlin,https://github.com/JetBrains/kotlin
2022-12-12,kotlin,28038,22,翻墙-科学上网,bannedbook,fanqiang,https://github.com/bannedbook/fanqiang
2022-12-12,kotlin,4478,25,Open-source Android/Desktop remake of Civ V,yairm210,Unciv,https://github.com/yairm210/Unciv
2022-12-12,kotlin,2100,17,An Android application for streaming music from YouTube Music.,vfsfitvnm,ViMusic,https://github.com/vfsfitvnm/ViMusic
2022-12-12,kotlin,11085,16,高效率 QQ 机器人支持库,mamoe,mirai,https://github.com/mamoe/mirai
2022-12-12,kotlin,20016,12,Free and open source manga reader for Android.,tachiyomiorg,tachiyomi,https://github.com/tachiyomiorg/tachiyomi
2022-12-12,kotlin,230,107,ChatGPT Android demonstrates OpenAI's ChatGPT on Android with Stream Chat SDK for Compose.,skydoves,chatgpt-android,https://github.com/skydoves/chatgpt-android
2022-12-12,kotlin,389,0,Minecraft utility mod coded in Kotlin,lambda-client,lambda,https://github.com/lambda-client/lambda
2022-12-12,kotlin,1019,3,Use your old Android device as an OctoPrint server.,feelfreelinux,octo4a,https://github.com/feelfreelinux/octo4a
2022-12-12,kotlin,1392,6,"This is a copy of Reeder, in order to give Android an RSS reader similar to Reeder, combines the interaction logic of Reeder with the design style of Material Design 3 (You).",Ashinch,ReadYou,https://github.com/Ashinch/ReadYou
2022-12-12,kotlin,584,0,Adds themed icons to Lawnchair.,LawnchairLauncher,lawnicons,https://github.com/LawnchairLauncher/lawnicons
2022-12-12,kotlin,18634,18,A rule-based tunnel for Android.,Kr328,ClashForAndroid,https://github.com/Kr328/ClashForAndroid
2022-12-12,kotlin,6921,11,"Kotlin Multiplatform Music Downloader, Supports Spotify / Gaana / Youtube Music / Jio Saavn / SoundCloud. NOTE: BEING REWRITTEN, SO STAY TUNED.",Shabinder,SpotiFlyer,https://github.com/Shabinder/SpotiFlyer
2022-12-12,kotlin,3970,5,provides metadata for networkIDs and chainIDs,ethereum-lists,chains,https://github.com/ethereum-lists/chains
2022-12-12,kotlin,1153,2,Mirai HTTP API (console) plugin,project-mirai,mirai-api-http,https://github.com/project-mirai/mirai-api-http
2022-12-12,kotlin,2207,1,Source extensions for the Tachiyomi app.,tachiyomiorg,tachiyomi-extensions,https://github.com/tachiyomiorg/tachiyomi-extensions
2022-12-12,kotlin,3629,5,An open-source keyboard for Android which respects your privacy. Currently in early-beta.,florisboard,florisboard,https://github.com/florisboard/florisboard
2022-12-12,kotlin,669,2,Termux add-on app for customizing the terminal font and color theme.,termux,termux-styling,https://github.com/termux/termux-styling
2022-12-12,kotlin,12065,12,"Legado 3.0 Book Reader with powerful controls & full functions阅读3.0, 阅读是一款可以自定义来源阅读网络内容的工具，为广大网络文学爱好者提供一种方便、快捷舒适的试读体验。",gedoor,legado,https://github.com/gedoor/legado
2022-12-12,kotlin,5775,0,Used to integrate Android apps with Facebook Platform.,facebook,facebook-android-sdk,https://github.com/facebook/facebook-android-sdk
2022-12-12,kotlin,2208,1,An Android app to watch anime on your phone without ads.,mukul500,AnimeXStream,https://github.com/mukul500/AnimeXStream
2022-12-12,kotlin,186,4,android app for iwara,re-ovo,iwara4a,https://github.com/re-ovo/iwara4a
2022-12-12,kotlin,5758,4,AnkiDroid: Anki flashcards on Android. Your secret trick to achieve superhuman information retention.,ankidroid,Anki-Android,https://github.com/ankidroid/Anki-Android