date,language,stargazers,starsToday,description,owner,name,url
2024-05-29,scala,5695,0,"The Scala 3 compiler, also known as Dotty.",scala,scala3,https://github.com/scala/scala3
2024-05-29,scala,14709,4,"♞ lichess.org: the forever free, adless and open source chess server ♞",lichess-org,lila,https://github.com/lichess-org/lila
2024-05-29,scala,1029,3,Gluten is a middle layer responsible for offloading JVM-based SQL engines' execution to native engines.,apache,incubator-gluten,https://github.com/apache/incubator-gluten
2024-05-29,scala,1,0,Rapture HTML library,marcus-downing,rapture-html,https://github.com/marcus-downing/rapture-html
2024-05-29,scala,235,0,"Open, Modular, Deep Learning Accelerator",apache,tvm-vta,https://github.com/apache/tvm-vta
2024-05-29,scala,6294,1,Modern Load Testing as Code,gatling,gatling,https://github.com/gatling/gatling
2024-05-29,scala,1963,1,Apache Kyuubi is a distributed and multi-tenant gateway to provide serverless SQL on data warehouses and lakehouses.,apache,kyuubi,https://github.com/apache/kyuubi
2024-05-29,scala,30,0,,broadinstitute,firecloud-orchestration,https://github.com/broadinstitute/firecloud-orchestration
2024-05-29,scala,68,0,Identus Cloud Agent,hyperledger,identus-cloud-agent,https://github.com/hyperledger/identus-cloud-agent
2024-05-29,scala,13,0,playframework 2.3.x hazelcast integration plugin,fmasion,playHazelcast,https://github.com/fmasion/playHazelcast
2024-05-29,scala,1454,0,"An Agile RISC-V SoC Design Framework with in-order cores, out-of-order cores, accelerators, and more",ucb-bar,chipyard,https://github.com/ucb-bar/chipyard
2024-05-29,scala,61526,6,Source code for Twitter's Recommendation Algorithm,twitter,the-algorithm,https://github.com/twitter/the-algorithm
2024-05-29,scala,4379,4,Open-source high-performance RISC-V processor,OpenXiangShan,XiangShan,https://github.com/OpenXiangShan/XiangShan
2024-05-29,scala,2766,0,Spark: The Definitive Guide's Code Repository,databricks,Spark-The-Definitive-Guide,https://github.com/databricks/Spark-The-Definitive-Guide
2024-05-29,scala,207,1,The batteries-included testing and formal verification library for Chisel-based RTL designs.,ucb-bar,chiseltest,https://github.com/ucb-bar/chiseltest
2024-05-29,scala,3049,2,Rocket Chip Generator,chipsalliance,rocket-chip,https://github.com/chipsalliance/rocket-chip
2024-05-29,scala,264,0,Apache Spark Connector for SQL Server and Azure SQL,microsoft,sql-spark-connector,https://github.com/microsoft/sql-spark-connector
2024-05-29,scala,4001,0,"ZIO — A type-safe, composable library for async and concurrent programming in Scala",zio,zio,https://github.com/zio/zio
2024-05-29,scala,1258,0,Cortex: a Powerful Observable Analysis and Active Response Engine,TheHive-Project,Cortex,https://github.com/TheHive-Project/Cortex
2024-05-29,scala,542,1,A template project for beginning new Chisel work,chipsalliance,chisel-template,https://github.com/chipsalliance/chisel-template
2024-05-29,scala,268,0,,rockthejvm,udemy-scala-beginners,https://github.com/rockthejvm/udemy-scala-beginners
2024-05-29,scala,9074,0,"A Git platform powered by Scala with easy installation, high extensibility & GitHub API compatibility",gitbucket,gitbucket,https://github.com/gitbucket/gitbucket
2024-05-29,scala,429,0,Server-side Web Authentication library for Java https://www.w3.org/TR/webauthn/#rp-operations,Yubico,java-webauthn-server,https://github.com/Yubico/java-webauthn-server
2024-05-29,scala,4991,0,Simple and Distributed Machine Learning,microsoft,SynapseML,https://github.com/microsoft/SynapseML
2024-05-29,scala,1621,0,SonicBOOM: The Berkeley Out-of-Order Machine,riscv-boom,riscv-boom,https://github.com/riscv-boom/riscv-boom