date,language,stargazers,starsToday,description,owner,name,url
2022-09-03,php,1192,207,Fast and beautiful Log Viewer for Laravel,opcodesio,log-viewer,https://github.com/opcodesio/log-viewer
2022-09-03,php,6595,4,PrestaShop is the universal open-source software platform to build your e-commerce solution.,PrestaShop,PrestaShop,https://github.com/PrestaShop/PrestaShop
2022-09-03,php,10218,2,"All Submissions you make to Magento Inc. (""Magento"") through GitHub are subject to the following terms and conditions: (1) You grant Magento a perpetual, worldwide, non-exclusive, no charge, royalty free, irrevocable license under your applicable copyrights and patents to reproduce, prepare derivative works of, display, publically perform, subli…",magento,magento2,https://github.com/magento/magento2
2022-09-03,php,15903,6,A simple PHP API extension for DateTime.,briannesbitt,Carbon,https://github.com/briannesbitt/Carbon
2022-09-03,php,13985,2,"Yii 2: The Fast, Secure and Professional PHP Framework",yiisoft,yii2,https://github.com/yiisoft/yii2
2022-09-03,php,4599,5,"The most advanced frontend drag & drop page builder. Create high-end, pixel perfect websites at record speeds. Any theme, any page, any design.",elementor,elementor,https://github.com/elementor/elementor
2022-09-03,php,1591,1,"WordPress Develop, Git-ified. Synced from git://develop.git.wordpress.org/, including branches and tags! This repository is just a mirror of the WordPress subversion repository. Please include a link to a pre-existing ticket on https://core.trac.wordpress.org/ with every pull request.",WordPress,wordpress-develop,https://github.com/WordPress/wordpress-develop
2022-09-03,php,16576,3,"WordPress, Git-ified. This repository is just a mirror of the WordPress subversion repository. Please do not send pull requests. Submit pull requests to https://github.com/WordPress/wordpress-develop and patches to https://core.trac.wordpress.org/ instead.",WordPress,WordPress,https://github.com/WordPress/WordPress
2022-09-03,php,7184,3,A flexible and feature-complete Redis client for PHP.,predis,predis,https://github.com/predis/predis
2022-09-03,php,27765,10,The Laravel Framework.,laravel,framework,https://github.com/laravel/framework
2022-09-03,php,10616,3,JSON Web Token Authentication for Laravel & Lumen,tymondesigns,jwt-auth,https://github.com/tymondesigns/jwt-auth
2022-09-03,php,9633,3,PHP_CodeSniffer tokenizes PHP files and detects violations of a defined set of coding standards.,squizlabs,PHP_CodeSniffer,https://github.com/squizlabs/PHP_CodeSniffer
2022-09-03,php,2834,0,Community-based GPL-licensed network monitoring system,librenms,librenms,https://github.com/librenms/librenms
2022-09-03,php,4501,4,Log activity inside your Laravel app,spatie,laravel-activitylog,https://github.com/spatie/laravel-activitylog
2022-09-03,php,4289,3,Moodle - the world's open source learning platform,moodle,moodle,https://github.com/moodle/moodle
2022-09-03,php,9368,2,A REPL for PHP,bobthecow,psysh,https://github.com/bobthecow/psysh
2022-09-03,php,83,7,Dynamically create and destroy servers,spatie,laravel-dynamic-servers,https://github.com/spatie/laravel-dynamic-servers
2022-09-03,php,26581,7,Faker is a PHP library that generates fake data for you,fzaninotto,Faker,https://github.com/fzaninotto/Faker
2022-09-03,php,11362,7,A tool to automatically fix PHP Coding Standards issues,FriendsOfPHP,PHP-CS-Fixer,https://github.com/FriendsOfPHP/PHP-CS-Fixer
2022-09-03,php,5443,1,A DOMPDF Wrapper for Laravel,barryvdh,laravel-dompdf,https://github.com/barryvdh/laravel-dompdf
2022-09-03,php,6179,3,A MongoDB based Eloquent model and Query builder for Laravel (Moloquent),jenssegers,laravel-mongodb,https://github.com/jenssegers/laravel-mongodb
2022-09-03,php,3354,2,Easily build Eloquent queries from API requests,spatie,laravel-query-builder,https://github.com/spatie/laravel-query-builder
2022-09-03,php,9902,5,A platform to create documentation/wiki content built with PHP & Laravel,BookStackApp,BookStack,https://github.com/BookStackApp/BookStack
2022-09-03,php,2465,5,"Real-time monitoring of IT components and services, such as networks, servers, VMs, applications and the cloud.",zabbix,zabbix,https://github.com/zabbix/zabbix
2022-09-03,php,11804,4,A PHP library for generating universally unique identifiers (UUIDs).,ramsey,uuid,https://github.com/ramsey/uuid