date,language,stargazers,starsToday,description,owner,name,url
2025-01-01,astro,2737,3,"A minimal, accessible and SEO-friendly Astro blog theme",satnaing,astro-paper,https://github.com/satnaing/astro-paper
2025-01-01,astro,3728,5,⭕️ AstroWind: A free template using Astro 5 and Tailwind CSS. Astro starter theme.,onwidget,astrowind,https://github.com/onwidget/astrowind
2025-01-01,astro,1008,0,"Astrofy is a free and open-source template for your Personal Portfolio Website built with Astro and TailwindCSS. Create in minutes a website with Blog, CV, Project Section, Store and RSS Feed.",manuelernestog,astrofy,https://github.com/manuelernestog/astrofy
2025-01-01,astro,44191,4,AdminLTE - Free admin dashboard template based on Bootstrap 5,ColorlibHQ,AdminLTE,https://github.com/ColorlibHQ/AdminLTE
2025-01-01,astro,287,1,Astro integration for Pagefind static site search.,shishkin,astro-pagefind,https://github.com/shishkin/astro-pagefind
2025-01-01,astro,716,1,"📚 Openblog is an elegant, simple, and user-friendly blog. Focused on accessibility, SEO and performance.",danielcgilibert,blog-template,https://github.com/danielcgilibert/blog-template
2025-01-01,astro,1715,0,list of free stuff for developer,hilmanski,freeStuffDev,https://github.com/hilmanski/freeStuffDev
2025-01-01,astro,1644,4,✨A static blog template built with Astro.,saicaca,fuwari,https://github.com/saicaca/fuwari
2025-01-01,astro,627,2,"Astroplate is a free starter template built with Astro, TailwindCSS & TypeScript providing everything you need to jumpstart your Astro project. Get started with Astroplate and save yourself hours of work!",zeon-studio,astroplate,https://github.com/zeon-studio/astroplate
2025-01-01,astro,1138,2,Ejemplo de porfolio para programadores y desarrolladores,midudev,porfolio.dev,https://github.com/midudev/porfolio.dev
2025-01-01,astro,1005,3,A simple Astro theme. Use it to create your blog or website.,chrismwilliams,astro-theme-cactus,https://github.com/chrismwilliams/astro-theme-cactus