date,language,stargazers,starsToday,description,owner,name,url
2024-04-06,php,20605,11,"Personal CRM. Remember everything about your friends, family and business relationships.",monicahq,monica,https://github.com/monicahq/monica
2024-04-06,php,53228,29,"SecLists is the security tester's companion. It's a collection of multiple types of lists used during security assessments, collected in one place. List types include usernames, passwords, URLs, sensitive data patterns, fuzzing payloads, web shells, and many more.",danielmiessler,SecLists,https://github.com/danielmiessler/SecLists
2024-04-06,php,9605,7,A free open source IT asset/license management system,snipe,snipe-it,https://github.com/snipe/snipe-it
2024-04-06,php,13626,20,"A collection of beautiful full-stack components for Laravel. The perfect starting point for your next app. Using Livewire, Alpine.js and Tailwind CSS.",filamentphp,filament,https://github.com/filamentphp/filament
2024-04-06,php,29240,2,The Symfony PHP framework,symfony,symfony,https://github.com/symfony/symfony
2024-04-06,php,11226,3,"Prior to making any Submission(s), you must sign an Adobe Contributor License Agreement, available here at: https://opensource.adobe.com/cla.html. All Submissions you make to Adobe Inc. and its affiliates, assigns and subsidiaries (collectively “Adobe”) are subject to the terms of the Adobe Contributor License Agreement.",magento,magento2,https://github.com/magento/magento2
2024-04-06,php,76634,8,"Laravel is a web application framework with expressive, elegant syntax. We’ve already laid the foundation for your next big idea — freeing you to create without sweating the small things.",laravel,laravel,https://github.com/laravel/laravel
2024-04-06,php,1501,10,百度网盘分享链接分析渲染列表辅助下载开源程序,codehub666,94list,https://github.com/codehub666/94list
2024-04-06,php,9107,0,A PHP client library for accessing Google APIs,googleapis,google-api-php-client,https://github.com/googleapis/google-api-php-client
2024-04-06,php,19530,4,The PHP Unit Testing framework.,sebastianbergmann,phpunit,https://github.com/sebastianbergmann/phpunit
2024-04-06,php,28197,1,Dependency Manager for PHP,composer,composer,https://github.com/composer/composer
2024-04-06,php,22968,4,"Guzzle, an extensible PHP HTTP client",guzzle,guzzle,https://github.com/guzzle/guzzle
2024-04-06,php,10233,4,HTML to PDF converter for PHP,dompdf,dompdf,https://github.com/dompdf/dompdf
2024-04-06,php,8178,3,Instant Upgrades and Automated Refactoring of any PHP 5.3+ code,rectorphp,rector,https://github.com/rectorphp/rector
2024-04-06,php,7688,2,"Invoices, Expenses and Tasks built with Laravel, Flutter and React",invoiceninja,invoiceninja,https://github.com/invoiceninja/invoiceninja
2024-04-06,php,31402,13,The Laravel Framework.,laravel,framework,https://github.com/laravel/framework
2024-04-06,php,21614,9,A full-stack framework for Laravel that takes the pain out of building dynamic UIs.,livewire,livewire,https://github.com/livewire/livewire
2024-04-06,php,8007,1,"Twig, the flexible, fast, and secure template language for PHP",twigphp,Twig,https://github.com/twigphp/Twig
2024-04-06,php,2571,1,Shopware 6 is an open commerce platform based on Symfony Framework and Vue and supported by a worldwide community and more than 1.500 community extensions,shopware,shopware,https://github.com/shopware/shopware
2024-04-06,php,5481,2,The Roundcube Webmail suite,roundcube,roundcubemail,https://github.com/roundcube/roundcubemail
2024-04-06,php,20775,0,"Sends your logs to files, sockets, inboxes, databases and various web services",Seldaek,monolog,https://github.com/Seldaek/monolog
2024-04-06,php,16045,4,Debugbar for Laravel (Integrates PHP Debug Bar),barryvdh,laravel-debugbar,https://github.com/barryvdh/laravel-debugbar
2024-04-06,php,5091,2,Open Source PHP Framework (originally from EllisLab),codeigniter4,CodeIgniter4,https://github.com/codeigniter4/CodeIgniter4
2024-04-06,php,1097,2,Powerful data objects for Laravel,spatie,laravel-data,https://github.com/spatie/laravel-data
2024-04-06,php,5963,6,"Pterodactyl® is a free, open-source game server management panel built with PHP, React, and Go. Designed with security in mind, Pterodactyl runs all game servers in isolated Docker containers while exposing a beautiful and intuitive UI to end users.",pterodactyl,panel,https://github.com/pterodactyl/panel