date,language,stargazers,starsToday,description,owner,name,url
2023-11-13,python,1640,311,"HAAS = Hierarchical Autonomous Agent Swarm - ""Resistance is futile!""",daveshap,OpenAI_Agent_Swarm,https://github.com/daveshap/OpenAI_Agent_Swarm
2023-11-13,python,1405,258,Browse the web with GPT-4V and Vimium,ishan0102,vimGPT,https://github.com/ishan0102/vimGPT
2023-11-13,python,1734,66,Robust recipes for to align language models with human and AI preferences,huggingface,alignment-handbook,https://github.com/huggingface/alignment-handbook
2023-11-13,python,41280,1312,"Interact with your documents using the power of GPT, 100% privately, no data leaks",imartinez,privateGPT,https://github.com/imartinez/privateGPT
2023-11-13,python,32584,211,"OpenAI's Code Interpreter in your terminal, running locally",KillianLucas,open-interpreter,https://github.com/KillianLucas/open-interpreter
2023-11-13,python,659,110,EmotiVoice ğŸ˜Š: a Multi-Voice and Prompt-Controlled TTS Engine,netease-youdao,EmotiVoice,https://github.com/netease-youdao/EmotiVoice
2023-11-13,python,172789,44,All Algorithms implemented in Python,TheAlgorithms,Python,https://github.com/TheAlgorithms/Python
2023-11-13,python,186407,114,"A curated list of awesome Python frameworks, libraries, software and resources",vinta,awesome-python,https://github.com/vinta/awesome-python
2023-11-13,python,9301,56,Experience macOS just like before,dortania,OpenCore-Legacy-Patcher,https://github.com/dortania/OpenCore-Legacy-Patcher
2023-11-13,python,13118,56,"GUI for ChatGPT API and many LLMs. Supports agents, file-based QA, GPT finetuning and query with web search. All with a neat UI.",GaiZhenbiao,ChuanhuChatGPT,https://github.com/GaiZhenbiao/ChuanhuChatGPT
2023-11-13,python,5679,12,Create Reddit Videos with justâœ¨ one command âœ¨,elebumm,RedditVideoMakerBot,https://github.com/elebumm/RedditVideoMakerBot
2023-11-13,python,487,15,æŠ¢èŒ…å°2023æœ€æ–°ï¼Œäº¬ä¸œæŠ¢èŒ…å°ï¼Œæ·˜å®æŠ¢èŒ…å° QmaoTai,chao325,QmaoTai,https://github.com/chao325/QmaoTai
2023-11-13,python,43912,46,openpilot is an open source driver assistance system. openpilot performs the functions of Automated Lane Centering and Adaptive Cruise Control for 250+ supported car makes and models.,commaai,openpilot,https://github.com/commaai/openpilot
2023-11-13,python,234998,108,Learn how to design large-scale systems. Prep for the system design interview. Includes Anki flashcards.,donnemartin,system-design-primer,https://github.com/donnemartin/system-design-primer
2023-11-13,python,17162,56,"Wechat robot based on ChatGPT, which using OpenAI api and itchat library. ä½¿ç”¨å¤§æ¨¡å‹æ­å»ºå¾®ä¿¡èŠå¤©æœºå™¨äººï¼ŒåŸºäº GPT3.5/GPT4.0/Claude/æ–‡å¿ƒä¸€è¨€/è®¯é£æ˜Ÿç«/LinkAIï¼Œæ”¯æŒä¸ªäººå¾®ä¿¡ã€å…¬ä¼—å·ã€ä¼ä¸šå¾®ä¿¡éƒ¨ç½²ï¼Œèƒ½å¤„ç†æ–‡æœ¬ã€è¯­éŸ³å’Œå›¾ç‰‡ï¼Œè®¿é—®æ“ä½œç³»ç»Ÿå’Œäº’è”ç½‘ï¼Œæ”¯æŒåŸºäºçŸ¥è¯†åº“å®šåˆ¶ä¸“å±æœºå™¨äººã€‚",zhayujie,chatgpt-on-wechat,https://github.com/zhayujie/chatgpt-on-wechat
2023-11-13,python,4863,56,An Autonomous LLM Agent for Complex Task Solving,OpenBMB,XAgent,https://github.com/OpenBMB/XAgent
2023-11-13,python,3997,14,Proxy server to bypass Cloudflare protection,FlareSolverr,FlareSolverr,https://github.com/FlareSolverr/FlareSolverr
2023-11-13,python,14759,235,The official Python library for the OpenAI API,openai,openai-python,https://github.com/openai/openai-python
2023-11-13,python,14828,46,The most powerful and modular stable diffusion GUI with a graph/nodes interface.,comfyanonymous,ComfyUI,https://github.com/comfyanonymous/ComfyUI
2023-11-13,python,3991,12,Get a ChatGPT plugin up and running in under 5 minutes!,openai,plugins-quickstart,https://github.com/openai/plugins-quickstart
2023-11-13,python,1014,123,Must-have resource for anyone who wants to experiment with and build on the OpenAI Vision API ğŸ”¥,roboflow,awesome-openai-vision-api-experiments,https://github.com/roboflow/awesome-openai-vision-api-experiments
2023-11-13,python,2195,19,Download all your kindle books script.,yihong0618,Kindle_download_helper,https://github.com/yihong0618/Kindle_download_helper
2023-11-13,python,35,1,,shiqiangw,iclr2024-scores,https://github.com/shiqiangw/iclr2024-scores
2023-11-13,python,757,76,YORG Open Source Version,YORG-AI,Open-Assistant,https://github.com/YORG-AI/Open-Assistant
2023-11-13,python,23363,20,"Free, open source crypto trading bot",freqtrade,freqtrade,https://github.com/freqtrade/freqtrade