date,language,stargazers,starsToday,description,owner,name,url
2022-08-30,javascript,2625,1075,"Upscayl - Free and Open Source AI Image Upscaler for Linux, MacOS and Windows built with Linux-First philosophy.",upscayl,upscayl,https://github.com/upscayl/upscayl
2022-08-30,javascript,100361,147,A list of Free Software network services and web applications which can be hosted on your own servers,awesome-selfhosted,awesome-selfhosted,https://github.com/awesome-selfhosted/awesome-selfhosted
2022-08-30,javascript,28588,30,Bypass Paywalls web browser extension for Chrome and Firefox.,iamadamdev,bypass-paywalls-chrome,https://github.com/iamadamdev/bypass-paywalls-chrome
2022-08-30,javascript,149801,150,Algorithms and data structures implemented in JavaScript with explanations and links to further readings,trekhleb,javascript-algorithms,https://github.com/trekhleb/javascript-algorithms
2022-08-30,javascript,27074,38,"30 days of JavaScript programming challenge is a step-by-step guide to learn JavaScript programming language in 30 days. This challenge may take more than 100 days, please just follow your own pace.",Asabeneh,30-Days-Of-JavaScript,https://github.com/Asabeneh/30-Days-Of-JavaScript
2022-08-30,javascript,21034,16,Everything is RSSible,DIYgod,RSSHub,https://github.com/DIYgod/RSSHub
2022-08-30,javascript,103,18,Build and Deploy a Modern YouTube Clone Application in React JS with Material UI 5,adrianhajdin,project_youtube_clone,https://github.com/adrianhajdin/project_youtube_clone
2022-08-30,javascript,54884,23,Collection of publicly available IPTV channels from all over the world,iptv-org,iptv,https://github.com/iptv-org/iptv
2022-08-30,javascript,8436,1,"Zigbee  to MQTT bridge , get rid of your proprietary Zigbee bridges",Koenkk,zigbee2mqtt,https://github.com/Koenkk/zigbee2mqtt
2022-08-30,javascript,287,15,A highly customizable homepage (or startpage / application dashboard) with Docker and service API integrations.,benphelps,homepage,https://github.com/benphelps/homepage
2022-08-30,javascript,3767,6,"A beautiful, simple, clean, and responsive Jekyll theme for academics",alshedivat,al-folio,https://github.com/alshedivat/al-folio
2022-08-30,javascript,8872,20,"Docker container for managing Nginx proxy hosts with a simple, powerful interface",NginxProxyManager,nginx-proxy-manager,https://github.com/NginxProxyManager/nginx-proxy-manager
2022-08-30,javascript,3088,4,"Create Minecraft bots with a powerful, stable, and high level JavaScript API.",PrismarineJS,mineflayer,https://github.com/PrismarineJS/mineflayer
2022-08-30,javascript,4880,11,一款 Material Design 风格的 Hexo 主题 / An elegant Material-Design theme for Hexo,fluid-dev,hexo-theme-fluid,https://github.com/fluid-dev/hexo-theme-fluid
2022-08-30,javascript,24355,23,"Secure Backend Server for Web, Mobile & Flutter Developers  AKA the 100% open-source Firebase alternative.",appwrite,appwrite,https://github.com/appwrite/appwrite
2022-08-30,javascript,4740,12,A new cross-platform Apple Music experience based on Electron and Vue.js written from scratch with performance in mind.,ciderapp,Cider,https://github.com/ciderapp/Cider
2022-08-30,javascript,7352,8,"Web app for browsing, reading and downloading eBooks stored in a Calibre database",janeczku,calibre-web,https://github.com/janeczku/calibre-web
2022-08-30,javascript,1699,1,"Starter files, final projects and FAQ for my Complete Node.js Bootcamp",jonasschmedtmann,complete-node-bootcamp,https://github.com/jonasschmedtmann/complete-node-bootcamp
2022-08-30,javascript,49,16,微信公众号推送-给女朋友的浪漫,wangxinleo,wechat-public-account-push,https://github.com/wangxinleo/wechat-public-account-push
2022-08-30,javascript,56572,45,"24 Lessons, 12 Weeks, Get Started as a Web Developer",microsoft,Web-Dev-For-Beginners,https://github.com/microsoft/Web-Dev-For-Beginners
2022-08-30,javascript,4477,11,"A boilerplate for building production-ready RESTful APIs using Node.js, Express, and Mongoose",hagopj13,node-express-boilerplate,https://github.com/hagopj13/node-express-boilerplate
2022-08-30,javascript,233,1,A whatsapp Multi Device bot based on baileys,lyfe00011,whatsapp-bot-md,https://github.com/lyfe00011/whatsapp-bot-md
2022-08-30,javascript,15837,34,"30 Days of React challenge is a step by step guide to learn React in 30 days. It requires HTML, CSS, and JavaScript knowledge. You should be comfortable with JavaScript before you start to React. If you are not comfortable with JavaScript check out 30DaysOfJavaScript. This is a continuation of 30 Days Of JS. This challenge may take more than 100…",Asabeneh,30-Days-Of-React,https://github.com/Asabeneh/30-Days-Of-React
2022-08-30,javascript,721,6,The CLI for Cloudflare Workers®,cloudflare,wrangler2,https://github.com/cloudflare/wrangler2
2022-08-30,javascript,8452,41,Clash For Windows 汉化补丁和汉化脚本,BoyceLig,Clash_Chinese_Patch,https://github.com/BoyceLig/Clash_Chinese_Patch