date,language,stargazers,starsToday,description,owner,name,url
2023-04-04,css,2262,251,免费 Prompt Engineering 教程,thinkingjimmy,Learning-Prompt,https://github.com/thinkingjimmy/Learning-Prompt
2023-04-04,css,53,10,"Build a stunning portfolio website with Next.js, Tailwind CSS and Framer-motion. If you want to learn to create this you can follow the tutorial link given in the Read me file.",codebucks27,Next.js-Developer-Portfolio-Starter-Code,https://github.com/codebucks27/Next.js-Developer-Portfolio-Starter-Code
2023-04-04,css,391,6,Documentation for GX mods,opera-gaming,gxmods,https://github.com/opera-gaming/gxmods
2023-04-04,css,12,2,,bobangajicsm,iphone-3d-website-starter,https://github.com/bobangajicsm/iphone-3d-website-starter
2023-04-04,css,4035,1,"Starter files, final projects and FAQ for my Advanced CSS course",jonasschmedtmann,advanced-css-course,https://github.com/jonasschmedtmann/advanced-css-course
2023-04-04,css,4090,6,,safak,youtube,https://github.com/safak/youtube
2023-04-04,css,27436,80,"50+ mini web projects using HTML, CSS & JS",bradtraversy,50projects50days,https://github.com/bradtraversy/50projects50days
2023-04-04,css,128,3,My dotfiles,ART3MISTICAL,dotfiles,https://github.com/ART3MISTICAL/dotfiles
2023-04-04,css,1840,0,Dark Gtk3.20+ theme created using the awesome Nord color pallete.,EliverLara,Nordic,https://github.com/EliverLara/Nordic
2023-04-04,css,313,6,,john-smilga,react-course-v3,https://github.com/john-smilga/react-course-v3
2023-04-04,css,3523,14,,john-smilga,react-projects,https://github.com/john-smilga/react-projects
2023-04-04,css,160,5,"Website ini merupakan hasil slicing dari Figma ke responsive website menggunakan HTML, CSS, dan JavaScript",fajarnurwahid,adminhub,https://github.com/fajarnurwahid/adminhub
2023-04-04,css,468,2,Personal theme for Obsidian,AnubisNekhet,AnuPpuccin,https://github.com/AnubisNekhet/AnuPpuccin
2023-04-04,css,4670,8,Accurately Locate Smartphones using Social Engineering,thewhiteh4t,seeker,https://github.com/thewhiteh4t/seeker
2023-04-04,css,42678,28,"Iconic font aggregator, collection, & patcher. 3,600+ icons, 50+ patched fonts: Hack, Source Code Pro, more. Glyph collections: Font Awesome, Material Design Icons, Octicons, & more",ryanoasis,nerd-fonts,https://github.com/ryanoasis/nerd-fonts
2023-04-04,css,2377,2,A GNOME theme for Firefox,rafaelmardojai,firefox-gnome-theme,https://github.com/rafaelmardojai/firefox-gnome-theme
2023-04-04,css,37,0,web design master project for beginner to advanced,emetdas,Youtube-code,https://github.com/emetdas/Youtube-code
2023-04-04,css,2711,6,Master the creation of Modern UX/UI Websites,adrianhajdin,project_modern_ui_ux_gpt3,https://github.com/adrianhajdin/project_modern_ui_ux_gpt3
2023-04-04,css,16067,4,Short CSS code snippets for all your development needs,30-seconds,30-seconds-of-css,https://github.com/30-seconds/30-seconds-of-css
2023-04-04,css,5197,11,"经济学人(含音频)、纽约客、卫报、连线、大西洋月刊等英语杂志免费下载,支持epub、mobi、pdf格式, 每周更新",hehonghui,awesome-english-ebooks,https://github.com/hehonghui/awesome-english-ebooks
2023-04-04,css,109,49,闻达：一个大型语言模型调用平台。目前支持chatGLM-6B、chatRWKV、chatYuan和chatGLM-6B模型下的chatPDF（自建知识库查找）,l15y,wenda,https://github.com/l15y/wenda
2023-04-04,css,77470,19,A cross-browser library of CSS animations. As easy to use as an easy thing.,animate-css,animate.css,https://github.com/animate-css/animate.css
2023-04-04,css,66,0,Discord themes,monstrousdev,themes,https://github.com/monstrousdev/themes
2023-04-04,css,4914,1,the CS missing semester Chinese version,missing-semester-cn,missing-semester-cn.github.io,https://github.com/missing-semester-cn/missing-semester-cn.github.io
2023-04-04,css,3762,4,The Most Complete React UI Component Library,primefaces,primereact,https://github.com/primefaces/primereact