date,language,stargazers,starsToday,description,owner,name,url
2023-04-25,php,2404,9,OpenAI PHP is a supercharged community-maintained PHP API client that allows you to interact with OpenAI API.,openai-php,client,https://github.com/openai-php/client
2023-04-25,php,4661,14,独角数卡(自动售货系统)-开源站长自动化售货解决方案、高效、稳定、快速！,assimon,dujiaoka,https://github.com/assimon/dujiaoka
2023-04-25,php,18959,7,"Personal CRM. Remember everything about your friends, family and business relationships.",monicahq,monica,https://github.com/monicahq/monica
2023-04-25,php,1268,11,个人发卡源码，发卡系统，二次元发卡系统，二次元发卡源码，发卡程序，动漫发卡，PHP发卡源码，异次元发卡,lizhipay,acg-faka,https://github.com/lizhipay/acg-faka
2023-04-25,php,1755,4,Nextcloud AIO stands for Nextcloud All-in-One and provides easy deployment and maintenance with most features included in this one Nextcloud instance.,nextcloud,all-in-one,https://github.com/nextcloud/all-in-one
2023-04-25,php,19056,3,The PHP Unit Testing framework.,sebastianbergmann,phpunit,https://github.com/sebastianbergmann/phpunit
2023-04-25,php,6534,4,A web interface for MySQL and MariaDB,phpmyadmin,phpmyadmin,https://github.com/phpmyadmin/phpmyadmin
2023-04-25,php,2766,6,A multiple proxy protocol manage panel application interface,v2board,v2board,https://github.com/v2board/v2board
2023-04-25,php,1869,0,"WordPress Develop, Git-ified. Synced from git://develop.git.wordpress.org/, including branches and tags! This repository is just a mirror of the WordPress subversion repository. Please include a link to a pre-existing ticket on https://core.trac.wordpress.org/ with every pull request.",WordPress,wordpress-develop,https://github.com/WordPress/wordpress-develop
2023-04-25,php,4902,9,"Pterodactyl® is a free, open-source game server management panel built with PHP, React, and Go. Designed with security in mind, Pterodactyl runs all game servers in isolated Docker containers while exposing a beautiful and intuitive UI to end users.",pterodactyl,panel,https://github.com/pterodactyl/panel
2023-04-25,php,28242,7,The Symfony PHP framework,symfony,symfony,https://github.com/symfony/symfony
2023-04-25,php,5191,2,A static analysis tool for finding errors in PHP applications,vimeo,psalm,https://github.com/vimeo/psalm
2023-04-25,php,2809,6,一个好玩的Web安全-漏洞测试平台,zhuifengshaonianhanlu,pikachu,https://github.com/zhuifengshaonianhanlu/pikachu
2023-04-25,php,46161,27,"SecLists is the security tester's companion. It's a collection of multiple types of lists used during security assessments, collected in one place. List types include usernames, passwords, URLs, sensitive data patterns, fuzzing payloads, web shells, and many more.",danielmiessler,SecLists,https://github.com/danielmiessler/SecLists
2023-04-25,php,11391,6,A platform to create documentation/wiki content built with PHP & Laravel,BookStackApp,BookStack,https://github.com/BookStackApp/BookStack
2023-04-25,php,3009,5,Freenom 域名自动续期。Freenom domain name renews automatically.,luolongfei,freenom,https://github.com/luolongfei/freenom
2023-04-25,php,22121,7,"Nextcloud server, a safe home for all your data",nextcloud,server,https://github.com/nextcloud/server
2023-04-25,php,4669,2,Moodle - the world's open source learning platform,moodle,moodle,https://github.com/moodle/moodle
2023-04-25,php,12117,0,A pure PHP library for reading and writing spreadsheet files,PHPOffice,PhpSpreadsheet,https://github.com/PHPOffice/PhpSpreadsheet
2023-04-25,php,4313,7,A tool to get the download link of the Baidu netdisk / 一个获取百度网盘分享链接下载地址的工具,yuantuo666,baiduwp-php,https://github.com/yuantuo666/baiduwp-php
2023-04-25,php,7757,3,"Twig, the flexible, fast, and secure template language for PHP",twigphp,Twig,https://github.com/twigphp/Twig
2023-04-25,php,27574,3,Dependency Manager for PHP,composer,composer,https://github.com/composer/composer
2023-04-25,php,11174,1,Associate users with roles and permissions,spatie,laravel-permission,https://github.com/spatie/laravel-permission
2023-04-25,php,5973,8,"A free, self-hostable aggregator…",FreshRSS,FreshRSS,https://github.com/FreshRSS/FreshRSS
2023-04-25,php,14613,2,A personal music streaming server that works.,koel,koel,https://github.com/koel/koel