date,language,stargazers,starsToday,description,owner,name,url
2022-05-17,markdown,811,8,Protect your data against global mass surveillance programs.,privacyguides,privacyguides.org,https://github.com/privacyguides/privacyguides.org
2022-05-17,markdown,13333,4,This maintains proposals for changes and user-visible enhancements to the Swift Programming Language.,apple,swift-evolution,https://github.com/apple/swift-evolution
2022-05-17,markdown,2685,6,Ethereum.org is a primary online resource for the Ethereum community.,ethereum,ethereum-org-website,https://github.com/ethereum/ethereum-org-website
2022-05-17,markdown,106176,56,"刷算法全靠套路，认准 labuladong 就够了！English version supported! Crack LeetCode, not only how, but also why.",labuladong,fucking-algorithm,https://github.com/labuladong/fucking-algorithm
2022-05-17,markdown,5454,9,The content behind MDN Web Docs,mdn,content,https://github.com/mdn/content
2022-05-17,markdown,4454,8,Official Discord API Documentation,discord,discord-api-docs,https://github.com/discord/discord-api-docs
2022-05-17,markdown,1502,1,Airbnb's Swift Style Guide.,airbnb,swift,https://github.com/airbnb/swift
2022-05-17,markdown,4761,5,Improve your README.md profile with these amazing badges.,alexandresanlim,Badges4-README.md-Profile,https://github.com/alexandresanlim/Badges4-README.md-Profile
2022-05-17,markdown,38660,11,Collaborative cheatsheets for console commands,tldr-pages,tldr,https://github.com/tldr-pages/tldr
2022-05-17,markdown,1562,0,Collection of Kaggle Solutions and Ideas,faridrashidi,kaggle-solutions,https://github.com/faridrashidi/kaggle-solutions
2022-05-17,markdown,59,0,Solutions (that we managed to find) for the 2021 PicoCTF,vivian-dai,PicoCTF2021-Writeup,https://github.com/vivian-dai/PicoCTF2021-Writeup
2022-05-17,markdown,1209,4,A Collection of GitHub Profiles with awesome readme,coderjojo,creative-profile-readme,https://github.com/coderjojo/creative-profile-readme
2022-05-17,markdown,333,0,home of the osu! wiki,ppy,osu-wiki,https://github.com/ppy/osu-wiki
2022-05-17,markdown,1592,2,BOLT: Basis of Lightning Technology (Lightning Network Specifications),lightning,bolts,https://github.com/lightning/bolts
2022-05-17,markdown,3507,2,Solutions to Introduction to Algorithms Third Edition,walkccc,CLRS,https://github.com/walkccc/CLRS