date,language,stargazers,starsToday,description,owner,name,url
2024-07-23,astro,43780,1,AdminLTE - Free admin dashboard template based on Bootstrap 5,ColorlibHQ,AdminLTE,https://github.com/ColorlibHQ/AdminLTE
2024-07-23,astro,2878,9,⭕️ AstroWind: A free template using Astro 4.0 and Tailwind CSS. Astro starter theme.,onwidget,astrowind,https://github.com/onwidget/astrowind
2024-07-23,astro,824,0,"Astrofy is a free and open-source template for your Personal Portfolio Website built with Astro and TailwindCSS. Create in minutes a website with Blog, CV, Project Section, Store and RSS Feed.",manuelernestog,astrofy,https://github.com/manuelernestog/astrofy
2024-07-23,astro,2901,3,"An opinionated, actionable guide for software engineering interviews.",nas5w,interview-guide,https://github.com/nas5w/interview-guide
2024-07-23,astro,6442,10,🦄 A curated list of privacy & security-focused software and services,Lissy93,awesome-privacy,https://github.com/Lissy93/awesome-privacy
2024-07-23,astro,514,1,"Open-source admin dashboard template built with Astro, Flowbite, and Tailwind CSS",themesberg,flowbite-astro-admin-dashboard,https://github.com/themesberg/flowbite-astro-admin-dashboard
2024-07-23,astro,2185,3,"A minimal, accessible and SEO-friendly Astro blog theme",satnaing,astro-paper,https://github.com/satnaing/astro-paper
2024-07-23,astro,464,1,"📚 Openblog is an elegant, simple, and user-friendly blog. Focused on accessibility, SEO and performance.",danielcgilibert,blog-template,https://github.com/danielcgilibert/blog-template
2024-07-23,astro,482,0,"Astroplate is a free starter template built with Astro, TailwindCSS & TypeScript providing everything you need to jumpstart your Astro project. Get started with Astroplate and save yourself hours of work!",zeon-studio,astroplate,https://github.com/zeon-studio/astroplate
2024-07-23,astro,1326,2,Web oficial de La Velada IV de Ibai Llanos,midudev,la-velada-web-oficial,https://github.com/midudev/la-velada-web-oficial
2024-07-23,astro,929,3,Ejemplo de porfolio para programadores y desarrolladores,midudev,porfolio.dev,https://github.com/midudev/porfolio.dev