date,language,stargazers,starsToday,description,owner,name,url
2023-05-24,svelte,20758,43,"The most popular, free and open-source Tailwind CSS component library",saadeghi,daisyui,https://github.com/saadeghi/daisyui
2023-05-24,svelte,2569,16,The UI toolkit for Svelte and Tailwind.,skeletonlabs,skeleton,https://github.com/skeletonlabs/skeleton
2023-05-24,svelte,42,3,"This is a Sveltekit auth starter project. It utilizes Lucia for authentication, Skeleton for ui elements, Prisma for database connectivity and type safety, Lucide for icons, inlang for translation, Zod and Superforms to handle forms and validation and Sveltekit.",delay,sveltekit-auth-starter,https://github.com/delay/sveltekit-auth-starter
2023-05-24,svelte,42,0,Website of the JSCraftCamp in Munich,jscraftcamp,website,https://github.com/jscraftcamp/website
2023-05-24,svelte,2996,3,Svelte Material UI Components,hperrin,svelte-material-ui,https://github.com/hperrin/svelte-material-ui
2023-05-24,svelte,613,0,"Primo is a modern monolithic CMS that makes it a blast to build pages, update content, and edit code a block at a time.",primocms,primo,https://github.com/primocms/primo
2023-05-24,svelte,0,0,Hurdle - a Wordle recreation for Cal State Fullerton's CPSC 121L Course,AmaJC,hurdle-frontend,https://github.com/AmaJC/hurdle-frontend
2023-05-24,svelte,925,5,Official Svelte components built for Flowbite and Tailwind CSS,themesberg,flowbite-svelte,https://github.com/themesberg/flowbite-svelte
2023-05-24,svelte,1967,2,"Isolate vocals, drums, bass, and other instrumental stems from any song",stemrollerapp,stemroller,https://github.com/stemrollerapp/stemroller
2023-05-24,svelte,582,3,ChatGPT web interface using the OpenAI API,Niek,chatgpt-web,https://github.com/Niek/chatgpt-web
2023-05-24,svelte,2459,4,"Database manager for MySQL, PostgreSQL, SQL Server, MongoDB, SQLite and others. Runs under Windows, Linux, Mac or as web application",dbgate,dbgate,https://github.com/dbgate/dbgate
2023-05-24,svelte,850,1,SvelteUI Monorepo,svelteuidev,svelteui,https://github.com/svelteuidev/svelteui
2023-05-24,svelte,2808,5,Build and ship your app faster https://fireship.io,fireship-io,fireship.io,https://github.com/fireship-io/fireship.io
2023-05-24,svelte,171,1,,iptv-org,iptv-org.github.io,https://github.com/iptv-org/iptv-org.github.io
2023-05-24,svelte,776,1,A SvelteKit template for building CMS-free editable websites,michael,editable-website,https://github.com/michael/editable-website
2023-05-24,svelte,1756,5,Business intelligence as code: build polished data products with SQL and markdown,evidence-dev,evidence,https://github.com/evidence-dev/evidence
2023-05-24,svelte,1839,2,"A Svelte library for building dynamic, infinitely customizable node-based user interfaces and flowcharts",open-source-labs,Svelvet,https://github.com/open-source-labs/Svelvet
2023-05-24,svelte,440,0,The official IOTA and Shimmer wallet,iotaledger,firefly,https://github.com/iotaledger/firefly
2023-05-24,svelte,128,0,"Frontend components, documentation and information hosted on the Hugging Face website.",huggingface,hub-docs,https://github.com/huggingface/hub-docs
2023-05-24,svelte,685,2,Plain text project planning in Obsidian,marcusolsson,obsidian-projects,https://github.com/marcusolsson/obsidian-projects
2023-05-24,svelte,2216,5,Svelte implementation of the Carbon Design System,carbon-design-system,carbon-components-svelte,https://github.com/carbon-design-system/carbon-components-svelte
2023-05-24,svelte,152,2,AI Data Management & Evaluation Platform,zeno-ml,zeno,https://github.com/zeno-ml/zeno
2023-05-24,svelte,1705,1,"A simple standalone program which automates the installation, removal and maintenance of BetterDiscord.",BetterDiscord,Installer,https://github.com/BetterDiscord/Installer
2023-05-24,svelte,551,3,"A simple wake on lan web app written with SvelteKit, Go, PocketBase and nmap",seriousm4x,UpSnap,https://github.com/seriousm4x/UpSnap