date,language,stargazers,starsToday,description,owner,name,url
2023-03-07,html,38124,1002,This repo includes ChatGPT prompt curation to use ChatGPT better.,f,awesome-chatgpt-prompts,https://github.com/f/awesome-chatgpt-prompts
2023-03-07,html,5847,16,The easiest way to run WireGuard VPN + Web-based Admin UI.,WeeJeWel,wg-easy,https://github.com/WeeJeWel/wg-easy
2023-03-07,html,13420,50,Create UIs for your machine learning model in Python in 3 minutes,gradio-app,gradio,https://github.com/gradio-app/gradio
2023-03-07,html,3080,6,Card-style Hugo theme designed for bloggers,CaiJimmy,hugo-theme-stack,https://github.com/CaiJimmy/hugo-theme-stack
2023-03-07,html,2608,3,Dopefolio  - Portfolio Template for Developers,rammcodes,Dopefolio,https://github.com/rammcodes/Dopefolio
2023-03-07,html,93,0,,pwlive,fullstackwebdevelopment,https://github.com/pwlive/fullstackwebdevelopment
2023-03-07,html,5102,10,"A beautiful, simple, clean, and responsive Jekyll theme for academics",alshedivat,al-folio,https://github.com/alshedivat/al-folio
2023-03-07,html,58,2,用python和flask简单实现调用chatGPT的API,wangyunjeff,EasyChatGPT-API,https://github.com/wangyunjeff/EasyChatGPT-API
2023-03-07,html,3962,0,"Welcome to the Bot Framework samples repository. Here you will find task-focused samples in C#, JavaScript and TypeScript to help you get started with the Bot Framework SDK!",microsoft,BotBuilder-Samples,https://github.com/microsoft/BotBuilder-Samples
2023-03-07,html,51542,43,程序员在家做饭方法指南。Programmer's guide about how to cook at home (Chinese only).,Anduin2017,HowToCook,https://github.com/Anduin2017/HowToCook
2023-03-07,html,7248,11,An automated phishing tool with 30+ templates. This Tool is made for educational purpose only ! Author will not be responsible for any misuse of this toolkit !,htr-tech,zphisher,https://github.com/htr-tech/zphisher
2023-03-07,html,26616,31,计算机自学指南,PKUFlyingPig,cs-self-learning,https://github.com/PKUFlyingPig/cs-self-learning
2023-03-07,html,8681,22,2023中国翻墙软件VPN推荐以及科学上网避坑，稳定好用。对比SSR机场、蓝灯、V2ray、老王VPN、VPS搭建梯子等科学上网与翻墙软件，中国最新科学上网翻墙梯子VPN下载推荐。,vpncn,vpncn.github.io,https://github.com/vpncn/vpncn.github.io
2023-03-07,html,4156,3,"Bonus materials, exercises, and example projects for our Python tutorials",realpython,materials,https://github.com/realpython/materials
2023-03-07,html,9367,11,Curso de HTML5 e CSS3,gustavoguanabara,html-css,https://github.com/gustavoguanabara/html-css
2023-03-07,html,912,1,,TheOdinProject,css-exercises,https://github.com/TheOdinProject/css-exercises
2023-03-07,html,183,7,"Atmospheric adventure chat shell for AI language models (KoboldAI, NovelAI, Pygmalion)",TavernAI,TavernAI,https://github.com/TavernAI/TavernAI
2023-03-07,html,171,2,,dotnet,blazor-samples,https://github.com/dotnet/blazor-samples
2023-03-07,html,591,1,Code for the note storing flask web app made during a YouTube video.,techwithtim,Flask-Web-App-Tutorial,https://github.com/techwithtim/Flask-Web-App-Tutorial
2023-03-07,html,8529,6,Dism++ Multi-language Support & BUG Report,Chuyu-Team,Dism-Multi-language,https://github.com/Chuyu-Team/Dism-Multi-language
2023-03-07,html,8068,9,Un blog increíble para el curso de Git y Github de Platzi,freddier,hyperblog,https://github.com/freddier/hyperblog
2023-03-07,html,2364,2,Web site for www.py4e.com and source to the Python 3.0 textbook,csev,py4e,https://github.com/csev/py4e
2023-03-07,html,174,3,"All assignments, demos, and cheat sheets from the 9 courses in the ""Meta Front-End Developer Professional Certificate"" on Coursera.",ginny100,Meta-Front-End-Developer,https://github.com/ginny100/Meta-Front-End-Developer
2023-03-07,html,9740,12,"one for all free music in china (chrome extension, also works for firefox)",listen1,listen1_chrome_extension,https://github.com/listen1/listen1_chrome_extension
2023-03-07,html,3679,7,"A minimal, responsive and feature-rich Jekyll theme for technical writing.",cotes2020,jekyll-theme-chirpy,https://github.com/cotes2020/jekyll-theme-chirpy