date,language,stargazers,starsToday,description,owner,name,url
2022-06-10,elixir,4619,2,"Rich, real-time user experiences with server-rendered HTML",phoenixframework,phoenix_live_view,https://github.com/phoenixframework/phoenix_live_view
2022-06-10,elixir,185,2,Gradient is a static typechecker for Elixir,esl,gradient,https://github.com/esl/gradient
2022-06-10,elixir,894,10,Catalog of Elixir-specific code smells,lucasvegi,Elixir-Code-Smells,https://github.com/lucasvegi/Elixir-Code-Smells
2022-06-10,elixir,567,0,Open Source Newsletter Tool.,pentacent,keila,https://github.com/pentacent/keila
2022-06-10,elixir,2,0,,OffchainLabs,blockscout,https://github.com/OffchainLabs/blockscout
2022-06-10,elixir,279,2,Phoenix + Live View HEEX Components,petalframework,petal_components,https://github.com/petalframework/petal_components
2022-06-10,elixir,5458,0,A toolkit for data mapping and language integrated query.,elixir-ecto,ecto,https://github.com/elixir-ecto/ecto
2022-06-10,elixir,447,0,Open API Specifications for Elixir Plug applications,open-api-spex,open_api_spex,https://github.com/open-api-spex/open_api_spex
2022-06-10,elixir,15,0,The fusion_auth library provides an Elixir API for accessing the FusionAuth Developer APIs.,leo-technologies-llc,fusion_auth,https://github.com/leo-technologies-llc/fusion_auth
2022-06-10,elixir,1775,0,"Testable, composable, and adapter based Elixir email library for devs that love piping.",thoughtbot,bamboo,https://github.com/thoughtbot/bamboo
2022-06-10,elixir,18007,3,Peace of mind from prototype to production,phoenixframework,phoenix,https://github.com/phoenixframework/phoenix
2022-06-10,elixir,11342,7,"Simple, open-source, lightweight (< 1 KB) and privacy-friendly web analytics alternative to Google Analytics.",plausible,analytics,https://github.com/plausible/analytics
2022-06-10,elixir,1728,6,Blockchain explorer for Ethereum based network and a tool for inspecting and analyzing EVM based blockchains.,blockscout,blockscout,https://github.com/blockscout/blockscout
2022-06-10,elixir,537,0,Kafka client library for Elixir,kafkaex,kafka_ex,https://github.com/kafkaex/kafka_ex
2022-06-10,elixir,20300,5,"Elixir is a dynamic, functional language designed for building scalable and maintainable applications",elixir-lang,elixir,https://github.com/elixir-lang/elixir
2022-06-10,elixir,512,1,更加现代的 Policr 迷你版,Hentioe,policr-mini,https://github.com/Hentioe/policr-mini
2022-06-10,elixir,448,0,automated contract testing via type checking for Elixir functions and mocks,msz,hammox,https://github.com/msz/hammox
2022-06-10,elixir,960,0,Nx-powered Neural Networks,elixir-nx,axon,https://github.com/elixir-nx/axon
2022-06-10,elixir,2166,2,WireGuard®-based VPN server and firewall,firezone,firezone,https://github.com/firezone/firezone
2022-06-10,elixir,5003,3,Listen to your to PostgreSQL database in realtime via websockets. Built with Elixir.,supabase,realtime,https://github.com/supabase/realtime
2022-06-10,elixir,1812,0,Multi-dimensional arrays (tensors) and numerical definitions for Elixir,elixir-nx,nx,https://github.com/elixir-nx/nx
2022-06-10,elixir,62,0,Traffic endpoint and graceful shutdown for Elixir Plug apps,Financial-Times,k8s_traffic_plug,https://github.com/Financial-Times/k8s_traffic_plug
2022-06-10,elixir,11330,0,"A curated list of amazingly awesome Elixir and Erlang libraries, resources and shiny things. Updates:",h4cc,awesome-elixir,https://github.com/h4cc/awesome-elixir
2022-06-10,elixir,1827,0,Concurrent and multi-stage data ingestion and data processing with Elixir,dashbitco,broadway,https://github.com/dashbitco/broadway
2022-06-10,elixir,301,0,Generate Phoenix API documentation from tests,api-hogs,bureaucrat,https://github.com/api-hogs/bureaucrat