date,language,stargazers,starsToday,description,owner,name,url
2024-03-27,scala,5583,3,"The Scala 3 compiler, also known as Dotty.",scala,scala3,https://github.com/scala/scala3
2024-03-27,scala,6789,1,"An open-source storage framework that enables building a Lakehouse architecture with compute engines including Spark, PrestoDB, Flink, Trino, and Hive and APIs",delta-io,delta,https://github.com/delta-io/delta
2024-03-27,scala,38124,13,Apache Spark - A unified analytics engine for large-scale data processing,apache,spark,https://github.com/apache/spark
2024-03-27,scala,3673,2,Chisel: A Modern Hardware Design Language,chipsalliance,chisel,https://github.com/chipsalliance/chisel
2024-03-27,scala,4266,4,Open-source high-performance RISC-V processor,OpenXiangShan,XiangShan,https://github.com/OpenXiangShan/XiangShan
2024-03-27,scala,10586,6,"Removes large or troublesome blobs like git-filter-branch does, but faster. And written in Scala",rtyley,bfg-repo-cleaner,https://github.com/rtyley/bfg-repo-cleaner
2024-03-27,scala,954,4,Gluten is a middle layer responsible for offloading JVM-based SQL engines' execution to native engines.,apache,incubator-gluten,https://github.com/apache/incubator-gluten
2024-03-27,scala,2977,2,Rocket Chip Generator,chipsalliance,rocket-chip,https://github.com/chipsalliance/rocket-chip
2024-03-27,scala,3108,4,"Deequ is a library built on top of Apache Spark for defining ""unit tests for data"", which measure data quality in large datasets.",awslabs,deequ,https://github.com/awslabs/deequ
2024-03-27,scala,2037,4,The Flix Programming Language,flix,flix,https://github.com/flix/flix
2024-03-27,scala,706,1,Spark RAPIDS plugin - accelerate Apache Spark with GPUs,NVIDIA,spark-rapids,https://github.com/NVIDIA/spark-rapids
2024-03-27,scala,24,0,Rawls service for DSDE,broadinstitute,rawls,https://github.com/broadinstitute/rawls
2024-03-27,scala,672,0,An open protocol for secure data sharing,delta-io,delta-sharing,https://github.com/delta-io/delta-sharing
2024-03-27,scala,1905,1,Apache Kyuubi is a distributed and multi-tenant gateway to provide serverless SQL on data warehouses and lakehouses.,apache,kyuubi,https://github.com/apache/kyuubi
2024-03-27,scala,3979,1,"ZIO — A type-safe, composable library for async and concurrent programming in Scala",zio,zio,https://github.com/zio/zio
2024-03-27,scala,4958,2,Simple and Distributed Machine Learning,microsoft,SynapseML,https://github.com/microsoft/SynapseML
2024-03-27,scala,2,0,MonoM_SCs,Karaokaze,MonoM_SCs,https://github.com/Karaokaze/MonoM_SCs
2024-03-27,scala,1570,1,SonicBOOM: The Berkeley Out-of-Order Machine,riscv-boom,riscv-boom,https://github.com/riscv-boom/riscv-boom
2024-03-27,scala,12905,0,"Build highly concurrent, distributed, and resilient message-driven applications on the JVM",akka,akka,https://github.com/akka/akka
2024-03-27,scala,1236,1,Cortex: a Powerful Observable Analysis and Active Response Engine,TheHive-Project,Cortex,https://github.com/TheHive-Project/Cortex
2024-03-27,scala,14474,8,"♞ lichess.org: the forever free, adless and open source chess server ♞",lichess-org,lila,https://github.com/lichess-org/lila
2024-03-27,scala,324,0,"Scala incremental compiler library, used by sbt and other build tools",sbt,zinc,https://github.com/sbt/zinc
2024-03-27,scala,15,0,All Rudder public plugins in one repository. Licenses are by-plugin.,Normation,rudder-plugins,https://github.com/Normation/rudder-plugins
2024-03-27,scala,1378,1,GeoMesa is a suite of tools for working with big geo-spatial data in a distributed fashion.,locationtech,geomesa,https://github.com/locationtech/geomesa
2024-03-27,scala,2734,1,Spark: The Definitive Guide's Code Repository,databricks,Spark-The-Definitive-Guide,https://github.com/databricks/Spark-The-Definitive-Guide