date,language,stargazers,starsToday,description,owner,name,url
2023-06-01,vue,23136,102,用 Express 和 Vue3 搭建的 ChatGPT 演示网页,Chanzhaoyu,chatgpt-web,https://github.com/Chanzhaoyu/chatgpt-web
2023-06-01,vue,136,60,mallchat的前端项目，是一个既能购物又能聊天的电商系统。以互联网企业级开发规范的要求来实现它，电商该有的购物车，订单，支付，推荐，搜索，拉新，促活，推送，物流，客服，它都必须有。持续更新ing,Evansy,MallChatWeb,https://github.com/Evansy/MallChatWeb
2023-06-01,vue,1197,4,"A set of background integration scheme based on vue3, element-plus, typescript4 and vite4",kailong321200875,vue-element-plus-admin,https://github.com/kailong321200875/vue-element-plus-admin
2023-06-01,vue,2357,3,The recommended way to start a Vite-powered Vue project,vuejs,create-vue,https://github.com/vuejs/create-vue
2023-06-01,vue,20054,9,A Vue.js 3 UI Library made by Element team,element-plus,element-plus,https://github.com/element-plus/element-plus
2023-06-01,vue,578,18,"跨平台桌面端视频资源播放器,免费高颜值.",Hiram-Wong,ZyPlayer,https://github.com/Hiram-Wong/ZyPlayer
2023-06-01,vue,13009,5,"Modern and easy to use SQL client for MySQL, Postgres, SQLite, SQL Server, and more. Linux, MacOS, and Windows.",beekeeper-studio,beekeeper-studio,https://github.com/beekeeper-studio/beekeeper-studio
2023-06-01,vue,158,0,万岳同城外卖(takeaway) 系统开源版，前端uniapp+后台php搭建，系统包含商家端、配送端、用户端以及总管理后台、城市配送后台,WanyueKJ,takeaway-uniapp,https://github.com/WanyueKJ/takeaway-uniapp
2023-06-01,vue,1119,4,"A modern, fast and productivity driven SQL client with a focus in UX.",antares-sql,antares,https://github.com/antares-sql/antares
2023-06-01,vue,1143,2,"一款开箱即用的 Vue 中后台管理系统框架，兼容PC、移动端。vue-admin, vue-element-admin, vue后台, 后台系统, 后台框架, 管理后台, 管理系统",fantastic-admin,basic,https://github.com/fantastic-admin/basic
2023-06-01,vue,53400,2,A Vue.js 2.0 UI Toolkit for Web,ElemeFE,element,https://github.com/ElemeFE/element
2023-06-01,vue,14306,6,"vue admin,vue3 admin,vue3.0 admin,vue后台管理,vue-admin,vue3.0-admin,admin,vue-admin,vue-element-admin,ant-design,vue-admin-beautiful-pro,vab admin pro,vab admin plus,vue admin plus,vue admin pro",chuzhixin,vue-admin-better,https://github.com/chuzhixin/vue-admin-better
2023-06-01,vue,4360,19,Geeker Admin，基于 Vue3.3、TypeScript、Vite4、Pinia、Element-Plus 开源的一套后台管理框架。,HalseySpicy,Geeker-Admin,https://github.com/HalseySpicy/Geeker-Admin
2023-06-01,vue,5329,6,京东风格的移动端 Vue2、Vue3 组件库 、支持多端小程序(A Vue.js UI Toolkit for Mobile Web),jdf2e,nutui,https://github.com/jdf2e/nutui
2023-06-01,vue,1193,2,适用于echarts等地图geoJson行政边界数据的实时获取与应用，全国省市区县多级联动下钻，真正意义的下钻至县级【附最新全国省市区县乡镇三级或四级城市geoJson文件下载，另可下载四级联动或五级（村级）行政编码对应关系】,TangSY,echarts-map-demo,https://github.com/TangSY/echarts-map-demo
2023-06-01,vue,921,5,个人主页，我的个人主页，个人主页源码，主页模板，homepage,imsyy,home,https://github.com/imsyy/home
2023-06-01,vue,18186,5,An enterprise-class UI components based on Ant Design and Vue.,vueComponent,ant-design-vue,https://github.com/vueComponent/ant-design-vue
2023-06-01,vue,8086,6,Blazing fast scrolling for any amount of data,Akryum,vue-virtual-scroller,https://github.com/Akryum/vue-virtual-scroller
2023-06-01,vue,631,6,"PandoraAI is a web chat client powered by node-chatgpt-api, allowing users to easily chat with multiple AI systems while also offering support for custom presets. With its seamless and convenient design, PandoraAI provides an engaging conversational AI experience.",waylaidwanderer,PandoraAI,https://github.com/waylaidwanderer/PandoraAI
2023-06-01,vue,3985,8,Vue + SpringBoot + MyBatis 音乐网站,Yin-Hongwei,music-website,https://github.com/Yin-Hongwei/music-website
2023-06-01,vue,688,1,Subconverter订阅转换前端，增加近百条远程配置及更多自定义功能！,youshandefeiyang,sub-web-modify,https://github.com/youshandefeiyang/sub-web-modify
2023-06-01,vue,173,5,一个简约的在线音乐播放器，支持网易云音乐账号登录，逐字歌词，下载歌曲，展示评论区，音乐频谱，音乐云盘及歌单管理，移动端基础适配,imsyy,SPlayer,https://github.com/imsyy/SPlayer
2023-06-01,vue,3365,6,一款简洁高效的VuePress知识管理&博客(blog)主题,xugaoyi,vuepress-theme-vdoing,https://github.com/xugaoyi/vuepress-theme-vdoing
2023-06-01,vue,1779,10,"基于fabric.js和Vue的图片编辑器，可自定义字体、素材、设计模板。fabric.js and Vue based image editor, can customize fonts, materials, design templates.",nihaojob,vue-fabric-editor,https://github.com/nihaojob/vue-fabric-editor
2023-06-01,vue,2625,9,Interface for Snapshot. Join us on Discord http://discord.snapshot.org,snapshot-labs,snapshot,https://github.com/snapshot-labs/snapshot