date,language,stargazers,starsToday,description,owner,name,url
2022-10-25,php,4276,4,"Pterodactyl® is a free, open-source game server management panel built with PHP, React, and Go. Designed with security in mind, Pterodactyl runs all game servers in isolated Docker containers while exposing a beautiful and intuitive UI to end users.",pterodactyl,panel,https://github.com/pterodactyl/panel
2022-10-25,php,9767,2,PHP_CodeSniffer tokenizes PHP files and detects violations of a defined set of coding standards.,squizlabs,PHP_CodeSniffer,https://github.com/squizlabs/PHP_CodeSniffer
2022-10-25,php,7626,1,"Twig, the flexible, fast, and secure template language for PHP",twigphp,Twig,https://github.com/twigphp/Twig
2022-10-25,php,111,7,Speedtest Tracker is a self-hosted internet performance tracking application that runs speedtest checks against Ookla's Speedtest service. Build using Laravel and the Speedtest CLI.,alexjustesen,speedtest-tracker,https://github.com/alexjustesen/speedtest-tracker
2022-10-25,php,42525,14,"SecLists is the security tester's companion. It's a collection of multiple types of lists used during security assessments, collected in one place. List types include usernames, passwords, URLs, sensitive data patterns, fuzzing payloads, web shells, and many more.",danielmiessler,SecLists,https://github.com/danielmiessler/SecLists
2022-10-25,php,4825,8,"Admin panel, form builder and table builder for Laravel. Built with the TALL stack. Designed for humans.",filamentphp,filament,https://github.com/filamentphp/filament
2022-10-25,php,801,5,Open source alternative frontend for TikTok made using PHP,pablouser1,ProxiTok,https://github.com/pablouser1/ProxiTok
2022-10-25,php,4901,12,"A free, self-hostable aggregator…",FreshRSS,FreshRSS,https://github.com/FreshRSS/FreshRSS
2022-10-25,php,14091,7,A personal music streaming server that works.,koel,koel,https://github.com/koel/koel
2022-10-25,php,18800,5,The classic email sending library for PHP,PHPMailer,PHPMailer,https://github.com/PHPMailer/PHPMailer
2022-10-25,php,14537,6,Laravel Debugbar (Integrates PHP Debug Bar),barryvdh,laravel-debugbar,https://github.com/barryvdh/laravel-debugbar
2022-10-25,php,3209,4,独角数卡(自动售货系统)-开源站长自动化售货解决方案、高效、稳定、快速！,assimon,dujiaoka,https://github.com/assimon/dujiaoka
2022-10-25,php,188,14,Add flags to Eloquent models,spatie,laravel-model-flags,https://github.com/spatie/laravel-model-flags
2022-10-25,php,8843,1,Doctrine Database Abstraction Layer,doctrine,dbal,https://github.com/doctrine/dbal
2022-10-25,php,2258,0,"Drush is a command-line shell and scripting interface for Drupal, a veritable Swiss Army knife designed to make life easier for those who spend their working hours hacking away at the command prompt.",drush-ops,drush,https://github.com/drush-ops/drush
2022-10-25,php,9094,3,Firefly III: a personal finances manager,firefly-iii,firefly-iii,https://github.com/firefly-iii/firefly-iii
2022-10-25,php,73,17,"A package for sanitizing/formatting data, powered by Laravel's validation components.",surgiie,transformer,https://github.com/surgiie/transformer
2022-10-25,php,6177,2,"A spec compliant, secure by default PHP OAuth 2.0 Server",thephpleague,oauth2-server,https://github.com/thephpleague/oauth2-server
2022-10-25,php,4677,4,"The most advanced frontend drag & drop page builder. Create high-end, pixel perfect websites at record speeds. Any theme, any page, any design.",elementor,elementor,https://github.com/elementor/elementor
2022-10-25,php,2404,2,Hexagonal Architecture + DDD + CQRS in PHP using Symfony 6,CodelyTV,php-ddd-example,https://github.com/CodelyTV/php-ddd-example
2022-10-25,php,10755,5,Associate users with roles and permissions,spatie,laravel-permission,https://github.com/spatie/laravel-permission
2022-10-25,php,2006,2,"Minimal Laravel authentication scaffolding with Blade, Vue, or React + Tailwind.",laravel,breeze,https://github.com/laravel/breeze
2022-10-25,php,2147,5,"A great looking and easy-to-use photo-management-system you can run on your server, to manage and share photos.",LycheeOrg,Lychee,https://github.com/LycheeOrg/Lychee
2022-10-25,php,443,20,OpenAI PHP is a supercharged PHP API client that allows you to interact with OpenAI API.,openai-php,client,https://github.com/openai-php/client
2022-10-25,php,4937,9,An Application dashboard and launcher,linuxserver,Heimdall,https://github.com/linuxserver/Heimdall