date,language,stargazers,starsToday,description,owner,name,url
2024-09-02,svelte,399,2,"Open source, self-hostable watched list for all your content (movies, tv series, anime, games) with user authentication, modern and clean UI and a very simple setup.",sbondCo,Watcharr,https://github.com/sbondCo/Watcharr
2024-09-02,svelte,5628,1,"A web interface for chatting with Alpaca through llama.cpp. Fully dockerized, with an easy to use API.",serge-chat,serge,https://github.com/serge-chat/serge
2024-09-02,svelte,1161,2,Full-sized drag & drop JavaScript event calendar with resource & timeline views,vkurko,calendar,https://github.com/vkurko/calendar
2024-09-02,svelte,3526,2,Build and ship your app faster https://fireship.io,fireship-io,fireship.io,https://github.com/fireship-io/fireship.io
2024-09-02,svelte,407,1,"D1 Manager is a web UI and API for Cloudflare D1, a serverless SQL database. It provides a web interface for managing databases, tables, and records, as well as an AI assistant to help you write query in natural language.",JacobLinCool,d1-manager,https://github.com/JacobLinCool/d1-manager
2024-09-02,svelte,294,0,🌐 Website for ReVanced,ReVanced,revanced-website,https://github.com/ReVanced/revanced-website
2024-09-02,svelte,46,0,Design tokens for the Brave's design system known as Leo,brave,leo,https://github.com/brave/leo
2024-09-02,svelte,649,1,Find the best Neovim plugins,codicocodes,dotfyle,https://github.com/codicocodes/dotfyle
2024-09-02,svelte,1672,0,A web frontend for the headscale Tailscale-compatible coordination server,gurucomputing,headscale-ui,https://github.com/gurucomputing/headscale-ui
2024-09-02,svelte,1768,0,"A simple standalone program which automates the installation, removal and maintenance of BetterDiscord.",BetterDiscord,Installer,https://github.com/BetterDiscord/Installer
2024-09-02,svelte,480,1,"FreeShow is a free and open-source, user-friendly presenter software.",ChurchApps,FreeShow,https://github.com/ChurchApps/FreeShow
2024-09-02,svelte,4785,5,"shadcn/ui, but for Svelte. ✨",huntabyte,shadcn-svelte,https://github.com/huntabyte/shadcn-svelte
2024-09-02,svelte,831,1,🍞🥂 Buttery smooth toast notifications for Svelte,kbrgl,svelte-french-toast,https://github.com/kbrgl/svelte-french-toast
2024-09-02,svelte,132,1,LOA Logs - Modern DPS Meter for Lost Ark,snoww,loa-logs,https://github.com/snoww/loa-logs