date,language,stargazers,starsToday,description,owner,name,url
2023-01-27,php,476,5,Speedtest Tracker is a self-hosted internet performance tracking application that runs speedtest checks against Ookla's Speedtest service. Build using Laravel and the Speedtest CLI.,alexjustesen,speedtest-tracker,https://github.com/alexjustesen/speedtest-tracker
2023-01-27,php,11672,5,A tool to automatically fix PHP Coding Standards issues,PHP-CS-Fixer,PHP-CS-Fixer,https://github.com/PHP-CS-Fixer/PHP-CS-Fixer
2023-01-27,php,130,8,,beetlehr,beetlehr,https://github.com/beetlehr/beetlehr
2023-01-27,php,1824,5,FreeScout — Free self-hosted help desk & shared mailbox (Zendesk / Help Scout alternative),freescout-helpdesk,freescout,https://github.com/freescout-helpdesk/freescout
2023-01-27,php,1450,2,A skeleton repository for Spatie's Laravel Packages,spatie,package-skeleton-laravel,https://github.com/spatie/package-skeleton-laravel
2023-01-27,php,26678,4,Faker is a PHP library that generates fake data for you,fzaninotto,Faker,https://github.com/fzaninotto/Faker
2023-01-27,php,10808,11,A platform to create documentation/wiki content built with PHP & Laravel,BookStackApp,BookStack,https://github.com/BookStackApp/BookStack
2023-01-27,php,2209,2,The server component of API Platform: hypermedia and GraphQL APIs in minutes,api-platform,core,https://github.com/api-platform/core
2023-01-27,php,10434,1,"Prior to making any Submission(s), you must sign an Adobe Contributor License Agreement, available here at: https://opensource.adobe.com/cla.html. All Submissions you make to Adobe Inc. and its affiliates, assigns and subsidiaries (collectively “Adobe”) are subject to the terms of the Adobe Contributor License Agreement.",magento,magento2,https://github.com/magento/magento2
2023-01-27,php,5593,11,"Admin panel, form builder and table builder for Laravel. Built with the TALL stack. Designed for humans.",filamentphp,filament,https://github.com/filamentphp/filament
2023-01-27,php,28757,2,The Laravel Framework.,laravel,framework,https://github.com/laravel/framework
2023-01-27,php,591,2,Powerful data objects for Laravel,spatie,laravel-data,https://github.com/spatie/laravel-data
2023-01-27,php,11269,7,Supercharged Excel exports and imports in Laravel,SpartnerNL,Laravel-Excel,https://github.com/SpartnerNL/Laravel-Excel
2023-01-27,php,4773,3,The Roundcube Webmail suite,roundcube,roundcubemail,https://github.com/roundcube/roundcubemail
2023-01-27,php,4898,3,"The most advanced frontend drag & drop page builder. Create high-end, pixel perfect websites at record speeds. Any theme, any page, any design.",elementor,elementor,https://github.com/elementor/elementor
2023-01-27,php,16044,1,A simple PHP API extension for DateTime.,briannesbitt,Carbon,https://github.com/briannesbitt/Carbon
2023-01-27,php,22322,2,"Guzzle, an extensible PHP HTTP client",guzzle,guzzle,https://github.com/guzzle/guzzle
2023-01-27,php,319,1,"Исходники из уроков youtube-канала ""Maxgraph - сайты как страсть""",maxdenaro,maxgraph-youtube-source,https://github.com/maxdenaro/maxgraph-youtube-source
2023-01-27,php,9479,2,Doctrine Object Relational Mapper (ORM),doctrine,orm,https://github.com/doctrine/orm
2023-01-27,php,7311,3,A free open source IT asset/license management system,snipe,snipe-it,https://github.com/snipe/snipe-it
2023-01-27,php,9963,3,PHP_CodeSniffer tokenizes PHP files and detects violations of a defined set of coding standards.,squizlabs,PHP_CodeSniffer,https://github.com/squizlabs/PHP_CodeSniffer
2023-01-27,php,2311,4,A multiple proxy protocol manage panel application interface,v2board,v2board,https://github.com/v2board/v2board
2023-01-27,php,7194,2,Open Source eCommerce Framework on Symfony,Sylius,Sylius,https://github.com/Sylius/Sylius
2023-01-27,php,2766,3,Automatic multi-tenancy for Laravel. No code changes needed.,archtechx,tenancy,https://github.com/archtechx/tenancy
2023-01-27,php,4328,8,"World countries, states, regions, provinces, cities, towns in JSON, SQL, XML, YAML, and CSV. All Countries, States, Cities with ISO2, ISO3, Country Code, Phone Code, Capital, Native Language, Timezones, Latitude, Longitude, Region, Subregion, Flag Emoji, and Currency. #countries #states #cities",dr5hn,countries-states-cities-database,https://github.com/dr5hn/countries-states-cities-database