date,language,stargazers,starsToday,description,owner,name,url
2024-02-10,kotlin,4588,17,Material Design file manager for Android,zhanghai,MaterialFiles,https://github.com/zhanghai/MaterialFiles
2024-02-10,kotlin,6658,19,Using system APIs directly with adb/root privileges from normal apps through a Java process started with app_process.,RikkaApps,Shizuku,https://github.com/RikkaApps/Shizuku
2024-02-10,kotlin,4967,1,Kotlin multiplatform / multi-format serialization,Kotlin,kotlinx.serialization,https://github.com/Kotlin/kotlinx.serialization
2024-02-10,kotlin,587,16,微信抢红包Android APP,xbdcc,GrabRedEnvelope,https://github.com/xbdcc/GrabRedEnvelope
2024-02-10,kotlin,7743,3,Kotlin SQL Framework,JetBrains,Exposed,https://github.com/JetBrains/Exposed
2024-02-10,kotlin,620,0,Easily install Vendetta on Android,vendetta-mod,VendettaManager,https://github.com/vendetta-mod/VendettaManager
2024-02-10,kotlin,12586,2,Library support for Kotlin coroutines,Kotlin,kotlinx.coroutines,https://github.com/Kotlin/kotlinx.coroutines
2024-02-10,kotlin,180,10,Use ChatGPT instead of Google Assistant,WSTxda,Plugin-VoiceGPT,https://github.com/WSTxda/Plugin-VoiceGPT
2024-02-10,kotlin,596,0,Opensource automated insulin delivery system (closed loop),nightscout,AndroidAPS,https://github.com/nightscout/AndroidAPS
2024-02-10,kotlin,431,1,"JetBrains Compose Multiplatform UI App (Android, iOS, Desktop, Web). MVVM - Kotlin MultiPlatform (KMP)",SEAbdulbasit,TravelApp-KMP,https://github.com/SEAbdulbasit/TravelApp-KMP
2024-02-10,kotlin,6784,14,NekoBox for Android / sing-box / universal proxy toolchain for Android,MatsuriDayo,NekoBoxForAndroid,https://github.com/MatsuriDayo/NekoBoxForAndroid
2024-02-10,kotlin,4819,4,Painless Mobile UI Automation,mobile-dev-inc,maestro,https://github.com/mobile-dev-inc/maestro
2024-02-10,kotlin,1985,2,Unofficial MangaDex Reader for Android 7+,nekomangaorg,Neko,https://github.com/nekomangaorg/Neko
2024-02-10,kotlin,46929,8,The Kotlin Programming Language.,JetBrains,kotlin,https://github.com/JetBrains/kotlin
2024-02-10,kotlin,4008,53,Free and open source manga reader for Android,mihonapp,mihon,https://github.com/mihonapp/mihon
2024-02-10,kotlin,2887,1,GraphQL for Java with Spring Boot made easy.,Netflix,dgs-framework,https://github.com/Netflix/dgs-framework
2024-02-10,kotlin,1034,4,Adds themed icons to Lawnchair.,LawnchairLauncher,lawnicons,https://github.com/LawnchairLauncher/lawnicons
2024-02-10,kotlin,7065,3,An Android application for streaming music from YouTube Music.,vfsfitvnm,ViMusic,https://github.com/vfsfitvnm/ViMusic
2024-02-10,kotlin,3192,4,API documentation engine for Kotlin,Kotlin,dokka,https://github.com/Kotlin/dokka
2024-02-10,kotlin,14503,10,A fully functional Android app built entirely with Kotlin and Jetpack Compose,android,nowinandroid,https://github.com/android/nowinandroid
2024-02-10,kotlin,1098,4,A free mixin-based injection hacked client for Minecraft using the Fabric API,CCBlueX,LiquidBounce,https://github.com/CCBlueX/LiquidBounce
2024-02-10,kotlin,43595,4,A collection of samples to discuss and showcase different architectural tools and patterns for Android apps.,android,architecture-samples,https://github.com/android/architecture-samples
2024-02-10,kotlin,188,2,✨ Gemini Android demonstrates Google's Generative AI on Android with Stream Chat SDK for Compose.,skydoves,gemini-android,https://github.com/skydoves/gemini-android
2024-02-10,kotlin,1807,4,"Kotlin Multiplatform lifecycle-aware business logic components (aka BLoCs) with routing (navigation) and pluggable UI (Jetpack Compose, SwiftUI, JS React, etc.)",arkivanov,Decompose,https://github.com/arkivanov/Decompose
2024-02-10,kotlin,14284,6,"Compose Multiplatform, a modern UI framework for Kotlin that makes building performant and beautiful user interfaces easy and enjoyable.",JetBrains,compose-multiplatform,https://github.com/JetBrains/compose-multiplatform