date,language,stargazers,starsToday,description,owner,name,url
2022-11-29,html,21995,84,30 Day Vanilla JS Challenge,wesbos,JavaScript30,https://github.com/wesbos/JavaScript30
2022-11-29,html,16413,826,计算机自学指南,PKUFlyingPig,cs-self-learning,https://github.com/PKUFlyingPig/cs-self-learning
2022-11-29,html,2689,5,A collection of several hundred online tools for OSINT,cipher387,osint_stuff_tool_collection,https://github.com/cipher387/osint_stuff_tool_collection
2022-11-29,html,1621,7,The ultimate phishing tool with 38 websites available!,An0nUD4Y,blackeye,https://github.com/An0nUD4Y/blackeye
2022-11-29,html,10907,17,Create UIs for your machine learning model in Python in 3 minutes,gradio-app,gradio,https://github.com/gradio-app/gradio
2022-11-29,html,408,1,,SuperSimpleDev,html-css-course-2022,https://github.com/SuperSimpleDev/html-css-course-2022
2022-11-29,html,775,2,,TheOdinProject,css-exercises,https://github.com/TheOdinProject/css-exercises
2022-11-29,html,6286,4,A curated list of awesome things related to Django,wsvincent,awesome-django,https://github.com/wsvincent/awesome-django
2022-11-29,html,2998,6,A list of FREE resources to make Web3 accessible to everyone.,FrancescoXX,free-Web3-resources,https://github.com/FrancescoXX/free-Web3-resources
2022-11-29,html,4750,9,The easiest way to run WireGuard VPN + Web-based Admin UI.,WeeJeWel,wg-easy,https://github.com/WeeJeWel/wg-easy
2022-11-29,html,20717,18,A curated list of awesome warez and piracy links,Igglybuff,awesome-piracy,https://github.com/Igglybuff/awesome-piracy
2022-11-29,html,1303,6,"vCard is a fully responsive personal portfolio website, responsive for all devices.",codewithsadee,vcard-personal-portfolio,https://github.com/codewithsadee/vcard-personal-portfolio
2022-11-29,html,520,1,Code for the note storing flask web app made during a YouTube video.,techwithtim,Flask-Web-App-Tutorial,https://github.com/techwithtim/Flask-Web-App-Tutorial
2022-11-29,html,4268,3,"Fluent System Icons are a collection of familiar, friendly and modern icons from Microsoft.",microsoft,fluentui-system-icons,https://github.com/microsoft/fluentui-system-icons
2022-11-29,html,6044,2,An extensible media player for the web.,clappr,clappr,https://github.com/clappr/clappr
2022-11-29,html,5810,10,Slam Dunk JavaScript,wesbos,beginner-javascript,https://github.com/wesbos/beginner-javascript
2022-11-29,html,3164,8,"A minimal, responsive, and powerful Jekyll theme for presenting professional writing.",cotes2020,jekyll-theme-chirpy,https://github.com/cotes2020/jekyll-theme-chirpy
2022-11-29,html,30170,14,浙江大学课程攻略共享计划,QSCTech,zju-icicles,https://github.com/QSCTech/zju-icicles
2022-11-29,html,4920,10,"A fast, clean, responsive Hugo theme.",adityatelange,hugo-PaperMod,https://github.com/adityatelange/hugo-PaperMod
2022-11-29,html,8516,15,Curso de HTML5 e CSS3,gustavoguanabara,html-css,https://github.com/gustavoguanabara/html-css
2022-11-29,html,26742,11,"清华大学计算机系课程攻略 Guidance for courses in Department of Computer Science and Technology, Tsinghua University",PKUanonym,REKCARC-TSC-UHT,https://github.com/PKUanonym/REKCARC-TSC-UHT
2022-11-29,html,331,12,Private Webpage,insolitum,insolitum.github.io,https://github.com/insolitum/insolitum.github.io
2022-11-29,html,903,5,EPG (Electronic Program Guide) for thousands of TV channels collected from different sources,iptv-org,epg,https://github.com/iptv-org/epg
2022-11-29,html,5525,1,"Compilers Principles, Techniques, & Tools (purple dragon book) second edition exercise answers. 编译原理（紫龙书）第2版习题答案。",fool2fish,dragon-book-exercise-answers,https://github.com/fool2fish/dragon-book-exercise-answers
2022-11-29,html,7321,22,2022中国翻墙软件VPN推荐以及科学上网避坑，稳定好用。对比SSR机场、蓝灯、V2ray、老王VPN、VPS搭建梯子等科学上网与翻墙软件，中国最新科学上网翻墙梯子VPN下载推荐。,vpncn,vpncn.github.io,https://github.com/vpncn/vpncn.github.io