date,language,stargazers,starsToday,description,owner,name,url
2022-11-29,markdown,7075,6,The content behind MDN Web Docs,mdn,content,https://github.com/mdn/content
2022-11-29,markdown,1055,3,The source repository of all translated content for MDN Web Docs,mdn,translated-content,https://github.com/mdn/translated-content
2022-11-29,markdown,3617,7,Ethereum.org is a primary online resource for the Ethereum community.,ethereum,ethereum-org-website,https://github.com/ethereum/ethereum-org-website
2022-11-29,markdown,6295,7,Improve your README.md profile with these amazing badges.,alexandresanlim,Badges4-README.md-Profile,https://github.com/alexandresanlim/Badges4-README.md-Profile
2022-11-29,markdown,12206,6,Free uptime monitor and status page powered by GitHub,upptime,upptime,https://github.com/upptime/upptime
2022-11-29,markdown,1279,4,Protect your data against global mass surveillance programs.,privacyguides,privacyguides.org,https://github.com/privacyguides/privacyguides.org
2022-11-29,markdown,112223,33,"刷算法全靠套路，认准 labuladong 就够了！English version supported! Crack LeetCode, not only how, but also why.",labuladong,fucking-algorithm,https://github.com/labuladong/fucking-algorithm
2022-11-29,markdown,106,1,Automated uptime monitoring of Nitter instances.,xnaas,nitter-instances,https://github.com/xnaas/nitter-instances
2022-11-29,markdown,3806,0,Solutions to Introduction to Algorithms Third Edition,walkccc,CLRS,https://github.com/walkccc/CLRS
2022-11-29,markdown,13815,2,This maintains proposals for changes and user-visible enhancements to the Swift Programming Language.,apple,swift-evolution,https://github.com/apple/swift-evolution
2022-11-29,markdown,4962,5,Official Discord API Documentation,discord,discord-api-docs,https://github.com/discord/discord-api-docs
2022-11-29,markdown,158,6,"List of supported, partially supported, and unsupported *non-rootless* tweaks for iOS 15.",itsnebulalol,ios15-tweaks,https://github.com/itsnebulalol/ios15-tweaks
2022-11-29,markdown,41737,13,Collaborative cheatsheets for console commands,tldr-pages,tldr,https://github.com/tldr-pages/tldr
2022-11-29,markdown,1179,3,This repository provides SAP style guides for coding and coding-related topics.,SAP,styleguides,https://github.com/SAP/styleguides
2022-11-29,markdown,95,0,Solutions (that we managed to find) for the 2021 PicoCTF,vivian-dai,PicoCTF2021-Writeup,https://github.com/vivian-dai/PicoCTF2021-Writeup
2022-11-29,markdown,21947,16,Linux命令大全搜索工具，内容包含Linux命令手册、详解、学习、搜集。https://git.io/linux,jaywcjlove,linux-command,https://github.com/jaywcjlove/linux-command
2022-11-29,markdown,2757,5,A collection listing all Achievements available on the GitHub profile,Schweinepriester,github-profile-achievements,https://github.com/Schweinepriester/github-profile-achievements