date,language,stargazers,starsToday,description,owner,name,url
2022-05-06,markdown,13279,4,This maintains proposals for changes and user-visible enhancements to the Swift Programming Language.,apple,swift-evolution,https://github.com/apple/swift-evolution
2022-05-06,markdown,3485,1,Solutions to Introduction to Algorithms Third Edition,walkccc,CLRS,https://github.com/walkccc/CLRS
2022-05-06,markdown,1047,0,This repository provides SAP style guides for coding and coding-related topics.,SAP,styleguides,https://github.com/SAP/styleguides
2022-05-06,markdown,105723,46,"刷算法全靠套路，认准 labuladong 就够了！English version supported! Crack LeetCode, not only how, but also why.",labuladong,fucking-algorithm,https://github.com/labuladong/fucking-algorithm
2022-05-06,markdown,4681,11,Improve your README.md profile with these amazing badges.,alexandresanlim,Badges4-README.md-Profile,https://github.com/alexandresanlim/Badges4-README.md-Profile
2022-05-06,markdown,5386,3,The content behind MDN Web Docs,mdn,content,https://github.com/mdn/content
2022-05-06,markdown,329,0,home of the osu! wiki,ppy,osu-wiki,https://github.com/ppy/osu-wiki
2022-05-06,markdown,2840,0,Rust 程序设计语言（2021 edition 施工中）,KaiserY,trpl-zh-cn,https://github.com/KaiserY/trpl-zh-cn
2022-05-06,markdown,767,3,Protect your data against global mass surveillance programs.,privacyguides,privacyguides.org,https://github.com/privacyguides/privacyguides.org
2022-05-06,markdown,38504,16,Collaborative cheatsheets for console commands,tldr-pages,tldr,https://github.com/tldr-pages/tldr
2022-05-06,markdown,1583,2,BOLT: Basis of Lightning Technology (Lightning Network Specifications),lightning,bolts,https://github.com/lightning/bolts
2022-05-06,markdown,4420,4,Official Discord API Documentation,discord,discord-api-docs,https://github.com/discord/discord-api-docs
2022-05-06,markdown,1191,1,A Collection of GitHub Profiles with awesome readme,coderjojo,creative-profile-readme,https://github.com/coderjojo/creative-profile-readme
2022-05-06,markdown,1490,1,Airbnb's Swift Style Guide.,airbnb,swift,https://github.com/airbnb/swift