date,language,stargazers,starsToday,description,owner,name,url
2023-01-08,svelte,1497,6,A lightweight Svelte component library for building interactive node-based flow diagrams,open-source-labs,Svelvet,https://github.com/open-source-labs/Svelvet
2023-01-08,svelte,917,5,A fully featured UI toolkit for Svelte + Tailwind.,skeletonlabs,skeleton,https://github.com/skeletonlabs/skeleton
2023-01-08,svelte,5391,2,An open-source & self-hostable Heroku / Netlify alternative.,coollabsio,coolify,https://github.com/coollabsio/coolify
2023-01-08,svelte,1784,2,SvelteKit implementation of the RealWorld app,sveltejs,realworld,https://github.com/sveltejs/realworld
2023-01-08,svelte,836,3,"Svelte ecommerce - Headless, Authentication, Cart & Checkout, TailwindCSS, Server Rendered, Proxy + API Integrated, Animations, Stores, Lazy Loading, Loading Indicators, Carousel, Instant Search, Faceted Filters, Typescript, Open Source, MIT license. 1 command deploy to your own server, 1 click deploy to netlify.",itswadesh,svelte-commerce,https://github.com/itswadesh/svelte-commerce
2023-01-08,svelte,123,0,,mail3protocol,mail3-me-button,https://github.com/mail3protocol/mail3-me-button
2023-01-08,svelte,154,1,Useful svelte stuff to put in your projects,vnphanquang,svelte-put,https://github.com/vnphanquang/svelte-put
2023-01-08,svelte,597,2,A three.js component library for Svelte.,threlte,threlte,https://github.com/threlte/threlte
2023-01-08,svelte,1924,5,Svelte implementation of the Carbon Design System,carbon-design-system,carbon-components-svelte,https://github.com/carbon-design-system/carbon-components-svelte
2023-01-08,svelte,425,2,Awesome examples of SvelteKit in the wild,janosh,awesome-sveltekit,https://github.com/janosh/awesome-sveltekit
2023-01-08,svelte,461,3,Official Svelte components built for Flowbite and Tailwind CSS,themesberg,flowbite-svelte,https://github.com/themesberg/flowbite-svelte
2023-01-08,svelte,21,0,Full stack application built with SvelteKit & PocketBase.,huntabyte,showcase,https://github.com/huntabyte/showcase
2023-01-08,svelte,776,0,What's really in your Discord Data package?,Androz2091,discord-data-package-explorer,https://github.com/Androz2091/discord-data-package-explorer
2023-01-08,svelte,2776,2,Svelte Material UI Components,hperrin,svelte-material-ui,https://github.com/hperrin/svelte-material-ui
2023-01-08,svelte,16792,31,"The most popular, free and open-source Tailwind CSS component library",saadeghi,daisyui,https://github.com/saadeghi/daisyui
2023-01-08,svelte,427,2,Project management for Obsidian,marcusolsson,obsidian-projects,https://github.com/marcusolsson/obsidian-projects
2023-01-08,svelte,1657,0,,PuruVJ,macos-web,https://github.com/PuruVJ/macos-web
2023-01-08,svelte,597,5,SvelteUI Monorepo,svelteuidev,svelteui,https://github.com/svelteuidev/svelteui
2023-01-08,svelte,76,0,"Frontend components, documentation and information hosted on the Hugging Face website.",huggingface,hub-docs,https://github.com/huggingface/hub-docs
2023-01-08,svelte,23,2,Opensource version of Nomie 6,open-nomie,nomie6-oss,https://github.com/open-nomie/nomie6-oss
2023-01-08,svelte,235,1,Issue-Crawler for GitHub based on Sveltekit,EddieHubCommunity,good-first-issue-finder,https://github.com/EddieHubCommunity/good-first-issue-finder
2023-01-08,svelte,803,9,Cybernetically enhanced Firebase apps,codediodeio,sveltefire,https://github.com/codediodeio/sveltefire
2023-01-08,svelte,86,3,Example showing how to use Auth.js with SvelteKit.,nextauthjs,sveltekit-auth-example,https://github.com/nextauthjs/sveltekit-auth-example
2023-01-08,svelte,596,1,"Rill is a tool for effortlessly transforming data sets into powerful, opinionated dashboards using SQL. BI-as-code.",rilldata,rill-developer,https://github.com/rilldata/rill-developer
2023-01-08,svelte,847,1,An extension that allows inspection of Svelte component hierarchy and state in the Firefox and Chrome developer tools.,sveltejs,svelte-devtools,https://github.com/sveltejs/svelte-devtools