date,language,stargazers,starsToday,description,owner,name,url
2022-05-23,rust,19335,614,Open source virtual / remote desktop infrastructure for everyone! The open source TeamViewer alternative.,rustdesk,rustdesk,https://github.com/rustdesk/rustdesk
2022-05-23,rust,22792,103,"A simple, fast and user-friendly alternative to 'find'",sharkdp,fd,https://github.com/sharkdp/fd
2022-05-23,rust,66818,33,Empowering everyone to build reliable and efficient software.,rust-lang,rust,https://github.com/rust-lang/rust
2022-05-23,rust,761,22,RustDesk Server Program,rustdesk,rustdesk-server,https://github.com/rustdesk/rustdesk-server
2022-05-23,rust,14718,113,"x86 virtualization in your browser, recompiling x86 to wasm on the fly",copy,v86,https://github.com/copy/v86
2022-05-23,rust,9632,11,A Rust compiler front-end for IDEs,rust-lang,rust-analyzer,https://github.com/rust-lang/rust-analyzer
2022-05-23,rust,7008,6,Substrate: The platform for blockchain innovators,paritytech,substrate,https://github.com/paritytech/substrate
2022-05-23,rust,19286,7,A new type of shell,nushell,nushell,https://github.com/nushell/nushell
2022-05-23,rust,3952,9,"A modern Elasticity and Performance cloud data warehouse, activate your object storage for real-time analytics.",datafuselabs,databend,https://github.com/datafuselabs/databend
2022-05-23,rust,2004,8,An async & dynamic ORM for Rust,SeaQL,sea-orm,https://github.com/SeaQL/sea-orm
2022-05-23,rust,26784,18,"Powerful, fast, and an easy to use search engine",meilisearch,meilisearch,https://github.com/meilisearch/meilisearch
2022-05-23,rust,922,15,"Aya is an eBPF library for the Rust programming language, built with a focus on developer experience and operability.",aya-rs,aya,https://github.com/aya-rs/aya
2022-05-23,rust,11279,6,A Python Interpreter written in Rust,RustPython,RustPython,https://github.com/RustPython/RustPython
2022-05-23,rust,16171,12,"A runtime for writing reliable asynchronous applications with Rust. Provides I/O, networking, scheduling, timers, ...",tokio-rs,tokio,https://github.com/tokio-rs/tokio
2022-05-23,rust,21681,22,Rust / Wasm framework for building client web apps,yewstack,yew,https://github.com/yewstack/yew
2022-05-23,rust,8584,15,"Web-Scale Blockchain for fast, secure, scalable, decentralized apps and marketplaces.",solana-labs,solana,https://github.com/solana-labs/solana
2022-05-23,rust,41059,63,"Build smaller, faster, and more secure desktop applications with a web frontend.",tauri-apps,tauri,https://github.com/tauri-apps/tauri
2022-05-23,rust,26484,20,"The minimal, blazing-fast, and infinitely customizable prompt for any shell!",starship,starship,https://github.com/starship/starship
2022-05-23,rust,1428,10,Cross-platform WebView library in Rust for Tauri.,tauri-apps,wry,https://github.com/tauri-apps/wry
2022-05-23,rust,3515,7,阿里云盘 WebDAV 服务,messense,aliyundrive-webdav,https://github.com/messense/aliyundrive-webdav
2022-05-23,rust,4348,5,A GPU-accelerated cross-platform terminal emulator and multiplexer written by @wez and implemented in Rust,wez,wezterm,https://github.com/wez/wezterm
2022-05-23,rust,337,28,The serverless open source alternative to AWS Aurora Postgres.,neondatabase,neon,https://github.com/neondatabase/neon
2022-05-23,rust,3750,20,3D and 2D game engine written in Rust,FyroxEngine,Fyrox,https://github.com/FyroxEngine/Fyrox
2022-05-23,rust,8666,17,A fast static site generator in a single binary with everything built-in. https://www.getzola.org,getzola,zola,https://github.com/getzola/zola
2022-05-23,rust,2433,7,The Rust Implementation of the libp2p networking stack.,libp2p,rust-libp2p,https://github.com/libp2p/rust-libp2p