date,language,stargazers,starsToday,description,owner,name,url
2023-05-28,markdown,116211,12,"刷算法全靠套路，认准 labuladong 就够了！English version supported! Crack LeetCode, not only how, but also why.",labuladong,fucking-algorithm,https://github.com/labuladong/fucking-algorithm
2023-05-28,markdown,1288,0,The source repository of all translated content for MDN Web Docs,mdn,translated-content,https://github.com/mdn/translated-content
2023-05-28,markdown,7850,2,The content behind MDN Web Docs,mdn,content,https://github.com/mdn/content
2023-05-28,markdown,14298,2,This maintains proposals for changes and user-visible enhancements to the Swift Programming Language.,apple,swift-evolution,https://github.com/apple/swift-evolution
2023-05-28,markdown,4090,1,Ethereum.org is a primary online resource for the Ethereum community.,ethereum,ethereum-org-website,https://github.com/ethereum/ethereum-org-website
2023-05-28,markdown,24057,6,Linux命令大全搜索工具，内容包含Linux命令手册、详解、学习、搜集。https://git.io/linux,jaywcjlove,linux-command,https://github.com/jaywcjlove/linux-command
2023-05-28,markdown,8935,2,Open source documentation of Microsoft Azure,MicrosoftDocs,azure-docs,https://github.com/MicrosoftDocs/azure-docs
2023-05-28,markdown,3562,1,Rust 程序设计语言（2021 edition 施工中）,KaiserY,trpl-zh-cn,https://github.com/KaiserY/trpl-zh-cn
2023-05-28,markdown,44310,11,Collaborative cheatsheets for console commands,tldr-pages,tldr,https://github.com/tldr-pages/tldr
2023-05-28,markdown,1703,1,Protect your data against global mass surveillance programs.,privacyguides,privacyguides.org,https://github.com/privacyguides/privacyguides.org
2023-05-28,markdown,1340,1,"A curated list of awesome HTML5 Canvas with examples, related articles and posts.",raphamorim,awesome-canvas,https://github.com/raphamorim/awesome-canvas
2023-05-28,markdown,1873,0,BOLT: Basis of Lightning Technology (Lightning Network Specifications),lightning,bolts,https://github.com/lightning/bolts
2023-05-28,markdown,5419,1,Official Discord API Documentation,discord,discord-api-docs,https://github.com/discord/discord-api-docs
2023-05-28,markdown,13209,4,Free uptime monitor and status page powered by GitHub,upptime,upptime,https://github.com/upptime/upptime
2023-05-28,markdown,1358,1,This repository provides SAP style guides for coding and coding-related topics.,SAP,styleguides,https://github.com/SAP/styleguides
2023-05-28,markdown,3036,0,Kotlin Evolution and Enhancement Process,Kotlin,KEEP,https://github.com/Kotlin/KEEP
2023-05-28,markdown,7543,3,Improve your README.md profile with these amazing badges.,alexandresanlim,Badges4-README.md-Profile,https://github.com/alexandresanlim/Badges4-README.md-Profile
2023-05-28,markdown,5249,2,RFCs for changes to Rust,rust-lang,rfcs,https://github.com/rust-lang/rfcs
2023-05-28,markdown,3674,7,A collection listing all Achievements available on the GitHub profile,Schweinepriester,github-profile-achievements,https://github.com/Schweinepriester/github-profile-achievements