date,language,stargazers,starsToday,description,owner,name,url
2022-11-24,perl,0,0,,molgenis,take-it-easyconfigs,https://github.com/molgenis/take-it-easyconfigs
2022-11-24,perl,1350,1,This is the new home for ddclient. Ddclient is a Perl client used to update dynamic DNS entries for accounts on 'Dynamic DNS Network Services' free DNS service. It currently supports a lot of different routers and a few different services.,ddclient,ddclient,https://github.com/ddclient/ddclient
2022-11-24,perl,272,0,"The Open Charge Point Interface (OCPI) allows for a scalable, automated roaming setup between Charge Point Operators and e-Mobility Service Providers. It supports authorisation, charge point information exchange (incl transaction events), charge detail record exchange and finally, the exchange of smart-charging commands between parties.",ocpi,ocpi,https://github.com/ocpi/ocpi
2022-11-24,perl,0,0,ruby vendor blobs,MiningCryptoLive,proprietary_vendor_htc_ruby,https://github.com/MiningCryptoLive/proprietary_vendor_htc_ruby
2022-11-24,perl,87,0,GLPI Agent,glpi-project,glpi-agent,https://github.com/glpi-project/glpi-agent
2022-11-24,perl,234,0,FusionInventory Agent,fusioninventory,fusioninventory-agent,https://github.com/fusioninventory/fusioninventory-agent
2022-11-24,perl,6253,4,Nikto web server scanner,sullo,nikto,https://github.com/sullo/nikto
2022-11-24,perl,2613,0,"Imapsync is an IMAP transfers tool. The purpose of imapsync is to migrate IMAP accounts or to backup IMAP accounts. IMAP is one of the three current standard protocols to access mailboxes, the two others are POP3 and HTTP with webmails, webmails are often tied to an IMAP server. Upstream website is",imapsync,imapsync,https://github.com/imapsync/imapsync
2022-11-24,perl,350,0,"A wrapper around Cutadapt and FastQC to consistently apply adapter and quality trimming to FastQ files, with extra functionality for RRBS data",FelixKrueger,TrimGalore,https://github.com/FelixKrueger/TrimGalore
2022-11-24,perl,280,0,Collection of standard plugins to discover and gather cloud-to-edge metrics and status across your whole IT infrastructure.,centreon,centreon-plugins,https://github.com/centreon/centreon-plugins
2022-11-24,perl,1110,1,ä¸€ä¸ªä¸»è¦è¿è¡Œåœ¨ ğğ¥ğğœğ•ğŸğ æˆ– ğªğ¢ğ§ğ ğ¥ğ¨ğ§ğ  ç­‰å®šæ—¶é¢æ¿ï¼ŒåŒæ—¶æ”¯æŒç³»ç»Ÿè¿è¡Œç¯å¢ƒçš„ç­¾åˆ°é¡¹ç›®ï¼ˆç¯å¢ƒï¼šğ‘·ğ’šğ’•ğ’‰ğ’ğ’ 3.8+ / ğ‘µğ’ğ’…ğ’†.ğ’‹ğ’” 10+ / ğ‘©ğ’‚ğ’”ğ’‰ 4+ / ğ‘¶ğ’‘ğ’†ğ’ğ‘±ğ‘«ğ‘²8 / ğ‘·ğ’†ğ’“ğ’5ï¼‰,OreosLab,checkinpanel,https://github.com/OreosLab/checkinpanel
2022-11-24,perl,212,0,Spec and test data for the MaxMind DB file format,maxmind,MaxMind-DB,https://github.com/maxmind/MaxMind-DB
2022-11-24,perl,314,0,RegRipper3.0,keydet89,RegRipper3.0,https://github.com/keydet89/RegRipper3.0
2022-11-24,perl,240,0,KH Coder: for Quantitative Content Analysis or Text Mining,ko-ichi-h,khcoder,https://github.com/ko-ichi-h/khcoder
2022-11-24,perl,823,0,"Ora2Pg is a free tool used to migrate an Oracle database to a PostgreSQL compatible schema. It connects your Oracle database, scan it automatically and extracts its structure or data, it then generates SQL scripts that you can load into PostgreSQL.",darold,ora2pg,https://github.com/darold/ora2pg
2022-11-24,perl,350,0,The Ensembl Variant Effect Predictor predicts the functional effects of genomic variants,Ensembl,ensembl-vep,https://github.com/Ensembl/ensembl-vep
2022-11-24,perl,2840,5,A fast PostgreSQL Log Analyzer,darold,pgbadger,https://github.com/darold/pgbadger
2022-11-24,perl,613,1,LCOV,linux-test-project,lcov,https://github.com/linux-test-project/lcov
2022-11-24,perl,190,0,BRAKER is a pipeline for fully automated prediction of protein coding gene structures with GeneMark-ES/ET and AUGUSTUS in novel eukaryotic genomes,Gaius-Augustus,BRAKER,https://github.com/Gaius-Augustus/BRAKER
2022-11-24,perl,1,0,,ribasushi,patchup-Perl5-DBD-InterBase,https://github.com/ribasushi/patchup-Perl5-DBD-InterBase
2022-11-24,perl,1048,0,"PacketFence is a fully supported, trusted, Free and Open Source network access control (NAC) solution. Boasting an impressive feature set including a captive-portal for registration and remediation, centralized wired and wireless management, powerful BYOD management options, 802.1X support, layer-2 isolation of problematic devices; PacketFence câ€¦",inverse-inc,packetfence,https://github.com/inverse-inc/packetfence
2022-11-24,perl,1531,1,The Perl programming language,Perl,perl5,https://github.com/Perl/perl5
2022-11-24,perl,2375,0,OWASP ModSecurity Core Rule Set (CRS) Project (Official Repository),SpiderLabs,owasp-modsecurity-crs,https://github.com/SpiderLabs/owasp-modsecurity-crs
2022-11-24,perl,15,0,Qt QA Scripts,qt,qtqa,https://github.com/qt/qtqa
2022-11-24,perl,605,0,Rapid prokaryotic genome annotation,tseemann,prokka,https://github.com/tseemann/prokka