date,language,stargazers,starsToday,description,owner,name,url
2023-07-24,css,3158,5,Master the creation of Modern UX/UI Websites,adrianhajdin,project_modern_ui_ux_gpt3,https://github.com/adrianhajdin/project_modern_ui_ux_gpt3
2023-07-24,css,4388,3,,safak,youtube,https://github.com/safak/youtube
2023-07-24,css,5141,8,Accurately Locate Smartphones using Social Engineering,thewhiteh4t,seeker,https://github.com/thewhiteh4t/seeker
2023-07-24,css,29527,14,"50+ mini web projects using HTML, CSS & JS",bradtraversy,50projects50days,https://github.com/bradtraversy/50projects50days
2023-07-24,css,13,0,,saarthack,sidcup-family-golf,https://github.com/saarthack/sidcup-family-golf
2023-07-24,css,2505,7,gpt4all chatbot ui,ParisNeo,lollms-webui,https://github.com/ParisNeo/lollms-webui
2023-07-24,css,7423,4,A list of public penetration test reports published by several consulting firms and academic security groups.,juliocesarfort,public-pentesting-reports,https://github.com/juliocesarfort/public-pentesting-reports
2023-07-24,css,1448,0,Python example app from the OpenAI API quickstart tutorial,openai,openai-quickstart-python,https://github.com/openai/openai-quickstart-python
2023-07-24,css,5792,9,"ç»æµå­¦äºº(å«éŸ³é¢‘)ã€çº½çº¦å®¢ã€å«æŠ¥ã€è¿çº¿ã€å¤§è¥¿æ´‹æœˆåˆŠç­‰è‹±è¯­æ‚å¿—å…è´¹ä¸‹è½½,æ”¯æŒepubã€mobiã€pdfæ ¼å¼, æ¯å‘¨æ›´æ–°",hehonghui,awesome-english-ebooks,https://github.com/hehonghui/awesome-english-ebooks
2023-07-24,css,2641,3,A minimal Jekyll Theme to host your resume (CV),sharu725,online-cv,https://github.com/sharu725/online-cv
2023-07-24,css,743,1,,john-smilga,react-course-v3,https://github.com/john-smilga/react-course-v3
2023-07-24,css,1832,3,Setup A Beautiful Desktop/GUI In Termux,adi1090x,termux-desktop,https://github.com/adi1090x/termux-desktop
2023-07-24,css,1079,1,SSH Panel User Management,Alirezad07,X-Panel-SSH-User-Management,https://github.com/Alirezad07/X-Panel-SSH-User-Management
2023-07-24,css,9581,1,A curated collection of all country flags in SVG â€” plus the CSS for easier integration,lipis,flag-icons,https://github.com/lipis/flag-icons
2023-07-24,css,883,1,Personal theme for Obsidian,AnubisNekhet,AnuPpuccin,https://github.com/AnubisNekhet/AnuPpuccin
2023-07-24,css,6668,3,A sample Spring-based application,spring-projects,spring-petclinic,https://github.com/spring-projects/spring-petclinic
2023-07-24,css,5012,4,Awesome stuff for Obsidian,kmaasrud,awesome-obsidian,https://github.com/kmaasrud/awesome-obsidian
2023-07-24,css,95,0,"A cold, dark & frosty theme.",DiscordStyles,DarkMatter,https://github.com/DiscordStyles/DarkMatter
2023-07-24,css,4186,2,"Starter files, final projects and FAQ for my Advanced CSS course",jonasschmedtmann,advanced-css-course,https://github.com/jonasschmedtmann/advanced-css-course
2023-07-24,css,12454,15,The simplest way to run LLaMA on your local machine,cocktailpeanut,dalai,https://github.com/cocktailpeanut/dalai
2023-07-24,css,11,0,,firtman,coffeemasters-vanilla,https://github.com/firtman/coffeemasters-vanilla
2023-07-24,css,21,24,FiSDK is an API toolkit developed by Fintechee for managing and controlling the backend of the Fintechee trading platform.,fintechees,FiSDK,https://github.com/fintechees/FiSDK
2023-07-24,css,1611,1,"ğŸªº A simple, clean, customizable Hugo theme",nanxiaobei,hugo-paper,https://github.com/nanxiaobei/hugo-paper
2023-07-24,css,1616,1,"Responsive Portfolio Website Using HTML, CSS & JavaScript",bedimcode,responsive-portfolio-website-Alexa,https://github.com/bedimcode/responsive-portfolio-website-Alexa
2023-07-24,css,439,4,ewwwwwwwwwwwwwww,end-4,dots-hyprland,https://github.com/end-4/dots-hyprland