date,language,stargazers,starsToday,description,owner,name,url
2022-08-11,perl,0,0,identidad visual de firefox,inaes-tic,pkg-firefox,https://github.com/inaes-tic/pkg-firefox
2022-08-11,perl,382,1,Movable Type,movabletype,movabletype,https://github.com/movabletype/movabletype
2022-08-11,perl,783,1,"Ora2Pg is a free tool used to migrate an Oracle database to a PostgreSQL compatible schema. It connects your Oracle database, scan it automatically and extracts its structure or data, it then generates SQL scripts that you can load into PostgreSQL.",darold,ora2pg,https://github.com/darold/ora2pg
2022-08-11,perl,2,0,Perl interface to the Beeminder API,letolabs,WWW-Beeminder,https://github.com/letolabs/WWW-Beeminder
2022-08-11,perl,656,0,Trinity RNA-Seq de novo transcriptome assembly,trinityrnaseq,trinityrnaseq,https://github.com/trinityrnaseq/trinityrnaseq
2022-08-11,perl,251,1,"The Open Charge Point Interface (OCPI) allows for a scalable, automated roaming setup between Charge Point Operators and e-Mobility Service Providers. It supports authorisation, charge point information exchange (incl transaction events), charge detail record exchange and finally, the exchange of smart-charging commands between parties.",ocpi,ocpi,https://github.com/ocpi/ocpi
2022-08-11,perl,7,1,A simple script that controlls MPlayer with a Hercules DJ Control MP3 - a USB MIDI controller,goblin,hercules_controller,https://github.com/goblin/hercules_controller
2022-08-11,perl,330,0,"A wrapper around Cutadapt and FastQC to consistently apply adapter and quality trimming to FastQ files, with extra functionality for RRBS data",FelixKrueger,TrimGalore,https://github.com/FelixKrueger/TrimGalore
2022-08-11,perl,14527,8,"cloc counts blank lines, comment lines, and physical lines of source code in many programming languages.",AlDanial,cloc,https://github.com/AlDanial/cloc
2022-08-11,perl,94,0,FreeRDP Manuals,awakecoding,FreeRDP-Manuals,https://github.com/awakecoding/FreeRDP-Manuals
2022-08-11,perl,26,0,Nginx C module to allow deeper control of Nginx behaviors by Kong Lua code,Kong,lua-kong-nginx-module,https://github.com/Kong/lua-kong-nginx-module
2022-08-11,perl,0,0,Wraps Test::Pod::Coverage to support undocumented subs and statistics on changed coverage,binary-com,perl-Test-Pod-CoverageChange,https://github.com/binary-com/perl-Test-Pod-CoverageChange
2022-08-11,perl,326,0,The Ensembl Variant Effect Predictor predicts the functional effects of genomic variants,Ensembl,ensembl-vep,https://github.com/Ensembl/ensembl-vep
2022-08-11,perl,62,0,GLPI Agent,glpi-project,glpi-agent,https://github.com/glpi-project/glpi-agent
2022-08-11,perl,228,0,FusionInventory Agent,fusioninventory,fusioninventory-agent,https://github.com/fusioninventory/fusioninventory-agent
2022-08-11,perl,13376,7,Stack trace visualizer,brendangregg,FlameGraph,https://github.com/brendangregg/FlameGraph
2022-08-11,perl,758,0,Ásbrú Connection Manager is a user interface that helps organizing remote terminal sessions and automating repetitive tasks.,asbru-cm,asbru-cm,https://github.com/asbru-cm/asbru-cm
2022-08-11,perl,275,0,Collection of standard plugins to discover and gather cloud-to-edge metrics and status across your whole IT infrastructure.,centreon,centreon-plugins,https://github.com/centreon/centreon-plugins
2022-08-11,perl,1401,1,Th3Inspector  Best Tool For Information Gathering,Moham3dRiahi,Th3inspector,https://github.com/Moham3dRiahi/Th3inspector
2022-08-11,perl,1,0,MTA weekly report scripts.,chandra-mta,Weekly_report,https://github.com/chandra-mta/Weekly_report
2022-08-11,perl,207,0,Spec and test data for the MaxMind DB file format,maxmind,MaxMind-DB,https://github.com/maxmind/MaxMind-DB
2022-08-11,perl,7646,2,MySQLTuner is a script written in Perl that will assist you with your MySQL configuration and make recommendations for increased performance and stability.,major,MySQLTuner-perl,https://github.com/major/MySQLTuner-perl
2022-08-11,perl,4070,1,"Git-it is a (Mac, Win, Linux) Desktop App for Learning Git and GitHub",jlord,git-it-electron,https://github.com/jlord/git-it-electron
2022-08-11,perl,584,1,Rapid prokaryotic genome annotation,tseemann,prokka,https://github.com/tseemann/prokka
2022-08-11,perl,2030,6,An open-source digital image forensic toolset,GuidoBartoli,sherloq,https://github.com/GuidoBartoli/sherloq