date,language,stargazers,starsToday,description,owner,name,url
2024-05-14,scala,38494,13,Apache Spark - A unified analytics engine for large-scale data processing,apache,spark,https://github.com/apache/spark
2024-05-14,scala,14669,6,"♞ lichess.org: the forever free, adless and open source chess server ♞",lichess-org,lila,https://github.com/lichess-org/lila
2024-05-14,scala,61458,10,Source code for Twitter's Recommendation Algorithm,twitter,the-algorithm,https://github.com/twitter/the-algorithm
2024-05-14,scala,3997,2,"ZIO — A type-safe, composable library for async and concurrent programming in Scala",zio,zio,https://github.com/zio/zio
2024-05-14,scala,3741,2,Chisel: A Modern Hardware Design Language,chipsalliance,chisel,https://github.com/chipsalliance/chisel
2024-05-14,scala,4349,3,Open-source high-performance RISC-V processor,OpenXiangShan,XiangShan,https://github.com/OpenXiangShan/XiangShan
2024-05-14,scala,1535,0,Scala based HDL,SpinalHDL,SpinalHDL,https://github.com/SpinalHDL/SpinalHDL
2024-05-14,scala,1100,0,This is the github repo for Learning Spark: Lightning-Fast Data Analytics [2nd Edition],databricks,LearningSparkV2,https://github.com/databricks/LearningSparkV2
2024-05-14,scala,286,0,Functional Kafka Streams for Scala,fd4s,fs2-kafka,https://github.com/fd4s/fs2-kafka
2024-05-14,scala,1071,0,"Build highly concurrent, distributed, and resilient message-driven applications using Java/Scala",apache,pekko,https://github.com/apache/pekko
2024-05-14,scala,738,0,"A next-generation Scala framework for building scalable, correct, and efficient HTTP clients and servers",zio,zio-http,https://github.com/zio/zio-http
2024-05-14,scala,234,0,"Open, Modular, Deep Learning Accelerator",apache,tvm-vta,https://github.com/apache/tvm-vta
2024-05-14,scala,29,0,🇧🇷 Conversão Total para GTA San Andreas com foco numa estética verdadeiramente brasileira.,pulse-club,gta-brasil,https://github.com/pulse-club/gta-brasil
2024-05-14,scala,1,0,Experiment with ways to protect against CRSF attacks with playframework 2 and scala,yanns,play2-crsf-protection,https://github.com/yanns/play2-crsf-protection
2024-05-14,scala,1688,0,Compiler for the Vale programming language - http://vale.dev/,ValeLang,Vale,https://github.com/ValeLang/Vale
2024-05-14,scala,1949,1,Apache Kyuubi is a distributed and multi-tenant gateway to provide serverless SQL on data warehouses and lakehouses.,apache,kyuubi,https://github.com/apache/kyuubi
2024-05-14,scala,171,2,ECMAScript Specification (ECMA-262) Metalanguage,es-meta,esmeta,https://github.com/es-meta/esmeta
2024-05-14,scala,6941,4,"An open-source storage framework that enables building a Lakehouse architecture with compute engines including Spark, PrestoDB, Flink, Trino, and Hive and APIs",delta-io,delta,https://github.com/delta-io/delta
2024-05-14,scala,782,0,The Daml smart contract language,digital-asset,daml,https://github.com/digital-asset/daml
2024-05-14,scala,12933,1,"Build highly concurrent, distributed, and resilient message-driven applications on the JVM",akka,akka,https://github.com/akka/akka
2024-05-14,scala,357,1,🔫 Helps to snipe hard to get reservations at restaurants that use resy,Alkaar,resy-booking-bot,https://github.com/Alkaar/resy-booking-bot
2024-05-14,scala,3175,0,A simple client for Android,xxf098,shadowsocksr-v2ray-trojan-android,https://github.com/xxf098/shadowsocksr-v2ray-trojan-android
2024-05-14,scala,12503,3,The Community Maintained High Velocity Web Framework For Java and Scala.,playframework,playframework,https://github.com/playframework/playframework
2024-05-14,scala,1438,1,"An Agile RISC-V SoC Design Framework with in-order cores, out-of-order cores, accelerators, and more",ucb-bar,chipyard,https://github.com/ucb-bar/chipyard
2024-05-14,scala,623,1,Chronon is a data platform for serving for AI/ML applications.,airbnb,chronon,https://github.com/airbnb/chronon