date,language,stargazers,starsToday,description,owner,name,url
2024-11-25,r,330,1,R toolkit for the analysis of single-cell chromatin data,stuart-lab,signac,https://github.com/stuart-lab/signac
2024-11-25,r,844,0,Repository for Programming Assignment 2 for R Programming on Coursera,rdpeng,ProgrammingAssignment2,https://github.com/rdpeng/ProgrammingAssignment2
2024-11-25,r,2884,0,Dynamic Documents for R,rstudio,rmarkdown,https://github.com/rstudio/rmarkdown
2024-11-25,r,115,0,,r-lib,tree-sitter-r,https://github.com/r-lib/tree-sitter-r
2024-11-25,r,410,2,S7: a new OO system for R,RConsortium,S7,https://github.com/RConsortium/S7
2024-11-25,r,144,1,Produce PRISMA-2020 compliant flow diagrams,prisma-flowdiagram,PRISMA2020,https://github.com/prisma-flowdiagram/PRISMA2020
2024-11-25,r,6534,6,An implementation of the Grammar of Graphics in R,tidyverse,ggplot2,https://github.com/tidyverse/ggplot2