date,language,stargazers,starsToday,description,owner,name,url
2024-09-28,scala,7471,4,"An open-source storage framework that enables building a Lakehouse architecture with compute engines including Spark, PrestoDB, Flink, Trino, and Hive and APIs",delta-io,delta,https://github.com/delta-io/delta
2024-09-28,scala,4075,1,"ZIO — A type-safe, composable library for async and concurrent programming in Scala",zio,zio,https://github.com/zio/zio
2024-09-28,scala,1582,3,"An Agile RISC-V SoC Design Framework with in-order cores, out-of-order cores, accelerators, and more",ucb-bar,chipyard,https://github.com/ucb-bar/chipyard
2024-09-28,scala,14318,0,Scala 2 compiler and standard library. Scala 2 bugs at https://github.com/scala/bug; Scala 3 at https://github.com/scala/scala3,scala,scala,https://github.com/scala/scala
2024-09-28,scala,3820,1,State of the Art Natural Language Processing,JohnSnowLabs,spark-nlp,https://github.com/JohnSnowLabs/spark-nlp
2024-09-28,scala,39378,3,Apache Spark - A unified analytics engine for large-scale data processing,apache,spark,https://github.com/apache/spark
2024-09-28,scala,1152,0,Gluten is a middle layer responsible for offloading JVM-based SQL engines' execution to native engines.,apache,incubator-gluten,https://github.com/apache/incubator-gluten
2024-09-28,scala,3178,1,Rocket Chip Generator,chipsalliance,rocket-chip,https://github.com/chipsalliance/rocket-chip
2024-09-28,scala,42,0,workbench identity and access management,broadinstitute,sam,https://github.com/broadinstitute/sam
2024-09-28,scala,752,1,An open protocol for secure data sharing,delta-io,delta-sharing,https://github.com/delta-io/delta-sharing
2024-09-28,scala,13034,5,"Build highly concurrent, distributed, and resilient message-driven applications on the JVM",akka,akka,https://github.com/akka/akka
2024-09-28,scala,287,0,,ucb-bar,berkeley-hardfloat,https://github.com/ucb-bar/berkeley-hardfloat
2024-09-28,scala,3930,2,Chisel: A Modern Hardware Design Language,chipsalliance,chisel,https://github.com/chipsalliance/chisel
2024-09-28,scala,2077,1,Apache Kyuubi is a distributed and multi-tenant gateway to provide serverless SQL on data warehouses and lakehouses.,apache,kyuubi,https://github.com/apache/kyuubi
2024-09-28,scala,2546,0,"A minimal, idiomatic Scala interface for HTTP",http4s,http4s,https://github.com/http4s/http4s
2024-09-28,scala,1997,0,Open-source code analysis platform for C/C++/Java/Binary/Javascript/Python/Kotlin based on code property graphs. Discord https://discord.gg/vv4MH284Hc,joernio,joern,https://github.com/joernio/joern
2024-09-28,scala,4795,1,"sbt, the interactive build tool",sbt,sbt,https://github.com/sbt/sbt
2024-09-28,scala,5822,1,"The Scala 3 compiler, also known as Dotty.",scala,scala3,https://github.com/scala/scala3
2024-09-28,scala,4729,1,Open-source high-performance RISC-V processor,OpenXiangShan,XiangShan,https://github.com/OpenXiangShan/XiangShan