date,language,stargazers,starsToday,description,owner,name,url
2024-09-28,svelte,5190,13,"Database manager for MySQL, PostgreSQL, SQL Server, MongoDB, SQLite and others. Runs under Windows, Linux, Mac or as web application",dbgate,dbgate,https://github.com/dbgate/dbgate
2024-09-28,svelte,1228,2,Full-sized drag & drop JavaScript event calendar with resource & timeline views,vkurko,calendar,https://github.com/vkurko/calendar
2024-09-28,svelte,1403,1,Plain text project planning in Obsidian,marcusolsson,obsidian-projects,https://github.com/marcusolsson/obsidian-projects
2024-09-28,svelte,1973,1,"Primo is a visual CMS with a built-in code editor, Svelte blocks, and static site generator.",primocms,primo,https://github.com/primocms/primo
2024-09-28,svelte,4912,3,"A complete design system and component solution, built on Tailwind.",skeletonlabs,skeleton,https://github.com/skeletonlabs/skeleton
2024-09-28,svelte,1018,2,"A lightweight, self-hosted friendly RSS aggregator and reader",0x2E,fusion,https://github.com/0x2E/fusion
2024-09-28,svelte,4986,7,"shadcn/ui, but for Svelte. ✨",huntabyte,shadcn-svelte,https://github.com/huntabyte/shadcn-svelte
2024-09-28,svelte,1011,0,Syntax Podcast Website,syntaxfm,website,https://github.com/syntaxfm/website
2024-09-28,svelte,2098,1,"A modern, easy-to-use and performant custom Home Assistant dashboard",matt8707,ha-fusion,https://github.com/matt8707/ha-fusion
2024-09-28,svelte,33333,12,"🌼 🌼 🌼 🌼 🌼  The most popular, free and open-source Tailwind CSS component library",saadeghi,daisyui,https://github.com/saadeghi/daisyui
2024-09-28,svelte,2130,1,Official Svelte components built for Flowbite and Tailwind CSS,themesberg,flowbite-svelte,https://github.com/themesberg/flowbite-svelte
2024-09-28,svelte,515,0,A soup-to-nuts interactive tutorial on how to build apps with Svelte,sveltejs,learn.svelte.dev,https://github.com/sveltejs/learn.svelte.dev
2024-09-28,svelte,2397,4,3D framework for Svelte,threlte,threlte,https://github.com/threlte/threlte
2024-09-28,svelte,4535,0,A based rollup. 🥁 🌸,taikoxyz,taiko-mono,https://github.com/taikoxyz/taiko-mono
2024-09-28,svelte,2443,4,"Bittorrent streaming software for cats. Stream anime torrents, real-time with no waiting for downloads.",ThaUnknown,miru,https://github.com/ThaUnknown/miru
2024-09-28,svelte,219,0,Create a custom league page for your Sleeper fantasy football league!,nmelhado,league-page,https://github.com/nmelhado/league-page
2024-09-28,svelte,1845,1,ChatGPT web interface using the OpenAI API,Niek,chatgpt-web,https://github.com/Niek/chatgpt-web
2024-09-28,svelte,322,0,The Console that makes Appwrite tick from the browser 🖥,appwrite,console,https://github.com/appwrite/console
2024-09-28,svelte,742,5,"A new local-first, privacy-focused and open-source home for your markdown notes",chroxify,haptic,https://github.com/chroxify/haptic