date,language,stargazers,starsToday,description,owner,name,url
2023-01-26,svelte,80,0,"Frontend components, documentation and information hosted on the Hugging Face website.",huggingface,hub-docs,https://github.com/huggingface/hub-docs
2023-01-26,svelte,882,1,"Svelte ecommerce - Headless, Authentication, Cart & Checkout, TailwindCSS, Server Rendered, Proxy + API Integrated, Animations, Lazy Loading, Loading Indicators, Carousel, Instant Search, Faceted Filters, Open Source",itswadesh,svelte-commerce,https://github.com/itswadesh/svelte-commerce
2023-01-26,svelte,2806,2,Svelte Material UI Components,hperrin,svelte-material-ui,https://github.com/hperrin/svelte-material-ui
2023-01-26,svelte,2574,2,Build and ship your app faster https://fireship.io,fireship-io,fireship.io,https://github.com/fireship-io/fireship.io
2023-01-26,svelte,1,0,Calculadora de promedios de la espol,Xidrovo,calculadoraESPOL,https://github.com/Xidrovo/calculadoraESPOL
2023-01-26,svelte,261,2,Issue-Crawler for GitHub based on Sveltekit,EddieHubCommunity,good-first-issue-finder,https://github.com/EddieHubCommunity/good-first-issue-finder
2023-01-26,svelte,452,1,Awesome examples of SvelteKit in the wild,janosh,awesome-sveltekit,https://github.com/janosh/awesome-sveltekit
2023-01-26,svelte,1087,15,A fully featured UI toolkit for Svelte + Tailwind.,skeletonlabs,skeleton,https://github.com/skeletonlabs/skeleton
2023-01-26,svelte,109,1,Example showing how to use Auth.js with SvelteKit.,nextauthjs,sveltekit-auth-example,https://github.com/nextauthjs/sveltekit-auth-example
2023-01-26,svelte,616,0,A web frontend for the headscale Tailscale-compatible coordination server,gurucomputing,headscale-ui,https://github.com/gurucomputing/headscale-ui
2023-01-26,svelte,630,4,"Rill is a tool for effortlessly transforming data sets into powerful, opinionated dashboards using SQL. BI-as-code.",rilldata,rill-developer,https://github.com/rilldata/rill-developer
2023-01-26,svelte,756,3,graphics framework for sveltejs,mhkeller,layercake,https://github.com/mhkeller/layercake
2023-01-26,svelte,62,2,Run primo on your own server to use it from anywhere & invite collaborators,primodotso,primo-server,https://github.com/primodotso/primo-server
2023-01-26,svelte,423,1,This repository shows how Svelte and SvelteKit work together with TypeScript.,ivanhofer,sveltekit-typescript-showcase,https://github.com/ivanhofer/sveltekit-typescript-showcase
2023-01-26,svelte,638,6,A three.js component library for Svelte.,threlte,threlte,https://github.com/threlte/threlte
2023-01-26,svelte,240,0,Self-hosted file server,machengim,oasis,https://github.com/machengim/oasis
2023-01-26,svelte,107,0,Static status page website for Upptime,upptime,status-page,https://github.com/upptime/status-page
2023-01-26,svelte,1954,4,Svelte implementation of the Carbon Design System,carbon-design-system,carbon-components-svelte,https://github.com/carbon-design-system/carbon-components-svelte
2023-01-26,svelte,417,0,The official IOTA and Shimmer wallet,iotaledger,firefly,https://github.com/iotaledger/firefly
2023-01-26,svelte,1809,2,SvelteKit implementation of the RealWorld app,sveltejs,realworld,https://github.com/sveltejs/realworld
2023-01-26,svelte,520,3,Official Svelte components built for Flowbite and Tailwind CSS,themesberg,flowbite-svelte,https://github.com/themesberg/flowbite-svelte
2023-01-26,svelte,2087,3,"Database manager for MySQL, PostgreSQL, SQL Server, MongoDB, SQLite and others. Runs under Windows, Linux, Mac or as web application",dbgate,dbgate,https://github.com/dbgate/dbgate
2023-01-26,svelte,5509,11,An open-source & self-hostable Heroku / Netlify alternative.,coollabsio,coolify,https://github.com/coollabsio/coolify
2023-01-26,svelte,1258,3,Unofficial Svelte port of the Headless UI component library,rgossiaux,svelte-headlessui,https://github.com/rgossiaux/svelte-headlessui
2023-01-26,svelte,1789,2,"Isolate vocals, drums, bass, and other instrumental stems from any song",stemrollerapp,stemroller,https://github.com/stemrollerapp/stemroller