date,language,stargazers,starsToday,description,owner,name,url
2023-08-28,astro,42866,2,AdminLTE - Free admin dashboard template based on Bootstrap 5,ColorlibHQ,AdminLTE,https://github.com/ColorlibHQ/AdminLTE
2023-08-28,astro,1242,3,⭕️ AstroWind: A free template using Astro 2.0 and Tailwind CSS. Astro starter theme.,onwidget,astrowind,https://github.com/onwidget/astrowind
2023-08-28,astro,350,2,🚀 Begin building your very own Notion Blog with Astro.,otoyo,astro-notion-blog,https://github.com/otoyo/astro-notion-blog
2023-08-28,astro,36,0,A bare-bones Astro template to get you deployed to Netlify fast!,netlify-templates,astro-quickstart,https://github.com/netlify-templates/astro-quickstart
2023-08-28,astro,44,1,Portfolio with a blog part built with Astro,MaeWolff,astro-portfolio-template,https://github.com/MaeWolff/astro-portfolio-template
2023-08-28,astro,389,1,Pruebas técnicas donde la comunidad participa con sus soluciones,midudev,pruebas-tecnicas,https://github.com/midudev/pruebas-tecnicas
2023-08-28,astro,8,0,,benphelps,homepage-docs,https://github.com/benphelps/homepage-docs
2023-08-28,astro,22,0,Free and open source self-hosting serverless podcast solution,manuelernestog,astropod,https://github.com/manuelernestog/astropod
2023-08-28,astro,3239,5,Next version of roadmap.sh,roadmapsh,next.roadmap.sh,https://github.com/roadmapsh/next.roadmap.sh
2023-08-28,astro,334,1,"Astrofy is a free and open-source template for your Personal Portfolio Website built with Astro and TailwindCSS. Create in minutes a website with Blog, CV, Project Section, Store and RSS Feed.",manuelernestog,astrofy,https://github.com/manuelernestog/astrofy
2023-08-28,astro,994,0,"A minimal, accessible and SEO-friendly Astro blog theme",satnaing,astro-paper,https://github.com/satnaing/astro-paper
2023-08-28,astro,295,0,An Astro + Tailwind CSS Example/Template for Landing Pages,mhyfritz,astro-landing-page,https://github.com/mhyfritz/astro-landing-page
2023-08-28,astro,525,1,Makes it easy to add information that is relevant for SEO to your Astro app.,jonasmerlin,astro-seo,https://github.com/jonasmerlin/astro-seo
2023-08-28,astro,330,1,A modern business marketing website theme/starter built with Astro 🚀,littlesticks,odyssey-theme,https://github.com/littlesticks/odyssey-theme
2023-08-28,astro,318,1,A simple Astro theme. Use it to create your blog or website.,chrismwilliams,astro-theme-cactus,https://github.com/chrismwilliams/astro-theme-cactus