date,language,stargazers,starsToday,description,owner,name,url
2023-08-01,shell,55911,412,Everything required to run your own Base node,base-org,node,https://github.com/base-org/node
2023-08-01,shell,23441,7,"I am using this repository to document my journey learning about DevOps. I began this process on January 1, 2022, and plan to continue until March 31. I will be dedicating one hour each day, including weekends, to gaining a foundational understanding of the various aspects of DevOps. This will be a 90-day intensive study period. 2022 & 2023 inc.",MichaelCade,90DaysOfDevOps,https://github.com/MichaelCade/90DaysOfDevOps
2023-08-01,shell,571,5,"// Aesthetic, dynamic and minimal dots for Arch hyprland",prasanthrangan,hyprdots,https://github.com/prasanthrangan/hyprdots
2023-08-01,shell,1755,4,,vcheckzen,KeepAliveE5,https://github.com/vcheckzen/KeepAliveE5
2023-08-01,shell,42999,3,A black hole for Internet advertisements,pi-hole,pi-hole,https://github.com/pi-hole/pi-hole
2023-08-01,shell,1683,128,"1000+ DevOps Bash Scripts - AWS, GCP, Kubernetes, Docker, CI/CD, APIs, SQL, PostgreSQL, MySQL, Hive, Impala, Kafka, Hadoop, Jenkins, GitHub, GitLab, BitBucket, Azure DevOps, TeamCity, Spotify, MP3, LDAP, Code/Build Linting, pkg mgmt for Linux, Mac, Python, Perl, Ruby, NodeJS, Golang, Advanced dotfiles: .bashrc, .vimrc, .gitconfig, .screenrc, tmux..",HariSekhon,DevOps-Bash-tools,https://github.com/HariSekhon/DevOps-Bash-tools
2023-08-01,shell,930,12,ReVanced eXtended YT and YT-M for both root and non-root users.,NoName-exe,revanced-extended,https://github.com/NoName-exe/revanced-extended
2023-08-01,shell,1829,3,,G33kzD3n,Catalogue,https://github.com/G33kzD3n/Catalogue
2023-08-01,shell,1107,3,"Support for OpenWrt in Amlogic, Rockchip and Allwinner boxes. Support a311d, s922x, s905x3, s905x2, s912, s905d, s905x, s905w, s905, s905l, rk3588, rk3568, rk3399, rk3328, h6, etc.",ophub,amlogic-s9xxx-openwrt,https://github.com/ophub/amlogic-s9xxx-openwrt
2023-08-01,shell,6767,5,Pi-hole in a docker container,pi-hole,docker-pi-hole,https://github.com/pi-hole/docker-pi-hole
2023-08-01,shell,31058,11,Run macOS VM in a Docker! Run near native OSX-KVM in Docker! X11 Forwarding! CI/CD for OS X Security Research! Docker mac Containers.,sickcodes,Docker-OSX,https://github.com/sickcodes/Docker-OSX
2023-08-01,shell,10864,7,A Clash Client For OpenWrt,vernesong,OpenClash,https://github.com/vernesong/OpenClash
2023-08-01,shell,22396,6,"Scripts to build your own IPsec VPN server, with IPsec/L2TP, Cisco IPsec and IKEv2",hwdsl2,setup-ipsec-vpn,https://github.com/hwdsl2/setup-ipsec-vpn
2023-08-01,shell,4897,7,Automated Redpill Loader,fbelavenuto,arpl,https://github.com/fbelavenuto/arpl
2023-08-01,shell,6980,2,Docker image that provides a Minecraft Server that will automatically download selected version at startup,itzg,docker-minecraft-server,https://github.com/itzg/docker-minecraft-server
2023-08-01,shell,3467,3,ğŸ”° Home Assistant Operating System,home-assistant,operating-system,https://github.com/home-assistant/operating-system
2023-08-01,shell,2071,16,Run Windows Subsystem For Android on your Windows 10 and Windows 11 PC using prebuilt binaries with Google Play Store (OpenGApps/ MindTheGapps) and/or Magisk or KernelSU (root solutions) built in.,MustardChef,WSABuilds,https://github.com/MustardChef/WSABuilds
2023-08-01,shell,7103,12,Integrate Magisk root and Google Apps into WSA (Windows Subsystem for Android),LSPosed,MagiskOnWSALocal,https://github.com/LSPosed/MagiskOnWSALocal
2023-08-01,shell,5126,15,Proxmox VE Helper Scripts,tteck,Proxmox,https://github.com/tteck/Proxmox
2023-08-01,shell,29,2,The only revancify,decipher3114,Revancify,https://github.com/decipher3114/Revancify
2023-08-01,shell,10803,2,A package build system for Termux.,termux,termux-packages,https://github.com/termux/termux-packages
2023-08-01,shell,9732,9,VLESS(TCP_Visionã€Realityã€gRPCã€WS)ã€VMess(WS)ã€Trojan(TCPã€gRPC)ã€Hysteriaã€Tuic å…«åˆä¸€å…±å­˜è„šæœ¬,mack-a,v2ray-agent,https://github.com/mack-a/v2ray-agent
2023-08-01,shell,1234,1,è‰¯å¿ƒçš„ Python æ•™ç¨‹ï¼Œé¢å‘é›¶åŸºç¡€åˆå­¦è€…ç®€æ˜æ˜“æ‡‚çš„ Python3 å…¥é—¨åŸºç¡€è¯¾ç¨‹ã€‚åœ¨linux+vimç”Ÿäº§åŠ›ç¯å¢ƒä¸‹ï¼Œä»æµ…å…¥æ·±ï¼Œä»ç®€å•ç¨‹åºå­¦åˆ°ç½‘ç»œçˆ¬è™«ã€‚å¯ä»¥é…åˆè“æ¡¥äº‘ä¸Šå®éªŒç¯å¢ƒæ“ä½œã€‚,overmind1980,oeasy-python-tutorial,https://github.com/overmind1980/oeasy-python-tutorial
2023-08-01,shell,75362,22,Papers from the computer science community to read and discuss.,papers-we-love,papers-we-love,https://github.com/papers-we-love/papers-we-love
2023-08-01,shell,4031,1,åŸºäºã€è…¾è®¯äº‘å‡½æ•°ã€‘/ã€Dockerã€‘/ã€é’é¾™é¢æ¿ã€‘/ã€elecV2Pã€‘/ã€ç¾¤æ™–ã€‘çš„æ¯æ—¥ç­¾åˆ°è„šæœ¬ï¼ˆæ”¯æŒå¤šè´¦å·ä½¿ç”¨ï¼‰ç­¾åˆ°åˆ—è¡¨: ï½œçˆ±å¥‡è‰ºï½œå…¨æ°‘Kæ­Œï½œæœ‰é“äº‘ç¬”è®°ï½œç™¾åº¦è´´å§ï½œBilibiliï½œV2EXï½œAcFunï½œå¤©ç¿¼äº‘ç›˜ï½œFaç±³å®¶ï½œå°ç±³è¿åŠ¨ï½œç™¾åº¦æœç´¢èµ„æºå¹³å°ï½œ,Sitoi,dailycheckin,https://github.com/Sitoi/dailycheckin