date,language,stargazers,starsToday,description,owner,name,url
2024-07-08,perl,2497,1,"A terminal for iOS, with multiple windows",holzschu,a-shell,https://github.com/holzschu/a-shell
2024-07-08,perl,8117,1,Nikto web server scanner,sullo,nikto,https://github.com/sullo/nikto
2024-07-08,perl,1881,0,🐪 The Perl programming language,Perl,perl5,https://github.com/Perl/perl5
2024-07-08,perl,909,1,"Request Tracker, an enterprise-grade issue tracking system",bestpractical,rt,https://github.com/bestpractical/rt
2024-07-08,perl,2208,1,Ddclient updates dynamic DNS entries for accounts on a wide range of dynamic DNS services.,ddclient,ddclient,https://github.com/ddclient/ddclient
2024-07-08,perl,2915,0,,ThePrimeagen,.dotfiles,https://github.com/ThePrimeagen/.dotfiles
2024-07-08,perl,1098,0,Server for Squeezebox and compatible players. This server is also called Lyrion Music Server.,LMS-Community,slimserver,https://github.com/LMS-Community/slimserver
2024-07-08,perl,167,0,"zm-build for Zimbra Collaboration Suite, FOSS Edition",Zimbra,zm-build,https://github.com/Zimbra/zm-build
2024-07-08,perl,241,0,"OTOBO is one of the most flexible web-based ticketing systems used for Customer Service, Help Desk, IT Service Management. https://otobo.io/",RotherOSS,otobo,https://github.com/RotherOSS/otobo
2024-07-08,perl,1256,0,A free/open source client and automation tool for Ragnarok Online,OpenKore,openkore,https://github.com/OpenKore/openkore
2024-07-08,perl,2075,2,Web application for archival and reading of manga/doujinshi. Lightweight and Docker-ready for NAS/servers.,Difegue,LANraragi,https://github.com/Difegue/LANraragi
2024-07-08,perl,8760,1,MySQLTuner is a script written in Perl that will assist you with your MySQL configuration and make recommendations for increased performance and stability.,major,MySQLTuner-perl,https://github.com/major/MySQLTuner-perl
2024-07-08,perl,17180,1,Good-lookin' diffs. Actually… nah… The best-lookin' diffs. 🎉,so-fancy,diff-so-fancy,https://github.com/so-fancy/diff-so-fancy
2024-07-08,perl,133,0,FreeRDP Manuals,awakecoding,FreeRDP-Manuals,https://github.com/awakecoding/FreeRDP-Manuals