date,language,stargazers,starsToday,description,owner,name,url
2022-09-06,perl,4089,0,"Git-it is a (Mac, Win, Linux) Desktop App for Learning Git and GitHub",jlord,git-it-electron,https://github.com/jlord/git-it-electron
2022-09-06,perl,787,1,Server for Logitech Squeezebox players. This server is also called Logitech Media Server,Logitech,slimserver,https://github.com/Logitech/slimserver
2022-09-06,perl,1432,0,The Perl programming language,Perl,perl5,https://github.com/Perl/perl5
2022-09-06,perl,1,0,My bash scripts,matalangilbert,mats-bash-scripts,https://github.com/matalangilbert/mats-bash-scripts
2022-09-06,perl,1870,0,Client for PPP+SSL VPN tunnel services,adrienverge,openfortivpn,https://github.com/adrienverge/openfortivpn
2022-09-06,perl,208,0,Spec and test data for the MaxMind DB file format,maxmind,MaxMind-DB,https://github.com/maxmind/MaxMind-DB
2022-09-06,perl,1703,0,A utility for downloading TV and radio programmes from BBC iPlayer and BBC Sounds,get-iplayer,get_iplayer,https://github.com/get-iplayer/get_iplayer
2022-09-06,perl,26,0,Nginx C module to allow deeper control of Nginx behaviors by Kong Lua code,Kong,lua-kong-nginx-module,https://github.com/Kong/lua-kong-nginx-module
2022-09-06,perl,1084,0,A free/open source client and automation tool for Ragnarok Online,OpenKore,openkore,https://github.com/OpenKore/openkore
2022-09-06,perl,1246,1,This is the new home for ddclient. Ddclient is a Perl client used to update dynamic DNS entries for accounts on 'Dynamic DNS Network Services' free DNS service. It currently supports a lot of different routers and a few different services.,ddclient,ddclient,https://github.com/ddclient/ddclient
2022-09-06,perl,1554,0,"The book documenting the curl project, the curl tool, libcurl and more. Simply put: everything curl.",bagder,everything-curl,https://github.com/bagder/everything-curl
2022-09-06,perl,307,0,,o0HalfLife0o,list,https://github.com/o0HalfLife0o/list
2022-09-06,perl,50,0,A multi-language tool which parses source code for function definitions and calls,koknat,callGraph,https://github.com/koknat/callGraph
2022-09-06,perl,2582,1,"a tool for backing up your data using rsync (if you want to get help, use https://lists.sourceforge.net/lists/listinfo/rsnapshot-discuss)",rsnapshot,rsnapshot,https://github.com/rsnapshot/rsnapshot
2022-09-06,perl,0,0,,binary-com,perl-Math-Business-Lookback,https://github.com/binary-com/perl-Math-Business-Lookback
2022-09-06,perl,0,0,,binary-com,perl-Finance-MIFIR-CONCAT,https://github.com/binary-com/perl-Finance-MIFIR-CONCAT
2022-09-06,perl,0,0,,binary-com,perl-Mojolicious-Plugin-ClientIP-Pluggable,https://github.com/binary-com/perl-Mojolicious-Plugin-ClientIP-Pluggable
2022-09-06,perl,3,0,Support for subscriptions and API interaction with blockchains such as BTC or ETH,binary-com,perl-Net-Async-Blockchain,https://github.com/binary-com/perl-Net-Async-Blockchain
2022-09-06,perl,1594,3,ExifTool meta information reader/writer,exiftool,exiftool,https://github.com/exiftool/exiftool
2022-09-06,perl,0,0,Address lookup and verification API,binary-com,perl-WebService-Async-SmartyStreets,https://github.com/binary-com/perl-WebService-Async-SmartyStreets
2022-09-06,perl,11,0,Development environment for Movable Type,movabletype,mt-dev,https://github.com/movabletype/mt-dev
2022-09-06,perl,0,0,Unofficial support for the customer.io API,binary-com,perl-WebService-Async-CustomerIO,https://github.com/binary-com/perl-WebService-Async-CustomerIO
2022-09-06,perl,6046,7,Nikto web server scanner,sullo,nikto,https://github.com/sullo/nikto
2022-09-06,perl,16,1,vMass Bot  Vulnerability Scanner & Auto Exploiter Tool Written in Perl.,c99tn,vMass,https://github.com/c99tn/vMass
2022-09-06,perl,2,0,A compat layer for migrating from ElasticSearch.pm to the new Elasticsearch.pm,elastic,elasticsearch-perl-compat,https://github.com/elastic/elasticsearch-perl-compat