date,language,stargazers,starsToday,description,owner,name,url
2023-02-19,scala,3716,1,"ZIO — A type-safe, composable library for async and concurrent programming in Scala",zio,zio,https://github.com/zio/zio
2023-02-19,scala,1485,0,Apache Kyuubi is a distributed and multi-tenant gateway to provide serverless SQL on data warehouses and lakehouses.,apache,kyuubi,https://github.com/apache/kyuubi
2023-02-19,scala,12608,1,"Build highly concurrent, distributed, and resilient message-driven applications on the JVM",akka,akka,https://github.com/akka/akka
2023-02-19,scala,11235,1,CMAK is a tool for managing Apache Kafka clusters,yahoo,CMAK,https://github.com/yahoo/CMAK
2023-02-19,scala,2663,0,"Deequ is a library built on top of Apache Spark for defining ""unit tests for data"", which measure data quality in large datasets.",awslabs,deequ,https://github.com/awslabs/deequ
2023-02-19,scala,9443,8,"Removes large or troublesome blobs like git-filter-branch does, but faster. And written in Scala",rtyley,bfg-repo-cleaner,https://github.com/rtyley/bfg-repo-cleaner
2023-02-19,scala,3100,0,State of the Art Natural Language Processing,JohnSnowLabs,spark-nlp,https://github.com/JohnSnowLabs/spark-nlp
2023-02-19,scala,743,0,Apache Livy is an open source REST interface for interacting with Apache Spark from anywhere.,apache,incubator-livy,https://github.com/apache/incubator-livy
2023-02-19,scala,1717,1,The pure asynchronous runtime for Scala,typelevel,cats-effect,https://github.com/typelevel/cats-effect
2023-02-19,scala,3916,2,Simple and Distributed Machine Learning,microsoft,SynapseML,https://github.com/microsoft/SynapseML
2023-02-19,scala,4,0,,ktoso,kanbanery-tv,https://github.com/ktoso/kanbanery-tv
2023-02-19,scala,1260,0,"LakeSoul is an end-to-end, realtime and cloud native Lakehouse framework with fast data ingestion, concurrent update and incremental data analytics on cloud storages for both BI and AI applications.",meta-soul,LakeSoul,https://github.com/meta-soul/LakeSoul
2023-02-19,scala,2515,1,Rocket Chip Generator,chipsalliance,rocket-chip,https://github.com/chipsalliance/rocket-chip
2023-02-19,scala,8486,1,"A fault tolerant, protocol-agnostic RPC system",twitter,finagle,https://github.com/twitter/finagle
2023-02-19,scala,35017,4,Apache Spark - A unified analytics engine for large-scale data processing,apache,spark,https://github.com/apache/spark
2023-02-19,scala,31,1,Scala client for OpenAI API,cequence-io,openai-scala-client,https://github.com/cequence-io/openai-scala-client
2023-02-19,scala,14020,2,"Scala 2 compiler and standard library. For bugs, see scala/bug",scala,scala,https://github.com/scala/scala
2023-02-19,scala,5823,2,Modern Load Testing as Code,gatling,gatling,https://github.com/gatling/gatling
2023-02-19,scala,7222,0,Snowflake is a network service for generating unique ID numbers at high scale with some simple guarantees.,twitter-archive,snowflake,https://github.com/twitter-archive/snowflake
2023-02-19,scala,79,20,,leisuremeta,leisuremeta-chain,https://github.com/leisuremeta/leisuremeta-chain
2023-02-19,scala,2922,0,Chisel 3: A Modern Hardware Design Language,chipsalliance,chisel3,https://github.com/chipsalliance/chisel3
2023-02-19,scala,1452,0,"Feathr – An Enterprise-Grade, High Performance Feature Store",feathr-ai,feathr,https://github.com/feathr-ai/feathr
2023-02-19,scala,5233,1,"The Scala 3 compiler, also known as Dotty.",lampepfl,dotty,https://github.com/lampepfl/dotty
2023-02-19,scala,12322,2,Play Framework,playframework,playframework,https://github.com/playframework/playframework
2023-02-19,scala,1397,0,"Alpakka Kafka connector - Alpakka is a Reactive Enterprise Integration library for Java and Scala, based on Reactive Streams and Akka.",akka,alpakka-kafka,https://github.com/akka/alpakka-kafka