date,language,stargazers,starsToday,description,owner,name,url
2023-05-13,astro,239241,97,"Interactive roadmaps, guides and other educational content to help developers grow in their careers.",kamranahmedse,developer-roadmap,https://github.com/kamranahmedse/developer-roadmap
2023-05-13,astro,2543,14,Next version of roadmap.sh,roadmapsh,next.roadmap.sh,https://github.com/roadmapsh/next.roadmap.sh
2023-05-13,astro,231,1,Begin building your very own Notion Blog with Astro.,otoyo,astro-notion-blog,https://github.com/otoyo/astro-notion-blog
2023-05-13,astro,267,0,A modern business marketing website theme/starter built with Astro,littlesticks,odyssey-theme,https://github.com/littlesticks/odyssey-theme
2023-05-13,astro,253,1,"An Accessible Starter Theme for Astro including accessibility features such as landmarks, better focus-outline and skip-links navigation. Ships with Tailwind, Prettier and ESLint support.",markteekman,accessible-astro-starter,https://github.com/markteekman/accessible-astro-starter
2023-05-13,astro,2476,1,A curated list of Open Source Mechanical Keyboard resources.,BenRoe,awesome-mechanical-keyboard,https://github.com/BenRoe/awesome-mechanical-keyboard
2023-05-13,astro,905,3,AstroWind: A free template using Astro 2.0 and Tailwind CSS.,onwidget,astrowind,https://github.com/onwidget/astrowind