date,language,stargazers,starsToday,description,owner,name,url
2023-08-07,vue,2712,6,The sleekest looking WEBUI for qBittorrent made with Vuejs!,WDaan,VueTorrent,https://github.com/WDaan/VueTorrent
2023-08-07,vue,12410,16,"A self-hostable personal dashboard built for you. Includes status-checking, widgets, themes, icon packs, a UI editor and tons more!",Lissy93,dashy,https://github.com/Lissy93/dashy
2023-08-07,vue,13227,3,è·¨å¹³å°æ¡Œé¢ç«¯è§†é¢‘èµ„æºæ’­æ”¾å™¨.ç®€æ´æ— å¹¿å‘Š.å…è´¹é«˜é¢œå€¼.,Hunlongyu,ZY-Player,https://github.com/Hunlongyu/ZY-Player
2023-08-07,vue,1342,15,"è·¨å¹³å°æ¡Œé¢ç«¯è§†é¢‘èµ„æºæ’­æ”¾å™¨,å…è´¹é«˜é¢œå€¼.",Hiram-Wong,ZyPlayer,https://github.com/Hiram-Wong/ZyPlayer
2023-08-07,vue,5046,4,An alternative privacy-friendly YouTube frontend which is efficient by design.,TeamPiped,Piped,https://github.com/TeamPiped/Piped
2023-08-07,vue,7445,8,A very simple static homepage for your server.,bastienwirtz,homer,https://github.com/bastienwirtz/homer
2023-08-07,vue,567,11,"Vue port of Radix UI Primitives. An open-source UI component library for building high-quality, accessible design systems and web apps.",radix-vue,radix-vue,https://github.com/radix-vue/radix-vue
2023-08-07,vue,1494,2,"Fast, modern and advanced photo management suite. Runs as a Nextcloud app.",pulsejet,memories,https://github.com/pulsejet/memories
2023-08-07,vue,24390,5,é«˜é¢œå€¼çš„ç¬¬ä¸‰æ–¹ç½‘æ˜“äº‘æ’­æ”¾å™¨ï¼Œæ”¯æŒ Windows / macOS / Linux,qier222,YesPlayMusic,https://github.com/qier222/YesPlayMusic
2023-08-07,vue,1373,3,Fully styled and customizable components for Nuxt.,nuxtlabs,ui,https://github.com/nuxtlabs/ui
2023-08-07,vue,34,6,A revolutionary mod for PAYDAY 2.,pierre-josselin,payday-2-ultimate-trainer-6,https://github.com/pierre-josselin/payday-2-ultimate-trainer-6
2023-08-07,vue,1421,1,"A backend management system based on vue3, typescript, element-plus, and vite",kailong321200875,vue-element-plus-admin,https://github.com/kailong321200875/vue-element-plus-admin
2023-08-07,vue,287,23,"A Multi-purpose PDF file processing tool with a nice UI that supports merge, split, rotate, reorder, delete, scale, crop, watermark, encrypt/decrypt, bookmark, extract, compress, etc.",kevin2li,PDF-Guru,https://github.com/kevin2li/PDF-Guru
2023-08-07,vue,3158,0,A simple FOSS video streaming client aimed to recreate ALL features from their respective apps (and more),VueTubeApp,VueTube,https://github.com/VueTubeApp/VueTube
2023-08-07,vue,13360,3,"Modern and easy to use SQL client for MySQL, Postgres, SQLite, SQL Server, and more. Linux, MacOS, and Windows.",beekeeper-studio,beekeeper-studio,https://github.com/beekeeper-studio/beekeeper-studio
2023-08-07,vue,197,0,èœ‚å·¢ ai-beehive ç”¨æˆ·ç«¯,mjjh1717,ai-beehive-web,https://github.com/mjjh1717/ai-beehive-web
2023-08-07,vue,2996,9,ğŸï¸ PicX æ˜¯ä¸€æ¬¾åŸºäº GitHub API å¼€å‘çš„å›¾åºŠå·¥å…·ï¼Œæä¾›å›¾ç‰‡ä¸Šä¼ æ‰˜ç®¡ã€ç”Ÿæˆå›¾ç‰‡é“¾æ¥å’Œå¸¸ç”¨å›¾ç‰‡å·¥å…·ç®±æœåŠ¡ã€‚,XPoet,picx,https://github.com/XPoet/picx
2023-08-07,vue,959,0,åŸºäºGin + Vue + Element UI & Arco Design & Ant Design çš„å‰åç«¯åˆ†ç¦»æƒé™ç®¡ç†ç³»ç»Ÿçš„å‰ç«¯æ¨¡å—,go-admin-team,go-admin-ui,https://github.com/go-admin-team/go-admin-ui
2023-08-07,vue,210,0,Openpose editor for ControlNet. Full hand/face support.,huchenlei,sd-webui-openpose-editor,https://github.com/huchenlei/sd-webui-openpose-editor
2023-08-07,vue,2117,2,"åŸºäºfabric.jså’ŒVueçš„å›¾ç‰‡ç¼–è¾‘å™¨ï¼Œå¯è‡ªå®šä¹‰å­—ä½“ã€ç´ æã€è®¾è®¡æ¨¡æ¿ã€‚fabric.js and Vue based image editor, can customize fonts, materials, design templates.",nihaojob,vue-fabric-editor,https://github.com/nihaojob/vue-fabric-editor
2023-08-07,vue,3559,0,ä¸€æ¬¾ç®€æ´é«˜æ•ˆçš„VuePressçŸ¥è¯†ç®¡ç†&åšå®¢(blog)ä¸»é¢˜,xugaoyi,vuepress-theme-vdoing,https://github.com/xugaoyi/vuepress-theme-vdoing
2023-08-07,vue,4252,0,Material design mobile component library for Vue3,varletjs,varlet,https://github.com/varletjs/varlet
2023-08-07,vue,4182,5,A nimble Mastodon web client,elk-zone,elk,https://github.com/elk-zone/elk
2023-08-07,vue,1210,0,"â­â­â­â­â­ä¸€æ¬¾å¼€ç®±å³ç”¨çš„ Vue ä¸­åå°ç®¡ç†ç³»ç»Ÿæ¡†æ¶ï¼Œå…¼å®¹PCã€ç§»åŠ¨ç«¯ã€‚vue-admin, vue-element-admin, vueåå°, åå°ç³»ç»Ÿ, åå°æ¡†æ¶, ç®¡ç†åå°, ç®¡ç†ç³»ç»Ÿ",fantastic-admin,basic,https://github.com/fantastic-admin/basic
2023-08-07,vue,288,0,A mod manager for easy installation of mods and modloader,satisfactorymodding,SatisfactoryModManager,https://github.com/satisfactorymodding/SatisfactoryModManager