date,language,stargazers,starsToday,description,owner,name,url
2024-03-29,elixir,109,0,A community driven API for Helldivers 2,helldivers-2,api,https://github.com/helldivers-2/api
2024-03-29,elixir,5163,9,A self-hosted data logger for your Tesla 🚘,teslamate-org,teslamate,https://github.com/teslamate-org/teslamate
2024-03-29,elixir,20504,3,Peace of mind from prototype to production,phoenixframework,phoenix,https://github.com/phoenixframework/phoenix
2024-03-29,elixir,4336,5,Automate code & data workflows with interactive Elixir notebooks,livebook-dev,livebook,https://github.com/livebook-dev/livebook
2024-03-29,elixir,23074,18,"Elixir is a dynamic, functional language for building scalable and maintainable applications",elixir-lang,elixir,https://github.com/elixir-lang/elixir
2024-03-29,elixir,5980,1,A toolkit for data mapping and language integrated query.,elixir-ecto,ecto,https://github.com/elixir-ecto/ecto
2024-03-29,elixir,18039,12,"Simple, open source, lightweight (< 1 KB) and privacy-friendly web analytics alternative to Google Analytics.",plausible,analytics,https://github.com/plausible/analytics
2024-03-29,elixir,9,0,,carsdotcom,car_req,https://github.com/carsdotcom/car_req
2024-03-29,elixir,106,0,🛡 Public database of Elixir security advisories pulled from GitHub Advisory Database,mirego,elixir-security-advisories,https://github.com/mirego/elixir-security-advisories
2024-03-29,elixir,12331,3,"A curated list of amazingly awesome Elixir and Erlang libraries, resources and shiny things. Updates:",h4cc,awesome-elixir,https://github.com/h4cc/awesome-elixir
2024-03-29,elixir,208,0,Elixir framework to build your own in-house PaaS,access-company,antikythera,https://github.com/access-company/antikythera
2024-03-29,elixir,19,0,Console adapter/logger for Spandex traces & spans.,pepsico-ecommerce,spandex_console,https://github.com/pepsico-ecommerce/spandex_console
2024-03-29,elixir,1982,0,A server-side rendering component library for Phoenix,surface-ui,surface,https://github.com/surface-ui/surface
2024-03-29,elixir,5596,2,Open-source live customer chat,papercups-io,papercups,https://github.com/papercups-io/papercups
2024-03-29,elixir,6418,1,"Broadcast, Presence, and Postgres Changes via WebSockets",supabase,realtime,https://github.com/supabase/realtime
2024-03-29,elixir,124,0,OpenTelemetry instrumentation for Erlang & Elixir,open-telemetry,opentelemetry-erlang-contrib,https://github.com/open-telemetry/opentelemetry-erlang-contrib
2024-03-29,elixir,3114,3,Blockchain explorer for Ethereum based network and a tool for inspecting and analyzing EVM based blockchains.,blockscout,blockscout,https://github.com/blockscout/blockscout
2024-03-29,elixir,5725,2,"Rich, real-time user experiences with server-rendered HTML",phoenixframework,phoenix_live_view,https://github.com/phoenixframework/phoenix_live_view
2024-03-29,elixir,39,0,,OffchainLabs,blockscout,https://github.com/OffchainLabs/blockscout
2024-03-29,elixir,5,0,A bunch of utility modules to accompany elixir-blueprint,rum-and-code,elixir-utils,https://github.com/rum-and-code/elixir-utils
2024-03-29,elixir,6,0,,rum-and-code,elixir-pdf-generator,https://github.com/rum-and-code/elixir-pdf-generator
2024-03-29,elixir,4514,21,"Local-first sync layer for web and mobile apps. Build reactive, realtime, local-first apps directly on Postgres.",electric-sql,electric,https://github.com/electric-sql/electric
2024-03-29,elixir,596,0,The official Elixir SDK for Sentry (sentry.io),getsentry,sentry-elixir,https://github.com/getsentry/sentry-elixir
2024-03-29,elixir,944,0,Package manager for the Erlang VM,hexpm,hex,https://github.com/hexpm/hex
2024-03-29,elixir,135,0,Wrapper around the Erlang crypto module for Elixir.,ntrepid8,ex_crypto,https://github.com/ntrepid8/ex_crypto