date,language,stargazers,starsToday,description,owner,name,url
2024-03-29,scala,6799,5,"An open-source storage framework that enables building a Lakehouse architecture with compute engines including Spark, PrestoDB, Flink, Trino, and Hive and APIs",delta-io,delta,https://github.com/delta-io/delta
2024-03-29,scala,12909,2,"Build highly concurrent, distributed, and resilient message-driven applications on the JVM",akka,akka,https://github.com/akka/akka
2024-03-29,scala,2978,2,Rocket Chip Generator,chipsalliance,rocket-chip,https://github.com/chipsalliance/rocket-chip
2024-03-29,scala,958,2,Gluten is a middle layer responsible for offloading JVM-based SQL engines' execution to native engines.,apache,incubator-gluten,https://github.com/apache/incubator-gluten
2024-03-29,scala,38137,7,Apache Spark - A unified analytics engine for large-scale data processing,apache,spark,https://github.com/apache/spark
2024-03-29,scala,4269,1,Open-source high-performance RISC-V processor,OpenXiangShan,XiangShan,https://github.com/OpenXiangShan/XiangShan
2024-03-29,scala,4749,1,"sbt, the interactive build tool",sbt,sbt,https://github.com/sbt/sbt
2024-03-29,scala,0,0,,ISC-HEI,101_Lists_lab,https://github.com/ISC-HEI/101_Lists_lab
2024-03-29,scala,5600,22,"The Scala 3 compiler, also known as Dotty.",scala,scala3,https://github.com/scala/scala3
2024-03-29,scala,1,0,,LeifAndersen,CPSLambdaCalc,https://github.com/LeifAndersen/CPSLambdaCalc
2024-03-29,scala,1,0,This repo is for the Linkedin Learning course: Hands-On Introduction: Scala,LinkedInLearning,hands-on-introduction-scala-4413550,https://github.com/LinkedInLearning/hands-on-introduction-scala-4413550
2024-03-29,scala,4959,1,Simple and Distributed Machine Learning,microsoft,SynapseML,https://github.com/microsoft/SynapseML
2024-03-29,scala,264,0,,ucb-bar,berkeley-hardfloat,https://github.com/ucb-bar/berkeley-hardfloat
2024-03-29,scala,1905,0,Apache Kyuubi is a distributed and multi-tenant gateway to provide serverless SQL on data warehouses and lakehouses.,apache,kyuubi,https://github.com/apache/kyuubi
2024-03-29,scala,848,2,Korean tokenizer,twitter,twitter-korean-text,https://github.com/twitter/twitter-korean-text
2024-03-29,scala,707,0,Spark RAPIDS plugin - accelerate Apache Spark with GPUs,NVIDIA,spark-rapids,https://github.com/NVIDIA/spark-rapids
2024-03-29,scala,150,0,RISC-V Torture Test,ucb-bar,riscv-torture,https://github.com/ucb-bar/riscv-torture
2024-03-29,scala,232,1,"Open, Modular, Deep Learning Accelerator",apache,tvm-vta,https://github.com/apache/tvm-vta
2024-03-29,scala,3106,0,"Deequ is a library built on top of Apache Spark for defining ""unit tests for data"", which measure data quality in large datasets.",awslabs,deequ,https://github.com/awslabs/deequ
2024-03-29,scala,561,0,AWS API Read Cache,Netflix,edda,https://github.com/Netflix/edda
2024-03-29,scala,132,0,Programming language for distributed systems & p2p,fluencelabs,aqua,https://github.com/fluencelabs/aqua
2024-03-29,scala,9052,1,"A Git platform powered by Scala with easy installation, high extensibility & GitHub API compatibility",gitbucket,gitbucket,https://github.com/gitbucket/gitbucket
2024-03-29,scala,11,0,An RTL generator for a last-level shared inclusive TileLink cache controller,chipsalliance,rocket-chip-inclusive-cache,https://github.com/chipsalliance/rocket-chip-inclusive-cache
2024-03-29,scala,3672,2,Chisel: A Modern Hardware Design Language,chipsalliance,chisel,https://github.com/chipsalliance/chisel
2024-03-29,scala,388,2,Toolkit for Scala Development,getkyo,kyo,https://github.com/getkyo/kyo