date,language,stargazers,starsToday,description,owner,name,url
2024-07-06,astro,721,3,A static blog template built with Astro.,saicaca,fuwari,https://github.com/saicaca/fuwari
2024-07-06,astro,43743,1,AdminLTE - Free admin dashboard template based on Bootstrap 5,ColorlibHQ,AdminLTE,https://github.com/ColorlibHQ/AdminLTE
2024-07-06,astro,2794,9,⭕️ AstroWind: A free template using Astro 4.0 and Tailwind CSS. Astro starter theme.,onwidget,astrowind,https://github.com/onwidget/astrowind
2024-07-06,astro,1277,1,Web oficial de La Velada IV de Ibai Llanos,midudev,la-velada-web-oficial,https://github.com/midudev/la-velada-web-oficial
2024-07-06,astro,495,3,"Open-source admin dashboard template built with Astro, Flowbite, and Tailwind CSS",themesberg,flowbite-astro-admin-dashboard,https://github.com/themesberg/flowbite-astro-admin-dashboard
2024-07-06,astro,6333,8,🦄 A curated list of privacy & security-focused software and services,Lissy93,awesome-privacy,https://github.com/Lissy93/awesome-privacy
2024-07-06,astro,809,1,"Astrofy is a free and open-source template for your Personal Portfolio Website built with Astro and TailwindCSS. Create in minutes a website with Blog, CV, Project Section, Store and RSS Feed.",manuelernestog,astrofy,https://github.com/manuelernestog/astrofy
2024-07-06,astro,1596,2,list of free stuff for developer,hilmanski,freeStuffDev,https://github.com/hilmanski/freeStuffDev
2024-07-06,astro,2127,2,"A minimal, accessible and SEO-friendly Astro blog theme",satnaing,astro-paper,https://github.com/satnaing/astro-paper
2024-07-06,astro,441,0,"📚 Openblog is an elegant, simple, and user-friendly blog. Focused on accessibility, SEO and performance.",danielcgilibert,blog-template,https://github.com/danielcgilibert/blog-template