date,language,stargazers,starsToday,description,owner,name,url
2024-09-01,haskell,10190,5,"Dockerfile linter, validate inline bash, written in Haskell",hadolint,hadolint,https://github.com/hadolint/hadolint
2024-09-01,haskell,3050,0,The core component that is used to participate in a Cardano decentralised blockchain.,IntersectMBO,cardano-node,https://github.com/IntersectMBO/cardano-node
2024-09-01,haskell,23082,5,REST API for any Postgres database,PostgREST,postgrest,https://github.com/PostgREST/postgrest
2024-09-01,haskell,1599,0,Official upstream development repository for Cabal and cabal-install,haskell,cabal,https://github.com/haskell/cabal
2024-09-01,haskell,33795,15,Universal markup converter,jgm,pandoc,https://github.com/jgm/pandoc
2024-09-01,haskell,36015,7,"ShellCheck, a static analysis tool for shell scripts",koalaman,shellcheck,https://github.com/koalaman/shellcheck
2024-09-01,haskell,5724,1,A friendly programming language from the future,unisonweb,unison,https://github.com/unisonweb/unison
2024-09-01,haskell,3977,0,The Haskell Tool Stack,commercialhaskell,stack,https://github.com/commercialhaskell/stack
2024-09-01,haskell,131,0,Horn Clause Constraint Solving for Liquid Types,ucsd-progsys,liquid-fixpoint,https://github.com/ucsd-progsys/liquid-fixpoint