date,language,stargazers,starsToday,description,owner,name,url
2024-03-30,perl,18294,4,"cloc counts blank lines, comment lines, and physical lines of source code in many programming languages.",AlDanial,cloc,https://github.com/AlDanial/cloc
2024-03-30,perl,45,0,a superdaemon for hot-deploying server programs,kazuho,p5-Server-Starter,https://github.com/kazuho/p5-Server-Starter
2024-03-30,perl,11,0,a tiny template engine for embedded HTML,kazuho,picotemplate,https://github.com/kazuho/picotemplate
2024-03-30,perl,2,0,,gleb-roma,google_count,https://github.com/gleb-roma/google_count
2024-03-30,perl,1,0,identidad visual de firefox,inaes-tic,pkg-firefox,https://github.com/inaes-tic/pkg-firefox
2024-03-30,perl,397,0,"The Open Charge Point Interface (OCPI) allows for a scalable, automated roaming setup between Charge Point Operators and e-Mobility Service Providers. It supports authorisation, charge point information exchange (incl transaction events), charge detail record exchange and finally, the exchange of smart-charging commands between parties.",ocpi,ocpi,https://github.com/ocpi/ocpi
2024-03-30,perl,1,0,Parse lines from Apache webserver log files,spacebat,perl-apache-logregex,https://github.com/spacebat/perl-apache-logregex
2024-03-30,perl,307,0,Collection of standard plugins to discover and gather cloud-to-edge metrics and status across your whole IT infrastructure.,centreon,centreon-plugins,https://github.com/centreon/centreon-plugins
2024-03-30,perl,824,0,LCOV,linux-test-project,lcov,https://github.com/linux-test-project/lcov
2024-03-30,perl,0,0,Fix for iTiVo https://code.google.com/p/itivo/,archstar,iTiVo-CookiePatch,https://github.com/archstar/iTiVo-CookiePatch
2024-03-30,perl,7,0,Term::Vspark Package,kablamo,Term-Vspark,https://github.com/kablamo/Term-Vspark
2024-03-30,perl,304,0,"openQA web-frontend, scheduler and tools.",os-autoinst,openQA,https://github.com/os-autoinst/openQA
2024-03-30,perl,1,0,Standardised logging adapter for company's Perl code,binary-com,perl-Log-Any-Adapter-DERIV,https://github.com/binary-com/perl-Log-Any-Adapter-DERIV
2024-03-30,perl,957,0,"Ora2Pg is a free tool used to migrate an Oracle database to a PostgreSQL compatible schema. It connects your Oracle database, scan it automatically and extracts its structure or data, it then generates SQL scripts that you can load into PostgreSQL.",darold,ora2pg,https://github.com/darold/ora2pg
2024-03-30,perl,433,0,✂️ ⚡ Rapid haploid variant calling and core genome alignment,tseemann,snippy,https://github.com/tseemann/snippy
2024-03-30,perl,128,0,FreeRDP Manuals,awakecoding,FreeRDP-Manuals,https://github.com/awakecoding/FreeRDP-Manuals
2024-03-30,perl,52,0,Ce logiciel permet de contrôler le respect des normes des fichiers d'écritures comptables (FEC) conformément aux dispositions de l'article A.47 A-1 du livre des procédures fiscales.,DGFiP,Test-Compta-Demat,https://github.com/DGFiP/Test-Compta-Demat
2024-03-30,perl,7736,2,Nikto web server scanner,sullo,nikto,https://github.com/sullo/nikto
2024-03-30,perl,0,0,,shohey1226,Graph-Algorithm-HITS,https://github.com/shohey1226/Graph-Algorithm-HITS
2024-03-30,perl,1,0,,regru,API-CPanel,https://github.com/regru/API-CPanel
2024-03-30,perl,16267,6,Stack trace visualizer,brendangregg,FlameGraph,https://github.com/brendangregg/FlameGraph
2024-03-30,perl,1223,2,"PacketFence is a fully supported, trusted, Free and Open Source network access control (NAC) solution. Boasting an impressive feature set including a captive-portal for registration and remediation, centralized wired and wireless management, powerful BYOD management options, 802.1X support, layer-2 isolation of problematic devices; PacketFence c…",inverse-inc,packetfence,https://github.com/inverse-inc/packetfence
2024-03-30,perl,1407,0,ModSecurity v3 Nginx Connector,owasp-modsecurity,ModSecurity-nginx,https://github.com/owasp-modsecurity/ModSecurity-nginx
2024-03-30,perl,2047,1,Ddclient updates dynamic DNS entries for accounts on a wide range of dynamic DNS services.,ddclient,ddclient,https://github.com/ddclient/ddclient
2024-03-30,perl,3153,0,"Imapsync is an IMAP transfers tool. The purpose of imapsync is to migrate IMAP accounts or to backup IMAP accounts. IMAP is one of the three current standard protocols to access mailboxes, the two others are POP3 and HTTP with webmails, webmails are often tied to an IMAP server. Upstream website is",imapsync,imapsync,https://github.com/imapsync/imapsync