date,language,stargazers,starsToday,description,owner,name,url
2023-11-14,lua,1605,3,,josean-dev,dev-environment-files,https://github.com/josean-dev/dev-environment-files
2023-11-14,lua,1535,1,"💻 Neovim setup for init.lua and plugin development with full signature help, docs and completion for the nvim lua API.",folke,neodev.nvim,https://github.com/folke/neodev.nvim
2023-11-14,lua,2185,3,Add/change/delete surrounding delimiter pairs with ease. Written with ❤️ in Lua.,kylechui,nvim-surround,https://github.com/kylechui/nvim-surround
2023-11-14,lua,616,3,"IDE-like breadcrumbs, out of the box",Bekaboo,dropbar.nvim,https://github.com/Bekaboo/dropbar.nvim
2023-11-14,lua,2220,1,Service eggs for the pterodactyl panel,parkervcp,eggs,https://github.com/parkervcp/eggs
2023-11-14,lua,3057,1,improve neovim lsp experience,nvimdev,lspsaga.nvim,https://github.com/nvimdev/lspsaga.nvim
2023-11-14,lua,257,4,Rainbow delimiters for Neovim with Tree-sitter,HiPhish,rainbow-delimiters.nvim,https://github.com/HiPhish/rainbow-delimiters.nvim
2023-11-14,lua,612,1,,xiaorouji,openwrt-passwall2,https://github.com/xiaorouji/openwrt-passwall2
2023-11-14,lua,9081,48,A launch point for your personal nvim configuration,nvim-lua,kickstart.nvim,https://github.com/nvim-lua/kickstart.nvim
2023-11-14,lua,8386,6,Quickstart configs for Nvim LSP,neovim,nvim-lspconfig,https://github.com/neovim/nvim-lspconfig
2023-11-14,lua,2362,6,,ThePrimeagen,init.lua,https://github.com/ThePrimeagen/init.lua
2023-11-14,lua,13981,10,"An ebook reader application supporting PDF, DjVu, EPUB, FB2 and many more formats, running on Cervantes, Kindle, Kobo, PocketBook and Android devices",koreader,koreader,https://github.com/koreader/koreader
2023-11-14,lua,1706,1,LSP signature hint as you type,ray-x,lsp_signature.nvim,https://github.com/ray-x/lsp_signature.nvim
2023-11-14,lua,2979,4,Library of 30+ independent Lua modules improving overall Neovim (version 0.7 and higher) experience with minimal effort,echasnovski,mini.nvim,https://github.com/echasnovski/mini.nvim
2023-11-14,lua,3633,8,💥 Create key bindings that stick. WhichKey is a lua plugin for Neovim 0.5 that displays a popup with possible keybindings of the command you started typing.,folke,which-key.nvim,https://github.com/folke/which-key.nvim
2023-11-14,lua,5797,3,A file explorer tree for neovim written in lua,nvim-tree,nvim-tree.lua,https://github.com/nvim-tree/nvim-tree.lua
2023-11-14,lua,20093,16,"Blazing fast Neovim config providing solid defaults and a beautiful UI, enhancing your neovim experience.",NvChad,NvChad,https://github.com/NvChad/NvChad
2023-11-14,lua,8155,19,💤 A modern plugin manager for Neovim,folke,lazy.nvim,https://github.com/folke/lazy.nvim
2023-11-14,lua,1437,5,"Navigate your code with search labels, enhanced character motions and Treesitter integration",folke,flash.nvim,https://github.com/folke/flash.nvim
2023-11-14,lua,3119,1,A neovim lua plugin to help easily manage multiple terminal windows,akinsho,toggleterm.nvim,https://github.com/akinsho/toggleterm.nvim
2023-11-14,lua,1472,15,Neovim file explorer: edit your filesystem like a buffer,stevearc,oil.nvim,https://github.com/stevearc/oil.nvim
2023-11-14,lua,1266,2,File Browser extension for telescope.nvim,nvim-telescope,telescope-file-browser.nvim,https://github.com/nvim-telescope/telescope-file-browser.nvim
2023-11-14,lua,364,1,Slot-based inventory with metadata.,overextended,ox_inventory,https://github.com/overextended/ox_inventory
2023-11-14,lua,1512,2,lua `fork` of vim-web-devicons for neovim,nvim-tree,nvim-web-devicons,https://github.com/nvim-tree/nvim-web-devicons
2023-11-14,lua,4007,5,Debug Adapter Protocol client implementation for Neovim,mfussenegger,nvim-dap,https://github.com/mfussenegger/nvim-dap