date,language,stargazers,starsToday,description,owner,name,url
2024-06-22,astro,43715,3,AdminLTE - Free admin dashboard template based on Bootstrap 5,ColorlibHQ,AdminLTE,https://github.com/ColorlibHQ/AdminLTE
2024-06-22,astro,430,1,"📚 Openblog is an elegant, simple, and user-friendly blog. Focused on accessibility, SEO and performance.",danielcgilibert,blog-template,https://github.com/danielcgilibert/blog-template
2024-06-22,astro,2841,2,"An opinionated, actionable guide for software engineering interviews.",nas5w,interview-guide,https://github.com/nas5w/interview-guide
2024-06-22,astro,1585,2,list of free stuff for developer,hilmanski,freeStuffDev,https://github.com/hilmanski/freeStuffDev
2024-06-22,astro,2077,4,"A minimal, accessible and SEO-friendly Astro blog theme",satnaing,astro-paper,https://github.com/satnaing/astro-paper
2024-06-22,astro,663,5,A static blog template built with Astro.,saicaca,fuwari,https://github.com/saicaca/fuwari
2024-06-22,astro,188,0,Rediscover the beauty of typography.,moeyua,astro-theme-typography,https://github.com/moeyua/astro-theme-typography
2024-06-22,astro,2713,3,⭕️ AstroWind: A free template using Astro 4.0 and Tailwind CSS. Astro starter theme.,onwidget,astrowind,https://github.com/onwidget/astrowind
2024-06-22,astro,852,1,Makes it easy to add information that is relevant for SEO to your Astro app.,jonasmerlin,astro-seo,https://github.com/jonasmerlin/astro-seo
2024-06-22,astro,6209,5,🦄 A curated list of privacy & security-focused software and services,Lissy93,awesome-privacy,https://github.com/Lissy93/awesome-privacy