date,language,stargazers,starsToday,description,owner,name,url
2024-06-22,perl,1261,1,Holberton-style C code checker written in Perl,alx-tools,Betty,https://github.com/alx-tools/Betty
2024-06-22,perl,8049,7,Nikto web server scanner,sullo,nikto,https://github.com/sullo/nikto
2024-06-22,perl,16704,6,Stack trace visualizer,brendangregg,FlameGraph,https://github.com/brendangregg/FlameGraph
2024-06-22,perl,1468,0,ModSecurity v3 Nginx Connector,owasp-modsecurity,ModSecurity-nginx,https://github.com/owasp-modsecurity/ModSecurity-nginx
2024-06-22,perl,18813,5,"cloc counts blank lines, comment lines, and physical lines of source code in many programming languages.",AlDanial,cloc,https://github.com/AlDanial/cloc
2024-06-22,perl,211,0,GLPI Agent,glpi-project,glpi-agent,https://github.com/glpi-project/glpi-agent
2024-06-22,perl,424,1,"The Open Charge Point Interface (OCPI) allows for a scalable, automated roaming setup between Charge Point Operators and e-Mobility Service Providers. It supports authorisation, charge point information exchange (incl transaction events), charge detail record exchange and finally, the exchange of smart-charging commands between parties.",ocpi,ocpi,https://github.com/ocpi/ocpi
2024-06-22,perl,437,0,The Ensembl Variant Effect Predictor predicts the functional effects of genomic variants,Ensembl,ensembl-vep,https://github.com/Ensembl/ensembl-vep
2024-06-22,perl,253,0,FusionInventory Agent,fusioninventory,fusioninventory-agent,https://github.com/fusioninventory/fusioninventory-agent
2024-06-22,perl,2433,0,OWASP ModSecurity Core Rule Set (CRS) Project (Official Repository),SpiderLabs,owasp-modsecurity-crs,https://github.com/SpiderLabs/owasp-modsecurity-crs
2024-06-22,perl,974,0,"Ora2Pg is a free tool used to migrate an Oracle database to a PostgreSQL compatible schema. It connects your Oracle database, scan it automatically and extracts its structure or data, it then generates SQL scripts that you can load into PostgreSQL.",darold,ora2pg,https://github.com/darold/ora2pg
2024-06-22,perl,1265,2,"PacketFence is a fully supported, trusted, Free and Open Source network access control (NAC) solution. Boasting an impressive feature set including a captive-portal for registration and remediation, centralized wired and wireless management, powerful BYOD management options, 802.1X support, layer-2 isolation of problematic devices; PacketFence c…",inverse-inc,packetfence,https://github.com/inverse-inc/packetfence
2024-06-22,perl,307,0,Collection of standard plugins to discover and gather cloud-to-edge metrics and status across your whole IT infrastructure.,centreon,centreon-plugins,https://github.com/centreon/centreon-plugins
2024-06-22,perl,809,0,Trinity RNA-Seq de novo transcriptome assembly,trinityrnaseq,trinityrnaseq,https://github.com/trinityrnaseq/trinityrnaseq
2024-06-22,perl,51,0,Ce logiciel permet de contrôler le respect des normes des fichiers d'écritures comptables (FEC) conformément aux dispositions de l'article A.47 A-1 du livre des procédures fiscales.,DGFiP,Test-Compta-Demat,https://github.com/DGFiP/Test-Compta-Demat
2024-06-22,perl,3423,2,A fast PostgreSQL Log Analyzer,darold,pgbadger,https://github.com/darold/pgbadger
2024-06-22,perl,771,0,⚡ ♒ Rapid prokaryotic genome annotation,tseemann,prokka,https://github.com/tseemann/prokka
2024-06-22,perl,859,1,LCOV,linux-test-project,lcov,https://github.com/linux-test-project/lcov
2024-06-22,perl,2550,1,Client for PPP+TLS VPN tunnel services,adrienverge,openfortivpn,https://github.com/adrienverge/openfortivpn
2024-06-22,perl,445,0,✂️ ⚡ Rapid haploid variant calling and core genome alignment,tseemann,snippy,https://github.com/tseemann/snippy
2024-06-22,perl,446,0,"A wrapper around Cutadapt and FastQC to consistently apply adapter and quality trimming to FastQ files, with extra functionality for RRBS data",FelixKrueger,TrimGalore,https://github.com/FelixKrueger/TrimGalore