date,language,stargazers,starsToday,description,owner,name,url
2024-07-31,perl,19029,6,"cloc counts blank lines, comment lines, and physical lines of source code in many programming languages.",AlDanial,cloc,https://github.com/AlDanial/cloc
2024-07-31,perl,2603,3,Client for PPP+TLS VPN tunnel services,adrienverge,openfortivpn,https://github.com/adrienverge/openfortivpn
2024-07-31,perl,2255,4,Ddclient updates dynamic DNS entries for accounts on a wide range of dynamic DNS services.,ddclient,ddclient,https://github.com/ddclient/ddclient
2024-07-31,perl,3464,1,A fast PostgreSQL Log Analyzer,darold,pgbadger,https://github.com/darold/pgbadger
2024-07-31,perl,46,0,a superdaemon for hot-deploying server programs,kazuho,p5-Server-Starter,https://github.com/kazuho/p5-Server-Starter
2024-07-31,perl,430,0,"The Open Charge Point Interface (OCPI) allows for a scalable, automated roaming setup between Charge Point Operators and e-Mobility Service Providers. It supports authorisation, charge point information exchange (incl transaction events), charge detail record exchange and finally, the exchange of smart-charging commands between parties.",ocpi,ocpi,https://github.com/ocpi/ocpi
2024-07-31,perl,136,0,FreeRDP Manuals,awakecoding,FreeRDP-Manuals,https://github.com/awakecoding/FreeRDP-Manuals
2024-07-31,perl,16890,3,Stack trace visualizer,brendangregg,FlameGraph,https://github.com/brendangregg/FlameGraph
2024-07-31,perl,226,2,GLPI Agent,glpi-project,glpi-agent,https://github.com/glpi-project/glpi-agent
2024-07-31,perl,309,0,Collection of standard plugins to discover and gather cloud-to-edge metrics and status across your whole IT infrastructure.,centreon,centreon-plugins,https://github.com/centreon/centreon-plugins
2024-07-31,perl,8795,3,MySQLTuner is a script written in Perl that will assist you with your MySQL configuration and make recommendations for increased performance and stability.,major,MySQLTuner-perl,https://github.com/major/MySQLTuner-perl
2024-07-31,perl,2441,1,OWASP ModSecurity Core Rule Set (CRS) Project (Official Repository),SpiderLabs,owasp-modsecurity-crs,https://github.com/SpiderLabs/owasp-modsecurity-crs
2024-07-31,perl,454,0,✂️ ⚡ Rapid haploid variant calling and core genome alignment,tseemann,snippy,https://github.com/tseemann/snippy
2024-07-31,perl,814,0,Trinity RNA-Seq de novo transcriptome assembly,trinityrnaseq,trinityrnaseq,https://github.com/trinityrnaseq/trinityrnaseq
2024-07-31,perl,1289,1,"PacketFence is a fully supported, trusted, Free and Open Source network access control (NAC) solution. Boasting an impressive feature set including a captive-portal for registration and remediation, centralized wired and wireless management, powerful BYOD management options, 802.1X support, layer-2 isolation of problematic devices; PacketFence c…",inverse-inc,packetfence,https://github.com/inverse-inc/packetfence
2024-07-31,perl,443,1,The Ensembl Variant Effect Predictor predicts the functional effects of genomic variants,Ensembl,ensembl-vep,https://github.com/Ensembl/ensembl-vep
2024-07-31,perl,3278,0,"Imapsync is an IMAP transfers tool. The purpose of imapsync is to migrate IMAP accounts or to backup IMAP accounts. IMAP is one of the three current standard protocols to access mailboxes, the two others are POP3 and HTTP with webmails, webmails are often tied to an IMAP server. Upstream website is",imapsync,imapsync,https://github.com/imapsync/imapsync
2024-07-31,perl,980,0,"Ora2Pg is a free tool used to migrate an Oracle database to a PostgreSQL compatible schema. It connects your Oracle database, scan it automatically and extracts its structure or data, it then generates SQL scripts that you can load into PostgreSQL.",darold,ora2pg,https://github.com/darold/ora2pg
2024-07-31,perl,875,1,LCOV,linux-test-project,lcov,https://github.com/linux-test-project/lcov
2024-07-31,perl,27,0,The Ensembl Variation Perl API and SQL schema,Ensembl,ensembl-variation,https://github.com/Ensembl/ensembl-variation