date,language,stargazers,starsToday,description,owner,name,url
2022-04-07,haskell,792,0,SimpleX - the first chat platform that is 100% private by design - iOS and Android apps are released !,simplex-chat,simplex-chat,https://github.com/simplex-chat/simplex-chat
2022-04-07,haskell,639,0,HTTP server & command-line for managing UTxOs and HD wallets in Cardano.,input-output-hk,cardano-wallet,https://github.com/input-output-hk/cardano-wallet
2022-04-07,haskell,6717,12,"Dockerfile linter, validate inline bash, written in Haskell",hadolint,hadolint,https://github.com/hadolint/hadolint
2022-04-07,haskell,28344,20,"ShellCheck, a static analysis tool for shell scripts",koalaman,shellcheck,https://github.com/koalaman/shellcheck
2022-04-07,haskell,26353,17,"Blazing fast, instant realtime GraphQL APIs on your DB with fine grained access control, also trigger webhooks on database events.",hasura,graphql-engine,https://github.com/hasura/graphql-engine
2022-04-07,haskell,43,1,a work in progress effect system for Haskell,lexi-lambda,eff,https://github.com/lexi-lambda/eff
2022-04-07,haskell,1508,8,A programming language that understands what a web app is.,wasp-lang,wasp,https://github.com/wasp-lang/wasp
2022-04-07,haskell,4,0,"Haskell S3 Client, forked from http://hackage.haskell.org/package/hS3 to support MD5 validation on upload and removed dependency on MissingH",necrobious,hS3,https://github.com/necrobious/hS3
2022-04-07,haskell,956,1,How to learn front-end or back-end development,fullstack-development,developers-roadmap,https://github.com/fullstack-development/developers-roadmap
2022-04-07,haskell,0,0,My gatech.edu/~user web site,Tarrasch,gawebsite,https://github.com/Tarrasch/gawebsite
2022-04-07,haskell,5,0,Signal processing for Haskell based on hmatrix,amcphail,hsignal,https://github.com/amcphail/hsignal
2022-04-07,haskell,18553,6,REST API for any Postgres database,PostgREST,postgrest,https://github.com/PostgREST/postgrest
2022-04-07,haskell,512,1,A comprehensive Amazon Web Services SDK for Haskell.,brendanhay,amazonka,https://github.com/brendanhay/amazonka
2022-04-07,haskell,1367,0,Official upstream development repository for Cabal and cabal-install,haskell,cabal,https://github.com/haskell/cabal
2022-04-07,haskell,211,0,The Plutus application platform,input-output-hk,plutus-apps,https://github.com/input-output-hk/plutus-apps
2022-04-07,haskell,2001,0,Official haskell ide support via language server (LSP). Successor of ghcide & haskell-ide-engine.,haskell,haskell-language-server,https://github.com/haskell/haskell-language-server
2022-04-07,haskell,2611,1,The core component that is used to participate in a Cardano decentralised blockchain.,input-output-hk,cardano-node,https://github.com/input-output-hk/cardano-node
2022-04-07,haskell,94,0,Addresses and mnemonic manipulation & derivations,input-output-hk,cardano-addresses,https://github.com/input-output-hk/cardano-addresses
2022-04-07,haskell,3175,1,The fastest way to build type safe web apps. IHP is a new batteries-included web framework optimized for longterm productivity and programmer happiness,digitallyinduced,ihp,https://github.com/digitallyinduced/ihp
2022-04-07,haskell,25130,12,Universal markup converter,jgm,pandoc,https://github.com/jgm/pandoc
2022-04-07,haskell,152,0,The ledger implementation and specifications of the Cardano blockchain.,input-output-hk,cardano-ledger,https://github.com/input-output-hk/cardano-ledger
2022-04-07,haskell,1755,7,A data-parallel functional programming language,diku-dk,futhark,https://github.com/diku-dk/futhark
2022-04-07,haskell,2019,1,Koka language compiler and interpreter,koka-lang,koka,https://github.com/koka-lang/koka
2022-04-07,haskell,89,0,Horn Clause Constraint Solving for Liquid Types,ucsd-progsys,liquid-fixpoint,https://github.com/ucsd-progsys/liquid-fixpoint
2022-04-07,haskell,56,1,Code used throughout the Cardano eco-system,input-output-hk,cardano-base,https://github.com/input-output-hk/cardano-base