date,language,stargazers,starsToday,description,owner,name,url
2022-01-27,vue,2011,20,基于 Vue3.x + TypeScript 的在线演示文稿（幻灯片）应用，还原了大部分 Office PowerPoint 常用功能，实现在线PPT的编辑、演示。支持导出PPT文件。,pipipi-pikachu,PPTist,https://github.com/pipipi-pikachu/PPTist
2022-01-27,vue,4020,6,京东风格的移动端 Vue2、Vue3 组件库 (A Vue.js UI Toolkit for Mobile Web),jdf2e,nutui,https://github.com/jdf2e/nutui
2022-01-27,vue,35954,49,Open source API development ecosystem - https://hoppscotch.io,hoppscotch,hoppscotch,https://github.com/hoppscotch/hoppscotch
2022-01-27,vue,3165,5,Vue3 全家桶 + Vant 搭建大型单页面商城项目，新蜂商城 Vue3 版本，技术栈为 Vue 3.0 + Vue-Router 4.0 + Vuex 4.0 + Vant 3.0。,newbee-ltd,newbee-mall-vue3-app,https://github.com/newbee-ltd/newbee-mall-vue3-app
2022-01-27,vue,77,5,dorring是一款在线数据可视化大屏开发软件，使用者无需设计经验或技术背景，通过简单的组件拖拽、图层、画布编辑等操作方式即可快速创建出美观酷炫的数据大屏。平台支持多种数据源类型接入，具备数据实时更新性强、视觉效果丰富等特点。 通过灵活多样的图表形式对庞杂的数据进行直观、清晰的可视化呈现，可视化大屏方便快速地洞察复杂业务背后的数据本质，帮助管理者及时发现问题，指导相关决策。,fish-uncle,dorring-sdk,https://github.com/fish-uncle/dorring-sdk
2022-01-27,vue,100,27,"一个快速开箱即用,大厂必备,配置齐全的Vue3+vite模板",MaleWeb,fast-vue3,https://github.com/MaleWeb/fast-vue3
2022-01-27,vue,572,6,Quickly scaffold a Vue project with `npm init vue@3`,vuejs,create-vue,https://github.com/vuejs/create-vue
2022-01-27,vue,15975,7,An enterprise-class UI components based on Ant Design and Vue.,vueComponent,ant-design-vue,https://github.com/vueComponent/ant-design-vue
2022-01-27,vue,13660,17,A Vue.js 3 UI Library made by Element team,element-plus,element-plus,https://github.com/element-plus/element-plus
2022-01-27,vue,2687,1,Workshop Materials for my Introduction to Vue.js Workshop,sdras,intro-to-vue,https://github.com/sdras/intro-to-vue
2022-01-27,vue,1262,4,"基于vue-cli5.x/vite2.x + vue3.x + ant-design-vue3.x + typescript hooks 的基础后台管理系统模板 RBAC的权限系统, JSON Schema动态表单,动态表格,漂亮锁屏界面",buqiyuan,vue3-antd-admin,https://github.com/buqiyuan/vue3-antd-admin
2022-01-27,vue,73,5,Vue 文档官方中文翻译 ｜ Official Chinese translation for Vue docs,vuejs-translations,docs-zh-cn,https://github.com/vuejs-translations/docs-zh-cn
2022-01-27,vue,8660,21,"A modern vue admin. It is based on Vue3, vite and TypeScript. It's fast！",vbenjs,vue-vben-admin,https://github.com/vbenjs/vue-vben-admin
2022-01-27,vue,2839,2,Ant Design Pro's implementation with Vue,iczer,vue-antd-admin,https://github.com/iczer/vue-antd-admin
2022-01-27,vue,73808,20,A magical vue admin https://panjiachen.github.io/vue-element-admin,PanJiaChen,vue-element-admin,https://github.com/PanJiaChen/vue-element-admin
2022-01-27,vue,6389,3,"一款完善的安全评估工具，支持常见 web 安全问题扫描和自定义 poc | 使用之前务必先阅读文档",chaitin,xray,https://github.com/chaitin/xray
2022-01-27,vue,1454,0,"Web-based image segmentation tool for object detection, localization, and keypoints",jsbroks,coco-annotator,https://github.com/jsbroks/coco-annotator
2022-01-27,vue,870,2,Chinese translation for v3.vuejs.org,vuejs,docs-next-zh-cn,https://github.com/vuejs/docs-next-zh-cn
2022-01-27,vue,997,0,"MyEtherWallet (our friends call us MEW) is a free, client-side interface helping you interact with the Ethereum blockchain.",MyEtherWallet,MyEtherWallet,https://github.com/MyEtherWallet/MyEtherWallet
2022-01-27,vue,11043,3,鲜亮的高饱和色彩，专注视觉的小程序组件库,weilanwl,ColorUI,https://github.com/weilanwl/ColorUI
2022-01-27,vue,5901,2,"Status Page for monitoring your websites and applications with beautiful graphs, analytics, and plugins. Run on any type of environment.",statping,statping,https://github.com/statping/statping
2022-01-27,vue,8393,11,"Modern and easy to use SQL client for MySQL, Postgres, SQLite, SQL Server, and more. Linux, MacOS, and Windows.",beekeeper-studio,beekeeper-studio,https://github.com/beekeeper-studio/beekeeper-studio
2022-01-27,vue,1569,8,Documentation for Vue 3,vuejs,docs,https://github.com/vuejs/docs
2022-01-27,vue,6072,8,Vue数据可视化组件库（类似阿里DataV，大屏数据展示），提供SVG的边框及装饰、图表、水位图、飞线图等组件，简单易用，长期更新(React版已发布),DataV-Team,DataV,https://github.com/DataV-Team/DataV
2022-01-27,vue,9064,0,Lightweight UI components for Vue.js based on Bulma,buefy,buefy,https://github.com/buefy/buefy