date,language,stargazers,starsToday,description,owner,name,url
2023-12-04,svelte,1406,42,ChatGPT web interface using the OpenAI API,Niek,chatgpt-web,https://github.com/Niek/chatgpt-web
2023-12-04,svelte,1019,41,ChatGPT-Style Web UI Client for Ollama 🦙,ollama-webui,ollama-webui,https://github.com/ollama-webui/ollama-webui
2023-12-04,svelte,269,0,,iptv-org,iptv-org.github.io,https://github.com/iptv-org/iptv-org.github.io
2023-12-04,svelte,5208,3,"A web interface for chatting with Alpaca through llama.cpp. Fully dockerized, with an easy to use API.",serge-chat,serge,https://github.com/serge-chat/serge
2023-12-04,svelte,1496,6,3D framework for Svelte,threlte,threlte,https://github.com/threlte/threlte
2023-12-04,svelte,1179,3,A browser extension to inspect Svelte application by extending your browser devtools capabilities,sveltejs,svelte-devtools,https://github.com/sveltejs/svelte-devtools
2023-12-04,svelte,1309,1,"The open-source storefront for any eCommerce. Built with a PWA and headless approach, using a modern JS stack. The API approach also allows you to merge Svelte Commerce with any third-party tool like payment gateways, POS or AI. WIP for MedusaJS, Woocommerce, Bigcommerce and Shopify.",itswadesh,svelte-commerce,https://github.com/itswadesh/svelte-commerce
2023-12-04,svelte,1772,0,"A simple standalone program which automates the installation, removal and maintenance of BetterDiscord.",BetterDiscord,Installer,https://github.com/BetterDiscord/Installer
2023-12-04,svelte,801,3,Awesome examples of SvelteKit in the wild,janosh,awesome-sveltekit,https://github.com/janosh/awesome-sveltekit
2023-12-04,svelte,764,0,Notus Svelte: Free Tailwind CSS UI Kit and Admin,creativetimofficial,notus-svelte,https://github.com/creativetimofficial/notus-svelte
2023-12-04,svelte,2159,10,"shadcn/ui, but for Svelte. ✨",huntabyte,shadcn-svelte,https://github.com/huntabyte/shadcn-svelte
2023-12-04,svelte,27116,27,"🌼 🌼 🌼 🌼 🌼  The most popular, free and open-source Tailwind CSS component library",saadeghi,daisyui,https://github.com/saadeghi/daisyui
2023-12-04,svelte,3065,2,"Database manager for MySQL, PostgreSQL, SQL Server, MongoDB, SQLite and others. Runs under Windows, Linux, Mac or as web application",dbgate,dbgate,https://github.com/dbgate/dbgate
2023-12-04,svelte,59,0,LOA Logs - Modern DPS Meter for Lost Ark,snoww,loa-logs,https://github.com/snoww/loa-logs
2023-12-04,svelte,1732,0,"Primo is a visual CMS with a built-in code editor, Svelte blocks, and static site generator.",primocms,primo,https://github.com/primocms/primo
2023-12-04,svelte,2376,1,"Figma is the first interface design tool based in the browser, making it easier for teams to create software. Join us in https://t.me/figma_linux",Figma-Linux,figma-linux,https://github.com/Figma-Linux/figma-linux
2023-12-04,svelte,2595,4,Business intelligence as code: build polished reports with SQL and markdown,evidence-dev,evidence,https://github.com/evidence-dev/evidence
2023-12-04,svelte,1337,4,"Bittorrent streaming software for cats. Stream anime torrents, real-time with no waiting for downloads.",ThaUnknown,miru,https://github.com/ThaUnknown/miru
2023-12-04,svelte,901,1,Syntax Podcast Website,syntaxfm,website,https://github.com/syntaxfm/website
2023-12-04,svelte,212,0,🌐 Website for ReVanced,ReVanced,revanced-website,https://github.com/ReVanced/revanced-website
2023-12-04,svelte,112,0,Ultra customizable hud featuring a unique and robust settings menu. Change eveything about your experience!,Project-Sloth,ps-hud,https://github.com/Project-Sloth/ps-hud
2023-12-04,svelte,570,4,🌟 GitHub & GitLab notifications on your desktop,colinlienard,gitlight,https://github.com/colinlienard/gitlight
2023-12-04,svelte,3952,3,The UI toolkit for Svelte and Tailwind.,skeletonlabs,skeleton,https://github.com/skeletonlabs/skeleton
2023-12-04,svelte,303,1,"Collection of Svelte components, actions, stores, and utilities to build highly interactive applications.",techniq,svelte-ux,https://github.com/techniq/svelte-ux
2023-12-04,svelte,80,0,"The Appwrite website, docs and blog 🏠",appwrite,website,https://github.com/appwrite/website