date,language,stargazers,starsToday,description,owner,name,url
2023-07-26,vue,4075,21,A nimble Mastodon web client,elk-zone,elk,https://github.com/elk-zone/elk
2023-07-26,vue,539,5,大麦网演唱会抢票软件，一个基于 tauri + rust + vue 调用接口的抢票软件。,shiyutim,tickets,https://github.com/shiyutim/tickets
2023-07-26,vue,18763,16,"A modern vue admin. It is based on Vue3, vite and TypeScript. It's fast！",vbenjs,vue-vben-admin,https://github.com/vbenjs/vue-vben-admin
2023-07-26,vue,20654,26,A Vue.js 3 UI Library made by Element team,element-plus,element-plus,https://github.com/element-plus/element-plus
2023-07-26,vue,3488,6,All-inclusive Python cheatsheet,wilfredinni,python-cheatsheet,https://github.com/wilfredinni/python-cheatsheet
2023-07-26,vue,21486,7,"Wiki.js | A modern and powerful wiki app built on Node.js",requarks,wiki,https://github.com/requarks/wiki
2023-07-26,vue,12292,18,"A self-hostable personal dashboard built for you. Includes status-checking, widgets, themes, icon packs, a UI editor and tons more!",Lissy93,dashy,https://github.com/Lissy93/dashy
2023-07-26,vue,2528,6,(RuoYi)官方仓库 基于SpringBoot，Spring Security，JWT，Vue3 & Vite、Element Plus 的前后端分离权限管理系统,yangzongzhuan,RuoYi-Vue3,https://github.com/yangzongzhuan/RuoYi-Vue3
2023-07-26,vue,25714,33,用 Express 和 Vue3 搭建的 ChatGPT 演示网页,Chanzhaoyu,chatgpt-web,https://github.com/Chanzhaoyu/chatgpt-web
2023-07-26,vue,87,4,waynboot-mall是一套全部开源的微商城项目，包含一个运营后台、h5商城和后台接口。实现了一个商城所需的首页展示、商品分类、商品详情、商品搜索、加入购物车、结算下单、订单状态流转等一系列功能。waynboot-mall的h5商城界面,wayn111,waynboot-mobile,https://github.com/wayn111/waynboot-mobile
2023-07-26,vue,2913,25,Interface for Snapshot. Join us on Discord http://discord.snapshot.org,snapshot-labs,snapshot,https://github.com/snapshot-labs/snapshot
2023-07-26,vue,8159,8,Element UI表单设计及代码生成器,JakHuang,form-generator,https://github.com/JakHuang/form-generator
2023-07-26,vue,546,18,"No-code in the front, Python in the back. An open-source framework for creating data apps.",streamsync-cloud,streamsync,https://github.com/streamsync-cloud/streamsync
2023-07-26,vue,519,10,一个还算强大的Web思维导图。A relatively powerful web mind map.,wanglin2,mind-map,https://github.com/wanglin2/mind-map
2023-07-26,vue,1662,2,JeecgBoot—Vue3版前端源码，采用 Vue3.0+TypeScript+Vite+Ant-Design-Vue等新技术方案，包括二次封装组件、utils、hooks、动态菜单、权限校验、按钮级别权限控制等功能。 是JeecgBoot低代码平台的vue3技术栈的全新UI版本，功能强于vue2版。,jeecgboot,jeecgboot-vue3,https://github.com/jeecgboot/jeecgboot-vue3
2023-07-26,vue,2702,3,基于vue3 的管理端模板(Vue3 TS Vuex4 element-plus vue-i18n-next composition-api) vue3-admin vue3-ts-admin,RainManGO,vue3-composition-admin,https://github.com/RainManGO/vue3-composition-admin
2023-07-26,vue,1514,4,Free Vue.js 3.x Tailwind 3.x admin dashboard template with dark mode. Vite builds. Pinia state. Laravel integration available,justboil,admin-one-vue-tailwind,https://github.com/justboil/admin-one-vue-tailwind
2023-07-26,vue,4958,7,An alternative privacy-friendly YouTube frontend which is efficient by design.,TeamPiped,Piped,https://github.com/TeamPiped/Piped
2023-07-26,vue,2941,1,Free and Open Source UI Library for Vue 3,epicmaxco,vuestic-ui,https://github.com/epicmaxco/vuestic-ui
2023-07-26,vue,83300,14,A magical vue admin https://panjiachen.github.io/vue-element-admin,PanJiaChen,vue-element-admin,https://github.com/PanJiaChen/vue-element-admin
2023-07-26,vue,1081,1,Beautiful Open-Source Form Builder,JhumanJ,OpnForm,https://github.com/JhumanJ/OpnForm
2023-07-26,vue,2792,2,Vue 3 + Vite 2 + Vue-Router 4 + Element-Plus + Echarts 5 + Axios 开发的后台管理系统,newbee-ltd,vue3-admin,https://github.com/newbee-ltd/vue3-admin
2023-07-26,vue,547,14,Github Starred Repositories Manager,cfour-hi,gitstars,https://github.com/cfour-hi/gitstars
2023-07-26,vue,2741,8,"Collection of handy online tools for developers, with great UX.",CorentinTh,it-tools,https://github.com/CorentinTh/it-tools
2023-07-26,vue,1942,4,Unleash Nuxt Developer Experience,nuxt,devtools,https://github.com/nuxt/devtools