date,language,stargazers,starsToday,description,owner,name,url
2023-09-12,scala,12774,2,"Build highly concurrent, distributed, and resilient message-driven applications on the JVM",akka,akka,https://github.com/akka/akka
2023-09-12,scala,59814,15,Source code for Twitter's Recommendation Algorithm,twitter,the-algorithm,https://github.com/twitter/the-algorithm
2023-09-12,scala,1698,2,Apache Kyuubi is a distributed and multi-tenant gateway to provide serverless SQL on data warehouses and lakehouses.,apache,kyuubi,https://github.com/apache/kyuubi
2023-09-12,scala,13557,7,"♞ lichess.org: the forever free, adless and open source chess server ♞",lichess-org,lila,https://github.com/lichess-org/lila
2023-09-12,scala,32,0,A Scala library for Context-Dependent Environments,chipsalliance,cde,https://github.com/chipsalliance/cde
2023-09-12,scala,22,0,Rawls service for DSDE,broadinstitute,rawls,https://github.com/broadinstitute/rawls
2023-09-12,scala,11497,2,CMAK is a tool for managing Apache Kafka clusters,yahoo,CMAK,https://github.com/yahoo/CMAK
2023-09-12,scala,1931,0,Scala language server with rich IDE features 🚀,scalameta,metals,https://github.com/scalameta/metals
2023-09-12,scala,2774,0,Rocket Chip Generator,chipsalliance,rocket-chip,https://github.com/chipsalliance/rocket-chip
2023-09-12,scala,12,0,"Network components (NIC, Switch) for FireBox",firesim,icenet,https://github.com/firesim/icenet
2023-09-12,scala,34,0,,OpenXiangShan,chisel-playground,https://github.com/OpenXiangShan/chisel-playground
2023-09-12,scala,994,1,This is the github repo for Learning Spark: Lightning-Fast Data Analytics [2nd Edition],databricks,LearningSparkV2,https://github.com/databricks/LearningSparkV2
2023-09-12,scala,1848,0,The pure asynchronous runtime for Scala,typelevel,cats-effect,https://github.com/typelevel/cats-effect
2023-09-12,scala,38,0,Notebook service,DataBiosphere,leonardo,https://github.com/DataBiosphere/leonardo
2023-09-12,scala,8702,0,"A fault tolerant, protocol-agnostic RPC system",twitter,finagle,https://github.com/twitter/finagle
2023-09-12,scala,488,0,"Low-code tool for automating actions on real time data | Stream processing for the users.",TouK,nussknacker,https://github.com/TouK/nussknacker
2023-09-12,scala,220,0,,rockthejvm,udemy-scala-beginners,https://github.com/rockthejvm/udemy-scala-beginners
2023-09-12,scala,770,0,The Daml smart contract language,digital-asset,daml,https://github.com/digital-asset/daml
2023-09-12,scala,211,0,"Open, Modular, Deep Learning Accelerator",apache,tvm-vta,https://github.com/apache/tvm-vta
2023-09-12,scala,228,0,,ucb-bar,berkeley-hardfloat,https://github.com/ucb-bar/berkeley-hardfloat
2023-09-12,scala,3875,2,"ZIO — A type-safe, composable library for async and concurrent programming in Scala",zio,zio,https://github.com/zio/zio
2023-09-12,scala,4418,40,Simple and Distributed Machine Learning,microsoft,SynapseML,https://github.com/microsoft/SynapseML
2023-09-12,scala,6139,1,Apache OpenWhisk is an open source serverless cloud platform,apache,openwhisk,https://github.com/apache/openwhisk
2023-09-12,scala,3421,1,State of the Art Natural Language Processing,JohnSnowLabs,spark-nlp,https://github.com/JohnSnowLabs/spark-nlp
2023-09-12,scala,1902,1,Your shiny new Java/Scala build tool!,com-lihaoyi,mill,https://github.com/com-lihaoyi/mill