date,language,stargazers,starsToday,description,owner,name,url
2023-01-11,lua,358,76,Neovim config for the lazy,LazyVim,LazyVim,https://github.com/LazyVim/LazyVim
2023-01-11,lua,11031,8,The Cloud-Native API Gateway,apache,apisix,https://github.com/apache/apisix
2023-01-11,lua,1825,53,A modern plugin manager for Neovim,folke,lazy.nvim,https://github.com/folke/lazy.nvim
2023-01-11,lua,268,30,Neovim file explorer: edit your filesystem like a buffer,stevearc,oil.nvim,https://github.com/stevearc/oil.nvim
2023-01-11,lua,1209,8,Github's Neovim themes,projekt0n,github-nvim-theme,https://github.com/projekt0n/github-nvim-theme
2023-01-11,lua,4088,13,A file explorer tree for neovim written in lua,nvim-tree,nvim-tree.lua,https://github.com/nvim-tree/nvim-tree.lua
2023-01-11,lua,50,11,Starter template for LazyVim,LazyVim,starter,https://github.com/LazyVim/starter
2023-01-11,lua,33765,8,The Cloud-Native API Gateway,Kong,kong,https://github.com/Kong/kong
2023-01-11,lua,150,12,Neovim Plugin for running functions on nodes.,CKolkey,ts-node-action,https://github.com/CKolkey/ts-node-action
2023-01-11,lua,784,5,,ThePrimeagen,init.lua,https://github.com/ThePrimeagen/init.lua
2023-01-11,lua,717,5,Find the enemy and replace them with dark power.,nvim-pack,nvim-spectre,https://github.com/nvim-pack/nvim-spectre
2023-01-11,lua,261,0,A task runner and job management plugin for Neovim,stevearc,overseer.nvim,https://github.com/stevearc/overseer.nvim
2023-01-11,lua,1416,4,"illuminate.vim - (Neo)Vim plugin for automatically highlighting other uses of the word under the cursor using either LSP, Tree-sitter, or regex matching.",RRethy,vim-illuminate,https://github.com/RRethy/vim-illuminate
2023-01-11,lua,110,1,Canary Server 12.x for OpenTibia community.,opentibiabr,canary,https://github.com/opentibiabr/canary
2023-01-11,lua,3283,15,"Portable package manager for Neovim that runs everywhere Neovim runs. Easily install and manage LSP servers, DAP servers, linters, and formatters.",williamboman,mason.nvim,https://github.com/williamboman/mason.nvim
2023-01-11,lua,24,2,Neovim Lua plugin to visualize and operate on indent scope. Part of 'mini.nvim' library.,echasnovski,mini.indentscope,https://github.com/echasnovski/mini.indentscope
2023-01-11,lua,2080,4,A neovim lua plugin to help easily manage multiple terminal windows,akinsho,toggleterm.nvim,https://github.com/akinsho/toggleterm.nvim
2023-01-11,lua,1038,5,Neovim plugin to manage the file system and other tree like structures.,nvim-neo-tree,neo-tree.nvim,https://github.com/nvim-neo-tree/neo-tree.nvim
2023-01-11,lua,2073,5,"A modern Neovim configuration with full battery for Python, Lua, C++, Markdown, LaTeX, and more...",jdhao,nvim-config,https://github.com/jdhao/nvim-config
2023-01-11,lua,1887,3,Orgmode clone written in Lua for Neovim 0.7+.,nvim-orgmode,orgmode,https://github.com/nvim-orgmode/orgmode
2023-01-11,lua,1243,2,A tree like view for symbols in Neovim using the Language Server Protocol. Supports all your favourite languages.,simrat39,symbols-outline.nvim,https://github.com/simrat39/symbols-outline.nvim
2023-01-11,lua,782,4,Neovim 配置实战：从 0 到 1 打造自己的 IDE,nshen,learn-neovim-lua,https://github.com/nshen/learn-neovim-lua
2023-01-11,lua,666,2,Courseplay for Farming Simulator 2022,Courseplay,Courseplay_FS22,https://github.com/Courseplay/Courseplay_FS22
2023-01-11,lua,3,0,Neovim Lua plugin for fast and familiar per-line commenting. Part of 'mini.nvim' library.,echasnovski,mini.comment,https://github.com/echasnovski/mini.comment
2023-01-11,lua,5,0,Neovim Lua plugin to automatically manage character pairs. Part of 'mini.nvim' library.,echasnovski,mini.pairs,https://github.com/echasnovski/mini.pairs