date,language,stargazers,starsToday,description,owner,name,url
2023-01-20,go,15782,40,"Find vulnerabilities, misconfigurations, secrets, SBOM in containers, Kubernetes, code repositories, clouds and more",aquasecurity,trivy,https://github.com/aquasecurity/trivy
2023-01-20,go,7757,48,"VictoriaMetrics: fast, cost-effective monitoring solution and time series database",VictoriaMetrics,VictoriaMetrics,https://github.com/VictoriaMetrics/VictoriaMetrics
2023-01-20,go,8124,4,Terraform AWS provider,hashicorp,terraform-provider-aws,https://github.com/hashicorp/terraform-provider-aws
2023-01-20,go,9109,19,Go library for accessing the GitHub v3 API,google,go-github,https://github.com/google/go-github
2023-01-20,go,3913,55,"ebpf-go is a pure-Go library to read, modify and load eBPF programs and attach them to various hooks in the Linux kernel.",cilium,ebpf,https://github.com/cilium/ebpf
2023-01-20,go,25908,4,"Consul is a distributed, highly available, and data center aware solution to connect and configure applications across dynamic, distributed infrastructure.",hashicorp,consul,https://github.com/hashicorp/consul
2023-01-20,go,3666,1,(Golang) Go bindings for Discord,bwmarrin,discordgo,https://github.com/bwmarrin/discordgo
2023-01-20,go,779,47,Artificial Intelligence Infrastructure-as-Code Generator.,gofireflyio,aiac,https://github.com/gofireflyio/aiac
2023-01-20,go,8753,5,"GoFrame is a modular, powerful, high-performance and enterprise-class application development framework of Golang.",gogf,gf,https://github.com/gogf/gf
2023-01-20,go,26824,5,"A tool for secrets management, encryption as a service, and privileged access management",hashicorp,vault,https://github.com/hashicorp/vault
2023-01-20,go,2412,66,An automated e-mail OSINT tool,alpkeskin,mosint,https://github.com/alpkeskin/mosint
2023-01-20,go,3785,3,Terraform provider for Azure Resource Manager,hashicorp,terraform-provider-azurerm,https://github.com/hashicorp/terraform-provider-azurerm
2023-01-20,go,8940,22,Information gathering framework for phone numbers,sundowndev,phoneinfoga,https://github.com/sundowndev/phoneinfoga
2023-01-20,go,24717,7,"High performance, minimalist Go web framework",labstack,echo,https://github.com/labstack/echo
2023-01-20,go,8425,9,GoMock is a mocking framework for the Go programming language.,golang,mock,https://github.com/golang/mock
2023-01-20,go,5905,27,"An open-source knowledge-based community software. You can use it quickly to build Q&A community for your products, customers, teams, and more.",answerdev,answer,https://github.com/answerdev/answer
2023-01-20,go,5582,4,"Work with remote images registries - retrieving information, images, signing content",containers,skopeo,https://github.com/containers/skopeo
2023-01-20,go,7162,3,The Official Golang driver for MongoDB,mongodb,mongo-go-driver,https://github.com/mongodb/mongo-go-driver
2023-01-20,go,7229,20,Generate type-safe code from SQL,kyleconroy,sqlc,https://github.com/kyleconroy/sqlc
2023-01-20,go,18654,10,A toolkit with common assertions and mocks that plays nicely with the standard library,stretchr,testify,https://github.com/stretchr/testify
2023-01-20,go,13115,7,"Nomad is an easy-to-use, flexible, and performant workload orchestrator that can deploy a mix of microservice, batch, containerized, and non-containerized applications. Nomad is easy to operate and scale and has native Consul and Vault integrations.",hashicorp,nomad,https://github.com/hashicorp/nomad
2023-01-20,go,7134,5,A vault for securely storing and accessing AWS credentials in development environments,99designs,aws-vault,https://github.com/99designs/aws-vault
2023-01-20,go,6025,5,Kubebuilder - SDK for building Kubernetes APIs using CRDs,kubernetes-sigs,kubebuilder,https://github.com/kubernetes-sigs/kubebuilder
2023-01-20,go,2599,3,"The AWS Copilot CLI is a tool for developers to build, release and operate production ready containerized applications on AWS App Runner or Amazon ECS on AWS Fargate.",aws,copilot-cli,https://github.com/aws/copilot-cli
2023-01-20,go,6664,4,Lightning Network Daemon,lightningnetwork,lnd,https://github.com/lightningnetwork/lnd