date,language,stargazers,starsToday,description,owner,name,url
2022-05-04,svelte,1454,3,SvelteKit implementation of the RealWorld app,sveltejs,realworld,https://github.com/sveltejs/realworld
2022-05-04,svelte,49,0,"ClassQuiz is a quiz-application like KAHOOT!, but open-source.",mawoka-myblock,ClassQuiz,https://github.com/mawoka-myblock/ClassQuiz
2022-05-04,svelte,3498,10,An open-source & self-hostable Heroku / Netlify alternative.,coollabsio,coolify,https://github.com/coollabsio/coolify
2022-05-04,svelte,2398,2,Svelte Material UI Components,hperrin,svelte-material-ui,https://github.com/hperrin/svelte-material-ui
2022-05-04,svelte,343,2,Tool to convert SVG to SwiftUI's Shape structure.,quassum,SVG-to-SwiftUI,https://github.com/quassum/SVG-to-SwiftUI
2022-05-04,svelte,153,3,,ivanhofer,sveltekit-typescript-showcase,https://github.com/ivanhofer/sveltekit-typescript-showcase
2022-05-04,svelte,1403,4,"Database manager for MySQL, PostgreSQL, SQL Server, MongoDB, SQLite and others. Runs under Windows, Linux, Mac or as web application",dbgate,dbgate,https://github.com/dbgate/dbgate
2022-05-04,svelte,1338,2,"Edit, preview and share mermaid charts/diagrams. New implementation of the live editor.",mermaid-js,mermaid-live-editor,https://github.com/mermaid-js/mermaid-live-editor
2022-05-04,svelte,41,2,"A UI component explorere desiged specifically for Svelte Kit, not spooky",leveluptuts,bookit,https://github.com/leveluptuts/bookit
2022-05-04,svelte,631,4,Unofficial Svelte port of Headless UI components,rgossiaux,svelte-headlessui,https://github.com/rgossiaux/svelte-headlessui
2022-05-04,svelte,1530,1,Svelte implementation of the Carbon Design System,carbon-design-system,carbon-components-svelte,https://github.com/carbon-design-system/carbon-components-svelte
2022-05-04,svelte,958,2,Svelte  Three,Rich-Harris,svelte-cubed,https://github.com/Rich-Harris/svelte-cubed
2022-05-04,svelte,10505,20,"The most popular, free and open-source Tailwind CSS component library",saadeghi,daisyui,https://github.com/saadeghi/daisyui
2022-05-04,svelte,351,0,IOTA's New Wallet,iotaledger,firefly,https://github.com/iotaledger/firefly
2022-05-04,svelte,660,0,Evidence enables analysts to deliver a polished business intelligence system using SQL and markdown,evidence-dev,evidence,https://github.com/evidence-dev/evidence