date,language,stargazers,starsToday,description,owner,name,url
2022-09-14,astro,74,1,A modern business marketing website theme/starter built with Astro,littlesticks,odyssey-theme,https://github.com/littlesticks/odyssey-theme
2022-09-14,astro,58,0,A blog with daily articles on web development,rebelchris,daily-dev-tips,https://github.com/rebelchris/daily-dev-tips
2022-09-14,astro,239,1,Astro documentation,withastro,docs,https://github.com/withastro/docs
2022-09-14,astro,419,2,¡La conferencia de desarrollo y programación web!,midudev,miduconf-website,https://github.com/midudev/miduconf-website
2022-09-14,astro,160,4,A template to make your website using Astro + Tailwind CSS.,onwidget,astrowind,https://github.com/onwidget/astrowind