date,language,stargazers,starsToday,description,owner,name,url
2022-10-28,perl,344,0,The Ensembl Variant Effect Predictor predicts the functional effects of genomic variants,Ensembl,ensembl-vep,https://github.com/Ensembl/ensembl-vep
2022-10-28,perl,2808,2,A fast PostgreSQL Log Analyzer,darold,pgbadger,https://github.com/darold/pgbadger
2022-10-28,perl,3,0,"Cloud Computing: Fundamentos e Infraestructuras, Máster Universitario en Ingeniería Informática, ETSIIT, Universidad de Granada",cvillalonga,CC-22-23,https://github.com/cvillalonga/CC-22-23
2022-10-28,perl,6179,5,Nikto web server scanner,sullo,nikto,https://github.com/sullo/nikto
2022-10-28,perl,210,0,Spec and test data for the MaxMind DB file format,maxmind,MaxMind-DB,https://github.com/maxmind/MaxMind-DB
2022-10-28,perl,51,0,a perl library for sending email,rjbs,Email-Sender,https://github.com/rjbs/Email-Sender
2022-10-28,perl,80,0,GLPI Agent,glpi-project,glpi-agent,https://github.com/glpi-project/glpi-agent
2022-10-28,perl,1,0,,TMSWhite,G4030_Bugs,https://github.com/TMSWhite/G4030_Bugs
2022-10-28,perl,601,0,Rapid prokaryotic genome annotation,tseemann,prokka,https://github.com/tseemann/prokka
2022-10-28,perl,797,1,Server for Logitech Squeezebox players. This server is also called Logitech Media Server,Logitech,slimserver,https://github.com/Logitech/slimserver
2022-10-28,perl,7775,2,MySQLTuner is a script written in Perl that will assist you with your MySQL configuration and make recommendations for increased performance and stability.,major,MySQLTuner-perl,https://github.com/major/MySQLTuner-perl
2022-10-28,perl,675,0,Trinity RNA-Seq de novo transcriptome assembly,trinityrnaseq,trinityrnaseq,https://github.com/trinityrnaseq/trinityrnaseq
2022-10-28,perl,466,0,"Open Food Facts database and web interface -  Perl, CSS and JS coders welcome  For helping in Python, see Robotoff",openfoodfacts,openfoodfacts-server,https://github.com/openfoodfacts/openfoodfacts-server
2022-10-28,perl,2590,1,"Imapsync is an IMAP transfers tool. The purpose of imapsync is to migrate IMAP accounts or to backup IMAP accounts. IMAP is one of the three current standard protocols to access mailboxes, the two others are POP3 and HTTP with webmails, webmails are often tied to an IMAP server. Upstream website is",imapsync,imapsync,https://github.com/imapsync/imapsync
2022-10-28,perl,267,0,"The Open Charge Point Interface (OCPI) allows for a scalable, automated roaming setup between Charge Point Operators and e-Mobility Service Providers. It supports authorisation, charge point information exchange (incl transaction events), charge detail record exchange and finally, the exchange of smart-charging commands between parties.",ocpi,ocpi,https://github.com/ocpi/ocpi
2022-10-28,perl,1046,1,"PacketFence is a fully supported, trusted, Free and Open Source network access control (NAC) solution. Boasting an impressive feature set including a captive-portal for registration and remediation, centralized wired and wireless management, powerful BYOD management options, 802.1X support, layer-2 isolation of problematic devices; PacketFence c…",inverse-inc,packetfence,https://github.com/inverse-inc/packetfence
2022-10-28,perl,14947,10,"cloc counts blank lines, comment lines, and physical lines of source code in many programming languages.",AlDanial,cloc,https://github.com/AlDanial/cloc
2022-10-28,perl,14,0,Qt QA Scripts,qt,qtqa,https://github.com/qt/qtqa
2022-10-28,perl,279,0,Collection of standard plugins to discover and gather cloud-to-edge metrics and status across your whole IT infrastructure.,centreon,centreon-plugins,https://github.com/centreon/centreon-plugins
2022-10-28,perl,809,0,"Ora2Pg is a free tool used to migrate an Oracle database to a PostgreSQL compatible schema. It connects your Oracle database, scan it automatically and extracts its structure or data, it then generates SQL scripts that you can load into PostgreSQL.",darold,ora2pg,https://github.com/darold/ora2pg
2022-10-28,perl,1148,1,ModSecurity v3 Nginx Connector,SpiderLabs,ModSecurity-nginx,https://github.com/SpiderLabs/ModSecurity-nginx
2022-10-28,perl,237,0,Mass screening of contigs for antimicrobial and virulence genes,tseemann,abricate,https://github.com/tseemann/abricate
2022-10-28,perl,1,0,Validate a name against sanctions lists,binary-com,perl-Data-Validate-Sanctions,https://github.com/binary-com/perl-Data-Validate-Sanctions
2022-10-28,perl,252,0,"openQA web-frontend, scheduler and tools.",os-autoinst,openQA,https://github.com/os-autoinst/openQA
2022-10-28,perl,13756,4,Stack trace visualizer,brendangregg,FlameGraph,https://github.com/brendangregg/FlameGraph