date,language,stargazers,starsToday,description,owner,name,url
2022-10-28,svelte,732,4,What's really in your Discord Data package?,Androz2091,discord-data-package-explorer,https://github.com/Androz2091/discord-data-package-explorer
2022-10-28,svelte,15105,23,"The most popular, free and open-source Tailwind CSS component library",saadeghi,daisyui,https://github.com/saadeghi/daisyui
2022-10-28,svelte,4870,4,An open-source & self-hostable Heroku / Netlify alternative.,coollabsio,coolify,https://github.com/coollabsio/coolify
2022-10-28,svelte,1291,12,A lightweight Svelte component library for building interactive node-based flow diagrams,open-source-labs,Svelvet,https://github.com/open-source-labs/Svelvet
2022-10-28,svelte,1064,1,Unofficial Svelte port of the Headless UI component library,rgossiaux,svelte-headlessui,https://github.com/rgossiaux/svelte-headlessui
2022-10-28,svelte,4,0,การต่อมุกที่ยาวที่สุดในประวัติศาสตร์!,narze,nunmun,https://github.com/narze/nunmun
2022-10-28,svelte,209,1,✒︎ Simply Awesome Blog Starter built with SvelteKit and Love,kwchang0831,svelte-QWER,https://github.com/kwchang0831/svelte-QWER
2022-10-28,svelte,459,1,A fully featured web UI toolkit for Svelte + Tailwind.,Brain-Bones,skeleton,https://github.com/Brain-Bones/skeleton
2022-10-28,svelte,608,0,"Bittorrent streaming software for cats. Stream anime torrents, real-time with no waiting for downloads.",ThaUnknown,miru,https://github.com/ThaUnknown/miru
2022-10-28,svelte,1797,2,Svelte implementation of the Carbon Design System,carbon-design-system,carbon-components-svelte,https://github.com/carbon-design-system/carbon-components-svelte
2022-10-28,svelte,11,0,Give voice to every aspect of your intelligence,canadaduane,soliloquy,https://github.com/canadaduane/soliloquy
2022-10-28,svelte,2398,3,Build and ship your app faster https://fireship.io,fireship-io,fireship.io,https://github.com/fireship-io/fireship.io
2022-10-28,svelte,9,0,เราสามารถออกไอเดียให้ BossKerati ได้ไหม!?,narze,DaiMai,https://github.com/narze/DaiMai
2022-10-28,svelte,85,0,Create a custom league page for your Sleeper fantasy football league!,nmelhado,league-page,https://github.com/nmelhado/league-page
2022-10-28,svelte,64,1,"Frontend components, documentation and information hosted on the Hugging Face website.",huggingface,hub-docs,https://github.com/huggingface/hub-docs