date,language,stargazers,starsToday,description,owner,name,url
2024-03-16,astro,702,1,Ejemplo de porfolio para programadores y desarrolladores,midudev,porfolio.dev,https://github.com/midudev/porfolio.dev
2024-03-16,astro,0,0,,himakom-gen-17,web-himakom-frontend,https://github.com/himakom-gen-17/web-himakom-frontend
2024-03-16,astro,2150,4,⭕️ AstroWind: A free template using Astro 4.0 and Tailwind CSS. Astro starter theme.,onwidget,astrowind,https://github.com/onwidget/astrowind
2024-03-16,astro,303,2,"📚 Openblog is an elegant, simple, and user-friendly blog. Focused on accessibility, SEO and performance.",danielcgilibert,blog-template,https://github.com/danielcgilibert/blog-template
2024-03-16,astro,210,3,"Differents pages and examples apps built with Astro v4.5, shadcn/ui & react js. Open Source.",mickasmt,astro-nomy,https://github.com/mickasmt/astro-nomy
2024-03-16,astro,1804,5,"A minimal, accessible and SEO-friendly Astro blog theme",satnaing,astro-paper,https://github.com/satnaing/astro-paper
2024-03-16,astro,986,1,"Astroship is a starter template for startups, marketing websites, landing pages & blog. Built with Astro & TailwindCSS",surjithctly,astroship,https://github.com/surjithctly/astroship
2024-03-16,astro,668,7,"Astrofy is a free and open-source template for your Personal Portfolio Website built with Astro and TailwindCSS. Create in minutes a website with Blog, CV, Project Section, Store and RSS Feed.",manuelernestog,astrofy,https://github.com/manuelernestog/astrofy
2024-03-16,astro,50,0,Astro workshop demo for Frontend Masters,learnwithjason,astro-frontend-masters,https://github.com/learnwithjason/astro-frontend-masters
2024-03-16,astro,29,4,"Open-source Astro website template with sleek, customizable TailwindCSS components.",mearashadowfax,ScrewFast,https://github.com/mearashadowfax/ScrewFast
2024-03-16,astro,1520,0,list of free stuff for developer,hilmanski,freeStuffDev,https://github.com/hilmanski/freeStuffDev
2024-03-16,astro,43486,4,AdminLTE - Free admin dashboard template based on Bootstrap 5,ColorlibHQ,AdminLTE,https://github.com/ColorlibHQ/AdminLTE
2024-03-16,astro,0,0,,SEDS-Antariksh-VIT-Chennai,showcase-website,https://github.com/SEDS-Antariksh-VIT-Chennai/showcase-website
2024-03-16,astro,620,0,"An Accessible Starter Theme for Astro 4.0 including accessibility features such as landmarks, better focus-outline and skip-links navigation. Ships with Tailwind, Prettier and ESLint support.",markteekman,accessible-astro-starter,https://github.com/markteekman/accessible-astro-starter
2024-03-16,astro,609,1,A simple Astro theme. Use it to create your blog or website.,chrismwilliams,astro-theme-cactus,https://github.com/chrismwilliams/astro-theme-cactus
2024-03-16,astro,740,2,Makes it easy to add information that is relevant for SEO to your Astro app.,jonasmerlin,astro-seo,https://github.com/jonasmerlin/astro-seo
2024-03-16,astro,2736,3,⌨️ A curated list of Open Source Mechanical Keyboard resources.,Keycapsss,awesome-mechanical-keyboard,https://github.com/Keycapsss/awesome-mechanical-keyboard
2024-03-16,astro,389,0,"Open-source admin dashboard template built with Astro, Flowbite, and Tailwind CSS",themesberg,flowbite-astro-admin-dashboard,https://github.com/themesberg/flowbite-astro-admin-dashboard
2024-03-16,astro,573,2,A minimalist portafolio configurable via one JSON,midudev,minimalist-portfolio-json,https://github.com/midudev/minimalist-portfolio-json
2024-03-16,astro,587,0,🚀 Begin building your very own Notion Blog with Astro.,otoyo,astro-notion-blog,https://github.com/otoyo/astro-notion-blog
2024-03-16,astro,4860,12,Next version of roadmap.sh,roadmapsh,deprecated-version,https://github.com/roadmapsh/deprecated-version
2024-03-16,astro,2634,2,"An opinionated, actionable guide for software engineering interviews.",nas5w,interview-guide,https://github.com/nas5w/interview-guide