date,language,stargazers,starsToday,description,owner,name,url
2023-05-17,perl,14704,10,Stack trace visualizer,brendangregg,FlameGraph,https://github.com/brendangregg/FlameGraph
2023-05-17,perl,2132,2,Client for PPP+SSL VPN tunnel services,adrienverge,openfortivpn,https://github.com/adrienverge/openfortivpn
2023-05-17,perl,16038,6,"cloc counts blank lines, comment lines, and physical lines of source code in many programming languages.",AlDanial,cloc,https://github.com/AlDanial/cloc
2023-05-17,perl,311,1,"The Open Charge Point Interface (OCPI) allows for a scalable, automated roaming setup between Charge Point Operators and e-Mobility Service Providers. It supports authorisation, charge point information exchange (incl transaction events), charge detail record exchange and finally, the exchange of smart-charging commands between parties.",ocpi,ocpi,https://github.com/ocpi/ocpi
2023-05-17,perl,726,0,Trinity RNA-Seq de novo transcriptome assembly,trinityrnaseq,trinityrnaseq,https://github.com/trinityrnaseq/trinityrnaseq
2023-05-17,perl,293,0,Collection of standard plugins to discover and gather cloud-to-edge metrics and status across your whole IT infrastructure.,centreon,centreon-plugins,https://github.com/centreon/centreon-plugins
2023-05-17,perl,371,0,The Ensembl Variant Effect Predictor predicts the functional effects of genomic variants,Ensembl,ensembl-vep,https://github.com/Ensembl/ensembl-vep
2023-05-17,perl,3026,1,A fast PostgreSQL Log Analyzer,darold,pgbadger,https://github.com/darold/pgbadger
2023-05-17,perl,375,0,"A wrapper around Cutadapt and FastQC to consistently apply adapter and quality trimming to FastQ files, with extra functionality for RRBS data",FelixKrueger,TrimGalore,https://github.com/FelixKrueger/TrimGalore
2023-05-17,perl,269,0,"openQA web-frontend, scheduler and tools.",os-autoinst,openQA,https://github.com/os-autoinst/openQA
2023-05-17,perl,1,0,Movable Type plugin adds alias features to blog and website.,miyanaga,mt-blog-alias,https://github.com/miyanaga/mt-blog-alias
2023-05-17,perl,3,0,JSON::Functions::XS,pawjy,perl-json-functions-xs,https://github.com/pawjy/perl-json-functions-xs
2023-05-17,perl,246,0,FusionInventory Agent,fusioninventory,fusioninventory-agent,https://github.com/fusioninventory/fusioninventory-agent
2023-05-17,perl,266,0,KH Coder: for Quantitative Content Analysis or Text Mining,ko-ichi-h,khcoder,https://github.com/ko-ichi-h/khcoder
2023-05-17,perl,1,0,do maintainance for some cpan modules,giftnuss,do_m,https://github.com/giftnuss/do_m
2023-05-17,perl,1249,1,ModSecurity v3 Nginx Connector,SpiderLabs,ModSecurity-nginx,https://github.com/SpiderLabs/ModSecurity-nginx
2023-05-17,perl,460,0,Extended information (especially license and layer details) about the published Official Images,docker-library,repo-info,https://github.com/docker-library/repo-info
2023-05-17,perl,1,0,,pawjy,perl-promised-docker-webdriver,https://github.com/pawjy/perl-promised-docker-webdriver
2023-05-17,perl,12,0,Inter process Pub/Sub pattern for Nginx worker processes,Kong,lua-resty-events,https://github.com/Kong/lua-resty-events
2023-05-17,perl,229,0,Spec and test data for the MaxMind DB file format,maxmind,MaxMind-DB,https://github.com/maxmind/MaxMind-DB
2023-05-17,perl,2512,1,"Policy-driven snapshot management and replication tools. Using ZFS for underlying next-gen storage. (Btrfs support plans are shelved unless and until btrfs becomes reliable.) Primarily intended for Linux, but BSD use is supported and reasonably frequently tested.",jimsalterjrs,sanoid,https://github.com/jimsalterjrs/sanoid
2023-05-17,perl,297,1,GNU Fortran (and GCC) compilers for macOS,fxcoudert,gfortran-for-macOS,https://github.com/fxcoudert/gfortran-for-macOS
2023-05-17,perl,2388,1,OWASP ModSecurity Core Rule Set (CRS) Project (Official Repository),SpiderLabs,owasp-modsecurity-crs,https://github.com/SpiderLabs/owasp-modsecurity-crs
2023-05-17,perl,121,0,GLPI Agent,glpi-project,glpi-agent,https://github.com/glpi-project/glpi-agent
2023-05-17,perl,0,0,This repo is a fork from https://github.com/brendangregg/FlameGraph,mongodb-forks,flamegraph,https://github.com/mongodb-forks/flamegraph