date,language,stargazers,starsToday,description,owner,name,url
2024-02-14,php,8526,25,"Pest is an elegant PHP testing Framework with a focus on simplicity, meticulously designed to bring back the joy of testing in PHP.",pestphp,pest,https://github.com/pestphp/pest
2024-02-14,php,3590,11,The official Nextcloud installation method. Provides easy deployment and maintenance with most features included in this one Nextcloud instance.,nextcloud,all-in-one,https://github.com/nextcloud/all-in-one
2024-02-14,php,28096,9,Dependency Manager for PHP,composer,composer,https://github.com/composer/composer
2024-02-14,php,52079,28,"SecLists is the security tester's companion. It's a collection of multiple types of lists used during security assessments, collected in one place. List types include usernames, passwords, URLs, sensitive data patterns, fuzzing payloads, web shells, and many more.",danielmiessler,SecLists,https://github.com/danielmiessler/SecLists
2024-02-14,php,5082,2,Log activity inside your Laravel app,spatie,laravel-activitylog,https://github.com/spatie/laravel-activitylog
2024-02-14,php,1031,2,Powerful data objects for Laravel,spatie,laravel-data,https://github.com/spatie/laravel-data
2024-02-14,php,10596,25,An open-source & self-hostable Heroku / Netlify / Vercel alternative.,coollabsio,coolify,https://github.com/coollabsio/coolify
2024-02-14,php,3643,2,"GLPI is a Free Asset and IT Management Software package, Data center management, ITIL Service Desk, licenses tracking and software auditing.",glpi-project,glpi,https://github.com/glpi-project/glpi
2024-02-14,php,9016,1,A PHP client library for accessing Google APIs,googleapis,google-api-php-client,https://github.com/googleapis/google-api-php-client
2024-02-14,php,4705,1,"Dolibarr ERP CRM is a modern software package to manage your company or foundation's activity (contacts, suppliers, invoices, orders, stocks, agenda, accounting, ...). it's an open source Web application (written in PHP) designed for businesses of any sizes, foundations and freelancers.",Dolibarr,dolibarr,https://github.com/Dolibarr/dolibarr
2024-02-14,php,2061,2,An open-source package that brings the power of modern headless e-commerce functionality to Laravel.,lunarphp,lunar,https://github.com/lunarphp/lunar
2024-02-14,php,8889,2,Damn Vulnerable Web Application (DVWA),digininja,DVWA,https://github.com/digininja/DVWA
2024-02-14,php,3970,0,"Doctrine2 behavioral extensions, Translatable, Sluggable, Tree-NestedSet, Timestampable, Loggable, Sortable",doctrine-extensions,DoctrineExtensions,https://github.com/doctrine-extensions/DoctrineExtensions
2024-02-14,php,6646,11,The RSS feed for websites missing it,RSS-Bridge,rss-bridge,https://github.com/RSS-Bridge/rss-bridge
2024-02-14,php,5062,2,⚗️ Adds code analysis to Laravel improving developer productivity and code quality.,larastan,larastan,https://github.com/larastan/larastan
2024-02-14,php,12890,10,Firefly III: a personal finances manager,firefly-iii,firefly-iii,https://github.com/firefly-iii/firefly-iii
2024-02-14,php,8939,0,"A customizable, open-source ecommerce platform built on WordPress. Build any commerce solution you can imagine.",woocommerce,woocommerce,https://github.com/woocommerce/woocommerce
2024-02-14,php,11918,1,🚀 Supercharged Excel exports and imports in Laravel,SpartnerNL,Laravel-Excel,https://github.com/SpartnerNL/Laravel-Excel
2024-02-14,php,18752,2,Liberating Web Analytics. Star us on Github? +1. Matomo is the leading open alternative to Google Analytics that gives you full control over your data. Matomo lets you easily collect data from websites & apps and visualise this data and extract insights. Privacy is built-in. We love Pull Requests!,matomo-org,matomo,https://github.com/matomo-org/matomo
2024-02-14,php,3237,3,The core Laravel CMS Composer package,statamic,cms,https://github.com/statamic/cms
2024-02-14,php,4370,0,The most widely used PHP client for RabbitMQ,php-amqplib,php-amqplib,https://github.com/php-amqplib/php-amqplib
2024-02-14,php,13357,7,A platform to create documentation/wiki content built with PHP & Laravel,BookStackApp,BookStack,https://github.com/BookStackApp/BookStack
2024-02-14,php,3865,4,🌻 The collaborative editing software that runs Wikipedia. Mirror from https://gerrit.wikimedia.org/g/mediawiki/core. See https://mediawiki.org/wiki/Developer_access for contributing.,wikimedia,mediawiki,https://github.com/wikimedia/mediawiki
2024-02-14,php,12424,3,PHP Static Analysis Tool - discover bugs in your code without running it!,phpstan,phpstan,https://github.com/phpstan/phpstan
2024-02-14,php,15925,2,Debugbar for Laravel (Integrates PHP Debug Bar),barryvdh,laravel-debugbar,https://github.com/barryvdh/laravel-debugbar