date,language,stargazers,starsToday,description,owner,name,url
2024-12-20,php,4586,30,"Laragon is a portable, isolated, fast & powerful universal development environment for PHP, Node.js, Python, Java, Go, Ruby. It is fast, lightweight, easy-to-use and easy-to-extend.",leokhoa,laragon,https://github.com/leokhoa/laragon
2024-12-20,php,11338,18,A free open source IT asset/license management system,snipe,snipe-it,https://github.com/snipe/snipe-it
2024-12-20,php,29862,1,The Symfony PHP framework,symfony,symfony,https://github.com/symfony/symfony
2024-12-20,php,8387,1,"A source-available invoice, quote, project and time-tracking app built with Laravel",invoiceninja,invoiceninja,https://github.com/invoiceninja/invoiceninja
2024-12-20,php,4382,4,"GLPI is a Free Asset and IT Management Software package, Data center management, ITIL Service Desk, licenses tracking and software auditing.",glpi-project,glpi,https://github.com/glpi-project/glpi
2024-12-20,php,3985,3,Community-based GPL-licensed network monitoring system,librenms,librenms,https://github.com/librenms/librenms
2024-12-20,php,79096,18,"Laravel is a web application framework with expressive, elegant syntax. We’ve already laid the foundation for your next big idea — freeing you to create without sweating the small things.",laravel,laravel,https://github.com/laravel/laravel
2024-12-20,php,7465,6,Mautic: Open Source Marketing Automation Software.,mautic,mautic,https://github.com/mautic/mautic
2024-12-20,php,2864,16,Shopware 6 is an open commerce platform based on Symfony Framework and Vue and supported by a worldwide community and more than 1.500 community extensions,shopware,shopware,https://github.com/shopware/shopware
2024-12-20,php,6623,4,"The most advanced frontend drag & drop page builder. Create high-end, pixel perfect websites at record speeds. Any theme, any page, any design.",elementor,elementor,https://github.com/elementor/elementor
2024-12-20,php,13415,1,A pure PHP library for reading and writing spreadsheet files,PHPOffice,PhpSpreadsheet,https://github.com/PHPOffice/PhpSpreadsheet
2024-12-20,php,32798,4,The Laravel Framework.,laravel,framework,https://github.com/laravel/framework
2024-12-20,php,3282,2,"The osTicket open source ticketing system official project repository, for versions 1.8 and later",osTicket,osTicket,https://github.com/osTicket/osTicket
2024-12-20,php,6281,3,🚀 A coroutine framework that focuses on hyperspeed and flexibility. Building microservice or middleware with ease.,hyperf,hyperf,https://github.com/hyperf/hyperf
2024-12-20,php,3443,1,"Core Framework for the Open Source Data & Experience Management Platform (PIM, MDM, CDP, DAM, DXP/CMS & Digital Commerce)",pimcore,pimcore,https://github.com/pimcore/pimcore
2024-12-20,php,19978,28,"A collection of beautiful full-stack components for Laravel. The perfect starting point for your next app. Using Livewire, Alpine.js and Tailwind CSS.",filamentphp,filament,https://github.com/filamentphp/filament
2024-12-20,php,59342,25,"SecLists is the security tester's companion. It's a collection of multiple types of lists used during security assessments, collected in one place. List types include usernames, passwords, URLs, sensitive data patterns, fuzzing payloads, web shells, and many more.",danielmiessler,SecLists,https://github.com/danielmiessler/SecLists
2024-12-20,php,5565,6,"Dolibarr ERP CRM is a modern software package to manage your company or foundation's activity (contacts, suppliers, invoices, orders, stocks, agenda, accounting, ...). it's an open source Web application (written in PHP) designed for businesses of any sizes, foundations and freelancers.",Dolibarr,dolibarr,https://github.com/Dolibarr/dolibarr
2024-12-20,php,9483,6,Multi-purpose proxy service management system,Anankke,SSPanel-UIM,https://github.com/Anankke/SSPanel-UIM
2024-12-20,php,5026,1,⚡️ OpenAI PHP is a supercharged community-maintained PHP API client that allows you to interact with OpenAI API.,openai-php,client,https://github.com/openai-php/client
2024-12-20,php,8297,4,Dictionary of attack patterns and primitives for black-box application fault injection and resource discovery.,fuzzdb-project,fuzzdb,https://github.com/fuzzdb-project/fuzzdb
2024-12-20,php,2874,2,⚡️ OpenAI PHP for Laravel is a supercharged PHP API client that allows you to interact with OpenAI API,openai-php,laravel,https://github.com/openai-php/laravel
2024-12-20,php,15898,23,Free and open source laravel eCommerce platform,bagisto,bagisto,https://github.com/bagisto/bagisto
2024-12-20,php,8580,4,Kanban project management software,kanboard,kanboard,https://github.com/kanboard/kanboard