date,language,stargazers,starsToday,description,owner,name,url
2023-08-17,go,173,17,"The TTPForge is a Framework created to facilitate the development, automation, and execution of Tactics, Techniques, and Procedures (TTPs).",facebookincubator,TTPForge,https://github.com/facebookincubator/TTPForge
2023-08-17,go,8330,4,"An open source, general-purpose policy engine.",open-policy-agent,opa,https://github.com/open-policy-agent/opa
2023-08-17,go,15896,4,gRPC to JSON proxy generator following the gRPC HTTP spec,grpc-ecosystem,grpc-gateway,https://github.com/grpc-ecosystem/grpc-gateway
2023-08-17,go,2182,2,Progressive Delivery for Kubernetes,argoproj,argo-rollouts,https://github.com/argoproj/argo-rollouts
2023-08-17,go,798,16,Zep: A long-term memory store for LLM / Chatbot applications,getzep,zep,https://github.com/getzep/zep
2023-08-17,go,458,32,Private EMail Server,Jinnrry,PMail,https://github.com/Jinnrry/PMail
2023-08-17,go,25309,7,A standard library for microservices.,go-kit,kit,https://github.com/go-kit/kit
2023-08-17,go,13282,5,Workflow engine for Kubernetes,argoproj,argo-workflows,https://github.com/argoproj/argo-workflows
2023-08-17,go,21680,9,HTTP load testing tool and library. It's over 9000!,tsenart,vegeta,https://github.com/tsenart/vegeta
2023-08-17,go,4142,0,Terraform provider for Azure Resource Manager,hashicorp,terraform-provider-azurerm,https://github.com/hashicorp/terraform-provider-azurerm
2023-08-17,go,8880,77,现代化、开源的 Linux 服务器运维管理面板。,1Panel-dev,1Panel,https://github.com/1Panel-dev/1Panel
2023-08-17,go,4499,1,Go package for UUIDs based on RFC 4122 and DCE 1.1: Authentication and Security Services.,google,uuid,https://github.com/google/uuid
2023-08-17,go,9286,6,A TCP proxy to simulate network and system conditions for chaos and resiliency testing,Shopify,toxiproxy,https://github.com/Shopify/toxiproxy
2023-08-17,go,18014,16,"基于vite+vue3+gin搭建的开发基础平台（支持TS,JS混用），集成jwt鉴权，权限管理，动态路由，显隐可控组件，分页封装，多点登录拦截，资源权限，上传下载，代码生成器，表单生成器,chatGPT自动查表等开发必备功能。",flipped-aurora,gin-vue-admin,https://github.com/flipped-aurora/gin-vue-admin
2023-08-17,go,19941,4,Learn Go with test-driven development,quii,learn-go-with-tests,https://github.com/quii/learn-go-with-tests
2023-08-17,go,4315,14,ZITADEL - The best of Auth0 and Keycloak combined. Built for the serverless era.,zitadel,zitadel,https://github.com/zitadel/zitadel
2023-08-17,go,7936,4,Go (Golang) Clean Architecture based on Reading Uncle Bob's Clean Architecture,bxcodec,go-clean-arch,https://github.com/bxcodec/go-clean-arch
2023-08-17,go,5200,12,A blazingly fast JSON serializing & deserializing library,bytedance,sonic,https://github.com/bytedance/sonic
2023-08-17,go,1944,3,Contrib repository for the OpenTelemetry Collector,open-telemetry,opentelemetry-collector-contrib,https://github.com/open-telemetry/opentelemetry-collector-contrib
2023-08-17,go,15425,5,Ingress-NGINX Controller for Kubernetes,kubernetes,ingress-nginx,https://github.com/kubernetes/ingress-nginx
2023-08-17,go,25188,13,A cloud-native Go microservices framework with cli tool for productivity.,zeromicro,go-zero,https://github.com/zeromicro/go-zero
2023-08-17,go,2953,5,"Fast, fun, ActivityPub server, powered by Go.",superseriousbusiness,gotosocial,https://github.com/superseriousbusiness/gotosocial
2023-08-17,go,16201,15,"eBPF-based Networking, Security, and Observability",cilium,cilium,https://github.com/cilium/cilium
2023-08-17,go,21433,4,Complete container management platform,rancher,rancher,https://github.com/rancher/rancher
2023-08-17,go,1795,2,Sonne tanken,evcc-io,evcc,https://github.com/evcc-io/evcc