date,language,stargazers,starsToday,description,owner,name,url
2023-06-12,css,5068,1,Public documentation for Visual Studio Code,microsoft,vscode-docs,https://github.com/microsoft/vscode-docs
2023-06-12,css,4191,9,免费 Prompt Engineering 教程,thinkingjimmy,Learning-Prompt,https://github.com/thinkingjimmy/Learning-Prompt
2023-06-12,css,4127,3,"Starter files, final projects and FAQ for my Advanced CSS course",jonasschmedtmann,advanced-css-course,https://github.com/jonasschmedtmann/advanced-css-course
2023-06-12,css,618,6,,john-smilga,react-course-v3,https://github.com/john-smilga/react-course-v3
2023-06-12,css,44436,13,"Iconic font aggregator, collection, & patcher. 3,600+ icons, 50+ patched fonts: Hack, Source Code Pro, more. Glyph collections: Font Awesome, Material Design Icons, Octicons, & more",ryanoasis,nerd-fonts,https://github.com/ryanoasis/nerd-fonts
2023-06-12,css,840,22,SSH Panel User Management,Alirezad07,X-Panel-SSH-User-Management,https://github.com/Alirezad07/X-Panel-SSH-User-Management
2023-06-12,css,713,3,Вопросы для подготовки к интервью на позицию Python Developer,yakimka,python_interview_questions,https://github.com/yakimka/python_interview_questions
2023-06-12,css,2204,4,gpt4all chatbot ui,ParisNeo,lollms-webui,https://github.com/ParisNeo/lollms-webui
2023-06-12,css,3804,2,Rime::Home is home to Rime users and developers,rime,home,https://github.com/rime/home
2023-06-12,css,3481,1,Phishing Tool & Information Collector,UndeadSec,SocialFish,https://github.com/UndeadSec/SocialFish
2023-06-12,css,4287,4,,safak,youtube,https://github.com/safak/youtube
2023-06-12,css,2202,0,Orchis is a [Material Design](https://material.io) theme for GNOME/GTK based desktop environments.,vinceliuice,Orchis-theme,https://github.com/vinceliuice/Orchis-theme
2023-06-12,css,5366,2,"Tailwind Starter Kit a beautiful extension for TailwindCSS, Free and Open Source",creativetimofficial,tailwind-starter-kit,https://github.com/creativetimofficial/tailwind-starter-kit
2023-06-12,css,175,0,Deployment of PyTorch chatbot with Flask,patrickloeber,chatbot-deployment,https://github.com/patrickloeber/chatbot-deployment
2023-06-12,css,9156,0,"700+ Pure CSS, SVG & Figma UI Icons Available in SVG Sprite, styled-components, NPM & API",astrit,css.gg,https://github.com/astrit/css.gg
2023-06-12,css,3817,2,,john-smilga,react-projects,https://github.com/john-smilga/react-projects
2023-06-12,css,77979,7,A cross-browser library of CSS animations. As easy to use as an easy thing.,animate-css,animate.css,https://github.com/animate-css/animate.css
2023-06-12,css,1522,3,"Responsive Portfolio Website Using HTML, CSS & JavaScript",bedimcode,responsive-portfolio-website-Alexa,https://github.com/bedimcode/responsive-portfolio-website-Alexa
2023-06-12,css,28943,15,"50+ mini web projects using HTML, CSS & JS",bradtraversy,50projects50days,https://github.com/bradtraversy/50projects50days
2023-06-12,css,8614,4,"The package of IBM’s typeface, IBM Plex.",IBM,plex,https://github.com/IBM/plex
2023-06-12,css,756,2,Personal theme for Obsidian,AnubisNekhet,AnuPpuccin,https://github.com/AnubisNekhet/AnuPpuccin
2023-06-12,css,8218,2,The Most Complete Angular UI Component Library,primefaces,primeng,https://github.com/primefaces/primeng
2023-06-12,css,251,0,Free Angular Admin Template by PrimeNG,primefaces,sakai-ng,https://github.com/primefaces/sakai-ng
2023-06-12,css,3189,3,,john-smilga,javascript-basic-projects,https://github.com/john-smilga/javascript-basic-projects
2023-06-12,css,3022,8,Master the creation of Modern UX/UI Websites,adrianhajdin,project_modern_ui_ux_gpt3,https://github.com/adrianhajdin/project_modern_ui_ux_gpt3