date,language,stargazers,starsToday,description,owner,name,url
2023-09-19,svelte,24625,23,"⭐️ ⭐️ ⭐️ ⭐️ ⭐️  The most popular, free and open-source Tailwind CSS component library",saadeghi,daisyui,https://github.com/saadeghi/daisyui
2023-09-19,svelte,4938,4,"A web interface for chatting with Alpaca through llama.cpp. Fully dockerized, with an easy to use API.",serge-chat,serge,https://github.com/serge-chat/serge
2023-09-19,svelte,3560,5,The UI toolkit for Svelte and Tailwind.,skeletonlabs,skeleton,https://github.com/skeletonlabs/skeleton
2023-09-19,svelte,1645,2,"Primo is a visual CMS with a built-in code editor, Svelte blocks, and static site generator.",primocms,primo,https://github.com/primocms/primo
2023-09-19,svelte,34,4,,nottherealsanta,ganimede,https://github.com/nottherealsanta/ganimede
2023-09-19,svelte,211,1,,iptv-org,iptv-org.github.io,https://github.com/iptv-org/iptv-org.github.io
2023-09-19,svelte,107,1,Ultra customizable hud featuring a unique and robust settings menu. Change eveything about your experience!,Project-Sloth,ps-hud,https://github.com/Project-Sloth/ps-hud
2023-09-19,svelte,2840,8,"Database manager for MySQL, PostgreSQL, SQL Server, MongoDB, SQLite and others. Runs under Windows, Linux, Mac or as web application",dbgate,dbgate,https://github.com/dbgate/dbgate
2023-09-19,svelte,1,0,Sweet & Powerful SvelteKit Project Template,xmlking,spectacular,https://github.com/xmlking/spectacular
2023-09-19,svelte,651,3,"Reiverr is a clean combined interface for Jellyfin, TMDB, Radarr and Sonarr, as well as a replacement to Overseerr",aleksilassila,reiverr,https://github.com/aleksilassila/reiverr
2023-09-19,svelte,850,3,"A simple wake on lan web app written with SvelteKit, Go and PocketBase.",seriousm4x,UpSnap,https://github.com/seriousm4x/UpSnap
2023-09-19,svelte,1628,1,Unofficial Svelte port of the Headless UI component library,rgossiaux,svelte-headlessui,https://github.com/rgossiaux/svelte-headlessui
2023-09-19,svelte,195,0,🌐 Website for ReVanced,ReVanced,revanced-website,https://github.com/ReVanced/revanced-website
2023-09-19,svelte,511,2,🌟 GitHub & GitLab notifications on your desktop,colinlienard,gitlight,https://github.com/colinlienard/gitlight
2023-09-19,svelte,27,1,LOA Logs - Modern DPS Meter for Lost Ark,snoww,loa-logs,https://github.com/snoww/loa-logs
2023-09-19,svelte,1622,4,"shadcn/ui, but for Svelte. ✨",huntabyte,shadcn-svelte,https://github.com/huntabyte/shadcn-svelte
2023-09-19,svelte,734,0,Awesome examples of SvelteKit in the wild,janosh,awesome-sveltekit,https://github.com/janosh/awesome-sveltekit
2023-09-19,svelte,0,0,Abyss is the best and most modern proxy to avoid modern censorship.,Abyss-Services,Abyss-Web,https://github.com/Abyss-Services/Abyss-Web
2023-09-19,svelte,1148,2,"Bittorrent streaming software for cats. Stream anime torrents, real-time with no waiting for downloads.",ThaUnknown,miru,https://github.com/ThaUnknown/miru
2023-09-19,svelte,1758,0,"A simple standalone program which automates the installation, removal and maintenance of BetterDiscord.",BetterDiscord,Installer,https://github.com/BetterDiscord/Installer
2023-09-19,svelte,532,3,Full-sized drag & drop JavaScript event calendar with resource view,vkurko,calendar,https://github.com/vkurko/calendar
2023-09-19,svelte,1,0,Emerald Studio's website,EmeraldHQ,Website,https://github.com/EmeraldHQ/Website
2023-09-19,svelte,1413,2,Official Svelte components built for Flowbite and Tailwind CSS,themesberg,flowbite-svelte,https://github.com/themesberg/flowbite-svelte
2023-09-19,svelte,134,7,"Transcribe any audio to text, translate and edit subtitles 100% locally with a web UI. Powered by whisper models!",pluja,whishper,https://github.com/pluja/whishper
2023-09-19,svelte,3105,1,Build and ship your app faster https://fireship.io,fireship-io,fireship.io,https://github.com/fireship-io/fireship.io