date,language,stargazers,starsToday,description,owner,name,url
2023-01-10,perl,1730,1,,ThePrimeagen,.dotfiles,https://github.com/ThePrimeagen/.dotfiles
2023-01-10,perl,1162,1,Web application for archival and reading of manga/doujinshi. Lightweight and Docker-ready for NAS/servers.,Difegue,LANraragi,https://github.com/Difegue/LANraragi
2023-01-10,perl,1778,1,ExifTool meta information reader/writer,exiftool,exiftool,https://github.com/exiftool/exiftool
2023-01-10,perl,2694,0,"a tool for backing up your data using rsync (if you want to get help, use https://lists.sourceforge.net/lists/listinfo/rsnapshot-discuss)",rsnapshot,rsnapshot,https://github.com/rsnapshot/rsnapshot
2023-01-10,perl,0,0,identidad visual de firefox,inaes-tic,pkg-firefox,https://github.com/inaes-tic/pkg-firefox
2023-01-10,perl,214,0,Spec and test data for the MaxMind DB file format,maxmind,MaxMind-DB,https://github.com/maxmind/MaxMind-DB
2023-01-10,perl,1767,1,A utility for downloading TV and radio programmes from BBC iPlayer and BBC Sounds,get-iplayer,get_iplayer,https://github.com/get-iplayer/get_iplayer
2023-01-10,perl,1105,0,A free/open source client and automation tool for Ragnarok Online,OpenKore,openkore,https://github.com/OpenKore/openkore
2023-01-10,perl,387,0,Movable Type,movabletype,movabletype,https://github.com/movabletype/movabletype
2023-01-10,perl,15,0,Qt QA Scripts,qt,qtqa,https://github.com/qt/qtqa
2023-01-10,perl,7884,3,MySQLTuner is a script written in Perl that will assist you with your MySQL configuration and make recommendations for increased performance and stability.,major,MySQLTuner-perl,https://github.com/major/MySQLTuner-perl
2023-01-10,perl,2385,1,"Policy-driven snapshot management and replication tools. Using ZFS for underlying next-gen storage. (Btrfs support plans are shelved unless and until btrfs becomes reliable.) Primarily intended for Linux, but BSD use is supported and reasonably frequently tested.",jimsalterjrs,sanoid,https://github.com/jimsalterjrs/sanoid
2023-01-10,perl,16114,3,Good-lookin' diffs. Actually… nah… The best-lookin' diffs.,so-fancy,diff-so-fancy,https://github.com/so-fancy/diff-so-fancy
2023-01-10,perl,703,0,lm-sensors repository,lm-sensors,lm-sensors,https://github.com/lm-sensors/lm-sensors
2023-01-10,perl,860,0,Repository for various Broadcom Bluetooth firmware,winterheart,broadcom-bt-firmware,https://github.com/winterheart/broadcom-bt-firmware
2023-01-10,perl,11,0,CASC Ain't Simply CRT,dnasko,CASC,https://github.com/dnasko/CASC
2023-01-10,perl,1488,0,Th3Inspector  Best Tool For Information Gathering,Moham3dRiahi,Th3inspector,https://github.com/Moham3dRiahi/Th3inspector
2023-01-10,perl,1068,0,Tool for creating snapshots and remote backups of btrfs subvolumes,digint,btrbk,https://github.com/digint/btrbk
2023-01-10,perl,1399,2,This is the new home for ddclient. Ddclient is a Perl client used to update dynamic DNS entries for accounts on 'Dynamic DNS Network Services' free DNS service. It currently supports a lot of different routers and a few different services.,ddclient,ddclient,https://github.com/ddclient/ddclient
2023-01-10,perl,248,0,KH Coder: for Quantitative Content Analysis or Text Mining,ko-ichi-h,khcoder,https://github.com/ko-ichi-h/khcoder
2023-01-10,perl,357,0,"A wrapper around Cutadapt and FastQC to consistently apply adapter and quality trimming to FastQ files, with extra functionality for RRBS data",FelixKrueger,TrimGalore,https://github.com/FelixKrueger/TrimGalore
2023-01-10,perl,109,0,FreeRDP Manuals,awakecoding,FreeRDP-Manuals,https://github.com/awakecoding/FreeRDP-Manuals