date,language,stargazers,starsToday,description,owner,name,url
2024-06-07,elixir,20824,4,Peace of mind from prototype to production,phoenixframework,phoenix,https://github.com/phoenixframework/phoenix
2024-06-07,elixir,4528,3,Automate code & data workflows with interactive Elixir notebooks,livebook-dev,livebook,https://github.com/livebook-dev/livebook
2024-06-07,elixir,1171,13,,fly-apps,live_beats,https://github.com/fly-apps/live_beats
2024-06-07,elixir,3247,1,Blockchain explorer for Ethereum based network and a tool for inspecting and analyzing EVM based blockchains.,blockscout,blockscout,https://github.com/blockscout/blockscout
2024-06-07,elixir,23844,6,"Elixir is a dynamic, functional language for building scalable and maintainable applications",elixir-lang,elixir,https://github.com/elixir-lang/elixir
2024-06-07,elixir,6332,2,"WireGuard®-based zero-trust access platform with OIDC auth, identity sync, and NAT traversal.",firezone,firezone,https://github.com/firezone/firezone
2024-06-07,elixir,6030,1,A toolkit for data mapping and language integrated query.,elixir-ecto,ecto,https://github.com/elixir-ecto/ecto
2024-06-07,elixir,135,0,OpenTelemetry instrumentation for Erlang & Elixir,open-telemetry,opentelemetry-erlang-contrib,https://github.com/open-telemetry/opentelemetry-erlang-contrib
2024-06-07,elixir,5894,4,"Rich, real-time user experiences with server-rendered HTML",phoenixframework,phoenix_live_view,https://github.com/phoenixframework/phoenix_live_view
2024-06-07,elixir,5164,7,"Local-first sync layer for web and mobile apps. Build reactive, realtime, local-first apps directly on Postgres.",electric-sql,electric,https://github.com/electric-sql/electric
2024-06-07,elixir,374,3,Your next YouTube media manager,kieraneglin,pinchflat,https://github.com/kieraneglin/pinchflat
2024-06-07,elixir,952,1,Svelte inside Phoenix LiveView with seamless end-to-end reactivity,woutdp,live_svelte,https://github.com/woutdp/live_svelte
2024-06-07,elixir,4234,0,The GraphQL toolkit for Elixir,absinthe-graphql,absinthe,https://github.com/absinthe-graphql/absinthe
2024-06-07,elixir,5670,3,Open-source live customer chat,papercups-io,papercups,https://github.com/papercups-io/papercups
2024-06-07,elixir,469,1,Elixir implementation of a LangChain style framework.,brainlid,langchain,https://github.com/brainlid/langchain
2024-06-07,elixir,18731,11,"Simple, open source, lightweight (< 1 KB) and privacy-friendly web analytics alternative to Google Analytics.",plausible,analytics,https://github.com/plausible/analytics