date,language,stargazers,starsToday,description,owner,name,url
2023-12-06,perl,7348,7,Nikto web server scanner,sullo,nikto,https://github.com/sullo/nikto
2023-12-06,perl,17403,4,"cloc counts blank lines, comment lines, and physical lines of source code in many programming languages.",AlDanial,cloc,https://github.com/AlDanial/cloc
2023-12-06,perl,558,1,"Open Food Facts database, API server and web interface - 🐪🦋 Perl, CSS and JS coders welcome 😊 For helping in Python, see Robotoff or taxonomy-editor",openfoodfacts,openfoodfacts-server,https://github.com/openfoodfacts/openfoodfacts-server
2023-12-06,perl,4510,1,"💻 🎓 Git-it is a (Mac, Win, Linux) Desktop App for Learning Git and GitHub",jlord,git-it-electron,https://github.com/jlord/git-it-electron
2023-12-06,perl,366,2,"The Open Charge Point Interface (OCPI) allows for a scalable, automated roaming setup between Charge Point Operators and e-Mobility Service Providers. It supports authorisation, charge point information exchange (incl transaction events), charge detail record exchange and finally, the exchange of smart-charging commands between parties.",ocpi,ocpi,https://github.com/ocpi/ocpi
2023-12-06,perl,210,0,"OTOBO is one of the most flexible web-based ticketing systems used for Customer Service, Help Desk, IT Service Management. https://www.otobo.de/",RotherOSS,otobo,https://github.com/RotherOSS/otobo
2023-12-06,perl,280,0,BRAKER is a pipeline for fully automated prediction of protein coding gene structures with GeneMark-ES/ET/EP/ETP and AUGUSTUS in novel eukaryotic genomes,Gaius-Augustus,BRAKER,https://github.com/Gaius-Augustus/BRAKER
2023-12-06,perl,2,0,CPAN::ParseDistribution,DrHyde,perl-modules-CPAN-ParseDistribution,https://github.com/DrHyde/perl-modules-CPAN-ParseDistribution
2023-12-06,perl,156,1,GLPI Agent,glpi-project,glpi-agent,https://github.com/glpi-project/glpi-agent
2023-12-06,perl,303,0,Collection of standard plugins to discover and gather cloud-to-edge metrics and status across your whole IT infrastructure.,centreon,centreon-plugins,https://github.com/centreon/centreon-plugins
2023-12-06,perl,1250,0,Holberton-style C code checker written in Perl,alx-tools,Betty,https://github.com/alx-tools/Betty
2023-12-06,perl,786,0,LCOV,linux-test-project,lcov,https://github.com/linux-test-project/lcov
2023-12-06,perl,770,0,Trinity RNA-Seq de novo transcriptome assembly,trinityrnaseq,trinityrnaseq,https://github.com/trinityrnaseq/trinityrnaseq
2023-12-06,perl,1,0,Apache module: bandwidth limits,pld-linux,apache1-mod_bandwidth,https://github.com/pld-linux/apache1-mod_bandwidth
2023-12-06,perl,0,0,identidad visual de firefox,inaes-tic,pkg-firefox,https://github.com/inaes-tic/pkg-firefox
2023-12-06,perl,406,0,The Ensembl Variant Effect Predictor predicts the functional effects of genomic variants,Ensembl,ensembl-vep,https://github.com/Ensembl/ensembl-vep
2023-12-06,perl,1681,3,Web application for archival and reading of manga/doujinshi. Lightweight and Docker-ready for NAS/servers.,Difegue,LANraragi,https://github.com/Difegue/LANraragi
2023-12-06,perl,288,0,KH Coder: for Quantitative Content Analysis or Text Mining,ko-ichi-h,khcoder,https://github.com/ko-ichi-h/khcoder
2023-12-06,perl,250,0,FusionInventory Agent,fusioninventory,fusioninventory-agent,https://github.com/fusioninventory/fusioninventory-agent
2023-12-06,perl,293,0,"openQA web-frontend, scheduler and tools.",os-autoinst,openQA,https://github.com/os-autoinst/openQA
2023-12-06,perl,923,0,"Ora2Pg is a free tool used to migrate an Oracle database to a PostgreSQL compatible schema. It connects your Oracle database, scan it automatically and extracts its structure or data, it then generates SQL scripts that you can load into PostgreSQL.",darold,ora2pg,https://github.com/darold/ora2pg
2023-12-06,perl,2408,0,OWASP ModSecurity Core Rule Set (CRS) Project (Official Repository),SpiderLabs,owasp-modsecurity-crs,https://github.com/SpiderLabs/owasp-modsecurity-crs
2023-12-06,perl,2517,1,ExifTool meta information reader/writer,exiftool,exiftool,https://github.com/exiftool/exiftool
2023-12-06,perl,419,0,✂️ ⚡ Rapid haploid variant calling and core genome alignment,tseemann,snippy,https://github.com/tseemann/snippy
2023-12-06,perl,2334,2,Client for PPP+TLS VPN tunnel services,adrienverge,openfortivpn,https://github.com/adrienverge/openfortivpn