date,language,stargazers,starsToday,description,owner,name,url
2024-05-01,r,2125,1,R toolkit for single cell genomics,satijalab,seurat,https://github.com/satijalab/seurat
2024-05-01,r,3481,0,R's data.table package extends data.frame:,Rdatatable,data.table,https://github.com/Rdatatable/data.table
2024-05-01,r,555,1,"phyloseq is a set of classes, wrappers, and tools (in R) to make it easier to import, store, and analyze phylogenetic sequencing data; and to reproducibly share that data and analysis with others. See the phyloseq front page:",joey711,phyloseq,https://github.com/joey711/phyloseq
2024-05-01,r,590,0,"R toolkit for inference, visualization and analysis of cell-cell communication from single-cell data",sqjin,CellChat,https://github.com/sqjin/CellChat
2024-05-01,r,450,0,Accurate sample inference from amplicon data with single nucleotide resolution,benjjneb,dada2,https://github.com/benjjneb/dada2
2024-05-01,r,510,0,Inferring CNV from Single-Cell RNA-Seq,broadinstitute,infercnv,https://github.com/broadinstitute/infercnv
2024-05-01,r,3372,0,A curated list of awesome network analysis resources.,briatte,awesome-network-analysis,https://github.com/briatte/awesome-network-analysis
2024-05-01,r,351,0,R package for detecting doublets in single-cell RNA sequencing data,chris-mcginnis-ucsf,DoubletFinder,https://github.com/chris-mcginnis-ucsf/DoubletFinder
2024-05-01,r,19,1,,satijalab,seurat-object,https://github.com/satijalab/seurat-object
2024-05-01,r,4217,0,🎓 A collection of interactive courses for the swirl R package.,swirldev,swirl_courses,https://github.com/swirldev/swirl_courses
2024-05-01,r,600,0,Equipment Loss Tracking,leedrake5,Russia-Ukraine,https://github.com/leedrake5/Russia-Ukraine
2024-05-01,r,1231,2,Make Complex Heatmaps,jokergoo,ComplexHeatmap,https://github.com/jokergoo/ComplexHeatmap
2024-05-01,r,818,0,Repository for Programming Assignment 2 for R Programming on Coursera,rdpeng,ProgrammingAssignment2,https://github.com/rdpeng/ProgrammingAssignment2
2024-05-01,r,289,0,R toolkit for the analysis of single-cell chromatin data,stuart-lab,signac,https://github.com/stuart-lab/signac
2024-05-01,r,1231,0,brms R package for Bayesian generalized multivariate non-linear multilevel models using Stan,paul-buerkner,brms,https://github.com/paul-buerkner/brms
2024-05-01,r,344,0,ArchR : Analysis of Regulatory Chromatin in R (www.ArchRProject.com),GreenleafLab,ArchR,https://github.com/GreenleafLab/ArchR
2024-05-01,r,219,0,,kpatel427,YouTubeTutorials,https://github.com/kpatel427/YouTubeTutorials
2024-05-01,r,134,0,Interfaces for HDF5-based Single Cell File Formats,mojaveazure,seurat-disk,https://github.com/mojaveazure/seurat-disk
2024-05-01,r,4657,0,dplyr: A grammar of data manipulation,tidyverse,dplyr,https://github.com/tidyverse/dplyr
2024-05-01,r,942,2,📊 A universal enrichment tool for interpreting omics data,YuLab-SMU,clusterProfiler,https://github.com/YuLab-SMU/clusterProfiler
2024-05-01,r,162,2,"R toolkit for inference, visualization and analysis of cell-cell communication from single-cell and spatially resolved transcriptomics",jinworks,CellChat,https://github.com/jinworks/CellChat
2024-05-01,r,1277,0,Simple Features for R,r-spatial,sf,https://github.com/r-spatial/sf
2024-05-01,r,1628,1,R Interface to Python,rstudio,reticulate,https://github.com/rstudio/reticulate
2024-05-01,r,0,0,,hughec1329,285_gtrend,https://github.com/hughec1329/285_gtrend
2024-05-01,r,281,0,Community-provided extensions to Seurat,satijalab,seurat-wrappers,https://github.com/satijalab/seurat-wrappers