date,language,stargazers,starsToday,description,owner,name,url
2024-02-24,scala,37885,11,Apache Spark - A unified analytics engine for large-scale data processing,apache,spark,https://github.com/apache/spark
2024-02-24,scala,12888,0,"Build highly concurrent, distributed, and resilient message-driven applications on the JVM",akka,akka,https://github.com/akka/akka
2024-02-24,scala,907,1,Gluten: Plugin to Double SparkSQL's Performance,oap-project,gluten,https://github.com/oap-project/gluten
2024-02-24,scala,1867,0,Apache Kyuubi is a distributed and multi-tenant gateway to provide serverless SQL on data warehouses and lakehouses.,apache,kyuubi,https://github.com/apache/kyuubi
2024-02-24,scala,12479,1,The Community Maintained High Velocity Web Framework For Java and Scala.,playframework,playframework,https://github.com/playframework/playframework
2024-02-24,scala,14352,3,"♞ lichess.org: the forever free, adless and open source chess server ♞",lichess-org,lila,https://github.com/lichess-org/lila
2024-02-24,scala,4934,0,Simple and Distributed Machine Learning,microsoft,SynapseML,https://github.com/microsoft/SynapseML
2024-02-24,scala,3629,2,Chisel: A Modern Hardware Design Language,chipsalliance,chisel,https://github.com/chipsalliance/chisel
2024-02-24,scala,0,0,,sajja,example-zio-webapp,https://github.com/sajja/example-zio-webapp
2024-02-24,scala,14257,3,Scala 2 compiler and standard library. Bugs at https://github.com/scala/bug; Scala 3 at https://github.com/lampepfl/dotty,scala,scala,https://github.com/scala/scala
2024-02-24,scala,3073,0,"Deequ is a library built on top of Apache Spark for defining ""unit tests for data"", which measure data quality in large datasets.",awslabs,deequ,https://github.com/awslabs/deequ
2024-02-24,scala,424,0,A Spark plugin for reading and writing Excel files,crealytics,spark-excel,https://github.com/crealytics/spark-excel
2024-02-24,scala,191,1,The batteries-included testing and formal verification library for Chisel-based RTL designs.,ucb-bar,chiseltest,https://github.com/ucb-bar/chiseltest
2024-02-24,scala,843,0,Apache Livy is an open source REST interface for interacting with Apache Spark from anywhere.,apache,incubator-livy,https://github.com/apache/incubator-livy
2024-02-24,scala,662,0,An open protocol for secure data sharing,delta-io,delta-sharing,https://github.com/delta-io/delta-sharing
2024-02-24,scala,687,1,Spark RAPIDS plugin - accelerate Apache Spark with GPUs,NVIDIA,spark-rapids,https://github.com/NVIDIA/spark-rapids
2024-02-24,scala,10510,0,"Removes large or troublesome blobs like git-filter-branch does, but faster. And written in Scala",rtyley,bfg-repo-cleaner,https://github.com/rtyley/bfg-repo-cleaner
2024-02-24,scala,225,0,"Open, Modular, Deep Learning Accelerator",apache,tvm-vta,https://github.com/apache/tvm-vta
2024-02-24,scala,3617,1,State of the Art Natural Language Processing,JohnSnowLabs,spark-nlp,https://github.com/JohnSnowLabs/spark-nlp
2024-02-24,scala,11627,0,CMAK is a tool for managing Apache Kafka clusters,yahoo,CMAK,https://github.com/yahoo/CMAK
2024-02-24,scala,478,0,XML data source for Spark SQL and DataFrames,databricks,spark-xml,https://github.com/databricks/spark-xml
2024-02-24,scala,1716,2,Open-source code analysis platform for C/C++/Java/Binary/Javascript/Python/Kotlin based on code property graphs. Discord https://discord.gg/vv4MH284Hc,joernio,joern,https://github.com/joernio/joern
2024-02-24,scala,0,0,,ytaras,scala_monad_slides,https://github.com/ytaras/scala_monad_slides
2024-02-24,scala,3,0,works,kazua,works,https://github.com/kazua/works
2024-02-24,scala,2938,3,Rocket Chip Generator,chipsalliance,rocket-chip,https://github.com/chipsalliance/rocket-chip