date,language,stargazers,starsToday,description,owner,name,url
2024-01-27,svelte,3995,38,ChatGPT-Style Web UI Client for Ollama 🦙,ollama-webui,ollama-webui,https://github.com/ollama-webui/ollama-webui
2024-01-27,svelte,28686,25,"🌼 🌼 🌼 🌼 🌼  The most popular, free and open-source Tailwind CSS component library",saadeghi,daisyui,https://github.com/saadeghi/daisyui
2024-01-27,svelte,252,21,Startup Funding Simulator,dabateam,funding-simulator,https://github.com/dabateam/funding-simulator
2024-01-27,svelte,4,0,Calculadora de promedios de la espol,Xidrovo,calculadoraESPOL,https://github.com/Xidrovo/calculadoraESPOL
2024-01-27,svelte,20,1,Your next-gen API testing and development tool.,sparrowapp-dev,sparrow-app,https://github.com/sparrowapp-dev/sparrow-app
2024-01-27,svelte,31,4,a local first note taking app built around semantic search. built at @recursecenter,nichwch,nomad-hypertext,https://github.com/nichwch/nomad-hypertext
2024-01-27,svelte,84,0,,0LNetworkCommunity,carpe,https://github.com/0LNetworkCommunity/carpe
2024-01-27,svelte,1285,4,Bookmark manager for the wizards 🧙,goniszewski,grimoire,https://github.com/goniszewski/grimoire
2024-01-27,svelte,734,1,Simple elegant toast notifications,zerodevx,svelte-toast,https://github.com/zerodevx/svelte-toast
2024-01-27,svelte,489,5,"Transcribe any audio to text, translate and edit subtitles 100% locally with a web UI. Powered by whisper models!",pluja,whishper,https://github.com/pluja/whishper
2024-01-27,svelte,5392,1,"A web interface for chatting with Alpaca through llama.cpp. Fully dockerized, with an easy to use API.",serge-chat,serge,https://github.com/serge-chat/serge
2024-01-27,svelte,3796,18,"Database manager for MySQL, PostgreSQL, SQL Server, MongoDB, SQLite and others. Runs under Windows, Linux, Mac or as web application",dbgate,dbgate,https://github.com/dbgate/dbgate
2024-01-27,svelte,2410,2,"Figma is the first interface design tool based in the browser, making it easier for teams to create software. Join us in https://t.me/figma_linux",Figma-Linux,figma-linux,https://github.com/Figma-Linux/figma-linux
2024-01-27,svelte,1763,1,"Primo is a visual CMS with a built-in code editor, Svelte blocks, and static site generator.",primocms,primo,https://github.com/primocms/primo
2024-01-27,svelte,393,0,A soup-to-nuts interactive tutorial on how to build apps with Svelte,sveltejs,learn.svelte.dev,https://github.com/sveltejs/learn.svelte.dev
2024-01-27,svelte,882,2,"Reiverr is a clean combined interface for Jellyfin, TMDB, Radarr and Sonarr, as well as a replacement to Overseerr",aleksilassila,reiverr,https://github.com/aleksilassila/reiverr
2024-01-27,svelte,429,0,📆 Interactive JavaScript Gantt chart/resource booking component,ANovokmet,svelte-gantt,https://github.com/ANovokmet/svelte-gantt
2024-01-27,svelte,2879,13,"shadcn/ui, but for Svelte. ✨",huntabyte,shadcn-svelte,https://github.com/huntabyte/shadcn-svelte
2024-01-27,svelte,1189,6,"A modern, easy-to-use and performant custom Home Assistant dashboard",matt8707,ha-fusion,https://github.com/matt8707/ha-fusion
2024-01-27,svelte,170,0,Create a custom league page for your Sleeper fantasy football league!,nmelhado,league-page,https://github.com/nmelhado/league-page
2024-01-27,svelte,3249,0,Build and ship your app faster https://fireship.io,fireship-io,fireship.io,https://github.com/fireship-io/fireship.io
2024-01-27,svelte,84,0,Vercel-like style portfolio template for developers.,RiadhAdrani,slick-portfolio-svelte,https://github.com/RiadhAdrani/slick-portfolio-svelte
2024-01-27,svelte,123,0,"D1 Manager is a web UI and API for Cloudflare D1, a serverless SQL database. It provides a user-friendly interface for managing databases, tables, and records, as well as an API for performing operations programmatically.",JacobLinCool,d1-manager,https://github.com/JacobLinCool/d1-manager
2024-01-27,svelte,1729,3,Official Svelte components built for Flowbite and Tailwind CSS,themesberg,flowbite-svelte,https://github.com/themesberg/flowbite-svelte
2024-01-27,svelte,1297,3,A web frontend for the headscale Tailscale-compatible coordination server,gurucomputing,headscale-ui,https://github.com/gurucomputing/headscale-ui