date,language,stargazers,starsToday,description,owner,name,url
2023-04-12,kotlin,10780,16,A fully functional Android app built entirely with Kotlin and Jetpack Compose,android,nowinandroid,https://github.com/android/nowinandroid
2023-04-12,kotlin,43816,10,"Square’s meticulous HTTP client for the JVM, Android, and GraalVM.",square,okhttp,https://github.com/square/okhttp
2023-04-12,kotlin,4379,4,Development environment for Android Jetpack extension libraries under the androidx namespace. Synchronized with Android Jetpack's primary development branch on AOSP.,androidx,androidx,https://github.com/androidx/androidx
2023-04-12,kotlin,44358,11,The Kotlin Programming Language.,JetBrains,kotlin,https://github.com/JetBrains/kotlin
2023-04-12,kotlin,29009,1,Alibaba Java Coding Guidelines pmd implements and IDE plugin,alibaba,p3c,https://github.com/alibaba/p3c
2023-04-12,kotlin,4245,3,Multiple samples showing the best practices in camera APIs on Android.,android,camera-samples,https://github.com/android/camera-samples
2023-04-12,kotlin,715,6,"Open-source, All-in-one productivity app for Tasks, Notes, Calendar, Diary and Bookmarks.",mhss1,MyBrain,https://github.com/mhss1/MyBrain
2023-04-12,kotlin,3557,7,"An Android Anilist client, which lets you stream & download Anime & Manga.",saikou-app,saikou,https://github.com/saikou-app/saikou
2023-04-12,kotlin,22710,5,Samples for Android Architecture Components.,android,architecture-components-samples,https://github.com/android/architecture-components-samples
2023-04-12,kotlin,12312,12,高效率 QQ 机器人支持库,mamoe,mirai,https://github.com/mamoe/mirai
2023-04-12,kotlin,6568,15,哔哩漫游，解除B站客户端番剧区域限制的Xposed模块，并且提供其他小功能。An Xposed module that unblocks bangumi area limit of BILIBILI with miscellaneous features.,yujincheng08,BiliRoaming,https://github.com/yujincheng08/BiliRoaming
2023-04-12,kotlin,3327,7,"Android app for streaming and downloading Movies, TV-Series and Anime.",recloudstream,cloudstream,https://github.com/recloudstream/cloudstream
2023-04-12,kotlin,14140,21,"Legado 3.0 Book Reader with powerful controls & full functions阅读3.0, 阅读是一款可以自定义来源阅读网络内容的工具，为广大网络文学爱好者提供一种方便、快捷舒适的试读体验。",gedoor,legado,https://github.com/gedoor/legado
2023-04-12,kotlin,5681,4,The 2022 Android Developer Roadmap suggests learning paths to understanding Android development.,skydoves,android-developer-roadmap,https://github.com/skydoves/android-developer-roadmap
2023-04-12,kotlin,28355,1,A memory leak detection library for Android.,square,leakcanary,https://github.com/square/leakcanary
2023-04-12,kotlin,452,2,Opensource automated insulin delivery system (closed loop),nightscout,AndroidAPS,https://github.com/nightscout/AndroidAPS
2023-04-12,kotlin,15325,11,Official Jetpack Compose samples.,android,compose-samples,https://github.com/android/compose-samples
2023-04-12,kotlin,42506,8,A collection of samples to discuss and showcase different architectural tools and patterns for Android apps.,android,architecture-samples,https://github.com/android/architecture-samples
2023-04-12,kotlin,43,4,"Anywhere GPT, the ultimate mobile app with seamless AI assistance  at your fingertips! Say goodbye to screen-switching!",Shashank02051997,AnywhereGPT-Android,https://github.com/Shashank02051997/AnywhereGPT-Android
2023-04-12,kotlin,4943,5,The universal proxy toolchain for Android,SagerNet,SagerNet,https://github.com/SagerNet/SagerNet
2023-04-12,kotlin,3081,5,"Modernized and sophisticated tooltips, fully customizable with an arrow and animations for Android.",skydoves,Balloon,https://github.com/skydoves/Balloon
2023-04-12,kotlin,3585,5,A highly customizable calendar view and compose library for Android.,kizitonwose,Calendar,https://github.com/kizitonwose/Calendar
2023-04-12,kotlin,3425,1,"A strongly-typed, caching GraphQL client for the JVM, Android, and Kotlin multiplatform.",apollographql,apollo-kotlin,https://github.com/apollographql/apollo-kotlin
2023-04-12,kotlin,2022,5,同文安卓輸入法平臺3.x/Android-rime/Rime Input Method Engine for Android,osfans,trime,https://github.com/osfans/trime
2023-04-12,kotlin,3275,1,Material Design file manager for Android,zhanghai,MaterialFiles,https://github.com/zhanghai/MaterialFiles