date,language,stargazers,starsToday,description,owner,name,url
2023-11-03,markdown,4416,3,Ethereum.org is a primary online resource for the Ethereum community.,ethereum,ethereum-org-website,https://github.com/ethereum/ethereum-org-website
2023-11-03,markdown,8268,5,The content behind MDN Web Docs,mdn,content,https://github.com/mdn/content
2023-11-03,markdown,1427,0,The source repository of all translated content for MDN Web Docs,mdn,translated-content,https://github.com/mdn/translated-content
2023-11-03,markdown,13854,7,â¬†ï¸ Free uptime monitor and status page powered by GitHub,upptime,upptime,https://github.com/upptime/upptime
2023-11-03,markdown,120676,34,"åˆ·ç®—æ³•å…¨é å¥—è·¯ï¼Œè®¤å‡† labuladong å°±å¤Ÿäº†ï¼English version supported! Crack LeetCode, not only how, but also why.",labuladong,fucking-algorithm,https://github.com/labuladong/fucking-algorithm
2023-11-03,markdown,14633,2,This maintains proposals for changes and user-visible enhancements to the Swift Programming Language.,apple,swift-evolution,https://github.com/apple/swift-evolution
2023-11-03,markdown,3811,3,Rust ç¨‹åºè®¾è®¡è¯­è¨€ï¼ˆ2021 edition æ–½å·¥ä¸­ï¼‰,KaiserY,trpl-zh-cn,https://github.com/KaiserY/trpl-zh-cn
2023-11-03,markdown,4235,2,A collection listing all Achievements available on the GitHub profile ğŸ†,Schweinepriester,github-profile-achievements,https://github.com/Schweinepriester/github-profile-achievements
2023-11-03,markdown,9470,4,Open source documentation of Microsoft Azure,MicrosoftDocs,azure-docs,https://github.com/MicrosoftDocs/azure-docs
2023-11-03,markdown,3147,1,Kotlin Evolution and Enhancement Process,Kotlin,KEEP,https://github.com/Kotlin/KEEP
2023-11-03,markdown,135,1,Solutions (that we managed to find) for the 2021 PicoCTF,vivian-dai,PicoCTF2021-Writeup,https://github.com/vivian-dai/PicoCTF2021-Writeup
2023-11-03,markdown,8549,7,Improve your README.md profile with these amazing badges.,alexandresanlim,Badges4-README.md-Profile,https://github.com/alexandresanlim/Badges4-README.md-Profile
2023-11-03,markdown,25515,19,Linuxå‘½ä»¤å¤§å…¨æœç´¢å·¥å…·ï¼Œå†…å®¹åŒ…å«Linuxå‘½ä»¤æ‰‹å†Œã€è¯¦è§£ã€å­¦ä¹ ã€æœé›†ã€‚https://git.io/linux,jaywcjlove,linux-command,https://github.com/jaywcjlove/linux-command
2023-11-03,markdown,1154,0,IntelliJ SDK Platform Documentation,JetBrains,intellij-sdk-docs,https://github.com/JetBrains/intellij-sdk-docs
2023-11-03,markdown,5450,0,RFCs for changes to Rust,rust-lang,rfcs,https://github.com/rust-lang/rfcs
2023-11-03,markdown,46256,8,ğŸ“š Collaborative cheatsheets for console commands,tldr-pages,tldr,https://github.com/tldr-pages/tldr
2023-11-03,markdown,2069,1,Airbnb's Swift Style Guide,airbnb,swift,https://github.com/airbnb/swift
2023-11-03,markdown,1390,0,SatoshiLabs Improvement Proposals,satoshilabs,slips,https://github.com/satoshilabs/slips