date,language,stargazers,starsToday,description,owner,name,url
2024-07-21,elixir,942,1,Req is a batteries-included HTTP client for Elixir.,wojtekmach,req,https://github.com/wojtekmach/req
2024-07-21,elixir,21004,4,Peace of mind from prototype to production,phoenixframework,phoenix,https://github.com/phoenixframework/phoenix
2024-07-21,elixir,137,0,Wrapper around the Erlang crypto module for Elixir.,ntrepid8,ex_crypto,https://github.com/ntrepid8/ex_crypto
2024-07-21,elixir,19154,4,"Simple, open source, lightweight (< 1 KB) and privacy-friendly web analytics alternative to Google Analytics.",plausible,analytics,https://github.com/plausible/analytics
2024-07-21,elixir,1261,2,Platform for creating interactive courses.,zoonk,zoonk,https://github.com/zoonk/zoonk
2024-07-21,elixir,6003,1,"Rich, real-time user experiences with server-rendered HTML",phoenixframework,phoenix_live_view,https://github.com/phoenixframework/phoenix_live_view
2024-07-21,elixir,141,0,OpenTelemetry instrumentation for Erlang & Elixir,open-telemetry,opentelemetry-erlang-contrib,https://github.com/open-telemetry/opentelemetry-erlang-contrib
2024-07-21,elixir,6494,2,Enterprise-ready zero-trust access platform built on WireGuard®.,firezone,firezone,https://github.com/firezone/firezone
2024-07-21,elixir,532,3,Bonfire - tend to your digital life in community. Customise and host your own online space and control your experience at the most granular level.,bonfire-networks,bonfire-app,https://github.com/bonfire-networks/bonfire-app
2024-07-21,elixir,24071,5,"Elixir is a dynamic, functional language for building scalable and maintainable applications",elixir-lang,elixir,https://github.com/elixir-lang/elixir
2024-07-21,elixir,1473,0,"A declarative, extensible framework for building Elixir applications.",ash-project,ash,https://github.com/ash-project/ash
2024-07-21,elixir,2032,0,Floki is a simple HTML parser that enables search for nodes using CSS selectors.,philss,floki,https://github.com/philss/floki
2024-07-21,elixir,277,0,🟪 AppSignal for Elixir package,appsignal,appsignal-elixir,https://github.com/appsignal/appsignal-elixir
2024-07-21,elixir,43,0,,OffchainLabs,blockscout,https://github.com/OffchainLabs/blockscout
2024-07-21,elixir,4659,2,Automate code & data workflows with interactive Elixir notebooks,livebook-dev,livebook,https://github.com/livebook-dev/livebook