date,language,stargazers,starsToday,description,owner,name,url
2024-07-21,python,11448,587,The memory layer for Personalized AI,mem0ai,mem0,https://github.com/mem0ai/mem0
2024-07-21,python,27209,205,A WebUI for Efficient Fine-Tuning of 100+ LLMs (ACL 2024),hiyouga,LLaMA-Factory,https://github.com/hiyouga/LLaMA-Factory
2024-07-21,python,35513,16,"Apache Airflow - A platform to programmatically author, schedule, and monitor workflows",apache,airflow,https://github.com/apache/airflow
2024-07-21,python,37932,13,The uncompromising Python code formatter,psf,black,https://github.com/psf/black
2024-07-21,python,9968,31,Turns Data and AI algorithms into production-ready web applications in no time.,Avaiga,taipy,https://github.com/Avaiga/taipy
2024-07-21,python,31088,19,"Build and share delightful machine learning apps, all in Python. ğŸŒŸ Star to support our work!",gradio-app,gradio,https://github.com/gradio-app/gradio
2024-07-21,python,3281,9,,karpathy,ng-video-lecture,https://github.com/karpathy/ng-video-lecture
2024-07-21,python,1669,28,"PraisonAI application combines AutoGen and CrewAI or similar frameworks into a low-code solution for building and managing multi-agent LLM systems, focusing on simplicity, customisation, and efficient human-agent collaboration. Chat with your ENTIRE Codebase.",MervinPraison,PraisonAI,https://github.com/MervinPraison/PraisonAI
2024-07-21,python,48746,7,openpilot is an open source driver assistance system. openpilot performs the functions of Automated Lane Centering and Adaptive Cruise Control for 250+ supported car makes and models.,commaai,openpilot,https://github.com/commaai/openpilot
2024-07-21,python,4385,3,This repository is for active development of the Azure SDK for Python. For consumers of the SDK we recommend visiting our public developer docs at https://docs.microsoft.com/python/azure/ or our versioned developer docs at https://azure.github.io/azure-sdk-for-python.,Azure,azure-sdk-for-python,https://github.com/Azure/azure-sdk-for-python
2024-07-21,python,6589,103,åŸºäºpythonçš„ç½‘é¡µè‡ªåŠ¨åŒ–å·¥å…·ã€‚æ—¢èƒ½æ§åˆ¶æµè§ˆå™¨ï¼Œä¹Ÿèƒ½æ”¶å‘æ•°æ®åŒ…ã€‚å¯å…¼é¡¾æµè§ˆå™¨è‡ªåŠ¨åŒ–çš„ä¾¿åˆ©æ€§å’Œrequestsçš„é«˜æ•ˆç‡ã€‚åŠŸèƒ½å¼ºå¤§ï¼Œå†…ç½®æ— æ•°äººæ€§åŒ–è®¾è®¡å’Œä¾¿æ·åŠŸèƒ½ã€‚è¯­æ³•ç®€æ´è€Œä¼˜é›…ï¼Œä»£ç é‡å°‘ã€‚,g1879,DrissionPage,https://github.com/g1879/DrissionPage
2024-07-21,python,14565,23,Convert PDF to markdown quickly with high accuracy,VikParuchuri,marker,https://github.com/VikParuchuri/marker
2024-07-21,python,28438,28,åŸºäºå¤§æ¨¡å‹æ­å»ºçš„èŠå¤©æœºå™¨äººï¼ŒåŒæ—¶æ”¯æŒ å¾®ä¿¡å…¬ä¼—å·ã€ä¼ä¸šå¾®ä¿¡åº”ç”¨ã€é£ä¹¦ã€é’‰é’‰ ç­‰æ¥å…¥ï¼Œå¯é€‰æ‹©GPT3.5/GPT-4o/GPT4.0/ Claude/æ–‡å¿ƒä¸€è¨€/è®¯é£æ˜Ÿç«/é€šä¹‰åƒé—®/ Gemini/GLM-4/Claude/Kimi/LinkAIï¼Œèƒ½å¤„ç†æ–‡æœ¬ã€è¯­éŸ³å’Œå›¾ç‰‡ï¼Œè®¿é—®æ“ä½œç³»ç»Ÿå’Œäº’è”ç½‘ï¼Œæ”¯æŒåŸºäºè‡ªæœ‰çŸ¥è¯†åº“è¿›è¡Œå®šåˆ¶ä¼ä¸šæ™ºèƒ½å®¢æœã€‚,zhayujie,chatgpt-on-wechat,https://github.com/zhayujie/chatgpt-on-wechat
2024-07-21,python,794,45,"A one-stop, open-source, high-quality data extraction tool, supports PDF/webpage/e-book extraction.ä¸€ç«™å¼å¼€æºé«˜è´¨é‡æ•°æ®æå–å·¥å…·ï¼Œæ”¯æŒPDF/ç½‘é¡µ/å¤šæ ¼å¼ç”µå­ä¹¦æå–ã€‚",opendatalab,MinerU,https://github.com/opendatalab/MinerU
2024-07-21,python,10391,16,Faster Whisper transcription with CTranslate2,SYSTRAN,faster-whisper,https://github.com/SYSTRAN/faster-whisper
2024-07-21,python,16106,51,"The best and simplest free open source web page change detection, website watcher, restock monitor and notification service. Restock Monitor, change detection. Designed for simplicity - Simply monitor which websites had a text change for free. Free Open source web page change detection, Website defacement monitoring, Price change notification",dgtlmoon,changedetection.io,https://github.com/dgtlmoon/changedetection.io