date,language,stargazers,starsToday,description,owner,name,url
2023-02-26,astro,230990,112,"Interactive roadmaps, guides and other educational content to help developers grow in their careers.",kamranahmedse,developer-roadmap,https://github.com/kamranahmedse/developer-roadmap
2023-02-26,astro,24,7,A place for sharing Angular Snippets,santoshyadavdev,angular-snippets,https://github.com/santoshyadavdev/angular-snippets
2023-02-26,astro,395,5,"A minimal, accessible and SEO-friendly Astro blog theme",satnaing,astro-paper,https://github.com/satnaing/astro-paper
2023-02-26,astro,115,2,"Astro Modern Personal Website Template with Project Section, CV Section, Paginated Blog, RSS Feed, SEO Friendly, Visual themes and Responsive Desing.",manuelernestog,astro-modern-personal-website,https://github.com/manuelernestog/astro-modern-personal-website
2023-02-26,astro,648,3,AstroWind: A free template using Astro 2.0 and Tailwind CSS.,onwidget,astrowind,https://github.com/onwidget/astrowind
2023-02-26,astro,154,2,"An Accessible Starter Theme for Astro including accessibility features such as landmarks, better focus-outline and skip-links navigation. Ships with Tailwind, Prettier and ESLint support.",markteekman,accessible-astro-starter,https://github.com/markteekman/accessible-astro-starter
2023-02-26,astro,353,2,"Astroship is a starter template for startups, marketing websites, landing pages & blog. Built with Astro & TailwindCSS",surjithctly,astroship,https://github.com/surjithctly/astroship
2023-02-26,astro,85,5,Let's start your own Notion Blog with Astro.,otoyo,astro-notion-blog,https://github.com/otoyo/astro-notion-blog
2023-02-26,astro,377,2,Makes it easy to add information that is relevant for SEO to your Astro app.,jonasmerlin,astro-seo,https://github.com/jonasmerlin/astro-seo
2023-02-26,astro,13900,0,,HubSpot,youmightnotneedjquery,https://github.com/HubSpot/youmightnotneedjquery