date,language,stargazers,starsToday,description,owner,name,url
2023-01-16,svelte,3315,12,A collection of advanced CSS styles to create realistic-looking effects for the faces of Pokemon cards.,simeydotme,pokemon-cards-css,https://github.com/simeydotme/pokemon-cards-css
2023-01-16,svelte,42,2,Opensource version of Nomie 6,open-nomie,nomie6-oss,https://github.com/open-nomie/nomie6-oss
2023-01-16,svelte,1594,2,"A simple standalone program which automates the installation, removal and maintenance of BetterDiscord.",BetterDiscord,Installer,https://github.com/BetterDiscord/Installer
2023-01-16,svelte,2786,2,Svelte Material UI Components,hperrin,svelte-material-ui,https://github.com/hperrin/svelte-material-ui
2023-01-16,svelte,1236,2,Unofficial Svelte port of the Headless UI component library,rgossiaux,svelte-headlessui,https://github.com/rgossiaux/svelte-headlessui
2023-01-16,svelte,63,0,Website for ReVanced,revanced,revanced-website,https://github.com/revanced/revanced-website
2023-01-16,svelte,587,1,Notus Svelte: Free Tailwind CSS UI Kit and Admin,creativetimofficial,notus-svelte,https://github.com/creativetimofficial/notus-svelte
2023-01-16,svelte,0,0,,Vincentvibe3,BrebeufHx-6.0,https://github.com/Vincentvibe3/BrebeufHx-6.0
2023-01-16,svelte,980,12,A fully featured UI toolkit for Svelte + Tailwind.,skeletonlabs,skeleton,https://github.com/skeletonlabs/skeleton
2023-01-16,svelte,417,0,The official IOTA and Shimmer wallet,iotaledger,firefly,https://github.com/iotaledger/firefly
2023-01-16,svelte,2546,4,Build and ship your app faster https://fireship.io,fireship-io,fireship.io,https://github.com/fireship-io/fireship.io
2023-01-16,svelte,207,1,The Svelte Society website,svelte-society,sveltesociety.dev,https://github.com/svelte-society/sveltesociety.dev
2023-01-16,svelte,1519,2,A lightweight Svelte component library for building interactive node-based flow diagrams,open-source-labs,Svelvet,https://github.com/open-source-labs/Svelvet
2023-01-16,svelte,1610,6,"Open-source web IDE, scalable runtime and platform for serverless, workflows and UIs",windmill-labs,windmill,https://github.com/windmill-labs/windmill
2023-01-16,svelte,66,0,Ultra customizable hud featuring a unique and robust settings menu. Change eveything about your experience!,Project-Sloth,ps-hud,https://github.com/Project-Sloth/ps-hud
2023-01-16,svelte,483,0,Official Svelte components built for Flowbite and Tailwind CSS,themesberg,flowbite-svelte,https://github.com/themesberg/flowbite-svelte
2023-01-16,svelte,622,0,b站全平台投稿客户端，支持多p投稿，稿件编辑,ForgQi,biliup-app,https://github.com/ForgQi/biliup-app
2023-01-16,svelte,169,3,Useful svelte stuff to put in your projects,vnphanquang,svelte-put,https://github.com/vnphanquang/svelte-put
2023-01-16,svelte,619,3,A three.js component library for Svelte.,threlte,threlte,https://github.com/threlte/threlte
2023-01-16,svelte,102,2,,yekta,stablecog,https://github.com/yekta/stablecog
2023-01-16,svelte,249,0,Issue-Crawler for GitHub based on Sveltekit,EddieHubCommunity,good-first-issue-finder,https://github.com/EddieHubCommunity/good-first-issue-finder
2023-01-16,svelte,5431,10,An open-source & self-hostable Heroku / Netlify alternative.,coollabsio,coolify,https://github.com/coollabsio/coolify
2023-01-16,svelte,1935,3,Svelte implementation of the Carbon Design System,carbon-design-system,carbon-components-svelte,https://github.com/carbon-design-system/carbon-components-svelte
2023-01-16,svelte,77,0,"Frontend components, documentation and information hosted on the Hugging Face website.",huggingface,hub-docs,https://github.com/huggingface/hub-docs
2023-01-16,svelte,1793,1,SvelteKit implementation of the RealWorld app,sveltejs,realworld,https://github.com/sveltejs/realworld