date,language,stargazers,starsToday,description,owner,name,url
2022-07-10,scala,807,4,"Feathr – An Enterprise-Grade, High Performance Feature Store",linkedin,feathr,https://github.com/linkedin/feathr
2022-07-10,scala,812,0,Scientific workflow engine designed for simplicity & scalability. Trivially transition between one off use cases to massive scale production environments,broadinstitute,cromwell,https://github.com/broadinstitute/cromwell
2022-07-10,scala,3442,1,"ZIO — A type-safe, composable library for async and concurrent programming in Scala",zio,zio,https://github.com/zio/zio
2022-07-10,scala,8746,2,"Removes large or troublesome blobs like git-filter-branch does, but faster. And written in Scala",rtyley,bfg-repo-cleaner,https://github.com/rtyley/bfg-repo-cleaner
2022-07-10,scala,3355,0,Simple and Distributed Machine Learning,microsoft,SynapseML,https://github.com/microsoft/SynapseML
2022-07-10,scala,13791,2,"Scala 2 compiler and standard library. For bugs, see scala/bug",scala,scala,https://github.com/scala/scala
2022-07-10,scala,12295,1,"Build highly concurrent, distributed, and resilient message-driven applications on the JVM",akka,akka,https://github.com/akka/akka
2022-07-10,scala,1115,1,"Apache Kyuubi is a distributed multi-tenant JDBC server for large-scale data processing and analytics, built on top of Apache Spark",apache,incubator-kyuubi,https://github.com/apache/incubator-kyuubi
2022-07-10,scala,5575,1,Modern Load Testing as Code,gatling,gatling,https://github.com/gatling/gatling
2022-07-10,scala,8290,0,"A fault tolerant, protocol-agnostic RPC system",twitter,finagle,https://github.com/twitter/finagle
2022-07-10,scala,7044,3,Snowflake is a network service for generating unique ID numbers at high scale with some simple guarantees.,twitter-archive,snowflake,https://github.com/twitter-archive/snowflake
2022-07-10,scala,33328,0,Apache Spark - A unified analytics engine for large-scale data processing,apache,spark,https://github.com/apache/spark
2022-07-10,scala,2810,3,State of the Art Natural Language Processing,JohnSnowLabs,spark-nlp,https://github.com/JohnSnowLabs/spark-nlp
2022-07-10,scala,5025,2,"The Scala 3 compiler, also known as Dotty.",lampepfl,dotty,https://github.com/lampepfl/dotty
2022-07-10,scala,11643,2,"♞ lichess.org: the forever free, adless and open source chess server ♞",lichess-org,lila,https://github.com/lichess-org/lila
2022-07-10,scala,5725,1,Apache OpenWhisk is an open source serverless cloud platform,apache,openwhisk,https://github.com/apache/openwhisk
2022-07-10,scala,2612,0,Chisel 3: A Modern Hardware Design Language,chipsalliance,chisel3,https://github.com/chipsalliance/chisel3
2022-07-10,scala,2830,1,Open-source high-performance RISC-V processor,OpenXiangShan,XiangShan,https://github.com/OpenXiangShan/XiangShan
2022-07-10,scala,2326,0,"Deequ is a library built on top of Apache Spark for defining ""unit tests for data"", which measure data quality in large datasets.",awslabs,deequ,https://github.com/awslabs/deequ
2022-07-10,scala,182,0,Apache Spark Connector for Azure Cosmos DB,Azure,azure-cosmosdb-spark,https://github.com/Azure/azure-cosmosdb-spark
2022-07-10,scala,834,1,"Non-blocking, Reactive MongoDB Driver for Scala",ReactiveMongo,ReactiveMongo,https://github.com/ReactiveMongo/ReactiveMongo
2022-07-10,scala,758,0,A Thrift parser/generator,twitter,scrooge,https://github.com/twitter/scrooge
2022-07-10,scala,10899,1,CMAK is a tool for managing Apache Kafka clusters,yahoo,CMAK,https://github.com/yahoo/CMAK
2022-07-10,scala,12159,2,Play Framework,playframework,playframework,https://github.com/playframework/playframework
2022-07-10,scala,2306,1,Yet another JSON library for Scala,circe,circe,https://github.com/circe/circe