date,language,stargazers,starsToday,description,owner,name,url
2024-06-16,lua,16257,24,A launch point for your personal nvim configuration,nvim-lua,kickstart.nvim,https://github.com/nvim-lua/kickstart.nvim
2024-06-16,lua,3235,15,Neovim file explorer: edit your filesystem like a buffer,stevearc,oil.nvim,https://github.com/stevearc/oil.nvim
2024-06-16,lua,735,2,"Easily create and manage predefined window layouts, bringing a new edge to your workflow",folke,edgy.nvim,https://github.com/folke/edgy.nvim
2024-06-16,lua,1214,3,A better annotation generator. Supports multiple languages and annotation conventions.,danymat,neogen,https://github.com/danymat/neogen
2024-06-16,lua,330,1,Canary Server 13.x for OpenTibia community.,opentibiabr,canary,https://github.com/opentibiabr/canary
2024-06-16,lua,159,40,A Neovim Plugin for the yazi terminal file manager,mikavilpas,yazi.nvim,https://github.com/mikavilpas/yazi.nvim
2024-06-16,lua,38134,11,🦍 The Cloud-Native API Gateway and AI Gateway.,Kong,kong,https://github.com/Kong/kong
2024-06-16,lua,13873,3,The Cloud-Native API Gateway,apache,apisix,https://github.com/apache/apisix
2024-06-16,lua,3354,1,Get your data in RAM. Get compute close to data. Enjoy the performance.,tarantool,tarantool,https://github.com/tarantool/tarantool
2024-06-16,lua,685,3,My dotfiles synced form localhost and remote machines,omerxx,dotfiles,https://github.com/omerxx/dotfiles
2024-06-16,lua,1005,1,A community repository of common plugin specifications,AstroNvim,astrocommunity,https://github.com/AstroNvim/astrocommunity
2024-06-16,lua,4325,14,Library of 40+ independent Lua modules improving overall Neovim (version 0.8 and higher) experience with minimal effort,echasnovski,mini.nvim,https://github.com/echasnovski/mini.nvim
2024-06-16,lua,2983,0,Jitsi Meet on Docker,jitsi,docker-jitsi-meet,https://github.com/jitsi/docker-jitsi-meet
2024-06-16,lua,1864,4,Improved fzf.vim written in lua,ibhagwan,fzf-lua,https://github.com/ibhagwan/fzf-lua
2024-06-16,lua,4927,6,🍨 Soothing pastel theme for (Neo)vim,catppuccin,nvim,https://github.com/catppuccin/nvim