date,language,stargazers,starsToday,description,owner,name,url
2022-11-15,astro,310,5,A template to make your website using Astro + Tailwind CSS.,onwidget,astrowind,https://github.com/onwidget/astrowind
2022-11-15,astro,334,1,Astro documentation,withastro,docs,https://github.com/withastro/docs
2022-11-15,astro,133,0,"A curated list of the tech I use, built with Astro and Tailwind CSS",craftzdog,craftzdog-uses,https://github.com/craftzdog/craftzdog-uses
2022-11-15,astro,106,11,"Astroship is a starter template for startups, marketing websites & landing pages. Built with Astro, TailwindCSS & Alpine.js",surjithctly,astroship,https://github.com/surjithctly/astroship
2022-11-15,astro,26,0,,stackblitz,ilovecodeflow.com,https://github.com/stackblitz/ilovecodeflow.com
2022-11-15,astro,53,0,"A minimal, responsive and SEO-friendly Astro blog theme",satnaing,astro-paper,https://github.com/satnaing/astro-paper