date,language,stargazers,starsToday,description,owner,name,url
2022-11-15,lua,5519,12,AstroNvim is an aesthetic and feature-rich neovim config that is extensible and easy to use with a great set of plugins,AstroNvim,AstroNvim,https://github.com/AstroNvim/AstroNvim
2022-11-15,lua,1518,2,Service eggs for the pterodactyl panel,parkervcp,eggs,https://github.com/parkervcp/eggs
2022-11-15,lua,1831,3,A snazzy bufferline for Neovim,akinsho,bufferline.nvim,https://github.com/akinsho/bufferline.nvim
2022-11-15,lua,4185,5,A completion plugin for neovim coded in Lua.,hrsh7th,nvim-cmp,https://github.com/hrsh7th/nvim-cmp
2022-11-15,lua,741,1,My neovim config,ChristianChiarulli,nvim,https://github.com/ChristianChiarulli/nvim
2022-11-15,lua,264,7,,josean-dev,dev-environment-files,https://github.com/josean-dev/dev-environment-files
2022-11-15,lua,770,1,a lua powered greeter like vim-startify / dashboard-nvim,goolord,alpha-nvim,https://github.com/goolord/alpha-nvim
2022-11-15,lua,2172,3,neovim lsp plugin,glepnir,lspsaga.nvim,https://github.com/glepnir/lspsaga.nvim
2022-11-15,lua,11663,12,"An ebook reader application supporting PDF, DjVu, EPUB, FB2 and many more formats, running on Cervantes, Kindle, Kobo, PocketBook and Android devices",koreader,koreader,https://github.com/koreader/koreader
2022-11-15,lua,422,0,nvim-cmp source for neovim builtin LSP client,hrsh7th,cmp-nvim-lsp,https://github.com/hrsh7th/cmp-nvim-lsp
2022-11-15,lua,2097,3,Create key bindings that stick. WhichKey is a lua plugin for Neovim 0.5 that displays a popup with possible keybindings of the command you started typing.,folke,which-key.nvim,https://github.com/folke/which-key.nvim
2022-11-15,lua,2099,5,Indent guides for Neovim,lukas-reineke,indent-blankline.nvim,https://github.com/lukas-reineke/indent-blankline.nvim
2022-11-15,lua,7797,5,"Find, Filter, Preview, Pick. All lua, all the time.",nvim-telescope,telescope.nvim,https://github.com/nvim-telescope/telescope.nvim
2022-11-15,lua,1537,1,NeoVim dark colorscheme inspired by the colors of the famous painting by Katsushika Hokusai.,rebelot,kanagawa.nvim,https://github.com/rebelot/kanagawa.nvim
2022-11-15,lua,1327,4,The neovim tabline plugin.,romgrk,barbar.nvim,https://github.com/romgrk/barbar.nvim
2022-11-15,lua,194,2,Slot-based inventory with metadata.,overextended,ox_inventory,https://github.com/overextended/ox_inventory
2022-11-15,lua,2338,7,"A pretty diagnostics, references, telescope results, quickfix and location list to help you solve all the trouble your code is causing.",folke,trouble.nvim,https://github.com/folke/trouble.nvim
2022-11-15,lua,3973,10,My personal dotfiles,craftzdog,dotfiles-public,https://github.com/craftzdog/dotfiles-public
2022-11-15,lua,1821,6,A neovim lua plugin to help easily manage multiple terminal windows,akinsho,toggleterm.nvim,https://github.com/akinsho/toggleterm.nvim
2022-11-15,lua,1633,6,"// Smart and powerful comment plugin for neovim. Supports treesitter, dot repeat, left-right/up-down motions, hooks, and more",numToStr,Comment.nvim,https://github.com/numToStr/Comment.nvim
2022-11-15,lua,179,0,All scripts and code used through videos/tutorials on Jeva. Created and maintained by @ThatZiv,jevajs,Jeva,https://github.com/jevajs/Jeva
2022-11-15,lua,1684,6,Soothing pastel theme for Neovim,catppuccin,nvim,https://github.com/catppuccin/nvim
2022-11-15,lua,1488,3,Snippet Engine for Neovim written in Lua.,L3MON4D3,LuaSnip,https://github.com/L3MON4D3/LuaSnip
2022-11-15,lua,714,1,Neovim plugin to improve the default vim.ui interfaces,stevearc,dressing.nvim,https://github.com/stevearc/dressing.nvim
2022-11-15,lua,3643,10,A file explorer tree for neovim written in lua,nvim-tree,nvim-tree.lua,https://github.com/nvim-tree/nvim-tree.lua