date,language,stargazers,starsToday,description,owner,name,url
2023-05-16,php,8542,2,"A customizable, open-source ecommerce platform built on WordPress. Build any commerce solution you can imagine.",woocommerce,woocommerce,https://github.com/woocommerce/woocommerce
2023-05-16,php,4973,2,"Pterodactyl® is a free, open-source game server management panel built with PHP, React, and Go. Designed with security in mind, Pterodactyl runs all game servers in isolated Docker containers while exposing a beautiful and intuitive UI to end users.",pterodactyl,panel,https://github.com/pterodactyl/panel
2023-05-16,php,19089,3,The PHP Unit Testing framework.,sebastianbergmann,phpunit,https://github.com/sebastianbergmann/phpunit
2023-05-16,php,6097,6,"A free, self-hostable aggregator…",FreshRSS,FreshRSS,https://github.com/FreshRSS/FreshRSS
2023-05-16,php,46552,23,"SecLists is the security tester's companion. It's a collection of multiple types of lists used during security assessments, collected in one place. List types include usernames, passwords, URLs, sensitive data patterns, fuzzing payloads, web shells, and many more.",danielmiessler,SecLists,https://github.com/danielmiessler/SecLists
2023-05-16,php,10410,5,Firefly III: a personal finances manager,firefly-iii,firefly-iii,https://github.com/firefly-iii/firefly-iii
2023-05-16,php,22542,8,"Nextcloud server, a safe home for all your data",nextcloud,server,https://github.com/nextcloud/server
2023-05-16,php,3437,2,基于 Laravel 的后台系统构建工具 (Laravel Admin)，使用很少的代码快速构建一个功能完善的高颜值后台系统，内置丰富的后台常用组件，开箱即用，让开发者告别冗杂的HTML代码,jqhph,dcat-admin,https://github.com/jqhph/dcat-admin
2023-05-16,php,3443,6,Argon - 一个轻盈、简洁的 WordPress 主题,solstice23,argon-theme,https://github.com/solstice23/argon-theme
2023-05-16,php,6560,3,A web interface for MySQL and MariaDB,phpmyadmin,phpmyadmin,https://github.com/phpmyadmin/phpmyadmin
2023-05-16,php,4194,4,Main repository for pfSense,pfsense,pfsense,https://github.com/pfsense/pfsense
2023-05-16,php,117,19,The ultimate solution for adding recurring functionality to your Laravel Models!,mohammedmanssour,laravel-recurring-models,https://github.com/mohammedmanssour/laravel-recurring-models
2023-05-16,php,6235,5,Free and Online Accounting Software,akaunting,akaunting,https://github.com/akaunting/akaunting
2023-05-16,php,1585,6,"OpenAI PHP SDK : Most downloaded, forked, contributed, huge community supported, and used PHP (Laravel , Symfony, Yii, Cake PHP or any PHP framework) SDK for OpenAI GPT-3 and DALL-E. It also supports chatGPT-like streaming. (ChatGPT AI is supported)",orhanerday,open-ai,https://github.com/orhanerday/open-ai
2023-05-16,php,7567,7,Damn Vulnerable Web Application (DVWA),digininja,DVWA,https://github.com/digininja/DVWA
2023-05-16,php,6293,0,"A spec compliant, secure by default PHP OAuth 2.0 Server",thephpleague,oauth2-server,https://github.com/thephpleague/oauth2-server
2023-05-16,php,14667,3,A personal music streaming server that works.,koel,koel,https://github.com/koel/koel
2023-05-16,php,4283,34,"Docker - Beginners | Intermediate | Advanced",collabnix,dockerlabs,https://github.com/collabnix/dockerlabs
2023-05-16,php,13780,2,"Modern, Crazy Fast, Ridiculously Easy and Amazingly Powerful Flat-File CMS powered by PHP, Markdown, Twig, and Symfony",getgrav,grav,https://github.com/getgrav/grav
2023-05-16,php,10260,3,Mobile_Detect is a lightweight PHP class for detecting mobile devices (including tablets). It uses the User-Agent string combined with specific HTTP headers to detect the mobile environment.,serbanghita,Mobile-Detect,https://github.com/serbanghita/Mobile-Detect
2023-05-16,php,5975,4,An Application dashboard and launcher,linuxserver,Heimdall,https://github.com/linuxserver/Heimdall
2023-05-16,php,15186,2,Debugbar for Laravel (Integrates PHP Debug Bar),barryvdh,laravel-debugbar,https://github.com/barryvdh/laravel-debugbar
2023-05-16,php,9664,6,HTML to PDF converter for PHP,dompdf,dompdf,https://github.com/dompdf/dompdf
2023-05-16,php,4686,2,WP-CLI framework,wp-cli,wp-cli,https://github.com/wp-cli/wp-cli
2023-05-16,php,22518,2,"Guzzle, an extensible PHP HTTP client",guzzle,guzzle,https://github.com/guzzle/guzzle