date,language,stargazers,starsToday,description,owner,name,url
2024-08-21,go,20980,254,fabric is an open-source framework for augmenting humans using AI. It provides a modular framework for solving specific problems using a crowdsourced set of AI prompts that can be used anywhere.,danielmiessler,fabric,https://github.com/danielmiessler/fabric
2024-08-21,go,21671,28,"An open source, self-hosted implementation of the Tailscale control server",juanfont,headscale,https://github.com/juanfont/headscale
2024-08-21,go,3172,22,Fast and reliable background jobs in Go,riverqueue,river,https://github.com/riverqueue/river
2024-08-21,go,26137,23,A powerful little TUI framework 🏗,charmbracelet,bubbletea,https://github.com/charmbracelet/bubbletea
2024-08-21,go,83627,52,A fast reverse proxy to help you expose a local server behind a NAT or firewall to the internet.,fatedier,frp,https://github.com/fatedier/frp
2024-08-21,go,4138,70,"A Go (Golang) Backend Clean Architecture project with Gin, MongoDB, JWT Authentication Middleware, Test, and Docker.",amitshekhariitbhu,go-backend-clean-architecture,https://github.com/amitshekhariitbhu/go-backend-clean-architecture
2024-08-21,go,77522,25,"Gin is a HTTP web framework written in Go (Golang). It features a Martini-like API with much better performance -- up to 40 times faster. If you need smashing performance, get yourself some Gin.",gin-gonic,gin,https://github.com/gin-gonic/gin
2024-08-21,go,6143,7,⛓️ A Framework for Building High Value Public Blockchains ✨,cosmos,cosmos-sdk,https://github.com/cosmos/cosmos-sdk
2024-08-21,go,2974,13,Sonne tanken ☀️🚘,evcc-io,evcc,https://github.com/evcc-io/evcc
2024-08-21,go,17762,69,The universal proxy platform,SagerNet,sing-box,https://github.com/SagerNet/sing-box
2024-08-21,go,10352,8,Automatically generate RESTful API documentation with Swagger 2.0 for Go.,swaggo,swag,https://github.com/swaggo/swag
2024-08-21,go,26643,10,Go configuration with fangs,spf13,viper,https://github.com/spf13/viper
2024-08-21,go,1961,11,GoMock is a mocking framework for the Go programming language.,uber-go,mock,https://github.com/uber-go/mock
2024-08-21,go,4494,0,Terraform provider for Azure Resource Manager,hashicorp,terraform-provider-azurerm,https://github.com/hashicorp/terraform-provider-azurerm
2024-08-21,go,68347,7,The Moby Project - a collaborative project for the container ecosystem to assemble container-based systems,moby,moby,https://github.com/moby/moby
2024-08-21,go,36375,10,"The fantastic ORM library for Golang, aims to be developer friendly",go-gorm,gorm,https://github.com/go-gorm/gorm
2024-08-21,go,6268,14,Open and extensible continuous delivery solution for Kubernetes. Powered by GitOps Toolkit.,fluxcd,flux2,https://github.com/fluxcd/flux2
2024-08-21,go,22069,9,"SeaweedFS is a fast distributed storage system for blobs, objects, files, and data lake, for billions of files! Blob store has O(1) disk seek, cloud tiering. Filer supports Cloud Drive, cross-DC active-active replication, Kubernetes, POSIX FUSE mount, S3 API, S3 Gateway, Hadoop, WebDAV, encryption, Erasure Coding.",seaweedfs,seaweedfs,https://github.com/seaweedfs/seaweedfs
2024-08-21,go,49716,27,The Cloud Native Application Proxy,traefik,traefik,https://github.com/traefik/traefik
2024-08-21,go,9379,9,"An all-in-one observability solution which aims to combine the advantages of Prometheus and Grafana. It manages alert rules and visualizes metrics, logs, traces in a beautiful web UI.",ccfos,nightingale,https://github.com/ccfos/nightingale
2024-08-21,go,16797,5,Analyzes resource usage and performance characteristics of running containers.,google,cadvisor,https://github.com/google/cadvisor
2024-08-21,go,5516,0,"Optimism is Ethereum, scaled.",ethereum-optimism,optimism,https://github.com/ethereum-optimism/optimism
2024-08-21,go,15167,12,Fast linters runner for Go,golangci,golangci-lint,https://github.com/golangci/golangci-lint
2024-08-21,go,27395,58,Easily and securely send things from one computer to another 🐊 📦,schollz,croc,https://github.com/schollz/croc
2024-08-21,go,12783,3,Compile-time Dependency Injection for Go,google,wire,https://github.com/google/wire