date,stargazers,starsToday,description,owner,name,url
2021-12-28,2,22,Web GUI for youtube-dl,Rudloff,alltube,https://github.com/Rudloff/alltube
2021-12-28,15,4,"WordPress, Git-ified. This repository is just a mirror of the WordPress subversion repository. Please do not send pull requests. Submit pull requests to https://github.com/WordPress/wordpress-develop and patches to https://core.trac.wordpress.org/ instead.",WordPress,WordPress,https://github.com/WordPress/WordPress
2021-12-28,15,13,"Personal CRM. Remember everything about your friends, family and business relationships.",monicahq,monica,https://github.com/monicahq/monica
2021-12-28,4,1,A static analysis tool for finding errors in PHP applications,vimeo,psalm,https://github.com/vimeo/psalm
2021-12-28,2,2,"Pterodactyl is an open-source game server management panel built with PHP 7, React, and Go. Designed with security in mind, Pterodactyl runs all game servers in isolated Docker containers while exposing a beautiful and intuitive UI to end users.",pterodactyl,panel,https://github.com/pterodactyl/panel
2021-12-28,2,4,"World countries, states, regions, provinces, cities, towns in JSON, SQL, XML, YAML, and CSV. All Countries, States, Cities with ISO2, ISO3, Country Code, Phone Code, Capital, Native Language, Timezones, Latitude, Longitude, Region, Subregion, Flag Emoji, and Currency. #countries #states #cities",dr5hn,countries-states-cities-database,https://github.com/dr5hn/countries-states-cities-database
2021-12-28,3,1,"Wave - The Software as a Service Starter Kit, designed to help you build the SAAS of your dreams",thedevdojo,wave,https://github.com/thedevdojo/wave
2021-12-28,367,1,"Twenty Twenty-Two, the default WordPress theme that will launch with WordPress 5.9.",WordPress,twentytwentytwo,https://github.com/WordPress/twentytwentytwo
2021-12-28,1,1,"WordPress Develop, Git-ified. Synced from git://develop.git.wordpress.org/, including branches and tags! This repository is just a mirror of the WordPress subversion repository. Please include a link to a pre-existing ticket on https://core.trac.wordpress.org/ with every pull request.",WordPress,wordpress-develop,https://github.com/WordPress/wordpress-develop
2021-12-28,5,5,Damn Vulnerable Web Application (DVWA),digininja,DVWA,https://github.com/digininja/DVWA
2021-12-28,2,6,独角数卡(自动售货系统)-开源式站长自动化售货解决方案、高效、稳定、快速！,assimon,dujiaoka,https://github.com/assimon/dujiaoka
2021-12-28,981,2,,pentestmonkey,php-reverse-shell,https://github.com/pentestmonkey/php-reverse-shell
2021-12-28,8,5,A PHP Blogging Platform. Simple and Powerful.,typecho,typecho,https://github.com/typecho/typecho
2021-12-28,5,4,Simple forum software for building great communities.,flarum,core,https://github.com/flarum/core
2021-12-28,20,6,sample code for several design patterns in PHP 8,DesignPatternsPHP,DesignPatternsPHP,https://github.com/DesignPatternsPHP/DesignPatternsPHP
2021-12-28,17,13,"Nextcloud server, a safe home for all your data",nextcloud,server,https://github.com/nextcloud/server
2021-12-28,4,43,Open Source Invoicing Solution for Individuals & Businesses,crater-invoice,crater,https://github.com/crater-invoice/crater
2021-12-28,1,4,兰空图床(Lsky Pro) - Your photo album on the cloud.,wisp-x,lsky-pro,https://github.com/wisp-x/lsky-pro
2021-12-28,31,1,"File Upload widget with multiple file selection, drag&drop support, progress bar, validation and preview images, audio and video for jQuery. Supports cross-domain, chunked and resumable file uploads. Works with any server-side platform (Google App Engine, PHP, Python, Ruby on Rails, Java, etc.) that supports standard HTML form file uploads.",blueimp,jQuery-File-Upload,https://github.com/blueimp/jQuery-File-Upload
2021-12-28,15,5,Liberating Web Analytics. Star us on Github? +1. Matomo is the leading open alternative to Google Analytics that gives you full control over your data. Matomo lets you easily collect data from websites & apps and visualise this data and extract insights. Privacy is built-in. We love Pull Requests!,matomo-org,matomo,https://github.com/matomo-org/matomo
2021-12-28,64,6,A collection of experimental block-based WordPress themes.,wpengine,themes,https://github.com/wpengine/themes
2021-12-28,7,2,"Twig, the flexible, fast, and secure template language for PHP",twigphp,Twig,https://github.com/twigphp/Twig
2021-12-28,2,5,"A @laravel based RAD platform for back-office applications, admin/user panels, and dashboards.",orchidsoftware,platform,https://github.com/orchidsoftware/platform
2021-12-28,6,0,The Translation component provides tools to internationalize your application.,symfony,translation,https://github.com/symfony/translation
2021-12-28,30,7,Bind your interfaces to implementations automatically.,michael-rubel,laravel-auto-binder,https://github.com/michael-rubel/laravel-auto-binder