date,language,stargazers,starsToday,description,owner,name,url
2022-10-26,lua,1039,9,Library of 20+ independent Lua modules improving overall Neovim (version 0.6 and higher) experience with minimal effort,echasnovski,mini.nvim,https://github.com/echasnovski/mini.nvim
2022-10-26,lua,40,3,,josean-dev,dev-environment-files,https://github.com/josean-dev/dev-environment-files
2022-10-26,lua,10516,8,The Cloud-Native API Gateway,apache,apisix,https://github.com/apache/apisix
2022-10-26,lua,846,7,Neovim plugin to manage the file system and other tree like structures.,nvim-neo-tree,neo-tree.nvim,https://github.com/nvim-neo-tree/neo-tree.nvim
2022-10-26,lua,1459,1,,ThePrimeagen,.dotfiles,https://github.com/ThePrimeagen/.dotfiles
2022-10-26,lua,3845,8,My personal dotfiles,craftzdog,dotfiles-public,https://github.com/craftzdog/dotfiles-public
2022-10-26,lua,3498,7,A file explorer tree for neovim written in lua,nvim-tree,nvim-tree.lua,https://github.com/nvim-tree/nvim-tree.lua
2022-10-26,lua,1177,1,明日方舟速通 arknights,tkkcc,ArkLights,https://github.com/tkkcc/ArkLights
2022-10-26,lua,713,3,My neovim config,ChristianChiarulli,nvim,https://github.com/ChristianChiarulli/nvim
2022-10-26,lua,7595,9,"Find, Filter, Preview, Pick. All lua, all the time.",nvim-telescope,telescope.nvim,https://github.com/nvim-telescope/telescope.nvim
2022-10-26,lua,2887,4,Modernity meets insane extensibility. The future of organizing your life in Neovim.,nvim-neorg,neorg,https://github.com/nvim-neorg/neorg
2022-10-26,lua,5871,8,Quickstart configs for Nvim LSP,neovim,nvim-lspconfig,https://github.com/neovim/nvim-lspconfig
2022-10-26,lua,152,2,User Interface replacement AddOn for World of Warcraft.,tukui-org,ElvUI,https://github.com/tukui-org/ElvUI
2022-10-26,lua,1758,1,Orgmode clone written in Lua for Neovim 0.7+.,nvim-orgmode,orgmode,https://github.com/nvim-orgmode/orgmode
2022-10-26,lua,480,3,Extension to mason.nvim that makes it easier to use lspconfig with mason.nvim,williamboman,mason-lspconfig.nvim,https://github.com/williamboman/mason-lspconfig.nvim
2022-10-26,lua,1484,3,Service eggs for the pterodactyl panel,parkervcp,eggs,https://github.com/parkervcp/eggs
2022-10-26,lua,63,0,Modules to utilise in other resources via imports and exports.,overextended,ox_lib,https://github.com/overextended/ox_lib
2022-10-26,lua,11541,3,"An ebook reader application supporting PDF, DjVu, EPUB, FB2 and many more formats, running on Cervantes, Kindle, Kobo, PocketBook and Android devices",koreader,koreader,https://github.com/koreader/koreader
2022-10-26,lua,2654,3,A blazing fast and easy to configure neovim statusline plugin written in pure lua.,nvim-lualine,lualine.nvim,https://github.com/nvim-lualine/lualine.nvim
2022-10-26,lua,1418,1,Snippet Engine for Neovim written in Lua.,L3MON4D3,LuaSnip,https://github.com/L3MON4D3/LuaSnip
2022-10-26,lua,189,0,Slot-based inventory with metadata.,overextended,ox_inventory,https://github.com/overextended/ox_inventory
2022-10-26,lua,1562,8,Soothing pastel theme for Neovim,catppuccin,nvim,https://github.com/catppuccin/nvim
2022-10-26,lua,625,3,Lua port of the most famous vim colorscheme,ellisonleao,gruvbox.nvim,https://github.com/ellisonleao/gruvbox.nvim
2022-10-26,lua,11243,35,An IDE layer for Neovim with sane defaults. Completely free and community driven.,LunarVim,LunarVim,https://github.com/LunarVim/LunarVim
2022-10-26,lua,33165,14,The Cloud-Native API Gateway,Kong,kong,https://github.com/Kong/kong