date,language,stargazers,starsToday,description,owner,name,url
2022-03-15,lua,1569,3,A Neovim config designed from scratch to be understandable,LunarVim,Neovim-from-scratch,https://github.com/LunarVim/Neovim-from-scratch
2022-03-15,lua,23422,22,Image Super-Resolution for Anime-Style Art,nagadomi,waifu2x,https://github.com/nagadomi/waifu2x
2022-03-15,lua,1949,2,Offline build planner for Path of Exile.,PathOfBuildingCommunity,PathOfBuilding,https://github.com/PathOfBuildingCommunity/PathOfBuilding
2022-03-15,lua,1286,8,Git integration for buffers,lewis6991,gitsigns.nvim,https://github.com/lewis6991/gitsigns.nvim
2022-03-15,lua,1396,4,"A pretty diagnostics, references, telescope results, quickfix and location list to help you solve all the trouble your code is causing.",folke,trouble.nvim,https://github.com/folke/trouble.nvim
2022-03-15,lua,1166,2,Neovim plugin that allows you to seamlessly manage LSP servers with :LspInstall. With full Windows support!,williamboman,nvim-lsp-installer,https://github.com/williamboman/nvim-lsp-installer
2022-03-15,lua,973,3,Service eggs for the pterodactyl panel,parkervcp,eggs,https://github.com/parkervcp/eggs
2022-03-15,lua,2396,5,"A use-package inspired plugin manager for Neovim. Uses native packages, supports Luarocks dependencies, written in Lua, allows for expressive config",wbthomason,packer.nvim,https://github.com/wbthomason/packer.nvim
2022-03-15,lua,810,2,A neovim lua plugin to help easily manage multiple terminal windows,akinsho,toggleterm.nvim,https://github.com/akinsho/toggleterm.nvim
2022-03-15,lua,31439,9,The Cloud-Native API Gateway,Kong,kong,https://github.com/Kong/kong
2022-03-15,lua,10055,6,"An ebook reader application supporting PDF, DjVu, EPUB, FB2 and many more formats, running on Cervantes, Kindle, Kobo, PocketBook and Android devices",koreader,koreader,https://github.com/koreader/koreader
2022-03-15,lua,59,0,A collection of every roblox script ive aquired. I DO NOT UPDATE OR MAINTAIN THESE.,PhoenixAceVFX,Roblox-Scripts,https://github.com/PhoenixAceVFX/Roblox-Scripts
2022-03-15,lua,1262,5,"A clean, dark Neovim theme written in Lua, with support for lsp, treesitter and lots of plugins. Includes additional themes for Kitty, Alacritty, iTerm and Fish.",folke,tokyonight.nvim,https://github.com/folke/tokyonight.nvim
2022-03-15,lua,7795,14,An IDE layer for Neovim with sane defaults. Completely free and community driven.,LunarVim,LunarVim,https://github.com/LunarVim/LunarVim
2022-03-15,lua,1443,5,A blazing fast and easy to configure neovim statusline plugin written in pure lua.,nvim-lualine,lualine.nvim,https://github.com/nvim-lualine/lualine.nvim
2022-03-15,lua,1086,3,"Use Neovim as a language server to inject LSP diagnostics, code actions, and more via Lua.",jose-elias-alvarez,null-ls.nvim,https://github.com/jose-elias-alvarez/null-ls.nvim
2022-03-15,lua,779,1,autopairs for neovim written by lua,windwp,nvim-autopairs,https://github.com/windwp/nvim-autopairs
2022-03-15,lua,2404,0,LuaRocks is the package manager for the Lua programming language.,luarocks,luarocks,https://github.com/luarocks/luarocks
2022-03-15,lua,2352,9,A completion plugin for neovim coded in Lua.,hrsh7th,nvim-cmp,https://github.com/hrsh7th/nvim-cmp
2022-03-15,lua,742,5,"// Smart and powerful comment plugin for neovim. Supports treesitter, dot repeat, left-right/up-down motions, hooks, and more",numToStr,Comment.nvim,https://github.com/numToStr/Comment.nvim
2022-03-15,lua,209,3,My neovim config,ChristianChiarulli,nvim,https://github.com/ChristianChiarulli/nvim
2022-03-15,lua,4016,12,Quickstart configurations for the Nvim LSP client,neovim,nvim-lspconfig,https://github.com/neovim/nvim-lspconfig
2022-03-15,lua,91,0,Official Repo For ESX-Legacy,esx-framework,esx-legacy,https://github.com/esx-framework/esx-legacy
2022-03-15,lua,21,0,,xiaorouji,openwrt-passwall2,https://github.com/xiaorouji/openwrt-passwall2
2022-03-15,lua,221,0,NoPixel Full Server Files working,swxy,NoPixelServer,https://github.com/swxy/NoPixelServer