date,language,stargazers,starsToday,description,owner,name,url
2022-03-15,php,37513,28,"SecLists is the security tester's companion. It's a collection of multiple types of lists used during security assessments, collected in one place. List types include usernames, passwords, URLs, sensitive data patterns, fuzzing payloads, web shells, and many more.",danielmiessler,SecLists,https://github.com/danielmiessler/SecLists
2022-03-15,php,2692,1,A server software for Minecraft: Bedrock Edition in PHP,pmmp,PocketMine-MP,https://github.com/pmmp/PocketMine-MP
2022-03-15,php,3410,4,Photo Sharing. For Everyone.,pixelfed,pixelfed,https://github.com/pixelfed/pixelfed
2022-03-15,php,845,2,Track any ip address with IP-Tracer. IP-Tracer is developed for Linux and Termux. you can retrieve any ip address information using IP-Tracer.,rajkumardusad,IP-Tracer,https://github.com/rajkumardusad/IP-Tracer
2022-03-15,php,13362,5,A personal music streaming server that works.,koel,koel,https://github.com/koel/koel
2022-03-15,php,665,3,"Dynamically generated, customizable SVG that gives the appearance of typing and deleting text. Typing SVGs can be used as a bio on your Github profile readme or repository.",DenverCoder1,readme-typing-svg,https://github.com/DenverCoder1/readme-typing-svg
2022-03-15,php,4863,3,Free and Online Accounting Software,akaunting,akaunting,https://github.com/akaunting/akaunting
2022-03-15,php,981,1,"Stay motivated and show off your contribution streak!  Display your total contributions, current streak, and longest streak on your GitHub profile README",DenverCoder1,github-readme-streak-stats,https://github.com/DenverCoder1/github-readme-streak-stats
2022-03-15,php,9220,3,PHP_CodeSniffer tokenizes PHP files and detects violations of a defined set of coding standards.,squizlabs,PHP_CodeSniffer,https://github.com/squizlabs/PHP_CodeSniffer
2022-03-15,php,16053,3,Liberating Web Analytics. Star us on Github? +1. Matomo is the leading open alternative to Google Analytics that gives you full control over your data. Matomo lets you easily collect data from websites & apps and visualise this data and extract insights. Privacy is built-in. We love Pull Requests!,matomo-org,matomo,https://github.com/matomo-org/matomo
2022-03-15,php,466,0,Raspberry Pi Self Hosted Server Based on Docker / Portainer.io,novaspirit,pi-hosted,https://github.com/novaspirit/pi-hosted
2022-03-15,php,17916,8,The classic email sending library for PHP,PHPMailer,PHPMailer,https://github.com/PHPMailer/PHPMailer
2022-03-15,php,2768,7,"World countries, states, regions, provinces, cities, towns in JSON, SQL, XML, YAML, and CSV. All Countries, States, Cities with ISO2, ISO3, Country Code, Phone Code, Capital, Native Language, Timezones, Latitude, Longitude, Region, Subregion, Flag Emoji, and Currency. #countries #states #cities",dr5hn,countries-states-cities-database,https://github.com/dr5hn/countries-states-cities-database
2022-03-15,php,162,0,,yankovalenko94,Webdev2019,https://github.com/yankovalenko94/Webdev2019
2022-03-15,php,821,3,Backdrop core code repository.,backdrop,backdrop,https://github.com/backdrop/backdrop
2022-03-15,php,9103,1,A deployment tool written in PHP with support for popular frameworks out of the box,deployphp,deployer,https://github.com/deployphp/deployer
2022-03-15,php,12713,4,PHP errors for cool kids,filp,whoops,https://github.com/filp/whoops
2022-03-15,php,15277,1,A PHP parser written in PHP,nikic,PHP-Parser,https://github.com/nikic/PHP-Parser
2022-03-15,php,853,2,Freenom 域名自动续期。Freenom domain name renews automatically.,luolongfei,freenom,https://github.com/luolongfei/freenom
2022-03-15,php,6501,8,Dictionary of attack patterns and primitives for black-box application fault injection and resource discovery.,fuzzdb-project,fuzzdb,https://github.com/fuzzdb-project/fuzzdb
2022-03-15,php,2853,7,"openmediavault is the next generation network attached storage (NAS) solution based on Debian Linux. It contains services like SSH, (S)FTP, SMB/CIFS, DAAP media server, RSync, BitTorrent client and many more. Thanks to the modular design of the framework it can be enhanced via plugins. OpenMediaVault is primarily designed to be used in home envi…",openmediavault,openmediavault,https://github.com/openmediavault/openmediavault
2022-03-15,php,2206,6,Highly-extensible PHP Markdown parser which fully supports the CommonMark and GFM specs.,thephpleague,commonmark,https://github.com/thephpleague/commonmark
2022-03-15,php,4121,2,Home of the Joomla! Content Management System,joomla,joomla-cms,https://github.com/joomla/joomla-cms
2022-03-15,php,18290,3,The PHP Unit Testing framework.,sebastianbergmann,phpunit,https://github.com/sebastianbergmann/phpunit
2022-03-15,php,4695,5,The RSS feed for websites missing it,RSS-Bridge,rss-bridge,https://github.com/RSS-Bridge/rss-bridge