date,language,stargazers,starsToday,description,owner,name,url
2022-03-15,scala,32279,8,Apache Spark - A unified analytics engine for large-scale data processing,apache,spark,https://github.com/apache/spark
2022-03-15,scala,10957,5,"♞ lichess.org: the forever free, adless and open source chess server ♞",lichess-org,lila,https://github.com/lichess-org/lila
2022-03-15,scala,2252,0,Spark: The Definitive Guide's Code Repository,databricks,Spark-The-Definitive-Guide,https://github.com/databricks/Spark-The-Definitive-Guide
2022-03-15,scala,834,15,Open-source code analysis platform for C/C++/Java/Binary/Javascript/Python/Kotlin based on code property graphs,joernio,joern,https://github.com/joernio/joern
2022-03-15,scala,12100,1,Play Framework,playframework,playframework,https://github.com/playframework/playframework
2022-03-15,scala,12081,4,"Build highly concurrent, distributed, and resilient message-driven applications on the JVM",akka,akka,https://github.com/akka/akka
2022-03-15,scala,4156,8,"An open-source storage layer that brings scalable, ACID transactions to Apache Spark™ and big data workloads.",delta-io,delta,https://github.com/delta-io/delta
2022-03-15,scala,13657,1,"Scala 2 compiler and standard library. For bugs, see scala/bug",scala,scala,https://github.com/scala/scala
2022-03-15,scala,956,0,"Apache Kyuubi is a distributed multi-tenant JDBC server for large-scale data processing and analytics, built on top of Apache Spark",apache,incubator-kyuubi,https://github.com/apache/incubator-kyuubi
2022-03-15,scala,659,0,This is the github repo for Learning Spark: Lightning-Fast Data Analytics [2nd Edition],databricks,LearningSparkV2,https://github.com/databricks/LearningSparkV2
2022-03-15,scala,1260,0,Home of the OpenComputers mod for Minecraft.,MightyPirates,OpenComputers,https://github.com/MightyPirates/OpenComputers
2022-03-15,scala,5384,0,Old repo for Linkerd 1.x. See the linkerd2 repo for Linkerd 2.x.,linkerd,linkerd,https://github.com/linkerd/linkerd
2022-03-15,scala,680,0,Mirror of Apache livy (Incubating),apache,incubator-livy,https://github.com/apache/incubator-livy
2022-03-15,scala,391,0,Ergo protocol description & reference client implementation,ergoplatform,ergo,https://github.com/ergoplatform/ergo
2022-03-15,scala,8177,1,"A fault tolerant, protocol-agnostic RPC system",twitter,finagle,https://github.com/twitter/finagle
2022-03-15,scala,1322,0,The Flix Programming Language,flix,flix,https://github.com/flix/flix
2022-03-15,scala,1286,0,Twitter-Server defines a template from which services at Twitter are built,twitter,twitter-server,https://github.com/twitter/twitter-server
2022-03-15,scala,751,0,A Thrift parser/generator,twitter,scrooge,https://github.com/twitter/scrooge
2022-03-15,scala,179,0,Apache Spark Connector for Azure Cosmos DB,Azure,azure-cosmosdb-spark,https://github.com/Azure/azure-cosmosdb-spark
2022-03-15,scala,2144,1,"A ShadowsocksR, V2Ray and Trojan client for Android",xxf098,shadowsocksr-v2ray-trojan-android,https://github.com/xxf098/shadowsocksr-v2ray-trojan-android
2022-03-15,scala,2513,0,Wonderful reusable code from Twitter,twitter,util,https://github.com/twitter/util
2022-03-15,scala,132,0,"Open, Modular, Deep Learning Accelerator",apache,tvm-vta,https://github.com/apache/tvm-vta
2022-03-15,scala,274,0,Bitcoin Implementation in Scala,bitcoin-s,bitcoin-s,https://github.com/bitcoin-s/bitcoin-s
2022-03-15,scala,2144,0,"Fast, testable, Scala services built on TwitterServer and Finagle",twitter,finatra,https://github.com/twitter/finatra
2022-03-15,scala,14,0,A Scala library for Context-Dependent Evironments,chipsalliance,api-config-chipsalliance,https://github.com/chipsalliance/api-config-chipsalliance