date,language,stargazers,starsToday,description,owner,name,url
2023-11-24,haskell,33704,44,"ShellCheck, a static analysis tool for shell scripts",koalaman,shellcheck,https://github.com/koalaman/shellcheck
2023-11-24,haskell,30663,14,Universal markup converter,jgm,pandoc,https://github.com/jgm/pandoc
2023-11-24,haskell,1464,0,The Plutus language implementation and tools,input-output-hk,plutus,https://github.com/input-output-hk/plutus
2023-11-24,haskell,21354,12,REST API for any Postgres database,PostgREST,postgrest,https://github.com/PostgREST/postgrest
2023-11-24,haskell,909,0,A Direct-to-Driver open mobility platform powering the next-generation of mobility applications in India.,nammayatri,nammayatri,https://github.com/nammayatri/nammayatri
2023-11-24,haskell,7,0,This is scrive's common collection of function import we use the most.,scrive,scrive-prelude,https://github.com/scrive/scrive-prelude
2023-11-24,haskell,1388,0,"This repository hosts the lectures of the Plutus Pioneers Program. This program is a training course that the IOG Education Team provides to recruit and train software developers in Plutus, the native smart contract language for the Cardano ecosystem.",input-output-hk,plutus-pioneer-program,https://github.com/input-output-hk/plutus-pioneer-program
2023-11-24,haskell,9180,9,"Dockerfile linter, validate inline bash, written in Haskell",hadolint,hadolint,https://github.com/hadolint/hadolint
2023-11-24,haskell,2972,1,The core component that is used to participate in a Cardano decentralised blockchain.,input-output-hk,cardano-node,https://github.com/input-output-hk/cardano-node
2023-11-24,haskell,5377,3,A friendly programming language from the future,unisonweb,unison,https://github.com/unisonweb/unison
2023-11-24,haskell,2565,0,🇪🇺 Wire back-end services,wireapp,wire-server,https://github.com/wireapp/wire-server
2023-11-24,haskell,2964,0,"A collection of awesome Haskell links, frameworks, libraries and software. Inspired by awesome projects line.",krispo,awesome-haskell,https://github.com/krispo/awesome-haskell
2023-11-24,haskell,577,0,A comprehensive Amazon Web Services SDK for Haskell.,brendanhay,amazonka,https://github.com/brendanhay/amazonka
2023-11-24,haskell,23,0,An llvm pretty printer inspired by the haskell llvm binding,elliottt,llvm-pretty,https://github.com/elliottt/llvm-pretty
2023-11-24,haskell,4512,4,"SimpleX - the first messaging platform operating without user identifiers of any kind - 100% private by design! iOS, Android and desktop apps 📱!",simplex-chat,simplex-chat,https://github.com/simplex-chat/simplex-chat
2023-11-24,haskell,8337,1,A strongly-typed language that compiles to JavaScript,purescript,purescript,https://github.com/purescript/purescript
2023-11-24,haskell,3157,1,"The core of xmonad, a small but functional ICCCM-compliant tiling window manager",xmonad,xmonad,https://github.com/xmonad/xmonad
2023-11-24,haskell,200,0,The symbolic execution engine powering the K Framework,runtimeverification,haskell-backend,https://github.com/runtimeverification/haskell-backend
2023-11-24,haskell,13,0,Fast serialization in haskell,vincenthz,hs-packer,https://github.com/vincenthz/hs-packer