date,language,stargazers,starsToday,description,owner,name,url
2022-02-19,scala,2499,9,Open-source high-performance RISC-V processor,OpenXiangShan,XiangShan,https://github.com/OpenXiangShan/XiangShan
2022-02-19,scala,3219,0,"ZIO — A type-safe, composable library for async and concurrent programming in Scala",zio,zio,https://github.com/zio/zio
2022-02-19,scala,8371,6,"Removes large or troublesome blobs like git-filter-branch does, but faster. And written in Scala",rtyley,bfg-repo-cleaner,https://github.com/rtyley/bfg-repo-cleaner
2022-02-19,scala,2268,2,A Scala API for Apache Beam and Google Cloud Dataflow.,spotify,scio,https://github.com/spotify/scio
2022-02-19,scala,4466,0,"sbt, the interactive build tool",sbt,sbt,https://github.com/sbt/sbt
2022-02-19,scala,32082,5,Apache Spark - A unified analytics engine for large-scale data processing,apache,spark,https://github.com/apache/spark
2022-02-19,scala,913,1,"Declarative, type-safe web endpoints library",softwaremill,tapir,https://github.com/softwaremill/tapir
2022-02-19,scala,2230,0,Spark: The Definitive Guide's Code Repository,databricks,Spark-The-Definitive-Guide,https://github.com/databricks/Spark-The-Definitive-Guide
2022-02-19,scala,2362,4,"TheHive: a Scalable, Open Source and Free Security Incident Response Platform",TheHive-Project,TheHive,https://github.com/TheHive-Project/TheHive
2022-02-19,scala,10890,5,"♞ lichess.org: the forever free, adless and open source chess server ♞",lichess-org,lila,https://github.com/lichess-org/lila
2022-02-19,scala,8167,0,"A fault tolerant, protocol-agnostic RPC system",twitter,finagle,https://github.com/twitter/finagle
2022-02-19,scala,1649,0,Scala language server with rich IDE features,scalameta,metals,https://github.com/scalameta/metals
2022-02-19,scala,10632,1,CMAK is a tool for managing Apache Kafka clusters,yahoo,CMAK,https://github.com/yahoo/CMAK
2022-02-19,scala,3136,3,Simple and Distributed Machine Learning,microsoft,SynapseML,https://github.com/microsoft/SynapseML
2022-02-19,scala,395,0,XML data source for Spark SQL and DataFrames,databricks,spark-xml,https://github.com/databricks/spark-xml
2022-02-19,scala,279,0,A Spark plugin for reading Excel files via Apache POI,crealytics,spark-excel,https://github.com/crealytics/spark-excel
2022-02-19,scala,2208,0,"A minimal, idiomatic Scala interface for HTTP",http4s,http4s,https://github.com/http4s/http4s
2022-02-19,scala,2116,3,"Deequ is a library built on top of Apache Spark for defining ""unit tests for data"", which measure data quality in large datasets.",awslabs,deequ,https://github.com/awslabs/deequ
2022-02-19,scala,27,0,EmbeddedMongo connection helper for Specs2 tests suites,athieriot,specs2-embedmongo,https://github.com/athieriot/specs2-embedmongo
2022-02-19,scala,2144,1,Rocket Chip Generator,chipsalliance,rocket-chip,https://github.com/chipsalliance/rocket-chip
2022-02-19,scala,240,0,Connectors for Delta Lake,delta-io,connectors,https://github.com/delta-io/connectors
2022-02-19,scala,5574,1,Apache OpenWhisk is an open source serverless cloud platform,apache,openwhisk,https://github.com/apache/openwhisk
2022-02-19,scala,3,1,"A simple alternative to the Amazon SQS Daemon (""sqsd"") used on AWS Beanstalk worker tier instances, based on https://github.com/mozart-analytics/sqsd",olxbr,aws-sqsd,https://github.com/olxbr/aws-sqsd
2022-02-19,scala,5,1,"Utility code for Scala: logging, testing, configuration and more",olxbr,scala-utils,https://github.com/olxbr/scala-utils
2022-02-19,scala,6,1,,olxbr,load-test,https://github.com/olxbr/load-test