date,language,stargazers,starsToday,description,owner,name,url
2024-09-15,astro,3142,7,⭕️ AstroWind: A free template using Astro 4.0 and Tailwind CSS. Astro starter theme.,onwidget,astrowind,https://github.com/onwidget/astrowind
2024-09-15,astro,896,1,"Astrofy is a free and open-source template for your Personal Portfolio Website built with Astro and TailwindCSS. Create in minutes a website with Blog, CV, Project Section, Store and RSS Feed.",manuelernestog,astrofy,https://github.com/manuelernestog/astrofy
2024-09-15,astro,43906,6,AdminLTE - Free admin dashboard template based on Bootstrap 5,ColorlibHQ,AdminLTE,https://github.com/ColorlibHQ/AdminLTE
2024-09-15,astro,866,4,A simple Astro theme. Use it to create your blog or website.,chrismwilliams,astro-theme-cactus,https://github.com/chrismwilliams/astro-theme-cactus
2024-09-15,astro,3025,4,"An opinionated, actionable guide for software engineering interviews.",nas5w,interview-guide,https://github.com/nas5w/interview-guide
2024-09-15,astro,300,0,Sources for nixos.org,NixOS,nixos-homepage,https://github.com/NixOS/nixos-homepage
2024-09-15,astro,1030,1,Ejemplo de porfolio para programadores y desarrolladores,midudev,porfolio.dev,https://github.com/midudev/porfolio.dev
2024-09-15,astro,87,0,We all depend on Open Source. Pay your share through Open Source Pledge.,opensourcepledge,osspledge.com,https://github.com/opensourcepledge/osspledge.com
2024-09-15,astro,227,1,"Dante, a single-author blog and portfolio theme for Astro.js.",JustGoodUI,dante-astro-theme,https://github.com/JustGoodUI/dante-astro-theme
2024-09-15,astro,562,2,"📚 Openblog is an elegant, simple, and user-friendly blog. Focused on accessibility, SEO and performance.",danielcgilibert,blog-template,https://github.com/danielcgilibert/blog-template