date,language,stargazers,starsToday,description,owner,name,url
2023-06-25,markdown,9137,5,Open source documentation of Microsoft Azure,MicrosoftDocs,azure-docs,https://github.com/MicrosoftDocs/azure-docs
2023-06-25,markdown,7949,3,The content behind MDN Web Docs,mdn,content,https://github.com/mdn/content
2023-06-25,markdown,4157,1,Ethereum.org is a primary online resource for the Ethereum community.,ethereum,ethereum-org-website,https://github.com/ethereum/ethereum-org-website
2023-06-25,markdown,24251,4,Linux命令大全搜索工具，内容包含Linux命令手册、详解、学习、搜集。https://git.io/linux,jaywcjlove,linux-command,https://github.com/jaywcjlove/linux-command
2023-06-25,markdown,3760,2,A collection listing all Achievements available on the GitHub profile,Schweinepriester,github-profile-achievements,https://github.com/Schweinepriester/github-profile-achievements
2023-06-25,markdown,44604,11,Collaborative cheatsheets for console commands,tldr-pages,tldr,https://github.com/tldr-pages/tldr
2023-06-25,markdown,1378,0,This repository provides SAP style guides for coding and coding-related topics.,SAP,styleguides,https://github.com/SAP/styleguides
2023-06-25,markdown,2336,3,A curation of awesome portfolio website ideas for developers and designers to draw inspiration from. Raise a pull request to add more.,Evavic44,portfolio-ideas,https://github.com/Evavic44/portfolio-ideas
2023-06-25,markdown,115,1,Solutions (that we managed to find) for the 2021 PicoCTF,vivian-dai,PicoCTF2021-Writeup,https://github.com/vivian-dai/PicoCTF2021-Writeup
2023-06-25,markdown,1352,0,SatoshiLabs Improvement Proposals,satoshilabs,slips,https://github.com/satoshilabs/slips
2023-06-25,markdown,1948,1,Airbnb's Swift Style Guide,airbnb,swift,https://github.com/airbnb/swift
2023-06-25,markdown,5293,1,RFCs for changes to Rust,rust-lang,rfcs,https://github.com/rust-lang/rfcs
2023-06-25,markdown,5473,4,Official Discord API Documentation,discord,discord-api-docs,https://github.com/discord/discord-api-docs
2023-06-25,markdown,14406,2,This maintains proposals for changes and user-visible enhancements to the Swift Programming Language.,apple,swift-evolution,https://github.com/apple/swift-evolution
2023-06-25,markdown,3056,0,Kotlin Evolution and Enhancement Process,Kotlin,KEEP,https://github.com/Kotlin/KEEP
2023-06-25,markdown,7749,9,Improve your README.md profile with these amazing badges.,alexandresanlim,Badges4-README.md-Profile,https://github.com/alexandresanlim/Badges4-README.md-Profile
2023-06-25,markdown,1329,0,The source repository of all translated content for MDN Web Docs,mdn,translated-content,https://github.com/mdn/translated-content
2023-06-25,markdown,621,3,A Complete List of GitHub Profile Badges and Achievements,drknzz,GitHub-Achievements,https://github.com/drknzz/GitHub-Achievements