date,language,stargazers,starsToday,description,owner,name,url
2022-01-24,svelte,1283,0,SvelteKit implementation of the RealWorld app,sveltejs,realworld,https://github.com/sveltejs/realworld
2022-01-24,svelte,115,3,An opinionated blog starter for SvelteKit + Tailwind + Netlify. Refreshed for 2022!,sw-yx,swyxkit,https://github.com/sw-yx/swyxkit
2022-01-24,svelte,2169,2,Svelte Material UI Components,hperrin,svelte-material-ui,https://github.com/hperrin/svelte-material-ui
2022-01-24,svelte,936,2,"Edit, preview and share mermaid charts/diagrams. New implementation of the live editor.",mermaid-js,mermaid-live-editor,https://github.com/mermaid-js/mermaid-live-editor
2022-01-24,svelte,52,8,A three.js component library for Svelte.,grischaerbe,threlte,https://github.com/grischaerbe/threlte
2022-01-24,svelte,1302,1,Svelte implementation of the Carbon Design System,carbon-design-system,carbon-components-svelte,https://github.com/carbon-design-system/carbon-components-svelte
2022-01-24,svelte,1275,1,"A simple standalone program which automates the installation, removal and maintenance of BetterDiscord.",BetterDiscord,Installer,https://github.com/BetterDiscord/Installer
2022-01-24,svelte,502,5,graphics framework for sveltejs,mhkeller,layercake,https://github.com/mhkeller/layercake
2022-01-24,svelte,818,4,Svelte  Three,Rich-Harris,svelte-cubed,https://github.com/Rich-Harris/svelte-cubed
2022-01-24,svelte,282,7,Unofficial Svelte port of Headless UI components (https://headlessui.dev/),rgossiaux,svelte-headlessui,https://github.com/rgossiaux/svelte-headlessui
2022-01-24,svelte,1098,0,,PuruVJ,macos-web,https://github.com/PuruVJ/macos-web
2022-01-24,svelte,287,0,"Sveltekit starter project created with sveltekit, typescript, tailwindcss, postcss, husky, and storybook. The project has the structure set up for the scaleable web application.",navneetsharmaui,sveltekit-starter,https://github.com/navneetsharmaui/sveltekit-starter
2022-01-24,svelte,311,1,"a simpler, all-in-one way to develop and manage websites",primo-af,primo,https://github.com/primo-af/primo
2022-01-24,svelte,311,0,IOTA's New Wallet,iotaledger,firefly,https://github.com/iotaledger/firefly
2022-01-24,svelte,853,0,Bootstrap 4 & 5 components for Svelte,bestguy,sveltestrap,https://github.com/bestguy/sveltestrap
2022-01-24,svelte,4,0,Next generation Satisfactory Modding Repository (SMR) frontend,satisfactorymodding,smr-frontend,https://github.com/satisfactorymodding/smr-frontend
2022-01-24,svelte,389,1,Notus Svelte: Free Tailwind CSS UI Kit and Admin,creativetimofficial,notus-svelte,https://github.com/creativetimofficial/notus-svelte
2022-01-24,svelte,111,0,The Svelte Society website,svelte-society,sveltesociety.dev,https://github.com/svelte-society/sveltesociety.dev
2022-01-24,svelte,507,1,A pretty cool UI kit for Svelte,illright,attractions,https://github.com/illright/attractions
2022-01-24,svelte,1221,3,"Database manager for MySQL, PostgreSQL, SQL Server, MongoDB, SQLite and others. Runs under Windows, Linux, Mac or as web application",dbgate,dbgate,https://github.com/dbgate/dbgate