date,language,stargazers,starsToday,description,owner,name,url
2022-09-21,kotlin,4317,73,The 2022 Android Developer Roadmap suggests learning paths to understanding Android development.,skydoves,android-developer-roadmap,https://github.com/skydoves/android-developer-roadmap
2022-09-21,kotlin,4089,3,Kotlin multiplatform / multi-format serialization,Kotlin,kotlinx.serialization,https://github.com/Kotlin/kotlinx.serialization
2022-09-21,kotlin,7236,16,A fully functional Android app built entirely with Kotlin and Jetpack Compose,android,nowinandroid,https://github.com/android/nowinandroid
2022-09-21,kotlin,5432,7,A collection of extension libraries for Jetpack Compose,google,accompanist,https://github.com/google/accompanist
2022-09-21,kotlin,1758,5,Template repository for creating plugins for IntelliJ Platform,JetBrains,intellij-platform-plugin-template,https://github.com/JetBrains/intellij-platform-plugin-template
2022-09-21,kotlin,2257,11,"An Android Anilist only client, which lets you stream & download Anime & Manga.",saikou-app,saikou,https://github.com/saikou-app/saikou
2022-09-21,kotlin,2914,8,阅读3服务器版，桌面端，iOS可用。后端 Kotlin + Spring Boot + Vert.x + Coroutine ；前端 Vue.js + Element。麻烦点点star，关注一下公众号【假装大佬】,hectorqin,reader,https://github.com/hectorqin/reader
2022-09-21,kotlin,1200,6,"Jetpack Compose image loading library that fetches and displays network images with Glide, Coil, and Fresco",skydoves,landscapist,https://github.com/skydoves/landscapist
2022-09-21,kotlin,876,2,Use your old Android device as an OctoPrint server.,feelfreelinux,octo4a,https://github.com/feelfreelinux/octo4a
2022-09-21,kotlin,16141,7,A gardening app illustrating Android development best practices with Android Jetpack.,android,sunflower,https://github.com/android/sunflower
2022-09-21,kotlin,190,0,,ktorio,ktor-documentation,https://github.com/ktorio/ktor-documentation
2022-09-21,kotlin,1538,4,Annotation processing library for type-safe Jetpack Compose navigation with no boilerplate.,raamcosta,compose-destinations,https://github.com/raamcosta/compose-destinations
2022-09-21,kotlin,5488,4,AnkiDroid: Anki flashcards on Android. Your secret trick to achieve superhuman information retention.,ankidroid,Anki-Android,https://github.com/ankidroid/Anki-Android
2022-09-21,kotlin,5667,11,"Kotlin Multiplatform Music Downloader, Supports Spotify / Gaana / Youtube Music / Jio Saavn / SoundCloud. NOTE: BEING REWRITTEN, SO STAY TUNED.",Shabinder,SpotiFlyer,https://github.com/Shabinder/SpotiFlyer
2022-09-21,kotlin,679,0,,googlecodelabs,android-compose-codelabs,https://github.com/googlecodelabs/android-compose-codelabs
2022-09-21,kotlin,2319,3,A glossy Matrix collaboration client for Android.,vector-im,element-android,https://github.com/vector-im/element-android
2022-09-21,kotlin,28212,8,Alibaba Java Coding Guidelines pmd implements and IDE plugin,alibaba,p3c,https://github.com/alibaba/p3c
2022-09-21,kotlin,13070,14,Official Jetpack Compose samples.,android,compose-samples,https://github.com/android/compose-samples
2022-09-21,kotlin,10469,27,高效率 QQ 机器人支持库,mamoe,mirai,https://github.com/mamoe/mirai
2022-09-21,kotlin,411,27,"Tolgee is translation management cloud platform made for translating modern web applications. It works great with JS frameworks like React, Angular, Vue and others.",tolgee,tolgee-platform,https://github.com/tolgee/tolgee-platform
2022-09-21,kotlin,2323,9,Community-driven collection of Jetpack Compose example code and tutorials  https://foso.github.io/compose,Foso,Jetpack-Compose-Playground,https://github.com/Foso/Jetpack-Compose-Playground
2022-09-21,kotlin,4831,2,Static code analysis for Kotlin,detekt,detekt,https://github.com/detekt/detekt
2022-09-21,kotlin,3381,7,provides metadata for networkIDs and chainIDs,ethereum-lists,chains,https://github.com/ethereum-lists/chains
2022-09-21,kotlin,5169,3,An anti-bikeshedding Kotlin linter with built-in formatter,pinterest,ktlint,https://github.com/pinterest/ktlint
2022-09-21,kotlin,9426,3,"Compose Multiplatform, a modern UI framework for Kotlin that makes building performant and beautiful user interfaces easy and enjoyable.",JetBrains,compose-jb,https://github.com/JetBrains/compose-jb