date,language,stargazers,starsToday,description,owner,name,url
2022-05-09,css,306,95,Vanilla JS TodoMVC App in 2022,1Marc,todomvc-vanillajs-2022,https://github.com/1Marc/todomvc-vanillajs-2022
2022-05-09,css,49,14,,creativeambition,my_react_portfolio,https://github.com/creativeambition/my_react_portfolio
2022-05-09,css,2616,5,,safak,youtube,https://github.com/safak/youtube
2022-05-09,css,3454,2,静态响应式网址导航网站 - webstack.cc,WebStackPage,WebStackPage.github.io,https://github.com/WebStackPage/WebStackPage.github.io
2022-05-09,css,8838,44,"经济学人(含音频)、纽约客、自然、新科学人、卫报、科学美国人、连线、大西洋月刊、国家地理等英语杂志免费下载、订阅(kindle推送),支持epub、mobi、pdf格式, 每周更新. The Economist 、The New Yorker 、Nature、The Atlantic 、New Scientist、The Guardian、Scientific American、Wired magazines, free download and subscription for kindle, mobi、epub、pdf format.",hehonghui,the-economist-ebooks,https://github.com/hehonghui/the-economist-ebooks
2022-05-09,css,681,6,"Free, no-nonsense, super fast blogging.",HermanMartinus,bearblog,https://github.com/HermanMartinus/bearblog
2022-05-09,css,7742,1,"Build a Jekyll blog in minutes, without touching the command line.",barryclark,jekyll-now,https://github.com/barryclark/jekyll-now
2022-05-09,css,5592,2,A sample Spring-based application,spring-projects,spring-petclinic,https://github.com/spring-projects/spring-petclinic
2022-05-09,css,52,2,Responsive Real State Website Design Using HTML CSS & JavaScript,bedimcode,responsive-real-state-website,https://github.com/bedimcode/responsive-real-state-website
2022-05-09,css,455,1,A blue theme for Obsidian.,whyt-byte,Blue-Topaz_Obsidian-css,https://github.com/whyt-byte/Blue-Topaz_Obsidian-css
2022-05-09,css,47,6,Give your Home Assistant a modern and clean facelift.  4 Color Themes (Magenta Red / Orange / Green / Blue) +  Light and  Dark modes included. Based on Metro and Fluent UI Design Systems from Microsoft Windows.,Madelena,Metrology-for-Hass,https://github.com/Madelena/Metrology-for-Hass
2022-05-09,css,1344,1,FingerNFT是一款开源NFT市场，兼容Opensea、Rarible。,fingerchar,fingernft,https://github.com/fingerchar/fingernft
2022-05-09,css,26010,2,"A collection of CSS3 powered hover effects to be applied to links, buttons, logos, SVG, featured images and so on. Easily apply to your own elements, modify or just use for inspiration. Available in CSS, Sass, and LESS.",IanLunn,Hover,https://github.com/IanLunn/Hover
2022-05-09,css,2995,2,"A content-first, sliding sidebar theme for Jekyll.",poole,lanyon,https://github.com/poole/lanyon
2022-05-09,css,486,0,dotfiles for my beautiful rices!,siduck,dotfiles,https://github.com/siduck/dotfiles
2022-05-09,css,1341,8,"Meticulously designed to make Obsidian feel native across platforms. You can customize colors, fonts and more with the companion plugin Minimal Theme Settings.",kepano,obsidian-minimal,https://github.com/kepano/obsidian-minimal
2022-05-09,css,3523,2,"Starter files, final projects and FAQ for my Advanced CSS course",jonasschmedtmann,advanced-css-course,https://github.com/jonasschmedtmann/advanced-css-course
2022-05-09,css,2145,5,,john-smilga,javascript-basic-projects,https://github.com/john-smilga/javascript-basic-projects
2022-05-09,css,7890,0,CSS Inspiration，在这里找到写 CSS 的灵感！,chokcoco,CSS-Inspiration,https://github.com/chokcoco/CSS-Inspiration
2022-05-09,css,1465,2,Collection of userstyles affecting the browser,MrOtherGuy,firefox-csshacks,https://github.com/MrOtherGuy/firefox-csshacks
2022-05-09,css,12386,1,不止于 CSS,chokcoco,iCSS,https://github.com/chokcoco/iCSS
2022-05-09,css,45466,5,Modern CSS framework based on Flexbox,jgthms,bulma,https://github.com/jgthms/bulma
2022-05-09,css,6859,13,forkable Ethereum dev stack focused on fast product iterations,scaffold-eth,scaffold-eth,https://github.com/scaffold-eth/scaffold-eth
2022-05-09,css,120,0,,bradtraversy,tailwind-landing-page,https://github.com/bradtraversy/tailwind-landing-page
2022-05-09,css,3094,3,Rime::Home is home to Rime users and developers,rime,home,https://github.com/rime/home