date,language,stargazers,starsToday,description,owner,name,url
2023-06-14,html,79991,199,This repo includes ChatGPT prompt curation to use ChatGPT better.,f,awesome-chatgpt-prompts,https://github.com/f/awesome-chatgpt-prompts
2023-06-14,html,10335,14,Curso de HTML5 e CSS3,gustavoguanabara,html-css,https://github.com/gustavoguanabara/html-css
2023-06-14,html,4337,1,"Test suites for Web platform specs — including WHATWG, W3C, and others",web-platform-tests,wpt,https://github.com/web-platform-tests/wpt
2023-06-14,html,5032,3,Gather and update all available and newest CVEs with their PoC.,trickest,cve,https://github.com/trickest/cve
2023-06-14,html,80,0,,Chr1skyy,Egzamin-Zawodowy-E14-EE09-INF03,https://github.com/Chr1skyy/Egzamin-Zawodowy-E14-EE09-INF03
2023-06-14,html,63,9,Render Swift source code in AR/VR for macOS and iOS.,tikimcfee,LookAtThat,https://github.com/tikimcfee/LookAtThat
2023-06-14,html,4052,0,"Welcome to the Bot Framework samples repository. Here you will find task-focused samples in C#, JavaScript and TypeScript to help you get started with the Bot Framework SDK!",microsoft,BotBuilder-Samples,https://github.com/microsoft/BotBuilder-Samples
2023-06-14,html,499,9,"每日分享免费节点,免费机场,ssr节点,v2ray节点,v2ray订阅,clash节点,clash订阅,shadowrocket订阅,Quantumult X订阅,Clash .NET订阅,小火箭节点,小猫咪节点,免费翻墙,免费科学上网,免费梯子,免费trojan节点,蓝灯,谷歌商店,翻墙梯子,安卓VPN,iphone翻墙节点,iphone vpn,一键翻墙浏览器,节点分享,免费SSR,蓝灯,谷歌商店,V2ary免费节点,代理,proxy代理科学上网,TG代理,电报代理,Telegram代理,ip加速,翻墙软件,socks5,破解VPN,机场推荐,节点订阅,破解VPN",mksshare,mksshare.github.io,https://github.com/mksshare/mksshare.github.io
2023-06-14,html,512,148,"A collection of bookmarks for penetration testers, bug bounty hunters, malware developers, reverse engineers and anyone who is just interested in infosec topics.",kargisimos,offensive-bookmarks,https://github.com/kargisimos/offensive-bookmarks
2023-06-14,html,6185,5,Slam Dunk JavaScript,wesbos,beginner-javascript,https://github.com/wesbos/beginner-javascript
2023-06-14,html,748,4,"Official codes for ACL 2023 paper ""WebCPM: Interactive Web Search for Chinese Long-form Question Answering""",thunlp,WebCPM,https://github.com/thunlp/WebCPM
2023-06-14,html,3461,7,A collection of several hundred online tools for OSINT,cipher387,osint_stuff_tool_collection,https://github.com/cipher387/osint_stuff_tool_collection
2023-06-14,html,22620,12,A curated list of awesome warez and piracy links,Igglybuff,awesome-piracy,https://github.com/Igglybuff/awesome-piracy
2023-06-14,html,5811,28,BELLE: Be Everyone's Large Language model Engine（开源中文对话大模型）,LianjiaTech,BELLE,https://github.com/LianjiaTech/BELLE
2023-06-14,html,24692,1,Library for fast text representation and classification.,facebookresearch,fastText,https://github.com/facebookresearch/fastText
2023-06-14,html,737,3,"Course Material for in28minutes courses on Java, Spring Boot, DevOps, AWS, Google Cloud, and Azure.",in28minutes,course-material,https://github.com/in28minutes/course-material
2023-06-14,html,5800,3,Super-project for modularized Boost,boostorg,boost,https://github.com/boostorg/boost
2023-06-14,html,371,0,,goitacademy,parcel-project-template,https://github.com/goitacademy/parcel-project-template
2023-06-14,html,1154,1,cool-admin一个很酷的后台权限管理框架，模块化、插件化、CRUD极速开发，永久开源免费，基于midway.js 3.0、typeorm、mysql、jwt、element-ui、vuex、vue-router、vue等构建,cool-team-official,cool-admin-vue,https://github.com/cool-team-official/cool-admin-vue
2023-06-14,html,6048,2,Github repo for the MDN Learning Area.,mdn,learning-area,https://github.com/mdn/learning-area
2023-06-14,html,11731,4,This repo is for demonstration purposes only.,octocat,Spoon-Knife,https://github.com/octocat/Spoon-Knife
2023-06-14,html,14185,8,Documentation that simply works,squidfunk,mkdocs-material,https://github.com/squidfunk/mkdocs-material
2023-06-14,html,17895,5,A lightweight and modular front-end framework for developing fast and powerful web interfaces,uikit,uikit,https://github.com/uikit/uikit
2023-06-14,html,2076,2,The official sources for the RDKit library,rdkit,rdkit,https://github.com/rdkit/rdkit
2023-06-14,html,3842,3,Kubernetes website and documentation repo:,kubernetes,website,https://github.com/kubernetes/website