date,language,stargazers,starsToday,description,owner,name,url
2023-06-14,scala,6067,5,"An open-source storage framework that enables building a Lakehouse architecture with compute engines including Spark, PrestoDB, Flink, Trino, and Hive and APIs",delta-io,delta,https://github.com/delta-io/delta
2023-06-14,scala,35963,9,Apache Spark - A unified analytics engine for large-scale data processing,apache,spark,https://github.com/apache/spark
2023-06-14,scala,1804,0,The pure asynchronous runtime for Scala,typelevel,cats-effect,https://github.com/typelevel/cats-effect
2023-06-14,scala,3282,0,State of the Art Natural Language Processing,JohnSnowLabs,spark-nlp,https://github.com/JohnSnowLabs/spark-nlp
2023-06-14,scala,12705,1,"Build highly concurrent, distributed, and resilient message-driven applications on the JVM",akka,akka,https://github.com/akka/akka
2023-06-14,scala,12404,2,Play Framework,playframework,playframework,https://github.com/playframework/playframework
2023-06-14,scala,5692,2,The Guardian DotCom.,guardian,frontend,https://github.com/guardian/frontend
2023-06-14,scala,3803,1,"ZIO — A type-safe, composable library for async and concurrent programming in Scala",zio,zio,https://github.com/zio/zio
2023-06-14,scala,1631,3,Apache Kyuubi is a distributed and multi-tenant gateway to provide serverless SQL on data warehouses and lakehouses.,apache,kyuubi,https://github.com/apache/kyuubi
2023-06-14,scala,1877,0,Your shiny new Java/Scala build tool!,com-lihaoyi,mill,https://github.com/com-lihaoyi/mill
2023-06-14,scala,8667,1,"A fault tolerant, protocol-agnostic RPC system",twitter,finagle,https://github.com/twitter/finagle
2023-06-14,scala,1382,5,SonicBOOM: The Berkeley Out-of-Order Machine,riscv-boom,riscv-boom,https://github.com/riscv-boom/riscv-boom
2023-06-14,scala,1907,2,DataStax Spark Cassandra Connector,datastax,spark-cassandra-connector,https://github.com/datastax/spark-cassandra-connector
2023-06-14,scala,68,3,Quickstart your next app with the Typelevel Toolkit!,typelevel,toolkit,https://github.com/typelevel/toolkit
2023-06-14,scala,9794,2,"Removes large or troublesome blobs like git-filter-branch does, but faster. And written in Scala",rtyley,bfg-repo-cleaner,https://github.com/rtyley/bfg-repo-cleaner
2023-06-14,scala,200,0,"Open, Modular, Deep Learning Accelerator",apache,tvm-vta,https://github.com/apache/tvm-vta
2023-06-14,scala,28,0,,broadinstitute,firecloud-orchestration,https://github.com/broadinstitute/firecloud-orchestration
2023-06-14,scala,22,0,Rawls service for DSDE,broadinstitute,rawls,https://github.com/broadinstitute/rawls
2023-06-14,scala,5957,3,Modern Load Testing as Code,gatling,gatling,https://github.com/gatling/gatling
2023-06-14,scala,11397,2,CMAK is a tool for managing Apache Kafka clusters,yahoo,CMAK,https://github.com/yahoo/CMAK
2023-06-14,scala,61,1,Mockup/testing JDBC & MongoDB driver (or Chmeee's son on the Ringworld).,cchantep,acolyte,https://github.com/cchantep/acolyte
2023-06-14,scala,3657,6,Open-source high-performance RISC-V processor,OpenXiangShan,XiangShan,https://github.com/OpenXiangShan/XiangShan
2023-06-14,scala,2420,0,"A minimal, idiomatic Scala interface for HTTP",http4s,http4s,https://github.com/http4s/http4s
2023-06-14,scala,373,0,A Spark plugin for reading and writing Excel files,crealytics,spark-excel,https://github.com/crealytics/spark-excel
2023-06-14,scala,2822,2,"Deequ is a library built on top of Apache Spark for defining ""unit tests for data"", which measure data quality in large datasets.",awslabs,deequ,https://github.com/awslabs/deequ