date,language,stargazers,starsToday,description,owner,name,url
2023-08-02,elixir,21871,3,"Elixir is a dynamic, functional language for building scalable and maintainable applications",elixir-lang,elixir,https://github.com/elixir-lang/elixir
2023-08-02,elixir,15583,14,"Simple, open-source, lightweight (< 1 KB) and privacy-friendly web analytics alternative to Google Analytics.",plausible,analytics,https://github.com/plausible/analytics
2023-08-02,elixir,73,0,Public database of Elixir security advisories pulled from GitHub Advisory Database,mirego,elixir-security-advisories,https://github.com/mirego/elixir-security-advisories
2023-08-02,elixir,574,0,Kafka client library for Elixir,kafkaex,kafka_ex,https://github.com/kafkaex/kafka_ex
2023-08-02,elixir,72,0,Traffic endpoint and graceful shutdown for Elixir Plug apps,Financial-Times,k8s_traffic_plug,https://github.com/Financial-Times/k8s_traffic_plug
2023-08-02,elixir,19756,4,Peace of mind from prototype to production,phoenixframework,phoenix,https://github.com/phoenixframework/phoenix
2023-08-02,elixir,4110,2,A self-hosted data logger for your Tesla 🚘,adriankumpf,teslamate,https://github.com/adriankumpf/teslamate
2023-08-02,elixir,511,0,An interactive cybersecurity curriculum designed for enterprise use at software companies using Elixir,podium,elixir-secure-coding,https://github.com/podium/elixir-secure-coding
2023-08-02,elixir,911,0,Pre-trained Neural Network models in Axon (+  Models integration),elixir-nx,bumblebee,https://github.com/elixir-nx/bumblebee
2023-08-02,elixir,2613,3,Blockchain explorer for Ethereum based network and a tool for inspecting and analyzing EVM based blockchains.,blockscout,blockscout,https://github.com/blockscout/blockscout
2023-08-02,elixir,3696,1,Automate code & data workflows with interactive Elixir notebooks,livebook-dev,livebook,https://github.com/livebook-dev/livebook
2023-08-02,elixir,6008,2,"Broadcast, Presence, and Postgres Changes via WebSockets",supabase,realtime,https://github.com/supabase/realtime
2023-08-02,elixir,96,1,A platform for building native applications with Phoenix LiveView,liveview-native,live_view_native,https://github.com/liveview-native/live_view_native
2023-08-02,elixir,5347,2,Open-source live customer chat,papercups-io,papercups,https://github.com/papercups-io/papercups
2023-08-02,elixir,5795,1,A toolkit for data mapping and language integrated query.,elixir-ecto,ecto,https://github.com/elixir-ecto/ecto
2023-08-02,elixir,2569,0,Changelog is news and podcast for developers. This is our open source platform.,thechangelog,changelog.com,https://github.com/thechangelog/changelog.com
2023-08-02,elixir,2643,1,"💎 Robust job processing in Elixir, backed by modern PostgreSQL or SQLite3",sorentwo,oban,https://github.com/sorentwo/oban
2023-08-02,elixir,849,1,An Elixir Library for Stripe,beam-community,stripity-stripe,https://github.com/beam-community/stripity-stripe
2023-08-02,elixir,562,0,The official Elixir SDK for Sentry (sentry.io),getsentry,sentry-elixir,https://github.com/getsentry/sentry-elixir
2023-08-02,elixir,2940,0,Simplify deployments in Elixir with OTP releases!,bitwalker,distillery,https://github.com/bitwalker/distillery
2023-08-02,elixir,5312,1,"Rich, real-time user experiences with server-rendered HTML",phoenixframework,phoenix_live_view,https://github.com/phoenixframework/phoenix_live_view
2023-08-02,elixir,259,4,Lexical is a next-generation elixir language server,lexical-lsp,lexical,https://github.com/lexical-lsp/lexical
2023-08-02,elixir,728,0,[Deprecated because ibrowse is not maintained] HTTP client for Elixir (use Tesla please),valpackett,httpotion,https://github.com/valpackett/httpotion
2023-08-02,elixir,414,0,Internationalization and localization support for Elixir.,elixir-gettext,gettext,https://github.com/elixir-gettext/gettext
2023-08-02,elixir,45,1,Simple DNS clustering for distributed Elixir nodes,phoenixframework,dns_cluster,https://github.com/phoenixframework/dns_cluster