date,language,stargazers,starsToday,description,owner,name,url
2024-08-19,typescript,4468,51,A modern JavaScript utility library that's 2-3 times faster and up to 97% smaller—a major upgrade to lodash.,toss,es-toolkit,https://github.com/toss/es-toolkit
2024-08-19,typescript,6505,200,"Huly — All-in-One Project Management Platform (alternative to Linear, Jira, Slack, Notion, Motion)",hcengineering,platform,https://github.com/hcengineering/platform
2024-08-19,typescript,36800,35,"🤯 Lobe Chat - an open-source, modern-design LLMs/AI chat framework. Supports Multi AI Providers( OpenAI / Claude 3 / Gemini / Ollama / Bedrock / Azure / Mistral / Perplexity ), Multi-Modals (Vision/TTS) and plugin system. One-click FREE deployment of your private ChatGPT chat application.",lobehub,lobe-chat,https://github.com/lobehub/lobe-chat
2024-08-19,typescript,14460,257,"Crawlee—A web scraping and browser automation library for Node.js to build reliable crawlers. In JavaScript and TypeScript. Extract data for AI, LLMs, RAG, or GPTs. Download HTML, PDF, JPG, PNG, and other files from websites. Works with Puppeteer, Playwright, Cheerio, JSDOM, and raw HTTP. Both headful and headless mode. With proxy rotation.",apify,crawlee,https://github.com/apify/crawlee
2024-08-19,typescript,14457,92,"♾ Infisical is the open-source secret management platform: Sync secrets across your team/infrastructure, prevent secret leaks, and manage internal PKI",Infisical,infisical,https://github.com/Infisical/infisical
2024-08-19,typescript,10931,19,Next.js Commerce,vercel,commerce,https://github.com/vercel/commerce
2024-08-19,typescript,1009,5,Official Javascript repository for Clerk authentication,clerk,javascript,https://github.com/clerk/javascript
2024-08-19,typescript,9362,205,"A framework for building custom AI Copilots 🤖 in-app AI chatbots, in-app AI Agents, & AI-powered Textareas.",CopilotKit,CopilotKit,https://github.com/CopilotKit/CopilotKit
2024-08-19,typescript,7355,36,"⚡️⚡️⚡️Self-hosted collaborative bookmark manager to collect, organize, and preserve webpages and articles.",linkwarden,linkwarden,https://github.com/linkwarden/linkwarden
2024-08-19,typescript,42400,60,High performance self-hosted photo and video management solution.,immich-app,immich,https://github.com/immich-app/immich
2024-08-19,typescript,63325,125,"The open and composable observability and data visualization platform. Visualize metrics, logs, and traces from multiple sources like Prometheus, Loki, Elasticsearch, InfluxDB, Postgres and many more.",grafana,grafana,https://github.com/grafana/grafana
2024-08-19,typescript,1862,13,Modern & Minimal JS Mastery Portfolio,adrianhajdin,portfolio,https://github.com/adrianhajdin/portfolio
2024-08-19,typescript,2287,9,"📺 Cross-platform IPTV player application with multiple features, such as support of m3u and m3u8 playlists, favorites, TV guide, TV archive/catchup and more.",4gray,iptvnator,https://github.com/4gray/iptvnator
2024-08-19,typescript,26868,224,"🔥 🔥 🔥 Open Source JIRA, Linear, Monday, and Asana Alternative. Plane helps you track your issues, epics, and product roadmaps in the simplest way possible.",makeplane,plane,https://github.com/makeplane/plane
2024-08-19,typescript,4378,4,"🌟 Build beautiful, accessible, high-performance documentation websites with Astro",withastro,starlight,https://github.com/withastro/starlight