date,language,stargazers,starsToday,description,owner,name,url
2024-12-09,haskell,24008,109,REST API for any Postgres database,PostgREST,postgrest,https://github.com/PostgREST/postgrest
2024-12-09,haskell,34975,9,Universal markup converter,jgm,pandoc,https://github.com/jgm/pandoc
2024-12-09,haskell,7422,11,"SimpleX - the first messaging network operating without user identifiers of any kind - 100% private by design! iOS, Android and desktop apps 📱!",simplex-chat,simplex-chat,https://github.com/simplex-chat/simplex-chat
2024-12-09,haskell,729,4,Trying to understand the file format of Tip Toi,entropia,tip-toi-reveng,https://github.com/entropia/tip-toi-reveng
2024-12-09,haskell,4141,2,An advanced keyboard manager,kmonad,kmonad,https://github.com/kmonad/kmonad
2024-12-09,haskell,2526,1,Agda is a dependently typed programming language / interactive theorem prover.,agda,agda,https://github.com/agda/agda
2024-12-09,haskell,10513,3,"Dockerfile linter, validate inline bash, written in Haskell",hadolint,hadolint,https://github.com/hadolint/hadolint
2024-12-09,haskell,1301,0,"Fast, portable and reliable dependency analysis for any codebase. Supports license & vulnerability scanning for large monoliths. Language-agnostic; integrates with 20+ build systems.",fossas,fossa-cli,https://github.com/fossas/fossa-cli
2024-12-09,haskell,8600,3,A strongly-typed language that compiles to JavaScript,purescript,purescript,https://github.com/purescript/purescript
2024-12-09,haskell,591,1,Contributed modules for xmonad,xmonad,xmonad-contrib,https://github.com/xmonad/xmonad-contrib
2024-12-09,haskell,3079,2,The core component that is used to participate in a Cardano decentralised blockchain.,IntersectMBO,cardano-node,https://github.com/IntersectMBO/cardano-node
2024-12-09,haskell,3085,2,"Robust, fast, intuitive plain text accounting tool with CLI, TUI and web interfaces.",simonmichael,hledger,https://github.com/simonmichael/hledger
2024-12-09,haskell,551,0,⚙️ SimpleXMQ - A reference implementation of the SimpleX Messaging Protocol for simplex queues over public networks.,simplex-chat,simplexmq,https://github.com/simplex-chat/simplexmq
2024-12-09,haskell,2535,1,A shell script which checks your $HOME for unwanted files and directories.,b3nj5m1n,xdg-ninja,https://github.com/b3nj5m1n/xdg-ninja
2024-12-09,haskell,5829,0,A friendly programming language from the future,unisonweb,unison,https://github.com/unisonweb/unison
2024-12-09,haskell,36564,6,"ShellCheck, a static analysis tool for shell scripts",koalaman,shellcheck,https://github.com/koalaman/shellcheck
2024-12-09,haskell,2627,0,🇪🇺 Wire back-end services,wireapp,wire-server,https://github.com/wireapp/wire-server
2024-12-09,haskell,2729,0,Official haskell ide support via language server (LSP). Successor of ghcide & haskell-ide-engine.,haskell,haskell-language-server,https://github.com/haskell/haskell-language-server
2024-12-09,haskell,4952,2,🔥 The fastest way to build type safe web apps. IHP is a new batteries-included web framework optimized for longterm productivity and programmer happiness,digitallyinduced,ihp,https://github.com/digitallyinduced/ihp
2024-12-09,haskell,36,0,Implementation of a Consensus Layer for the Ouroboros family of protocols,IntersectMBO,ouroboros-consensus,https://github.com/IntersectMBO/ouroboros-consensus
2024-12-09,haskell,458,0,A language for intent-centric and declarative decentralised applications,anoma,juvix,https://github.com/anoma/juvix