date,language,stargazers,starsToday,description,owner,name,url
2023-01-30,typescript,40481,171,Virtual whiteboard for sketching hand-drawn like diagrams,excalidraw,excalidraw,https://github.com/excalidraw/excalidraw
2023-01-30,typescript,1827,19,Clean and simple starter repo using the T3 Stack along with Expo React Native,t3-oss,create-t3-turbo,https://github.com/t3-oss/create-t3-turbo
2023-01-30,typescript,25916,162,Build faster websites with Astro's next-gen island architecture,withastro,astro,https://github.com/withastro/astro
2023-01-30,typescript,71940,29,"""The mother of all demo apps"" — Exemplary fullstack Medium.com clone powered by React, Angular, Node, Django, and many more",gothinkster,realworld,https://github.com/gothinkster/realworld
2023-01-30,typescript,34217,33,"Joplin - an open source note taking and to-do application with synchronisation capabilities for Windows, macOS, Linux, Android and iOS.",laurent22,joplin,https://github.com/laurent22/joplin
2023-01-30,typescript,5480,33,Use ChatGPT On Wechat via wechaty,fuergaosi233,wechat-chatgpt,https://github.com/fuergaosi233/wechat-chatgpt
2023-01-30,typescript,18084,42,"The open-source notification infrastructure for products. Add a notification center for your React, Vue and Angular apps",novuhq,novu,https://github.com/novuhq/novu
2023-01-30,typescript,16558,41,"A simple, scalable, and powerful architecture for building production ready React applications.",alan2207,bulletproof-react,https://github.com/alan2207/bulletproof-react
2023-01-30,typescript,12890,8,前端低代码框架，通过 JSON 配置就能生成各种页面。,baidu,amis,https://github.com/baidu/amis
2023-01-30,typescript,34655,10,The communications platform that puts data protection first.,RocketChat,Rocket.Chat,https://github.com/RocketChat/Rocket.Chat
2023-01-30,typescript,1199,17,插件化、定制化、无广告的免费音乐播放器,maotoumao,MusicFree,https://github.com/maotoumao/MusicFree
2023-01-30,typescript,8786,20,"支持python3、javaScript、shell、typescript 的定时任务管理软件（Timed task management software with python3, javaScript, shell, typescript support）",whyour,qinglong,https://github.com/whyour/qinglong
2023-01-30,typescript,23737,44,一个基于 electron 的音乐软件,lyswhut,lx-music-desktop,https://github.com/lyswhut/lx-music-desktop
2023-01-30,typescript,6615,5,Vite & Vue powered static site generator.,vuejs,vitepress,https://github.com/vuejs/vitepress
2023-01-30,typescript,21609,10,"Seamlessly visualize your JSON data instantly into graphs; paste, import or fetch!",AykutSarac,jsoncrack.com,https://github.com/AykutSarac/jsoncrack.com
2023-01-30,typescript,9153,19,"Upscayl - Free and Open Source AI Image Upscaler for Linux, MacOS and Windows built with Linux-First philosophy.",upscayl,upscayl,https://github.com/upscayl/upscayl
2023-01-30,typescript,1285,19,A browser extension that augments your ChatGPT prompts with web results.,qunash,chatgpt-advanced,https://github.com/qunash/chatgpt-advanced
2023-01-30,typescript,42604,35,A terminal for a more modern age,Eugeny,tabby,https://github.com/Eugeny/tabby
2023-01-30,typescript,993,6,微软语音合成工具，使用 Electron + Vue + ElementPlus + Vite 构建。,LokerL,tts-vue,https://github.com/LokerL/tts-vue
2023-01-30,typescript,3923,1,An open source interface for the Uniswap protocol,Uniswap,interface,https://github.com/Uniswap/interface
2023-01-30,typescript,5615,29,"An open-source, self-hosted memo hub with knowledge management and socialization.",usememos,memos,https://github.com/usememos/memos
2023-01-30,typescript,360108,63,freeCodeCamp.org's open-source codebase and curriculum. Learn to code for free.,freeCodeCamp,freeCodeCamp,https://github.com/freeCodeCamp/freeCodeCamp
2023-01-30,typescript,18696,10,"A fast, offline-first, reactive database for JavaScript Applications",pubkey,rxdb,https://github.com/pubkey/rxdb
2023-01-30,typescript,14918,28,The HTML-first framework. Instant apps of any size with ~ 1kb JS,BuilderIO,qwik,https://github.com/BuilderIO/qwik
2023-01-30,typescript,2021,9,Stable diffusion for real-time music generation (web app),riffusion,riffusion-app,https://github.com/riffusion/riffusion-app