date,language,stargazers,starsToday,description,owner,name,url
2023-12-07,scala,1805,2,Apache Kyuubi is a distributed and multi-tenant gateway to provide serverless SQL on data warehouses and lakehouses.,apache,kyuubi,https://github.com/apache/kyuubi
2023-12-07,scala,14050,5,"♞ lichess.org: the forever free, adless and open source chess server ♞",lichess-org,lila,https://github.com/lichess-org/lila
2023-12-07,scala,4879,1,Simple and Distributed Machine Learning,microsoft,SynapseML,https://github.com/microsoft/SynapseML
2023-12-07,scala,796,2,Gluten: Plugin to Double SparkSQL's Performance,oap-project,gluten,https://github.com/oap-project/gluten
2023-12-07,scala,12471,0,The Community Maintained High Velocity Web Framework For Java and Scala.,playframework,playframework,https://github.com/playframework/playframework
2023-12-07,scala,37339,11,Apache Spark - A unified analytics engine for large-scale data processing,apache,spark,https://github.com/apache/spark
2023-12-07,scala,3533,1,"StreamPark, Make stream processing easier! easy-to-use streaming application development framework and operation platform",apache,incubator-streampark,https://github.com/apache/incubator-streampark
2023-12-07,scala,649,0,An open protocol for secure data sharing,delta-io,delta-sharing,https://github.com/delta-io/delta-sharing
2023-12-07,scala,228,0,Enabling Continuous Data Processing with Apache Spark and Azure Event Hubs,Azure,azure-event-hubs-spark,https://github.com/Azure/azure-event-hubs-spark
2023-12-07,scala,3520,2,State of the Art Natural Language Processing,JohnSnowLabs,spark-nlp,https://github.com/JohnSnowLabs/spark-nlp
2023-12-07,scala,1,0,,eed3si9n,recipes,https://github.com/eed3si9n/recipes
2023-12-07,scala,1,0,Experiment with ways to protect against CRSF attacks with playframework 2 and scala,yanns,play2-crsf-protection,https://github.com/yanns/play2-crsf-protection
2023-12-07,scala,5478,3,"The Scala 3 compiler, also known as Dotty.",lampepfl,dotty,https://github.com/lampepfl/dotty
2023-12-07,scala,4723,1,"sbt, the interactive build tool",sbt,sbt,https://github.com/sbt/sbt
2023-12-07,scala,39,0,Notebook service,DataBiosphere,leonardo,https://github.com/DataBiosphere/leonardo
2023-12-07,scala,25,0,Rawls service for DSDE,broadinstitute,rawls,https://github.com/broadinstitute/rawls
2023-12-07,scala,216,0,"Open, Modular, Deep Learning Accelerator",apache,tvm-vta,https://github.com/apache/tvm-vta
2023-12-07,scala,12829,1,"Build highly concurrent, distributed, and resilient message-driven applications on the JVM",akka,akka,https://github.com/akka/akka
2023-12-07,scala,3298,1,Chisel: A Modern Hardware Design Language,chipsalliance,chisel,https://github.com/chipsalliance/chisel
2023-12-07,scala,6239,0,Apache OpenWhisk is an open source serverless cloud platform,apache,openwhisk,https://github.com/apache/openwhisk
2023-12-07,scala,3909,0,"ZIO — A type-safe, composable library for async and concurrent programming in Scala",zio,zio,https://github.com/zio/zio
2023-12-07,scala,1255,0,"Declarative, type-safe web endpoints library",softwaremill,tapir,https://github.com/softwaremill/tapir
2023-12-07,scala,8994,1,"A Git platform powered by Scala with easy installation, high extensibility & GitHub API compatibility",gitbucket,gitbucket,https://github.com/gitbucket/gitbucket
2023-12-07,scala,830,1,Apache Livy is an open source REST interface for interacting with Apache Spark from anywhere.,apache,incubator-livy,https://github.com/apache/incubator-livy
2023-12-07,scala,249,0,Apache Spark Connector for SQL Server and Azure SQL,microsoft,sql-spark-connector,https://github.com/microsoft/sql-spark-connector