date,language,stargazers,starsToday,description,owner,name,url
2024-05-10,r,2132,3,R toolkit for single cell genomics,satijalab,seurat,https://github.com/satijalab/seurat
2024-05-10,r,0,0,This is my other add and subtract package,wevanjohnson,my.package,https://github.com/wevanjohnson/my.package
2024-05-10,r,15,1,,CastleLi,scBSP,https://github.com/CastleLi/scBSP
2024-05-10,r,6338,1,An implementation of the Grammar of Graphics in R,tidyverse,ggplot2,https://github.com/tidyverse/ggplot2
2024-05-10,r,168,0,"R toolkit for inference, visualization and analysis of cell-cell communication from single-cell and spatially resolved transcriptomics",jinworks,CellChat,https://github.com/jinworks/CellChat
2024-05-10,r,510,0,Inferring CNV from Single-Cell RNA-Seq,broadinstitute,infercnv,https://github.com/broadinstitute/infercnv
2024-05-10,r,0,0,,smarguer,GENERAL_R_SCRIPTS,https://github.com/smarguer/GENERAL_R_SCRIPTS
2024-05-10,r,350,0,ArchR : Analysis of Regulatory Chromatin in R (www.ArchRProject.com),GreenleafLab,ArchR,https://github.com/GreenleafLab/ArchR
2024-05-10,r,594,0,"R toolkit for inference, visualization and analysis of cell-cell communication from single-cell data",sqjin,CellChat,https://github.com/sqjin/CellChat
2024-05-10,r,291,0,R toolkit for the analysis of single-cell chromatin data,stuart-lab,signac,https://github.com/stuart-lab/signac
2024-05-10,r,312,0,,cole-trapnell-lab,monocle3,https://github.com/cole-trapnell-lab/monocle3
2024-05-10,r,555,0,"phyloseq is a set of classes, wrappers, and tools (in R) to make it easier to import, store, and analyze phylogenetic sequencing data; and to reproducibly share that data and analysis with others. See the phyloseq front page:",joey711,phyloseq,https://github.com/joey711/phyloseq
2024-05-10,r,453,0,Accurate sample inference from amplicon data with single nucleotide resolution,benjjneb,dada2,https://github.com/benjjneb/dada2
2024-05-10,r,2359,0,Tools to make an R developer's life easier,r-lib,devtools,https://github.com/r-lib/devtools
2024-05-10,r,733,1,,rmcelreath,stat_rethinking_2024,https://github.com/rmcelreath/stat_rethinking_2024
2024-05-10,r,1235,3,Make Complex Heatmaps,jokergoo,ComplexHeatmap,https://github.com/jokergoo/ComplexHeatmap
2024-05-10,r,134,0,Interfaces for HDF5-based Single Cell File Formats,mojaveazure,seurat-disk,https://github.com/mojaveazure/seurat-disk
2024-05-10,r,222,0,,kpatel427,YouTubeTutorials,https://github.com/kpatel427/YouTubeTutorials
2024-05-10,r,352,0,R package for detecting doublets in single-cell RNA sequencing data,chris-mcginnis-ucsf,DoubletFinder,https://github.com/chris-mcginnis-ucsf/DoubletFinder
2024-05-10,r,20,0,,satijalab,seurat-object,https://github.com/satijalab/seurat-object
2024-05-10,r,33,1,新手友好的孟德尔随机化项目,TullyMonster,MendelRookie,https://github.com/TullyMonster/MendelRookie
2024-05-10,r,2494,1,An interactive graphing library for R,plotly,plotly.R,https://github.com/plotly/plotly.R
2024-05-10,r,4665,1,dplyr: A grammar of data manipulation,tidyverse,dplyr,https://github.com/tidyverse/dplyr
2024-05-10,r,1,0,,molgenis,ds-tidyverse-client,https://github.com/molgenis/ds-tidyverse-client
2024-05-10,r,944,0,📊 A universal enrichment tool for interpreting omics data,YuLab-SMU,clusterProfiler,https://github.com/YuLab-SMU/clusterProfiler