date,language,stargazers,starsToday,description,owner,name,url
2024-05-10,svelte,19541,180,User-friendly WebUI for LLMs (Formerly Ollama WebUI),open-webui,open-webui,https://github.com/open-webui/open-webui
2024-05-10,svelte,3966,9,"shadcn/ui, but for Svelte. ✨",huntabyte,shadcn-svelte,https://github.com/huntabyte/shadcn-svelte
2024-05-10,svelte,4558,6,The UI toolkit for Svelte and Tailwind.,skeletonlabs,skeleton,https://github.com/skeletonlabs/skeleton
2024-05-10,svelte,2270,11,"Huly — All-in-One Project Management Platform (alternative to Linear, Jira, Slack, Notion, Motion)",hcengineering,platform,https://github.com/hcengineering/platform
2024-05-10,svelte,3432,0,Build and ship your app faster https://fireship.io,fireship-io,fireship.io,https://github.com/fireship-io/fireship.io
2024-05-10,svelte,0,0,,bkuehnis,KI-Anwendungen-n-to-n-frontend,https://github.com/bkuehnis/KI-Anwendungen-n-to-n-frontend
2024-05-10,svelte,869,9,"Transcribe any audio to text, translate and edit subtitles 100% locally with a web UI. Powered by whisper models!",pluja,whishper,https://github.com/pluja/whishper
2024-05-10,svelte,124,0,A human-readable Solana transaction explorer powered by Helius.,helius-labs,xray,https://github.com/helius-labs/xray
2024-05-10,svelte,116,0,Astro-bento-portfolio is a minimal bento-like (almost) single page portfolio website made in Astro,Ladvace,astro-bento-portfolio,https://github.com/Ladvace/astro-bento-portfolio
2024-05-10,svelte,562,2,"Collection of Svelte components, actions, stores, and utilities to build highly interactive applications.",techniq,svelte-ux,https://github.com/techniq/svelte-ux
2024-05-10,svelte,1250,5,graphics framework for sveltejs,mhkeller,layercake,https://github.com/mhkeller/layercake
2024-05-10,svelte,382,2,"FreeShow is a free and open-source, user-friendly presenter software.",ChurchApps,FreeShow,https://github.com/ChurchApps/FreeShow
2024-05-10,svelte,275,6,"Open source, self-hostable watched list for all your content (movies, tv series, anime, games) with user authentication, modern and clean UI and a very simple setup.",sbondCo,Watcharr,https://github.com/sbondCo/Watcharr
2024-05-10,svelte,881,0,Full-sized drag & drop JavaScript event calendar with resource view,vkurko,calendar,https://github.com/vkurko/calendar
2024-05-10,svelte,4358,1,"Database manager for MySQL, PostgreSQL, SQL Server, MongoDB, SQLite and others. Runs under Windows, Linux, Mac or as web application",dbgate,dbgate,https://github.com/dbgate/dbgate
2024-05-10,svelte,131,1,A website to generate Minecraft profile pictures,MauritsWilke,mcpfp,https://github.com/MauritsWilke/mcpfp
2024-05-10,svelte,706,7,"A modern SaaS template/boilerplate built with SvelteKit, Tailwind, and Supabase. Includes marketing page, blog, subscriptions, auth, user dashboard, user settings, pricing page, and more.",CriticalMoments,CMSaasStarter,https://github.com/CriticalMoments/CMSaasStarter
2024-05-10,svelte,1675,1,"A modern, easy-to-use and performant custom Home Assistant dashboard",matt8707,ha-fusion,https://github.com/matt8707/ha-fusion
2024-05-10,svelte,217,2,Admin Web Interface for juanfont/headscale,GoodiesHQ,headscale-admin,https://github.com/GoodiesHQ/headscale-admin
2024-05-10,svelte,1787,5,"Bittorrent streaming software for cats. Stream anime torrents, real-time with no waiting for downloads.",ThaUnknown,miru,https://github.com/ThaUnknown/miru
2024-05-10,svelte,245,3,An Obsidian plugin to interact with your privacy focused AI-Assistant making your second brain even smarter!,your-papa,obsidian-Smart2Brain,https://github.com/your-papa/obsidian-Smart2Brain
2024-05-10,svelte,1611,0,Bookmark manager for the wizards 🧙,goniszewski,grimoire,https://github.com/goniszewski/grimoire
2024-05-10,svelte,2118,1,,PuruVJ,macos-web,https://github.com/PuruVJ/macos-web
2024-05-10,svelte,493,0,Find the best Neovim plugins,codicocodes,dotfyle,https://github.com/codicocodes/dotfyle
2024-05-10,svelte,13,0,Example repository that showcases inlang.,opral,example,https://github.com/opral/example