date,language,stargazers,starsToday,description,owner,name,url
2024-06-21,javascript,8526,29,"Powerful rich text editor framework with a modular architecture, modern integrations, and features like collaborative editing.",ckeditor,ckeditor5,https://github.com/ckeditor/ckeditor5
2024-06-21,javascript,6083,21,Use Cloudflare pages and worker serverless to implement VLESS protocol,3Kmfi6HP,EDtunnel,https://github.com/3Kmfi6HP/EDtunnel
2024-06-21,javascript,8826,21,Xray panel supporting multi-protocol multi-user expire day & traffic & ip limit (Vmess & Vless & Trojan & ShadowSocks & Wireguard),MHSanaei,3x-ui,https://github.com/MHSanaei/3x-ui
2024-06-21,javascript,46283,110,"⚡ Serverless Framework – Use AWS Lambda and other managed cloud services to build apps that auto-scale, cost nothing when idle, and boast radically low maintenance.",serverless,serverless,https://github.com/serverless/serverless
2024-06-21,javascript,34594,123,</> htmx - high power tools for HTML,bigskysoftware,htmx,https://github.com/bigskysoftware/htmx
2024-06-21,javascript,19287,155,"⛓️ Langflow is a visual framework for building multi-agent and RAG applications. It's open-source, Python-powered, fully customizable, model and vector store agnostic.",langflow-ai,langflow,https://github.com/langflow-ai/langflow
2024-06-21,javascript,11044,4,OpenLayers,openlayers,openlayers,https://github.com/openlayers/openlayers
2024-06-21,javascript,8345,10,Community curated list of templates for the nuclei engine to find security vulnerabilities.,projectdiscovery,nuclei-templates,https://github.com/projectdiscovery/nuclei-templates
2024-06-21,javascript,6731,39,"🎮 Open-source, cross-platform game engine designed to be used by everyone.",4ian,GDevelop,https://github.com/4ian/GDevelop
2024-06-21,javascript,29007,3,Reorderable drag-and-drop lists for modern browsers and touch devices. No jQuery or framework required.,SortableJS,Sortable,https://github.com/SortableJS/Sortable
2024-06-21,javascript,100009,34,JavaScript 3D Library.,mrdoob,three.js,https://github.com/mrdoob/three.js
2024-06-21,javascript,7337,1,A JavaScript plugin for entering and validating international telephone numbers,jackocnr,intl-tel-input,https://github.com/jackocnr/intl-tel-input
2024-06-21,javascript,46354,5,"Fast, easy and reliable testing for anything that runs in a browser.",cypress-io,cypress,https://github.com/cypress-io/cypress
2024-06-21,javascript,18202,10,"Cross-platform automation framework for all kinds of apps, built on top of the W3C WebDriver protocol",appium,appium,https://github.com/appium/appium
2024-06-21,javascript,9967,22,The Block Editor project for WordPress and beyond. Plugin is available from the official repository.,WordPress,gutenberg,https://github.com/WordPress/gutenberg
2024-06-21,javascript,12298,13,An open-source JavaScript library for world-class 3D globes and maps 🌎,CesiumGS,cesium,https://github.com/CesiumGS/cesium
2024-06-21,javascript,55124,7,"The best React-based framework with performance, scalability and security built in.",gatsbyjs,gatsby,https://github.com/gatsbyjs/gatsby
2024-06-21,javascript,32686,7,Beautiful and accessible drag and drop for lists with React,atlassian,react-beautiful-dnd,https://github.com/atlassian/react-beautiful-dnd
2024-06-21,javascript,3266,28,"meet Suhail-Md, Your All-in-One WhatsApp Excitement Buddy! Enjoy a thrilling messaging experience like never before. Suhail-Md brings a world of excitement and joy to your chats ✨🤖",SuhailTechInfo,Suhail-Md,https://github.com/SuhailTechInfo/Suhail-Md
2024-06-21,javascript,15713,11,The open-source repo for docs.github.com,github,docs,https://github.com/github/docs
2024-06-21,javascript,24519,10,Find and fix problems in your JavaScript code.,eslint,eslint,https://github.com/eslint/eslint