date,language,stargazers,starsToday,description,owner,name,url
2022-10-17,css,38858,24,"Iconic font aggregator, collection, & patcher. 3,600+ icons, 50+ patched fonts: Hack, Source Code Pro, more. Glyph collections: Font Awesome, Material Design Icons, Octicons, & more",ryanoasis,nerd-fonts,https://github.com/ryanoasis/nerd-fonts
2022-10-17,css,3436,4,,safak,youtube,https://github.com/safak/youtube
2022-10-17,css,1090,13,"经济学人(含音频)、纽约客、卫报、连线、大西洋月刊等英语杂志免费下载,支持epub、mobi、pdf格式, 每周更新",hehonghui,awesome-english-ebooks,https://github.com/hehonghui/awesome-english-ebooks
2022-10-17,css,677,5,A blue theme for Obsidian.,whyt-byte,Blue-Topaz_Obsidian-css,https://github.com/whyt-byte/Blue-Topaz_Obsidian-css
2022-10-17,css,17617,8,"CSS is powerful, you can do a lot of things without JS.",you-dont-need,You-Dont-Need-JavaScript,https://github.com/you-dont-need/You-Dont-Need-JavaScript
2022-10-17,css,4049,3,Accurately Locate Smartphones using Social Engineering,thewhiteh4t,seeker,https://github.com/thewhiteh4t/seeker
2022-10-17,css,3862,1,A community-driven collection of themes for customizing Spotify through Spicetify - https://github.com/spicetify/spicetify-cli,spicetify,spicetify-themes,https://github.com/spicetify/spicetify-themes
2022-10-17,css,16,1,This is a price template panel project where I aim to make working price template model that can be used on webapps,ElvinPero,PriceTemplate,https://github.com/ElvinPero/PriceTemplate
2022-10-17,css,560,8,Firefox custom CSS based on Simplefox,andreasgrafen,cascade,https://github.com/andreasgrafen/cascade
2022-10-17,css,1479,2,毒奶去网页广告计划（稳定版）For Quantumult X & Surge & 油猴脚本 ；如去内容农场/禁漫天堂/绅士漫画/奈菲影视/低端影视/哔嘀影视/片库网/Pornhub/Jable/Netflav/HPjav等视频网站广告或其他ACG网站网页广告；,limbopro,Adblock4limbo,https://github.com/limbopro/Adblock4limbo
2022-10-17,css,47,1,This repository only accepting CSS/LASS/SAAS projects.Check the support link also star my repository,WeBeginners-Community,CSS.Effects-Designs,https://github.com/WeBeginners-Community/CSS.Effects-Designs
2022-10-17,css,4387,3,http://learnopengl.com 系列教程的简体中文翻译,LearnOpenGL-CN,LearnOpenGL-CN,https://github.com/LearnOpenGL-CN/LearnOpenGL-CN
2022-10-17,css,76022,2,A cross-browser library of CSS animations. As easy to use as an easy thing.,animate-css,animate.css,https://github.com/animate-css/animate.css
2022-10-17,css,2214,2,A minimal Jekyll Theme to host your resume (CV),sharu725,online-cv,https://github.com/sharu725/online-cv
2022-10-17,css,1220,2,8亿QQ绑定数据泄露查询源码，附送数据。不定期更新下载地址 关注越多送的越多,qq8e,qq,https://github.com/qq8e/qq
2022-10-17,css,1799,5,Orchis is a [Material Design](https://material.io) theme for GNOME/GTK based desktop environments.,vinceliuice,Orchis-theme,https://github.com/vinceliuice/Orchis-theme
2022-10-17,css,659,0,Fluent design gtk theme for linux desktops,vinceliuice,Fluent-gtk-theme,https://github.com/vinceliuice/Fluent-gtk-theme
2022-10-17,css,168,0,Source for Midjourney's official wiki,midjourney,docs,https://github.com/midjourney/docs
2022-10-17,css,525,0,This project is for html & css practice. We made this for youtube tutorial purpose.,ShaifArfan,one-page-website-html-css-project,https://github.com/ShaifArfan/one-page-website-html-css-project
2022-10-17,css,21654,14,"50+ mini web projects using HTML, CSS & JS",bradtraversy,50projects50days,https://github.com/bradtraversy/50projects50days
2022-10-17,css,3946,6,静态响应式网址导航网站 - webstack.cc,WebStackPage,WebStackPage.github.io,https://github.com/WebStackPage/WebStackPage.github.io
2022-10-17,css,22,2,"A platform where anyone can make their profile, share their twitter and linkedIn bookmarks, see other shared bookmarks and contribute to the community. This repository is participating in Hacktoberfest2022.",vijayyprajapati,Share-Your-Bookmarks,https://github.com/vijayyprajapati/Share-Your-Bookmarks
2022-10-17,css,1539,3,v2ray-core 的模板们,v2fly,v2ray-examples,https://github.com/v2fly/v2ray-examples
2022-10-17,css,1901,5,"Meticulously designed to make Obsidian feel native across platforms. You can customize colors, fonts and more with the companion plugin Minimal Theme Settings.",kepano,obsidian-minimal,https://github.com/kepano/obsidian-minimal
2022-10-17,css,25,1,"A collection of awesome projects made using plain HTML, CSS, and JavaScript",varunKT001,awesome-javascript-projects,https://github.com/varunKT001/awesome-javascript-projects