date,language,stargazers,starsToday,description,owner,name,url
2024-07-27,css,48924,10,Modern CSS framework based on Flexbox,jgthms,bulma,https://github.com/jgthms/bulma
2024-07-27,css,80273,7,ğŸ¿ A cross-browser library of CSS animations. As easy to use as an easy thing.,animate-css,animate.css,https://github.com/animate-css/animate.css
2024-07-27,css,52162,4,A modern alternative to CSS resets,necolas,normalize.css,https://github.com/necolas/normalize.css
2024-07-27,css,5723,1,Pro Git 2nd Edition,progit,progit2,https://github.com/progit/progit2
2024-07-27,css,9904,6,The Most Complete Angular UI Component Library,primefaces,primeng,https://github.com/primefaces/primeng
2024-07-27,css,36809,11,FCC China open source codebase and curriculum. Learn to code and help nonprofits.,FreeCodeCampChina,freecodecamp.cn,https://github.com/FreeCodeCampChina/freecodecamp.cn
2024-07-27,css,7442,2,A sample Spring-based application,spring-projects,spring-petclinic,https://github.com/spring-projects/spring-petclinic
2024-07-27,css,140,0,A sphinx-based centralized documentation repo for MoveIt 2,moveit,moveit2_tutorials,https://github.com/moveit/moveit2_tutorials
2024-07-27,css,5419,3,"A simple, efficient and powerful micro front-end framework. ä¸€æ¬¾ç®€çº¦ã€é«˜æ•ˆã€åŠŸèƒ½å¼ºå¤§çš„å¾®å‰ç«¯æ¡†æ¶",micro-zoe,micro-app,https://github.com/micro-zoe/micro-app
2024-07-27,css,6303,7,The Most Complete React UI Component Library,primefaces,primereact,https://github.com/primefaces/primereact
2024-07-27,css,9431,7,"Set of icons representing programming languages, designing & development tools",devicons,devicon,https://github.com/devicons/devicon
2024-07-27,css,5267,3,A collection of advanced CSS styles to create realistic-looking effects for the faces of Pokemon cards.,simeydotme,pokemon-cards-css,https://github.com/simeydotme/pokemon-cards-css
2024-07-27,css,1307,2,a simple template to write your CV in a readable markdown file and use CSS to publish/print it.,elipapa,markdown-cv,https://github.com/elipapa/markdown-cv