date,language,stargazers,starsToday,description,owner,name,url
2024-12-18,astro,3651,6,⭕️ AstroWind: A free template using Astro 5 and Tailwind CSS. Astro starter theme.,onwidget,astrowind,https://github.com/onwidget/astrowind
2024-12-18,astro,44163,3,AdminLTE - Free admin dashboard template based on Bootstrap 5,ColorlibHQ,AdminLTE,https://github.com/ColorlibHQ/AdminLTE
2024-12-18,astro,613,0,"Astroplate is a free starter template built with Astro, TailwindCSS & TypeScript providing everything you need to jumpstart your Astro project. Get started with Astroplate and save yourself hours of work!",zeon-studio,astroplate,https://github.com/zeon-studio/astroplate
2024-12-18,astro,997,2,"Astrofy is a free and open-source template for your Personal Portfolio Website built with Astro and TailwindCSS. Create in minutes a website with Blog, CV, Project Section, Store and RSS Feed.",manuelernestog,astrofy,https://github.com/manuelernestog/astrofy
2024-12-18,astro,171,0,"Stone is a free and open-source Astro theme specially designed for Business, Marketing, SaaS and Startup websites.",m6v3l9,astro-theme-stone,https://github.com/m6v3l9/astro-theme-stone
2024-12-18,astro,626,1,"Open-source admin dashboard template built with Astro, Flowbite, and Tailwind CSS",themesberg,flowbite-astro-admin-dashboard,https://github.com/themesberg/flowbite-astro-admin-dashboard