date,language,stargazers,starsToday,description,owner,name,url
2024-12-15,php,3398,0,📅 Easy!Appointments - Self Hosted Appointment Scheduler,alextselegidis,easyappointments,https://github.com/alextselegidis/easyappointments
2024-12-15,php,15792,6,Free and open source laravel eCommerce platform,bagisto,bagisto,https://github.com/bagisto/bagisto
2024-12-15,php,11594,1,"Prior to making any Submission(s), you must sign an Adobe Contributor License Agreement, available here at: https://opensource.adobe.com/cla.html. All Submissions you make to Adobe Inc. and its affiliates, assigns and subsidiaries (collectively “Adobe”) are subject to the terms of the Adobe Contributor License Agreement.",magento,magento2,https://github.com/magento/magento2
2024-12-15,php,5020,3,⚡️ OpenAI PHP is a supercharged community-maintained PHP API client that allows you to interact with OpenAI API.,openai-php,client,https://github.com/openai-php/client
2024-12-15,php,4975,0,Main repository for pfSense,pfsense,pfsense,https://github.com/pfsense/pfsense
2024-12-15,php,19864,23,"A collection of beautiful full-stack components for Laravel. The perfect starting point for your next app. Using Livewire, Alpine.js and Tailwind CSS.",filamentphp,filament,https://github.com/filamentphp/filament
2024-12-15,php,19991,2,Empowering People Ethically with the leading open source alternative to Google Analytics that gives you full control over your data. Matomo lets you easily collect data from websites & apps and visualise this data and extract insights. Privacy is built-in. Liberating Web Analytics. Star us on Github? +1. And we love Pull Requests!,matomo-org,matomo,https://github.com/matomo-org/matomo
2024-12-15,php,8826,6,Instant Upgrades and Automated Refactoring of any PHP 5.3+ code,rectorphp,rector,https://github.com/rectorphp/rector
2024-12-15,php,2622,4,"WordPress Develop, Git-ified. Synced from git://develop.git.wordpress.org/, including branches and tags! This repository is just a mirror of the WordPress subversion repository. Please include a link to a pre-existing ticket on https://core.trac.wordpress.org/ with every pull request.",WordPress,wordpress-develop,https://github.com/WordPress/wordpress-develop
2024-12-15,php,1620,3,TallStack UI components,wireui,wireui,https://github.com/wireui/wireui
2024-12-15,php,27690,15,"☁️ Nextcloud server, a safe home for all your data",nextcloud,server,https://github.com/nextcloud/server
2024-12-15,php,1547,0,Simple patches plugin for Composer,cweagans,composer-patches,https://github.com/cweagans/composer-patches
2024-12-15,php,4960,1,"🔥 Stay motivated and show off your contribution streak! 🌟 Display your total contributions, current streak, and longest streak on your GitHub profile README",DenverCoder1,github-readme-streak-stats,https://github.com/DenverCoder1/github-readme-streak-stats
2024-12-15,php,3440,1,"Core Framework for the Open Source Data & Experience Management Platform (PIM, MDM, CDP, DAM, DXP/CMS & Digital Commerce)",pimcore,pimcore,https://github.com/pimcore/pimcore
2024-12-15,php,32769,3,The Laravel Framework.,laravel,framework,https://github.com/laravel/framework
2024-12-15,php,5548,6,"Dolibarr ERP CRM is a modern software package to manage your company or foundation's activity (contacts, suppliers, invoices, orders, stocks, agenda, accounting, ...). it's an open source Web application (written in PHP) designed for businesses of any sizes, foundations and freelancers.",Dolibarr,dolibarr,https://github.com/Dolibarr/dolibarr
2024-12-15,php,6023,8,"⚡ Dynamically generated, customizable SVG that gives the appearance of typing and deleting text for use on your profile page, repositories, or website.",DenverCoder1,readme-typing-svg,https://github.com/DenverCoder1/readme-typing-svg
2024-12-15,php,4367,2,"GLPI is a Free Asset and IT Management Software package, Data center management, ITIL Service Desk, licenses tracking and software auditing.",glpi-project,glpi,https://github.com/glpi-project/glpi
2024-12-15,php,2342,0,"Drush is a command-line shell and scripting interface for Drupal, a veritable Swiss Army knife designed to make life easier for those who spend their working hours hacking away at the command prompt.",drush-ops,drush,https://github.com/drush-ops/drush
2024-12-15,php,506,0,Datadog PHP Clients,DataDog,dd-trace-php,https://github.com/DataDog/dd-trace-php
2024-12-15,php,14291,2,IDE Helper for Laravel,barryvdh,laravel-ide-helper,https://github.com/barryvdh/laravel-ide-helper