date,language,stargazers,starsToday,description,owner,name,url
2023-12-29,php,11981,17,Firefly III: a personal finances manager,firefly-iii,firefly-iii,https://github.com/firefly-iii/firefly-iii
2023-12-29,php,1751,3,Track any ip address with IP-Tracer. IP-Tracer is developed for Linux and Termux. you can retrieve any ip address information using IP-Tracer.,rajkumardusad,IP-Tracer,https://github.com/rajkumardusad/IP-Tracer
2023-12-29,php,6484,4,The RSS feed for websites missing it,RSS-Bridge,rss-bridge,https://github.com/RSS-Bridge/rss-bridge
2023-12-29,php,6968,0,A pure PHP library for reading and writing word processing documents,PHPOffice,PHPWord,https://github.com/PHPOffice/PHPWord
2023-12-29,php,7459,13,"A free, self-hostable news aggregator…",FreshRSS,FreshRSS,https://github.com/FreshRSS/FreshRSS
2023-12-29,php,19429,3,The PHP Unit Testing framework.,sebastianbergmann,phpunit,https://github.com/sebastianbergmann/phpunit
2023-12-29,php,50902,53,"SecLists is the security tester's companion. It's a collection of multiple types of lists used during security assessments, collected in one place. List types include usernames, passwords, URLs, sensitive data patterns, fuzzing payloads, web shells, and many more.",danielmiessler,SecLists,https://github.com/danielmiessler/SecLists
2023-12-29,php,9232,5,wallabag is a self hostable application for saving web pages: Save and classify articles. Read them later. Freely.,wallabag,wallabag,https://github.com/wallabag/wallabag
2023-12-29,php,4566,2,"ZoneMinder is a free, open source Closed-circuit television software application developed for Linux which supports IP, USB and Analog cameras.",ZoneMinder,zoneminder,https://github.com/ZoneMinder/zoneminder
2023-12-29,php,22835,0,"Guzzle, an extensible PHP HTTP client",guzzle,guzzle,https://github.com/guzzle/guzzle
2023-12-29,php,75560,14,"Laravel is a web application framework with expressive, elegant syntax. We’ve already laid the foundation for your next big idea — freeing you to create without sweating the small things.",laravel,laravel,https://github.com/laravel/laravel
2023-12-29,php,4804,1,MISP (core software) - Open Source Threat Intelligence and Sharing Platform,MISP,MISP,https://github.com/MISP/MISP
2023-12-29,php,11018,3,"Prior to making any Submission(s), you must sign an Adobe Contributor License Agreement, available here at: https://opensource.adobe.com/cla.html. All Submissions you make to Adobe Inc. and its affiliates, assigns and subsidiaries (collectively “Adobe”) are subject to the terms of the Adobe Contributor License Agreement.",magento,magento2,https://github.com/magento/magento2
2023-12-29,php,4706,5,HTPC/Homelab Services Organizer - Written in PHP,causefx,Organizr,https://github.com/causefx/Organizr
2023-12-29,php,20173,7,The classic email sending library for PHP,PHPMailer,PHPMailer,https://github.com/PHPMailer/PHPMailer
2023-12-29,php,5898,5,"🌍 Discover our global repository of countries, states, and cities! 🏙️ Get comprehensive data in JSON, SQL, XML, YAML, and CSV formats. Access ISO2, ISO3 codes, country code, capital, native language, timezones (for countries), and more. #countries #states #cities",dr5hn,countries-states-cities-database,https://github.com/dr5hn/countries-states-cities-database
2023-12-29,php,2853,95,方糖全栈路线图2023，为「从螺丝钉到一人企业」补全技能栈,easychen,stack-roadmap,https://github.com/easychen/stack-roadmap
2023-12-29,php,512,5,Source code for the demo.filamentphp.com website.,filamentphp,demo,https://github.com/filamentphp/demo
2023-12-29,php,9064,8,Free and open source laravel eCommerce platform,bagisto,bagisto,https://github.com/bagisto/bagisto
2023-12-29,php,8940,4,A free open source IT asset/license management system,snipe,snipe-it,https://github.com/snipe/snipe-it
2023-12-29,php,8977,0,A PHP client library for accessing Google APIs,googleapis,google-api-php-client,https://github.com/googleapis/google-api-php-client
2023-12-29,php,4999,2,⚗️ Adds code analysis to Laravel improving developer productivity and code quality.,larastan,larastan,https://github.com/larastan/larastan
2023-12-29,php,6269,4,A DOMPDF Wrapper for Laravel,barryvdh,laravel-dompdf,https://github.com/barryvdh/laravel-dompdf
2023-12-29,php,13531,2,PHP Image Processing,Intervention,image,https://github.com/Intervention/image
2023-12-29,php,30708,10,The Laravel Framework.,laravel,framework,https://github.com/laravel/framework