date,language,stargazers,starsToday,description,owner,name,url
2022-08-06,kotlin,3090,3,An open-source keyboard for Android which respects your privacy. Currently in early-beta.,florisboard,florisboard,https://github.com/florisboard/florisboard
2022-08-06,kotlin,10130,3,Framework for quickly creating connected applications in Kotlin with minimal effort,ktorio,ktor,https://github.com/ktorio/ktor
2022-08-06,kotlin,42623,11,"Square’s meticulous HTTP client for the JVM, Android, and GraalVM.",square,okhttp,https://github.com/square/okhttp
2022-08-06,kotlin,11032,3,Library support for Kotlin coroutines,Kotlin,kotlinx.coroutines,https://github.com/Kotlin/kotlinx.coroutines
2022-08-06,kotlin,402,3,Material Design Samples。ConstraintLayout、MaterialButton、ShapeableImageView、TabLayout、SearchView...,yechaoa,MaterialDesign,https://github.com/yechaoa/MaterialDesign
2022-08-06,kotlin,9974,12,高效率 QQ 机器人支持库,mamoe,mirai,https://github.com/mamoe/mirai
2022-08-06,kotlin,4725,8,Static code analysis for Kotlin,detekt,detekt,https://github.com/detekt/detekt
2022-08-06,kotlin,57,6,"Is an All in One app for Muslims with lots of features such as Prayer Times & Adhan, Collections of Dhikr and Prayer sourced from Authentic Hadith, The Holy Qur'an, Qibla, Notes and many more!",dzikirqu,dzikirqu-android,https://github.com/dzikirqu/dzikirqu-android
2022-08-06,kotlin,2577,7,阅读3服务器版，桌面端，iOS可用。后端 Kotlin + Spring Boot + Vert.x + Coroutine ；前端 Vue.js + Element。麻烦点点star，关注一下公众号【假装大佬】,hectorqin,reader,https://github.com/hectorqin/reader
2022-08-06,kotlin,9156,7,"Compose Multiplatform, a modern UI framework for Kotlin that makes building performant and beautiful user interfaces easy and enjoyable.",JetBrains,compose-jb,https://github.com/JetBrains/compose-jb
2022-08-06,kotlin,4007,0,Kotlin multiplatform / multi-format serialization,Kotlin,kotlinx.serialization,https://github.com/Kotlin/kotlinx.serialization
2022-08-06,kotlin,641,0,,googlecodelabs,android-compose-codelabs,https://github.com/googlecodelabs/android-compose-codelabs
2022-08-06,kotlin,891,2,A suite of tools to assist with reviewing Open Source Software dependencies.,oss-review-toolkit,ort,https://github.com/oss-review-toolkit/ort
2022-08-06,kotlin,4710,0,SQLDelight - Generates typesafe Kotlin APIs from SQL,cashapp,sqldelight,https://github.com/cashapp/sqldelight
2022-08-06,kotlin,4055,4,Rust plugin for the IntelliJ Platform,intellij-rust,intellij-rust,https://github.com/intellij-rust/intellij-rust
2022-08-06,kotlin,6405,6,Kotlin SQL Framework,JetBrains,Exposed,https://github.com/JetBrains/Exposed
2022-08-06,kotlin,5680,2,Used to integrate Android apps with Facebook Platform.,facebook,facebook-android-sdk,https://github.com/facebook/facebook-android-sdk
2022-08-06,kotlin,195,6,A Basic Call Recorder for rooted Android devices,chenxiaolong,BCR,https://github.com/chenxiaolong/BCR
2022-08-06,kotlin,19346,3,"A beautiful, fluid, and extensible dialogs API for Kotlin & Android.",afollestad,material-dialogs,https://github.com/afollestad/material-dialogs
2022-08-06,kotlin,1971,0,Source extensions for the Tachiyomi app.,tachiyomiorg,tachiyomi-extensions,https://github.com/tachiyomiorg/tachiyomi-extensions
2022-08-06,kotlin,374,3,Android Mobile app to rule all Flipper's family,flipperdevices,Flipper-Android-App,https://github.com/flipperdevices/Flipper-Android-App
2022-08-06,kotlin,528,0,Mapbox Navigation SDK for Android,mapbox,mapbox-navigation-android,https://github.com/mapbox/mapbox-navigation-android
2022-08-06,kotlin,3760,3,Multiple samples showing the best practices in camera APIs on Android.,android,camera-samples,https://github.com/android/camera-samples
2022-08-06,kotlin,4580,0,mocking library for Kotlin,mockk,mockk,https://github.com/mockk/mockk
2022-08-06,kotlin,41260,7,A collection of samples to discuss and showcase different architectural tools and patterns for Android apps.,android,architecture-samples,https://github.com/android/architecture-samples