date,language,stargazers,starsToday,description,owner,name,url
2024-12-21,kotlin,17517,12,A fully functional Android app built entirely with Kotlin and Jetpack Compose,android,nowinandroid,https://github.com/android/nowinandroid
2024-12-21,kotlin,45996,2,"Square’s meticulous HTTP client for the JVM, Android, and GraalVM.",square,okhttp,https://github.com/square/okhttp
2024-12-21,kotlin,2405,10,📱 Home Assistant Companion for Android,home-assistant,android,https://github.com/home-assistant/android
2024-12-21,kotlin,5019,18,A Material 3 YouTube Music client for Android,z-huang,InnerTune,https://github.com/z-huang/InnerTune
2024-12-21,kotlin,486,19,A Material 3 Music Player with YouTube Music support for Android. Forked from InnerTune,DD3Boh,OuterTune,https://github.com/DD3Boh/OuterTune
2024-12-21,kotlin,16484,10,"Compose Multiplatform, a modern UI framework for Kotlin that makes building performant and beautiful user interfaces easy and enjoyable.",JetBrains,compose-multiplatform,https://github.com/JetBrains/compose-multiplatform
2024-12-21,kotlin,7537,7,"SimpleX - the first messaging network operating without user identifiers of any kind - 100% private by design! iOS, Android and desktop apps 📱!",simplex-chat,simplex-chat,https://github.com/simplex-chat/simplex-chat
2024-12-21,kotlin,4371,6,Manga reader for Android,KotatsuApp,Kotatsu,https://github.com/KotatsuApp/Kotatsu
2024-12-21,kotlin,1947,5,An Android native video player,anilbeesetti,nextplayer,https://github.com/anilbeesetti/nextplayer
2024-12-21,kotlin,831,6,Read-only mirror of Grayjay repo for issue tracking,futo-org,grayjay-android,https://github.com/futo-org/grayjay-android
2024-12-21,kotlin,49628,9,The Kotlin Programming Language.,JetBrains,kotlin,https://github.com/JetBrains/kotlin
2024-12-21,kotlin,4837,4,A highly customizable calendar view and compose library for Android and Kotlin Multiplatform.,kizitonwose,Calendar,https://github.com/kizitonwose/Calendar
2024-12-21,kotlin,1197,1,A sane music player built with media3 and material design library that is following android's standard strictly.,AkaneTan,Gramophone,https://github.com/AkaneTan/Gramophone
2024-12-21,kotlin,7659,1,A simple and modern Java and Kotlin web framework,javalin,javalin,https://github.com/javalin/javalin
2024-12-21,kotlin,13139,4,Library support for Kotlin coroutines,Kotlin,kotlinx.coroutines,https://github.com/Kotlin/kotlinx.coroutines
2024-12-21,kotlin,9377,2,IdeaVim – A Vim engine for JetBrains IDEs,JetBrains,ideavim,https://github.com/JetBrains/ideavim
2024-12-21,kotlin,8437,1,Kotlin SQL Framework,JetBrains,Exposed,https://github.com/JetBrains/Exposed
2024-12-21,kotlin,3802,2,"Gradle plugin to create fat/uber JARs, apply file transforms, and relocate packages for applications and libraries. Gradle version of Maven's Shade plugin.",GradleUp,shadow,https://github.com/GradleUp/shadow
2024-12-21,kotlin,38837,12,翻墙-科学上网,bannedbook,fanqiang,https://github.com/bannedbook/fanqiang