date,language,stargazers,starsToday,description,owner,name,url
2023-07-09,markdown,44728,17,Collaborative cheatsheets for console commands,tldr-pages,tldr,https://github.com/tldr-pages/tldr
2023-07-09,markdown,24352,10,Linux命令大全搜索工具，内容包含Linux命令手册、详解、学习、搜集。https://git.io/linux,jaywcjlove,linux-command,https://github.com/jaywcjlove/linux-command
2023-07-09,markdown,9174,0,Open source documentation of Microsoft Azure,MicrosoftDocs,azure-docs,https://github.com/MicrosoftDocs/azure-docs
2023-07-09,markdown,1393,2,This repository provides SAP style guides for coding and coding-related topics.,SAP,styleguides,https://github.com/SAP/styleguides
2023-07-09,markdown,3070,0,Kotlin Evolution and Enhancement Process,Kotlin,KEEP,https://github.com/Kotlin/KEEP
2023-07-09,markdown,4274,0,"An awesome list of awesome YouTubers that teach about technology. Tutorials about web development, computer science, machine learning, game development, cybersecurity, and more.",JoseDeFreitas,awesome-youtubers,https://github.com/JoseDeFreitas/awesome-youtubers
2023-07-09,markdown,116,0,Solutions (that we managed to find) for the 2021 PicoCTF,vivian-dai,PicoCTF2021-Writeup,https://github.com/vivian-dai/PicoCTF2021-Writeup
2023-07-09,markdown,5489,3,Official Discord API Documentation,discord,discord-api-docs,https://github.com/discord/discord-api-docs
2023-07-09,markdown,2126,1,A Collection of GitHub Profiles with awesome readme,coderjojo,creative-profile-readme,https://github.com/coderjojo/creative-profile-readme
2023-07-09,markdown,7992,4,The content behind MDN Web Docs,mdn,content,https://github.com/mdn/content
2023-07-09,markdown,651,4,A Complete List of GitHub Profile Badges and Achievements,drknzz,GitHub-Achievements,https://github.com/drknzz/GitHub-Achievements
2023-07-09,markdown,3842,7,A collection listing all Achievements available on the GitHub profile,Schweinepriester,github-profile-achievements,https://github.com/Schweinepriester/github-profile-achievements
2023-07-09,markdown,2386,3,A curation of awesome portfolio website ideas for developers and designers to draw inspiration from. Raise a pull request to add more.,Evavic44,portfolio-ideas,https://github.com/Evavic44/portfolio-ideas
2023-07-09,markdown,14440,0,This maintains proposals for changes and user-visible enhancements to the Swift Programming Language.,apple,swift-evolution,https://github.com/apple/swift-evolution
2023-07-09,markdown,1347,1,The source repository of all translated content for MDN Web Docs,mdn,translated-content,https://github.com/mdn/translated-content