date,language,stargazers,starsToday,description,owner,name,url
2024-01-02,haskell,2882,3,Koka language compiler and interpreter,koka-lang,koka,https://github.com/koka-lang/koka
2024-01-02,haskell,34071,2,"ShellCheck, a static analysis tool for shell scripts",koalaman,shellcheck,https://github.com/koalaman/shellcheck
2024-01-02,haskell,4724,11,"SimpleX - the first messaging platform operating without user identifiers of any kind - 100% private by design! iOS, Android and desktop apps 📱!",simplex-chat,simplex-chat,https://github.com/simplex-chat/simplex-chat
2024-01-02,haskell,838,0,"High performance, concurrent functional programming abstractions",composewell,streamly,https://github.com/composewell/streamly
2024-01-02,haskell,2482,0,Official haskell ide support via language server (LSP). Successor of ghcide & haskell-ide-engine.,haskell,haskell-language-server,https://github.com/haskell/haskell-language-server
2024-01-02,haskell,1159,0,"📜 Haskell course info, plan, video lectures, slides",haskell-beginners-2022,course-plan,https://github.com/haskell-beginners-2022/course-plan
2024-01-02,haskell,3184,2,"The core of xmonad, a small but functional ICCCM-compliant tiling window manager",xmonad,xmonad,https://github.com/xmonad/xmonad
2024-01-02,haskell,113,0,"Toolkit for converting and building songs for Rock Band, Guitar Hero, Clone Hero, and other similar rhythm games",mtolly,onyx,https://github.com/mtolly/onyx
2024-01-02,haskell,21610,5,REST API for any Postgres database,PostgREST,postgrest,https://github.com/PostgREST/postgrest
2024-01-02,haskell,1536,0,Official upstream development repository for Cabal and cabal-install,haskell,cabal,https://github.com/haskell/cabal
2024-01-02,haskell,2979,0,The core component that is used to participate in a Cardano decentralised blockchain.,IntersectMBO,cardano-node,https://github.com/IntersectMBO/cardano-node
2024-01-02,haskell,366,0,⚙️ SimpleXMQ - A reference implementation of the SimpleX Messaging Protocol for simplex queues over public networks.,simplex-chat,simplexmq,https://github.com/simplex-chat/simplexmq
2024-01-02,haskell,1363,0,Easy dependency management for Nix projects,nmattia,niv,https://github.com/nmattia/niv
2024-01-02,haskell,1974,0,A shell script which checks your $HOME for unwanted files and directories.,b3nj5m1n,xdg-ninja,https://github.com/b3nj5m1n/xdg-ninja
2024-01-02,haskell,6,0,Accelerates K Framework's Haskell backend,runtimeverification,hs-backend-booster,https://github.com/runtimeverification/hs-backend-booster
2024-01-02,haskell,200,0,The symbolic execution engine powering the K Framework,runtimeverification,haskell-backend,https://github.com/runtimeverification/haskell-backend
2024-01-02,haskell,3213,3,An advanced keyboard manager,kmonad,kmonad,https://github.com/kmonad/kmonad
2024-01-02,haskell,613,1,Trying to understand the file format of Tip Toi,entropia,tip-toi-reveng,https://github.com/entropia/tip-toi-reveng
2024-01-02,haskell,2271,1,Agda is a dependently typed programming language / interactive theorem prover.,agda,agda,https://github.com/agda/agda
2024-01-02,haskell,730,0,HTTP server & command-line for managing UTxOs and HD wallets in Cardano.,cardano-foundation,cardano-wallet,https://github.com/cardano-foundation/cardano-wallet
2024-01-02,haskell,226,0,The ledger implementation and specifications of the Cardano blockchain.,IntersectMBO,cardano-ledger,https://github.com/IntersectMBO/cardano-ledger