date,language,stargazers,starsToday,description,owner,name,url
2022-07-08,php,6906,4,Open Source eCommerce Platform on Symfony,Sylius,Sylius,https://github.com/Sylius/Sylius
2022-07-08,php,8151,3,A PHP client library for accessing Google APIs,googleapis,google-api-php-client,https://github.com/googleapis/google-api-php-client
2022-07-08,php,6295,5,A free open source IT asset/license management system,snipe,snipe-it,https://github.com/snipe/snipe-it
2022-07-08,php,8942,2,HTML to PDF converter for PHP,dompdf,dompdf,https://github.com/dompdf/dompdf
2022-07-08,php,4900,3,Official PHP client for Elasticsearch.,elastic,elasticsearch-php,https://github.com/elastic/elasticsearch-php
2022-07-08,php,2049,0,The most popular FOSS online survey tool on the web.,LimeSurvey,LimeSurvey,https://github.com/LimeSurvey/LimeSurvey
2022-07-08,php,11201,3,A tool to automatically fix PHP Coding Standards issues,FriendsOfPHP,PHP-CS-Fixer,https://github.com/FriendsOfPHP/PHP-CS-Fixer
2022-07-08,php,1948,3,Statamic 3: The Core Composer Package,statamic,cms,https://github.com/statamic/cms
2022-07-08,php,925,1,"Advanced datatables using Laravel, Livewire, Tailwind CSS and Alpine JS",MedicOneSystems,livewire-datatables,https://github.com/MedicOneSystems/livewire-datatables
2022-07-08,php,19526,6,"Nextcloud server, a safe home for all your data",nextcloud,server,https://github.com/nextcloud/server
2022-07-08,php,2123,1,"Laravel Cashier provides an expressive, fluent interface to Stripe's subscription billing services.",laravel,cashier-stripe,https://github.com/laravel/cashier-stripe
2022-07-08,php,6108,1,A MongoDB based Eloquent model and Query builder for Laravel (Moloquent),jenssegers,laravel-mongodb,https://github.com/jenssegers/laravel-mongodb
2022-07-08,php,19783,2,"Sends your logs to files, sockets, inboxes, databases and various web services",Seldaek,monolog,https://github.com/Seldaek/monolog
2022-07-08,php,1903,2,Shopware 6 is an open commerce platform based on Symfony Framework and Vue and supported by a worldwide community and more than 1.500 community extensions,shopware,platform,https://github.com/shopware/platform
2022-07-08,php,1237,1,Our team created for you one of the most innovative CRM systems that supports mainly business processes and allows for customization according to your needs. Be ahead of your competition and implement YetiForce!,YetiForceCompany,YetiForceCRM,https://github.com/YetiForceCompany/YetiForceCRM
2022-07-08,php,8037,3,"A customizable, open-source eCommerce platform built on WordPress. Build any commerce solution you can imagine.",woocommerce,woocommerce,https://github.com/woocommerce/woocommerce
2022-07-08,php,2248,2,"Drush is a command-line shell and scripting interface for Drupal, a veritable Swiss Army knife designed to make life easier for those who spend their working hours hacking away at the command prompt.",drush-ops,drush,https://github.com/drush-ops/drush
2022-07-08,php,5332,4,A DOMPDF Wrapper for Laravel,barryvdh,laravel-dompdf,https://github.com/barryvdh/laravel-dompdf
2022-07-08,php,21946,5,"Guzzle, an extensible PHP HTTP client",guzzle,guzzle,https://github.com/guzzle/guzzle
2022-07-08,php,2668,5,"GLPI is a Free Asset and IT Management Software package, Data center management, ITIL Service Desk, licenses tracking and software auditing.",glpi-project,glpi,https://github.com/glpi-project/glpi
2022-07-08,php,1236,0,Simple patches plugin for Composer,cweagans,composer-patches,https://github.com/cweagans/composer-patches
2022-07-08,php,2277,6,DooTask是一款轻量级的开源在线项目任务管理工具，提供各类文档协作工具、在线思维导图、在线流程图、项目管理、任务分发、即时IM，文件管理等工具。,kuaifan,dootask,https://github.com/kuaifan/dootask
2022-07-08,php,15511,3,A PHP parser written in PHP,nikic,PHP-Parser,https://github.com/nikic/PHP-Parser
2022-07-08,php,16377,6,"WordPress, Git-ified. This repository is just a mirror of the WordPress subversion repository. Please do not send pull requests. Submit pull requests to https://github.com/WordPress/wordpress-develop and patches to https://core.trac.wordpress.org/ instead.",WordPress,WordPress,https://github.com/WordPress/WordPress
2022-07-08,php,6269,4,Damn Vulnerable Web Application (DVWA),digininja,DVWA,https://github.com/digininja/DVWA