date,language,stargazers,starsToday,description,owner,name,url
2024-08-05,r,4466,0,R for data science: a book,hadley,r4ds,https://github.com/hadley/r4ds
2024-08-05,r,65,0,Tidyverse developer day,tidyverse,tidy-dev-day,https://github.com/tidyverse/tidy-dev-day
2024-08-05,r,4268,0,🎓 A collection of interactive courses for the swirl R package.,swirldev,swirl_courses,https://github.com/swirldev/swirl_courses
2024-08-05,r,403,0,R package for performing 2-sample MR using MR-Base database,MRCIEU,TwoSampleMR,https://github.com/MRCIEU/TwoSampleMR
2024-08-05,r,831,0,R Interface to Keras,rstudio,keras3,https://github.com/rstudio/keras3