date,language,stargazers,starsToday,description,owner,name,url
2024-06-17,astro,43709,3,AdminLTE - Free admin dashboard template based on Bootstrap 5,ColorlibHQ,AdminLTE,https://github.com/ColorlibHQ/AdminLTE
2024-06-17,astro,2060,3,"A minimal, accessible and SEO-friendly Astro blog theme",satnaing,astro-paper,https://github.com/satnaing/astro-paper
2024-06-17,astro,6186,4,🦄 A curated list of privacy & security-focused software and services,Lissy93,awesome-privacy,https://github.com/Lissy93/awesome-privacy
2024-06-17,astro,639,3,A static blog template built with Astro.,saicaca,fuwari,https://github.com/saicaca/fuwari
2024-06-17,astro,2826,5,"An opinionated, actionable guide for software engineering interviews.",nas5w,interview-guide,https://github.com/nas5w/interview-guide
2024-06-17,astro,2689,4,⭕️ AstroWind: A free template using Astro 4.0 and Tailwind CSS. Astro starter theme.,onwidget,astrowind,https://github.com/onwidget/astrowind
2024-06-17,astro,170,0,"Dante, a single-author blog and portfolio theme for Astro.js.",JustGoodUI,dante-astro-theme,https://github.com/JustGoodUI/dante-astro-theme
2024-06-17,astro,184,1,"Template with astro, tailwind and alpinejs",zankhq,astros,https://github.com/zankhq/astros
2024-06-17,astro,454,0,"Astroplate is a free starter template built with Astro, TailwindCSS & TypeScript providing everything you need to jumpstart your Astro project. Get started with Astroplate and save yourself hours of work!",zeon-studio,astroplate,https://github.com/zeon-studio/astroplate
2024-06-17,astro,867,1,Ejemplo de porfolio para programadores y desarrolladores,midudev,porfolio.dev,https://github.com/midudev/porfolio.dev
2024-06-17,astro,787,0,"Astrofy is a free and open-source template for your Personal Portfolio Website built with Astro and TailwindCSS. Create in minutes a website with Blog, CV, Project Section, Store and RSS Feed.",manuelernestog,astrofy,https://github.com/manuelernestog/astrofy
2024-06-17,astro,1255,3,Web oficial de La Velada IV de Ibai Llanos,midudev,la-velada-web-oficial,https://github.com/midudev/la-velada-web-oficial