date,language,stargazers,starsToday,description,owner,name,url
2022-05-15,php,8068,0,A PHP client library for accessing Google APIs,googleapis,google-api-php-client,https://github.com/googleapis/google-api-php-client
2022-05-15,php,3344,7,"A collection of tools for rapidly building beautiful TALL stack interfaces, designed for humans.",laravel-filament,filament,https://github.com/laravel-filament/filament
2022-05-15,php,18396,1,The PHP Unit Testing framework.,sebastianbergmann,phpunit,https://github.com/sebastianbergmann/phpunit
2022-05-15,php,26855,5,The Symfony PHP framework,symfony,symfony,https://github.com/symfony/symfony
2022-05-15,php,3219,2,"Dolibarr ERP CRM is a modern software package to manage your company or foundation's activity (contacts, suppliers, invoices, orders, stocks, agenda, accounting, ...). It is open source software (written in PHP) and designed for small and medium businesses, foundations and freelancers. You can freely install, use and distribute it as a standalon…",Dolibarr,dolibarr,https://github.com/Dolibarr/dolibarr
2022-05-15,php,19648,1,"Sends your logs to files, sockets, inboxes, databases and various web services",Seldaek,monolog,https://github.com/Seldaek/monolog
2022-05-15,php,21823,0,"Guzzle, an extensible PHP HTTP client",guzzle,guzzle,https://github.com/guzzle/guzzle
2022-05-15,php,8797,3,HTML to PDF converter for PHP,dompdf,dompdf,https://github.com/dompdf/dompdf
2022-05-15,php,7807,1,"A customizable, open-source eCommerce platform built on WordPress. Build any commerce solution you can imagine.",woocommerce,woocommerce,https://github.com/woocommerce/woocommerce
2022-05-15,php,26972,11,The Laravel Framework.,laravel,framework,https://github.com/laravel/framework
2022-05-15,php,9354,0,PHP_CodeSniffer tokenizes PHP files and detects violations of a defined set of coding standards.,squizlabs,PHP_CodeSniffer,https://github.com/squizlabs/PHP_CodeSniffer
2022-05-15,php,11110,3,A pure PHP library for reading and writing spreadsheet files,PHPOffice,PhpSpreadsheet,https://github.com/PHPOffice/PhpSpreadsheet
2022-05-15,php,19159,13,"Nextcloud server, a safe home for all your data",nextcloud,server,https://github.com/nextcloud/server
2022-05-15,php,4425,0,"The most advanced frontend drag & drop page builder. Create high-end, pixel perfect websites at record speeds. Any theme, any page, any design.",elementor,elementor,https://github.com/elementor/elementor
2022-05-15,php,16319,5,Liberating Web Analytics. Star us on Github? +1. Matomo is the leading open alternative to Google Analytics that gives you full control over your data. Matomo lets you easily collect data from websites & apps and visualise this data and extract insights. Privacy is built-in. We love Pull Requests!,matomo-org,matomo,https://github.com/matomo-org/matomo
2022-05-15,php,4160,0,Moodle - the world's open source learning platform,moodle,moodle,https://github.com/moodle/moodle
2022-05-15,php,10472,3,Build a full-featured administrative interface in ten minutes,z-song,laravel-admin,https://github.com/z-song/laravel-admin
2022-05-15,php,16213,7,"WordPress, Git-ified. This repository is just a mirror of the WordPress subversion repository. Please do not send pull requests. Submit pull requests to https://github.com/WordPress/wordpress-develop and patches to https://core.trac.wordpress.org/ instead.",WordPress,WordPress,https://github.com/WordPress/WordPress
2022-05-15,php,15400,3,A PHP parser written in PHP,nikic,PHP-Parser,https://github.com/nikic/PHP-Parser
2022-05-15,php,8252,1,"Library that provides collection, processing, and rendering functionality for PHP code coverage information.",sebastianbergmann,php-code-coverage,https://github.com/sebastianbergmann/php-code-coverage
2022-05-15,php,175,0,,yankovalenko94,Webdev2019,https://github.com/yankovalenko94/Webdev2019
2022-05-15,php,7469,0,PSR-7 HTTP message library,guzzle,psr7,https://github.com/guzzle/psr7
2022-05-15,php,3313,1,Tailwind scaffolding for the Laravel framework.,laravel,jetstream,https://github.com/laravel/jetstream
2022-05-15,php,7500,2,"Twig, the flexible, fast, and secure template language for PHP",twigphp,Twig,https://github.com/twigphp/Twig
2022-05-15,php,10658,1,PHP Email address validator,egulias,EmailValidator,https://github.com/egulias/EmailValidator