date,language,stargazers,starsToday,description,owner,name,url
2022-03-21,markdown,37707,8,Collaborative cheatsheets for console commands,tldr-pages,tldr,https://github.com/tldr-pages/tldr
2022-03-21,markdown,4246,4,Official Discord API Documentation,discord,discord-api-docs,https://github.com/discord/discord-api-docs
2022-03-21,markdown,4360,7,Improve your README.md profile with these amazing badges.,alexandresanlim,Badges4-README.md-Profile,https://github.com/alexandresanlim/Badges4-README.md-Profile
2022-03-21,markdown,13157,1,This maintains proposals for changes and user-visible enhancements to the Swift Programming Language.,apple,swift-evolution,https://github.com/apple/swift-evolution
2022-03-21,markdown,103945,41,"刷算法全靠套路，认准 labuladong 就够了！English version supported! Crack LeetCode, not only how, but also why.",labuladong,fucking-algorithm,https://github.com/labuladong/fucking-algorithm
2022-03-21,markdown,18175,3,Linux命令大全搜索工具，内容包含Linux命令手册、详解、学习、搜集。https://git.io/linux,jaywcjlove,linux-command,https://github.com/jaywcjlove/linux-command
2022-03-21,markdown,3315,1,MySQL入门教程（MySQL tutorial book）,jaywcjlove,mysql-tutorial,https://github.com/jaywcjlove/mysql-tutorial
2022-03-21,markdown,2767,3,Rust 程序设计语言（2021 edition 施工中）,KaiserY,trpl-zh-cn,https://github.com/KaiserY/trpl-zh-cn
2022-03-21,markdown,49,0,Solutions (that we managed to find) for the 2021 PicoCTF,vivian-dai,PicoCTF2021-Writeup,https://github.com/vivian-dai/PicoCTF2021-Writeup
2022-03-21,markdown,1018,3,This repository provides SAP style guides for coding and coding-related topics.,SAP,styleguides,https://github.com/SAP/styleguides
2022-03-21,markdown,318,1,home of the osu! wiki,ppy,osu-wiki,https://github.com/ppy/osu-wiki
2022-03-21,markdown,1540,0,BOLT: Basis of Lightning Technology (Lightning Network Specifications),lightning,bolts,https://github.com/lightning/bolts