date,language,stargazers,starsToday,description,owner,name,url
2025-01-06,css,273,0,Django 5 By Example (5th Edition) published by Packt,PacktPublishing,Django-5-By-Example,https://github.com/PacktPublishing/Django-5-By-Example
2025-01-06,css,49472,6,Modern CSS framework based on Flexbox,jgthms,bulma,https://github.com/jgthms/bulma
2025-01-06,css,5185,1,A community-driven collection of themes for customizing Spotify through Spicetify - https://github.com/spicetify/cli,spicetify,spicetify-themes,https://github.com/spicetify/spicetify-themes
2025-01-06,css,4686,1,一个 Transmission 浏览器管理界面。Transmission Web Control is a custom web UI.,ronggang,transmission-web-control,https://github.com/ronggang/transmission-web-control
2025-01-06,css,10872,1,🎏 A curated collection of all country flags in SVG — plus the CSS for easier integration,lipis,flag-icons,https://github.com/lipis/flag-icons
2025-01-06,css,7402,4,Accurately Locate Smartphones using Social Engineering,thewhiteh4t,seeker,https://github.com/thewhiteh4t/seeker
2025-01-06,css,55734,16,"Iconic font aggregator, collection, & patcher. 3,600+ icons, 50+ patched fonts: Hack, Source Code Pro, more. Glyph collections: Font Awesome, Material Design Icons, Octicons, & more",ryanoasis,nerd-fonts,https://github.com/ryanoasis/nerd-fonts
2025-01-06,css,726,0,"A dark, rounded discord theme.",refact0r,midnight-discord,https://github.com/refact0r/midnight-discord
2025-01-06,css,43067,7,"The C++ Core Guidelines are a set of tried-and-true guidelines, rules, and best practices about coding in C++",isocpp,CppCoreGuidelines,https://github.com/isocpp/CppCoreGuidelines
2025-01-06,css,2166,0,"A simple, retro theme for Hugo",panr,hugo-theme-terminal,https://github.com/panr/hugo-theme-terminal
2025-01-06,css,37807,6,"50+ mini web projects using HTML, CSS & JS",bradtraversy,50projects50days,https://github.com/bradtraversy/50projects50days
2025-01-06,css,1478,7,"🚀 The easiest, free and open-source Tailwind CSS component library with semantic classes.",themeselection,flyonui,https://github.com/themeselection/flyonui
2025-01-06,css,7859,3,A sample Spring-based application,spring-projects,spring-petclinic,https://github.com/spring-projects/spring-petclinic
2025-01-06,css,8108,2,The minimal amount of CSS to replicate the GitHub Markdown style,sindresorhus,github-markdown-css,https://github.com/sindresorhus/github-markdown-css
2025-01-06,css,748,1,Resource hub for Obsidian resources.,obsidian-community,obsidian-hub,https://github.com/obsidian-community/obsidian-hub