date,language,stargazers,starsToday,description,owner,name,url
2024-04-11,scala,6841,2,"An open-source storage framework that enables building a Lakehouse architecture with compute engines including Spark, PrestoDB, Flink, Trino, and Hive and APIs",delta-io,delta,https://github.com/delta-io/delta
2024-04-11,scala,38231,7,Apache Spark - A unified analytics engine for large-scale data processing,apache,spark,https://github.com/apache/spark
2024-04-11,scala,61224,16,Source code for Twitter's Recommendation Algorithm,twitter,the-algorithm,https://github.com/twitter/the-algorithm
2024-04-11,scala,12918,1,"Build highly concurrent, distributed, and resilient message-driven applications on the JVM",akka,akka,https://github.com/akka/akka
2024-04-11,scala,4283,1,Open-source high-performance RISC-V processor,OpenXiangShan,XiangShan,https://github.com/OpenXiangShan/XiangShan
2024-04-11,scala,3693,1,Chisel: A Modern Hardware Design Language,chipsalliance,chisel,https://github.com/chipsalliance/chisel
2024-04-11,scala,11660,1,CMAK is a tool for managing Apache Kafka clusters,yahoo,CMAK,https://github.com/yahoo/CMAK
2024-04-11,scala,324,118,Chronon is a data platform for serving for AI/ML applications.,airbnb,chronon,https://github.com/airbnb/chronon
2024-04-11,scala,12503,6,The Community Maintained High Velocity Web Framework For Java and Scala.,playframework,playframework,https://github.com/playframework/playframework
2024-04-11,scala,963,0,Gluten is a middle layer responsible for offloading JVM-based SQL engines' execution to native engines.,apache,incubator-gluten,https://github.com/apache/incubator-gluten
2024-04-11,scala,5659,8,"The Scala 3 compiler, also known as Dotty.",scala,scala3,https://github.com/scala/scala3
2024-04-11,scala,1,0,A simplified distributed locking and synchronization manager written with scala and akka. A lightweight alternative to zookeeper.,kalmanb,gridlock,https://github.com/kalmanb/gridlock
2024-04-11,scala,113,0,FEEL parser and interpreter written in Scala,camunda,feel-scala,https://github.com/camunda/feel-scala
2024-04-11,scala,14268,0,Scala 2 compiler and standard library. Bugs at https://github.com/scala/bug; Scala 3 at https://github.com/scala/scala3,scala,scala,https://github.com/scala/scala
2024-04-11,scala,3981,1,"ZIO — A type-safe, composable library for async and concurrent programming in Scala",zio,zio,https://github.com/zio/zio
2024-04-11,scala,14525,4,"♞ lichess.org: the forever free, adless and open source chess server ♞",lichess-org,lila,https://github.com/lichess-org/lila
2024-04-11,scala,39,0,A Scala library for Context-Dependent Environments,chipsalliance,cde,https://github.com/chipsalliance/cde
2024-04-11,scala,1916,2,Apache Kyuubi is a distributed and multi-tenant gateway to provide serverless SQL on data warehouses and lakehouses.,apache,kyuubi,https://github.com/apache/kyuubi
2024-04-11,scala,519,1,A template project for beginning new Chisel work,chipsalliance,chisel-template,https://github.com/chipsalliance/chisel-template
2024-04-11,scala,4748,0,"sbt, the interactive build tool",sbt,sbt,https://github.com/sbt/sbt
2024-04-11,scala,1,0,This repo is for the Linkedin Learning course: Hands-On Introduction: Scala,LinkedInLearning,hands-on-introduction-scala-4413550,https://github.com/LinkedInLearning/hands-on-introduction-scala-4413550
2024-04-11,scala,2989,1,Rocket Chip Generator,chipsalliance,rocket-chip,https://github.com/chipsalliance/rocket-chip
2024-04-11,scala,784,0,The Daml smart contract language,digital-asset,daml,https://github.com/digital-asset/daml
2024-04-11,scala,433,0,A Spark plugin for reading and writing Excel files,crealytics,spark-excel,https://github.com/crealytics/spark-excel
2024-04-11,scala,261,0,Apache Spark Connector for SQL Server and Azure SQL,microsoft,sql-spark-connector,https://github.com/microsoft/sql-spark-connector