date,language,stargazers,starsToday,description,owner,name,url
2022-12-17,php,2079,57,A multiple proxy protocol manage panel application interface,v2board,v2board,https://github.com/v2board/v2board
2022-12-17,php,8445,3,"Library that provides collection, processing, and rendering functionality for PHP code coverage information.",sebastianbergmann,php-code-coverage,https://github.com/sebastianbergmann/php-code-coverage
2022-12-17,php,10387,0,"Prior to making any Submission(s), you must sign an Adobe Contributor License Agreement, available here at: https://opensource.adobe.com/cla.html. All Submissions you make to Adobe Inc. and its affiliates, assigns and subsidiaries (collectively “Adobe”) are subject to the terms of the Adobe Contributor License Agreement.",magento,magento2,https://github.com/magento/magento2
2022-12-17,php,22246,4,"Guzzle, an extensible PHP HTTP client",guzzle,guzzle,https://github.com/guzzle/guzzle
2022-12-17,php,17117,3,Liberating Web Analytics. Star us on Github? +1. Matomo is the leading open alternative to Google Analytics that gives you full control over your data. Matomo lets you easily collect data from websites & apps and visualise this data and extract insights. Privacy is built-in. We love Pull Requests!,matomo-org,matomo,https://github.com/matomo-org/matomo
2022-12-17,php,7399,16,SSPanel V3 魔改再次修改版,Anankke,SSPanel-Uim,https://github.com/Anankke/SSPanel-Uim
2022-12-17,php,3122,0,The Facebook SDK for PHP provides a native interface to the Graph API and Facebook Login. https://developers.facebook.com/docs/php,facebookarchive,php-graph-sdk,https://github.com/facebookarchive/php-graph-sdk
2022-12-17,php,6402,5,Instant Upgrades and Automated Refactoring of any PHP 5.3+ code,rectorphp,rector,https://github.com/rectorphp/rector
2022-12-17,php,7136,2,Open Source eCommerce Framework on Symfony,Sylius,Sylius,https://github.com/Sylius/Sylius
2022-12-17,php,8658,27,This is a webshell open source project,tennc,webshell,https://github.com/tennc/webshell
2022-12-17,php,637,15,"The magic of Inertia.js with the simplicity of Blade  - Splade provides a super easy way to build Single Page Applications (SPA) using standard Laravel Blade templates, and sparkle it to make it interactive. All without ever leaving Blade.",protonemedia,laravel-splade,https://github.com/protonemedia/laravel-splade
2022-12-17,php,3806,1,PHP library generating PDF files from UTF-8 encoded HTML,mpdf,mpdf,https://github.com/mpdf/mpdf
2022-12-17,php,3674,1,"EasyAdmin is a fast, beautiful and modern admin generator for Symfony applications.",EasyCorp,EasyAdminBundle,https://github.com/EasyCorp/EasyAdminBundle
2022-12-17,php,8310,4,"A customizable, open-source ecommerce platform built on WordPress. Build any commerce solution you can imagine.",woocommerce,woocommerce,https://github.com/woocommerce/woocommerce
2022-12-17,php,22,0,Aplikasi Penilaian Direktorat SMK,eraporsmk,erapor6,https://github.com/eraporsmk/erapor6
2022-12-17,php,3448,6,独角数卡(自动售货系统)-开源站长自动化售货解决方案、高效、稳定、快速！,assimon,dujiaoka,https://github.com/assimon/dujiaoka
2022-12-17,php,1302,1,PHP library for interacting with the Pusher Channels HTTP API,pusher,pusher-http-php,https://github.com/pusher/pusher-http-php
2022-12-17,php,11207,4,Supercharged Excel exports and imports in Laravel,SpartnerNL,Laravel-Excel,https://github.com/SpartnerNL/Laravel-Excel
2022-12-17,php,2082,1,Shopware 6 is an open commerce platform based on Symfony Framework and Vue and supported by a worldwide community and more than 1.500 community extensions,shopware,platform,https://github.com/shopware/platform
2022-12-17,php,2211,0,PHP_CodeSniffer rules (sniffs) to enforce WordPress coding conventions,WordPress,WordPress-Coding-Standards,https://github.com/WordPress/WordPress-Coding-Standards
2022-12-17,php,6885,3,PrestaShop is the universal open-source software platform to build your e-commerce solution.,PrestaShop,PrestaShop,https://github.com/PrestaShop/PrestaShop
2022-12-17,php,9665,4,The PHP deployment tool with support for popular frameworks out of the box,deployphp,deployer,https://github.com/deployphp/deployer
2022-12-17,php,5252,3,"Admin panel, form builder and table builder for Laravel. Built with the TALL stack. Designed for humans.",filamentphp,filament,https://github.com/filamentphp/filament
2022-12-17,php,7665,3,"Twig, the flexible, fast, and secure template language for PHP",twigphp,Twig,https://github.com/twigphp/Twig
2022-12-17,php,2616,3,Serverless PHP on AWS Lambda,brefphp,bref,https://github.com/brefphp/bref