date,language,stargazers,starsToday,description,owner,name,url
2024-10-12,perl,8451,5,Nikto web server scanner,sullo,nikto,https://github.com/sullo/nikto
2024-10-12,perl,19438,7,"cloc counts blank lines, comment lines, and physical lines of source code in many programming languages.",AlDanial,cloc,https://github.com/AlDanial/cloc
2024-10-12,perl,17328,0,Good-lookin' diffs. Actually… nah… The best-lookin' diffs. 🎉,so-fancy,diff-so-fancy,https://github.com/so-fancy/diff-so-fancy
2024-10-12,perl,447,0,"The Open Charge Point Interface (OCPI) allows for a scalable, automated roaming setup between Charge Point Operators and e-Mobility Service Providers. It supports authorisation, charge point information exchange (incl transaction events), charge detail record exchange and finally, the exchange of smart-charging commands between parties.",ocpi,ocpi,https://github.com/ocpi/ocpi
2024-10-12,perl,242,1,GLPI Agent,glpi-project,glpi-agent,https://github.com/glpi-project/glpi-agent
2024-10-12,perl,17184,5,Stack trace visualizer,brendangregg,FlameGraph,https://github.com/brendangregg/FlameGraph
2024-10-12,perl,1014,0,"Ora2Pg is a free tool used to migrate an Oracle database to a PostgreSQL compatible schema. It connects your Oracle database, scan it automatically and extracts its structure or data, it then generates SQL scripts that you can load into PostgreSQL.",darold,ora2pg,https://github.com/darold/ora2pg
2024-10-12,perl,2650,2,"A terminal for iOS, with multiple windows",holzschu,a-shell,https://github.com/holzschu/a-shell
2024-10-12,perl,831,0,Trinity RNA-Seq de novo transcriptome assembly,trinityrnaseq,trinityrnaseq,https://github.com/trinityrnaseq/trinityrnaseq
2024-10-12,perl,450,0,The Ensembl Variant Effect Predictor predicts the functional effects of genomic variants,Ensembl,ensembl-vep,https://github.com/Ensembl/ensembl-vep
2024-10-12,perl,46,0,a superdaemon for hot-deploying server programs,kazuho,p5-Server-Starter,https://github.com/kazuho/p5-Server-Starter
2024-10-12,perl,896,0,LCOV,linux-test-project,lcov,https://github.com/linux-test-project/lcov
2024-10-12,perl,2695,3,Client for PPP+TLS VPN tunnel services,adrienverge,openfortivpn,https://github.com/adrienverge/openfortivpn
2024-10-12,perl,181,0,"zm-build for Zimbra Collaboration Suite, FOSS Edition",Zimbra,zm-build,https://github.com/Zimbra/zm-build
2024-10-12,perl,2447,0,OWASP ModSecurity Core Rule Set (CRS) Project (Official Repository),SpiderLabs,owasp-modsecurity-crs,https://github.com/SpiderLabs/owasp-modsecurity-crs
2024-10-12,perl,1559,2,ModSecurity v3 Nginx Connector,owasp-modsecurity,ModSecurity-nginx,https://github.com/owasp-modsecurity/ModSecurity-nginx
2024-10-12,perl,1932,5,🐪 The Perl programming language,Perl,perl5,https://github.com/Perl/perl5
2024-10-12,perl,828,2,⚡ ♒ Rapid prokaryotic genome annotation,tseemann,prokka,https://github.com/tseemann/prokka
2024-10-12,perl,253,0,FusionInventory Agent,fusioninventory,fusioninventory-agent,https://github.com/fusioninventory/fusioninventory-agent
2024-10-12,perl,8885,3,MySQLTuner is a script written in Perl that will assist you with your MySQL configuration and make recommendations for increased performance and stability.,major,MySQLTuner-perl,https://github.com/major/MySQLTuner-perl