date,language,stargazers,starsToday,description,owner,name,url
2024-02-25,r,5445,6,Friends don't let friends make certain types of data visualization - What are they and why are they bad.,cxli233,FriendsDontLetFriends,https://github.com/cxli233/FriendsDontLetFriends
2024-02-25,r,2047,0,R toolkit for single cell genomics,satijalab,seurat,https://github.com/satijalab/seurat
2024-02-25,r,6243,1,An implementation of the Grammar of Graphics in R,tidyverse,ggplot2,https://github.com/tidyverse/ggplot2
2024-02-25,r,4289,5,R for data science: a book,hadley,r4ds,https://github.com/hadley/r4ds
2024-02-25,r,328,0,ArchR : Analysis of Regulatory Chromatin in R (www.ArchRProject.com),GreenleafLab,ArchR,https://github.com/GreenleafLab/ArchR
2024-02-25,r,543,0,"phyloseq is a set of classes, wrappers, and tools (in R) to make it easier to import, store, and analyze phylogenetic sequencing data; and to reproducibly share that data and analysis with others. See the phyloseq front page:",joey711,phyloseq,https://github.com/joey711/phyloseq
2024-02-25,r,5719,0,"A curated list of awesome R packages, frameworks and software.",qinwf,awesome-R,https://github.com/qinwf/awesome-R
2024-02-25,r,3451,0,R's data.table package extends data.frame:,Rdatatable,data.table,https://github.com/Rdatatable/data.table
2024-02-25,r,283,1,R toolkit for the analysis of single-cell chromatin data,stuart-lab,signac,https://github.com/stuart-lab/signac
2024-02-25,r,493,0,Inferring CNV from Single-Cell RNA-Seq,broadinstitute,infercnv,https://github.com/broadinstitute/infercnv
2024-02-25,r,107,1,"R toolkit for inference, visualization and analysis of cell-cell communication from single-cell and spatially resolved transcriptomics",jinworks,CellChat,https://github.com/jinworks/CellChat
2024-02-25,r,571,0,"R toolkit for inference, visualization and analysis of cell-cell communication from single-cell data",sqjin,CellChat,https://github.com/sqjin/CellChat
2024-02-25,r,1248,0,Simple Features for R,r-spatial,sf,https://github.com/r-spatial/sf
2024-02-25,r,203,0,,kpatel427,YouTubeTutorials,https://github.com/kpatel427/YouTubeTutorials
2024-02-25,r,327,0,R package for detecting doublets in single-cell RNA sequencing data,chris-mcginnis-ucsf,DoubletFinder,https://github.com/chris-mcginnis-ucsf/DoubletFinder
2024-02-25,r,1201,0,Make Complex Heatmaps,jokergoo,ComplexHeatmap,https://github.com/jokergoo/ComplexHeatmap
2024-02-25,r,692,1,Generate static html documentation for an R package,r-lib,pkgdown,https://github.com/r-lib/pkgdown
2024-02-25,r,573,2,,rmcelreath,stat_rethinking_2024,https://github.com/rmcelreath/stat_rethinking_2024
2024-02-25,r,1388,0,Comprehensive list of color palettes available in R ❤️🧡💛💚💙💜,EmilHvitfeldt,r-color-palettes,https://github.com/EmilHvitfeldt/r-color-palettes
2024-02-25,r,919,0,📊 A universal enrichment tool for interpreting omics data,YuLab-SMU,clusterProfiler,https://github.com/YuLab-SMU/clusterProfiler
2024-02-25,r,1848,0,"Easily generate information-rich, publication-quality tables from R",rstudio,gt,https://github.com/rstudio/gt
2024-02-25,r,1209,1,brms R package for Bayesian generalized multivariate non-linear multilevel models using Stan,paul-buerkner,brms,https://github.com/paul-buerkner/brms
2024-02-25,r,922,0,R interface for Apache Spark,sparklyr,sparklyr,https://github.com/sparklyr/sparklyr
2024-02-25,r,4618,0,dplyr: A grammar of data manipulation,tidyverse,dplyr,https://github.com/tidyverse/dplyr
2024-02-25,r,2351,0,The Composer of ggplots,thomasp85,patchwork,https://github.com/thomasp85/patchwork