date,language,stargazers,starsToday,description,owner,name,url
2023-06-17,haskell,20663,9,REST API for any Postgres database,PostgREST,postgrest,https://github.com/PostgREST/postgrest
2023-06-17,haskell,32328,9,"ShellCheck, a static analysis tool for shell scripts",koalaman,shellcheck,https://github.com/koalaman/shellcheck
2023-06-17,haskell,1496,0,Official upstream development repository for Cabal and cabal-install,haskell,cabal,https://github.com/haskell/cabal
2023-06-17,haskell,2863,6,The fastest way to develop full-stack web apps with React & Node.js.,wasp-lang,wasp,https://github.com/wasp-lang/wasp
2023-06-17,haskell,710,0,HTTP server & command-line for managing UTxOs and HD wallets in Cardano.,input-output-hk,cardano-wallet,https://github.com/input-output-hk/cardano-wallet
2023-06-17,haskell,3,0,IO concurrent promitives for conduit,qnikst,iochan-conduit,https://github.com/qnikst/iochan-conduit
2023-06-17,haskell,8686,4,"Dockerfile linter, validate inline bash, written in Haskell",hadolint,hadolint,https://github.com/hadolint/hadolint
2023-06-17,haskell,2,0,,input-output-hk,cardano-cli,https://github.com/input-output-hk/cardano-cli
2023-06-17,haskell,14,0,Symbolic execution of LLVM IR traces for program understanding.,phulin,symbolic-trace,https://github.com/phulin/symbolic-trace
2023-06-17,haskell,2945,0,The core component that is used to participate in a Cardano decentralised blockchain.,input-output-hk,cardano-node,https://github.com/input-output-hk/cardano-node
2023-06-17,haskell,77,0,A community-driven collection of documentation for Haskell error messages and warnings,haskellfoundation,error-message-index,https://github.com/haskellfoundation/error-message-index
2023-06-17,haskell,1,0,"Efficient, pure binary decoding using Arrows and ByteStrings in Haskell.",kolmodin,binary-arrow,https://github.com/kolmodin/binary-arrow
2023-06-17,haskell,1711,3,A shell script which checks your $HOME for unwanted files and directories.,b3nj5m1n,xdg-ninja,https://github.com/b3nj5m1n/xdg-ninja
2023-06-17,haskell,9,0,Jambhala Cardano Development Suite,iburzynski,jambhala,https://github.com/iburzynski/jambhala
2023-06-17,haskell,2811,6,An advanced keyboard manager,kmonad,kmonad,https://github.com/kmonad/kmonad
2023-06-17,haskell,264,0,A WebSocket JSON/RPC bridge for Cardano,CardanoSolutions,ogmios,https://github.com/CardanoSolutions/ogmios
2023-06-17,haskell,0,0,haskell-sand-game,abramhindle,haskell-sand-game,https://github.com/abramhindle/haskell-sand-game
2023-06-17,haskell,1387,0,"This repository hosts the lectures of the Plutus Pioneers Program. This program is a training course that the IOG Education Team provides to recruit and train software developers in Plutus, the native smart contract language for the Cardano ecosystem.",input-output-hk,plutus-pioneer-program,https://github.com/input-output-hk/plutus-pioneer-program
2023-06-17,haskell,3032,1,"The core of xmonad, a small but functional ICCCM-compliant tiling window manager",xmonad,xmonad,https://github.com/xmonad/xmonad
2023-06-17,haskell,3351,1,SimpleX - the first messaging platform operating without user identifiers of any kind - 100% private by design! iOS and Android apps are released !,simplex-chat,simplex-chat,https://github.com/simplex-chat/simplex-chat
2023-06-17,haskell,29137,10,Universal markup converter,jgm,pandoc,https://github.com/jgm/pandoc
2023-06-17,haskell,33,1,,TheInnerLight,tiki-tech,https://github.com/TheInnerLight/tiki-tech