date,language,stargazers,starsToday,description,owner,name,url
2023-06-17,markdown,13291,5,Free uptime monitor and status page powered by GitHub,upptime,upptime,https://github.com/upptime/upptime
2023-06-17,markdown,1321,1,The source repository of all translated content for MDN Web Docs,mdn,translated-content,https://github.com/mdn/translated-content
2023-06-17,markdown,116539,24,"刷算法全靠套路，认准 labuladong 就够了！English version supported! Crack LeetCode, not only how, but also why.",labuladong,fucking-algorithm,https://github.com/labuladong/fucking-algorithm
2023-06-17,markdown,24209,10,Linux命令大全搜索工具，内容包含Linux命令手册、详解、学习、搜集。https://git.io/linux,jaywcjlove,linux-command,https://github.com/jaywcjlove/linux-command
2023-06-17,markdown,4142,3,Ethereum.org is a primary online resource for the Ethereum community.,ethereum,ethereum-org-website,https://github.com/ethereum/ethereum-org-website
2023-06-17,markdown,5288,2,RFCs for changes to Rust,rust-lang,rfcs,https://github.com/rust-lang/rfcs
2023-06-17,markdown,7699,11,Improve your README.md profile with these amazing badges.,alexandresanlim,Badges4-README.md-Profile,https://github.com/alexandresanlim/Badges4-README.md-Profile
2023-06-17,markdown,7923,2,The content behind MDN Web Docs,mdn,content,https://github.com/mdn/content
2023-06-17,markdown,112,0,Mendix documentation repository,mendix,docs,https://github.com/mendix/docs
2023-06-17,markdown,5462,5,Official Discord API Documentation,discord,discord-api-docs,https://github.com/discord/discord-api-docs
2023-06-17,markdown,1373,0,This repository provides SAP style guides for coding and coding-related topics.,SAP,styleguides,https://github.com/SAP/styleguides
2023-06-17,markdown,44537,15,Collaborative cheatsheets for console commands,tldr-pages,tldr,https://github.com/tldr-pages/tldr
2023-06-17,markdown,2307,9,A curation of awesome portfolio website ideas for developers and designers to draw inspiration from. Raise a pull request to add more.,Evavic44,portfolio-ideas,https://github.com/Evavic44/portfolio-ideas
2023-06-17,markdown,609,3,A Complete List of GitHub Profile Badges and Achievements,drknzz,GitHub-Achievements,https://github.com/drknzz/GitHub-Achievements
2023-06-17,markdown,1753,2,Protect your data against global mass surveillance programs.,privacyguides,privacyguides.org,https://github.com/privacyguides/privacyguides.org
2023-06-17,markdown,3054,1,Kotlin Evolution and Enhancement Process,Kotlin,KEEP,https://github.com/Kotlin/KEEP
2023-06-17,markdown,3730,6,A collection listing all Achievements available on the GitHub profile,Schweinepriester,github-profile-achievements,https://github.com/Schweinepriester/github-profile-achievements
2023-06-17,markdown,112,0,Solutions (that we managed to find) for the 2021 PicoCTF,vivian-dai,PicoCTF2021-Writeup,https://github.com/vivian-dai/PicoCTF2021-Writeup
2023-06-17,markdown,14383,4,This maintains proposals for changes and user-visible enhancements to the Swift Programming Language.,apple,swift-evolution,https://github.com/apple/swift-evolution