date,language,stargazers,starsToday,description,owner,name,url
2024-04-29,perl,18493,6,"cloc counts blank lines, comment lines, and physical lines of source code in many programming languages.",AlDanial,cloc,https://github.com/AlDanial/cloc
2024-04-29,perl,2769,2,,ThePrimeagen,.dotfiles,https://github.com/ThePrimeagen/.dotfiles
2024-04-29,perl,44,0,a superdaemon for hot-deploying server programs,kazuho,p5-Server-Starter,https://github.com/kazuho/p5-Server-Starter
2024-04-29,perl,10,0,a tiny template engine for embedded HTML,kazuho,picotemplate,https://github.com/kazuho/picotemplate
2024-04-29,perl,2894,9,These are policy-driven snapshot management and replication tools which use OpenZFS for underlying next-gen storage. (Btrfs support plans are shelved unless and until btrfs becomes reliable.),jimsalterjrs,sanoid,https://github.com/jimsalterjrs/sanoid
2024-04-29,perl,40,4,PostgreSQL Database Security Assessment Tool,HexaCluster,pgdsat,https://github.com/HexaCluster/pgdsat
2024-04-29,perl,12,0,,Berkeley-CS162,cs162-workspace,https://github.com/Berkeley-CS162/cs162-workspace
2024-04-29,perl,0,0,,binary-com,perl-Format-Util,https://github.com/binary-com/perl-Format-Util
2024-04-29,perl,2375,0,"A terminal for iOS, with multiple windows",holzschu,a-shell,https://github.com/holzschu/a-shell
2024-04-29,perl,400,0,Movable Type,movabletype,movabletype,https://github.com/movabletype/movabletype
2024-04-29,perl,7875,2,Nikto web server scanner,sullo,nikto,https://github.com/sullo/nikto
2024-04-29,perl,1960,2,Web application for archival and reading of manga/doujinshi. Lightweight and Docker-ready for NAS/servers.,Difegue,LANraragi,https://github.com/Difegue/LANraragi
2024-04-29,perl,2036,0,A utility for downloading TV and radio programmes from BBC iPlayer and BBC Sounds,get-iplayer,get_iplayer,https://github.com/get-iplayer/get_iplayer
2024-04-29,perl,0,0,metaconfig for perl,shlomif,metaconfig,https://github.com/shlomif/metaconfig
2024-04-29,perl,2125,1,Th3Inspector 🕵️ Best Tool For Information Gathering 🔎,Moham3dRiahi,Th3inspector,https://github.com/Moham3dRiahi/Th3inspector
2024-04-29,perl,162,0,"Comprehensive, language independent Test Suite for YAML",yaml,yaml-test-suite,https://github.com/yaml/yaml-test-suite
2024-04-29,perl,17085,1,Good-lookin' diffs. Actually… nah… The best-lookin' diffs. 🎉,so-fancy,diff-so-fancy,https://github.com/so-fancy/diff-so-fancy
2024-04-29,perl,1,0,,gleb-roma,google_count,https://github.com/gleb-roma/google_count
2024-04-29,perl,0,0,identidad visual de firefox,inaes-tic,pkg-firefox,https://github.com/inaes-tic/pkg-firefox
2024-04-29,perl,3,0,Custom compiled perl for Binary.com,binary-com,perl,https://github.com/binary-com/perl
2024-04-29,perl,48,0,cstyle-based JavaScript style checker,TritonDataCenter,jsstyle,https://github.com/TritonDataCenter/jsstyle
2024-04-29,perl,2,0,Language files for Binary.com Websockets API service,binary-com,translations-websockets-api,https://github.com/binary-com/translations-websockets-api
2024-04-29,perl,369,0,templates to format geographic addresses,OpenCageData,address-formatting,https://github.com/OpenCageData/address-formatting
2024-04-29,perl,1248,0,A free/open source client and automation tool for Ragnarok Online,OpenKore,openkore,https://github.com/OpenKore/openkore
2024-04-29,perl,2093,2,Ddclient updates dynamic DNS entries for accounts on a wide range of dynamic DNS services.,ddclient,ddclient,https://github.com/ddclient/ddclient