date,language,stargazers,starsToday,description,owner,name,url
2023-08-20,lua,1919,9,Neovim plugin to manage the file system and other tree like structures.,nvim-neo-tree,neo-tree.nvim,https://github.com/nvim-neo-tree/neo-tree.nvim
2023-08-20,lua,3161,7,Offline build planner for Path of Exile.,PathOfBuildingCommunity,PathOfBuilding,https://github.com/PathOfBuildingCommunity/PathOfBuilding
2023-08-20,lua,10992,12,"Find, Filter, Preview, Pick. All lua, all the time.",nvim-telescope,telescope.nvim,https://github.com/nvim-telescope/telescope.nvim
2023-08-20,lua,18836,17,"Blazing fast Neovim config providing solid defaults and a beautiful UI, enhancing your neovim experience.",NvChad,NvChad,https://github.com/NvChad/NvChad
2023-08-20,lua,35737,4,The Cloud-Native API Gateway,Kong,kong,https://github.com/Kong/kong
2023-08-20,lua,12450,6,The Cloud-Native API Gateway,apache,apisix,https://github.com/apache/apisix
2023-08-20,lua,7413,15,Neovim config for the lazy,LazyVim,LazyVim,https://github.com/LazyVim/LazyVim
2023-08-20,lua,6649,14,A modern plugin manager for Neovim,folke,lazy.nvim,https://github.com/folke/lazy.nvim
2023-08-20,lua,13337,6,"An ebook reader application supporting PDF, DjVu, EPUB, FB2 and many more formats, running on Cervantes, Kindle, Kobo, PocketBook and Android devices",koreader,koreader,https://github.com/koreader/koreader
2023-08-20,lua,2602,5,Library of 30+ independent Lua modules improving overall Neovim (version 0.7 and higher) experience with minimal effort,echasnovski,mini.nvim,https://github.com/echasnovski/mini.nvim
2023-08-20,lua,5412,2,A file explorer tree for neovim written in lua,nvim-tree,nvim-tree.lua,https://github.com/nvim-tree/nvim-tree.lua
2023-08-20,lua,2577,3,A starting point to setup some lsp related features in neovim.,VonHeikemen,lsp-zero.nvim,https://github.com/VonHeikemen/lsp-zero.nvim
2023-08-20,lua,2057,9,,ThePrimeagen,init.lua,https://github.com/ThePrimeagen/init.lua
2023-08-20,lua,1214,2,Set of preconfigured snippets for different languages.,rafamadriz,friendly-snippets,https://github.com/rafamadriz/friendly-snippets
2023-08-20,lua,208,15,wildfire burns treesitter,SUSTech-data,wildfire.nvim,https://github.com/SUSTech-data/wildfire.nvim
2023-08-20,lua,2493,4,A language server that offers Lua language support - programmed in Lua,LuaLS,lua-language-server,https://github.com/LuaLS/lua-language-server
2023-08-20,lua,2313,3,"A highly customizable theme for vim and neovim with support for lsp, treesitter and a variety of plugins.",EdenEast,nightfox.nvim,https://github.com/EdenEast/nightfox.nvim
2023-08-20,lua,2233,3,Snippet Engine for Neovim written in Lua.,L3MON4D3,LuaSnip,https://github.com/L3MON4D3/LuaSnip
2023-08-20,lua,11813,0,"Software that can generate photos from paintings, turn horses into zebras, perform style transfer, and more.",junyanz,CycleGAN,https://github.com/junyanz/CycleGAN
2023-08-20,lua,858,1,Neovim treesitter plugin for setting the commentstring based on the cursor location in a file.,JoosepAlviste,nvim-ts-context-commentstring,https://github.com/JoosepAlviste/nvim-ts-context-commentstring
2023-08-20,lua,95,1,nvim-cmp source for math calculation,hrsh7th,cmp-calc,https://github.com/hrsh7th/cmp-calc
2023-08-20,lua,122,1,FIFA 23 Live Editor,xAranaktu,FIFA-23-Live-Editor,https://github.com/xAranaktu/FIFA-23-Live-Editor
2023-08-20,lua,142,0,"A public collection of cheats for Sky: Children of the Light, the latest game by thatgamecompany!",thatskymod,Sky-CotL-Scripts,https://github.com/thatskymod/Sky-CotL-Scripts
2023-08-20,lua,2164,0,Offline build planner for Path of Exile.,Openarl,PathOfBuilding,https://github.com/Openarl/PathOfBuilding
2023-08-20,lua,3419,3,Git integration for buffers,lewis6991,gitsigns.nvim,https://github.com/lewis6991/gitsigns.nvim