date,language,stargazers,starsToday,description,owner,name,url
2022-06-26,php,1234,73,Laravel Pint is an opinionated PHP code style fixer for minimalists.,laravel,pint,https://github.com/laravel/pint
2022-06-26,php,8008,11,"A customizable, open-source eCommerce platform built on WordPress. Build any commerce solution you can imagine.",woocommerce,woocommerce,https://github.com/woocommerce/woocommerce
2022-06-26,php,705,6,Hydra is a zero-config API boilerplate with Laravel 9x + Laravel Sanctum that comes with an excellent user and role management API out of the box,hasinhayder,hydra,https://github.com/hasinhayder/hydra
2022-06-26,php,70067,16,"Laravel is a web application framework with expressive, elegant syntax. We’ve already laid the foundation for your next big idea — freeing you to create without sweating the small things.",laravel,laravel,https://github.com/laravel/laravel
2022-06-26,php,9490,6,PHP_CodeSniffer tokenizes PHP files and detects violations of a defined set of coding standards.,squizlabs,PHP_CodeSniffer,https://github.com/squizlabs/PHP_CodeSniffer
2022-06-26,php,6230,5,A free open source IT asset/license management system,snipe,snipe-it,https://github.com/snipe/snipe-it
2022-06-26,php,26671,5,Dependency Manager for PHP,composer,composer,https://github.com/composer/composer
2022-06-26,php,123,9,Check if your requests would pass validation if you executed them normally,dive-be,laravel-dry-requests,https://github.com/dive-be/laravel-dry-requests
2022-06-26,php,3566,0,"EasyAdmin is a fast, beautiful and modern admin generator for Symfony applications.",EasyCorp,EasyAdminBundle,https://github.com/EasyCorp/EasyAdminBundle
2022-06-26,php,5306,6,mailcow: dockerized -  +  =  - we stand with,mailcow,mailcow-dockerized,https://github.com/mailcow/mailcow-dockerized
2022-06-26,php,4796,1,A static analysis tool for finding errors in PHP applications,vimeo,psalm,https://github.com/vimeo/psalm
2022-06-26,php,9571,3,A platform to create documentation/wiki content built with PHP & Laravel,BookStackApp,BookStack,https://github.com/BookStackApp/BookStack
2022-06-26,php,484,2,-------> RAFEL<------ Android Rat Written in Java With WebPanel For Controlling Victims...Hack Android Devices,swagkarna,Rafel-Rat,https://github.com/swagkarna/Rafel-Rat
2022-06-26,php,3041,4,Eloquent roles and abilities.,JosephSilber,bouncer,https://github.com/JosephSilber/bouncer
2022-06-26,php,10507,2,Build a full-featured administrative interface in ten minutes,z-song,laravel-admin,https://github.com/z-song/laravel-admin
2022-06-26,php,4440,6,"A free, self-hostable aggregator…",FreshRSS,FreshRSS,https://github.com/FreshRSS/FreshRSS
2022-06-26,php,4491,2,Clockwork - php dev tools in your browser - server-side component,itsgoingd,clockwork,https://github.com/itsgoingd/clockwork
2022-06-26,php,2236,5,DooTask是一款轻量级的开源在线项目任务管理工具，提供各类文档协作工具、在线思维导图、在线流程图、项目管理、任务分发、即时IM，文件管理等工具。,kuaifan,dootask,https://github.com/kuaifan/dootask
2022-06-26,php,1885,0,Shopware 6 is an open commerce platform based on Symfony Framework and Vue and supported by a worldwide community and more than 1.500 community extensions,shopware,platform,https://github.com/shopware/platform
2022-06-26,php,2564,0,"Open Source Data & Experience Management Platform (PIM, MDM, CDP, DAM, DXP/CMS & Digital Commerce)",pimcore,pimcore,https://github.com/pimcore/pimcore
2022-06-26,php,3282,0,"Dolibarr ERP CRM is a modern software package to manage your company or foundation's activity (contacts, suppliers, invoices, orders, stocks, agenda, accounting, ...). It is open source software (written in PHP) and designed for small and medium businesses, foundations and freelancers. You can freely install, use and distribute it as a standalon…",Dolibarr,dolibarr,https://github.com/Dolibarr/dolibarr
2022-06-26,php,2102,2,The server component of API Platform: hypermedia and GraphQL APIs in minutes,api-platform,core,https://github.com/api-platform/core
2022-06-26,php,59,23,PHP Laravel Telegram Bot,jyxjjj,Telegram-Bot,https://github.com/jyxjjj/Telegram-Bot
2022-06-26,php,1195,0,,pentestmonkey,php-reverse-shell,https://github.com/pentestmonkey/php-reverse-shell
2022-06-26,php,3665,9,"Admin panel, form builder and table builder for the TALL stack. Designed for humans.",filamentphp,filament,https://github.com/filamentphp/filament