date,language,stargazers,starsToday,description,owner,name,url
2024-09-14,haskell,36099,7,"ShellCheck, a static analysis tool for shell scripts",koalaman,shellcheck,https://github.com/koalaman/shellcheck
2024-09-14,haskell,23197,13,REST API for any Postgres database,PostgREST,postgrest,https://github.com/PostgREST/postgrest
2024-09-14,haskell,1262,2,"Fast, portable and reliable dependency analysis for any codebase. Supports license & vulnerability scanning for large monoliths. Language-agnostic; integrates with 20+ build systems.",fossas,fossa-cli,https://github.com/fossas/fossa-cli
2024-09-14,haskell,33944,17,Universal markup converter,jgm,pandoc,https://github.com/jgm/pandoc
2024-09-14,haskell,3329,2,"The core of xmonad, a small but functional ICCCM-compliant tiling window manager",xmonad,xmonad,https://github.com/xmonad/xmonad
2024-09-14,haskell,10238,5,"Dockerfile linter, validate inline bash, written in Haskell",hadolint,hadolint,https://github.com/hadolint/hadolint
2024-09-14,haskell,2432,5,A shell script which checks your $HOME for unwanted files and directories.,b3nj5m1n,xdg-ninja,https://github.com/b3nj5m1n/xdg-ninja
2024-09-14,haskell,274,1,Implementation of the Hydra Head protocol,cardano-scaling,hydra,https://github.com/cardano-scaling/hydra
2024-09-14,haskell,535,0,SystemVerilog to Verilog conversion,zachjs,sv2v,https://github.com/zachjs/sv2v
2024-09-14,haskell,6043,4,"SimpleX - the first messaging network operating without user identifiers of any kind - 100% private by design! iOS, Android and desktop apps 📱!",simplex-chat,simplex-chat,https://github.com/simplex-chat/simplex-chat
2024-09-14,haskell,3881,4,An advanced keyboard manager,kmonad,kmonad,https://github.com/kmonad/kmonad