date,language,stargazers,starsToday,description,owner,name,url
2023-05-26,haskell,3109,38,SimpleX - the first messaging platform operating without user identifiers of any kind - 100% private by design! iOS and Android apps are released !,simplex-chat,simplex-chat,https://github.com/simplex-chat/simplex-chat
2023-05-26,haskell,8613,2,"Dockerfile linter, validate inline bash, written in Haskell",hadolint,hadolint,https://github.com/hadolint/hadolint
2023-05-26,haskell,28963,13,Universal markup converter,jgm,pandoc,https://github.com/jgm/pandoc
2023-05-26,haskell,2109,1,Agda is a dependently typed programming language / interactive theorem prover.,agda,agda,https://github.com/agda/agda
2023-05-26,haskell,7185,2,"Compiler for Elm, a functional language for reliable webapps.",elm,compiler,https://github.com/elm/compiler
2023-05-26,haskell,2935,0,The core component that is used to participate in a Cardano decentralised blockchain.,input-output-hk,cardano-node,https://github.com/input-output-hk/cardano-node
2023-05-26,haskell,5,0,"Haskell S3 Client, forked from http://hackage.haskell.org/package/hS3 to support MD5 validation on upload and removed dependency on MissingH",necrobious,hS3,https://github.com/necrobious/hS3
2023-05-26,haskell,1490,1,Official upstream development repository for Cabal and cabal-install,haskell,cabal,https://github.com/haskell/cabal
2023-05-26,haskell,32185,8,"ShellCheck, a static analysis tool for shell scripts",koalaman,shellcheck,https://github.com/koalaman/shellcheck
2023-05-26,haskell,90,0,Core types and utilities,diagrams,diagrams-core,https://github.com/diagrams/diagrams-core
2023-05-26,haskell,20574,5,REST API for any Postgres database,PostgREST,postgrest,https://github.com/PostgREST/postgrest
2023-05-26,haskell,707,0,HTTP server & command-line for managing UTxOs and HD wallets in Cardano.,input-output-hk,cardano-wallet,https://github.com/input-output-hk/cardano-wallet
2023-05-26,haskell,48,0,,josephsumabat,static-ls,https://github.com/josephsumabat/static-ls
2023-05-26,haskell,1594,1,Tunneling over websocket protocol - Static binary available,erebe,wstunnel,https://github.com/erebe/wstunnel
2023-05-26,haskell,16,0,Effectful Raw handler for Servant servers.,cdepillabout,servant-rawm,https://github.com/cdepillabout/servant-rawm
2023-05-26,haskell,3010,1,"The core of xmonad, a small but functional ICCCM-compliant tiling window manager",xmonad,xmonad,https://github.com/xmonad/xmonad
2023-05-26,haskell,1661,3,A shell script which checks your $HOME for unwanted files and directories.,b3nj5m1n,xdg-ninja,https://github.com/b3nj5m1n/xdg-ninja
2023-05-26,haskell,24,0,generate haskell types for Squeal from a running postgresql database.,mwotton,squealgen,https://github.com/mwotton/squealgen
2023-05-26,haskell,5,0,This is scrive's common collection of function import we use the most.,scrive,scrive-prelude,https://github.com/scrive/scrive-prelude
2023-05-26,haskell,923,0,"Haskell course info, plan, video lectures, slides",haskell-beginners-2022,course-plan,https://github.com/haskell-beginners-2022/course-plan
2023-05-26,haskell,1384,1,"This repository hosts the lectures of the Plutus Pioneers Program. This program is a training course that the IOG Education Team provides to recruit and train software developers in Plutus, the native smart contract language for the Cardano ecosystem.",input-output-hk,plutus-pioneer-program,https://github.com/input-output-hk/plutus-pioneer-program
2023-05-26,haskell,5205,0,A friendly programming language from the future,unisonweb,unison,https://github.com/unisonweb/unison