date,language,stargazers,starsToday,description,owner,name,url
2022-09-26,svelte,56,0,Ultra customizable hud featuring a unique and robust settings menu. Change eveything about your experience!,Project-Sloth,ps-hud,https://github.com/Project-Sloth/ps-hud
2022-09-26,svelte,147,3,✒︎ Simply Awesome Blog Starter built with SvelteKit and Love,kwchang0831,svelte-QWER,https://github.com/kwchang0831/svelte-QWER
2022-09-26,svelte,1539,3,,PuruVJ,macos-web,https://github.com/PuruVJ/macos-web
2022-09-26,svelte,1750,1,Svelte implementation of the Carbon Design System,carbon-design-system,carbon-components-svelte,https://github.com/carbon-design-system/carbon-components-svelte
2022-09-26,svelte,1657,2,SvelteKit implementation of the RealWorld app,sveltejs,realworld,https://github.com/sveltejs/realworld
2022-09-26,svelte,1405,0,"A simple standalone program which automates the installation, removal and maintenance of BetterDiscord.",BetterDiscord,Installer,https://github.com/BetterDiscord/Installer
2022-09-26,svelte,766,2,An extension that allows inspection of Svelte component hierarchy and state in the Firefox and Chrome developer tools.,sveltejs,svelte-devtools,https://github.com/sveltejs/svelte-devtools
2022-09-26,svelte,388,0,The official IOTA and Shimmer wallet,iotaledger,firefly,https://github.com/iotaledger/firefly
2022-09-26,svelte,154,0,Companion desktop app for the self-hosted M1 Mac version of Stable Diffusion,breadthe,sd-buddy,https://github.com/breadthe/sd-buddy
2022-09-26,svelte,14464,24,"The most popular, free and open-source Tailwind CSS component library",saadeghi,daisyui,https://github.com/saadeghi/daisyui
2022-09-26,svelte,203,0,"Sweet, Powerful, IndieWeb-Compatible SvelteKit Blog Starter. [δ](Delta)",importantimport,urara,https://github.com/importantimport/urara
2022-09-26,svelte,4416,7,An open-source & self-hostable Heroku / Netlify alternative.,coollabsio,coolify,https://github.com/coollabsio/coolify
2022-09-26,svelte,1246,0,A lightweight Svelte component library for building interactive node-based flow diagrams,open-source-labs,Svelvet,https://github.com/open-source-labs/Svelvet
2022-09-26,svelte,987,2,Unofficial Svelte port of the Headless UI component library,rgossiaux,svelte-headlessui,https://github.com/rgossiaux/svelte-headlessui
2022-09-26,svelte,288,5,A web frontend for the headscale Tailscale-compatible coordination server,gurucomputing,headscale-ui,https://github.com/gurucomputing/headscale-ui
2022-09-26,svelte,27,0,Project management for Obsidian,marcusolsson,obsidian-projects,https://github.com/marcusolsson/obsidian-projects
2022-09-26,svelte,255,1,Gitpod website and documentation,gitpod-io,website,https://github.com/gitpod-io/website
2022-09-26,svelte,3,0,the recipe for the Fathym arcade,fathym-it,arcade-recipe,https://github.com/fathym-it/arcade-recipe
2022-09-26,svelte,48,0,"Best Genshin Impact Wish Simulator for Web Version, No need to download, 100% running on browser!",AguzzTN54,Genshin-Impact-Wish-Simulator,https://github.com/AguzzTN54/Genshin-Impact-Wish-Simulator
2022-09-26,svelte,368,3,A fully featured UI toolkit for Svelte + Tailwind.,Brain-Bones,skeleton,https://github.com/Brain-Bones/skeleton
2022-09-26,svelte,10,1,Make a game with Sprig and share it with the world.,hackclub,sprig-gallery,https://github.com/hackclub/sprig-gallery
2022-09-26,svelte,146,0,Buttery smooth toast notifications for Svelte,kbrgl,svelte-french-toast,https://github.com/kbrgl/svelte-french-toast
2022-09-26,svelte,33,0,Repository for the website of ReVanced,revanced,revanced.github.io,https://github.com/revanced/revanced.github.io
2022-09-26,svelte,46,0,,iptv-org,iptv-org.github.io,https://github.com/iptv-org/iptv-org.github.io
2022-09-26,svelte,1798,16,"Database manager for MySQL, PostgreSQL, SQL Server, MongoDB, SQLite and others. Runs under Windows, Linux, Mac or as web application",dbgate,dbgate,https://github.com/dbgate/dbgate