date,language,stargazers,starsToday,description,owner,name,url
2022-08-19,astro,192,4,Astro documentation,withastro,docs,https://github.com/withastro/docs
2022-08-19,astro,182,0,"Crisp, minimal, personal blog theme for Astro",one-aalam,astro-ink,https://github.com/one-aalam/astro-ink
2022-08-19,astro,42,1,A modern business marketing website theme/starter built with Astro,littlesticksdev,odyssey-theme,https://github.com/littlesticksdev/odyssey-theme
2022-08-19,astro,74,2,Personal Blog Template Powered by Astro,Charca,astro-blog-template,https://github.com/Charca/astro-blog-template
2022-08-19,astro,50,10,A template to make your website using Astro + Tailwind CSS.,onwidget,astrowind,https://github.com/onwidget/astrowind
2022-08-19,astro,69,1,,withastro,astro.build,https://github.com/withastro/astro.build