date,language,stargazers,starsToday,description,owner,name,url
2022-08-19,svelte,13564,38,"The most popular, free and open-source Tailwind CSS component library",saadeghi,daisyui,https://github.com/saadeghi/daisyui
2022-08-19,svelte,1601,3,SvelteKit implementation of the RealWorld app,sveltejs,realworld,https://github.com/sveltejs/realworld
2022-08-19,svelte,26,0,Repository for the website of ReVanced,revanced,revanced.github.io,https://github.com/revanced/revanced.github.io
2022-08-19,svelte,1697,3,Svelte implementation of the Carbon Design System,carbon-design-system,carbon-components-svelte,https://github.com/carbon-design-system/carbon-components-svelte
2022-08-19,svelte,4154,4,An open-source & self-hostable Heroku / Netlify alternative.,coollabsio,coolify,https://github.com/coollabsio/coolify
2022-08-19,svelte,140,0,"Commune is a communications suite built on top of matrix. Commune aims to bring together chat, discussions, email and other interactive apps into a single matrix client.",commune-org,commune,https://github.com/commune-org/commune
2022-08-19,svelte,816,0,SvelteStorm is an open-source IDE with a built-in Debugging window for viewing and debugging your Svelte project in real-time,open-source-labs,SvelteStorm,https://github.com/open-source-labs/SvelteStorm
2022-08-19,svelte,65,0,Create a custom league page for your Sleeper fantasy football league!,nmelhado,league-page,https://github.com/nmelhado/league-page
2022-08-19,svelte,2573,2,Svelte Material UI Components,hperrin,svelte-material-ui,https://github.com/hperrin/svelte-material-ui
2022-08-19,svelte,146,4,FreeShow is a free and open-source presenter for anyone to use with ease.,vassbo,freeshow,https://github.com/vassbo/freeshow
2022-08-19,svelte,203,1,Official Svelte components built for Flowbite and Tailwind CSS,themesberg,flowbite-svelte,https://github.com/themesberg/flowbite-svelte