date,language,stargazers,starsToday,description,owner,name,url
2023-12-22,elixir,4052,4,Automate code & data workflows with interactive Elixir notebooks,livebook-dev,livebook,https://github.com/livebook-dev/livebook
2023-12-22,elixir,3560,22,"Local-first sync layer for web and mobile apps. Build reactive, realtime, local-first apps directly on Postgres.",electric-sql,electric,https://github.com/electric-sql/electric
2023-12-22,elixir,17092,15,"Simple, open source, lightweight (< 1 KB) and privacy-friendly web analytics alternative to Google Analytics.",plausible,analytics,https://github.com/plausible/analytics
2023-12-22,elixir,1215,0,A declarative and extensible framework for building Elixir applications.,ash-project,ash,https://github.com/ash-project/ash
2023-12-22,elixir,5512,2,"Rich, real-time user experiences with server-rendered HTML",phoenixframework,phoenix_live_view,https://github.com/phoenixframework/phoenix_live_view
2023-12-22,elixir,20187,2,Peace of mind from prototype to production,phoenixframework,phoenix,https://github.com/phoenixframework/phoenix
2023-12-22,elixir,5887,0,A toolkit for data mapping and language integrated query.,elixir-ecto,ecto,https://github.com/elixir-ecto/ecto
2023-12-22,elixir,94,2,🛡 Public database of Elixir security advisories pulled from GitHub Advisory Database,mirego,elixir-security-advisories,https://github.com/mirego/elixir-security-advisories
2023-12-22,elixir,1069,2,Platform for creating interactive courses.,zoonk,uneebee,https://github.com/zoonk/uneebee
2023-12-22,elixir,2903,4,Blockchain explorer for Ethereum based network and a tool for inspecting and analyzing EVM based blockchains.,blockscout,blockscout,https://github.com/blockscout/blockscout
2023-12-22,elixir,14,0,Console adapter/logger for Spandex traces & spans.,pepsico-ecommerce,spandex_console,https://github.com/pepsico-ecommerce/spandex_console
2023-12-22,elixir,6254,3,"Broadcast, Presence, and Postgres Changes via WebSockets",supabase,realtime,https://github.com/supabase/realtime
2023-12-22,elixir,146,0,"UI Dashboard for Exq, a job processing library for Elixir. Exq UI provides the UI dashboard to display stats on job processing.",akira,exq_ui,https://github.com/akira/exq_ui
2023-12-22,elixir,2859,3,"💎 Robust job processing in Elixir, backed by modern PostgreSQL or SQLite3",sorentwo,oban,https://github.com/sorentwo/oban
2023-12-22,elixir,22360,2,"Elixir is a dynamic, functional language for building scalable and maintainable applications",elixir-lang,elixir,https://github.com/elixir-lang/elixir
2023-12-22,elixir,3,0,A bunch of utility modules to accompany elixir-blueprint,rum-and-code,elixir-utils,https://github.com/rum-and-code/elixir-utils
2023-12-22,elixir,1066,1,Pre-trained Neural Network models in Axon (+ 🤗 Models integration),elixir-nx,bumblebee,https://github.com/elixir-nx/bumblebee
2023-12-22,elixir,2952,0,Simplify deployments in Elixir with OTP releases!,bitwalker,distillery,https://github.com/bitwalker/distillery
2023-12-22,elixir,77,1,Traffic endpoint and graceful shutdown for Elixir Plug apps,Financial-Times,k8s_traffic_plug,https://github.com/Financial-Times/k8s_traffic_plug
2023-12-22,elixir,33,0,,OffchainLabs,blockscout,https://github.com/OffchainLabs/blockscout
2023-12-22,elixir,12187,0,"A curated list of amazingly awesome Elixir and Erlang libraries, resources and shiny things. Updates:",h4cc,awesome-elixir,https://github.com/h4cc/awesome-elixir
2023-12-22,elixir,724,0,[Deprecated because ibrowse is not maintained] HTTP client for Elixir (use Tesla please),valpackett,httpotion,https://github.com/valpackett/httpotion
2023-12-22,elixir,582,0,Kafka client library for Elixir,kafkaex,kafka_ex,https://github.com/kafkaex/kafka_ex
2023-12-22,elixir,579,0,The official Elixir SDK for Sentry (sentry.io),getsentry,sentry-elixir,https://github.com/getsentry/sentry-elixir
2023-12-22,elixir,4760,5,A self-hosted data logger for your Tesla 🚘,teslamate-org,teslamate,https://github.com/teslamate-org/teslamate