date,language,stargazers,starsToday,description,owner,name,url
2023-01-04,python,24900,560,ALL IN ONE Hacking Tool For Hackers,Z4nzu,hackingtool,https://github.com/Z4nzu/hackingtool
2023-01-04,python,2028,619,"The simplest, fastest repository for training/finetuning medium-sized GPTs.",karpathy,nanoGPT,https://github.com/karpathy/nanoGPT
2023-01-04,python,2607,159,A multi-voice TTS system trained with an emphasis on quality,neonbjb,tortoise-tts,https://github.com/neonbjb/tortoise-tts
2023-01-04,python,709,137,Ejercicios de código semanales en 2023 de la comunidad MoureDev para practicar lógica en cualquier lenguaje de programación.,mouredev,retos-programacion-2023,https://github.com/mouredev/retos-programacion-2023
2023-01-04,python,1671,382,"Run 100B+ language models at home, BitTorrent-style. Fine-tuning and inference up to 10x faster than offloading",bigscience-workshop,petals,https://github.com/bigscience-workshop/petals
2023-01-04,python,708,48,An index created by GPT to organize external information and answer queries!,jerryjliu,gpt_index,https://github.com/jerryjliu/gpt_index
2023-01-04,python,151954,215,"A curated list of awesome Python frameworks, libraries, software and resources",vinta,awesome-python,https://github.com/vinta/awesome-python
2023-01-04,python,1542,124,Offensive Software Exploitation Course,ashemery,exploitation-course,https://github.com/ashemery/exploitation-course
2023-01-04,python,57064,38,Open source home automation that puts local control and privacy first.,home-assistant,core,https://github.com/home-assistant/core
2023-01-04,python,27049,137,Stable Diffusion web UI,AUTOMATIC1111,stable-diffusion-webui,https://github.com/AUTOMATIC1111/stable-diffusion-webui
2023-01-04,python,6391,14,NVR with realtime local object detection for IP cameras,blakeblackshear,frigate,https://github.com/blakeblackshear/frigate
2023-01-04,python,2099,35,[NeurIPS 2022] Towards Robust Blind Face Restoration with Codebook Lookup Transformer,sczhou,CodeFormer,https://github.com/sczhou/CodeFormer
2023-01-04,python,5169,17,"A community-supported supercharged version of paperless: scan, index and archive all your physical documents",paperless-ngx,paperless-ngx,https://github.com/paperless-ngx/paperless-ngx
2023-01-04,python,3852,15,WAFW00F allows one to identify and fingerprint Web Application Firewall (WAF) products protecting a website.,EnableSecurity,wafw00f,https://github.com/EnableSecurity/wafw00f
2023-01-04,python,25504,93,GFPGAN aims at developing Practical Algorithms for Real-world Face Restoration.,TencentARC,GFPGAN,https://github.com/TencentARC/GFPGAN
2023-01-04,python,5117,16,An easy and fast way to create a Python GUI,ParthJadhav,Tkinter-Designer,https://github.com/ParthJadhav/Tkinter-Designer
2023-01-04,python,289,7,"This custom component for Home Assistant will add crucial features to your climate-controlling TRV (Thermostatic Radiator Valves) to save you the work of creating automations to make it smart. It combines a room-temperature sensor, window/door sensors, weather forecasts, or an ambient temperature probe to decide when it should call for heat and …",KartoffelToby,better_thermostat,https://github.com/KartoffelToby/better_thermostat
2023-01-04,python,20230,6,"Free, open source crypto trading bot",freqtrade,freqtrade,https://github.com/freqtrade/freqtrade
2023-01-04,python,22547,16,The OWASP Cheat Sheet Series was created to provide a concise collection of high value information on specific application security topics.,OWASP,CheatSheetSeries,https://github.com/OWASP/CheatSheetSeries
2023-01-04,python,14423,8,Optional static typing for Python,python,mypy,https://github.com/python/mypy
2023-01-04,python,4468,10,强国通 科技强国 学习强国 xuexiqiangguo 全网最好用开源网页学习强国助手：TechXueXi （懒人刷分工具 自动学习）技术强国，支持答题，支持 docker 45分/天,TechXueXi,TechXueXi,https://github.com/TechXueXi/TechXueXi
2023-01-04,python,4457,7,Create Reddit Videos with just one command,elebumm,RedditVideoMakerBot,https://github.com/elebumm/RedditVideoMakerBot
2023-01-04,python,7940,14,"A Python framework for creating reproducible, maintainable and modular data science code.",kedro-org,kedro,https://github.com/kedro-org/kedro
2023-01-04,python,8246,26,The Unified Machine Learning Framework,unifyai,ivy,https://github.com/unifyai/ivy
2023-01-04,python,117,9,一木TVBOX自用,xianyuyimu,TVBOX-,https://github.com/xianyuyimu/TVBOX-