date,language,stargazers,starsToday,description,owner,name,url
2022-11-28,rust,337,63,"Secure, Fast and Light remote desktop & file manager tool powered by Tauri and egui.",MirrorX-Desktop,MirrorX,https://github.com/MirrorX-Desktop/MirrorX
2022-11-28,rust,20101,20,"Unofficial Bitwarden compatible server written in Rust, formerly known as bitwarden_rs",dani-garcia,vaultwarden,https://github.com/dani-garcia/vaultwarden
2022-11-28,rust,12507,22,Anki for desktop computers,ankitects,anki,https://github.com/ankitects/anki
2022-11-28,rust,4789,8,"Foundry is a blazing fast, portable and modular toolkit for Ethereum application development written in Rust.",foundry-rs,foundry,https://github.com/foundry-rs/foundry
2022-11-28,rust,25281,32,Rust / Wasm framework for building client web apps,yewstack,yew,https://github.com/yewstack/yew
2022-11-28,rust,10742,8,A fast and secure runtime for WebAssembly,bytecodealliance,wasmtime,https://github.com/bytecodealliance/wasmtime
2022-11-28,rust,357,46,Cairo is the first Turing-complete language for creating provable programs for general computation.,starkware-libs,cairo,https://github.com/starkware-libs/cairo
2022-11-28,rust,2625,132,"Hurl, run and test HTTP requests with plain text.",Orange-OpenSource,hurl,https://github.com/Orange-OpenSource/hurl
2022-11-28,rust,10258,11,An incremental parsing system for programming tools,tree-sitter,tree-sitter,https://github.com/tree-sitter/tree-sitter
2022-11-28,rust,43249,40,"A cross-platform, OpenGL terminal emulator.",alacritty,alacritty,https://github.com/alacritty/alacritty
2022-11-28,rust,86545,23,A modern runtime for JavaScript and TypeScript.,denoland,deno,https://github.com/denoland/deno
2022-11-28,rust,21494,30,"Unified developer tools for JavaScript, TypeScript, and the web",rome,tools,https://github.com/rome/tools
2022-11-28,rust,15777,34,"A scalable, distributed, collaborative, document-graph database, for the realtime web",surrealdb,surrealdb,https://github.com/surrealdb/surrealdb
2022-11-28,rust,7344,23,"Ergonomic and modular web framework built with Tokio, Tower, and Hyper",tokio-rs,axum,https://github.com/tokio-rs/axum
2022-11-28,rust,32018,39,Small exercises to get you used to reading and writing Rust code!,rust-lang,rustlings,https://github.com/rust-lang/rustlings
2022-11-28,rust,74901,38,Empowering everyone to build reliable and efficient software.,rust-lang,rust,https://github.com/rust-lang/rust
2022-11-28,rust,8852,10,"Multi functional app to find duplicates, empty folders, similar images etc.",qarmin,czkawka,https://github.com/qarmin/czkawka
2022-11-28,rust,54509,31,"Build smaller, faster, and more secure desktop applications with a web frontend.",tauri-apps,tauri,https://github.com/tauri-apps/tauri
2022-11-28,rust,4270,9,ElKowars wacky widgets,elkowar,eww,https://github.com/elkowar/eww
2022-11-28,rust,2984,6,Window handling library in pure Rust,rust-windowing,winit,https://github.com/rust-windowing/winit
2022-11-28,rust,8993,12,No Nonsense Neovim Client in Rust,neovide,neovide,https://github.com/neovide/neovide
2022-11-28,rust,11930,15,egui: an easy-to-use immediate mode GUI in Rust that runs on both web and native,emilk,egui,https://github.com/emilk/egui
2022-11-28,rust,1886,8,A Decentralized Operating System for ZK Applications,AleoHQ,snarkOS,https://github.com/AleoHQ/snarkOS
2022-11-28,rust,10952,8,A Rust compiler front-end for IDEs,rust-lang,rust-analyzer,https://github.com/rust-lang/rust-analyzer
2022-11-28,rust,8531,8,A bunch of lints to catch common mistakes and improve your Rust code. Book: https://doc.rust-lang.org/clippy/,rust-lang,rust-clippy,https://github.com/rust-lang/rust-clippy