date,language,stargazers,starsToday,description,owner,name,url
2024-09-25,scala,5817,4,"The Scala 3 compiler, also known as Dotty.",scala,scala3,https://github.com/scala/scala3
2024-09-25,scala,39367,5,Apache Spark - A unified analytics engine for large-scale data processing,apache,spark,https://github.com/apache/spark
2024-09-25,scala,3176,2,Rocket Chip Generator,chipsalliance,rocket-chip,https://github.com/chipsalliance/rocket-chip
2024-09-25,scala,1576,1,"An Agile RISC-V SoC Design Framework with in-order cores, out-of-order cores, accelerators, and more",ucb-bar,chipyard,https://github.com/ucb-bar/chipyard
2024-09-25,scala,1149,0,Gluten is a middle layer responsible for offloading JVM-based SQL engines' execution to native engines.,apache,incubator-gluten,https://github.com/apache/incubator-gluten
2024-09-25,scala,11808,0,CMAK is a tool for managing Apache Kafka clusters,yahoo,CMAK,https://github.com/yahoo/CMAK
2024-09-25,scala,286,0,,ucb-bar,berkeley-hardfloat,https://github.com/ucb-bar/berkeley-hardfloat
2024-09-25,scala,4075,1,"ZIO — A type-safe, composable library for async and concurrent programming in Scala",zio,zio,https://github.com/zio/zio
2024-09-25,scala,7460,2,"An open-source storage framework that enables building a Lakehouse architecture with compute engines including Spark, PrestoDB, Flink, Trino, and Hive and APIs",delta-io,delta,https://github.com/delta-io/delta
2024-09-25,scala,783,0,"A next-generation Scala framework for building scalable, correct, and efficient HTTP clients and servers",zio,zio-http,https://github.com/zio/zio-http
2024-09-25,scala,789,0,Spark RAPIDS plugin - accelerate Apache Spark with GPUs,NVIDIA,spark-rapids,https://github.com/NVIDIA/spark-rapids
2024-09-25,scala,3259,2,"Deequ is a library built on top of Apache Spark for defining ""unit tests for data"", which measure data quality in large datasets.",awslabs,deequ,https://github.com/awslabs/deequ
2024-09-25,scala,461,0,A Spark plugin for reading and writing Excel files,crealytics,spark-excel,https://github.com/crealytics/spark-excel
2024-09-25,scala,988,0,Scientific workflow engine designed for simplicity & scalability. Trivially transition between one off use cases to massive scale production environments,broadinstitute,cromwell,https://github.com/broadinstitute/cromwell
2024-09-25,scala,4724,2,Open-source high-performance RISC-V processor,OpenXiangShan,XiangShan,https://github.com/OpenXiangShan/XiangShan
2024-09-25,scala,2074,0,Apache Kyuubi is a distributed and multi-tenant gateway to provide serverless SQL on data warehouses and lakehouses.,apache,kyuubi,https://github.com/apache/kyuubi
2024-09-25,scala,15092,3,"♞ lichess.org: the forever free, adless and open source chess server ♞",lichess-org,lila,https://github.com/lichess-org/lila
2024-09-25,scala,782,3,Berkeley's Spatial Array Generator,ucb-bar,gemmini,https://github.com/ucb-bar/gemmini
2024-09-25,scala,543,1,"Scala CLI is a command-line tool to interact with the Scala language. It lets you compile, run, test, and package your Scala code (and more!)",VirtusLab,scala-cli,https://github.com/VirtusLab/scala-cli
2024-09-25,scala,881,0,Apache Livy is an open source REST interface for interacting with Apache Spark from anywhere.,apache,incubator-livy,https://github.com/apache/incubator-livy
2024-09-25,scala,796,0,The Daml smart contract language,digital-asset,daml,https://github.com/digital-asset/daml
2024-09-25,scala,12533,0,The Community Maintained High Velocity Web Framework For Java and Scala.,playframework,playframework,https://github.com/playframework/playframework
2024-09-25,scala,11022,2,"Removes large or troublesome blobs like git-filter-branch does, but faster. And written in Scala",rtyley,bfg-repo-cleaner,https://github.com/rtyley/bfg-repo-cleaner