date,language,stargazers,starsToday,description,owner,name,url
2022-10-16,scala,34109,7,Apache Spark - A unified analytics engine for large-scale data processing,apache,spark,https://github.com/apache/spark
2022-10-16,scala,1203,7,"Feathr – An Enterprise-Grade, High Performance Feature Store",feathr-ai,feathr,https://github.com/feathr-ai/feathr
2022-10-16,scala,5295,1,"An open-source storage framework that enables building a Lakehouse architecture with compute engines including Spark, PrestoDB, Flink, Trino, and Hive and APIs",delta-io,delta,https://github.com/delta-io/delta
2022-10-16,scala,3798,0,Simple and Distributed Machine Learning,microsoft,SynapseML,https://github.com/microsoft/SynapseML
2022-10-16,scala,5697,1,Modern Load Testing as Code,gatling,gatling,https://github.com/gatling/gatling
2022-10-16,scala,11055,1,CMAK is a tool for managing Apache Kafka clusters,yahoo,CMAK,https://github.com/yahoo/CMAK
2022-10-16,scala,1241,0,Apache Kyuubi is a distributed and multi-tenant gateway to provide serverless SQL on data warehouses and lakehouses.,apache,incubator-kyuubi,https://github.com/apache/incubator-kyuubi
2022-10-16,scala,722,0,The Daml smart contract language,digital-asset,daml,https://github.com/digital-asset/daml
2022-10-16,scala,2708,0,"Linkis helps easily connect to various back-end computation/storage engines(Spark, Python, TiDB...), exposes various interfaces(REST, JDBC, Java ...), with multi-tenancy, high performance, and resource control.",apache,incubator-linkis,https://github.com/apache/incubator-linkis
2022-10-16,scala,1781,0,Scala language server with rich IDE features,scalameta,metals,https://github.com/scalameta/metals
2022-10-16,scala,4783,2,"Lightweight, modular, and extensible library for functional programming.",typelevel,cats,https://github.com/typelevel/cats
2022-10-16,scala,2381,0,A Scala API for Apache Beam and Google Cloud Dataflow.,spotify,scio,https://github.com/spotify/scio
2022-10-16,scala,13897,0,"Scala 2 compiler and standard library. For bugs, see scala/bug",scala,scala,https://github.com/scala/scala
2022-10-16,scala,563,1,A scala library to write Http apps.,zio,zio-http,https://github.com/zio/zio-http
2022-10-16,scala,210,0,Enabling Continuous Data Processing with Apache Spark and Azure Event Hubs,Azure,azure-event-hubs-spark,https://github.com/Azure/azure-event-hubs-spark
2022-10-16,scala,2674,1,"TheHive: a Scalable, Open Source and Free Security Incident Response Platform",TheHive-Project,TheHive,https://github.com/TheHive-Project/TheHive
2022-10-16,scala,317,0,A Spark plugin for reading and writing Excel files,crealytics,spark-excel,https://github.com/crealytics/spark-excel
2022-10-16,scala,4566,0,"sbt, the interactive build tool",sbt,sbt,https://github.com/sbt/sbt
2022-10-16,scala,855,0,Scientific workflow engine designed for simplicity & scalability. Trivially transition between one off use cases to massive scale production environments,broadinstitute,cromwell,https://github.com/broadinstitute/cromwell
2022-10-16,scala,77,0,FEEL parser and interpreter written in Scala,camunda,feel-scala,https://github.com/camunda/feel-scala
2022-10-16,scala,36,0,Java and Scala SDKs for Kalix,lightbend,kalix-jvm-sdk,https://github.com/lightbend/kalix-jvm-sdk
2022-10-16,scala,12099,5,"♞ lichess.org: the forever free, adless and open source chess server ♞",lichess-org,lila,https://github.com/lichess-org/lila
2022-10-16,scala,201,0,Apache Spark Connector for SQL Server and Azure SQL,microsoft,sql-spark-connector,https://github.com/microsoft/sql-spark-connector
2022-10-16,scala,59,1,"Gobra is an automated, modular verifier for Go programs, based on the Viper verification infrastructure.",viperproject,gobra,https://github.com/viperproject/gobra
2022-10-16,scala,2738,4,Chisel 3: A Modern Hardware Design Language,chipsalliance,chisel3,https://github.com/chipsalliance/chisel3