date,language,stargazers,starsToday,description,owner,name,url
2023-11-21,css,4321,0,"Starter files, final projects and FAQ for my Advanced CSS course",jonasschmedtmann,advanced-css-course,https://github.com/jonasschmedtmann/advanced-css-course
2023-11-21,css,14442,19,"ç»æµå­¦äºº(å«éŸ³é¢‘)ã€çº½çº¦å®¢ã€å«æŠ¥ã€è¿çº¿ã€å¤§è¥¿æ´‹æœˆåˆŠç­‰è‹±è¯­æ‚å¿—å…è´¹ä¸‹è½½,æ”¯æŒepubã€mobiã€pdfæ ¼å¼, æ¯å‘¨æ›´æ–°",hehonghui,awesome-english-ebooks,https://github.com/hehonghui/awesome-english-ebooks
2023-11-21,css,636,1,Documentation for GX mods,opera-gaming,gxmods,https://github.com/opera-gaming/gxmods
2023-11-21,css,4623,1,,safak,youtube,https://github.com/safak/youtube
2023-11-21,css,5233,11,Next Generation Vue UI Component Library,primefaces,primevue,https://github.com/primefaces/primevue
2023-11-21,css,303,1,SSH Panel User Management,xpanel-cp,XPanel-SSH-User-Management,https://github.com/xpanel-cp/XPanel-SSH-User-Management
2023-11-21,css,1359,4,Personal theme for Obsidian,AnubisNekhet,AnuPpuccin,https://github.com/AnubisNekhet/AnuPpuccin
2023-11-21,css,6906,3,A sample Spring-based application,spring-projects,spring-petclinic,https://github.com/spring-projects/spring-petclinic
2023-11-21,css,1143,3,A responsive One-Line CSS Theme for Firefox.,andreasgrafen,cascade,https://github.com/andreasgrafen/cascade
2023-11-21,css,47674,5,Modern CSS framework based on Flexbox,jgthms,bulma,https://github.com/jgthms/bulma
2023-11-21,css,1779,1,"ğŸªº A simple, clean, customizable Hugo theme",nanxiaobei,hugo-paper,https://github.com/nanxiaobei/hugo-paper
2023-11-21,css,408,2,"â­Build a stunning portfolio website with Next.js, Tailwind CSS and Framer-motion. If you want to learn to create this you can follow the tutorial link given in the Read me file.",codebucks27,Next.js-Developer-Portfolio-Starter-Code,https://github.com/codebucks27/Next.js-Developer-Portfolio-Starter-Code
2023-11-21,css,4466,1,A community-driven collection of themes for customizing Spotify through Spicetify - https://github.com/spicetify/spicetify-cli,spicetify,spicetify-themes,https://github.com/spicetify/spicetify-themes
2023-11-21,css,78888,7,ğŸ¿ A cross-browser library of CSS animations. As easy to use as an easy thing.,animate-css,animate.css,https://github.com/animate-css/animate.css
2023-11-21,css,44,0,,firtman,coffeemasters-vanilla,https://github.com/firtman/coffeemasters-vanilla
2023-11-21,css,378,0,AsmrProg Youtube Channel Dashboard Designs Code Collection,AsmrProg-YT,Dashboard-Designs,https://github.com/AsmrProg-YT/Dashboard-Designs
2023-11-21,css,407,1,mingw-w64.net web page contents (The new web page),mingw-w64,mingw-w64.github.io,https://github.com/mingw-w64/mingw-w64.github.io
2023-11-21,css,8686,4,The Most Complete Angular UI Component Library,primefaces,primeng,https://github.com/primefaces/primeng
2023-11-21,css,47824,37,"Iconic font aggregator, collection, & patcher. 3,600+ icons, 50+ patched fonts: Hack, Source Code Pro, more. Glyph collections: Font Awesome, Material Design Icons, Octicons, & more",ryanoasis,nerd-fonts,https://github.com/ryanoasis/nerd-fonts
2023-11-21,css,5297,1,Public documentation for Visual Studio Code,microsoft,vscode-docs,https://github.com/microsoft/vscode-docs
2023-11-21,css,3684,2,Phishing Tool & Information Collector,UndeadSec,SocialFish,https://github.com/UndeadSec/SocialFish
2023-11-21,css,1128,3,A lightweight DIY alternative to services like Linktree.,sethcottle,littlelink,https://github.com/sethcottle/littlelink
2023-11-21,css,3458,2,,john-smilga,javascript-basic-projects,https://github.com/john-smilga/javascript-basic-projects
2023-11-21,css,2967,5,A distraction-free and highly customizable theme for Obsidian.,kepano,obsidian-minimal,https://github.com/kepano/obsidian-minimal
2023-11-21,css,1833,4,"Responsive Portfolio Website Using HTML, CSS & JavaScript",bedimcode,responsive-portfolio-website-Alexa,https://github.com/bedimcode/responsive-portfolio-website-Alexa