date,language,stargazers,starsToday,description,owner,name,url
2023-09-13,scala,1699,2,Apache Kyuubi is a distributed and multi-tenant gateway to provide serverless SQL on data warehouses and lakehouses.,apache,kyuubi,https://github.com/apache/kyuubi
2023-09-13,scala,4439,28,Simple and Distributed Machine Learning,microsoft,SynapseML,https://github.com/microsoft/SynapseML
2023-09-13,scala,3915,1,Open-source high-performance RISC-V processor,OpenXiangShan,XiangShan,https://github.com/OpenXiangShan/XiangShan
2023-09-13,scala,36693,16,Apache Spark - A unified analytics engine for large-scale data processing,apache,spark,https://github.com/apache/spark
2023-09-13,scala,14148,1,Scala 2 compiler and standard library. Bugs at https://github.com/scala/bug; Scala 3 at https://github.com/lampepfl/dotty,scala,scala,https://github.com/scala/scala
2023-09-13,scala,3,0,works,kazua,works,https://github.com/kazua/works
2023-09-13,scala,7,0,"A Lift web app wrapping Dumbster, the fake Smtp Server",Dan-M,dumbsterweb,https://github.com/Dan-M/dumbsterweb
2023-09-13,scala,6141,1,Apache OpenWhisk is an open source serverless cloud platform,apache,openwhisk,https://github.com/apache/openwhisk
2023-09-13,scala,1848,0,The pure asynchronous runtime for Scala,typelevel,cats-effect,https://github.com/typelevel/cats-effect
2023-09-13,scala,664,1,Gluten: Plugin to Double SparkSQL's Performance,oap-project,gluten,https://github.com/oap-project/gluten
2023-09-13,scala,22,0,Rawls service for DSDE,broadinstitute,rawls,https://github.com/broadinstitute/rawls
2023-09-13,scala,38,0,Notebook service,DataBiosphere,leonardo,https://github.com/DataBiosphere/leonardo
2023-09-13,scala,13560,3,"♞ lichess.org: the forever free, adless and open source chess server ♞",lichess-org,lila,https://github.com/lichess-org/lila
2023-09-13,scala,2776,2,Rocket Chip Generator,chipsalliance,rocket-chip,https://github.com/chipsalliance/rocket-chip
2023-09-13,scala,636,0,An open protocol for secure data sharing,delta-io,delta-sharing,https://github.com/delta-io/delta-sharing
2023-09-13,scala,227,0,Enabling Continuous Data Processing with Apache Spark and Azure Event Hubs,Azure,azure-event-hubs-spark,https://github.com/Azure/azure-event-hubs-spark
2023-09-13,scala,2930,1,"Deequ is a library built on top of Apache Spark for defining ""unit tests for data"", which measure data quality in large datasets.",awslabs,deequ,https://github.com/awslabs/deequ
2023-09-13,scala,4686,0,"sbt, the interactive build tool",sbt,sbt,https://github.com/sbt/sbt
2023-09-13,scala,29,0,,broadinstitute,firecloud-orchestration,https://github.com/broadinstitute/firecloud-orchestration
2023-09-13,scala,37,0,workbench identity and access management,broadinstitute,sam,https://github.com/broadinstitute/sam
2023-09-13,scala,562,0,Spark RAPIDS plugin - accelerate Apache Spark with GPUs,NVIDIA,spark-rapids,https://github.com/NVIDIA/spark-rapids
2023-09-13,scala,242,0,Apache Spark Connector for SQL Server and Azure SQL,microsoft,sql-spark-connector,https://github.com/microsoft/sql-spark-connector
2023-09-13,scala,393,0,A Spark plugin for reading and writing Excel files,crealytics,spark-excel,https://github.com/crealytics/spark-excel
2023-09-13,scala,2451,0,"A minimal, idiomatic Scala interface for HTTP",http4s,http4s,https://github.com/http4s/http4s
2023-09-13,scala,101,0,FEEL parser and interpreter written in Scala,camunda,feel-scala,https://github.com/camunda/feel-scala