date,language,stargazers,starsToday,description,owner,name,url
2023-07-13,elixir,72,0,Public database of Elixir security advisories pulled from GitHub Advisory Database,mirego,elixir-security-advisories,https://github.com/mirego/elixir-security-advisories
2023-07-13,elixir,15397,15,"Simple, open-source, lightweight (< 1 KB) and privacy-friendly web analytics alternative to Google Analytics.",plausible,analytics,https://github.com/plausible/analytics
2023-07-13,elixir,5297,3,"Rich, real-time user experiences with server-rendered HTML",phoenixframework,phoenix_live_view,https://github.com/phoenixframework/phoenix_live_view
2023-07-13,elixir,19704,2,Peace of mind from prototype to production,phoenixframework,phoenix,https://github.com/phoenixframework/phoenix
2023-07-13,elixir,132,0,Wrapper around the Erlang crypto module for Elixir.,ntrepid8,ex_crypto,https://github.com/ntrepid8/ex_crypto
2023-07-13,elixir,5779,2,A toolkit for data mapping and language integrated query.,elixir-ecto,ecto,https://github.com/elixir-ecto/ecto
2023-07-13,elixir,2571,2,Blockchain explorer for Ethereum based network and a tool for inspecting and analyzing EVM based blockchains.,blockscout,blockscout,https://github.com/blockscout/blockscout
2023-07-13,elixir,4512,4,WireGuard®-based VPN server and firewall,firezone,firezone,https://github.com/firezone/firezone
2023-07-13,elixir,3656,2,Automate code & data workflows with interactive Elixir notebooks,livebook-dev,livebook,https://github.com/livebook-dev/livebook
2023-07-13,elixir,26,0,US Address Parsing for Elixir.,smashedtoatoms,address_us,https://github.com/smashedtoatoms/address_us
2023-07-13,elixir,188,0,Elixir framework to build your own in-house PaaS,access-company,antikythera,https://github.com/access-company/antikythera
2023-07-13,elixir,21807,5,"Elixir is a dynamic, functional language for building scalable and maintainable applications",elixir-lang,elixir,https://github.com/elixir-lang/elixir
2023-07-13,elixir,740,3,"Crawly, a high-level web crawling & scraping framework for Elixir.",elixir-crawly,crawly,https://github.com/elixir-crawly/crawly
2023-07-13,elixir,954,1,A declarative and extensible framework for building Elixir applications.,ash-project,ash,https://github.com/ash-project/ash
2023-07-13,elixir,5975,1,"Broadcast, Presence, and Postgres Changes via WebSockets",supabase,realtime,https://github.com/supabase/realtime
2023-07-13,elixir,30,2,Madara Explorer. A Starknet Explorer,lambdaclass,madara_explorer,https://github.com/lambdaclass/madara_explorer