date,stargazers,starsToday,description,owner,name,url
2021-12-25,11,1,Azure Quickstart Templates,Azure,azure-quickstart-templates,https://github.com/Azure/azure-quickstart-templates
2021-12-25,6,5,A build system and primary set of packages for Termux.,termux,termux-packages,https://github.com/termux/termux-packages
2021-12-25,8,11,The Mobile Security Testing Guide (MSTG) is a comprehensive manual for mobile app security testing and reverse engineering. It describes the technical processes for verifying the controls listed in the OWASP Mobile Application Security Verification Standard (MASVS).,OWASP,owasp-mstg,https://github.com/OWASP/owasp-mstg
2021-12-25,2,9,A cli tool to browse and play anime,pystardust,ani-cli,https://github.com/pystardust/ani-cli
2021-12-25,265,18,Pure Bash lightweight web server.,remileduc,sherver,https://github.com/remileduc/sherver
2021-12-25,34,21,A black hole for Internet advertisements,pi-hole,pi-hole,https://github.com/pi-hole/pi-hole
2021-12-25,7,14,"Set up your own OpenVPN server on Debian, Ubuntu, Fedora, CentOS or Arch Linux.",angristan,openvpn-install,https://github.com/angristan/openvpn-install
2021-12-25,94,14,Bring bash to the next level,mauro-balades,bash-plusplus,https://github.com/mauro-balades/bash-plusplus
2021-12-25,1,6,Official Zabbix Dockerfiles,zabbix,zabbix-docker,https://github.com/zabbix/zabbix-docker
2021-12-25,24,15,A pure Unix shell script implementing ACME client protocol,acmesh-official,acme.sh,https://github.com/acmesh-official/acme.sh
2021-12-25,138,49,"A delightful community-driven (with 1900+ contributors) framework for managing your zsh configuration. Includes 300+ optional plugins (rails, git, macOS, hub, docker, homebrew, node, php, python, etc), 140+ themes to spice up your morning, and an auto-update tool so that makes it easy to keep up with the latest updates from the community.",ohmyzsh,ohmyzsh,https://github.com/ohmyzsh/ohmyzsh
2021-12-25,3,0,Raspberry Pi & NanoPi R2S/R4S & G-Dock & x86 OpenWrt Compile Project. (Based on Github Action / Daily Update),SuLingGG,OpenWrt-Rpi,https://github.com/SuLingGG/OpenWrt-Rpi
2021-12-25,14,0,Modified OTA for PEX (FanEdition),PixelExtended,OTA,https://github.com/PixelExtended/OTA
2021-12-25,14,3,"OpenVPN road warrior installer for Ubuntu, Debian, AlmaLinux, Rocky Linux, CentOS and Fedora",Nyr,openvpn-install,https://github.com/Nyr/openvpn-install
2021-12-25,7,2,Xray 基于 Nginx 的 VLESS + XTLS 一键安装脚本,wulabing,Xray_onekey,https://github.com/wulabing/Xray_onekey
2021-12-25,6,5,Guide to using YubiKey for GPG and SSH,drduh,YubiKey-Guide,https://github.com/drduh/YubiKey-Guide
2021-12-25,86,0,windows和linux基线检查，配套自动化检查脚本。纯手打。,tangjie1,-Baseline-check,https://github.com/tangjie1/-Baseline-check
2021-12-25,17,7,"Scripts to build your own IPsec VPN server, with IPsec/L2TP, Cisco IPsec and IKEv2",hwdsl2,setup-ipsec-vpn,https://github.com/hwdsl2/setup-ipsec-vpn
2021-12-25,6,1,Go Version Manager,moovweb,gvm,https://github.com/moovweb/gvm
2021-12-25,19,11,Run Mac in a Docker! Run near native OSX-KVM in Docker! X11 Forwarding! CI/CD for OS X!,sickcodes,Docker-OSX,https://github.com/sickcodes/Docker-OSX
2021-12-25,732,5,,sandy1709,nekopack,https://github.com/sandy1709/nekopack
2021-12-25,4,1,Scripted Local Linux Enumeration & Privilege Escalation Checks,rebootuser,LinEnum,https://github.com/rebootuser/LinEnum
2021-12-25,12,4,The Elastic stack (ELK) powered by Docker and Compose.,deviantony,docker-elk,https://github.com/deviantony/docker-elk
2021-12-25,4,2,"Prowler is a security tool to perform AWS security best practices assessments, audits, incident response, continuous monitoring, hardening and forensics readiness. It contains more than 200 controls covering CIS, ISO27001, GDPR, HIPAA, SOC2, ENS and other security frameworks.",toniblyx,prowler,https://github.com/toniblyx/prowler
2021-12-25,269,3,使用Heroku部署Xray高性能代理服务，通过ws传输的 (vmess、vless、trojan shadowsocks、socks)等协议,Lbingyi,HerokuXray,https://github.com/Lbingyi/HerokuXray