date,language,stargazers,starsToday,description,owner,name,url
2024-11-26,r,6537,3,An implementation of the Grammar of Graphics in R,tidyverse,ggplot2,https://github.com/tidyverse/ggplot2
2024-11-26,r,330,0,R toolkit for the analysis of single-cell chromatin data,stuart-lab,signac,https://github.com/stuart-lab/signac
2024-11-26,r,115,0,,r-lib,tree-sitter-r,https://github.com/r-lib/tree-sitter-r
2024-11-26,r,839,1,R Interface to Keras,rstudio,keras3,https://github.com/rstudio/keras3
2024-11-26,r,4586,1,R for data science: a book,hadley,r4ds,https://github.com/hadley/r4ds