date,language,stargazers,starsToday,description,owner,name,url
2022-10-11,php,14047,8,A personal music streaming server that works.,koel,koel,https://github.com/koel/koel
2022-10-11,php,1004,3,"一款基于WordPress开发的高颜值的自适应主题，支持白天与黑夜模式/无刷新加载/第三方登录等众多功能 | A high-value adaptive theme based on WordPress, supports day and night modes, no refresh loading, etc.",Licoy,wordpress-theme-puock,https://github.com/Licoy/wordpress-theme-puock
2022-10-11,php,18760,5,The classic email sending library for PHP,PHPMailer,PHPMailer,https://github.com/PHPMailer/PHPMailer
2022-10-11,php,4372,3,Postman汉化中文版,hlmd,Postman-cn,https://github.com/hlmd/Postman-cn
2022-10-11,php,715,2,Nextcloud AIO stands for Nextcloud All In One and provides easy deployment and maintenance with most features included in this one Nextcloud instance.,nextcloud,all-in-one,https://github.com/nextcloud/all-in-one
2022-10-11,php,6653,2,Damn Vulnerable Web Application (DVWA),digininja,DVWA,https://github.com/digininja/DVWA
2022-10-11,php,3147,4,独角数卡(自动售货系统)-开源站长自动化售货解决方案、高效、稳定、快速！,assimon,dujiaoka,https://github.com/assimon/dujiaoka
2022-10-11,php,211,0,,yankovalenko94,Webdev2019,https://github.com/yankovalenko94/Webdev2019
2022-10-11,php,6777,2,A simple library to work with JSON Web Token and JSON Web Signature,lcobucci,jwt,https://github.com/lcobucci/jwt
2022-10-11,php,4837,3,"A free, self-hostable aggregator…",FreshRSS,FreshRSS,https://github.com/FreshRSS/FreshRSS
2022-10-11,php,9062,2,"Goutte, a simple PHP Web Scraper",FriendsOfPHP,Goutte,https://github.com/FriendsOfPHP/Goutte
2022-10-11,php,1990,0,"Minimal Laravel authentication scaffolding with Blade, Vue, or React + Tailwind.",laravel,breeze,https://github.com/laravel/breeze
2022-10-11,php,4864,5,An Application dashboard and launcher,linuxserver,Heimdall,https://github.com/linuxserver/Heimdall
2022-10-11,php,27503,4,The Symfony PHP framework,symfony,symfony,https://github.com/symfony/symfony
2022-10-11,php,5575,15,Free and Online Accounting Software,akaunting,akaunting,https://github.com/akaunting/akaunting
2022-10-11,php,7612,1,"Twig, the flexible, fast, and secure template language for PHP",twigphp,Twig,https://github.com/twigphp/Twig
2022-10-11,php,2457,2,一个好玩的Web安全-漏洞测试平台,zhuifengshaonianhanlu,pikachu,https://github.com/zhuifengshaonianhanlu/pikachu
2022-10-11,php,9134,4,HTML to PDF converter for PHP,dompdf,dompdf,https://github.com/dompdf/dompdf
2022-10-11,php,15695,2,A PHP parser written in PHP,nikic,PHP-Parser,https://github.com/nikic/PHP-Parser
2022-10-11,php,6211,2,A web interface for MySQL and MariaDB,phpmyadmin,phpmyadmin,https://github.com/phpmyadmin/phpmyadmin
2022-10-11,php,2497,3,Web GUI for youtube-dl,Rudloff,alltube,https://github.com/Rudloff/alltube
2022-10-11,php,4242,3,"Pterodactyl® is a free, open-source game server management panel built with PHP, React, and Go. Designed with security in mind, Pterodactyl runs all game servers in isolated Docker containers while exposing a beautiful and intuitive UI to end users.",pterodactyl,panel,https://github.com/pterodactyl/panel
2022-10-11,php,14487,3,Laravel Debugbar (Integrates PHP Debug Bar),barryvdh,laravel-debugbar,https://github.com/barryvdh/laravel-debugbar
2022-10-11,php,9387,4,A PHP Blogging Platform. Simple and Powerful.,typecho,typecho,https://github.com/typecho/typecho
2022-10-11,php,2912,1,A server software for Minecraft: Bedrock Edition in PHP,pmmp,PocketMine-MP,https://github.com/pmmp/PocketMine-MP