date,language,stargazers,starsToday,description,owner,name,url
2022-10-15,rust,393,119,,smallnest,concurrency-programming-via-rust,https://github.com/smallnest/concurrency-programming-via-rust
2022-10-15,rust,1764,7,"Sui, a next-generation smart contract platform with high throughput, low latency, and an asset-oriented programming model powered by the Move programming language",MystenLabs,sui,https://github.com/MystenLabs/sui
2022-10-15,rust,4906,91,3D and 2D game engine written in Rust,FyroxEngine,Fyrox,https://github.com/FyroxEngine/Fyrox
2022-10-15,rust,42335,31,"A cross-platform, OpenGL terminal emulator.",alacritty,alacritty,https://github.com/alacritty/alacritty
2022-10-15,rust,9311,10,"A safe, extensible ORM and Query Builder for Rust",diesel-rs,diesel,https://github.com/diesel-rs/diesel
2022-10-15,rust,11437,29,A high-performance observability data pipeline.,vectordotdev,vector,https://github.com/vectordotdev/vector
2022-10-15,rust,1117,19,"CYFS is the next-generation technology to build real Web3 by upgrading the basic protocol of Web (TCP/IP+DNS+HTTP),is short for CYberFileSystem. https://www.cyfs.com/, cyfs://cyfs/index_en.html.",buckyos,CYFS,https://github.com/buckyos/CYFS
2022-10-15,rust,7733,15,A data-first Rust-native UI design toolkit.,linebender,druid,https://github.com/linebender/druid
2022-10-15,rust,30106,46,"A lightning-fast search engine that fits effortlessly into your apps, websites, and workflow.",meilisearch,meilisearch,https://github.com/meilisearch/meilisearch
2022-10-15,rust,7321,9,Rust for Windows,microsoft,windows-rs,https://github.com/microsoft/windows-rs
2022-10-15,rust,11017,37,"“连续六年成为全世界最受喜爱的语言，无 GC 也无需手动内存管理、极高的性能和安全性、过程/OO/函数式编程、优秀的包管理、JS 未来基石"" — 工作之余的第二语言来试试 Rust 吧。<<Rust语言圣经>>拥有全面且深入的讲解、生动贴切的示例、德芙般丝滑的内容，甚至还有JS程序员关注的 WASM 和 Deno 等专题。这可能是目前最用心的 Rust 中文学习教程 / Book",sunface,rust-course,https://github.com/sunface/rust-course
2022-10-15,rust,2910,6,Window handling library in pure Rust,rust-windowing,winit,https://github.com/rust-windowing/winit
2022-10-15,rust,3046,6,Application level tracing for Rust.,tokio-rs,tracing,https://github.com/tokio-rs/tracing
2022-10-15,rust,13554,92,"A scalable, distributed, collaborative, document-graph database, for the realtime web",surrealdb,surrealdb,https://github.com/surrealdb/surrealdb
2022-10-15,rust,1325,2,A Decentralized Operating System for Zero-Knowledge Applications,AleoHQ,snarkOS,https://github.com/AleoHQ/snarkOS
2022-10-15,rust,19424,97,Lightning-fast and Powerful Code Editor written in Rust,lapce,lapce,https://github.com/lapce/lapce
2022-10-15,rust,13907,9,Cube — Headless Business Intelligence for Building Data Applications,cube-js,cube.js,https://github.com/cube-js/cube.js
2022-10-15,rust,85831,26,A modern runtime for JavaScript and TypeScript.,denoland,deno,https://github.com/denoland/deno
2022-10-15,rust,2157,23,"An extremely fast Python linter, written in Rust.",charliermarsh,ruff,https://github.com/charliermarsh/ruff
2022-10-15,rust,12659,20,Cross-platform Rust rewrite of the GNU coreutils,uutils,coreutils,https://github.com/uutils/coreutils
2022-10-15,rust,5812,26,bore is a simple CLI tool for making tunnels to localhost,ekzhang,bore,https://github.com/ekzhang/bore
2022-10-15,rust,30128,58,Open source virtual / remote desktop infrastructure for everyone! The open source TeamViewer alternative. Display and control your PC and Android devices from anywhere at anytime.,rustdesk,rustdesk,https://github.com/rustdesk/rustdesk
2022-10-15,rust,19205,21,"Unofficial Bitwarden compatible server written in Rust, formerly known as bitwarden_rs",dani-garcia,vaultwarden,https://github.com/dani-garcia/vaultwarden
2022-10-15,rust,1043,13,A high-performance and strong-extensibility Rust RPC framework that helps developers build microservices.,cloudwego,volo,https://github.com/cloudwego/volo
2022-10-15,rust,29245,29,A curated list of Rust code and resources.,rust-unofficial,awesome-rust,https://github.com/rust-unofficial/awesome-rust