date,language,stargazers,starsToday,description,owner,name,url
2022-10-15,scala,34104,7,Apache Spark - A unified analytics engine for large-scale data processing,apache,spark,https://github.com/apache/spark
2022-10-15,scala,2708,3,"Linkis helps easily connect to various back-end computation/storage engines(Spark, Python, TiDB...), exposes various interfaces(REST, JDBC, Java ...), with multi-tenancy, high performance, and resource control.",apache,incubator-linkis,https://github.com/apache/incubator-linkis
2022-10-15,scala,13897,1,"Scala 2 compiler and standard library. For bugs, see scala/bug",scala,scala,https://github.com/scala/scala
2022-10-15,scala,3044,2,Open-source high-performance RISC-V processor,OpenXiangShan,XiangShan,https://github.com/OpenXiangShan/XiangShan
2022-10-15,scala,5696,5,Modern Load Testing as Code,gatling,gatling,https://github.com/gatling/gatling
2022-10-15,scala,1241,1,Apache Kyuubi is a distributed and multi-tenant gateway to provide serverless SQL on data warehouses and lakehouses.,apache,incubator-kyuubi,https://github.com/apache/incubator-kyuubi
2022-10-15,scala,1196,9,"Feathr – An Enterprise-Grade, High Performance Feature Store",feathr-ai,feathr,https://github.com/feathr-ai/feathr
2022-10-15,scala,5294,4,"An open-source storage framework that enables building a Lakehouse architecture with compute engines including Spark, PrestoDB, Flink, Trino, and Hive and APIs",delta-io,delta,https://github.com/delta-io/delta
2022-10-15,scala,2959,3,State of the Art Natural Language Processing,JohnSnowLabs,spark-nlp,https://github.com/JohnSnowLabs/spark-nlp
2022-10-15,scala,3798,2,Simple and Distributed Machine Learning,microsoft,SynapseML,https://github.com/microsoft/SynapseML
2022-10-15,scala,855,1,Scientific workflow engine designed for simplicity & scalability. Trivially transition between one off use cases to massive scale production environments,broadinstitute,cromwell,https://github.com/broadinstitute/cromwell
2022-10-15,scala,722,0,The Daml smart contract language,digital-asset,daml,https://github.com/digital-asset/daml
2022-10-15,scala,12229,1,Play Framework,playframework,playframework,https://github.com/playframework/playframework
2022-10-15,scala,11054,2,CMAK is a tool for managing Apache Kafka clusters,yahoo,CMAK,https://github.com/yahoo/CMAK
2022-10-15,scala,2380,1,Rocket Chip Generator,chipsalliance,rocket-chip,https://github.com/chipsalliance/rocket-chip
2022-10-15,scala,414,0,"This project provides Apache Spark SQL, RDD, DataFrame and Dataset examples in Scala language",spark-examples,spark-scala-examples,https://github.com/spark-examples/spark-scala-examples
2022-10-15,scala,186,0,,ucb-bar,berkeley-hardfloat,https://github.com/ucb-bar/berkeley-hardfloat
2022-10-15,scala,33,0,workbench identity and access management,broadinstitute,sam,https://github.com/broadinstitute/sam
2022-10-15,scala,563,0,Flexible Intermediate Representation for RTL,chipsalliance,firrtl,https://github.com/chipsalliance/firrtl
2022-10-15,scala,2734,2,Chisel 3: A Modern Hardware Design Language,chipsalliance,chisel3,https://github.com/chipsalliance/chisel3
2022-10-15,scala,2483,0,"Deequ is a library built on top of Apache Spark for defining ""unit tests for data"", which measure data quality in large datasets.",awslabs,deequ,https://github.com/awslabs/deequ
2022-10-15,scala,1,0,,epmartini,command_line.master.g8,https://github.com/epmartini/command_line.master.g8
2022-10-15,scala,8357,0,"A fault tolerant, protocol-agnostic RPC system",twitter,finagle,https://github.com/twitter/finagle
2022-10-15,scala,113,0,RISC-V Torture Test,ucb-bar,riscv-torture,https://github.com/ucb-bar/riscv-torture
2022-10-15,scala,12520,1,"Build highly concurrent, distributed, and resilient message-driven applications on the JVM",akka,akka,https://github.com/akka/akka