date,language,stargazers,starsToday,description,owner,name,url
2022-08-22,python,15610,110,Build cross-modal and multimodal applications on the cloud · Neural Search · Creative AI · Cloud Native,jina-ai,jina,https://github.com/jina-ai/jina
2022-08-22,python,12977,47,Real-ESRGAN aims at developing Practical Algorithms for General Image/Video Restoration.,xinntao,Real-ESRGAN,https://github.com/xinntao/Real-ESRGAN
2022-08-22,python,193501,110,Learn how to design large-scale systems. Prep for the system design interview. Includes Anki flashcards.,donnemartin,system-design-primer,https://github.com/donnemartin/system-design-primer
2022-08-22,python,54469,20,Open source home automation that puts local control and privacy first.,home-assistant,core,https://github.com/home-assistant/core
2022-08-22,python,205982,105,A collective list of free APIs,public-apis,public-apis,https://github.com/public-apis/public-apis
2022-08-22,python,3847,27,Create Reddit Videos with just one command,elebumm,RedditVideoMakerBot,https://github.com/elebumm/RedditVideoMakerBot
2022-08-22,python,244,10,Gradience is a tool for customizing Libadwaita applications and the adw-gtk3 theme.,GradienceTeam,Gradience,https://github.com/GradienceTeam/Gradience
2022-08-22,python,19469,12,We have made you a wrapper you can't refuse,python-telegram-bot,python-telegram-bot,https://github.com/python-telegram-bot/python-telegram-bot
2022-08-22,python,60,11,A Python script to exploit CVE-2022-36446 Software Package Updates RCE (Authenticated) on Webmin < 1.997.,p0dalirius,CVE-2022-36446-Webmin-Software-Package-Updates-RCE,https://github.com/p0dalirius/CVE-2022-36446-Webmin-Software-Package-Updates-RCE
2022-08-22,python,4103,23,Compilation of Resources from TCM's Practical Ethical Hacking Udemy Course,TCM-Course-Resources,Practical-Ethical-Hacking-Resources,https://github.com/TCM-Course-Resources/Practical-Ethical-Hacking-Resources
2022-08-22,python,1336,6,Implementation of Denoising Diffusion Probabilistic Model in Pytorch,lucidrains,denoising-diffusion-pytorch,https://github.com/lucidrains/denoising-diffusion-pytorch
2022-08-22,python,110,17,"Code and data for crosstalk text generation tasks, exploring whether large models and pre-trained language models can understand humor.",anonNo2,crosstalk-generation,https://github.com/anonNo2/crosstalk-generation
2022-08-22,python,722,26,Download media files from a telegram conversation/chat/channel up to 2GiB per file,Dineshkarthik,telegram_media_downloader,https://github.com/Dineshkarthik/telegram_media_downloader
2022-08-22,python,23,5,"Dislock, the most advanced Discord Browser Generator. Powered by hCaptcha Solving AI.",Vinyzu,DiscordGenerator,https://github.com/Vinyzu/DiscordGenerator
2022-08-22,python,112512,35,Command-line program to download videos from YouTube.com and other video sites,ytdl-org,youtube-dl,https://github.com/ytdl-org/youtube-dl
2022-08-22,python,46436,26,Animation engine for explanatory math videos,3b1b,manim,https://github.com/3b1b/manim
2022-08-22,python,3758,5,RSA attack tool (mainly for ctf) - retreive private key from weak public key and/or uncipher data,RsaCtfTool,RsaCtfTool,https://github.com/RsaCtfTool/RsaCtfTool
2022-08-22,python,2487,13,"免费机场 / 免费VPN -> 自动获取免 clash/v2ray/trojan/sr/ssr 订阅链接，间隔12小时持续更新 | 科学上网 | 翻墙",ermaozi,get_subscribe,https://github.com/ermaozi/get_subscribe
2022-08-22,python,3354,4,github release、archive以及项目文件的加速项目,hunshcn,gh-proxy,https://github.com/hunshcn/gh-proxy
2022-08-22,python,504,19,"一账通是一款开源的统一身份认证授权管理解决方案，支持多种标准协议(LDAP, OAuth2, SAML, OpenID)，细粒度权限控制，完整的WEB管理功能，钉钉、企业微信集成等，QQ group: 167885406",longguikeji,arkid,https://github.com/longguikeji/arkid
2022-08-22,python,1968,13,高质量免费节点分享，以及订阅链接收集。,alanbobs999,TopFreeProxies,https://github.com/alanbobs999/TopFreeProxies
2022-08-22,python,138564,103,"A curated list of awesome Python frameworks, libraries, software and resources",vinta,awesome-python,https://github.com/vinta/awesome-python
2022-08-22,python,7486,4,Download market data from Yahoo! Finance's API,ranaroussi,yfinance,https://github.com/ranaroussi/yfinance
2022-08-22,python,6781,6,"Pure Python 3 MTProto API Telegram client library, for bots too!",LonamiWebs,Telethon,https://github.com/LonamiWebs/Telethon
2022-08-22,python,11279,11,An API wrapper for Discord written in Python.,Rapptz,discord.py,https://github.com/Rapptz/discord.py