date,language,stargazers,starsToday,description,owner,name,url
2024-04-07,kotlin,18626,6,Official Jetpack Compose samples.,android,compose-samples,https://github.com/android/compose-samples
2024-04-07,kotlin,3520,6,DuckDuckGo Android App,duckduckgo,Android,https://github.com/duckduckgo/Android
2024-04-07,kotlin,744,4,A Hanime1.me Application for Android.,YenalyLiew,Han1meViewer,https://github.com/YenalyLiew/Han1meViewer
2024-04-07,kotlin,2300,5,"DNS over HTTPS / DNS over Tor / DNSCrypt client, WireGuard proxifier, firewall, and connection tracker for Android.",celzero,rethink-app,https://github.com/celzero/rethink-app
2024-04-07,kotlin,5873,8,SQLDelight - Generates typesafe Kotlin APIs from SQL,cashapp,sqldelight,https://github.com/cashapp/sqldelight
2024-04-07,kotlin,14578,7,"Compose Multiplatform, a modern UI framework for Kotlin that makes building performant and beautiful user interfaces easy and enjoyable.",JetBrains,compose-multiplatform,https://github.com/JetBrains/compose-multiplatform
2024-04-07,kotlin,5005,5,Painless Mobile UI Automation,mobile-dev-inc,maestro,https://github.com/mobile-dev-inc/maestro
2024-04-07,kotlin,2162,0,KotlinX multiplatform date/time library,Kotlin,kotlinx-datetime,https://github.com/Kotlin/kotlinx-datetime
2024-04-07,kotlin,720,0,AWS Toolkit for JetBrains - a plugin for interacting with AWS from JetBrains IDEs,aws,aws-toolkit-jetbrains,https://github.com/aws/aws-toolkit-jetbrains
2024-04-07,kotlin,5070,1,Kotlin multiplatform / multi-format serialization,Kotlin,kotlinx.serialization,https://github.com/Kotlin/kotlinx.serialization
2024-04-07,kotlin,1926,1,"Kotlin Multiplatform lifecycle-aware business logic components (aka BLoCs) with routing (navigation) and pluggable UI (Jetpack Compose, SwiftUI, JS React, etc.)",arkivanov,Decompose,https://github.com/arkivanov/Decompose
2024-04-07,kotlin,7779,5,AnkiDroid: Anki flashcards on Android. Your secret trick to achieve superhuman information retention.,ankidroid,Anki-Android,https://github.com/ankidroid/Anki-Android
2024-04-07,kotlin,8034,5,provides metadata for chains,ethereum-lists,chains,https://github.com/ethereum-lists/chains
2024-04-07,kotlin,5019,1,Development environment for Android Jetpack extension libraries under the androidx namespace. Synchronized with Android Jetpack's primary development branch on AOSP.,androidx,androidx,https://github.com/androidx/androidx
2024-04-07,kotlin,1601,6,"EhViewer overhauled with Material Design 3 and more, forked from https://github.com/Ehviewer-Overhauled/Ehviewer",FooIbar,EhViewer,https://github.com/FooIbar/EhViewer
2024-04-07,kotlin,9317,4,K-9 Mail – Open Source Email App for Android,thunderbird,thunderbird-android,https://github.com/thunderbird/thunderbird-android
2024-04-07,kotlin,3500,4,📲 ChatGPT Android demonstrates a Chatbot application using OpenAI's chat API on Android with Stream Chat SDK for Compose.,skydoves,chatgpt-android,https://github.com/skydoves/chatgpt-android
2024-04-07,kotlin,636,1,Opensource automated insulin delivery system (closed loop),nightscout,AndroidAPS,https://github.com/nightscout/AndroidAPS
2024-04-07,kotlin,1204,1,A free mixin-based injection hacked client for Minecraft using the Fabric API,CCBlueX,LiquidBounce,https://github.com/CCBlueX/LiquidBounce
2024-04-07,kotlin,6042,39,Free and open source manga reader for Android,mihonapp,mihon,https://github.com/mihonapp/mihon
2024-04-07,kotlin,3731,1,Best Material You Design music player for Android,RetroMusicPlayer,RetroMusicPlayer,https://github.com/RetroMusicPlayer/RetroMusicPlayer
2024-04-07,kotlin,2039,11,SD Maid 2/SE is Android's most thorough cleaning tool.,d4rken-org,sdmaid-se,https://github.com/d4rken-org/sdmaid-se
2024-04-07,kotlin,2022,5,📱 Home Assistant Companion for Android,home-assistant,android,https://github.com/home-assistant/android
2024-04-07,kotlin,1112,4,Adds themed icons to Lawnchair.,LawnchairLauncher,lawnicons,https://github.com/LawnchairLauncher/lawnicons
2024-04-07,kotlin,12689,3,Library support for Kotlin coroutines,Kotlin,kotlinx.coroutines,https://github.com/Kotlin/kotlinx.coroutines