date,language,stargazers,starsToday,description,owner,name,url
2023-08-21,php,6291,43,独角数卡(自动售货系统)-开源站长自动化售货解决方案、高效、稳定、快速！,assimon,dujiaoka,https://github.com/assimon/dujiaoka
2023-08-21,php,50,14,Experience the elegance of SpladePanel: effortlessly create sleek dashboards. Harness Laravel Splade's intuitive SPA-building features for seamless speed and visual allure.,abdelmjid-saber,SpladePanel,https://github.com/abdelmjid-saber/SpladePanel
2023-08-21,php,48408,18,"SecLists is the security tester's companion. It's a collection of multiple types of lists used during security assessments, collected in one place. List types include usernames, passwords, URLs, sensitive data patterns, fuzzing payloads, web shells, and many more.",danielmiessler,SecLists,https://github.com/danielmiessler/SecLists
2023-08-21,php,8051,48,Damn Vulnerable Web Application (DVWA),digininja,DVWA,https://github.com/digininja/DVWA
2023-08-21,php,1786,2,个人发卡源码，发卡系统，二次元发卡系统，二次元发卡源码，发卡程序，动漫发卡，PHP发卡源码，异次元发卡,lizhipay,acg-faka,https://github.com/lizhipay/acg-faka
2023-08-21,php,4239,4,"Dolibarr ERP CRM is a modern software package to manage your company or foundation's activity (contacts, suppliers, invoices, orders, stocks, agenda, accounting, ...). It is open source software (written in PHP) and designed for small and medium businesses, foundations and freelancers. You can freely install, use and distribute it as a standalon…",Dolibarr,dolibarr,https://github.com/Dolibarr/dolibarr
2023-08-21,php,1786,1,简单图床 - 一款功能强大无数据库的图床 2.0版,icret,EasyImages2.0,https://github.com/icret/EasyImages2.0
2023-08-21,php,7406,6,Instant Upgrades and Automated Refactoring of any PHP 5.3+ code,rectorphp,rector,https://github.com/rectorphp/rector
2023-08-21,php,19273,2,The PHP Unit Testing framework.,sebastianbergmann,phpunit,https://github.com/sebastianbergmann/phpunit
2023-08-21,php,445,5,"PHP script collects V2Ray subscription links from sources, saves to protocol-specific files",yebekhe,TelegramV2rayCollector,https://github.com/yebekhe/TelegramV2rayCollector
2023-08-21,php,15446,3,Debugbar for Laravel (Integrates PHP Debug Bar),barryvdh,laravel-debugbar,https://github.com/barryvdh/laravel-debugbar
2023-08-21,php,74414,13,"Laravel is a web application framework with expressive, elegant syntax. We’ve already laid the foundation for your next big idea — freeing you to create without sweating the small things.",laravel,laravel,https://github.com/laravel/laravel
2023-08-21,php,554,4,Bot showing the volume and remaining subscription x-ui panel,wizwizdev,wizwizxui-timebot,https://github.com/wizwizdev/wizwizxui-timebot
2023-08-21,php,8309,28,"A collection of beautiful full-stack components for Laravel. The perfect starting point for your next app. Using Livewire, Alpine.js and Tailwind CSS.",filamentphp,filament,https://github.com/filamentphp/filament
2023-08-21,php,2278,5,PHP library for printing to ESC/POS-compatible thermal and impact printers,mike42,escpos-php,https://github.com/mike42/escpos-php
2023-08-21,php,5035,3,Photo Sharing. For Everyone.,pixelfed,pixelfed,https://github.com/pixelfed/pixelfed
2023-08-21,php,4301,1,"ZoneMinder is a free, open source Closed-circuit television software application developed for Linux which supports IP, USB and Analog cameras.",ZoneMinder,zoneminder,https://github.com/ZoneMinder/zoneminder
2023-08-21,php,6521,2,Free and Online Accounting Software,akaunting,akaunting,https://github.com/akaunting/akaunting
2023-08-21,php,18078,2,Liberating Web Analytics. Star us on Github? +1. Matomo is the leading open alternative to Google Analytics that gives you full control over your data. Matomo lets you easily collect data from websites & apps and visualise this data and extract insights. Privacy is built-in. We love Pull Requests!,matomo-org,matomo,https://github.com/matomo-org/matomo
2023-08-21,php,6003,1,Mautic: Open Source Marketing Automation Software.,mautic,mautic,https://github.com/mautic/mautic
2023-08-21,php,5204,5,"Pterodactyl® is a free, open-source game server management panel built with PHP, React, and Go. Designed with security in mind, Pterodactyl runs all game servers in isolated Docker containers while exposing a beautiful and intuitive UI to end users.",pterodactyl,panel,https://github.com/pterodactyl/panel
2023-08-21,php,3524,6,"Laragon is a portable, isolated, fast & powerful universal development environment for PHP, Node.js, Python, Java, Go, Ruby. It is fast, lightweight, easy-to-use and easy-to-extend.",leokhoa,laragon,https://github.com/leokhoa/laragon
2023-08-21,php,3117,2,A server software for Minecraft: Bedrock Edition in PHP,pmmp,PocketMine-MP,https://github.com/pmmp/PocketMine-MP
2023-08-21,php,2019,0,PHP Compatibility check for PHP_CodeSniffer,PHPCompatibility,PHPCompatibility,https://github.com/PHPCompatibility/PHPCompatibility
2023-08-21,php,590,0,SSH User Management With Add/Delete Users - Online Users - Limit Users,HamedAp,Ssh-User-management,https://github.com/HamedAp/Ssh-User-management