date,language,stargazers,starsToday,description,owner,name,url
2023-10-08,lua,1437,5,,josean-dev,dev-environment-files,https://github.com/josean-dev/dev-environment-files
2023-10-08,lua,575,1,A community repository of common plugin specifications,AstroNvim,astrocommunity,https://github.com/AstroNvim/astrocommunity
2023-10-08,lua,4665,13,Modernity meets insane extensibility. The future of organizing your life in Neovim.,nvim-neorg,neorg,https://github.com/nvim-neorg/neorg
2023-10-08,lua,36014,9,🦍 The Cloud-Native API Gateway,Kong,kong,https://github.com/Kong/kong
2023-10-08,lua,77,8,Neovim plugin to generate text using LLMs with customizable prompts,David-Kunz,gen.nvim,https://github.com/David-Kunz/gen.nvim
2023-10-08,lua,1027,2,Smooth scrolling neovim plugin written in lua,karb94,neoscroll.nvim,https://github.com/karb94/neoscroll.nvim
2023-10-08,lua,8179,9,Quickstart configs for Nvim LSP,neovim,nvim-lspconfig,https://github.com/neovim/nvim-lspconfig
2023-10-08,lua,3565,2,Git integration for buffers,lewis6991,gitsigns.nvim,https://github.com/lewis6991/gitsigns.nvim
2023-10-08,lua,4405,4,A blazing fast and easy to configure neovim statusline plugin written in pure lua.,nvim-lualine,lualine.nvim,https://github.com/nvim-lualine/lualine.nvim
2023-10-08,lua,3867,1,Debug Adapter Protocol client implementation for Neovim,mfussenegger,nvim-dap,https://github.com/mfussenegger/nvim-dap
2023-10-08,lua,2613,3,A language server that offers Lua language support - programmed in Lua,LuaLS,lua-language-server,https://github.com/LuaLS/lua-language-server
2023-10-08,lua,5612,5,A file explorer tree for neovim written in lua,nvim-tree,nvim-tree.lua,https://github.com/nvim-tree/nvim-tree.lua
2023-10-08,lua,1471,3,Fully featured & enhanced replacement for copilot.vim complete with API for interacting with Github Copilot,zbirenbaum,copilot.lua,https://github.com/zbirenbaum/copilot.lua
2023-10-08,lua,13628,3,"An ebook reader application supporting PDF, DjVu, EPUB, FB2 and many more formats, running on Cervantes, Kindle, Kobo, PocketBook and Android devices",koreader,koreader,https://github.com/koreader/koreader
2023-10-08,lua,2082,3,Add/change/delete surrounding delimiter pairs with ease. Written with ❤️ in Lua.,kylechui,nvim-surround,https://github.com/kylechui/nvim-surround
2023-10-08,lua,37,2,An admin menu for QBCore.,Project-Sloth,ps-adminmenu,https://github.com/Project-Sloth/ps-adminmenu
2023-10-08,lua,3247,1,Get your data in RAM. Get compute close to data. Enjoy the performance.,tarantool,tarantool,https://github.com/tarantool/tarantool
2023-10-08,lua,11447,12,"Find, Filter, Preview, Pick. All lua, all the time.",nvim-telescope,telescope.nvim,https://github.com/nvim-telescope/telescope.nvim
2023-10-08,lua,2030,2,Tools for better development in rust using neovim's builtin lsp,simrat39,rust-tools.nvim,https://github.com/simrat39/rust-tools.nvim
2023-10-08,lua,225,0,Canary Server 13.x for OpenTibia community.,opentibiabr,canary,https://github.com/opentibiabr/canary
2023-10-08,lua,2862,3,"💥 Highly experimental plugin that completely replaces the UI for messages, cmdline and the popupmenu.",folke,noice.nvim,https://github.com/folke/noice.nvim
2023-10-08,lua,8171,10,Neovim config for the lazy,LazyVim,LazyVim,https://github.com/LazyVim/LazyVim
2023-10-08,lua,640,1,enhanced increment/decrement plugin for Neovim.,monaqa,dial.nvim,https://github.com/monaqa/dial.nvim
2023-10-08,lua,1093,5,🧘 Distraction-free coding for Neovim,folke,zen-mode.nvim,https://github.com/folke/zen-mode.nvim
2023-10-08,lua,466,0,"Interactively select and swap function arguments, list elements, and much more. Powered by tree-sitter.",mizlan,iswap.nvim,https://github.com/mizlan/iswap.nvim