date,language,stargazers,starsToday,description,owner,name,url
2024-08-15,rust,3262,875,A web browser that plays old world blues to build new world hope,versotile-org,verso,https://github.com/versotile-org/verso
2024-08-15,rust,70208,252,"An open-source remote desktop application designed for self-hosting, as an alternative to TeamViewer.",rustdesk,rustdesk,https://github.com/rustdesk/rustdesk
2024-08-15,rust,16034,155,A GPU-accelerated cross-platform terminal emulator and multiplexer written by @wez and implemented in Rust,wez,wezterm,https://github.com/wez/wezterm
2024-08-15,rust,35833,161,"Unofficial Bitwarden compatible server written in Rust, formerly known as bitwarden_rs",dani-garcia,vaultwarden,https://github.com/dani-garcia/vaultwarden
2024-08-15,rust,19797,34,"Fullstack app framework for web, desktop, mobile, and more.",DioxusLabs,dioxus,https://github.com/DioxusLabs/dioxus
2024-08-15,rust,27376,88,"Servo, the embeddable, independent, memory-safe, modular, parallel web rendering engine",servo,servo,https://github.com/servo/servo
2024-08-15,rust,1554,83,High performance HTML and CSS renderer powered by WGPU,DioxusLabs,blitz,https://github.com/DioxusLabs/blitz
2024-08-15,rust,5742,7,Apache DataFusion SQL Query Engine,apache,datafusion,https://github.com/apache/datafusion
2024-08-15,rust,15919,21,"An extremely fast Python package installer and resolver, written in Rust.",astral-sh,uv,https://github.com/astral-sh/uv
2024-08-15,rust,7683,14,Fast Rust bundler for JavaScript/TypeScript with Rollup-compatible API.,rolldown,rolldown,https://github.com/rolldown/rolldown
2024-08-15,rust,25782,13,"Build system optimized for JavaScript and TypeScript, written in Rust",vercel,turborepo,https://github.com/vercel/turborepo
2024-08-15,rust,460,22,Build Postgres replication apps in Rust,supabase,pg_replicate,https://github.com/supabase/pg_replicate
2024-08-15,rust,7546,0,Facilitating high-level interactions between Wasm modules and JavaScript,rustwasm,wasm-bindgen,https://github.com/rustwasm/wasm-bindgen
2024-08-15,rust,93663,14,A modern runtime for JavaScript and TypeScript.,denoland,deno,https://github.com/denoland/deno
2024-08-15,rust,55193,24,"A cross-platform, OpenGL terminal emulator.",alacritty,alacritty,https://github.com/alacritty/alacritty
2024-08-15,rust,18344,4,"🚀 The leading Wasm Runtime supporting WASIX, WASI and Emscripten",wasmerio,wasmer,https://github.com/wasmerio/wasmer
2024-08-15,rust,13370,24,"A toolchain for web projects, aimed to provide functionalities to maintain them. Biome offers formatter and linter, usable via CLI and LSP.",biomejs,biome,https://github.com/biomejs/biome
2024-08-15,rust,27072,35,This is the Rust course used by the Android team at Google. It provides you the material to quickly teach Rust.,google,comprehensive-rust,https://github.com/google/comprehensive-rust
2024-08-15,rust,28601,23,"Dataframes powered by a multithreaded, vectorized query engine, written in Rust",pola-rs,polars,https://github.com/pola-rs/polars
2024-08-15,rust,9208,4,🥧 Savoury implementation of the QUIC transport protocol and HTTP/3,cloudflare,quiche,https://github.com/cloudflare/quiche
2024-08-15,rust,8807,3,💥 Fast State-of-the-Art Tokenizers optimized for Research and Production,huggingface,tokenizers,https://github.com/huggingface/tokenizers
2024-08-15,rust,21002,12,"Actix Web is a powerful, pragmatic, and extremely fast web framework for Rust.",actix,actix-web,https://github.com/actix/actix-web