date,language,stargazers,starsToday,description,owner,name,url
2022-02-06,php,36758,18,"SecLists is the security tester's companion. It's a collection of multiple types of lists used during security assessments, collected in one place. List types include usernames, passwords, URLs, sensitive data patterns, fuzzing payloads, web shells, and many more.",danielmiessler,SecLists,https://github.com/danielmiessler/SecLists
2022-02-06,php,8583,9,A platform to create documentation/wiki content built with PHP & Laravel,BookStackApp,BookStack,https://github.com/BookStackApp/BookStack
2022-02-06,php,2363,5,"GLPI is a Free Asset and IT Management Software package, Data center management, ITIL Service Desk, licenses tracking and software auditing.",glpi-project,glpi,https://github.com/glpi-project/glpi
2022-02-06,php,4646,2,A static analysis tool for finding errors in PHP applications,vimeo,psalm,https://github.com/vimeo/psalm
2022-02-06,php,1374,3,"A great looking and easy-to-use photo-management-system you can run on your server, to manage and share photos.",LycheeOrg,Lychee,https://github.com/LycheeOrg/Lychee
2022-02-06,php,9132,0,PHP_CodeSniffer tokenizes PHP files and detects violations of a defined set of coding standards.,squizlabs,PHP_CodeSniffer,https://github.com/squizlabs/PHP_CodeSniffer
2022-02-06,php,1715,0,"Enable AMP on your WordPress site, the WordPress way.",ampproject,amp-wp,https://github.com/ampproject/amp-wp
2022-02-06,php,4959,4,Mautic: Open Source Marketing Automation Software.,mautic,mautic,https://github.com/mautic/mautic
2022-02-06,php,1565,1,"Kimai v2 is a web-based multiuser time-tracking application. Free for everyone: freelancers, agencies, companies, organizations - all can track their times, generate invoices and more. SaaS version available at https://www.kimai.cloud",kevinpapst,kimai2,https://github.com/kevinpapst/kimai2
2022-02-06,php,111,34,This package wraps up the standalone executable version of the Tailwind CSS framework for a Laravel application.,tonysm,tailwindcss-laravel,https://github.com/tonysm/tailwindcss-laravel
2022-02-06,php,6422,3,Kanban project management software,kanboard,kanboard,https://github.com/kanboard/kanboard
2022-02-06,php,3767,1,HTML and Form Builders for the Laravel Framework,LaravelCollective,html,https://github.com/LaravelCollective/html
2022-02-06,php,9878,2,"All Submissions you make to Magento Inc. (""Magento"") through GitHub are subject to the following terms and conditions: (1) You grant Magento a perpetual, worldwide, non-exclusive, no charge, royalty free, irrevocable license under your applicable copyrights and patents to reproduce, prepare derivative works of, display, publically perform, subli…",magento,magento2,https://github.com/magento/magento2
2022-02-06,php,7412,0,"Twig, the flexible, fast, and secure template language for PHP",twigphp,Twig,https://github.com/twigphp/Twig
2022-02-06,php,3958,1,"A free, self-hostable aggregator…",FreshRSS,FreshRSS,https://github.com/FreshRSS/FreshRSS
2022-02-06,php,823,0,[Community Development Repository] The open source Product Information Management (PIM),akeneo,pim-community-dev,https://github.com/akeneo/pim-community-dev
2022-02-06,php,1199,3,"WordPress Develop, Git-ified. Synced from git://develop.git.wordpress.org/, including branches and tags! This repository is just a mirror of the WordPress subversion repository. Please include a link to a pre-existing ticket on https://core.trac.wordpress.org/ with every pull request.",WordPress,wordpress-develop,https://github.com/WordPress/wordpress-develop
2022-02-06,php,12532,3,An open source status page system for everyone.,CachetHQ,Cachet,https://github.com/CachetHQ/Cachet
2022-02-06,php,10526,3,Supercharged Excel exports and imports in Laravel,SpartnerNL,Laravel-Excel,https://github.com/SpartnerNL/Laravel-Excel
2022-02-06,php,1359,2,FreeScout — Free self-hosted help desk & shared mailbox (Zendesk / Help Scout alternative),freescout-helpdesk,freescout,https://github.com/freescout-helpdesk/freescout
2022-02-06,php,3200,1,Official clone of PHP library to generate PDF documents and barcodes,tecnickcom,TCPDF,https://github.com/tecnickcom/TCPDF
2022-02-06,php,3550,3,MISP (core software) - Open Source Threat Intelligence and Sharing Platform,MISP,MISP,https://github.com/MISP/MISP
2022-02-06,php,701,4,Generate API documentation for humans from your Laravel codebase.,knuckleswtf,scribe,https://github.com/knuckleswtf/scribe
2022-02-06,php,17658,7,The classic email sending library for PHP,PHPMailer,PHPMailer,https://github.com/PHPMailer/PHPMailer
2022-02-06,php,3464,3,"EasyAdmin is a fast, beautiful and modern admin generator for Symfony applications.",EasyCorp,EasyAdminBundle,https://github.com/EasyCorp/EasyAdminBundle