date,language,stargazers,starsToday,description,owner,name,url
2022-11-17,vue,2505,20,Geeker Admin，基于 Vue3.2、TypeScript、Vite2、Pinia、Element-Plus 开源的一套后台管理框架。,HalseySpicy,Geeker-Admin,https://github.com/HalseySpicy/Geeker-Admin
2022-11-17,vue,14864,14,"A modern vue admin. It is based on Vue3, vite and TypeScript. It's fast！",vbenjs,vue-vben-admin,https://github.com/vbenjs/vue-vben-admin
2022-11-17,vue,3590,1,uView UI，是uni-app生态最优秀的UI框架，全面的组件和便捷的工具会让您信手拈来，如鱼得水,umicro,uView,https://github.com/umicro/uView
2022-11-17,vue,8986,1,Free and Beautiful Vue 3 Admin Template,epicmaxco,vuestic-admin,https://github.com/epicmaxco/vuestic-admin
2022-11-17,vue,79474,30,A magical vue admin https://panjiachen.github.io/vue-element-admin,PanJiaChen,vue-element-admin,https://github.com/PanJiaChen/vue-element-admin
2022-11-17,vue,52839,8,A Vue.js 2.0 UI Toolkit for Web,ElemeFE,element,https://github.com/ElemeFE/element
2022-11-17,vue,3115,5,"Naive Ui Admin 是一个基于 vue3,vite2,TypeScript 的中后台解决方案，它使用了最新的前端技术栈，并提炼了典型的业务模型，页面，包括二次封装组件、动态菜单、权限校验、粒子化权限控制等功能，它可以帮助你快速搭建企业级中后台项目，相信不管是从新技术使用还是其他方面，都能帮助到你，持续更新中。",jekip,naive-ui-admin,https://github.com/jekip/naive-ui-admin
2022-11-17,vue,17779,13,A Vue.js 3 UI Library made by Element team,element-plus,element-plus,https://github.com/element-plus/element-plus
2022-11-17,vue,17382,7,An enterprise-class UI components based on Ant Design and Vue.,vueComponent,ant-design-vue,https://github.com/vueComponent/ant-design-vue
2022-11-17,vue,779,3,A TMDB client built with Nuxt 3,nuxt,movies,https://github.com/nuxt/movies
2022-11-17,vue,48271,39,Open source API development ecosystem - https://hoppscotch.io,hoppscotch,hoppscotch,https://github.com/hoppscotch/hoppscotch
2022-11-17,vue,2728,6,,CareyWang,sub-web,https://github.com/CareyWang/sub-web
2022-11-17,vue,3223,2,Ant Design Pro's implementation with Vue,iczer,vue-antd-admin,https://github.com/iczer/vue-antd-admin
2022-11-17,vue,2692,8,All-inclusive Python cheatsheet,wilfredinni,python-cheatsheet,https://github.com/wilfredinni/python-cheatsheet
2022-11-17,vue,1705,0,"Web-based image segmentation tool for object detection, localization, and keypoints",jsbroks,coco-annotator,https://github.com/jsbroks/coco-annotator
2022-11-17,vue,10194,2,mall-admin-web是一个电商后台管理系统的前端项目，基于Vue+Element实现。 主要包括商品管理、订单管理、会员管理、促销管理、运营管理、内容管理、统计报表、财务管理、权限管理、设置等功能。,macrozheng,mall-admin-web,https://github.com/macrozheng/mall-admin-web
2022-11-17,vue,814,2,A powerful form designer for Vue.,vform666,variant-form,https://github.com/vform666/variant-form
2022-11-17,vue,738,4,JEECG BOOT APP 移动解决方案，采用uniapp框架，一份代码多终端适配，同时支持APP、小程序、H5！实现了与JeecgBoot平台完美对接的移动解决方案！目前已经实现登录、用户信息、通讯录、公告、移动首页、九宫格等基础功能。,jeecgboot,jeecg-uniapp,https://github.com/jeecgboot/jeecg-uniapp
2022-11-17,vue,447,6,Datepicker component for Vue 3,Vuepic,vue-datepicker,https://github.com/Vuepic/vue-datepicker
2022-11-17,vue,1654,12,"A fresh and elegant admin template, based on Vue3,Vite3,TypeScript,NaiveUI and UnoCSS [一个基于Vue3、Vite3、TypeScript、NaiveUI 和 UnoCSS的清新优雅的中后台模版]",honghuangdc,soybean-admin,https://github.com/honghuangdc/soybean-admin
2022-11-17,vue,6004,7,A very simple static homepage for your server.,bastienwirtz,homer,https://github.com/bastienwirtz/homer
2022-11-17,vue,1496,2,A local UI tool for visualizing your Tailwind CSS configuration file.,rogden,tailwind-config-viewer,https://github.com/rogden/tailwind-config-viewer
2022-11-17,vue,0,0,,patriciads17,vue-firebase,https://github.com/patriciads17/vue-firebase
2022-11-17,vue,3,1,Quick general weighted average calculator for PSHS & college students,jareddantis,gwa-calc,https://github.com/jareddantis/gwa-calc
2022-11-17,vue,2238,24,基于Golang的开源社区系统。,mlogclub,bbs-go,https://github.com/mlogclub/bbs-go