date,stargazers,starsToday,description,owner,name,url
2021-12-22,3,1,"An open-source storage layer that brings scalable, ACID transactions to Apache Spark™ and big data workloads.",delta-io,delta,https://github.com/delta-io/delta
2021-12-22,10,11,"♞ lichess.org: the forever free, adless and open source chess server ♞",ornicar,lila,https://github.com/ornicar/lila
2021-12-22,691,4,"Make Flink|Spark easier!!! The original intention of StreamX is to make the development of Flink easier. StreamX focuses on the management of development phases and tasks. Our ultimate goal is to build a one-stop big data solution integrating stream processing, batch processing, data warehouse and data laker.",streamxhub,streamx,https://github.com/streamxhub/streamx
2021-12-22,4,4,"The Scala 3 compiler, also known as Dotty.",lampepfl,dotty,https://github.com/lampepfl/dotty
2021-12-22,938,1,A bot that helps you keep your Scala projects up-to-date,scala-steward-org,scala-steward,https://github.com/scala-steward-org/scala-steward
2021-12-22,11,5,"Build highly concurrent, distributed, and resilient message-driven applications on the JVM",akka,akka,https://github.com/akka/akka
2021-12-22,2,3,Chisel 3: A Modern Hardware Design Language,chipsalliance,chisel3,https://github.com/chipsalliance/chisel3
2021-12-22,2,1,"TheHive: a Scalable, Open Source and Free Security Incident Response Platform",TheHive-Project,TheHive,https://github.com/TheHive-Project/TheHive
2021-12-22,2,1,Open-source high-performance RISC-V processor,OpenXiangShan,XiangShan,https://github.com/OpenXiangShan/XiangShan
2021-12-22,1,1,Scala language server with rich IDE features,scalameta,metals,https://github.com/scalameta/metals
2021-12-22,116,0,"Open, Modular, Deep Learning Accelerator",apache,tvm-vta,https://github.com/apache/tvm-vta
2021-12-22,82,0,Repository for chisel3 testers2 open alpha,ucb-bar,chisel-testers2,https://github.com/ucb-bar/chisel-testers2
2021-12-22,52,0,A STAC/OGC API Features Web Service,azavea,franklin,https://github.com/azavea/franklin
2021-12-22,2,2,Scala Language Integrated Connection Kit. Slick is a modern database query and access library for Scala,slick,slick,https://github.com/slick/slick
2021-12-22,1,0,Compile-time Language Integrated Queries for Scala,zio,zio-quill,https://github.com/zio/zio-quill
2021-12-22,31,8,Apache Spark - A unified analytics engine for large-scale data processing,apache,spark,https://github.com/apache/spark
2021-12-22,747,0,A Thrift parser/generator,twitter,scrooge,https://github.com/twitter/scrooge
2021-12-22,1,0,Protocol buffer compiler for Scala.,scalapb,ScalaPB,https://github.com/scalapb/ScalaPB
2021-12-22,1,0,Twitter-Server defines a template from which services at Twitter are built,twitter,twitter-server,https://github.com/twitter/twitter-server
2021-12-22,12,2,Play Framework,playframework,playframework,https://github.com/playframework/playframework
2021-12-22,2,1,Spark: The Definitive Guide's Code Repository,databricks,Spark-The-Definitive-Guide,https://github.com/databricks/Spark-The-Definitive-Guide
2021-12-22,647,0,The Daml smart contract language,digital-asset,daml,https://github.com/digital-asset/daml
2021-12-22,175,0,Enabling Continuous Data Processing with Apache Spark and Azure Event Hubs,Azure,azure-event-hubs-spark,https://github.com/Azure/azure-event-hubs-spark
2021-12-22,3,1,"ZIO — A type-safe, composable library for async and concurrent programming in Scala",zio,zio,https://github.com/zio/zio
2021-12-22,6,0,Snowflake is a network service for generating unique ID numbers at high scale with some simple guarantees.,twitter-archive,snowflake,https://github.com/twitter-archive/snowflake