date,language,stargazers,starsToday,description,owner,name,url
2023-01-06,kotlin,28648,12,Alibaba Java Coding Guidelines pmd implements and IDE plugin,alibaba,p3c,https://github.com/alibaba/p3c
2023-01-06,kotlin,773,21,ChatGPT Android demonstrates OpenAI's ChatGPT on Android with Stream Chat SDK for Compose.,skydoves,chatgpt-android,https://github.com/skydoves/chatgpt-android
2023-01-06,kotlin,2848,8,"Modernized and sophisticated tooltips, fully customizable with an arrow and animations for Android.",skydoves,Balloon,https://github.com/skydoves/Balloon
2023-01-06,kotlin,6777,8,Kotlin SQL Framework,JetBrains,Exposed,https://github.com/JetBrains/Exposed
2023-01-06,kotlin,43369,5,"Square’s meticulous HTTP client for the JVM, Android, and GraalVM.",square,okhttp,https://github.com/square/okhttp
2023-01-06,kotlin,5211,13,The 2022 Android Developer Roadmap suggests learning paths to understanding Android development.,skydoves,android-developer-roadmap,https://github.com/skydoves/android-developer-roadmap
2023-01-06,kotlin,2549,1,GraphQL for Java with Spring Boot made easy.,Netflix,dgs-framework,https://github.com/Netflix/dgs-framework
2023-01-06,kotlin,20310,21,Free and open source manga reader for Android.,tachiyomiorg,tachiyomi,https://github.com/tachiyomiorg/tachiyomi
2023-01-06,kotlin,33213,8,A shadowsocks client for Android,shadowsocks,shadowsocks-android,https://github.com/shadowsocks/shadowsocks-android
2023-01-06,kotlin,275,10,A custom Compose layout backed by a physics engine,KlassenKonstantin,ComposePhysicsLayout,https://github.com/KlassenKonstantin/ComposePhysicsLayout
2023-01-06,kotlin,28137,4,A memory leak detection library for Android.,square,leakcanary,https://github.com/square/leakcanary
2023-01-06,kotlin,5079,2,Static code analysis for Kotlin,detekt,detekt,https://github.com/detekt/detekt
2023-01-06,kotlin,547,0,Mapbox Navigation SDK for Android,mapbox,mapbox-navigation-android,https://github.com/mapbox/mapbox-navigation-android
2023-01-06,kotlin,3388,5,A Kotlin API for generating .kt source files.,square,kotlinpoet,https://github.com/square/kotlinpoet
2023-01-06,kotlin,9436,10,Translation plugin for IntelliJ based IDEs/Android Studio/HUAWEI DevEco Studio.,YiiGuxing,TranslationPlugin,https://github.com/YiiGuxing/TranslationPlugin
2023-01-06,kotlin,4076,14,provides metadata for networkIDs and chainIDs,ethereum-lists,chains,https://github.com/ethereum-lists/chains
2023-01-06,kotlin,633,2,AWS Toolkit for JetBrains - a plugin for interacting with AWS from JetBrains IDEs,aws,aws-toolkit-jetbrains,https://github.com/aws/aws-toolkit-jetbrains
2023-01-06,kotlin,382,1,Android examples,velmurugan-murugesan,Android-Example,https://github.com/velmurugan-murugesan/Android-Example
2023-01-06,kotlin,5830,9,哔哩漫游，解除B站客户端番剧区域限制的Xposed模块，并且提供其他小功能。An Xposed module that unblocks bangumi area limit of BILIBILI with miscellaneous features.,yujincheng08,BiliRoaming,https://github.com/yujincheng08/BiliRoaming
2023-01-06,kotlin,2925,10,Painless Mobile UI Automation,mobile-dev-inc,maestro,https://github.com/mobile-dev-inc/maestro
2023-01-06,kotlin,249,9,哔哩哔哩 的第三方 Android TV 应用,aaa1115910,bv,https://github.com/aaa1115910/bv
2023-01-06,kotlin,9165,13,A fully functional Android app built entirely with Kotlin and Jetpack Compose,android,nowinandroid,https://github.com/android/nowinandroid
2023-01-06,kotlin,12351,13,"Legado 3.0 Book Reader with powerful controls & full functions阅读3.0, 阅读是一款可以自定义来源阅读网络内容的工具，为广大网络文学爱好者提供一种方便、快捷舒适的试读体验。",gedoor,legado,https://github.com/gedoor/legado
2023-01-06,kotlin,10665,8,Framework for quickly creating connected applications in Kotlin with minimal effort,ktorio,ktor,https://github.com/ktorio/ktor
2023-01-06,kotlin,3419,5,A highly customizable calendar view and compose library for Android.,kizitonwose,Calendar,https://github.com/kizitonwose/Calendar