date,language,stargazers,starsToday,description,owner,name,url
2023-02-02,perl,14203,8,Stack trace visualizer,brendangregg,FlameGraph,https://github.com/brendangregg/FlameGraph
2023-02-02,perl,7932,1,MySQLTuner is a script written in Perl that will assist you with your MySQL configuration and make recommendations for increased performance and stability.,major,MySQLTuner-perl,https://github.com/major/MySQLTuner-perl
2023-02-02,perl,1,0,Tracking satellites using TLEs and Perl (KML/Google Earth output),ttfnrob,SatelliteTracking,https://github.com/ttfnrob/SatelliteTracking
2023-02-02,perl,42,0,Perl-Belkin-WeMo-API,ericblue,Perl-Belkin-WeMo-API,https://github.com/ericblue/Perl-Belkin-WeMo-API
2023-02-02,perl,6421,7,Nikto web server scanner,sullo,nikto,https://github.com/sullo/nikto
2023-02-02,perl,286,0,"The Open Charge Point Interface (OCPI) allows for a scalable, automated roaming setup between Charge Point Operators and e-Mobility Service Providers. It supports authorisation, charge point information exchange (incl transaction events), charge detail record exchange and finally, the exchange of smart-charging commands between parties.",ocpi,ocpi,https://github.com/ocpi/ocpi
2023-02-02,perl,2374,0,OWASP ModSecurity Core Rule Set (CRS) Project (Official Repository),SpiderLabs,owasp-modsecurity-crs,https://github.com/SpiderLabs/owasp-modsecurity-crs
2023-02-02,perl,1192,1,ModSecurity v3 Nginx Connector,SpiderLabs,ModSecurity-nginx,https://github.com/SpiderLabs/ModSecurity-nginx
2023-02-02,perl,359,0,The Ensembl Variant Effect Predictor predicts the functional effects of genomic variants,Ensembl,ensembl-vep,https://github.com/Ensembl/ensembl-vep
2023-02-02,perl,696,1,Trinity RNA-Seq de novo transcriptome assembly,trinityrnaseq,trinityrnaseq,https://github.com/trinityrnaseq/trinityrnaseq
2023-02-02,perl,834,1,"Ora2Pg is a free tool used to migrate an Oracle database to a PostgreSQL compatible schema. It connects your Oracle database, scan it automatically and extracts its structure or data, it then generates SQL scripts that you can load into PostgreSQL.",darold,ora2pg,https://github.com/darold/ora2pg
2023-02-02,perl,218,0,Spec and test data for the MaxMind DB file format,maxmind,MaxMind-DB,https://github.com/maxmind/MaxMind-DB
2023-02-02,perl,2010,1,Client for PPP+SSL VPN tunnel services,adrienverge,openfortivpn,https://github.com/adrienverge/openfortivpn
2023-02-02,perl,625,0,Rapid prokaryotic genome annotation,tseemann,prokka,https://github.com/tseemann/prokka
2023-02-02,perl,361,0,"A wrapper around Cutadapt and FastQC to consistently apply adapter and quality trimming to FastQ files, with extra functionality for RRBS data",FelixKrueger,TrimGalore,https://github.com/FelixKrueger/TrimGalore
2023-02-02,perl,107,0,GLPI Agent,glpi-project,glpi-agent,https://github.com/glpi-project/glpi-agent
2023-02-02,perl,29,0,Nginx C module to allow deeper control of Nginx behaviors by Kong Lua code,Kong,lua-kong-nginx-module,https://github.com/Kong/lua-kong-nginx-module
2023-02-02,perl,283,0,Collection of standard plugins to discover and gather cloud-to-edge metrics and status across your whole IT infrastructure.,centreon,centreon-plugins,https://github.com/centreon/centreon-plugins
2023-02-02,perl,0,0,"Bits and pieces for the ""Lightweight Threads in Perl"" talk at Brisbane Perl Mongers",awhatson,pmbris-coro-talk,https://github.com/awhatson/pmbris-coro-talk
2023-02-02,perl,349,0,Rapid haploid variant calling and core genome alignment,tseemann,snippy,https://github.com/tseemann/snippy
2023-02-02,perl,640,0,LCOV,linux-test-project,lcov,https://github.com/linux-test-project/lcov
2023-02-02,perl,0,0,identidad visual de firefox,inaes-tic,pkg-firefox,https://github.com/inaes-tic/pkg-firefox
2023-02-02,perl,0,0,,pawjy,perl-promised-mysqld,https://github.com/pawjy/perl-promised-mysqld
2023-02-02,perl,1,0,,pawjy,perl-promised-command,https://github.com/pawjy/perl-promised-command
2023-02-02,perl,109,0,FreeRDP Manuals,awakecoding,FreeRDP-Manuals,https://github.com/awakecoding/FreeRDP-Manuals