date,language,stargazers,starsToday,description,owner,name,url
2024-10-27,php,21646,7,"Personal CRM. Remember everything about your friends, family and business relationships.",monicahq,monica,https://github.com/monicahq/monica
2024-10-27,php,3874,6,Community-based GPL-licensed network monitoring system,librenms,librenms,https://github.com/librenms/librenms
2024-10-27,php,18688,19,"A collection of beautiful full-stack components for Laravel. The perfect starting point for your next app. Using Livewire, Alpine.js and Tailwind CSS.",filamentphp,filament,https://github.com/filamentphp/filament
2024-10-27,php,3396,1,"Core Framework for the Open Source Data & Experience Management Platform (PIM, MDM, CDP, DAM, DXP/CMS & Digital Commerce)",pimcore,pimcore,https://github.com/pimcore/pimcore
2024-10-27,php,29768,11,The Symfony PHP framework,symfony,symfony,https://github.com/symfony/symfony
2024-10-27,php,11534,2,"Prior to making any Submission(s), you must sign an Adobe Contributor License Agreement, available here at: https://opensource.adobe.com/cla.html. All Submissions you make to Adobe Inc. and its affiliates, assigns and subsidiaries (collectively “Adobe”) are subject to the terms of the Adobe Contributor License Agreement.",magento,magento2,https://github.com/magento/magento2
2024-10-27,php,2118,1,Beautiful Open-Source Form Builder,JhumanJ,OpnForm,https://github.com/JhumanJ/OpnForm
2024-10-27,php,828,2,OrangeHRM is a comprehensive Human Resource Management (HRM) System that captures all the essential functionalities required for any enterprise.,orangehrm,orangehrm,https://github.com/orangehrm/orangehrm
2024-10-27,php,3229,6,"Manage your photos with Piwigo, a full featured open source photo gallery application for the web. Star us on Github! More than 200 plugins and themes available. Join us and contribute!",Piwigo,Piwigo,https://github.com/Piwigo/Piwigo
2024-10-27,php,1524,0,Simple patches plugin for Composer,cweagans,composer-patches,https://github.com/cweagans/composer-patches
2024-10-27,php,15991,3,🐦 A personal music streaming server that works.,koel,koel,https://github.com/koel/koel
2024-10-27,php,2443,2,The server component of API Platform: hypermedia and GraphQL APIs in minutes,api-platform,core,https://github.com/api-platform/core
2024-10-27,php,5336,0,MISP (core software) - Open Source Threat Intelligence and Sharing Platform,MISP,MISP,https://github.com/MISP/MISP
2024-10-27,php,8169,4,PrestaShop is the universal open-source software platform to build your e-commerce solution.,PrestaShop,PrestaShop,https://github.com/PrestaShop/PrestaShop
2024-10-27,php,5396,5,"Dolibarr ERP CRM is a modern software package to manage your company or foundation's activity (contacts, suppliers, invoices, orders, stocks, agenda, accounting, ...). it's an open source Web application (written in PHP) designed for businesses of any sizes, foundations and freelancers.",Dolibarr,dolibarr,https://github.com/Dolibarr/dolibarr
2024-10-27,php,142,4,Self-hosted blog with subscriptions,bezumkin,orbita,https://github.com/bezumkin/orbita
2024-10-27,php,2172,1,The Symfony documentation,symfony,symfony-docs,https://github.com/symfony/symfony-docs
2024-10-27,php,9406,8,"A customizable, open-source ecommerce platform built on WordPress. Build any commerce solution you can imagine.",woocommerce,woocommerce,https://github.com/woocommerce/woocommerce
2024-10-27,php,2932,8,Wallos: Open-Source Personal Subscription Tracker,ellite,Wallos,https://github.com/ellite/Wallos
2024-10-27,php,12855,2,A tool to automatically fix PHP Coding Standards issues,PHP-CS-Fixer,PHP-CS-Fixer,https://github.com/PHP-CS-Fixer/PHP-CS-Fixer
2024-10-27,php,9559,0,"Pest is an elegant PHP testing Framework with a focus on simplicity, meticulously designed to bring back the joy of testing in PHP.",pestphp,pest,https://github.com/pestphp/pest
2024-10-27,php,2556,3,"WordPress Develop, Git-ified. Synced from git://develop.git.wordpress.org/, including branches and tags! This repository is just a mirror of the WordPress subversion repository. Please include a link to a pre-existing ticket on https://core.trac.wordpress.org/ with every pull request.",WordPress,wordpress-develop,https://github.com/WordPress/wordpress-develop