date,language,stargazers,starsToday,description,owner,name,url
2023-07-01,haskell,8735,7,"Dockerfile linter, validate inline bash, written in Haskell",hadolint,hadolint,https://github.com/hadolint/hadolint
2023-07-01,haskell,1040,8,"Haskell course info, plan, video lectures, slides",haskell-beginners-2022,course-plan,https://github.com/haskell-beginners-2022/course-plan
2023-07-01,haskell,3417,5,SimpleX - the first messaging platform operating without user identifiers of any kind - 100% private by design! iOS and Android apps are released !,simplex-chat,simplex-chat,https://github.com/simplex-chat/simplex-chat
2023-07-01,haskell,1387,0,"This repository hosts the lectures of the Plutus Pioneers Program. This program is a training course that the IOG Education Team provides to recruit and train software developers in Plutus, the native smart contract language for the Cardano ecosystem.",input-output-hk,plutus-pioneer-program,https://github.com/input-output-hk/plutus-pioneer-program
2023-07-01,haskell,32419,4,"ShellCheck, a static analysis tool for shell scripts",koalaman,shellcheck,https://github.com/koalaman/shellcheck
2023-07-01,haskell,2909,11,The fastest way to develop full-stack web apps with React & Node.js.,wasp-lang,wasp,https://github.com/wasp-lang/wasp
2023-07-01,haskell,1,0,The UFO (Universal FeynRules Output) format generator,wavewave,ufomaker,https://github.com/wavewave/ufomaker
2023-07-01,haskell,1,0,,imsut,starthaskell,https://github.com/imsut/starthaskell
2023-07-01,haskell,232,1,💻 Exercises for the Haskell Beginners 2022 course,haskell-beginners-2022,exercises,https://github.com/haskell-beginners-2022/exercises
2023-07-01,haskell,406,2,A formatter for Nix code,serokell,nixfmt,https://github.com/serokell/nixfmt
2023-07-01,haskell,196,0,The symbolic execution engine powering the K Framework,runtimeverification,haskell-backend,https://github.com/runtimeverification/haskell-backend
2023-07-01,haskell,3,0,,amitaibu,ihp-landing-page,https://github.com/amitaibu/ihp-landing-page
2023-07-01,haskell,20741,7,REST API for any Postgres database,PostgREST,postgrest,https://github.com/PostgREST/postgrest
2023-07-01,haskell,29259,11,Universal markup converter,jgm,pandoc,https://github.com/jgm/pandoc
2023-07-01,haskell,6,0,This is scrive's common collection of function import we use the most.,scrive,scrive-prelude,https://github.com/scrive/scrive-prelude
2023-07-01,haskell,572,1,A Direct-to-Driver open mobility platform powering the next-generation of mobility applications in India.,nammayatri,nammayatri,https://github.com/nammayatri/nammayatri
2023-07-01,haskell,909,0,👩‍🏫 👨‍🏫 Learn Haskell basics in 4 pull requests,kowainik,learn4haskell,https://github.com/kowainik/learn4haskell
2023-07-01,haskell,563,0,A comprehensive Amazon Web Services SDK for Haskell.,brendanhay,amazonka,https://github.com/brendanhay/amazonka
2023-07-01,haskell,1720,1,"Main repository for the servant libraries — DSL for describing, serving, querying, mocking, documenting web applications and more!",haskell-servant,servant,https://github.com/haskell-servant/servant
2023-07-01,haskell,2375,0,Official haskell ide support via language server (LSP). Successor of ghcide & haskell-ide-engine.,haskell,haskell-language-server,https://github.com/haskell/haskell-language-server
2023-07-01,haskell,1651,0,Informative git prompt for zsh,olivierverdier,zsh-git-prompt,https://github.com/olivierverdier/zsh-git-prompt
2023-07-01,haskell,1632,0,Tunneling over websocket protocol - Static binary available,erebe,wstunnel,https://github.com/erebe/wstunnel
2023-07-01,haskell,1,0,Graphite dashboards,brendanhay,ligature,https://github.com/brendanhay/ligature
2023-07-01,haskell,714,1,HTTP server & command-line for managing UTxOs and HD wallets in Cardano.,cardano-foundation,cardano-wallet,https://github.com/cardano-foundation/cardano-wallet
2023-07-01,haskell,1497,0,Official upstream development repository for Cabal and cabal-install,haskell,cabal,https://github.com/haskell/cabal