date,language,stargazers,starsToday,description,owner,name,url
2023-08-08,elixir,15630,7,"Simple, open-source, lightweight (< 1 KB) and privacy-friendly web analytics alternative to Google Analytics.",plausible,analytics,https://github.com/plausible/analytics
2023-08-08,elixir,21895,6,"Elixir is a dynamic, functional language for building scalable and maintainable applications",elixir-lang,elixir,https://github.com/elixir-lang/elixir
2023-08-08,elixir,5326,1,"Rich, real-time user experiences with server-rendered HTML",phoenixframework,phoenix_live_view,https://github.com/phoenixframework/phoenix_live_view
2023-08-08,elixir,4131,6,A self-hosted data logger for your Tesla 🚘,adriankumpf,teslamate,https://github.com/adriankumpf/teslamate
2023-08-08,elixir,6023,3,"Broadcast, Presence, and Postgres Changes via WebSockets",supabase,realtime,https://github.com/supabase/realtime
2023-08-08,elixir,74,0,🛡 Public database of Elixir security advisories pulled from GitHub Advisory Database,mirego,elixir-security-advisories,https://github.com/mirego/elixir-security-advisories
2023-08-08,elixir,19776,6,Peace of mind from prototype to production,phoenixframework,phoenix,https://github.com/phoenixframework/phoenix
2023-08-08,elixir,4628,7,WireGuard®-based VPN server and firewall,firezone,firezone,https://github.com/firezone/firezone
2023-08-08,elixir,3752,45,Automate code & data workflows with interactive Elixir notebooks,livebook-dev,livebook,https://github.com/livebook-dev/livebook
2023-08-08,elixir,2648,2,"Robust job processing in Elixir, backed by modern PostgreSQL or SQLite3",sorentwo,oban,https://github.com/sorentwo/oban
2023-08-08,elixir,208,1,,chrismccord,todo_trek,https://github.com/chrismccord/todo_trek
2023-08-08,elixir,854,0,An Elixir Library for Stripe,beam-community,stripity-stripe,https://github.com/beam-community/stripity-stripe
2023-08-08,elixir,597,1,Req is a batteries-included HTTP client for Elixir.,wojtekmach,req,https://github.com/wojtekmach/req
2023-08-08,elixir,451,0,A smart redirecting gateway for various frontend services,benbusby,farside,https://github.com/benbusby/farside
2023-08-08,elixir,27,0,,OffchainLabs,blockscout,https://github.com/OffchainLabs/blockscout
2023-08-08,elixir,805,3,ElectricSQL local-first SQL platform. Develop instantly reactive apps with realtime multi-user and conflict-free offline support. For web and mobile. With active-active replication between Postgres and SQLite.,electric-sql,electric,https://github.com/electric-sql/electric
2023-08-08,elixir,108,0,A tool for version and changelog management in Elixir via conventional commits.,zachdaniel,git_ops,https://github.com/zachdaniel/git_ops
2023-08-08,elixir,628,0,A massive repo filled with notes on everything from coding to philosophy to psychology to marketing to product,daryllxd,lifelong-learning,https://github.com/daryllxd/lifelong-learning
2023-08-08,elixir,988,1,A declarative and extensible framework for building Elixir applications.,ash-project,ash,https://github.com/ash-project/ash
2023-08-08,elixir,1474,0,A merge bot for GitHub Pull Requests,bors-ng,bors-ng,https://github.com/bors-ng/bors-ng
2023-08-08,elixir,1317,0,ExDoc produces HTML and EPUB documentation for Elixir projects,elixir-lang,ex_doc,https://github.com/elixir-lang/ex_doc
2023-08-08,elixir,2939,0,Simplify deployments in Elixir with OTP releases!,bitwalker,distillery,https://github.com/bitwalker/distillery
2023-08-08,elixir,2265,5,Multi-dimensional arrays (tensors) and numerical definitions for Elixir,elixir-nx,nx,https://github.com/elixir-nx/nx
2023-08-08,elixir,10,0,Plataforma digital PEA PESCARTE,peapescarte,pescarte-plataforma,https://github.com/peapescarte/pescarte-plataforma
2023-08-08,elixir,739,2,Expose your Discord presence and activities to a RESTful API and WebSocket in less than 10 seconds,Phineas,lanyard,https://github.com/Phineas/lanyard