date,language,stargazers,starsToday,description,owner,name,url
2023-05-01,css,28309,31,"50+ mini web projects using HTML, CSS & JS",bradtraversy,50projects50days,https://github.com/bradtraversy/50projects50days
2023-05-01,css,1819,3,Cloudflare’s documentation,cloudflare,cloudflare-docs,https://github.com/cloudflare/cloudflare-docs
2023-05-01,css,4831,6,Accurately Locate Smartphones using Social Engineering,thewhiteh4t,seeker,https://github.com/thewhiteh4t/seeker
2023-05-01,css,208,1,"Website ini merupakan hasil slicing dari Figma ke responsive website menggunakan HTML, CSS, dan JavaScript",fajarnurwahid,adminhub,https://github.com/fajarnurwahid/adminhub
2023-05-01,css,457,1,Documentation for GX mods,opera-gaming,gxmods,https://github.com/opera-gaming/gxmods
2023-05-01,css,249,3,Bot showing the volume and remaining subscription x-ui panel,wizwizdev,wizwizxui-timebot,https://github.com/wizwizdev/wizwizxui-timebot
2023-05-01,css,4164,3,,safak,youtube,https://github.com/safak/youtube
2023-05-01,css,43381,24,"Iconic font aggregator, collection, & patcher. 3,600+ icons, 50+ patched fonts: Hack, Source Code Pro, more. Glyph collections: Font Awesome, Material Design Icons, Octicons, & more",ryanoasis,nerd-fonts,https://github.com/ryanoasis/nerd-fonts
2023-05-01,css,55,2,web design master project for beginner to advanced,emetdas,Youtube-code,https://github.com/emetdas/Youtube-code
2023-05-01,css,4990,5,Public documentation for Visual Studio Code,microsoft,vscode-docs,https://github.com/microsoft/vscode-docs
2023-05-01,css,2840,3,Master the creation of Modern UX/UI Websites,adrianhajdin,project_modern_ui_ux_gpt3,https://github.com/adrianhajdin/project_modern_ui_ux_gpt3
2023-05-01,css,1456,2,"Responsive Portfolio Website Using HTML, CSS & JavaScript",bedimcode,responsive-portfolio-website-Alexa,https://github.com/bedimcode/responsive-portfolio-website-Alexa
2023-05-01,css,177,0,discord theme inspired by zorin,schnensch0,zelk,https://github.com/schnensch0/zelk
2023-05-01,css,3689,5,,john-smilga,react-projects,https://github.com/john-smilga/react-projects
2023-05-01,css,2447,1,A GNOME theme for Firefox,rafaelmardojai,firefox-gnome-theme,https://github.com/rafaelmardojai/firefox-gnome-theme
2023-05-01,css,4149,2,一个 Transmission 浏览器管理界面。Transmission Web Control is a custom web UI.,ronggang,transmission-web-control,https://github.com/ronggang/transmission-web-control
2023-05-01,css,1386,2,Fluent for Steam. A simple skin for steam to make it look like windows 11.,purogamer,Fluent-for-Steam,https://github.com/purogamer/Fluent-for-Steam
2023-05-01,css,8116,4,The Most Complete Angular UI Component Library,primefaces,primeng,https://github.com/primefaces/primeng
2023-05-01,css,2330,0,High Quality web friendly icons,atisawd,boxicons,https://github.com/atisawd/boxicons
2023-05-01,css,2410,3,A distraction-free and highly customizable theme for Obsidian,kepano,obsidian-minimal,https://github.com/kepano/obsidian-minimal
2023-05-01,css,2137,1,Orchis is a [Material Design](https://material.io) theme for GNOME/GTK based desktop environments.,vinceliuice,Orchis-theme,https://github.com/vinceliuice/Orchis-theme
2023-05-01,css,6425,2,A sample Spring-based application,spring-projects,spring-petclinic,https://github.com/spring-projects/spring-petclinic
2023-05-01,css,4195,3,A community-driven collection of themes for customizing Spotify through Spicetify - https://github.com/spicetify/spicetify-cli,spicetify,spicetify-themes,https://github.com/spicetify/spicetify-themes
2023-05-01,css,145,3,"Build a stunning portfolio website with Next.js, Tailwind CSS and Framer-motion. If you want to learn to create this you can follow the tutorial link given in the Read me file.",codebucks27,Next.js-Developer-Portfolio-Starter-Code,https://github.com/codebucks27/Next.js-Developer-Portfolio-Starter-Code
2023-05-01,css,631,3,Вопросы для подготовки к интервью на позицию Python Developer,yakimka,python_interview_questions,https://github.com/yakimka/python_interview_questions