date,language,stargazers,starsToday,description,owner,name,url
2024-01-18,astro,395,22,Ejemplo de porfolio para programadores y desarrolladores,midudev,porfolio.dev,https://github.com/midudev/porfolio.dev
2024-01-18,astro,43314,9,AdminLTE - Free admin dashboard template based on Bootstrap 5,ColorlibHQ,AdminLTE,https://github.com/ColorlibHQ/AdminLTE
2024-01-18,astro,4702,6,Next version of roadmap.sh,roadmapsh,deprecated-version,https://github.com/roadmapsh/deprecated-version
2024-01-18,astro,886,6,"Astroship is a starter template for startups, marketing websites, landing pages & blog. Built with Astro & TailwindCSS",surjithctly,astroship,https://github.com/surjithctly/astroship
2024-01-18,astro,564,0,Pruebas técnicas donde la comunidad participa con sus soluciones,midudev,pruebas-tecnicas,https://github.com/midudev/pruebas-tecnicas
2024-01-18,astro,563,1,"An Accessible Starter Theme for Astro including accessibility features such as landmarks, better focus-outline and skip-links navigation. Ships with Tailwind, Prettier and ESLint support.",markteekman,accessible-astro-starter,https://github.com/markteekman/accessible-astro-starter
2024-01-18,astro,100,1,"Template with astro, tailwind and alpinejs",zankhq,astros,https://github.com/zankhq/astros
2024-01-18,astro,2499,1,"An opinionated, actionable guide for software engineering interviews.",nas5w,interview-guide,https://github.com/nas5w/interview-guide
2024-01-18,astro,511,2,A simple Astro theme. Use it to create your blog or website.,chrismwilliams,astro-theme-cactus,https://github.com/chrismwilliams/astro-theme-cactus
2024-01-18,astro,59,0,Astro-bento-portfolio is a minimal bento-like (almost) single page portfolio website made in Astro,Ladvace,astro-bento-portfolio,https://github.com/Ladvace/astro-bento-portfolio
2024-01-18,astro,72,0,Drizzle ORM documentation website,drizzle-team,drizzle-orm-docs,https://github.com/drizzle-team/drizzle-orm-docs
2024-01-18,astro,1862,4,⭕️ AstroWind: A free template using Astro 4.0 and Tailwind CSS. Astro starter theme.,onwidget,astrowind,https://github.com/onwidget/astrowind
2024-01-18,astro,1525,6,"A minimal, accessible and SEO-friendly Astro blog theme",satnaing,astro-paper,https://github.com/satnaing/astro-paper
2024-01-18,astro,524,1,"Astrofy is a free and open-source template for your Personal Portfolio Website built with Astro and TailwindCSS. Create in minutes a website with Blog, CV, Project Section, Store and RSS Feed.",manuelernestog,astrofy,https://github.com/manuelernestog/astrofy
2024-01-18,astro,313,1,"Open-source admin dashboard template built with Astro, Flowbite, and Tailwind CSS",themesberg,flowbite-astro-admin-dashboard,https://github.com/themesberg/flowbite-astro-admin-dashboard
2024-01-18,astro,95,0,Pinwheel is a multipurpose SaaS theme built with Astro and TailwindCSS.,themefisher,pinwheel-astro,https://github.com/themefisher/pinwheel-astro
2024-01-18,astro,2688,2,⌨️ A curated list of Open Source Mechanical Keyboard resources.,Keycapsss,awesome-mechanical-keyboard,https://github.com/Keycapsss/awesome-mechanical-keyboard
2024-01-18,astro,279,1,"Astroplate is a free starter template built with Astro, TailwindCSS & TypeScript providing everything you need to jumpstart your Astro project. Get started with Astroplate and save yourself hours of work!",zeon-studio,astroplate,https://github.com/zeon-studio/astroplate
2024-01-18,astro,243,1,"📚 Openblog is an elegant, simple, and user-friendly blog. Focused on accessibility, SEO and performance.",danielcgilibert,blog-template,https://github.com/danielcgilibert/blog-template