date,language,stargazers,starsToday,description,owner,name,url
2023-07-18,vue,162,4,Openpose editor for ControlNet. Full hand/face support.,huchenlei,sd-webui-openpose-editor,https://github.com/huchenlei/sd-webui-openpose-editor
2023-07-18,vue,70,13,Hexhub 是一款开源的SSH、SFTP、数据库管理客户端，数据库管理模块目前还在开发之中,xiwh,hexhub,https://github.com/xiwh/hexhub
2023-07-18,vue,10866,2,mall-admin-web是一个电商后台管理系统的前端项目，基于Vue+Element实现。 主要包括商品管理、订单管理、会员管理、促销管理、运营管理、内容管理、统计报表、财务管理、权限管理、设置等功能。,macrozheng,mall-admin-web,https://github.com/macrozheng/mall-admin-web
2023-07-18,vue,4912,8,An alternative privacy-friendly YouTube frontend which is efficient by design.,TeamPiped,Piped,https://github.com/TeamPiped/Piped
2023-07-18,vue,3451,13,All-inclusive Python cheatsheet,wilfredinni,python-cheatsheet,https://github.com/wilfredinni/python-cheatsheet
2023-07-18,vue,12171,15,"A self-hostable personal dashboard built for you. Includes status-checking, widgets, themes, icon packs, a UI editor and tons more!",Lissy93,dashy,https://github.com/Lissy93/dashy
2023-07-18,vue,13176,7,跨平台桌面端视频资源播放器.简洁无广告.免费高颜值.,Hunlongyu,ZY-Player,https://github.com/Hunlongyu/ZY-Player
2023-07-18,vue,1092,7,个人主页，我的个人主页，个人主页源码，主页模板，homepage,imsyy,home,https://github.com/imsyy/home
2023-07-18,vue,2633,11,The sleekest looking WEBUI for qBittorrent made with Vuejs!,WDaan,VueTorrent,https://github.com/WDaan/VueTorrent
2023-07-18,vue,891,6,"A ChatGPT web client that supports multiple users, multiple languages, and multiple database connections for persistent data storage. Provides Docker images and quick deployment scripts.",WongSaang,chatgpt-ui,https://github.com/WongSaang/chatgpt-ui
2023-07-18,vue,1205,8,"跨平台桌面端视频资源播放器,免费高颜值.",Hiram-Wong,ZyPlayer,https://github.com/Hiram-Wong/ZyPlayer
2023-07-18,vue,4215,4,Material design mobile component library for Vue3,varletjs,varlet,https://github.com/varletjs/varlet
2023-07-18,vue,2836,9,Interface for Snapshot. Join us on Discord http://discord.snapshot.org,snapshot-labs,snapshot,https://github.com/snapshot-labs/snapshot
2023-07-18,vue,462,15,大麦抢票软件，一个基于 tauri + rust + vue 调用接口的抢票软件。,shiyutim,tickets,https://github.com/shiyutim/tickets
2023-07-18,vue,2498,4,(RuoYi)官方仓库 基于SpringBoot，Spring Security，JWT，Vue3 & Vite、Element Plus 的前后端分离权限管理系统,yangzongzhuan,RuoYi-Vue3,https://github.com/yangzongzhuan/RuoYi-Vue3
2023-07-18,vue,1242,8,Fully styled and customizable components for Nuxt.,nuxtlabs,ui,https://github.com/nuxtlabs/ui
2023-07-18,vue,480,7,"No-code in the front, Python in the back. An open-source framework for creating data apps.",streamsync-cloud,streamsync,https://github.com/streamsync-cloud/streamsync
2023-07-18,vue,203,28,Automatically create prompts and make them fight each other to know which is the best,meistrari,prompts-royale,https://github.com/meistrari/prompts-royale
2023-07-18,vue,1545,2,基于Vue + Echarts 构建的数据可视化平台，酷炫大屏展示模板和组件库，持续更新各行各业实用模板和炫酷小组件。,jackchen0120,vueDataV,https://github.com/jackchen0120/vueDataV
2023-07-18,vue,735,2,A modern web client for Jellyfin based on Vue,jellyfin,jellyfin-vue,https://github.com/jellyfin/jellyfin-vue
2023-07-18,vue,1999,7,"基于fabric.js和Vue的图片编辑器，可自定义字体、素材、设计模板。fabric.js and Vue based image editor, can customize fonts, materials, design templates.",nihaojob,vue-fabric-editor,https://github.com/nihaojob/vue-fabric-editor
2023-07-18,vue,415,8,"Geddit is an open-source, Reddit client for Android without using their API",kaangiray26,geddit-app,https://github.com/kaangiray26/geddit-app
2023-07-18,vue,86,0,Browse the most popular Boorus with the Rule 34 App.,Rule-34,App,https://github.com/Rule-34/App
2023-07-18,vue,105,2,,Orbiter-Finance,OrbiterFE-V2,https://github.com/Orbiter-Finance/OrbiterFE-V2
2023-07-18,vue,71,0,"An opinionated base template for a quick start with Nuxt, Tailwind & Netlify CMS. Up on a site after only 5 minutes!",Knogobert,ntn-boilerplate,https://github.com/Knogobert/ntn-boilerplate