date,language,stargazers,starsToday,description,owner,name,url
2024-10-25,php,29753,4,The Symfony PHP framework,symfony,symfony,https://github.com/symfony/symfony
2024-10-25,php,18649,37,"A collection of beautiful full-stack components for Laravel. The perfect starting point for your next app. Using Livewire, Alpine.js and Tailwind CSS.",filamentphp,filament,https://github.com/filamentphp/filament
2024-10-25,php,8160,4,PrestaShop is the universal open-source software platform to build your e-commerce solution.,PrestaShop,PrestaShop,https://github.com/PrestaShop/PrestaShop
2024-10-25,php,3392,2,"Core Framework for the Open Source Data & Experience Management Platform (PIM, MDM, CDP, DAM, DXP/CMS & Digital Commerce)",pimcore,pimcore,https://github.com/pimcore/pimcore
2024-10-25,php,12853,6,A tool to automatically fix PHP Coding Standards issues,PHP-CS-Fixer,PHP-CS-Fixer,https://github.com/PHP-CS-Fixer/PHP-CS-Fixer
2024-10-25,php,3328,4,"OPNsense GUI, API and systems backend",opnsense,core,https://github.com/opnsense/core
2024-10-25,php,3855,1,Community-based GPL-licensed network monitoring system,librenms,librenms,https://github.com/librenms/librenms
2024-10-25,php,32410,11,The Laravel Framework.,laravel,framework,https://github.com/laravel/framework
2024-10-25,php,28602,4,Dependency Manager for PHP,composer,composer,https://github.com/composer/composer
2024-10-25,php,10593,3,The PHP deployment tool with support for popular frameworks out of the box,deployphp,deployer,https://github.com/deployphp/deployer
2024-10-25,php,14543,4,"Modern, Crazy Fast, Ridiculously Easy and Amazingly Powerful Flat-File CMS powered by PHP, Markdown, Twig, and Symfony",getgrav,grav,https://github.com/getgrav/grav
2024-10-25,php,246,2,Open Source eCommerce Application on top of Symfony,Sylius,Sylius-Standard,https://github.com/Sylius/Sylius-Standard
2024-10-25,php,9397,5,"A customizable, open-source ecommerce platform built on WordPress. Build any commerce solution you can imagine.",woocommerce,woocommerce,https://github.com/woocommerce/woocommerce
2024-10-25,php,13325,3,A pure PHP library for reading and writing spreadsheet files,PHPOffice,PhpSpreadsheet,https://github.com/PHPOffice/PhpSpreadsheet
2024-10-25,php,11529,1,"Prior to making any Submission(s), you must sign an Adobe Contributor License Agreement, available here at: https://opensource.adobe.com/cla.html. All Submissions you make to Adobe Inc. and its affiliates, assigns and subsidiaries (collectively “Adobe”) are subject to the terms of the Adobe Contributor License Agreement.",magento,magento2,https://github.com/magento/magento2
2024-10-25,php,9726,6,"A free, self-hostable news aggregator…",FreshRSS,FreshRSS,https://github.com/FreshRSS/FreshRSS
2024-10-25,php,1524,0,Simple patches plugin for Composer,cweagans,composer-patches,https://github.com/cweagans/composer-patches
2024-10-25,php,22353,6,A full-stack framework for Laravel that takes the pain out of building dynamic UIs.,livewire,livewire,https://github.com/livewire/livewire
2024-10-25,php,19826,3,Empowering People Ethically with the leading open source alternative to Google Analytics that gives you full control over your data. Matomo lets you easily collect data from websites & apps and visualise this data and extract insights. Privacy is built-in. Liberating Web Analytics. Star us on Github? +1. And we love Pull Requests!,matomo-org,matomo,https://github.com/matomo-org/matomo
2024-10-25,php,2554,3,"WordPress Develop, Git-ified. Synced from git://develop.git.wordpress.org/, including branches and tags! This repository is just a mirror of the WordPress subversion repository. Please include a link to a pre-existing ticket on https://core.trac.wordpress.org/ with every pull request.",WordPress,wordpress-develop,https://github.com/WordPress/wordpress-develop
2024-10-25,php,78620,21,"Laravel is a web application framework with expressive, elegant syntax. We’ve already laid the foundation for your next big idea — freeing you to create without sweating the small things.",laravel,laravel,https://github.com/laravel/laravel