date,language,stargazers,starsToday,description,owner,name,url
2024-12-03,haskell,7385,20,"SimpleX - the first messaging network operating without user identifiers of any kind - 100% private by design! iOS, Android and desktop apps 📱!",simplex-chat,simplex-chat,https://github.com/simplex-chat/simplex-chat
2024-12-03,haskell,2722,1,Official haskell ide support via language server (LSP). Successor of ghcide & haskell-ide-engine.,haskell,haskell-language-server,https://github.com/haskell/haskell-language-server
2024-12-03,haskell,3077,0,The core component that is used to participate in a Cardano decentralised blockchain.,IntersectMBO,cardano-node,https://github.com/IntersectMBO/cardano-node
2024-12-03,haskell,23505,4,REST API for any Postgres database,PostgREST,postgrest,https://github.com/PostgREST/postgrest
2024-12-03,haskell,7565,0,"Compiler for Elm, a functional language for reliable webapps.",elm,compiler,https://github.com/elm/compiler
2024-12-03,haskell,4130,2,An advanced keyboard manager,kmonad,kmonad,https://github.com/kmonad/kmonad
2024-12-03,haskell,549,1,⚙️ SimpleXMQ - A reference implementation of the SimpleX Messaging Protocol for simplex queues over public networks.,simplex-chat,simplexmq,https://github.com/simplex-chat/simplexmq
2024-12-03,haskell,3077,2,"Robust, fast, intuitive plain text accounting tool with CLI, TUI and web interfaces.",simonmichael,hledger,https://github.com/simonmichael/hledger
2024-12-03,haskell,3996,0,The Haskell Tool Stack,commercialhaskell,stack,https://github.com/commercialhaskell/stack
2024-12-03,haskell,1628,0,Official upstream development repository for Cabal and cabal-install,haskell,cabal,https://github.com/haskell/cabal
2024-12-03,haskell,36539,7,"ShellCheck, a static analysis tool for shell scripts",koalaman,shellcheck,https://github.com/koalaman/shellcheck