date,language,stargazers,starsToday,description,owner,name,url
2023-05-14,perl,1753,38,Th3Inspector  Best Tool For Information Gathering,Moham3dRiahi,Th3inspector,https://github.com/Moham3dRiahi/Th3inspector
2023-05-14,perl,14687,4,Stack trace visualizer,brendangregg,FlameGraph,https://github.com/brendangregg/FlameGraph
2023-05-14,perl,688,0,LCOV,linux-test-project,lcov,https://github.com/linux-test-project/lcov
2023-05-14,perl,16017,3,"cloc counts blank lines, comment lines, and physical lines of source code in many programming languages.",AlDanial,cloc,https://github.com/AlDanial/cloc
2023-05-14,perl,1,0,identidad visual de firefox,inaes-tic,pkg-firefox,https://github.com/inaes-tic/pkg-firefox
2023-05-14,perl,310,0,"The Open Charge Point Interface (OCPI) allows for a scalable, automated roaming setup between Charge Point Operators and e-Mobility Service Providers. It supports authorisation, charge point information exchange (incl transaction events), charge detail record exchange and finally, the exchange of smart-charging commands between parties.",ocpi,ocpi,https://github.com/ocpi/ocpi
2023-05-14,perl,121,0,GLPI Agent,glpi-project,glpi-agent,https://github.com/glpi-project/glpi-agent
2023-05-14,perl,229,0,Spec and test data for the MaxMind DB file format,maxmind,MaxMind-DB,https://github.com/maxmind/MaxMind-DB
2023-05-14,perl,1635,0,The Perl programming language,Perl,perl5,https://github.com/Perl/perl5
2023-05-14,perl,293,0,Collection of standard plugins to discover and gather cloud-to-edge metrics and status across your whole IT infrastructure.,centreon,centreon-plugins,https://github.com/centreon/centreon-plugins
2023-05-14,perl,726,0,Trinity RNA-Seq de novo transcriptome assembly,trinityrnaseq,trinityrnaseq,https://github.com/trinityrnaseq/trinityrnaseq
2023-05-14,perl,2387,0,OWASP ModSecurity Core Rule Set (CRS) Project (Official Repository),SpiderLabs,owasp-modsecurity-crs,https://github.com/SpiderLabs/owasp-modsecurity-crs
2023-05-14,perl,16452,8,Good-lookin' diffs. Actually… nah… The best-lookin' diffs.,so-fancy,diff-so-fancy,https://github.com/so-fancy/diff-so-fancy
2023-05-14,perl,659,0,Rapid prokaryotic genome annotation,tseemann,prokka,https://github.com/tseemann/prokka
2023-05-14,perl,268,0,"openQA web-frontend, scheduler and tools.",os-autoinst,openQA,https://github.com/os-autoinst/openQA
2023-05-14,perl,3024,0,A fast PostgreSQL Log Analyzer,darold,pgbadger,https://github.com/darold/pgbadger
2023-05-14,perl,1122,1,"PacketFence is a fully supported, trusted, Free and Open Source network access control (NAC) solution. Boasting an impressive feature set including a captive-portal for registration and remediation, centralized wired and wireless management, powerful BYOD management options, 802.1X support, layer-2 isolation of problematic devices; PacketFence c…",inverse-inc,packetfence,https://github.com/inverse-inc/packetfence
2023-05-14,perl,49,0,Ce logiciel permet de contrôler le respect des normes des fichiers d'écritures comptables (FEC) conformément aux dispositions de l'article A.47 A-1 du livre des procédures fiscales.,DGFiP,Test-Compta-Demat,https://github.com/DGFiP/Test-Compta-Demat
2023-05-14,perl,2,0,,pawjy,serverset,https://github.com/pawjy/serverset
2023-05-14,perl,1382,1,Web application for archival and reading of manga/doujinshi. Lightweight and Docker-ready for NAS/servers.,Difegue,LANraragi,https://github.com/Difegue/LANraragi
2023-05-14,perl,869,0,"Ora2Pg is a free tool used to migrate an Oracle database to a PostgreSQL compatible schema. It connects your Oracle database, scan it automatically and extracts its structure or data, it then generates SQL scripts that you can load into PostgreSQL.",darold,ora2pg,https://github.com/darold/ora2pg
2023-05-14,perl,8072,0,MySQLTuner is a script written in Perl that will assist you with your MySQL configuration and make recommendations for increased performance and stability.,major,MySQLTuner-perl,https://github.com/major/MySQLTuner-perl
2023-05-14,perl,382,1,Rapid haploid variant calling and core genome alignment,tseemann,snippy,https://github.com/tseemann/snippy
2023-05-14,perl,246,0,FusionInventory Agent,fusioninventory,fusioninventory-agent,https://github.com/fusioninventory/fusioninventory-agent
2023-05-14,perl,375,0,"A wrapper around Cutadapt and FastQC to consistently apply adapter and quality trimming to FastQ files, with extra functionality for RRBS data",FelixKrueger,TrimGalore,https://github.com/FelixKrueger/TrimGalore