date,language,stargazers,starsToday,description,owner,name,url
2022-09-12,lua,11914,113,"An attempt to make neovim cli functional like an IDE while being very beautiful, blazing fast startuptime ~ 14ms to 67ms",NvChad,NvChad,https://github.com/NvChad/NvChad
2022-09-12,lua,3568,15,My personal dotfiles,craftzdog,dotfiles-public,https://github.com/craftzdog/dotfiles-public
2022-09-12,lua,3315,9,A Neovim config designed from scratch to be understandable,LunarVim,Neovim-from-scratch,https://github.com/LunarVim/Neovim-from-scratch
2022-09-12,lua,1303,10,Soothing pastel theme for NeoVim,catppuccin,nvim,https://github.com/catppuccin/nvim
2022-09-12,lua,11302,8,"An ebook reader application supporting PDF, DjVu, EPUB, FB2 and many more formats, running on Cervantes, Kindle, Kobo, PocketBook and Android devices",koreader,koreader,https://github.com/koreader/koreader
2022-09-12,lua,4486,13,AstroNvim is an aesthetic and feature-rich neovim config that is extensible and easy to use with a great set of plugins,AstroNvim,AstroNvim,https://github.com/AstroNvim/AstroNvim
2022-09-12,lua,2439,6,A blazing fast and easy to configure neovim statusline plugin written in pure lua.,nvim-lualine,lualine.nvim,https://github.com/nvim-lualine/lualine.nvim
2022-09-12,lua,3951,12,"A use-package inspired plugin manager for Neovim. Uses native packages, supports Luarocks dependencies, written in Lua, allows for expressive config",wbthomason,packer.nvim,https://github.com/wbthomason/packer.nvim
2022-09-12,lua,333,0,FiveM RP Framework Core,qbcore-framework,qb-core,https://github.com/qbcore-framework/qb-core
2022-09-12,lua,987,2,Certain anime game Repacked Resource from Multiple Sources,tamilpp25,Grasscutter_Resources,https://github.com/tamilpp25/Grasscutter_Resources
2022-09-12,lua,639,2,My neovim config,ChristianChiarulli,nvim,https://github.com/ChristianChiarulli/nvim
2022-09-12,lua,18931,4,A community-driven modular vim/neovim distribution - The ultimate vimrc,SpaceVim,SpaceVim,https://github.com/SpaceVim/SpaceVim
2022-09-12,lua,3226,3,A file explorer tree for neovim written in lua,kyazdani42,nvim-tree.lua,https://github.com/kyazdani42/nvim-tree.lua
2022-09-12,lua,1545,3,"A modern Neovim configuration with full battery for Python, C++, Markdown, LaTeX, and more...",jdhao,nvim-config,https://github.com/jdhao/nvim-config
2022-09-12,lua,1257,6,"A highly customizable theme for vim and neovim with support for lsp, treesitter and a variety of plugins.",EdenEast,nightfox.nvim,https://github.com/EdenEast/nightfox.nvim
2022-09-12,lua,123,1,A collection of every roblox script ive aquired. I DO NOT UPDATE OR MAINTAIN THESE.,PhoenixAceVFX,Roblox-Scripts,https://github.com/PhoenixAceVFX/Roblox-Scripts
2022-09-12,lua,27,0,A compilation of small resources combined into one,qbcore-framework,qb-smallresources,https://github.com/qbcore-framework/qb-smallresources
2022-09-12,lua,1349,2,NeoVim dark colorscheme inspired by the colors of the famous painting by Katsushika Hokusai.,rebelot,kanagawa.nvim,https://github.com/rebelot/kanagawa.nvim
2022-09-12,lua,30,0,Script For Buying Vehicles Used With QB-Core,qbcore-framework,qb-vehicleshop,https://github.com/qbcore-framework/qb-vehicleshop
2022-09-12,lua,2091,10,"A clean, dark Neovim theme written in Lua, with support for lsp, treesitter and lots of plugins. Includes additional themes for Kitty, Alacritty, iTerm and Fish.",folke,tokyonight.nvim,https://github.com/folke/tokyonight.nvim
2022-09-12,lua,10280,11,An IDE layer for Neovim with sane defaults. Completely free and community driven.,LunarVim,LunarVim,https://github.com/LunarVim/LunarVim
2022-09-12,lua,1640,4,A language server that offers Lua language support - programmed in Lua,sumneko,lua-language-server,https://github.com/sumneko/lua-language-server
2022-09-12,lua,32889,12,The Cloud-Native API Gateway,Kong,kong,https://github.com/Kong/kong
2022-09-12,lua,73,0,A better interaction system for FiveM,qbcore-framework,qb-target,https://github.com/qbcore-framework/qb-target
2022-09-12,lua,1961,3,neovim lsp plugin,glepnir,lspsaga.nvim,https://github.com/glepnir/lspsaga.nvim