date,language,stargazers,starsToday,description,owner,name,url
2023-02-25,elixir,13982,12,"Simple, open-source, lightweight (< 1 KB) and privacy-friendly web analytics alternative to Google Analytics.",plausible,analytics,https://github.com/plausible/analytics
2023-02-25,elixir,5686,1,A toolkit for data mapping and language integrated query.,elixir-ecto,ecto,https://github.com/elixir-ecto/ecto
2023-02-25,elixir,5083,0,"Rich, real-time user experiences with server-rendered HTML",phoenixframework,phoenix_live_view,https://github.com/phoenixframework/phoenix_live_view
2023-02-25,elixir,558,2,Kafka client library for Elixir,kafkaex,kafka_ex,https://github.com/kafkaex/kafka_ex
2023-02-25,elixir,62,0,Proportional Korean TrueType font based on NeoDunggeunmo.,neodgm,neodgm-pro,https://github.com/neodgm/neodgm-pro
2023-02-25,elixir,52,1,Public database of Elixir security advisories pulled from GitHub Advisory Database,mirego,elixir-security-advisories,https://github.com/mirego/elixir-security-advisories
2023-02-25,elixir,3739,3,WireGuard®-based VPN server and firewall,firezone,firezone,https://github.com/firezone/firezone
2023-02-25,elixir,70,1,Easy & flexible traffic filtering with Elixir,evadne,shun,https://github.com/evadne/shun
2023-02-25,elixir,190,0,A Broadway connector for Kafka,dashbitco,broadway_kafka,https://github.com/dashbitco/broadway_kafka
2023-02-25,elixir,19170,5,Peace of mind from prototype to production,phoenixframework,phoenix,https://github.com/phoenixframework/phoenix
2023-02-25,elixir,27,2,No fuzz ExUnit test server to mock third party services,danschultzer,test_server,https://github.com/danschultzer/test_server
2023-02-25,elixir,792,0,An Elixir Library for Stripe,beam-community,stripity-stripe,https://github.com/beam-community/stripity-stripe
2023-02-25,elixir,70,0,Traffic endpoint and graceful shutdown for Elixir Plug apps,Financial-Times,k8s_traffic_plug,https://github.com/Financial-Times/k8s_traffic_plug
2023-02-25,elixir,1093,1,"A frontend-independent IDE ""smartness"" server for Elixir. Implements the ""Language Server Protocol"" standard and provides debugger support via the ""Debug Adapter Protocol""",elixir-lsp,elixir-ls,https://github.com/elixir-lsp/elixir-ls
2023-02-25,elixir,20,0,,jellyfish-dev,membrane_webrtc_plugin,https://github.com/jellyfish-dev/membrane_webrtc_plugin
2023-02-25,elixir,1841,0,"Testable, composable, and adapter based Elixir email library for devs that love piping.",thoughtbot,bamboo,https://github.com/thoughtbot/bamboo
2023-02-25,elixir,5166,2,Open-source live customer chat,papercups-io,papercups,https://github.com/papercups-io/papercups
2023-02-25,elixir,5674,1,"Broadcast, Presence, and Postgres Changes via WebSockets",supabase,realtime,https://github.com/supabase/realtime
2023-02-25,elixir,447,1,,DockYard-Academy,curriculum,https://github.com/DockYard-Academy/curriculum
2023-02-25,elixir,405,0,Phoenix web server for hubs.mozilla.com,mozilla,reticulum,https://github.com/mozilla/reticulum
2023-02-25,elixir,58,0,Next Generation OLI Authoring and Delivery Platform,Simon-Initiative,oli-torus,https://github.com/Simon-Initiative/oli-torus
2023-02-25,elixir,727,0,[Deprecated because ibrowse is not maintained] HTTP client for Elixir (use Tesla please),valpackett,httpotion,https://github.com/valpackett/httpotion
2023-02-25,elixir,538,1,Phoenix + Live View HEEX Components,petalframework,petal_components,https://github.com/petalframework/petal_components
2023-02-25,elixir,21315,5,"Elixir is a dynamic, functional language designed for building scalable and maintainable applications",elixir-lang,elixir,https://github.com/elixir-lang/elixir
2023-02-25,elixir,11759,3,"A curated list of amazingly awesome Elixir and Erlang libraries, resources and shiny things. Updates:",h4cc,awesome-elixir,https://github.com/h4cc/awesome-elixir