date,language,stargazers,starsToday,description,owner,name,url
2022-04-21,lua,31694,11,The Cloud-Native API Gateway,Kong,kong,https://github.com/Kong/kong
2022-04-21,lua,512,1,Courseplay for Farming Simulator 2022,Courseplay,Courseplay_FS22,https://github.com/Courseplay/Courseplay_FS22
2022-04-21,lua,307,2,"A legend for your keymaps, commands, and autocmds, with which-key.nvim integration",mrjones2014,legendary.nvim,https://github.com/mrjones2014/legendary.nvim
2022-04-21,lua,92,0,LandSandBoat - a server emulator for Final Fantasy XI. Just an X-34 landspeeder out for a drive.,LandSandBoat,server,https://github.com/LandSandBoat/server
2022-04-21,lua,8317,12,An IDE layer for Neovim with sane defaults. Completely free and community driven.,LunarVim,LunarVim,https://github.com/LunarVim/LunarVim
2022-04-21,lua,5470,12,"Find, Filter, Preview, Pick. All lua, all the time.",nvim-telescope,telescope.nvim,https://github.com/nvim-telescope/telescope.nvim
2022-04-21,lua,2617,9,A completion plugin for neovim coded in Lua.,hrsh7th,nvim-cmp,https://github.com/hrsh7th/nvim-cmp
2022-04-21,lua,2655,3,"A use-package inspired plugin manager for Neovim. Uses native packages, supports Luarocks dependencies, written in Lua, allows for expressive config",wbthomason,packer.nvim,https://github.com/wbthomason/packer.nvim
2022-04-21,lua,1737,2,HelloWorld是一个以用户最佳主观体验为导向的插件，它支持多种主流协议和多种自定义视频分流服务，拥有精美的操作界面，并配上直观的节点信息。,jerrykuku,luci-app-vssr,https://github.com/jerrykuku/luci-app-vssr
2022-04-21,lua,9027,15,The Cloud-Native API Gateway,apache,apisix,https://github.com/apache/apisix
2022-04-21,lua,4520,2,Web-based Traffic and Security Network Traffic Monitoring,ntop,ntopng,https://github.com/ntop/ntopng
2022-04-21,lua,2347,10,A lightweight text editor written in Lua,lite-xl,lite-xl,https://github.com/lite-xl/lite-xl
2022-04-21,lua,2862,1,Get your data in RAM. Get compute close to data. Enjoy the performance.,tarantool,tarantool,https://github.com/tarantool/tarantool
2022-04-21,lua,248,4,明日方舟速通,tkkcc,arknights,https://github.com/tkkcc/arknights
2022-04-21,lua,447,1,Find the enemy and replace them with dark power.,nvim-pack,nvim-spectre,https://github.com/nvim-pack/nvim-spectre
2022-04-21,lua,281,4,My neovim config,ChristianChiarulli,nvim,https://github.com/ChristianChiarulli/nvim
2022-04-21,lua,631,6,Improve startup time for Neovim,lewis6991,impatient.nvim,https://github.com/lewis6991/impatient.nvim
2022-04-21,lua,14,1,QBCore Dispatch,Project-Sloth,qb-dispatch,https://github.com/Project-Sloth/qb-dispatch
2022-04-21,lua,18,0,Script For Buying Vehicles Used With QB-Core,qbcore-framework,qb-vehicleshop,https://github.com/qbcore-framework/qb-vehicleshop
2022-04-21,lua,316,0,"Neovim theme based off of the Nord Color Palette, written in lua with tree sitter support",shaunsingh,nord.nvim,https://github.com/shaunsingh/nord.nvim
2022-04-21,lua,341,0,FS22 version of the AutoDrive mod,Stephan-S,FS22_AutoDrive,https://github.com/Stephan-S/FS22_AutoDrive
2022-04-21,lua,150,1,"FS22. Farming Simulator 22. LS22. Landwirtschafts Simulator 22. Track assistant, parking brake, differential locks, wheel drive modes and better hydraulics controls for your vehicle. Shows more vehicle details on HUD.",ZhooL,FS22_EnhancedVehicle,https://github.com/ZhooL/FS22_EnhancedVehicle
2022-04-21,lua,32,9,Git intergration for neovim.,ipod825,igit.nvim,https://github.com/ipod825/igit.nvim
2022-04-21,lua,100,1,DCS UH-60L Mod release repository,Kinkkujuustovoileipa,uh-60l,https://github.com/Kinkkujuustovoileipa/uh-60l
2022-04-21,lua,1233,2,"Use Neovim as a language server to inject LSP diagnostics, code actions, and more via Lua.",jose-elias-alvarez,null-ls.nvim,https://github.com/jose-elias-alvarez/null-ls.nvim