date,language,stargazers,starsToday,description,owner,name,url
2023-12-05,haskell,21407,5,REST API for any Postgres database,PostgREST,postgrest,https://github.com/PostgREST/postgrest
2023-12-05,haskell,30753,7,Universal markup converter,jgm,pandoc,https://github.com/jgm/pandoc
2023-12-05,haskell,8345,2,A strongly-typed language that compiles to JavaScript,purescript,purescript,https://github.com/purescript/purescript
2023-12-05,haskell,5387,2,A friendly programming language from the future,unisonweb,unison,https://github.com/unisonweb/unison
2023-12-05,haskell,2457,1,Official haskell ide support via language server (LSP). Successor of ghcide & haskell-ide-engine.,haskell,haskell-language-server,https://github.com/haskell/haskell-language-server
2023-12-05,haskell,0,0,Skeleton code for the Haskell Assignment,hawkinsw,CS3003-HaskellAssignment,https://github.com/hawkinsw/CS3003-HaskellAssignment
2023-12-05,haskell,122,1,Horn Clause Constraint Solving for Liquid Types,ucsd-progsys,liquid-fixpoint,https://github.com/ucsd-progsys/liquid-fixpoint
2023-12-05,haskell,3162,0,"The core of xmonad, a small but functional ICCCM-compliant tiling window manager",xmonad,xmonad,https://github.com/xmonad/xmonad
2023-12-05,haskell,200,0,The symbolic execution engine powering the K Framework,runtimeverification,haskell-backend,https://github.com/runtimeverification/haskell-backend
2023-12-05,haskell,5,0,Accelerates K Framework's Haskell backend,runtimeverification,hs-backend-booster,https://github.com/runtimeverification/hs-backend-booster
2023-12-05,haskell,2971,1,The core component that is used to participate in a Cardano decentralised blockchain.,input-output-hk,cardano-node,https://github.com/input-output-hk/cardano-node
2023-12-05,haskell,23,0,Jambhala Cardano Development Suite,iburzynski,jambhala,https://github.com/iburzynski/jambhala
2023-12-05,haskell,1531,0,Official upstream development repository for Cabal and cabal-install,haskell,cabal,https://github.com/haskell/cabal
2023-12-05,haskell,4155,0,🔥 The fastest way to build type safe web apps. IHP is a new batteries-included web framework optimized for longterm productivity and programmer happiness,digitallyinduced,ihp,https://github.com/digitallyinduced/ihp
2023-12-05,haskell,3150,4,An advanced keyboard manager,kmonad,kmonad,https://github.com/kmonad/kmonad
2023-12-05,haskell,1124,0,Liquid Types For Haskell,ucsd-progsys,liquidhaskell,https://github.com/ucsd-progsys/liquidhaskell
2023-12-05,haskell,132,0,Addresses and mnemonic manipulation & derivations,IntersectMBO,cardano-addresses,https://github.com/IntersectMBO/cardano-addresses
2023-12-05,haskell,4606,3,"SimpleX - the first messaging platform operating without user identifiers of any kind - 100% private by design! iOS, Android and desktop apps 📱!",simplex-chat,simplex-chat,https://github.com/simplex-chat/simplex-chat
2023-12-05,haskell,7333,0,"Compiler for Elm, a functional language for reliable webapps.",elm,compiler,https://github.com/elm/compiler
2023-12-05,haskell,259,0,Specifications of network protocols and implementations of components running these protocols which support a family of Ouroboros Consesus protocols; the diffusion layer of the Cardano Node.,input-output-hk,ouroboros-network,https://github.com/input-output-hk/ouroboros-network
2023-12-05,haskell,726,0,HTTP server & command-line for managing UTxOs and HD wallets in Cardano.,cardano-foundation,cardano-wallet,https://github.com/cardano-foundation/cardano-wallet
2023-12-05,haskell,1951,1,A shell script which checks your $HOME for unwanted files and directories.,b3nj5m1n,xdg-ninja,https://github.com/b3nj5m1n/xdg-ninja
2023-12-05,haskell,33816,11,"ShellCheck, a static analysis tool for shell scripts",koalaman,shellcheck,https://github.com/koalaman/shellcheck