date,language,stargazers,starsToday,description,owner,name,url
2024-08-04,php,9232,2,A PHP client library for accessing Google APIs,googleapis,google-api-php-client,https://github.com/googleapis/google-api-php-client
2024-08-04,php,5134,2,"Dolibarr ERP CRM is a modern software package to manage your company or foundation's activity (contacts, suppliers, invoices, orders, stocks, agenda, accounting, ...). it's an open source Web application (written in PHP) designed for businesses of any sizes, foundations and freelancers.",Dolibarr,dolibarr,https://github.com/Dolibarr/dolibarr
2024-08-04,php,3288,1,"Core Framework for the Open Source Data & Experience Management Platform (PIM, MDM, CDP, DAM, DXP/CMS & Digital Commerce)",pimcore,pimcore,https://github.com/pimcore/pimcore
2024-08-04,php,2330,0,"Drush is a command-line shell and scripting interface for Drupal, a veritable Swiss Army knife designed to make life easier for those who spend their working hours hacking away at the command prompt.",drush-ops,drush,https://github.com/drush-ops/drush
2024-08-04,php,2530,4,Speedtest Tracker is a self-hosted internet performance tracking application that runs speedtest checks against Ookla's Speedtest service.,alexjustesen,speedtest-tracker,https://github.com/alexjustesen/speedtest-tracker
2024-08-04,php,8023,4,"Invoices, Expenses and Tasks built with Laravel, Flutter and React",invoiceninja,invoiceninja,https://github.com/invoiceninja/invoiceninja
2024-08-04,php,11408,0,"Prior to making any Submission(s), you must sign an Adobe Contributor License Agreement, available here at: https://opensource.adobe.com/cla.html. All Submissions you make to Adobe Inc. and its affiliates, assigns and subsidiaries (collectively “Adobe”) are subject to the terms of the Adobe Contributor License Agreement.",magento,magento2,https://github.com/magento/magento2
2024-08-04,php,16598,29,"A collection of beautiful full-stack components for Laravel. The perfect starting point for your next app. Using Livewire, Alpine.js and Tailwind CSS.",filamentphp,filament,https://github.com/filamentphp/filament
2024-08-04,php,2721,0,Shopware 6 is an open commerce platform based on Symfony Framework and Vue and supported by a worldwide community and more than 1.500 community extensions,shopware,shopware,https://github.com/shopware/shopware
2024-08-04,php,19415,4,Empowering People Ethically with the leading open source alternative to Google Analytics that gives you full control over your data. Matomo lets you easily collect data from websites & apps and visualise this data and extract insights. Privacy is built-in. Liberating Web Analytics. Star us on Github? +1. And we love Pull Requests!,matomo-org,matomo,https://github.com/matomo-org/matomo
2024-08-04,php,9259,1,"A customizable, open-source ecommerce platform built on WordPress. Build any commerce solution you can imagine.",woocommerce,woocommerce,https://github.com/woocommerce/woocommerce
2024-08-04,php,2403,4,"WordPress Develop, Git-ified. Synced from git://develop.git.wordpress.org/, including branches and tags! This repository is just a mirror of the WordPress subversion repository. Please include a link to a pre-existing ticket on https://core.trac.wordpress.org/ with every pull request.",WordPress,wordpress-develop,https://github.com/WordPress/wordpress-develop
2024-08-04,php,8085,1,"Twig, the flexible, fast, and secure template language for PHP",twigphp,Twig,https://github.com/twigphp/Twig
2024-08-04,php,29529,0,The Symfony PHP framework,symfony,symfony,https://github.com/symfony/symfony
2024-08-04,php,8489,1,Instant Upgrades and Automated Refactoring of any PHP 5.3+ code,rectorphp,rector,https://github.com/rectorphp/rector
2024-08-04,php,22034,5,A full-stack framework for Laravel that takes the pain out of building dynamic UIs.,livewire,livewire,https://github.com/livewire/livewire
2024-08-04,php,1662,3,EspoCRM – Open Source CRM Application,espocrm,espocrm,https://github.com/espocrm/espocrm
2024-08-04,php,14033,3,IDE Helper for Laravel,barryvdh,laravel-ide-helper,https://github.com/barryvdh/laravel-ide-helper
2024-08-04,php,4498,4,"🔥 Stay motivated and show off your contribution streak! 🌟 Display your total contributions, current streak, and longest streak on your GitHub profile README",DenverCoder1,github-readme-streak-stats,https://github.com/DenverCoder1/github-readme-streak-stats
2024-08-04,php,1503,0,Simple patches plugin for Composer,cweagans,composer-patches,https://github.com/cweagans/composer-patches
2024-08-04,php,7804,1,Open Source eCommerce Framework on Symfony,Sylius,Sylius,https://github.com/Sylius/Sylius