date,language,stargazers,starsToday,description,owner,name,url
2024-07-14,perl,16821,1,Stack trace visualizer,brendangregg,FlameGraph,https://github.com/brendangregg/FlameGraph
2024-07-14,perl,2221,2,Ddclient updates dynamic DNS entries for accounts on a wide range of dynamic DNS services.,ddclient,ddclient,https://github.com/ddclient/ddclient
2024-07-14,perl,17191,2,Good-lookin' diffs. Actually… nah… The best-lookin' diffs. 🎉,so-fancy,diff-so-fancy,https://github.com/so-fancy/diff-so-fancy
2024-07-14,perl,8773,3,MySQLTuner is a script written in Perl that will assist you with your MySQL configuration and make recommendations for increased performance and stability.,major,MySQLTuner-perl,https://github.com/major/MySQLTuner-perl
2024-07-14,perl,880,0,lm-sensors repository,lm-sensors,lm-sensors,https://github.com/lm-sensors/lm-sensors
2024-07-14,perl,427,0,"The Open Charge Point Interface (OCPI) allows for a scalable, automated roaming setup between Charge Point Operators and e-Mobility Service Providers. It supports authorisation, charge point information exchange (incl transaction events), charge detail record exchange and finally, the exchange of smart-charging commands between parties.",ocpi,ocpi,https://github.com/ocpi/ocpi
2024-07-14,perl,314,0,"openQA web-frontend, scheduler and tools.",os-autoinst,openQA,https://github.com/os-autoinst/openQA
2024-07-14,perl,338,0,BRAKER is a pipeline for fully automated prediction of protein coding gene structures with GeneMark-ES/ET/EP/ETP and AUGUSTUS in novel eukaryotic genomes,Gaius-Augustus,BRAKER,https://github.com/Gaius-Augustus/BRAKER
2024-07-14,perl,46,0,a superdaemon for hot-deploying server programs,kazuho,p5-Server-Starter,https://github.com/kazuho/p5-Server-Starter
2024-07-14,perl,2929,1,,ThePrimeagen,.dotfiles,https://github.com/ThePrimeagen/.dotfiles
2024-07-14,perl,1257,0,A free/open source client and automation tool for Ragnarok Online,OpenKore,openkore,https://github.com/OpenKore/openkore
2024-07-14,perl,56,0,a perl library for sending email,rjbs,Email-Sender,https://github.com/rjbs/Email-Sender
2024-07-14,perl,18941,5,"cloc counts blank lines, comment lines, and physical lines of source code in many programming languages.",AlDanial,cloc,https://github.com/AlDanial/cloc
2024-07-14,perl,810,0,Trinity RNA-Seq de novo transcriptome assembly,trinityrnaseq,trinityrnaseq,https://github.com/trinityrnaseq/trinityrnaseq
2024-07-14,perl,439,0,The Ensembl Variant Effect Predictor predicts the functional effects of genomic variants,Ensembl,ensembl-vep,https://github.com/Ensembl/ensembl-vep
2024-07-14,perl,978,0,"Ora2Pg is a free tool used to migrate an Oracle database to a PostgreSQL compatible schema. It connects your Oracle database, scan it automatically and extracts its structure or data, it then generates SQL scripts that you can load into PostgreSQL.",darold,ora2pg,https://github.com/darold/ora2pg
2024-07-14,perl,1987,0,"The book documenting the curl project, the curl tool, libcurl and more. Simply put: everything curl.",curl,everything-curl,https://github.com/curl/everything-curl