date,language,stargazers,starsToday,description,owner,name,url
2024-07-14,scala,38918,7,Apache Spark - A unified analytics engine for large-scale data processing,apache,spark,https://github.com/apache/spark
2024-07-14,scala,14849,2,"♞ lichess.org: the forever free, adless and open source chess server ♞",lichess-org,lila,https://github.com/lichess-org/lila
2024-07-14,scala,1076,0,Gluten is a middle layer responsible for offloading JVM-based SQL engines' execution to native engines.,apache,incubator-gluten,https://github.com/apache/incubator-gluten
2024-07-14,scala,7272,4,"An open-source storage framework that enables building a Lakehouse architecture with compute engines including Spark, PrestoDB, Flink, Trino, and Hive and APIs",delta-io,delta,https://github.com/delta-io/delta
2024-07-14,scala,2042,0,Scala language server with rich IDE features 🚀,scalameta,metals,https://github.com/scalameta/metals
2024-07-14,scala,4480,1,Open-source high-performance RISC-V processor,OpenXiangShan,XiangShan,https://github.com/OpenXiangShan/XiangShan
2024-07-14,scala,727,0,An open protocol for secure data sharing,delta-io,delta-sharing,https://github.com/delta-io/delta-sharing
2024-07-14,scala,2012,0,Apache Kyuubi is a distributed and multi-tenant gateway to provide serverless SQL on data warehouses and lakehouses.,apache,kyuubi,https://github.com/apache/kyuubi
2024-07-14,scala,765,0,Spark RAPIDS plugin - accelerate Apache Spark with GPUs,NVIDIA,spark-rapids,https://github.com/NVIDIA/spark-rapids
2024-07-14,scala,5718,1,"The Scala 3 compiler, also known as Dotty.",scala,scala3,https://github.com/scala/scala3
2024-07-14,scala,3088,3,Rocket Chip Generator,chipsalliance,rocket-chip,https://github.com/chipsalliance/rocket-chip
2024-07-14,scala,270,0,Apache Spark Connector for SQL Server and Azure SQL,microsoft,sql-spark-connector,https://github.com/microsoft/sql-spark-connector
2024-07-14,scala,12984,0,"Build highly concurrent, distributed, and resilient message-driven applications on the JVM",akka,akka,https://github.com/akka/akka
2024-07-14,scala,3762,2,State of the Art Natural Language Processing,JohnSnowLabs,spark-nlp,https://github.com/JohnSnowLabs/spark-nlp
2024-07-14,scala,3829,2,Chisel: A Modern Hardware Design Language,chipsalliance,chisel,https://github.com/chipsalliance/chisel
2024-07-14,scala,1656,1,SonicBOOM: The Berkeley Out-of-Order Machine,riscv-boom,riscv-boom,https://github.com/riscv-boom/riscv-boom
2024-07-14,scala,450,0,A Spark plugin for reading and writing Excel files,crealytics,spark-excel,https://github.com/crealytics/spark-excel
2024-07-14,scala,1285,2,Cortex: a Powerful Observable Analysis and Active Response Engine,TheHive-Project,Cortex,https://github.com/TheHive-Project/Cortex
2024-07-14,scala,841,0,FireSim: Fast and Effortless FPGA-accelerated Hardware Simulation with On-Prem and Cloud Flexibility,firesim,firesim,https://github.com/firesim/firesim