date,language,stargazers,starsToday,description,owner,name,url
2022-03-26,vue,24682,228,"Open Source Airtable Alternative - turns any MySQL, Postgres database into a collaborative spreadsheet with REST APIs.",nocodb,nocodb,https://github.com/nocodb/nocodb
2022-03-26,vue,10567,27,"A modern vue admin. It is based on Vue3, vite and TypeScript. It's fast！",vbenjs,vue-vben-admin,https://github.com/vbenjs/vue-vben-admin
2022-03-26,vue,40955,141,Open source API development ecosystem - https://hoppscotch.io,hoppscotch,hoppscotch,https://github.com/hoppscotch/hoppscotch
2022-03-26,vue,74946,35,A magical vue admin https://panjiachen.github.io/vue-element-admin,PanJiaChen,vue-element-admin,https://github.com/PanJiaChen/vue-element-admin
2022-03-26,vue,15635,11,"Wiki.js | A modern and powerful wiki app built on Node.js",Requarks,wiki,https://github.com/Requarks/wiki
2022-03-26,vue,1520,12,"A self-hosted startpage for your server. Easy to use visual editor, status checking, widgets, themes and tons more!",Lissy93,dashy,https://github.com/Lissy93/dashy
2022-03-26,vue,300,7,Vue 文档官方中文翻译 ｜ Official Chinese translation for Vue docs,vuejs-translations,docs-zh-cn,https://github.com/vuejs-translations/docs-zh-cn
2022-03-26,vue,9092,20,"Modern and easy to use SQL client for MySQL, Postgres, SQLite, SQL Server, and more. Linux, MacOS, and Windows.",beekeeper-studio,beekeeper-studio,https://github.com/beekeeper-studio/beekeeper-studio
2022-03-26,vue,52,15,,zhuye1993,file-view,https://github.com/zhuye1993/file-view
2022-03-26,vue,1331,3,基于vue3 的管理端模板(Vue3 TS Vuex4 element-plus vue-i18n-next composition-api) vue3-admin vue3-ts-admin,RainManGO,vue3-composition-admin,https://github.com/RainManGO/vue3-composition-admin
2022-03-26,vue,3430,6,Vue3 全家桶 + Vant 搭建大型单页面商城项目，新蜂商城 Vue3 版本，技术栈为 Vue 3.0 + Vue-Router 4.0 + Vuex 4.0 + Vant 3.0。,newbee-ltd,newbee-mall-vue3-app,https://github.com/newbee-ltd/newbee-mall-vue3-app
2022-03-26,vue,399,2,Front end of Sonic cloud real machine testing platform. Sonic云真机测试平台前端。,SonicCloudOrg,sonic-client-web,https://github.com/SonicCloudOrg/sonic-client-web
2022-03-26,vue,3881,2,"精致的下拉刷新和上拉加载 js框架.支持vue,完美运行于移动端和主流PC浏览器 (JS framework for pull-refresh and pull-up-loading)",mescroll,mescroll,https://github.com/mescroll/mescroll
2022-03-26,vue,4164,1,京东风格的移动端 Vue2、Vue3 组件库 、支持多端小程序(A Vue.js UI Toolkit for Mobile Web),jdf2e,nutui,https://github.com/jdf2e/nutui
2022-03-26,vue,16268,6,An enterprise-class UI components based on Ant Design and Vue.,vueComponent,ant-design-vue,https://github.com/vueComponent/ant-design-vue
2022-03-26,vue,526,6,"soybean admin - a beautiful vue admin template, based on Vue3、Vite、Naive UI、TypeScript. 基于Vite + Vue3 + NaiveUI + TypeScript的漂亮清新的中后台管理模版",honghuangdc,soybean-admin,https://github.com/honghuangdc/soybean-admin
2022-03-26,vue,544,0,本项目基于vue3+ElementPlus+Typescript+Vite搭建一套通用的后台管理模板；并基于常见业务场景，抽象出常见功能组件；包括动态菜单，菜单权限、登录、主题切换、国际化、个人中心、表单页、列表页、复制文本、二维码分享等等,GeekQiaQia,vue3.0-template-admin,https://github.com/GeekQiaQia/vue3.0-template-admin
2022-03-26,vue,2366,1,一个低代码（可视化拖拽）教学项目,woai3c,visual-drag-demo,https://github.com/woai3c/visual-drag-demo
2022-03-26,vue,51815,3,A Vue.js 2.0 UI Toolkit for Web,ElemeFE,element,https://github.com/ElemeFE/element
2022-03-26,vue,299,4,A starter kit for Element Plus with Vite,element-plus,element-plus-vite-starter,https://github.com/element-plus/element-plus-vite-starter
2022-03-26,vue,12,1,,CryptoMagg,kingdom.watch,https://github.com/CryptoMagg/kingdom.watch
2022-03-26,vue,2935,3,Ant Design Pro's implementation with Vue,iczer,vue-antd-admin,https://github.com/iczer/vue-antd-admin
2022-03-26,vue,6284,4,Vue数据可视化组件库（类似阿里DataV，大屏数据展示），提供SVG的边框及装饰、图表、水位图、飞线图等组件，简单易用，长期更新(React版已发布),DataV-Team,DataV,https://github.com/DataV-Team/DataV
2022-03-26,vue,710,8,A Chinese Hanzi variation of Wordle - 汉字 Wordle,antfu,handle,https://github.com/antfu/handle
2022-03-26,vue,16483,0,Mobile UI elements for Vue.js,ElemeFE,mint-ui,https://github.com/ElemeFE/mint-ui