date,language,stargazers,starsToday,description,owner,name,url
2022-01-02,kotlin,1683,8,Best Material You Design music player for Android,RetroMusicPlayer,RetroMusicPlayer,https://github.com/RetroMusicPlayer/RetroMusicPlayer
2022-01-02,kotlin,4595,9,"Loop Habit Tracker, a mobile app for creating and maintaining long-term positive habits",iSoron,uhabits,https://github.com/iSoron/uhabits
2022-01-02,kotlin,5645,18,Vanced Installer,YTVanced,VancedManager,https://github.com/YTVanced/VancedManager
2022-01-02,kotlin,4763,5,"Tivi is a work-in-progress TV show tracking Android app, which connects to Trakt.tv. It is still in its early stages of development and currently only contains two pieces of UI. It is under heavy development.",chrisbanes,tivi,https://github.com/chrisbanes/tivi
2022-01-02,kotlin,14029,14,Free and open source manga reader for Android.,tachiyomiorg,tachiyomi,https://github.com/tachiyomiorg/tachiyomi
2022-01-02,kotlin,1597,1,Source extensions for the Tachiyomi app.,tachiyomiorg,tachiyomi-extensions,https://github.com/tachiyomiorg/tachiyomi-extensions
2022-01-02,kotlin,677,10,"btrace(AKA RheaTrace) is a high performance Android trace tool which is based on Systrace, it support to define custom events automatically during building apk and using bhook to provider more native events like IO.",bytedance,btrace,https://github.com/bytedance/btrace
2022-01-02,kotlin,10262,5,Library support for Kotlin coroutines,Kotlin,kotlinx.coroutines,https://github.com/Kotlin/kotlinx.coroutines
2022-01-02,kotlin,131,5,A high-performance fork of Paper designed for large servers.,pufferfish-gg,Pufferfish,https://github.com/pufferfish-gg/Pufferfish
2022-01-02,kotlin,2644,4,哔哩漫游，解除B站客户端番剧区域限制的Xposed模块，并且提供其他小功能。An Xposed module that unblocks bangumi area limit of BILIBILI with miscellaneous features.,yujincheng08,BiliRoaming,https://github.com/yujincheng08/BiliRoaming
2022-01-02,kotlin,1259,2,provides metadata for networkIDs and chainIDs,ethereum-lists,chains,https://github.com/ethereum-lists/chains
2022-01-02,kotlin,12753,14,,2dust,v2rayNG,https://github.com/2dust/v2rayNG
2022-01-02,kotlin,2768,5,The universal proxy toolchain for Android,SagerNet,SagerNet,https://github.com/SagerNet/SagerNet
2022-01-02,kotlin,5875,5,"阅读3.0, 阅读是一款可以自定义来源阅读网络内容的工具，为广大网络文学爱好者提供一种方便、快捷舒适的试读体验。",gedoor,legado,https://github.com/gedoor/legado
2022-01-02,kotlin,556,1,A free mixin-based injection hacked client for Minecraft using the Fabric API,CCBlueX,LiquidBounce,https://github.com/CCBlueX/LiquidBounce
2022-01-02,kotlin,154,1,Minecraft utility mod coded in Kotlin,lambda-client,lambda,https://github.com/lambda-client/lambda
2022-01-02,kotlin,1315,0,The collaboration workspace for Machine Learning,MLReef,mlreef,https://github.com/MLReef/mlreef
2022-01-02,kotlin,5444,5,Firefox for Android,mozilla-mobile,fenix,https://github.com/mozilla-mobile/fenix
2022-01-02,kotlin,10867,19,A rule-based tunnel for Android.,Kr328,ClashForAndroid,https://github.com/Kr328/ClashForAndroid
2022-01-02,kotlin,2848,3,A simple tool for managing Xiaomi devices on desktop using ADB and Fastboot,Szaki,XiaomiADBFastbootTools,https://github.com/Szaki/XiaomiADBFastbootTools
2022-01-02,kotlin,852,1,"Purpur is a drop-in replacement for Paper servers designed for configurability, and new fun and exciting gameplay features.",PurpurMC,Purpur,https://github.com/PurpurMC/Purpur
2022-01-02,kotlin,274,1,Salt Player Update.,Moriafly,SaltPlayerSource,https://github.com/Moriafly/SaltPlayerSource
2022-01-02,kotlin,518,1,A local ADB shell for Android!,tytydraco,LADB,https://github.com/tytydraco/LADB
2022-01-02,kotlin,883,3,"Free, open source, unofficial MangaDex reader for Android",CarlosEsco,Neko,https://github.com/CarlosEsco/Neko
2022-01-02,kotlin,71,2,Ivy Wallet is an Open Source money manager app for android that you can either build or download from Google Play.,ILIYANGERMANOV,ivy-wallet,https://github.com/ILIYANGERMANOV/ivy-wallet