date,language,stargazers,starsToday,description,owner,name,url
2023-08-05,shell,58082,663,Everything required to run your own Base node,base-org,node,https://github.com/base-org/node
2023-08-05,shell,6426,4,"Sentry, feature-complete and packaged up for low-volume deployments and proofs-of-concept",getsentry,self-hosted,https://github.com/getsentry/self-hosted
2023-08-05,shell,7141,7,Integrate Magisk root and Google Apps into WSA (Windows Subsystem for Android),LSPosed,MagiskOnWSALocal,https://github.com/LSPosed/MagiskOnWSALocal
2023-08-05,shell,277,34,Example of how to setup Codecov with docker compose,codecov,self-hosted,https://github.com/codecov/self-hosted
2023-08-05,shell,1765,0,,vcheckzen,KeepAliveE5,https://github.com/vcheckzen/KeepAliveE5
2023-08-05,shell,24984,7,"Laws, Theories, Principles and Patterns that developers will find useful. #hackerlaws",dwmkerr,hacker-laws,https://github.com/dwmkerr/hacker-laws
2023-08-05,shell,5624,2,Certified Kubernetes Administrator - CKA Course,kodekloudhub,certified-kubernetes-administrator-course,https://github.com/kodekloudhub/certified-kubernetes-administrator-course
2023-08-05,shell,3654,1,easy-rsa - Simple shell based CA utility,OpenVPN,easy-rsa,https://github.com/OpenVPN/easy-rsa
2023-08-05,shell,780,7,基于 Lean 源码编译的 OpenWrt 固件——适配X86、R2C、R2S、R4S、R4SE、R5C、R5S、香橙派 R1 Plus、树莓派3B/B+、树莓派4B、R66S、R68S、M68S、H66K、H68K、H69K、E25、N1、S905x3、S922x、HK1、X96max、微加云、贝壳云、我家云、章鱼星球等,haiibo,OpenWrt,https://github.com/haiibo/OpenWrt
2023-08-05,shell,9348,6,使用Ansible脚本安装K8S集群，介绍组件交互原理，方便直接，不受国内网络环境影响,easzlab,kubeasz,https://github.com/easzlab/kubeasz
2023-08-05,shell,3024,8,"最全面的游戏开发技术图谱。帮助游戏开发者们在已知问题上节省时间，省出更多的精力投入到更有创造性的工作中去。 | The most comprehensive technical map of game development. Help game developers save time on known problems and save more energy for more creative work.",gonglei007,GameDevMind,https://github.com/gonglei007/GameDevMind
2023-08-05,shell,700,0,"A GitOps workflow example for multi-env deployments with Flux, Kustomize and Helm.",fluxcd,flux2-kustomize-helm-example,https://github.com/fluxcd/flux2-kustomize-helm-example
2023-08-05,shell,11408,6,Prevents you from committing secrets and credentials into git repositories,awslabs,git-secrets,https://github.com/awslabs/git-secrets
2023-08-05,shell,230,0,Release tooling for OpenShift,openshift,release,https://github.com/openshift/release
2023-08-05,shell,2560,3,pre-commit git hooks to take care of Terraform configurations,antonbabenko,pre-commit-terraform,https://github.com/antonbabenko/pre-commit-terraform
2023-08-05,shell,620,4,A program almost identical to the 42 EXAMS for practice. (Pool EXAM & Stud EXAM),JCluzet,42_EXAM,https://github.com/JCluzet/42_EXAM
2023-08-05,shell,4116,5,install latest or LTS linux kernel and enable BBR or BBR plus,jinwyp,one_click_script,https://github.com/jinwyp/one_click_script
2023-08-05,shell,17850,1,Node version management,tj,n,https://github.com/tj/n
2023-08-05,shell,211,0,Proxmox VE & PBS unofficial arm64 version,jiangcuo,Proxmox-Arm64,https://github.com/jiangcuo/Proxmox-Arm64
2023-08-05,shell,766,1,Port(ish) of Great Expectations to dbt test macros,calogica,dbt-expectations,https://github.com/calogica/dbt-expectations
2023-08-05,shell,1982,13,Extensive ReVanced builder. Builds both modules and APKs. Updated daily.,j-hc,revanced-magisk-module,https://github.com/j-hc/revanced-magisk-module
2023-08-05,shell,3948,3,Terraform version manager,tfutils,tfenv,https://github.com/tfutils/tfenv
2023-08-05,shell,209,0,emergency response toolkit,theLSA,hack-er-tools,https://github.com/theLSA/hack-er-tools
2023-08-05,shell,1297,11,A Library for Advanced Deep Time Series Models.,thuml,Time-Series-Library,https://github.com/thuml/Time-Series-Library
2023-08-05,shell,181,0,Projects on shell scripting. Goal is to simulate real time projects as much as posible.,iam-veeramalla,shell-scripting-projects,https://github.com/iam-veeramalla/shell-scripting-projects