date,language,stargazers,starsToday,description,owner,name,url
2024-02-16,astro,1998,6,⭕️ AstroWind: A free template using Astro 4.0 and Tailwind CSS. Astro starter theme.,onwidget,astrowind,https://github.com/onwidget/astrowind
2024-02-16,astro,177,2,"Nebulix, a Fast & Green Theme Based on Astro + Static CMS + Snipcart",unfolding-io,nebulix,https://github.com/unfolding-io/nebulix
2024-02-16,astro,17,0,Guardian Ghost,NigelBreslaw,guardian-ghost,https://github.com/NigelBreslaw/guardian-ghost
2024-02-16,astro,18,2,Pagina con información financiera de Argentina,ferminrp,compara-tasas,https://github.com/ferminrp/compara-tasas
2024-02-16,astro,566,1,A simple Astro theme. Use it to create your blog or website.,chrismwilliams,astro-theme-cactus,https://github.com/chrismwilliams/astro-theme-cactus
2024-02-16,astro,601,3,Ejemplo de porfolio para programadores y desarrolladores,midudev,porfolio.dev,https://github.com/midudev/porfolio.dev
2024-02-16,astro,933,4,"🌠 An overview of the JavaScript landscape in 2023: trends about frontend, Node.js, fullstack frameworks, build tools, testing, Vue.js, React, state management...",bestofjs,javascript-risingstars,https://github.com/bestofjs/javascript-risingstars
2024-02-16,astro,1664,5,"A minimal, accessible and SEO-friendly Astro blog theme",satnaing,astro-paper,https://github.com/satnaing/astro-paper
2024-02-16,astro,940,3,"Astroship is a starter template for startups, marketing websites, landing pages & blog. Built with Astro & TailwindCSS",surjithctly,astroship,https://github.com/surjithctly/astroship
2024-02-16,astro,311,3,"Astroplate is a free starter template built with Astro, TailwindCSS & TypeScript providing everything you need to jumpstart your Astro project. Get started with Astroplate and save yourself hours of work!",zeon-studio,astroplate,https://github.com/zeon-studio/astroplate
2024-02-16,astro,43398,2,AdminLTE - Free admin dashboard template based on Bootstrap 5,ColorlibHQ,AdminLTE,https://github.com/ColorlibHQ/AdminLTE