date,language,stargazers,starsToday,description,owner,name,url
2023-02-08,php,11698,7,A tool to automatically fix PHP Coding Standards issues,PHP-CS-Fixer,PHP-CS-Fixer,https://github.com/PHP-CS-Fixer/PHP-CS-Fixer
2023-02-08,php,9751,5,The PHP deployment tool with support for popular frameworks out of the box,deployphp,deployer,https://github.com/deployphp/deployer
2023-02-08,php,18902,2,The PHP Unit Testing framework.,sebastianbergmann,phpunit,https://github.com/sebastianbergmann/phpunit
2023-02-08,php,4460,3,Adds code analysis to Laravel improving developer productivity and code quality.,nunomaduro,larastan,https://github.com/nunomaduro/larastan
2023-02-08,php,21481,6,"Nextcloud server, a safe home for all your data",nextcloud,server,https://github.com/nextcloud/server
2023-02-08,php,11917,7,A pure PHP library for reading and writing spreadsheet files,PHPOffice,PhpSpreadsheet,https://github.com/PHPOffice/PhpSpreadsheet
2023-02-08,php,12879,4,IDE Helper for Laravel,barryvdh,laravel-ide-helper,https://github.com/barryvdh/laravel-ide-helper
2023-02-08,php,3764,3,"Dolibarr ERP CRM is a modern software package to manage your company or foundation's activity (contacts, suppliers, invoices, orders, stocks, agenda, accounting, ...). It is open source software (written in PHP) and designed for small and medium businesses, foundations and freelancers. You can freely install, use and distribute it as a standalon…",Dolibarr,dolibarr,https://github.com/Dolibarr/dolibarr
2023-02-08,php,12044,6,"WordPress starter theme with Laravel Blade components and templates, Tailwind CSS, and a modern development workflow",roots,sage,https://github.com/roots/sage
2023-02-08,php,3335,3,SuiteCRM - Open source CRM for the world,salesagility,SuiteCRM,https://github.com/salesagility/SuiteCRM
2023-02-08,php,958,12,Build beautiful API integrations and SDKs with Saloon,Sammyjo20,Saloon,https://github.com/Sammyjo20/Saloon
2023-02-08,php,11007,6,Associate users with roles and permissions,spatie,laravel-permission,https://github.com/spatie/laravel-permission
2023-02-08,php,3724,0,"EasyAdmin is a fast, beautiful and modern admin generator for Symfony applications.",EasyCorp,EasyAdminBundle,https://github.com/EasyCorp/EasyAdminBundle
2023-02-08,php,1645,4,Laravel Impersonate is a plugin that allows you to authenticate as your users.,404labfr,laravel-impersonate,https://github.com/404labfr/laravel-impersonate
2023-02-08,php,1320,8,Nextcloud AIO stands for Nextcloud All In One and provides easy deployment and maintenance with most features included in this one Nextcloud instance.,nextcloud,all-in-one,https://github.com/nextcloud/all-in-one
2023-02-08,php,20155,6,"Sends your logs to files, sockets, inboxes, databases and various web services",Seldaek,monolog,https://github.com/Seldaek/monolog
2023-02-08,php,27988,5,The Symfony PHP framework,symfony,symfony,https://github.com/symfony/symfony
2023-02-08,php,1776,2,"WordPress Develop, Git-ified. Synced from git://develop.git.wordpress.org/, including branches and tags! This repository is just a mirror of the WordPress subversion repository. Please include a link to a pre-existing ticket on https://core.trac.wordpress.org/ with every pull request.",WordPress,wordpress-develop,https://github.com/WordPress/wordpress-develop
2023-02-08,php,2444,3,The core Laravel CMS Composer package,statamic,cms,https://github.com/statamic/cms
2023-02-08,php,5690,10,"Admin panel, form builder and table builder for Laravel. Built with the TALL stack. Designed for humans.",filamentphp,filament,https://github.com/filamentphp/filament
2023-02-08,php,1322,3,Simple patches plugin for Composer,cweagans,composer-patches,https://github.com/cweagans/composer-patches
2023-02-08,php,10907,14,A platform to create documentation/wiki content built with PHP & Laravel,BookStackApp,BookStack,https://github.com/BookStackApp/BookStack
2023-02-08,php,2049,3,"Kimai is a web-based multi-user time-tracking application. Works great for everyone: freelancers, companies, organizations - everyone can track their times, generate reports, create invoices and do so much more. SaaS version available at https://www.kimai.cloud",kimai,kimai,https://github.com/kimai/kimai
2023-02-08,php,22358,6,"Guzzle, an extensible PHP HTTP client",guzzle,guzzle,https://github.com/guzzle/guzzle
2023-02-08,php,2984,3,"GLPI is a Free Asset and IT Management Software package, Data center management, ITIL Service Desk, licenses tracking and software auditing.",glpi-project,glpi,https://github.com/glpi-project/glpi