date,language,stargazers,starsToday,description,owner,name,url
2022-06-14,lua,1898,3,A blazing fast and easy to configure neovim statusline plugin written in pure lua.,nvim-lualine,lualine.nvim,https://github.com/nvim-lualine/lualine.nvim
2022-06-14,lua,2402,9,A Neovim config designed from scratch to be understandable,LunarVim,Neovim-from-scratch,https://github.com/LunarVim/Neovim-from-scratch
2022-06-14,lua,880,3,vim dashboard,glepnir,dashboard-nvim,https://github.com/glepnir/dashboard-nvim
2022-06-14,lua,3013,9,A completion plugin for neovim coded in Lua.,hrsh7th,nvim-cmp,https://github.com/hrsh7th/nvim-cmp
2022-06-14,lua,1171,3,Service eggs for the pterodactyl panel,parkervcp,eggs,https://github.com/parkervcp/eggs
2022-06-14,lua,10687,12,"An ebook reader application supporting PDF, DjVu, EPUB, FB2 and many more formats, running on Cervantes, Kindle, Kobo, PocketBook and Android devices",koreader,koreader,https://github.com/koreader/koreader
2022-06-14,lua,1717,6,Neovim plugin that allow you to seamlessly manage LSP servers with :LspInstall. With full Windows support!,williamboman,nvim-lsp-installer,https://github.com/williamboman/nvim-lsp-installer
2022-06-14,lua,4700,10,Quickstart configs for Nvim LSP,neovim,nvim-lspconfig,https://github.com/neovim/nvim-lspconfig
2022-06-14,lua,1176,10,A neovim lua plugin to help easily manage multiple terminal windows,akinsho,toggleterm.nvim,https://github.com/akinsho/toggleterm.nvim
2022-06-14,lua,4781,4,awesome window manager,awesomeWM,awesome,https://github.com/awesomeWM/awesome
2022-06-14,lua,978,3,Snippet Engine for Neovim written in Lua.,L3MON4D3,LuaSnip,https://github.com/L3MON4D3/LuaSnip
2022-06-14,lua,1452,2,"Use Neovim as a language server to inject LSP diagnostics, code actions, and more via Lua.",jose-elias-alvarez,null-ls.nvim,https://github.com/jose-elias-alvarez/null-ls.nvim
2022-06-14,lua,3145,18,AstroNvim is an aesthetic and feature-rich neovim config that is extensible and easy to use with a great set of plugins,AstroNvim,AstroNvim,https://github.com/AstroNvim/AstroNvim
2022-06-14,lua,2596,9,A file explorer tree for neovim written in lua,kyazdani42,nvim-tree.lua,https://github.com/kyazdani42/nvim-tree.lua
2022-06-14,lua,1610,1,Git integration for buffers,lewis6991,gitsigns.nvim,https://github.com/lewis6991/gitsigns.nvim
2022-06-14,lua,6004,8,"Find, Filter, Preview, Pick. All lua, all the time.",nvim-telescope,telescope.nvim,https://github.com/nvim-telescope/telescope.nvim
2022-06-14,lua,28,1,EthicalPixel Admin menu,CallMeDaddyBro,EthicalPixel-Admin,https://github.com/CallMeDaddyBro/EthicalPixel-Admin
2022-06-14,lua,406,2,My neovim config,ChristianChiarulli,nvim,https://github.com/ChristianChiarulli/nvim
2022-06-14,lua,593,2,Courseplay for Farming Simulator 2022,Courseplay,Courseplay_FS22,https://github.com/Courseplay/Courseplay_FS22
2022-06-14,lua,672,3,Combined Resource Folder from Multiple Sources of certain anime game,Koko-boya,Grasscutter_Resources,https://github.com/Koko-boya/Grasscutter_Resources
2022-06-14,lua,2102,3,Offline build planner for Path of Exile.,PathOfBuildingCommunity,PathOfBuilding,https://github.com/PathOfBuildingCommunity/PathOfBuilding
2022-06-14,lua,737,3,"A minimal, stylish and customizable statusline for Neovim written in Lua",feline-nvim,feline.nvim,https://github.com/feline-nvim/feline.nvim
2022-06-14,lua,507,2,a lua powered greeter like vim-startify / dashboard-nvim,goolord,alpha-nvim,https://github.com/goolord/alpha-nvim
2022-06-14,lua,1429,1,Lua Language Server coded by Lua,sumneko,lua-language-server,https://github.com/sumneko/lua-language-server
2022-06-14,lua,917,3,"A highly customizable theme for vim and neovim with support for lsp, treesitter and a variety of plugins.",EdenEast,nightfox.nvim,https://github.com/EdenEast/nightfox.nvim