date,language,stargazers,starsToday,description,owner,name,url
2022-03-31,lua,8858,14,The Cloud-Native API Gateway,apache,apisix,https://github.com/apache/apisix
2022-03-31,lua,686,7,"A highly customizable theme for vim and neovim with support for lsp, treesitter and a variety of plugins.",EdenEast,nightfox.nvim,https://github.com/EdenEast/nightfox.nvim
2022-03-31,lua,25,0,Slot Based Inventory System Used With QB-Core,qbcore-framework,qb-inventory,https://github.com/qbcore-framework/qb-inventory
2022-03-31,lua,772,2,Snippet Engine for Neovim written in Lua.,L3MON4D3,LuaSnip,https://github.com/L3MON4D3/LuaSnip
2022-03-31,lua,587,2,Soothing pastel theme for NeoVim,catppuccin,nvim,https://github.com/catppuccin/nvim
2022-03-31,lua,31554,10,The Cloud-Native API Gateway,Kong,kong,https://github.com/Kong/kong
2022-03-31,lua,92,0,Official Repo For ESX-Legacy,esx-framework,esx-legacy,https://github.com/esx-framework/esx-legacy
2022-03-31,lua,71,1,User Interface replacement AddOn for World of Warcraft.,tukui-org,ElvUI,https://github.com/tukui-org/ElvUI
2022-03-31,lua,1263,6,Neovim plugin that allows you to seamlessly manage LSP servers with :LspInstall. With full Windows support!,williamboman,nvim-lsp-installer,https://github.com/williamboman/nvim-lsp-installer
2022-03-31,lua,23578,14,Image Super-Resolution for Anime-Style Art,nagadomi,waifu2x,https://github.com/nagadomi/waifu2x
2022-03-31,lua,38,2,Pet Simulator X Scripts,hackerDashDash,PetSimulatorX,https://github.com/hackerDashDash/PetSimulatorX
2022-03-31,lua,223,0,FiveM RP Framework Core,qbcore-framework,qb-core,https://github.com/qbcore-framework/qb-core
2022-03-31,lua,4488,0,Web-based Traffic and Security Network Traffic Monitoring,ntop,ntopng,https://github.com/ntop/ntopng
2022-03-31,lua,2006,0,A lightweight text editor written in Lua,lite-xl,lite-xl,https://github.com/lite-xl/lite-xl
2022-03-31,lua,1354,1,Widgets for Awesome Window Manager,streetturtle,awesome-wm-widgets,https://github.com/streetturtle/awesome-wm-widgets
2022-03-31,lua,4768,2,Lsyncd (Live Syncing Daemon) synchronizes local directories with remote targets,lsyncd,lsyncd,https://github.com/lsyncd/lsyncd
2022-03-31,lua,2454,5,A completion plugin for neovim coded in Lua.,hrsh7th,nvim-cmp,https://github.com/hrsh7th/nvim-cmp
2022-03-31,lua,251,2,Neovim plugin to manage the file system and other tree like structures.,nvim-neo-tree,neo-tree.nvim,https://github.com/nvim-neo-tree/neo-tree.nvim
2022-03-31,lua,69,1,Feedbacks & suggestion are very appreciated on ETHOS of FrSky,FrSkyRC,ETHOS-Feedback-Community,https://github.com/FrSkyRC/ETHOS-Feedback-Community
2022-03-31,lua,4,1,"Simple camera script for QBCore, take and view photos",Wert22,wert-camera,https://github.com/Wert22/wert-camera
2022-03-31,lua,511,0,Data related to the investigation of realtime censorship,citizenlab,chat-censorship,https://github.com/citizenlab/chat-censorship
2022-03-31,lua,15,0,Vehicle Customization For QB-Core,qbcore-framework,qb-customs,https://github.com/qbcore-framework/qb-customs
2022-03-31,lua,18,2,OrbitLib is a two-body orbital mechanics library for Roblox Luau.,daftcube,orbitlib,https://github.com/daftcube/orbitlib
2022-03-31,lua,483,1,Courseplay for Farming Simulator 2022,Courseplay,Courseplay_FS22,https://github.com/Courseplay/Courseplay_FS22
2022-03-31,lua,1034,2,A snazzy bufferline for Neovim,akinsho,bufferline.nvim,https://github.com/akinsho/bufferline.nvim