date,language,stargazers,starsToday,description,owner,name,url
2023-08-19,scala,3869,5,Open-source high-performance RISC-V processor,OpenXiangShan,XiangShan,https://github.com/OpenXiangShan/XiangShan
2023-08-19,scala,5707,1,The Guardian DotCom.,guardian,frontend,https://github.com/guardian/frontend
2023-08-19,scala,2744,4,Rocket Chip Generator,chipsalliance,rocket-chip,https://github.com/chipsalliance/rocket-chip
2023-08-19,scala,59560,15,Source code for Twitter's Recommendation Algorithm,twitter,the-algorithm,https://github.com/twitter/the-algorithm
2023-08-19,scala,6120,1,Apache OpenWhisk is an open source serverless cloud platform,apache,openwhisk,https://github.com/apache/openwhisk
2023-08-19,scala,36472,7,Apache Spark - A unified analytics engine for large-scale data processing,apache,spark,https://github.com/apache/spark
2023-08-19,scala,1332,1,The Streaming-first HTTP server/module of Akka,akka,akka-http,https://github.com/akka/akka-http
2023-08-19,scala,12754,5,"Build highly concurrent, distributed, and resilient message-driven applications on the JVM",akka,akka,https://github.com/akka/akka
2023-08-19,scala,3862,1,"ZIO — A type-safe, composable library for async and concurrent programming in Scala",zio,zio,https://github.com/zio/zio
2023-08-19,scala,1927,1,Scala language server with rich IDE features,scalameta,metals,https://github.com/scalameta/metals
2023-08-19,scala,460,0,XML data source for Spark SQL and DataFrames,databricks,spark-xml,https://github.com/databricks/spark-xml
2023-08-19,scala,636,1,Gluten: Plugin to Double SparkSQL's Performance,oap-project,gluten,https://github.com/oap-project/gluten
2023-08-19,scala,678,0,"A next-generation Scala framework for building scalable, correct, and efficient HTTP clients and servers",zio,zio-http,https://github.com/zio/zio-http
2023-08-19,scala,717,0,Mirror of Apache Toree (Incubating),apache,incubator-toree,https://github.com/apache/incubator-toree
2023-08-19,scala,9999,7,"Removes large or troublesome blobs like git-filter-branch does, but faster. And written in Scala",rtyley,bfg-repo-cleaner,https://github.com/rtyley/bfg-repo-cleaner
2023-08-19,scala,57,1,"Production ready event-driven automata for Scala, Scala.js and scala native",hnaderi,edomata,https://github.com/hnaderi/edomata
2023-08-19,scala,625,0,An open protocol for secure data sharing,delta-io,delta-sharing,https://github.com/delta-io/delta-sharing
2023-08-19,scala,390,1,A Spark plugin for reading and writing Excel files,crealytics,spark-excel,https://github.com/crealytics/spark-excel
2023-08-19,scala,19,0,"Solutions to exercises from the book ""Scala for the Impacient"" by Cay S. Horstmann.",calinburloiu,Scala-for-the-Impatient--Exercises,https://github.com/calinburloiu/Scala-for-the-Impatient--Exercises
2023-08-19,scala,11462,1,CMAK is a tool for managing Apache Kafka clusters,yahoo,CMAK,https://github.com/yahoo/CMAK
2023-08-19,scala,770,0,The Daml smart contract language,digital-asset,daml,https://github.com/digital-asset/daml
2023-08-19,scala,207,0,"Open, Modular, Deep Learning Accelerator",apache,tvm-vta,https://github.com/apache/tvm-vta
2023-08-19,scala,2898,0,"Deequ is a library built on top of Apache Spark for defining ""unit tests for data"", which measure data quality in large datasets.",awslabs,deequ,https://github.com/awslabs/deequ
2023-08-19,scala,16,0,High-performance vector search engine with no loss of accuracy through GPU and dynamic placement,sionic-ai,flasma,https://github.com/sionic-ai/flasma
2023-08-19,scala,227,0,Enabling Continuous Data Processing with Apache Spark and Azure Event Hubs,Azure,azure-event-hubs-spark,https://github.com/Azure/azure-event-hubs-spark