date,language,stargazers,starsToday,description,owner,name,url
2022-08-31,scala,5059,2,"The Scala 3 compiler, also known as Dotty.",lampepfl,dotty,https://github.com/lampepfl/dotty
2022-08-31,scala,5183,3,This connector allows Apache Spark™ to read from and write to Delta Lake.,delta-io,delta,https://github.com/delta-io/delta
2022-08-31,scala,2384,0,Spark: The Definitive Guide's Code Repository,databricks,Spark-The-Definitive-Guide,https://github.com/databricks/Spark-The-Definitive-Guide
2022-08-31,scala,33756,8,Apache Spark - A unified analytics engine for large-scale data processing,apache,spark,https://github.com/apache/spark
2022-08-31,scala,11924,7,"♞ lichess.org: the forever free, adless and open source chess server ♞",lichess-org,lila,https://github.com/lichess-org/lila
2022-08-31,scala,5645,1,Modern Load Testing as Code,gatling,gatling,https://github.com/gatling/gatling
2022-08-31,scala,8887,6,"Removes large or troublesome blobs like git-filter-branch does, but faster. And written in Scala",rtyley,bfg-repo-cleaner,https://github.com/rtyley/bfg-repo-cleaner
2022-08-31,scala,3511,3,"ZIO — A type-safe, composable library for async and concurrent programming in Scala",zio,zio,https://github.com/zio/zio
2022-08-31,scala,2668,1,Chisel 3: A Modern Hardware Design Language,chipsalliance,chisel3,https://github.com/chipsalliance/chisel3
2022-08-31,scala,12203,1,Play Framework,playframework,playframework,https://github.com/playframework/playframework
2022-08-31,scala,2957,2,Open-source high-performance RISC-V processor,OpenXiangShan,XiangShan,https://github.com/OpenXiangShan/XiangShan
2022-08-31,scala,13837,3,"Scala 2 compiler and standard library. For bugs, see scala/bug",scala,scala,https://github.com/scala/scala
2022-08-31,scala,2554,0,Slick (Scala Language Integrated Connection Kit) is a modern database query and access library for Scala,slick,slick,https://github.com/slick/slick
2022-08-31,scala,3502,0,Simple and Distributed Machine Learning,microsoft,SynapseML,https://github.com/microsoft/SynapseML
2022-08-31,scala,141,1,"Beautiful trees, without the landscaping.",stripe,bonsai,https://github.com/stripe/bonsai
2022-08-31,scala,8322,0,"A fault tolerant, protocol-agnostic RPC system",twitter,finagle,https://github.com/twitter/finagle
2022-08-31,scala,5,0,"A Lift web app wrapping Dumbster, the fake Smtp Server",Dan-M,dumbsterweb,https://github.com/Dan-M/dumbsterweb
2022-08-31,scala,2467,1,A simple client for Android,xxf098,shadowsocksr-v2ray-trojan-android,https://github.com/xxf098/shadowsocksr-v2ray-trojan-android
2022-08-31,scala,761,0,A Thrift parser/generator,twitter,scrooge,https://github.com/twitter/scrooge
2022-08-31,scala,1755,1,Scala language server with rich IDE features,scalameta,metals,https://github.com/scalameta/metals
2022-08-31,scala,187,0,Apache Spark Connector for Azure Cosmos DB,Azure,azure-cosmosdb-spark,https://github.com/Azure/azure-cosmosdb-spark
2022-08-31,scala,2598,0,"TheHive: a Scalable, Open Source and Free Security Incident Response Platform",TheHive-Project,TheHive,https://github.com/TheHive-Project/TheHive
2022-08-31,scala,2889,0,State of the Art Natural Language Processing,JohnSnowLabs,spark-nlp,https://github.com/JohnSnowLabs/spark-nlp
2022-08-31,scala,6177,0,"The enterprise-grade behavioral data engine (web, mobile, server-side, webhooks), running cloud-natively on AWS and GCP",snowplow,snowplow,https://github.com/snowplow/snowplow
2022-08-31,scala,12376,1,"Build highly concurrent, distributed, and resilient message-driven applications on the JVM",akka,akka,https://github.com/akka/akka