date,language,stargazers,starsToday,description,owner,name,url
2022-11-07,kotlin,17498,25,A rule-based tunnel for Android.,Kr328,ClashForAndroid,https://github.com/Kr328/ClashForAndroid
2022-11-07,kotlin,1829,10,Official patches by ReVanced,revanced,revanced-patches,https://github.com/revanced/revanced-patches
2022-11-07,kotlin,1455,24,An Android client for the microblogging server Mastodon,tuskyapp,Tusky,https://github.com/tuskyapp/Tusky
2022-11-07,kotlin,4254,10,The universal proxy toolchain for Android,SagerNet,SagerNet,https://github.com/SagerNet/SagerNet
2022-11-07,kotlin,5633,3,AnkiDroid: Anki flashcards on Android. Your secret trick to achieve superhuman information retention.,ankidroid,Anki-Android,https://github.com/ankidroid/Anki-Android
2022-11-07,kotlin,1063,7,Matsuri (茉莉) / V2Ray / universal proxy toolchain for Android / Fork of SagerNet,MatsuriDayo,Matsuri,https://github.com/MatsuriDayo/Matsuri
2022-11-07,kotlin,2706,1,"A premium app for managing and editing your photos, videos, GIFs without ads",SimpleMobileTools,Simple-Gallery,https://github.com/SimpleMobileTools/Simple-Gallery
2022-11-07,kotlin,11395,4,Library support for Kotlin coroutines,Kotlin,kotlinx.coroutines,https://github.com/Kotlin/kotlinx.coroutines
2022-11-07,kotlin,1560,18,An Android application for streaming music from YouTube Music.,vfsfitvnm,ViMusic,https://github.com/vfsfitvnm/ViMusic
2022-11-07,kotlin,1479,14,"Video/Audio downloader for Android, designed and themed with Material You.",JunkFood02,Seal,https://github.com/JunkFood02/Seal
2022-11-07,kotlin,2526,9,"An Android Anilist only client, which lets you stream & download Anime & Manga.",saikou-app,saikou,https://github.com/saikou-app/saikou
2022-11-07,kotlin,11366,21,"Legado 3.0 Book Reader with powerful controls & full functions阅读3.0, 阅读是一款可以自定义来源阅读网络内容的工具，为广大网络文学爱好者提供一种方便、快捷舒适的试读体验。",gedoor,legado,https://github.com/gedoor/legado
2022-11-07,kotlin,17286,28,"A V2Ray client for Android, support Xray core and v2fly core",2dust,v2rayNG,https://github.com/2dust/v2rayNG
2022-11-07,kotlin,955,1,Use your old Android device as an OctoPrint server.,feelfreelinux,octo4a,https://github.com/feelfreelinux/octo4a
2022-11-07,kotlin,6369,24,"Kotlin Multiplatform Music Downloader, Supports Spotify / Gaana / Youtube Music / Jio Saavn / SoundCloud. NOTE: BEING REWRITTEN, SO STAY TUNED.",Shabinder,SpotiFlyer,https://github.com/Shabinder/SpotiFlyer
2022-11-07,kotlin,4174,3,Kotlin multiplatform / multi-format serialization,Kotlin,kotlinx.serialization,https://github.com/Kotlin/kotlinx.serialization
2022-11-07,kotlin,33039,4,A shadowsocks client for Android,shadowsocks,shadowsocks-android,https://github.com/shadowsocks/shadowsocks-android
2022-11-07,kotlin,7705,4,Vanced Installer,TeamVanced,VancedManager,https://github.com/TeamVanced/VancedManager
2022-11-07,kotlin,622,12,A material design YouTube Music client,z-huang,InnerTune,https://github.com/z-huang/InnerTune
2022-11-07,kotlin,2792,4,DuckDuckGo Android App,duckduckgo,Android,https://github.com/duckduckgo/Android
2022-11-07,kotlin,2445,3,A glossy Matrix collaboration client for Android.,vector-im,element-android,https://github.com/vector-im/element-android
2022-11-07,kotlin,3456,10,"An alternative YouTube front end, for Android.",libre-tube,LibreTube,https://github.com/libre-tube/LibreTube
2022-11-07,kotlin,2521,1,Best Material You Design music player for Android,RetroMusicPlayer,RetroMusicPlayer,https://github.com/RetroMusicPlayer/RetroMusicPlayer
2022-11-07,kotlin,2670,3,"Lightweight password manager for Android, KeePassDX allows editing encrypted data in a single file in KeePass format and fill in the forms in a secure way.",Kunzisoft,KeePassDX,https://github.com/Kunzisoft/KeePassDX
2022-11-07,kotlin,6628,6,Kotlin SQL Framework,JetBrains,Exposed,https://github.com/JetBrains/Exposed