date,language,stargazers,starsToday,description,owner,name,url
2022-10-06,perl,0,0,Understand Plugins and Scripts,stinb,plugins,https://github.com/stinb/plugins
2022-10-06,perl,74,0,GLPI Agent,glpi-project,glpi-agent,https://github.com/glpi-project/glpi-agent
2022-10-06,perl,669,0,Trinity RNA-Seq de novo transcriptome assembly,trinityrnaseq,trinityrnaseq,https://github.com/trinityrnaseq/trinityrnaseq
2022-10-06,perl,231,0,FusionInventory Agent,fusioninventory,fusioninventory-agent,https://github.com/fusioninventory/fusioninventory-agent
2022-10-06,perl,1889,1,Client for PPP+SSL VPN tunnel services,adrienverge,openfortivpn,https://github.com/adrienverge/openfortivpn
2022-10-06,perl,260,1,"The Open Charge Point Interface (OCPI) allows for a scalable, automated roaming setup between Charge Point Operators and e-Mobility Service Providers. It supports authorisation, charge point information exchange (incl transaction events), charge detail record exchange and finally, the exchange of smart-charging commands between parties.",ocpi,ocpi,https://github.com/ocpi/ocpi
2022-10-06,perl,277,0,Collection of standard plugins to discover and gather cloud-to-edge metrics and status across your whole IT infrastructure.,centreon,centreon-plugins,https://github.com/centreon/centreon-plugins
2022-10-06,perl,462,1,Holberton-style C code checker written in Perl,holbertonschool,Betty,https://github.com/holbertonschool/Betty
2022-10-06,perl,15894,4,Good-lookin' diffs. Actually… nah… The best-lookin' diffs.,so-fancy,diff-so-fancy,https://github.com/so-fancy/diff-so-fancy
2022-10-06,perl,2777,1,A fast PostgreSQL Log Analyzer,darold,pgbadger,https://github.com/darold/pgbadger
2022-10-06,perl,4,0,Promise in Perl,manakai,perl-promise,https://github.com/manakai/perl-promise
2022-10-06,perl,1040,0,"PacketFence is a fully supported, trusted, Free and Open Source network access control (NAC) solution. Boasting an impressive feature set including a captive-portal for registration and remediation, centralized wired and wireless management, powerful BYOD management options, 802.1X support, layer-2 isolation of problematic devices; PacketFence c…",inverse-inc,packetfence,https://github.com/inverse-inc/packetfence
2022-10-06,perl,260,0,GNU Fortran (and GCC) compilers for macOS,fxcoudert,gfortran-for-macOS,https://github.com/fxcoudert/gfortran-for-macOS
2022-10-06,perl,43,0,Ce logiciel permet de contrôler le respect des normes des fichiers d'écritures comptables (FEC) conformément aux dispositions de l'article A.47 A-1 du livre des procédures fiscales.,DGFiP,Test-Compta-Demat,https://github.com/DGFiP/Test-Compta-Demat
2022-10-06,perl,210,0,Spec and test data for the MaxMind DB file format,maxmind,MaxMind-DB,https://github.com/maxmind/MaxMind-DB
2022-10-06,perl,597,0,Rapid prokaryotic genome annotation,tseemann,prokka,https://github.com/tseemann/prokka
2022-10-06,perl,384,0,Movable Type,movabletype,movabletype,https://github.com/movabletype/movabletype
2022-10-06,perl,337,0,The Ensembl Variant Effect Predictor predicts the functional effects of genomic variants,Ensembl,ensembl-vep,https://github.com/Ensembl/ensembl-vep
2022-10-06,perl,14,0,Qt QA Scripts,qt,qtqa,https://github.com/qt/qtqa
2022-10-06,perl,325,0,Rapid haploid variant calling and core genome alignment,tseemann,snippy,https://github.com/tseemann/snippy
2022-10-06,perl,630,0,"Engintron for cPanel/WHM is the easiest way to integrate Nginx on your cPanel/WHM server. Engintron will improve the performance & web serving capacity of your server, while reducing CPU/RAM load at the same time, by installing & configuring the popular Nginx webserver to act as a reverse caching proxy in front of Apache.",engintron,engintron,https://github.com/engintron/engintron
2022-10-06,perl,8,0,A simple script that controlls MPlayer with a Hercules DJ Control MP3 - a USB MIDI controller,goblin,hercules_controller,https://github.com/goblin/hercules_controller
2022-10-06,perl,798,0,"Ora2Pg is a free tool used to migrate an Oracle database to a PostgreSQL compatible schema. It connects your Oracle database, scan it automatically and extracts its structure or data, it then generates SQL scripts that you can load into PostgreSQL.",darold,ora2pg,https://github.com/darold/ora2pg
2022-10-06,perl,344,0,"A wrapper around Cutadapt and FastQC to consistently apply adapter and quality trimming to FastQ files, with extra functionality for RRBS data",FelixKrueger,TrimGalore,https://github.com/FelixKrueger/TrimGalore
2022-10-06,perl,26,0,Nginx C module to allow deeper control of Nginx behaviors by Kong Lua code,Kong,lua-kong-nginx-module,https://github.com/Kong/lua-kong-nginx-module