date,language,stargazers,starsToday,description,owner,name,url
2022-01-18,php,5480,7,Open Source Invoicing Solution for Individuals & Businesses,crater-invoice,crater,https://github.com/crater-invoice/crater
2022-01-18,php,6355,4,"List of 78 languages for Laravel Framework 4-9, Laravel Jetstream, Laravel Fortify, Laravel Breeze, Laravel Cashier, Laravel Nova, Laravel Spark and Laravel UI.",Laravel-Lang,lang,https://github.com/Laravel-Lang/lang
2022-01-18,php,13,3,,OmarFaruk20,Inventory_Management,https://github.com/OmarFaruk20/Inventory_Management
2022-01-18,php,3425,6,"EasyAdmin is a fast, beautiful and modern admin generator for Symfony applications.",EasyCorp,EasyAdminBundle,https://github.com/EasyCorp/EasyAdminBundle
2022-01-18,php,3062,4,"Pterodactyl® is a free, open-source game server management panel built with PHP, React, and Go. Designed with security in mind, Pterodactyl runs all game servers in isolated Docker containers while exposing a beautiful and intuitive UI to end users.",pterodactyl,panel,https://github.com/pterodactyl/panel
2022-01-18,php,2628,3,A server software for Minecraft: Bedrock Edition in PHP,pmmp,PocketMine-MP,https://github.com/pmmp/PocketMine-MP
2022-01-18,php,18178,5,The PHP Unit Testing framework.,sebastianbergmann,phpunit,https://github.com/sebastianbergmann/phpunit
2022-01-18,php,4599,4,A static analysis tool for finding errors in PHP applications,vimeo,psalm,https://github.com/vimeo/psalm
2022-01-18,php,36428,22,"SecLists is the security tester's companion. It's a collection of multiple types of lists used during security assessments, collected in one place. List types include usernames, passwords, URLs, sensitive data patterns, fuzzing payloads, web shells, and many more.",danielmiessler,SecLists,https://github.com/danielmiessler/SecLists
2022-01-18,php,1010,4,,pentestmonkey,php-reverse-shell,https://github.com/pentestmonkey/php-reverse-shell
2022-01-18,php,13578,4,Laravel Debugbar (Integrates PHP Debug Bar),barryvdh,laravel-debugbar,https://github.com/barryvdh/laravel-debugbar
2022-01-18,php,5471,4,Collections Abstraction Library,doctrine,collections,https://github.com/doctrine/collections
2022-01-18,php,3783,4,"SQLI labs to test error based, Blind boolean based, Time based.",Audi-1,sqli-labs,https://github.com/Audi-1/sqli-labs
2022-01-18,php,3406,4,"Wave - The Software as a Service Starter Kit, designed to help you build the SAAS of your dreams",thedevdojo,wave,https://github.com/thedevdojo/wave
2022-01-18,php,5784,2,A web interface for MySQL and MariaDB,phpmyadmin,phpmyadmin,https://github.com/phpmyadmin/phpmyadmin
2022-01-18,php,31095,4,"File Upload widget with multiple file selection, drag&drop support, progress bar, validation and preview images, audio and video for jQuery. Supports cross-domain, chunked and resumable file uploads. Works with any server-side platform (Google App Engine, PHP, Python, Ruby on Rails, Java, etc.) that supports standard HTML form file uploads.",blueimp,jQuery-File-Upload,https://github.com/blueimp/jQuery-File-Upload
2022-01-18,php,2865,3,A Laravel publishing platform,austintoddj,canvas,https://github.com/austintoddj/canvas
2022-01-18,php,494,3,,Cesar-Hack-Gray,FotoSploit,https://github.com/Cesar-Hack-Gray/FotoSploit
2022-01-18,php,6363,4,Annotations Docblock Parser,doctrine,annotations,https://github.com/doctrine/annotations
2022-01-18,php,13865,3,"Yii 2: The Fast, Secure and Professional PHP Framework",yiisoft,yii2,https://github.com/yiisoft/yii2
2022-01-18,php,15843,6,"WordPress, Git-ified. This repository is just a mirror of the WordPress subversion repository. Please do not send pull requests. Submit pull requests to https://github.com/WordPress/wordpress-develop and patches to https://core.trac.wordpress.org/ instead.",WordPress,WordPress,https://github.com/WordPress/WordPress
2022-01-18,php,6021,1,"A spec compliant, secure by default PHP OAuth 2.0 Server",thephpleague,oauth2-server,https://github.com/thephpleague/oauth2-server
2022-01-18,php,3510,4,The Doctrine Persistence project is a library that provides common abstractions for object mapper persistence.,doctrine,persistence,https://github.com/doctrine/persistence
2022-01-18,php,18005,15,"Nextcloud server, a safe home for all your data",nextcloud,server,https://github.com/nextcloud/server
2022-01-18,php,3491,4,A non-blocking concurrency framework for PHP applications.,amphp,amp,https://github.com/amphp/amp