date,language,stargazers,starsToday,description,owner,name,url
2022-01-18,shell,63148,92,"""The mother of all demo apps"" — Exemplary fullstack Medium.com clone powered by React, Angular, Node, Django, and many more",gothinkster,realworld,https://github.com/gothinkster/realworld
2022-01-18,shell,7153,10,A build system and primary set of packages for Termux.,termux,termux-packages,https://github.com/termux/termux-packages
2022-01-18,shell,2372,14,A cli tool to browse and play anime,pystardust,ani-cli,https://github.com/pystardust/ani-cli
2022-01-18,shell,937,13,Automated Arch Linux Install,ChrisTitusTech,ArchTitus,https://github.com/ChrisTitusTech/ArchTitus
2022-01-18,shell,54664,24,Node Version Manager - POSIX-compliant bash script to manage multiple active node.js versions,nvm-sh,nvm,https://github.com/nvm-sh/nvm
2022-01-18,shell,4730,8,"Prowler is a security tool to perform AWS security best practices assessments, audits, incident response, continuous monitoring, hardening and forensics readiness. It contains more than 200 controls covering CIS, ISO27001, GDPR, HIPAA, SOC2, ENS and other security frameworks.",toniblyx,prowler,https://github.com/toniblyx/prowler
2022-01-18,shell,4281,4,Mac setup and configuration via Ansible.,geerlingguy,mac-dev-playbook,https://github.com/geerlingguy/mac-dev-playbook
2022-01-18,shell,3902,2,This is a multi-use bash script for Linux systems to audit wireless networks.,v1s1t0r1sh3r3,airgeddon,https://github.com/v1s1t0r1sh3r3/airgeddon
2022-01-18,shell,3847,7,Docker image that provides a Minecraft Server that will automatically download selected version at startup,itzg,docker-minecraft-server,https://github.com/itzg/docker-minecraft-server
2022-01-18,shell,34586,22,A black hole for Internet advertisements,pi-hole,pi-hole,https://github.com/pi-hole/pi-hole
2022-01-18,shell,1985,1,reconFTW is a tool designed to perform automated recon on a target domain by running the best set of tools to perform scanning and finding out vulnerabilities,six2dez,reconftw,https://github.com/six2dez/reconftw
2022-01-18,shell,1555,1,The Void source packages collection,void-linux,void-packages,https://github.com/void-linux/void-packages
2022-01-18,shell,11831,6,"Tools to set up a quick macOS VM in QEMU, accelerated by KVM.",foxlet,macOS-Simple-KVM,https://github.com/foxlet/macOS-Simple-KVM
2022-01-18,shell,20991,10,"Over 250 terminal color schemes/themes for iTerm/iTerm2. Includes ports to Terminal, Konsole, PuTTY, Xresources, XRDB, Remmina, Termite, XFCE, Tilda, FreeBSD VT, Terminator, Kitty, MobaXterm, LXTerminal, Microsoft's Windows Terminal, Visual Studio, Alacritty",mbadolato,iTerm2-Color-Schemes,https://github.com/mbadolato/iTerm2-Color-Schemes
2022-01-18,shell,695,3,Raspberry Pi App Store for Open Source Projects,Botspot,pi-apps,https://github.com/Botspot/pi-apps
2022-01-18,shell,4403,3,Pi-hole in a docker container,pi-hole,docker-pi-hole,https://github.com/pi-hole/docker-pi-hole
2022-01-18,shell,15316,7,最好用的 V2Ray 一键安装脚本 & 管理脚本,233boy,v2ray,https://github.com/233boy/v2ray
2022-01-18,shell,647,0,Klipper Installation And Update Helper,th33xitus,kiauh,https://github.com/th33xitus/kiauh
2022-01-18,shell,1781,2,Advanced Phishing tool for Linux & Termux,htr-tech,nexphisher,https://github.com/htr-tech/nexphisher
2022-01-18,shell,8756,9,A curated list of command line apps,agarrharr,awesome-cli-apps,https://github.com/agarrharr/awesome-cli-apps
2022-01-18,shell,4079,6,"Quickly create and run optimised Windows, macOS and Linux desktop virtual machines.",quickemu-project,quickemu,https://github.com/quickemu-project/quickemu
2022-01-18,shell,484,4,RedPill Loader Generator,RedPill-TTG,redpill-load,https://github.com/RedPill-TTG/redpill-load
2022-01-18,shell,4870,9,"A template for building OpenWrt with GitHub Actions | 使用 GitHub Actions 云编译 OpenWrt",P3TERX,Actions-OpenWrt,https://github.com/P3TERX/Actions-OpenWrt
2022-01-18,shell,462,2,A walkthrough for optimal Audiobook experience using Plex,seanap,Plex-Audiobook-Guide,https://github.com/seanap/Plex-Audiobook-Guide
2022-01-18,shell,2041,11,,BtbN,FFmpeg-Builds,https://github.com/BtbN/FFmpeg-Builds