date,language,stargazers,starsToday,description,owner,name,url
2022-05-03,lua,83,17,Combined Resource Folder from Multiple Sources of certain anime game,Koko-boya,Grasscutter_Resources,https://github.com/Koko-boya/Grasscutter_Resources
2022-05-03,lua,4399,12,Quickstart configurations for the Nvim LSP client,neovim,nvim-lspconfig,https://github.com/neovim/nvim-lspconfig
2022-05-03,lua,2732,7,"A use-package inspired plugin manager for Neovim. Uses native packages, supports Luarocks dependencies, written in Lua, allows for expressive config",wbthomason,packer.nvim,https://github.com/wbthomason/packer.nvim
2022-05-03,lua,8760,11,"An attempt to make neovim cli functional like an IDE while being very beautiful, blazing fast startuptime ~ 0.06 secs",NvChad,NvChad,https://github.com/NvChad/NvChad
2022-05-03,lua,1493,11,Neovim plugin that allows you to seamlessly manage LSP servers with :LspInstall. With full Windows support!,williamboman,nvim-lsp-installer,https://github.com/williamboman/nvim-lsp-installer
2022-05-03,lua,8480,19,An IDE layer for Neovim with sane defaults. Completely free and community driven.,LunarVim,LunarVim,https://github.com/LunarVim/LunarVim
2022-05-03,lua,1954,9,A Neovim config designed from scratch to be understandable,LunarVim,Neovim-from-scratch,https://github.com/LunarVim/Neovim-from-scratch
2022-05-03,lua,2704,9,A completion plugin for neovim coded in Lua.,hrsh7th,nvim-cmp,https://github.com/hrsh7th/nvim-cmp
2022-05-03,lua,2671,9,AstroNvim is an aesthetic and feature-rich neovim config that is extensible and easy to use with a great set of plugins,AstroNvim,AstroNvim,https://github.com/AstroNvim/AstroNvim
2022-05-03,lua,1290,6,"Use Neovim as a language server to inject LSP diagnostics, code actions, and more via Lua.",jose-elias-alvarez,null-ls.nvim,https://github.com/jose-elias-alvarez/null-ls.nvim
2022-05-03,lua,888,1,LSP signature hint as you type,ray-x,lsp_signature.nvim,https://github.com/ray-x/lsp_signature.nvim
2022-05-03,lua,518,0,My configuration files and tools,tjdevries,config_manager,https://github.com/tjdevries/config_manager
2022-05-03,lua,989,4,A neovim lua plugin to help easily manage multiple terminal windows,akinsho,toggleterm.nvim,https://github.com/akinsho/toggleterm.nvim
2022-05-03,lua,426,5,a lua powered greeter like vim-startify / dashboard-nvim,goolord,alpha-nvim,https://github.com/goolord/alpha-nvim
2022-05-03,lua,10378,10,"An ebook reader application supporting PDF, DjVu, EPUB, FB2 and many more formats, running on Cervantes, Kindle, Kobo, PocketBook and Android devices",koreader,koreader,https://github.com/koreader/koreader
2022-05-03,lua,849,7,plenary: full; complete; entire; absolute; unqualified. All the lua functions I don't want to write twice.,nvim-lua,plenary.nvim,https://github.com/nvim-lua/plenary.nvim
2022-05-03,lua,2334,7,A file explorer tree for neovim written in lua,kyazdani42,nvim-tree.lua,https://github.com/kyazdani42/nvim-tree.lua
2022-05-03,lua,5608,20,"Find, Filter, Preview, Pick. All lua, all the time.",nvim-telescope,telescope.nvim,https://github.com/nvim-telescope/telescope.nvim
2022-05-03,lua,221,0,nvim-cmp source for neovim builtin LSP client,hrsh7th,cmp-nvim-lsp,https://github.com/hrsh7th/cmp-nvim-lsp
2022-05-03,lua,1466,4,Git integration for buffers,lewis6991,gitsigns.nvim,https://github.com/lewis6991/gitsigns.nvim
2022-05-03,lua,1559,3,"A pretty diagnostics, references, telescope results, quickfix and location list to help you solve all the trouble your code is causing.",folke,trouble.nvim,https://github.com/folke/trouble.nvim
2022-05-03,lua,1703,3,A blazing fast and easy to configure neovim statusline plugin written in pure lua.,nvim-lualine,lualine.nvim,https://github.com/nvim-lualine/lualine.nvim
2022-05-03,lua,20,3,fivem-appearance for qb-core with Tattoos support,iLLeniumStudios,fivem-appearance,https://github.com/iLLeniumStudios/fivem-appearance
2022-05-03,lua,885,0,autopairs for neovim written by lua,windwp,nvim-autopairs,https://github.com/windwp/nvim-autopairs
2022-05-03,lua,461,0,Neovim plugin to improve the default vim.ui interfaces,stevearc,dressing.nvim,https://github.com/stevearc/dressing.nvim