date,language,stargazers,starsToday,description,owner,name,url
2023-03-29,elixir,3389,1,Automate code & data workflows with interactive Elixir notebooks,livebook-dev,livebook,https://github.com/livebook-dev/livebook
2023-03-29,elixir,2353,4,Blockchain explorer for Ethereum based network and a tool for inspecting and analyzing EVM based blockchains.,blockscout,blockscout,https://github.com/blockscout/blockscout
2023-03-29,elixir,1434,0,A merge bot for GitHub Pull Requests,bors-ng,bors-ng,https://github.com/bors-ng/bors-ng
2023-03-29,elixir,57,0,Public database of Elixir security advisories pulled from GitHub Advisory Database,mirego,elixir-security-advisories,https://github.com/mirego/elixir-security-advisories
2023-03-29,elixir,2929,1,Simplify deployments in Elixir with OTP releases!,bitwalker,distillery,https://github.com/bitwalker/distillery
2023-03-29,elixir,19332,5,Peace of mind from prototype to production,phoenixframework,phoenix,https://github.com/phoenixframework/phoenix
2023-03-29,elixir,801,2,An Elixir Library for Stripe,beam-community,stripity-stripe,https://github.com/beam-community/stripity-stripe
2023-03-29,elixir,2114,0,Multi-dimensional arrays (tensors) and numerical definitions for Elixir,elixir-nx,nx,https://github.com/elixir-nx/nx
2023-03-29,elixir,3704,4,A self-hosted data logger for your Tesla,adriankumpf,teslamate,https://github.com/adriankumpf/teslamate
2023-03-29,elixir,21425,7,"Elixir is a dynamic, functional language designed for building scalable and maintainable applications",elixir-lang,elixir,https://github.com/elixir-lang/elixir
2023-03-29,elixir,0,0,Client for talking to TicketUtils API,SeatScouts,ex_ticket_utils,https://github.com/SeatScouts/ex_ticket_utils
2023-03-29,elixir,72,1,Moon Design System for Elixir,coingaming,moon,https://github.com/coingaming/moon
2023-03-29,elixir,5140,2,"Rich, real-time user experiences with server-rendered HTML",phoenixframework,phoenix_live_view,https://github.com/phoenixframework/phoenix_live_view
2023-03-29,elixir,480,0,,DockYard-Academy,curriculum,https://github.com/DockYard-Academy/curriculum
2023-03-29,elixir,3906,6,WireGuard®-based VPN server and firewall,firezone,firezone,https://github.com/firezone/firezone
2023-03-29,elixir,13,1,LiveView app to demonstrating streams,SophieDeBenedetto,stream_chat,https://github.com/SophieDeBenedetto/stream_chat
2023-03-29,elixir,30,0,"The newest version of OpenFn's existing DPG, Lightning  provides a web UI to visually manage complex workflow automation projects.",OpenFn,Lightning,https://github.com/OpenFn/Lightning
2023-03-29,elixir,71,0,Traffic endpoint and graceful shutdown for Elixir Plug apps,Financial-Times,k8s_traffic_plug,https://github.com/Financial-Times/k8s_traffic_plug
2023-03-29,elixir,21,0,The fusion_auth library provides an Elixir API for accessing the FusionAuth Developer APIs.,leo-technologies-llc,fusion_auth,https://github.com/leo-technologies-llc/fusion_auth
2023-03-29,elixir,14313,14,"Simple, open-source, lightweight (< 1 KB) and privacy-friendly web analytics alternative to Google Analytics.",plausible,analytics,https://github.com/plausible/analytics
2023-03-29,elixir,1189,0,"A flexible, easy to use set of clients AWS APIs for Elixir",ex-aws,ex_aws,https://github.com/ex-aws/ex_aws
2023-03-29,elixir,5735,1,"Broadcast, Presence, and Postgres Changes via WebSockets",supabase,realtime,https://github.com/supabase/realtime
2023-03-29,elixir,875,2,"free4.chat is a real-time audio chat service. It is designed by the local first and privacy first principle, and is very easy to use.",madawei2699,free4chat,https://github.com/madawei2699/free4chat
2023-03-29,elixir,5710,1,A toolkit for data mapping and language integrated query.,elixir-ecto,ecto,https://github.com/elixir-ecto/ecto
2023-03-29,elixir,707,0,Series (one-dimensional) and dataframes (two-dimensional) for fast data exploration in Elixir,elixir-nx,explorer,https://github.com/elixir-nx/explorer