date,language,stargazers,starsToday,description,owner,name,url
2024-12-25,scala,7699,2,"An open-source storage framework that enables building a Lakehouse architecture with compute engines including Spark, PrestoDB, Flink, Trino, and Hive and APIs",delta-io,delta,https://github.com/delta-io/delta
2024-12-25,scala,1234,1,Gluten is a middle layer responsible for offloading JVM-based SQL engines' execution to native engines.,apache,incubator-gluten,https://github.com/apache/incubator-gluten
2024-12-25,scala,4815,1,"sbt, the interactive build tool",sbt,sbt,https://github.com/sbt/sbt
2024-12-25,scala,86,0,,aimacode,aima-scala,https://github.com/aimacode/aima-scala
2024-12-25,scala,2116,0,Apache Kyuubi is a distributed and multi-tenant gateway to provide serverless SQL on data warehouses and lakehouses.,apache,kyuubi,https://github.com/apache/kyuubi
2024-12-25,scala,4983,2,Open-source high-performance RISC-V processor,OpenXiangShan,XiangShan,https://github.com/OpenXiangShan/XiangShan
2024-12-25,scala,4053,3,Chisel: A Modern Hardware Design Language,chipsalliance,chisel,https://github.com/chipsalliance/chisel
2024-12-25,scala,2163,1,Open-source code analysis platform for C/C++/Java/Binary/Javascript/Python/Kotlin based on code property graphs. Discord https://discord.gg/vv4MH284Hc,joernio,joern,https://github.com/joernio/joern
2024-12-25,scala,40242,9,Apache Spark - A unified analytics engine for large-scale data processing,apache,spark,https://github.com/apache/spark
2024-12-25,scala,1005,0,Scientific workflow engine designed for simplicity & scalability. Trivially transition between one off use cases to massive scale production environments,broadinstitute,cromwell,https://github.com/broadinstitute/cromwell
2024-12-25,scala,3333,0,"Deequ is a library built on top of Apache Spark for defining ""unit tests for data"", which measure data quality in large datasets.",awslabs,deequ,https://github.com/awslabs/deequ
2024-12-25,scala,1692,1,"An Agile RISC-V SoC Design Framework with in-order cores, out-of-order cores, accelerators, and more",ucb-bar,chipyard,https://github.com/ucb-bar/chipyard
2024-12-25,scala,2897,2,Spark: The Definitive Guide's Code Repository,databricks,Spark-The-Definitive-Guide,https://github.com/databricks/Spark-The-Definitive-Guide
2024-12-25,scala,14360,1,Scala 2 compiler and standard library. Scala 2 bugs at https://github.com/scala/bug; Scala 3 at https://github.com/scala/scala3,scala,scala,https://github.com/scala/scala
2024-12-25,scala,3481,2,"TheHive: a Scalable, Open Source and Free Security Incident Response Platform",TheHive-Project,TheHive,https://github.com/TheHive-Project/TheHive
2024-12-25,scala,9183,3,"A Git platform powered by Scala with easy installation, high extensibility & GitHub API compatibility",gitbucket,gitbucket,https://github.com/gitbucket/gitbucket
2024-12-25,scala,894,0,Apache Livy is an open source REST interface for interacting with Apache Spark from anywhere.,apache,incubator-livy,https://github.com/apache/incubator-livy
2024-12-25,scala,805,1,The Daml smart contract language,digital-asset,daml,https://github.com/digital-asset/daml
2024-12-25,scala,15888,7,"♞ lichess.org: the forever free, adless and open source chess server ♞",lichess-org,lila,https://github.com/lichess-org/lila
2024-12-25,scala,11854,0,CMAK is a tool for managing Apache Kafka clusters,yahoo,CMAK,https://github.com/yahoo/CMAK