date,language,stargazers,starsToday,description,owner,name,url
2024-10-02,php,18117,36,"A collection of beautiful full-stack components for Laravel. The perfect starting point for your next app. Using Livewire, Alpine.js and Tailwind CSS.",filamentphp,filament,https://github.com/filamentphp/filament
2024-10-02,php,32229,69,An open-source & self-hostable Heroku / Netlify / Vercel alternative.,coollabsio,coolify,https://github.com/coollabsio/coolify
2024-10-02,php,8108,2,PrestaShop is the universal open-source software platform to build your e-commerce solution.,PrestaShop,PrestaShop,https://github.com/PrestaShop/PrestaShop
2024-10-02,php,15907,2,🐦 A personal music streaming server that works.,koel,koel,https://github.com/koel/koel
2024-10-02,php,21495,9,"Personal CRM. Remember everything about your friends, family and business relationships.",monicahq,monica,https://github.com/monicahq/monica
2024-10-02,php,14990,14,A platform to create documentation/wiki content built with PHP & Laravel,BookStackApp,BookStack,https://github.com/BookStackApp/BookStack
2024-10-02,php,11489,3,"Prior to making any Submission(s), you must sign an Adobe Contributor License Agreement, available here at: https://opensource.adobe.com/cla.html. All Submissions you make to Adobe Inc. and its affiliates, assigns and subsidiaries (collectively “Adobe”) are subject to the terms of the Adobe Contributor License Agreement.",magento,magento2,https://github.com/magento/magento2
2024-10-02,php,3805,1,Community-based GPL-licensed network monitoring system,librenms,librenms,https://github.com/librenms/librenms
2024-10-02,php,3114,2,The most popular open source electronic health records and medical practice management solution.,openemr,openemr,https://github.com/openemr/openemr
2024-10-02,php,22264,4,A full-stack framework for Laravel that takes the pain out of building dynamic UIs.,livewire,livewire,https://github.com/livewire/livewire
2024-10-02,php,29661,11,The Symfony PHP framework,symfony,symfony,https://github.com/symfony/symfony
2024-10-02,php,7279,5,"🌍 Discover our global repository of countries, states, and cities! 🏙️ Get comprehensive data in JSON, SQL, PSQL, XML, YAML, and CSV formats. Access ISO2, ISO3 codes, country code, capital, native language, timezones (for countries), and more. #countries #states #cities",dr5hn,countries-states-cities-database,https://github.com/dr5hn/countries-states-cities-database
2024-10-02,php,9310,4,A PHP client library for accessing Google APIs,googleapis,google-api-php-client,https://github.com/googleapis/google-api-php-client
2024-10-02,php,5474,1,⚗️ Adds code analysis to Laravel improving developer productivity and code quality.,larastan,larastan,https://github.com/larastan/larastan
2024-10-02,php,2492,1,"WordPress Develop, Git-ified. Synced from git://develop.git.wordpress.org/, including branches and tags! This repository is just a mirror of the WordPress subversion repository. Please include a link to a pre-existing ticket on https://core.trac.wordpress.org/ with every pull request.",WordPress,wordpress-develop,https://github.com/WordPress/wordpress-develop
2024-10-02,php,1041,0,The TYPO3 Core - Enterprise Content Management System. Synchronized mirror of https://review.typo3.org/q/project:Packages/TYPO3.CMS,TYPO3,typo3,https://github.com/TYPO3/typo3
2024-10-02,php,7864,5,Open Source eCommerce Framework on Symfony,Sylius,Sylius,https://github.com/Sylius/Sylius
2024-10-02,php,4876,4,"Single-file PHP file manager, browser and manage your files efficiently and easily with tinyfilemanager",prasathmani,tinyfilemanager,https://github.com/prasathmani/tinyfilemanager
2024-10-02,php,4049,1,"EasyAdmin is a fast, beautiful and modern admin generator for Symfony applications.",EasyCorp,EasyAdminBundle,https://github.com/EasyCorp/EasyAdminBundle