date,language,stargazers,starsToday,description,owner,name,url
2024-10-02,scala,15208,41,"♞ lichess.org: the forever free, adless and open source chess server ♞",lichess-org,lila,https://github.com/lichess-org/lila
2024-10-02,scala,7483,2,"An open-source storage framework that enables building a Lakehouse architecture with compute engines including Spark, PrestoDB, Flink, Trino, and Hive and APIs",delta-io,delta,https://github.com/delta-io/delta
2024-10-02,scala,1159,2,Gluten is a middle layer responsible for offloading JVM-based SQL engines' execution to native engines.,apache,incubator-gluten,https://github.com/apache/incubator-gluten
2024-10-02,scala,3388,0,"TheHive: a Scalable, Open Source and Free Security Incident Response Platform",TheHive-Project,TheHive,https://github.com/TheHive-Project/TheHive
2024-10-02,scala,62121,5,Source code for Twitter's Recommendation Algorithm,twitter,the-algorithm,https://github.com/twitter/the-algorithm
2024-10-02,scala,753,0,An open protocol for secure data sharing,delta-io,delta-sharing,https://github.com/delta-io/delta-sharing
2024-10-02,scala,4076,0,"ZIO — A type-safe, composable library for async and concurrent programming in Scala",zio,zio,https://github.com/zio/zio
2024-10-02,scala,6420,5,Modern Load Testing as Code,gatling,gatling,https://github.com/gatling/gatling
2024-10-02,scala,3933,0,Chisel: A Modern Hardware Design Language,chipsalliance,chisel,https://github.com/chipsalliance/chisel
2024-10-02,scala,39395,6,Apache Spark - A unified analytics engine for large-scale data processing,apache,spark,https://github.com/apache/spark
2024-10-02,scala,13038,1,"Build highly concurrent, distributed, and resilient message-driven applications on the JVM",akka,akka,https://github.com/akka/akka
2024-10-02,scala,4742,0,Open-source high-performance RISC-V processor,OpenXiangShan,XiangShan,https://github.com/OpenXiangShan/XiangShan
2024-10-02,scala,6495,1,Apache OpenWhisk is an open source serverless cloud platform,apache,openwhisk,https://github.com/apache/openwhisk
2024-10-02,scala,792,0,Spark RAPIDS plugin - accelerate Apache Spark with GPUs,NVIDIA,spark-rapids,https://github.com/NVIDIA/spark-rapids
2024-10-02,scala,3826,1,State of the Art Natural Language Processing,JohnSnowLabs,spark-nlp,https://github.com/JohnSnowLabs/spark-nlp
2024-10-02,scala,31,0,,broadinstitute,firecloud-orchestration,https://github.com/broadinstitute/firecloud-orchestration
2024-10-02,scala,220,0,The batteries-included testing and formal verification library for Chisel-based RTL designs.,ucb-bar,chiseltest,https://github.com/ucb-bar/chiseltest
2024-10-02,scala,3181,1,Rocket Chip Generator,chipsalliance,rocket-chip,https://github.com/chipsalliance/rocket-chip
2024-10-02,scala,9142,0,"A Git platform powered by Scala with easy installation, high extensibility & GitHub API compatibility",gitbucket,gitbucket,https://github.com/gitbucket/gitbucket
2024-10-02,scala,2080,2,Scala language server with rich IDE features 🚀,scalameta,metals,https://github.com/scalameta/metals