date,language,stargazers,starsToday,description,owner,name,url
2024-05-21,svelte,1717,2,"A modern, easy-to-use and performant custom Home Assistant dashboard",matt8707,ha-fusion,https://github.com/matt8707/ha-fusion
2024-05-21,svelte,1824,1,"Bittorrent streaming software for cats. Stream anime torrents, real-time with no waiting for downloads.",ThaUnknown,miru,https://github.com/ThaUnknown/miru
2024-05-21,svelte,8763,13,Open-source developer platform to turn scripts into workflows and UIs. Fastest workflow engine (5x vs Airflow). Open-source alternative to Airplane and Retool.,windmill-labs,windmill,https://github.com/windmill-labs/windmill
2024-05-21,svelte,401,0,"FreeShow is a free and open-source, user-friendly presenter software.",ChurchApps,FreeShow,https://github.com/ChurchApps/FreeShow
2024-05-21,svelte,1933,2,Official Svelte components built for Flowbite and Tailwind CSS,themesberg,flowbite-svelte,https://github.com/themesberg/flowbite-svelte
2024-05-21,svelte,4433,3,"Database manager for MySQL, PostgreSQL, SQL Server, MongoDB, SQLite and others. Runs under Windows, Linux, Mac or as web application",dbgate,dbgate,https://github.com/dbgate/dbgate
2024-05-21,svelte,146,6,🐉 WireGuard VPN Server with an web-based admin UI + TOR,shahradelahi,wireadmin,https://github.com/shahradelahi/wireadmin
2024-05-21,svelte,1158,3,"Reiverr is a clean combined interface for Jellyfin, TMDB, Radarr and Sonarr, as well as a replacement to Overseerr",aleksilassila,reiverr,https://github.com/aleksilassila/reiverr
2024-05-21,svelte,4603,4,The UI toolkit for Svelte and Tailwind.,skeletonlabs,skeleton,https://github.com/skeletonlabs/skeleton
2024-05-21,svelte,0,0,,bkuehnis,KI-Anwendungen-n-to-n-frontend,https://github.com/bkuehnis/KI-Anwendungen-n-to-n-frontend
2024-05-21,svelte,1884,0,"Primo is a visual CMS with a built-in code editor, Svelte blocks, and static site generator.",primocms,primo,https://github.com/primocms/primo
2024-05-21,svelte,94,1,A Radio Script for Fivem Server,SOH69,mm_radio,https://github.com/SOH69/mm_radio
2024-05-21,svelte,136,3,📮 The free temporary email service powered by Cloudflare,berrysauce,justatemp,https://github.com/berrysauce/justatemp
2024-05-21,svelte,1775,0,"A simple standalone program which automates the installation, removal and maintenance of BetterDiscord.",BetterDiscord,Installer,https://github.com/BetterDiscord/Installer
2024-05-21,svelte,4044,7,"shadcn/ui, but for Svelte. ✨",huntabyte,shadcn-svelte,https://github.com/huntabyte/shadcn-svelte
2024-05-21,svelte,132,0,Ultra customizable hud featuring a unique and robust settings menu. Change eveything about your experience!,Project-Sloth,ps-hud,https://github.com/Project-Sloth/ps-hud
2024-05-21,svelte,268,1,🌐 Website for ReVanced,ReVanced,revanced-website,https://github.com/ReVanced/revanced-website
2024-05-21,svelte,302,14,Modern material design for Invidious.,Materialious,Materialious,https://github.com/Materialious/Materialious
2024-05-21,svelte,331,1,,iptv-org,iptv-org.github.io,https://github.com/iptv-org/iptv-org.github.io
2024-05-21,svelte,114,0,LOA Logs - Modern DPS Meter for Lost Ark,snoww,loa-logs,https://github.com/snoww/loa-logs
2024-05-21,svelte,22787,405,User-friendly WebUI for LLMs (Formerly Ollama WebUI),open-webui,open-webui,https://github.com/open-webui/open-webui
2024-05-21,svelte,156,4,"GDPR compliant, self-hosted CAPTCHA alternative. Now with API and a Spam Filter!",altcha-org,altcha,https://github.com/altcha-org/altcha
2024-05-21,svelte,2347,9,"Huly — All-in-One Project Management Platform (alternative to Linear, Jira, Slack, Notion, Motion)",hcengineering,platform,https://github.com/hcengineering/platform
2024-05-21,svelte,750,5,"A modern SaaS template/boilerplate built with SvelteKit, Tailwind, and Supabase. Includes marketing page, blog, subscriptions, auth, user dashboard, user settings, pricing page, and more.",CriticalMoments,CMSaasStarter,https://github.com/CriticalMoments/CMSaasStarter
2024-05-21,svelte,1,0,a FiveM car rental script,TheExquis,ex-rental,https://github.com/TheExquis/ex-rental