date,language,stargazers,starsToday,description,owner,name,url
2024-10-09,php,13307,3,A pure PHP library for reading and writing spreadsheet files,PHPOffice,PhpSpreadsheet,https://github.com/PHPOffice/PhpSpreadsheet
2024-10-09,php,28571,1,Dependency Manager for PHP,composer,composer,https://github.com/composer/composer
2024-10-09,php,2504,5,"WordPress Develop, Git-ified. Synced from git://develop.git.wordpress.org/, including branches and tags! This repository is just a mirror of the WordPress subversion repository. Please include a link to a pre-existing ticket on https://core.trac.wordpress.org/ with every pull request.",WordPress,wordpress-develop,https://github.com/WordPress/wordpress-develop
2024-10-09,php,4180,3,"GLPI is a Free Asset and IT Management Software package, Data center management, ITIL Service Desk, licenses tracking and software auditing.",glpi-project,glpi,https://github.com/glpi-project/glpi
2024-10-09,php,14789,16,Free and open source laravel eCommerce platform,bagisto,bagisto,https://github.com/bagisto/bagisto
2024-10-09,php,23153,1,"Guzzle, an extensible PHP HTTP client",guzzle,guzzle,https://github.com/guzzle/guzzle
2024-10-09,php,18274,32,"A collection of beautiful full-stack components for Laravel. The perfect starting point for your next app. Using Livewire, Alpine.js and Tailwind CSS.",filamentphp,filament,https://github.com/filamentphp/filament
2024-10-09,php,5307,5,MISP (core software) - Open Source Threat Intelligence and Sharing Platform,MISP,MISP,https://github.com/MISP/MISP
2024-10-09,php,19735,6,Empowering People Ethically with the leading open source alternative to Google Analytics that gives you full control over your data. Matomo lets you easily collect data from websites & apps and visualise this data and extract insights. Privacy is built-in. Liberating Web Analytics. Star us on Github? +1. And we love Pull Requests!,matomo-org,matomo,https://github.com/matomo-org/matomo
2024-10-09,php,6997,0,A MongoDB based Eloquent model and Query builder for Laravel (Moloquent),mongodb,laravel-mongodb,https://github.com/mongodb/laravel-mongodb
2024-10-09,php,22294,4,A full-stack framework for Laravel that takes the pain out of building dynamic UIs.,livewire,livewire,https://github.com/livewire/livewire
2024-10-09,php,4182,0,Official clone of PHP library to generate PDF documents and barcodes,tecnickcom,TCPDF,https://github.com/tecnickcom/TCPDF
2024-10-09,php,20987,5,The classic email sending library for PHP,PHPMailer,PHPMailer,https://github.com/PHPMailer/PHPMailer
2024-10-09,php,8671,2,Instant Upgrades and Automated Refactoring of any PHP 5.3+ code,rectorphp,rector,https://github.com/rectorphp/rector
2024-10-09,php,2332,1,"Drush is a command-line shell and scripting interface for Drupal, a veritable Swiss Army knife designed to make life easier for those who spend their working hours hacking away at the command prompt.",drush-ops,drush,https://github.com/drush-ops/drush
2024-10-09,php,11496,0,"Prior to making any Submission(s), you must sign an Adobe Contributor License Agreement, available here at: https://opensource.adobe.com/cla.html. All Submissions you make to Adobe Inc. and its affiliates, assigns and subsidiaries (collectively “Adobe”) are subject to the terms of the Adobe Contributor License Agreement.",magento,magento2,https://github.com/magento/magento2
2024-10-09,php,6667,5,"Pterodactyl® is a free, open-source game server management panel built with PHP, React, and Go. Designed with security in mind, Pterodactyl runs all game servers in isolated Docker containers while exposing a beautiful and intuitive UI to end users.",pterodactyl,panel,https://github.com/pterodactyl/panel
2024-10-09,php,29693,3,The Symfony PHP framework,symfony,symfony,https://github.com/symfony/symfony
2024-10-09,php,4032,1,"Doctrine2 behavioral extensions, Translatable, Sluggable, Tree-NestedSet, Timestampable, Loggable, Sortable",doctrine-extensions,DoctrineExtensions,https://github.com/doctrine-extensions/DoctrineExtensions
2024-10-09,php,3817,4,Community-based GPL-licensed network monitoring system,librenms,librenms,https://github.com/librenms/librenms