date,language,stargazers,starsToday,description,owner,name,url
2024-11-01,scala,39675,34,Apache Spark - A unified analytics engine for large-scale data processing,apache,spark,https://github.com/apache/spark
2024-11-01,scala,2164,12,"Mill is a fast JVM build tool that supports Java and Scala. 2-4x faster than Gradle and 5-10x faster than Maven for common workflows, Mill aims to make your project’s build process performant, maintainable, and flexible",com-lihaoyi,mill,https://github.com/com-lihaoyi/mill
2024-11-01,scala,15583,6,"♞ lichess.org: the forever free, adless and open source chess server ♞",lichess-org,lila,https://github.com/lichess-org/lila
2024-11-01,scala,3301,0,"Deequ is a library built on top of Apache Spark for defining ""unit tests for data"", which measure data quality in large datasets.",awslabs,deequ,https://github.com/awslabs/deequ
2024-11-01,scala,1189,0,Gluten is a middle layer responsible for offloading JVM-based SQL engines' execution to native engines.,apache,incubator-gluten,https://github.com/apache/incubator-gluten
2024-11-01,scala,7556,1,"An open-source storage framework that enables building a Lakehouse architecture with compute engines including Spark, PrestoDB, Flink, Trino, and Hive and APIs",delta-io,delta,https://github.com/delta-io/delta
2024-11-01,scala,164,0,RISC-V Torture Test,ucb-bar,riscv-torture,https://github.com/ucb-bar/riscv-torture
2024-11-01,scala,881,0,FireSim: Fast and Effortless FPGA-accelerated Hardware Simulation with On-Prem and Cloud Flexibility,firesim,firesim,https://github.com/firesim/firesim
2024-11-01,scala,4817,1,Open-source high-performance RISC-V processor,OpenXiangShan,XiangShan,https://github.com/OpenXiangShan/XiangShan
2024-11-01,scala,3859,0,State of the Art Natural Language Processing,JohnSnowLabs,spark-nlp,https://github.com/JohnSnowLabs/spark-nlp
2024-11-01,scala,2865,2,Spark: The Definitive Guide's Code Repository,databricks,Spark-The-Definitive-Guide,https://github.com/databricks/Spark-The-Definitive-Guide
2024-11-01,scala,806,1,Berkeley's Spatial Array Generator,ucb-bar,gemmini,https://github.com/ucb-bar/gemmini
2024-11-01,scala,11111,3,"Removes large or troublesome blobs like git-filter-branch does, but faster. And written in Scala",rtyley,bfg-repo-cleaner,https://github.com/rtyley/bfg-repo-cleaner
2024-11-01,scala,466,0,A Spark plugin for reading and writing Excel files,nightscape,spark-excel,https://github.com/nightscape/spark-excel
2024-11-01,scala,1628,0,"An Agile RISC-V SoC Design Framework with in-order cores, out-of-order cores, accelerators, and more",ucb-bar,chipyard,https://github.com/ucb-bar/chipyard
2024-11-01,scala,6460,1,Modern Load Testing as Code,gatling,gatling,https://github.com/gatling/gatling
2024-11-01,scala,805,1,Spark RAPIDS plugin - accelerate Apache Spark with GPUs,NVIDIA,spark-rapids,https://github.com/NVIDIA/spark-rapids
2024-11-01,scala,3426,3,"TheHive: a Scalable, Open Source and Free Security Incident Response Platform",TheHive-Project,TheHive,https://github.com/TheHive-Project/TheHive
2024-11-01,scala,1338,1,Cortex: a Powerful Observable Analysis and Active Response Engine,TheHive-Project,Cortex,https://github.com/TheHive-Project/Cortex