date,language,stargazers,starsToday,description,owner,name,url
2022-07-06,scala,1110,1,"Apache Kyuubi is a distributed multi-tenant JDBC server for large-scale data processing and analytics, built on top of Apache Spark",apache,incubator-kyuubi,https://github.com/apache/incubator-kyuubi
2022-07-06,scala,775,16,"Feathr – An Enterprise-Grade, High Performance Feature Store",linkedin,feathr,https://github.com/linkedin/feathr
2022-07-06,scala,11631,4,"♞ lichess.org: the forever free, adless and open source chess server ♞",lichess-org,lila,https://github.com/lichess-org/lila
2022-07-06,scala,2529,1,"TheHive: a Scalable, Open Source and Free Security Incident Response Platform",TheHive-Project,TheHive,https://github.com/TheHive-Project/TheHive
2022-07-06,scala,5719,0,Apache OpenWhisk is an open source serverless cloud platform,apache,openwhisk,https://github.com/apache/openwhisk
2022-07-06,scala,12288,3,"Build highly concurrent, distributed, and resilient message-driven applications on the JVM",akka,akka,https://github.com/akka/akka
2022-07-06,scala,1953,2,In-memory message queue with an Amazon SQS-compatible interface. Runs stand-alone or embedded.,softwaremill,elasticmq,https://github.com/softwaremill/elasticmq
2022-07-06,scala,51,2,A Scala Kubernetes client library,hagay3,skuber,https://github.com/hagay3/skuber
2022-07-06,scala,2269,1,Rocket Chip Generator,chipsalliance,rocket-chip,https://github.com/chipsalliance/rocket-chip
2022-07-06,scala,148,0,"Open, Modular, Deep Learning Accelerator",apache,tvm-vta,https://github.com/apache/tvm-vta
2022-07-06,scala,52,0,Effect-Oriented Programming: Creating Reliable Systems with Scala 3 and ZIO 2,EffectOrientedProgramming,book,https://github.com/EffectOrientedProgramming/book
2022-07-06,scala,699,1,The Daml smart contract language,digital-asset,daml,https://github.com/digital-asset/daml
2022-07-06,scala,182,0,Apache Spark Connector for Azure Cosmos DB,Azure,azure-cosmosdb-spark,https://github.com/Azure/azure-cosmosdb-spark
2022-07-06,scala,1357,1,Twitter-Server defines a template from which services at Twitter are built,twitter,twitter-server,https://github.com/twitter/twitter-server
2022-07-06,scala,4716,1,"Lightweight, modular, and extensible library for functional programming.",typelevel,cats,https://github.com/typelevel/cats
2022-07-06,scala,1850,1,DataStax Spark Cassandra Connector,datastax,spark-cassandra-connector,https://github.com/datastax/spark-cassandra-connector
2022-07-06,scala,4,1,,windymelt,FNFIS,https://github.com/windymelt/FNFIS
2022-07-06,scala,73,1,FEEL parser and interpreter written in Scala,camunda,feel-scala,https://github.com/camunda/feel-scala
2022-07-06,scala,6125,1,"The enterprise-grade behavioral data engine (web, mobile, server-side, webhooks), running cloud-natively on AWS and GCP",snowplow,snowplow,https://github.com/snowplow/snowplow
2022-07-06,scala,1728,4,Scala language server with rich IDE features,scalameta,metals,https://github.com/scalameta/metals
2022-07-06,scala,5020,3,"The Scala 3 compiler, also known as Dotty.",lampepfl,dotty,https://github.com/lampepfl/dotty
2022-07-06,scala,8288,3,"A fault tolerant, protocol-agnostic RPC system",twitter,finagle,https://github.com/twitter/finagle
2022-07-06,scala,1555,1,深圳地铁大数据客流分析系统,geekyouth,SZT-bigdata,https://github.com/geekyouth/SZT-bigdata
2022-07-06,scala,408,0,XML data source for Spark SQL and DataFrames,databricks,spark-xml,https://github.com/databricks/spark-xml
2022-07-06,scala,1042,0,"Declarative, type-safe web endpoints library",softwaremill,tapir,https://github.com/softwaremill/tapir