date,language,stargazers,starsToday,description,owner,name,url
2022-07-06,shell,138,25,The docker-compose files for setting up a SearXNG instance with docker.,searxng,searxng-docker,https://github.com/searxng/searxng-docker
2022-07-06,shell,59110,49,Node Version Manager - POSIX-compliant bash script to manage multiple active node.js versions,nvm-sh,nvm,https://github.com/nvm-sh/nvm
2022-07-06,shell,27179,14,A pure Unix shell script implementing ACME client protocol,acmesh-official,acme.sh,https://github.com/acmesh-official/acme.sh
2022-07-06,shell,2527,5,Programmatically generated handy kubectl aliases.,ahmetb,kubectl-aliases,https://github.com/ahmetb/kubectl-aliases
2022-07-06,shell,119,6,"GooFuzz is a tool to perform fuzzing with an OSINT approach, managing to enumerate directories, files, subdomains or parameters without leaving evidence on the target's server and by means of advanced Google searches (Google Dorking).",m3n0sd0n4ld,GooFuzz,https://github.com/m3n0sd0n4ld/GooFuzz
2022-07-06,shell,712,2,"Armbian for Amlogic s9xxx tv box. Support a311d, s922x, s905x3, s905x2, s912, s905d, s905x, s905w, s905, etc. including install to EMMC and update related functions.",ophub,amlogic-s9xxx-armbian,https://github.com/ophub/amlogic-s9xxx-armbian
2022-07-06,shell,36769,13,A black hole for Internet advertisements,pi-hole,pi-hole,https://github.com/pi-hole/pi-hole
2022-07-06,shell,3920,30,A cli tool to browse and play anime,pystardust,ani-cli,https://github.com/pystardust/ani-cli
2022-07-06,shell,23267,4,A docker-powered PaaS that helps you build and manage the lifecycle of applications,dokku,dokku,https://github.com/dokku/dokku
2022-07-06,shell,14703,3,Default configuration for Le Wagon's students,lewagon,dotfiles,https://github.com/lewagon/dotfiles
2022-07-06,shell,565,26,A fast and lightweight native programming language,titzer,virgil,https://github.com/titzer/virgil
2022-07-06,shell,4920,8,"Quickly create and run optimised Windows, macOS and Linux desktop virtual machines.",quickemu-project,quickemu,https://github.com/quickemu-project/quickemu
2022-07-06,shell,2285,16,Soothing pastel theme for the high-spirited!,catppuccin,catppuccin,https://github.com/catppuccin/catppuccin
2022-07-06,shell,1479,5,Homebrew (un)installer,Homebrew,install,https://github.com/Homebrew/install
2022-07-06,shell,8009,2,Combination of multiple linters to install as a GitHub Action,github,super-linter,https://github.com/github/super-linter
2022-07-06,shell,2330,4,Easily install PHP extension in Docker containers,mlocati,docker-php-extension-installer,https://github.com/mlocati/docker-php-extension-installer
2022-07-06,shell,1627,2,"Hestia Control Panel | A lightweight and powerful control panel for the modern web.",hestiacp,hestiacp,https://github.com/hestiacp/hestiacp
2022-07-06,shell,437,2,Dynamic Kernel Module Support,dell,dkms,https://github.com/dell/dkms
2022-07-06,shell,11729,7,kaldi-asr/kaldi is the official location of the Kaldi project.,kaldi-asr,kaldi,https://github.com/kaldi-asr/kaldi
2022-07-06,shell,177,0,Release tooling for OpenShift,openshift,release,https://github.com/openshift/release
2022-07-06,shell,1572,2,Official Zabbix Dockerfiles,zabbix,zabbix-docker,https://github.com/zabbix/zabbix-docker
2022-07-06,shell,1171,0,"Scripts and samples to support Confluent Demos and Talks. Might be rough around the edges ;-) For automated tutorials and QA'd code, see https://github.com/confluentinc/examples/",confluentinc,demo-scene,https://github.com/confluentinc/demo-scene
2022-07-06,shell,6494,3,"Run Windows apps such as Microsoft Office/Adobe in Linux (Ubuntu/Fedora) and GNOME/KDE as if they were a part of the native OS, including Nautilus integration.",Fmstrat,winapps,https://github.com/Fmstrat/winapps
2022-07-06,shell,745,0,Helm chart to install Vault and other associated components.,hashicorp,vault-helm,https://github.com/hashicorp/vault-helm
2022-07-06,shell,14200,28,This repository is my documenting repository for learning the world of DevOps. I started this journey on the 1st January 2022 and I plan to run to March 31st for a complete 90-day romp on spending an hour a day including weekends to get a foundational knowledge across a lot of different areas that make up DevOps.,MichaelCade,90DaysOfDevOps,https://github.com/MichaelCade/90DaysOfDevOps