date,language,stargazers,starsToday,description,owner,name,url
2022-01-01,rust,9390,8,"A curated list of static analysis (SAST) tools for all programming languages, config files, build tools, and more.",analysis-tools-dev,static-analysis,https://github.com/analysis-tools-dev/static-analysis
2022-01-01,rust,5103,11,"The Rust SQL Toolkit. An async, pure Rust SQL crate featuring compile-time checked queries without a DSL. Supports PostgreSQL, MySQL, SQLite, and MSSQL.",launchbadge,sqlx,https://github.com/launchbadge/sqlx
2022-01-01,rust,8283,3,Create book from markdown files. Like Gitbook but implemented in Rust,rust-lang,mdBook,https://github.com/rust-lang/mdBook
2022-01-01,rust,972,17,An async & dynamic ORM for Rust,SeaQL,sea-orm,https://github.com/SeaQL/sea-orm
2022-01-01,rust,7279,23,"A full featured, fast Command Line Argument Parser for Rust",clap-rs,clap,https://github.com/clap-rs/clap
2022-01-01,rust,6796,6,A bunch of lints to catch common mistakes and improve your Rust code,rust-lang,rust-clippy,https://github.com/rust-lang/rust-clippy
2022-01-01,rust,1176,9,A collection of Solana-maintained on-chain programs,solana-labs,solana-program-library,https://github.com/solana-labs/solana-program-library
2022-01-01,rust,6157,13,Build terminal user interfaces and dashboards using Rust,fdehau,tui-rs,https://github.com/fdehau/tui-rs
2022-01-01,rust,6448,15,"Web-Scale Blockchain for fast, secure, scalable, decentralized apps and marketplaces.",solana-labs,solana,https://github.com/solana-labs/solana
2022-01-01,rust,14435,12,"A runtime for writing reliable asynchronous applications with Rust. Provides I/O, networking, scheduling, timers, ...",tokio-rs,tokio,https://github.com/tokio-rs/tokio
2022-01-01,rust,6197,17,egui: an easy-to-use immediate mode GUI in pure Rust,emilk,egui,https://github.com/emilk/egui
2022-01-01,rust,2720,4,Safe OpenGL wrapper for the Rust language.,glium,glium,https://github.com/glium/glium
2022-01-01,rust,451,24,<<Rust语言圣经(Rust Course)>>，本书对Rust语言进行全面且深入的讲解，辅以生动的文字和典型的示例。 这既是一本厚重的书籍，也是一门全面的课程，希望读者朋友能喜欢。,sunface,rust-course,https://github.com/sunface/rust-course
2022-01-01,rust,1273,3,AWS SDK for the Rust Programming Language,awslabs,aws-sdk-rust,https://github.com/awslabs/aws-sdk-rust
2022-01-01,rust,6896,19,Blazing  fast terminal-ui for git written in rust,extrawurst,gitui,https://github.com/extrawurst/gitui
2022-01-01,rust,25682,28,"Build smaller, faster, and more secure desktop applications with a web frontend.",tauri-apps,tauri,https://github.com/tauri-apps/tauri
2022-01-01,rust,16279,1,Diem’s mission is to build a trusted and innovative financial network that empowers people and businesses around the world.,diem,diem,https://github.com/diem/diem
2022-01-01,rust,49,8,rust raft with improvements,datafuselabs,openraft,https://github.com/datafuselabs/openraft
2022-01-01,rust,1495,3,Apache Arrow DataFusion and Ballista query engines,apache,arrow-datafusion,https://github.com/apache/arrow-datafusion
2022-01-01,rust,812,13,A Decentralized Operating System for Zero-Knowledge Applications,AleoHQ,snarkOS,https://github.com/AleoHQ/snarkOS
2022-01-01,rust,8126,22,A Rust compiler front-end for IDEs,rust-analyzer,rust-analyzer,https://github.com/rust-analyzer/rust-analyzer
2022-01-01,rust,1746,15,A framework for building compiled Node.js add-ons in Rust via Node-API,napi-rs,napi-rs,https://github.com/napi-rs/napi-rs
2022-01-01,rust,2581,9,Strongly typed JSON library for Rust,serde-rs,json,https://github.com/serde-rs/json
2022-01-01,rust,12572,11,A refreshingly simple data-driven game engine built in Rust,bevyengine,bevy,https://github.com/bevyengine/bevy
2022-01-01,rust,3446,19,"Safe and portable GPU abstraction in Rust, implementing WebGPU API.",gfx-rs,wgpu,https://github.com/gfx-rs/wgpu