date,language,stargazers,starsToday,description,owner,name,url
2022-10-22,perl,13718,13,Stack trace visualizer,brendangregg,FlameGraph,https://github.com/brendangregg/FlameGraph
2022-10-22,perl,15918,4,Good-lookin' diffs. Actually… nah… The best-lookin' diffs.,so-fancy,diff-so-fancy,https://github.com/so-fancy/diff-so-fancy
2022-10-22,perl,6154,2,Nikto web server scanner,sullo,nikto,https://github.com/sullo/nikto
2022-10-22,perl,340,0,The Ensembl Variant Effect Predictor predicts the functional effects of genomic variants,Ensembl,ensembl-vep,https://github.com/Ensembl/ensembl-vep
2022-10-22,perl,14911,7,"cloc counts blank lines, comment lines, and physical lines of source code in many programming languages.",AlDanial,cloc,https://github.com/AlDanial/cloc
2022-10-22,perl,2583,4,"Imapsync is an IMAP transfers tool. The purpose of imapsync is to migrate IMAP accounts or to backup IMAP accounts. IMAP is one of the three current standard protocols to access mailboxes, the two others are POP3 and HTTP with webmails, webmails are often tied to an IMAP server. Upstream website is",imapsync,imapsync,https://github.com/imapsync/imapsync
2022-10-22,perl,1302,0,This is the new home for ddclient. Ddclient is a Perl client used to update dynamic DNS entries for accounts on 'Dynamic DNS Network Services' free DNS service. It currently supports a lot of different routers and a few different services.,ddclient,ddclient,https://github.com/ddclient/ddclient
2022-10-22,perl,0,0,UAL's custom pre-job/post-job scripts for interfacing Veeam with MariaDB,ualbertalib,UAL-Veeam-MariaDB-Export,https://github.com/ualbertalib/UAL-Veeam-MariaDB-Export
2022-10-22,perl,234,0,KH Coder: for Quantitative Content Analysis or Text Mining,ko-ichi-h,khcoder,https://github.com/ko-ichi-h/khcoder
2022-10-22,perl,232,0,FusionInventory Agent,fusioninventory,fusioninventory-agent,https://github.com/fusioninventory/fusioninventory-agent
2022-10-22,perl,4129,1,"Git-it is a (Mac, Win, Linux) Desktop App for Learning Git and GitHub",jlord,git-it-electron,https://github.com/jlord/git-it-electron
2022-10-22,perl,43,0,Ce logiciel permet de contrôler le respect des normes des fichiers d'écritures comptables (FEC) conformément aux dispositions de l'article A.47 A-1 du livre des procédures fiscales.,DGFiP,Test-Compta-Demat,https://github.com/DGFiP/Test-Compta-Demat
2022-10-22,perl,81,3,GLPI Agent,glpi-project,glpi-agent,https://github.com/glpi-project/glpi-agent
2022-10-22,perl,267,1,"The Open Charge Point Interface (OCPI) allows for a scalable, automated roaming setup between Charge Point Operators and e-Mobility Service Providers. It supports authorisation, charge point information exchange (incl transaction events), charge detail record exchange and finally, the exchange of smart-charging commands between parties.",ocpi,ocpi,https://github.com/ocpi/ocpi
2022-10-22,perl,279,0,Collection of standard plugins to discover and gather cloud-to-edge metrics and status across your whole IT infrastructure.,centreon,centreon-plugins,https://github.com/centreon/centreon-plugins
2022-10-22,perl,0,0,Release history of Mollie-Micropayment,puneetsinghal111,Mollie-Micropayment,https://github.com/puneetsinghal111/Mollie-Micropayment
2022-10-22,perl,51,0,a perl library for sending email,rjbs,Email-Sender,https://github.com/rjbs/Email-Sender
2022-10-22,perl,673,1,Trinity RNA-Seq de novo transcriptome assembly,trinityrnaseq,trinityrnaseq,https://github.com/trinityrnaseq/trinityrnaseq
2022-10-22,perl,1043,1,"PacketFence is a fully supported, trusted, Free and Open Source network access control (NAC) solution. Boasting an impressive feature set including a captive-portal for registration and remediation, centralized wired and wireless management, powerful BYOD management options, 802.1X support, layer-2 isolation of problematic devices; PacketFence c…",inverse-inc,packetfence,https://github.com/inverse-inc/packetfence
2022-10-22,perl,601,1,LCOV,linux-test-project,lcov,https://github.com/linux-test-project/lcov
2022-10-22,perl,384,0,Movable Type,movabletype,movabletype,https://github.com/movabletype/movabletype
2022-10-22,perl,2376,0,OWASP ModSecurity Core Rule Set (CRS) Project (Official Repository),SpiderLabs,owasp-modsecurity-crs,https://github.com/SpiderLabs/owasp-modsecurity-crs
2022-10-22,perl,1589,1,"The book documenting the curl project, the curl tool, libcurl and more. Simply put: everything curl.",bagder,everything-curl,https://github.com/bagder/everything-curl
2022-10-22,perl,807,0,"Ora2Pg is a free tool used to migrate an Oracle database to a PostgreSQL compatible schema. It connects your Oracle database, scan it automatically and extracts its structure or data, it then generates SQL scripts that you can load into PostgreSQL.",darold,ora2pg,https://github.com/darold/ora2pg
2022-10-22,perl,234,0,Mass screening of contigs for antimicrobial and virulence genes,tseemann,abricate,https://github.com/tseemann/abricate