date,language,stargazers,starsToday,description,owner,name,url
2024-12-05,lua,3291,7,Lightweight yet powerful formatter plugin for Neovim,stevearc,conform.nvim,https://github.com/stevearc/conform.nvim
2024-12-05,lua,1490,12,"Performant, batteries-included completion plugin for Neovim",Saghen,blink.cmp,https://github.com/Saghen/blink.cmp
2024-12-05,lua,10251,18,🔥 A cross-platform build utility based on Lua,xmake-io,xmake,https://github.com/xmake-io/xmake
2024-12-05,lua,2626,3,"Navigate your code with search labels, enhanced character motions and Treesitter integration",folke,flash.nvim,https://github.com/folke/flash.nvim
2024-12-05,lua,1728,0,Use treesitter to auto close and auto rename html tag,windwp,nvim-ts-autotag,https://github.com/windwp/nvim-ts-autotag
2024-12-05,lua,6518,6,Modernity meets insane extensibility. The future of organizing your life in Neovim.,nvim-neorg,neorg,https://github.com/nvim-neorg/neorg
2024-12-05,lua,919,9,Find And Replace plugin for neovim,MagicDuck,grug-far.nvim,https://github.com/MagicDuck/grug-far.nvim
2024-12-05,lua,10830,5,Quickstart configs for Nvim LSP,neovim,nvim-lspconfig,https://github.com/neovim/nvim-lspconfig
2024-12-05,lua,39420,12,🦍 The Cloud-Native API Gateway and AI Gateway.,Kong,kong,https://github.com/Kong/kong
2024-12-05,lua,20252,18,A launch point for your personal nvim configuration,nvim-lua,kickstart.nvim,https://github.com/nvim-lua/kickstart.nvim
2024-12-05,lua,1160,3,A Neovim plugin enabling you to solve LeetCode problems.,kawre,leetcode.nvim,https://github.com/kawre/leetcode.nvim
2024-12-05,lua,17003,9,"An ebook reader application supporting PDF, DjVu, EPUB, FB2 and many more formats, running on Cervantes, Kindle, Kobo, PocketBook and Android devices",koreader,koreader,https://github.com/koreader/koreader
2024-12-05,lua,1817,5,🦀 Supercharge your Rust experience in Neovim! A heavily modified fork of rust-tools.nvim,mrcjkb,rustaceanvim,https://github.com/mrcjkb/rustaceanvim
2024-12-05,lua,2806,4,Fully featured & enhanced replacement for copilot.vim complete with API for interacting with Github Copilot,zbirenbaum,copilot.lua,https://github.com/zbirenbaum/copilot.lua
2024-12-05,lua,4306,5,Obsidian 🤝 Neovim,epwalsh,obsidian.nvim,https://github.com/epwalsh/obsidian.nvim
2024-12-05,lua,935,2,Painless Java in Neovim,nvim-java,nvim-java,https://github.com/nvim-java/nvim-java
2024-12-05,lua,4093,4,Single tabpage interface for easily cycling through diffs for all modified files for any git rev.,sindrets,diffview.nvim,https://github.com/sindrets/diffview.nvim
2024-12-05,lua,843,0,A native neovim extension for Codeium,Exafunction,codeium.nvim,https://github.com/Exafunction/codeium.nvim
2024-12-05,lua,3100,2,Orgmode clone written in Lua for Neovim 0.9+.,nvim-orgmode,orgmode,https://github.com/nvim-orgmode/orgmode