date,language,stargazers,starsToday,description,owner,name,url
2024-05-04,astro,428,8,A static blog template built with Astro.,saicaca,fuwari,https://github.com/saicaca/fuwari
2024-05-04,astro,117,1,"Dante, a single-author blog and portfolio theme for Astro.js.",JustGoodUI,dante-astro-theme,https://github.com/JustGoodUI/dante-astro-theme
2024-05-04,astro,1200,1,Web oficial de La Velada IV de Ibai Llanos,midudev,la-velada-web-oficial,https://github.com/midudev/la-velada-web-oficial
2024-05-04,astro,5104,5,Next version of roadmap.sh,roadmapsh,deprecated-version,https://github.com/roadmapsh/deprecated-version
2024-05-04,astro,2458,8,⭕️ AstroWind: A free template using Astro 4.0 and Tailwind CSS. Astro starter theme.,onwidget,astrowind,https://github.com/onwidget/astrowind
2024-05-04,astro,407,1,"Astroplate is a free starter template built with Astro, TailwindCSS & TypeScript providing everything you need to jumpstart your Astro project. Get started with Astroplate and save yourself hours of work!",zeon-studio,astroplate,https://github.com/zeon-studio/astroplate
2024-05-04,astro,1553,1,list of free stuff for developer,hilmanski,freeStuffDev,https://github.com/hilmanski/freeStuffDev
2024-05-04,astro,362,2,"📚 Openblog is an elegant, simple, and user-friendly blog. Focused on accessibility, SEO and performance.",danielcgilibert,blog-template,https://github.com/danielcgilibert/blog-template
2024-05-04,astro,89,1,Drizzle ORM documentation website,drizzle-team,drizzle-orm-docs,https://github.com/drizzle-team/drizzle-orm-docs
2024-05-04,astro,43594,3,AdminLTE - Free admin dashboard template based on Bootstrap 5,ColorlibHQ,AdminLTE,https://github.com/ColorlibHQ/AdminLTE
2024-05-04,astro,94,2,"Astro Sphere is a static, minimalist, lightweight, lightning fast portfolio and blog.",markhorn-dev,astro-sphere,https://github.com/markhorn-dev/astro-sphere
2024-05-04,astro,2719,3,"An opinionated, actionable guide for software engineering interviews.",nas5w,interview-guide,https://github.com/nas5w/interview-guide
2024-05-04,astro,35,0,A stunning and versatile Astro theme designed for digital marketing agencies.,manulthanura,Positivus,https://github.com/manulthanura/Positivus
2024-05-04,astro,206,1,"Nebulix, a Fast & Green Theme Based on Astro + Static CMS + Snipcart",unfolding-io,nebulix,https://github.com/unfolding-io/nebulix
2024-05-04,astro,1068,3,"Astroship is a starter template for startups, marketing websites, landing pages & blog. Built with Astro & TailwindCSS",surjithctly,astroship,https://github.com/surjithctly/astroship
2024-05-04,astro,70,3,"Astro Nano is a static, minimalist, lightweight, lightning fast portfolio and blog.",markhorn-dev,astro-nano,https://github.com/markhorn-dev/astro-nano
2024-05-04,astro,655,3,A minimalist portafolio configurable via one JSON,midudev,minimalist-portfolio-json,https://github.com/midudev/minimalist-portfolio-json
2024-05-04,astro,280,3,"Open-source Astro website template with sleek, customizable TailwindCSS components.",mearashadowfax,ScrewFast,https://github.com/mearashadowfax/ScrewFast
2024-05-04,astro,5994,7,🦄 A curated list of privacy & security-focused software and services,Lissy93,awesome-privacy,https://github.com/Lissy93/awesome-privacy