date,stargazers,starsToday,description,owner,name,url
2021-12-24,1,4,ExifTool meta information reader/writer,exiftool,exiftool,https://github.com/exiftool/exiftool
2021-12-24,7,0,MySQLTuner is a script written in Perl that will assist you with your MySQL configuration and make recommendations for increased performance and stability.,major,MySQLTuner-perl,https://github.com/major/MySQLTuner-perl
2021-12-24,375,0,Movable Type,movabletype,movabletype,https://github.com/movabletype/movabletype
2021-12-24,1,1,Th3Inspector  Best Tool For Information Gathering,Moham3dRiahi,Th3inspector,https://github.com/Moham3dRiahi/Th3inspector
2021-12-24,261,0,Collection of standard plugins to discover and gather cloud-to-edge metrics and status across your whole IT infrastructure.,centreon,centreon-plugins,https://github.com/centreon/centreon-plugins
2021-12-24,13,0,Set of test cases that can be used to test custom implementations of the SecRules language (ModSecurity rules format).,SpiderLabs,secrules-language-tests,https://github.com/SpiderLabs/secrules-language-tests
2021-12-24,98,0,"OBS build script, can be used with OBS or stand alone",openSUSE,obs-build,https://github.com/openSUSE/obs-build
2021-12-24,188,0,Spec and test data for the MaxMind DB file format,maxmind,MaxMind-DB,https://github.com/maxmind/MaxMind-DB
2021-12-24,1,1,X Attacker Tool  Website Vulnerability Scanner & Auto Exploiter,Moham3dRiahi,XAttacker,https://github.com/Moham3dRiahi/XAttacker
2021-12-24,212,0,FusionInventory Agent,fusioninventory,fusioninventory-agent,https://github.com/fusioninventory/fusioninventory-agent
2021-12-24,4,0,JSON::Functions::XS,wakaba,perl-json-functions-xs,https://github.com/wakaba/perl-json-functions-xs
2021-12-24,205,0,"The Open Charge Point Interface (OCPI) allows for a scalable, automated roaming setup between Charge Point Operators and e-Mobility Service Providers. It supports authorisation, charge point information exchange (incl transaction events), charge detail record exchange and finally, the exchange of smart-charging commands between parties.",ocpi,ocpi,https://github.com/ocpi/ocpi
2021-12-24,706,1,"Ora2Pg is a free tool used to migrate an Oracle database to a PostgreSQL compatible schema. It connects your Oracle database, scan it automatically and extracts its structure or data, it then generates SQL scripts that you can load into PostgreSQL.",darold,ora2pg,https://github.com/darold/ora2pg
2021-12-24,566,4,ä¸€ä¸ªä¸»è¦è¿è¡Œåœ¨ ğğ¥ğğœğ•ğŸğ æˆ– ğªğ¢ğ§ğ ğ¥ğ¨ğ§ğ  ç­‰å®šæ—¶é¢æ¿ï¼ŒåŒæ—¶æ”¯æŒç³»ç»Ÿè¿è¡Œç¯å¢ƒçš„ç­¾åˆ°é¡¹ç›®ï¼ˆç¯å¢ƒï¼šğ‘·ğ’šğ’•ğ’‰ğ’ğ’ 3.8+ / ğ‘µğ’ğ’…ğ’†.ğ’‹ğ’” 10+ / ğ‘©ğ’‚ğ’”ğ’‰ 4+ / ğ‘¶ğ’‘ğ’†ğ’ğ‘±ğ‘«ğ‘²8 / ğ‘·ğ’†ğ’“ğ’5ï¼‰,Oreomeow,checkinpanel,https://github.com/Oreomeow/checkinpanel
2021-12-24,12,7,Stack trace visualizer,brendangregg,FlameGraph,https://github.com/brendangregg/FlameGraph
2021-12-24,960,4,This is the new home for ddclient. Ddclient is a Perl client used to update dynamic DNS entries for accounts on 'Dynamic DNS Network Services' free DNS service. It currently supports a lot of different routers and a few different services.,ddclient,ddclient,https://github.com/ddclient/ddclient
2021-12-24,723,0,Server for Logitech Squeezebox players. This server is also called Logitech Media Server,Logitech,slimserver,https://github.com/Logitech/slimserver
2021-12-24,514,0,LCOV,linux-test-project,lcov,https://github.com/linux-test-project/lcov
2021-12-24,1,0,Client for PPP+SSL VPN tunnel services,adrienverge,openfortivpn,https://github.com/adrienverge/openfortivpn
2021-12-24,731,2,Image Payload Creating/Injecting tools,chinarulezzz,pixload,https://github.com/chinarulezzz/pixload
2021-12-24,27,0,"The Web and Open Data Validator (formerly the WPSS Validation Tool) provides web developers and quality assurance testers the ability to perform a number of web site, web page validation and Open data validation tasks at one time.",wet-boew,wet-boew-wpss,https://github.com/wet-boew/wet-boew-wpss
2021-12-24,1,1,Next-Generation Linux Kernel Exploit Suggester,jondonas,linux-exploit-suggester-2,https://github.com/jondonas/linux-exploit-suggester-2
2021-12-24,1,2,The Perl programming language,Perl,perl5,https://github.com/Perl/perl5
2021-12-24,104,0,"OTOBO is one of the most flexible web-based ticketing systems used for Customer Service, Help Desk, IT Service Management. https://www.otobo.de/",RotherOSS,otobo,https://github.com/RotherOSS/otobo
2021-12-24,,,Language files for Binary.com Websockets API service,binary-com,translations-websockets-api,https://github.com/binary-com/translations-websockets-api