date,stargazers,starsToday,description,owner,name,url
2021-12-24,297,0,IOTA's New Wallet,iotaledger,firefly,https://github.com/iotaledger/firefly
2021-12-24,2,3,Svelte Material UI Components,hperrin,svelte-material-ui,https://github.com/hperrin/svelte-material-ui
2021-12-24,1,1,Svelte implementation of the Carbon Design System,carbon-design-system,carbon-components-svelte,https://github.com/carbon-design-system/carbon-components-svelte
2021-12-24,1,0,"Database manager for MySQL, PostgreSQL, SQL Server, MongoDB, SQLite and others. Runs under Windows, Linux, Mac or as web application",dbgate,dbgate,https://github.com/dbgate/dbgate
2021-12-24,23,0,"The source code for the ""Full Stack Web Development in the Cloud"" course.",gitpod-io,full-stack-web-development,https://github.com/gitpod-io/full-stack-web-development
2021-12-24,3,0,vlack's personal site,v1ack,v1ack.github.io,https://github.com/v1ack/v1ack.github.io
2021-12-24,57,0,PaperCSS components for Svelte,Oli8,spaper,https://github.com/Oli8/spaper
2021-12-24,1,4,,PuruVJ,macos-web,https://github.com/PuruVJ/macos-web
2021-12-24,89,1,The Svelte Society website,svelte-society,sveltesociety.dev,https://github.com/svelte-society/sveltesociety.dev
2021-12-24,534,0,"Svelte ecommerce - Headless, Authentication, Cart & Checkout, TailwindCSS, Server Rendered, Proxy + API Integrated, Animations, Stores, Lazy Loading, Loading Indicators, Carousel, Instant Search, Faceted Filters, Typescript, Open Source, MIT license. 1 command deploy to your own server, 1 click deploy to netlify.",itswadesh,svelte-commerce,https://github.com/itswadesh/svelte-commerce
2021-12-24,1,0,UI framework with material components built with Svelte and Tailwind CSS,matyunya,smelte,https://github.com/matyunya/smelte
2021-12-24,79,0,Monorepo for the sites in the Svelte ecosystem,sveltejs,sites,https://github.com/sveltejs/sites
2021-12-24,2,0,,threefoldtech,grid_weblets,https://github.com/threefoldtech/grid_weblets
2021-12-24,1,1,SvelteKit implementation of the RealWorld app,sveltejs,realworld,https://github.com/sveltejs/realworld
2021-12-24,312,0,Svelte plugin for http://vitejs.dev/,sveltejs,vite-plugin-svelte,https://github.com/sveltejs/vite-plugin-svelte