date,language,stargazers,starsToday,description,owner,name,url
2022-08-26,go,6607,133,"Kubescape is a K8s open-source tool providing a multi-cloud K8s single pane of glass, including risk analysis, security compliance, RBAC visualizer and image vulnerabilities scanning.",kubescape,kubescape,https://github.com/kubescape/kubescape
2022-08-26,go,34869,69,Multi-Cloud  Object Storage,minio,minio,https://github.com/minio/minio
2022-08-26,go,8572,99,Open Source realtime backend in 1 file,pocketbase,pocketbase,https://github.com/pocketbase/pocketbase
2022-08-26,go,7834,1,AWS SDK for the Go programming language.,aws,aws-sdk-go,https://github.com/aws/aws-sdk-go
2022-08-26,go,3017,4,Google Cloud Client Libraries for Go.,googleapis,google-cloud-go,https://github.com/googleapis/google-cloud-go
2022-08-26,go,38954,21,Official Go implementation of the Ethereum protocol,ethereum,go-ethereum,https://github.com/ethereum/go-ethereum
2022-08-26,go,7018,8,"An open source, general-purpose policy engine.",open-policy-agent,opa,https://github.com/open-policy-agent/opa
2022-08-26,go,6690,10,Automatically generate RESTful API documentation with Swagger 2.0 for Go.,swaggo,swag,https://github.com/swaggo/swag
2022-08-26,go,16811,12,"Like Prometheus, but for logs.",grafana,loki,https://github.com/grafana/loki
2022-08-26,go,13904,6,Hyperledger Fabric is an enterprise-grade permissioned distributed ledger framework for developing solutions and applications. Its modular and versatile design satisfies a broad range of industry use cases. It offers a unique approach to consensus that enables performance at scale while preserving privacy.,hyperledger,fabric,https://github.com/hyperledger/fabric
2022-08-26,go,16645,5,The Go language implementation of gRPC. HTTP/2 based RPC,grpc,grpc-go,https://github.com/grpc/grpc-go
2022-08-26,go,32133,14,"TiDB is an open-source, cloud-native, distributed, MySQL-Compatible database for elastic scale and real-time analytics. Try free: https://tidbcloud.com/free-trial",pingcap,tidb,https://github.com/pingcap/tidb
2022-08-26,go,25348,11,"A tool for secrets management, encryption as a service, and privileged access management",hashicorp,vault,https://github.com/hashicorp/vault
2022-08-26,go,3851,25,"A Kubernetes controller to watch changes in ConfigMap and Secrets and do rolling upgrades on Pods with their associated Deployment, StatefulSet, DaemonSet and DeploymentConfig – [✩Star] if you're using it!",stakater,Reloader,https://github.com/stakater/Reloader
2022-08-26,go,10328,6,Kubernetes IN Docker - local clusters for testing Kubernetes,kubernetes-sigs,kind,https://github.com/kubernetes-sigs/kind
2022-08-26,go,7286,3,A cloud-native Pipeline resource.,tektoncd,pipeline,https://github.com/tektoncd/pipeline
2022-08-26,go,5877,2,PostgreSQL driver and toolkit for Go,jackc,pgx,https://github.com/jackc/pgx
2022-08-26,go,3790,11,A highly extensible Git implementation in pure Go.,go-git,go-git,https://github.com/go-git/go-git
2022-08-26,go,3872,2,NGINX and NGINX Plus Ingress Controllers for Kubernetes,nginxinc,kubernetes-ingress,https://github.com/nginxinc/kubernetes-ingress
2022-08-26,go,2350,5,Generate Go client and server boilerplate from OpenAPI 3 specifications,deepmap,oapi-codegen,https://github.com/deepmap/oapi-codegen
2022-08-26,go,1633,3,Event-driven workflow automation framework,argoproj,argo-events,https://github.com/argoproj/argo-events
2022-08-26,go,7255,7,Cross-platform file system notifications for Go.,fsnotify,fsnotify,https://github.com/fsnotify/fsnotify
2022-08-26,go,33413,26,A tool for exploring each layer in a docker image,wagoodman,dive,https://github.com/wagoodman/dive
2022-08-26,go,3944,1,Add-on agent to generate and expose cluster-level metrics.,kubernetes,kube-state-metrics,https://github.com/kubernetes/kube-state-metrics
2022-08-26,go,10860,5,Highly available Prometheus setup with long term storage capabilities. A CNCF Incubating project.,thanos-io,thanos,https://github.com/thanos-io/thanos