date,language,stargazers,starsToday,description,owner,name,url
2022-09-18,shell,136,10,A reliable exploit + write-up to elevate privileges to root. (Tested on Ubuntu 22.04),MaherAzzouzi,CVE-2022-37706-LPE-exploit,https://github.com/MaherAzzouzi/CVE-2022-37706-LPE-exploit
2022-09-18,shell,737,4,All versions of iOS Device Support,JinjunHan,iOSDeviceSupport,https://github.com/JinjunHan/iOSDeviceSupport
2022-09-18,shell,280,18,Automated Redpill Loader,fbelavenuto,arpl,https://github.com/fbelavenuto/arpl
2022-09-18,shell,6567,3,"Prowler is an Open Source security tool to perform AWS security best practices assessments, audits, incident response, continuous monitoring, hardening and forensics readiness. It contains more than 240 controls covering CIS, PCI-DSS, ISO27001, GDPR, HIPAA, FFIEC, SOC2, AWS FTR, ENS and custom security frameworks.",prowler-cloud,prowler,https://github.com/prowler-cloud/prowler
2022-09-18,shell,28081,11,A pure Unix shell script implementing ACME client protocol,acmesh-official,acme.sh,https://github.com/acmesh-official/acme.sh
2022-09-18,shell,951,2,"Crack Interface lockscreen, Metasploit and More Android/IOS Hacking",tegal1337,CiLocks,https://github.com/tegal1337/CiLocks
2022-09-18,shell,755,4,Emulator configurator for Steam Deck,dragoonDorise,EmuDeck,https://github.com/dragoonDorise/EmuDeck
2022-09-18,shell,6233,3,Docker images for Selenium Grid,SeleniumHQ,docker-selenium,https://github.com/SeleniumHQ/docker-selenium
2022-09-18,shell,1413,1,Conda recipes for the bioconda channel.,bioconda,bioconda-recipes,https://github.com/bioconda/bioconda-recipes
2022-09-18,shell,114,7,"Linux Guide. Learn about Linux Hardware vendors, Linux in the Cloud, Desktop Environments, Window Mangers, Linux Distributions, Linux Security, Graphics (AMD/NVIDIA/Intel ARC), and Software Apps.",mikeroyal,Linux-Guide,https://github.com/mikeroyal/Linux-Guide
2022-09-18,shell,38670,11,A black hole for Internet advertisements,pi-hole,pi-hole,https://github.com/pi-hole/pi-hole
2022-09-18,shell,3832,4,A repository of development container definitions for the VS Code Remote - Containers extension and GitHub Codespaces,microsoft,vscode-dev-containers,https://github.com/microsoft/vscode-dev-containers
2022-09-18,shell,10050,6,"Lynis - Security auditing tool for Linux, macOS, and UNIX-based systems. Assists with compliance testing (HIPAA/ISO27001/PCI DSS) and system hardening. Agentless, and installation optional.",CISOfy,lynis,https://github.com/CISOfy/lynis
2022-09-18,shell,1398,1,Docker image for Keycloak project,keycloak,keycloak-containers,https://github.com/keycloak/keycloak-containers
2022-09-18,shell,2953,8,One-click deployment and management of Clash services using Shell scripts in Linux environment,juewuy,ShellClash,https://github.com/juewuy/ShellClash
2022-09-18,shell,1183,6,"Armbian for Amlogic s9xxx tv box. Support a311d, s922x, s905x3, s905x2, s912, s905d, s905x, s905w, s905, etc. including install to EMMC and update related functions.",ophub,amlogic-s9xxx-armbian,https://github.com/ophub/amlogic-s9xxx-armbian
2022-09-18,shell,398,7,Bitnami container images,bitnami,containers,https://github.com/bitnami/containers
2022-09-18,shell,8598,1,Performance analysis tools based on Linux perf_events (aka perf) and ftrace,brendangregg,perf-tools,https://github.com/brendangregg/perf-tools
2022-09-18,shell,56,4,Builds a minimal Fedora image to run on Apple M1/M2 systems,leifliddy,asahi-fedora-builder,https://github.com/leifliddy/asahi-fedora-builder
2022-09-18,shell,2726,4,A conda-forge distribution.,conda-forge,miniforge,https://github.com/conda-forge/miniforge
2022-09-18,shell,719,2,A helm plugin that help manage secrets with Git workflow and store them anywhere,jkroepke,helm-secrets,https://github.com/jkroepke/helm-secrets
2022-09-18,shell,48,7,A collection of development container 'features',devcontainers,features,https://github.com/devcontainers/features
2022-09-18,shell,2793,4,"ONLYOFFICE Document Server is an online office suite comprising viewers and editors for texts, spreadsheets and presentations, fully compatible with Office Open XML formats: .docx, .xlsx, .pptx and enabling collaborative editing in real time.",ONLYOFFICE,DocumentServer,https://github.com/ONLYOFFICE/DocumentServer
2022-09-18,shell,60927,14,Node Version Manager - POSIX-compliant bash script to manage multiple active node.js versions,nvm-sh,nvm,https://github.com/nvm-sh/nvm
2022-09-18,shell,483,0,"All in one Instagram hacking tool available (Insta information gathering, Insta brute force, Insta account auto repoter)",IncredibleHacker,insta-hack,https://github.com/IncredibleHacker/insta-hack