date,language,stargazers,starsToday,description,owner,name,url
2024-01-24,perl,2393,0,Client for PPP+TLS VPN tunnel services,adrienverge,openfortivpn,https://github.com/adrienverge/openfortivpn
2024-01-24,perl,55,0,a perl library for sending email,rjbs,Email-Sender,https://github.com/rjbs/Email-Sender
2024-01-24,perl,123,0,FreeRDP Manuals,awakecoding,FreeRDP-Manuals,https://github.com/awakecoding/FreeRDP-Manuals
2024-01-24,perl,1255,1,Holberton-style C code checker written in Perl,alx-tools,Betty,https://github.com/alx-tools/Betty
2024-01-24,perl,374,0,"The Open Charge Point Interface (OCPI) allows for a scalable, automated roaming setup between Charge Point Operators and e-Mobility Service Providers. It supports authorisation, charge point information exchange (incl transaction events), charge detail record exchange and finally, the exchange of smart-charging commands between parties.",ocpi,ocpi,https://github.com/ocpi/ocpi
2024-01-24,perl,1775,3,Web application for archival and reading of manga/doujinshi. Lightweight and Docker-ready for NAS/servers.,Difegue,LANraragi,https://github.com/Difegue/LANraragi
2024-01-24,perl,0,0,identidad visual de firefox,inaes-tic,pkg-firefox,https://github.com/inaes-tic/pkg-firefox
2024-01-24,perl,17749,8,"cloc counts blank lines, comment lines, and physical lines of source code in many programming languages.",AlDanial,cloc,https://github.com/AlDanial/cloc
2024-01-24,perl,934,2,"Ora2Pg is a free tool used to migrate an Oracle database to a PostgreSQL compatible schema. It connects your Oracle database, scan it automatically and extracts its structure or data, it then generates SQL scripts that you can load into PostgreSQL.",darold,ora2pg,https://github.com/darold/ora2pg
2024-01-24,perl,779,0,Trinity RNA-Seq de novo transcriptome assembly,trinityrnaseq,trinityrnaseq,https://github.com/trinityrnaseq/trinityrnaseq
2024-01-24,perl,398,0,Movable Type,movabletype,movabletype,https://github.com/movabletype/movabletype
2024-01-24,perl,170,1,GLPI Agent,glpi-project,glpi-agent,https://github.com/glpi-project/glpi-agent
2024-01-24,perl,305,1,Collection of standard plugins to discover and gather cloud-to-edge metrics and status across your whole IT infrastructure.,centreon,centreon-plugins,https://github.com/centreon/centreon-plugins
2024-01-24,perl,295,1,BRAKER is a pipeline for fully automated prediction of protein coding gene structures with GeneMark-ES/ET/EP/ETP and AUGUSTUS in novel eukaryotic genomes,Gaius-Augustus,BRAKER,https://github.com/Gaius-Augustus/BRAKER
2024-01-24,perl,410,0,The Ensembl Variant Effect Predictor predicts the functional effects of genomic variants,Ensembl,ensembl-vep,https://github.com/Ensembl/ensembl-vep
2024-01-24,perl,733,0,⚡ ♒ Rapid prokaryotic genome annotation,tseemann,prokka,https://github.com/tseemann/prokka
2024-01-24,perl,3,0,Custom compiled perl for Binary.com,binary-com,perl,https://github.com/binary-com/perl
2024-01-24,perl,2,0,[READ-ONLY] Gherkin for Perl - subtree of monorepo https://github.com/cucumber/cucumber -- moved to https://github.com/cucumber/gherkin,cucumber,gherkin-perl,https://github.com/cucumber/gherkin-perl
2024-01-24,perl,15953,10,Stack trace visualizer,brendangregg,FlameGraph,https://github.com/brendangregg/FlameGraph
2024-01-24,perl,2,0,Language files for Binary.com Websockets API service,binary-com,translations-websockets-api,https://github.com/binary-com/translations-websockets-api
2024-01-24,perl,2613,3,ExifTool meta information reader/writer,exiftool,exiftool,https://github.com/exiftool/exiftool
2024-01-24,perl,4,0,Transparent SMTP proxy to prevent mail forwarding loops,jnorell,smtpprox-loopprevent,https://github.com/jnorell/smtpprox-loopprevent
2024-01-24,perl,48,0,Ce logiciel permet de contrôler le respect des normes des fichiers d'écritures comptables (FEC) conformément aux dispositions de l'article A.47 A-1 du livre des procédures fiscales.,DGFiP,Test-Compta-Demat,https://github.com/DGFiP/Test-Compta-Demat
2024-01-24,perl,315,0,GNU Fortran (and GCC) compilers for macOS,fxcoudert,gfortran-for-macOS,https://github.com/fxcoudert/gfortran-for-macOS
2024-01-24,perl,410,1,"A wrapper around Cutadapt and FastQC to consistently apply adapter and quality trimming to FastQ files, with extra functionality for RRBS data",FelixKrueger,TrimGalore,https://github.com/FelixKrueger/TrimGalore