date,language,stargazers,starsToday,description,owner,name,url
2023-11-06,elixir,22200,4,"Elixir is a dynamic, functional language for building scalable and maintainable applications",elixir-lang,elixir,https://github.com/elixir-lang/elixir
2023-11-06,elixir,16622,6,"Simple, open source, lightweight (< 1 KB) and privacy-friendly web analytics alternative to Google Analytics.",plausible,analytics,https://github.com/plausible/analytics
2023-11-06,elixir,88,0,🛡 Public database of Elixir security advisories pulled from GitHub Advisory Database,mirego,elixir-security-advisories,https://github.com/mirego/elixir-security-advisories
2023-11-06,elixir,4430,1,A self-hosted data logger for your Tesla 🚘,adriankumpf,teslamate,https://github.com/adriankumpf/teslamate
2023-11-06,elixir,439,2,Lexical is a next-generation elixir language server,lexical-lsp,lexical,https://github.com/lexical-lsp/lexical
2023-11-06,elixir,1275,3,Bandit is a pure Elixir HTTP server for Plug & WebSock applications,mtrudel,bandit,https://github.com/mtrudel/bandit
2023-11-06,elixir,5441,0,"Rich, real-time user experiences with server-rendered HTML",phoenixframework,phoenix_live_view,https://github.com/phoenixframework/phoenix_live_view
2023-11-06,elixir,550,0,Elixir Discord Library,Kraigie,nostrum,https://github.com/Kraigie/nostrum
2023-11-06,elixir,630,2,"Open-source content management system (CMS) built with Phoenix LiveView. Faster render times to boost SEO performance, even for the most content-heavy pages.",BeaconCMS,beacon,https://github.com/BeaconCMS/beacon
2023-11-06,elixir,442,0,The language server for Elixir that just works. Ready for early adopters!,elixir-tools,next-ls,https://github.com/elixir-tools/next-ls
2023-11-06,elixir,3949,3,Automate code & data workflows with interactive Elixir notebooks,livebook-dev,livebook,https://github.com/livebook-dev/livebook
2023-11-06,elixir,6170,0,"Broadcast, Presence, and Postgres Changes via WebSockets",supabase,realtime,https://github.com/supabase/realtime
2023-11-06,elixir,3010,12,"Local-first sync layer for web and mobile apps. Build reactive, realtime, local-first apps directly on Postgres.",electric-sql,electric,https://github.com/electric-sql/electric
2023-11-06,elixir,982,1,Event store using PostgreSQL for persistence,commanded,eventstore,https://github.com/commanded/eventstore
2023-11-06,elixir,104,0,OpenTelemetry instrumentation for Erlang & Elixir,open-telemetry,opentelemetry-erlang-contrib,https://github.com/open-telemetry/opentelemetry-erlang-contrib
2023-11-06,elixir,299,0,The ultimate tool to interact with your audience,ClaperCo,Claper,https://github.com/ClaperCo/Claper
2023-11-06,elixir,443,0,An @elixir-lang code-style enforcer that will just FIFY instead of complaining,adobe,elixir-styler,https://github.com/adobe/elixir-styler
2023-11-06,elixir,2815,1,Blockchain explorer for Ethereum based network and a tool for inspecting and analyzing EVM based blockchains.,blockscout,blockscout,https://github.com/blockscout/blockscout
2023-11-06,elixir,21,0,"Sample application running Beacon, a open-source content management system (CMS) built with Phoenix LiveView.",BeaconCMS,beacon_demo,https://github.com/BeaconCMS/beacon_demo
2023-11-06,elixir,15,0,Console adapter/logger for Spandex traces & spans.,pepsico-ecommerce,spandex_console,https://github.com/pepsico-ecommerce/spandex_console
2023-11-06,elixir,2947,0,Simplify deployments in Elixir with OTP releases!,bitwalker,distillery,https://github.com/bitwalker/distillery
2023-11-06,elixir,1803,0,Automatic cluster formation/healing for Elixir applications,bitwalker,libcluster,https://github.com/bitwalker/libcluster
2023-11-06,elixir,1636,1,Fast batch message passing between nodes for Erlang/Elixir.,discord,manifold,https://github.com/discord/manifold
2023-11-06,elixir,204,0,A Broadway connector for Kafka,dashbitco,broadway_kafka,https://github.com/dashbitco/broadway_kafka
2023-11-06,elixir,33,0,,OffchainLabs,blockscout,https://github.com/OffchainLabs/blockscout