date,language,stargazers,starsToday,description,owner,name,url
2022-06-28,css,2298,3,,john-smilga,javascript-basic-projects,https://github.com/john-smilga/javascript-basic-projects
2022-06-28,css,2875,7,,safak,youtube,https://github.com/safak/youtube
2022-06-28,css,244,35,,leoFitz1024,wallhaven,https://github.com/leoFitz1024/wallhaven
2022-06-28,css,3601,4,"Starter files, final projects and FAQ for my Advanced CSS course",jonasschmedtmann,advanced-css-course,https://github.com/jonasschmedtmann/advanced-css-course
2022-06-28,css,8562,1,"An easy-to-read, quick reference for PHP best practices, accepted coding standards, and links to authoritative tutorials around the Web",codeguy,php-the-right-way,https://github.com/codeguy/php-the-right-way
2022-06-28,css,2228,2,,john-smilga,react-projects,https://github.com/john-smilga/react-projects
2022-06-28,css,3874,8,I respect proton UI and aim to improve it.,black7375,Firefox-UI-Fix,https://github.com/black7375/Firefox-UI-Fix
2022-06-28,css,1587,3,Orchis is a [Material Design](https://material.io) theme for GNOME/GTK based desktop environments.,vinceliuice,Orchis-theme,https://github.com/vinceliuice/Orchis-theme
2022-06-28,css,47913,16,A modern alternative to CSS resets,necolas,normalize.css,https://github.com/necolas/normalize.css
2022-06-28,css,1509,1,Dark Gtk3.20+ theme created using the awesome Nord color pallete.,EliverLara,Nordic,https://github.com/EliverLara/Nordic
2022-06-28,css,1413,0,A collection of themes/skins for 50 selfhosted apps!,GilbN,theme.park,https://github.com/GilbN/theme.park
2022-06-28,css,1603,30,My awesomewm dotfiles for awesome people!,rxyhn,dotfiles,https://github.com/rxyhn/dotfiles
2022-06-28,css,3648,2,A community-driven collection of themes for customizing Spotify through Spicetify - https://github.com/spicetify/spicetify-cli,spicetify,spicetify-themes,https://github.com/spicetify/spicetify-themes
2022-06-28,css,259,2,可能是东半球最好用的azure非官方面板 Probably the best azure unofficial panel in the Eastern Hemisphere,azpanel,azpanel,https://github.com/azpanel/azpanel
2022-06-28,css,1161,6,Cloudflare’s developer docs.,cloudflare,cloudflare-docs,https://github.com/cloudflare/cloudflare-docs
2022-06-28,css,1391,4,Master the creation of Modern UX/UI Websites,adrianhajdin,project_modern_ui_ux_gpt3,https://github.com/adrianhajdin/project_modern_ui_ux_gpt3
2022-06-28,css,358,0,Colloid gtk theme for linux,vinceliuice,Colloid-gtk-theme,https://github.com/vinceliuice/Colloid-gtk-theme
2022-06-28,css,975,5,"Responsive Portfolio Website Using HTML, CSS & JavaScript",bedimcode,responsive-portfolio-website-Alexa,https://github.com/bedimcode/responsive-portfolio-website-Alexa
2022-06-28,css,554,1,The theme from libadwaita ported to GTK-3,lassekongo83,adw-gtk3,https://github.com/lassekongo83/adw-gtk3
2022-06-28,css,7319,8,forkable Ethereum dev stack focused on fast product iterations,scaffold-eth,scaffold-eth,https://github.com/scaffold-eth/scaffold-eth
2022-06-28,css,7798,3,"The package of IBM’s typeface, IBM Plex.",IBM,plex,https://github.com/IBM/plex
2022-06-28,css,582,0,Fluent design gtk theme for linux desktops,vinceliuice,Fluent-gtk-theme,https://github.com/vinceliuice/Fluent-gtk-theme
2022-06-28,css,10572,0,"Hi. I'm a starter theme called _s, or underscores, if you like. I'm a theme meant for hacking so don't use me as a Parent Theme. Instead try turning me into the next, most awesome, WordPress theme out there. That's what I'm here for.",Automattic,_s,https://github.com/Automattic/_s
2022-06-28,css,0,0,Sitio web IPS,piratekevin1129,ips-sitio,https://github.com/piratekevin1129/ips-sitio