date,language,stargazers,starsToday,description,owner,name,url
2023-04-22,lua,34643,1,The Cloud-Native API Gateway,Kong,kong,https://github.com/Kong/kong
2023-04-22,lua,3753,8,Modernity meets insane extensibility. The future of organizing your life in Neovim.,nvim-neorg,neorg,https://github.com/nvim-neorg/neorg
2023-04-22,lua,4859,25,Neovim config for the lazy,LazyVim,LazyVim,https://github.com/LazyVim/LazyVim
2023-04-22,lua,14091,34,LunarVim is an IDE layer for Neovim. Completely free and community driven.,LunarVim,LunarVim,https://github.com/LunarVim/LunarVim
2023-04-22,lua,9035,25,AstroNvim is an aesthetic and feature-rich neovim config that is extensible and easy to use with a great set of plugins,AstroNvim,AstroNvim,https://github.com/AstroNvim/AstroNvim
2023-04-22,lua,3153,1,Get your data in RAM. Get compute close to data. Enjoy the performance.,tarantool,tarantool,https://github.com/tarantool/tarantool
2023-04-22,lua,1754,6,A well configured and structured Neovim.,ayamir,nvimdots,https://github.com/ayamir/nvimdots
2023-04-22,lua,11685,11,The Cloud-Native API Gateway,apache,apisix,https://github.com/apache/apisix
2023-04-22,lua,114,0,Modules to utilise in other resources via imports and exports.,overextended,ox_lib,https://github.com/overextended/ox_lib
2023-04-22,lua,125,0,Feedbacks & suggestion are very appreciated on ETHOS of FrSky,FrSkyRC,ETHOS-Feedback-Community,https://github.com/FrSkyRC/ETHOS-Feedback-Community
2023-04-22,lua,2356,5,"A modern Neovim configuration with full battery for Python, Lua, C++, Markdown, LaTeX, and more...",jdhao,nvim-config,https://github.com/jdhao/nvim-config
2023-04-22,lua,7187,10,Quickstart configs for Nvim LSP,neovim,nvim-lspconfig,https://github.com/neovim/nvim-lspconfig
2023-04-22,lua,144,0,"fivem-appearance for qb-core and ESX framework, packed with a lot of features",iLLeniumStudios,illenium-appearance,https://github.com/iLLeniumStudios/illenium-appearance
2023-04-22,lua,1567,3,This is my attempt at a basic stable starting point for a Neovim IDE.,LunarVim,nvim-basic-ide,https://github.com/LunarVim/nvim-basic-ide
2023-04-22,lua,12649,8,"An ebook reader application supporting PDF, DjVu, EPUB, FB2 and many more formats, running on Cervantes, Kindle, Kobo, PocketBook and Android devices",koreader,koreader,https://github.com/koreader/koreader
2023-04-22,lua,946,1,"One dark and light colorscheme for neovim >= 0.5.0 written in lua based on Atom's One Dark and Light theme. Additionally, it comes with 5 color variant styles",navarasu,onedark.nvim,https://github.com/navarasu/onedark.nvim
2023-04-22,lua,9752,9,"Find, Filter, Preview, Pick. All lua, all the time.",nvim-telescope,telescope.nvim,https://github.com/nvim-telescope/telescope.nvim
2023-04-22,lua,2677,0,Jitsi Meet on Docker,jitsi,docker-jitsi-meet,https://github.com/jitsi/docker-jitsi-meet
2023-04-22,lua,283,1,Neovim plugin to manage global and project-local settings,folke,neoconf.nvim,https://github.com/folke/neoconf.nvim
2023-04-22,lua,5118,5,A completion plugin for neovim coded in Lua.,hrsh7th,nvim-cmp,https://github.com/hrsh7th/nvim-cmp
2023-04-22,lua,52,1,Crafting a modernized development environment with Neovim.,alpha2phi,modern-neovim,https://github.com/alpha2phi/modern-neovim
2023-04-22,lua,102,2,,eggtoopain,Neovim-Configuration-Tutorial,https://github.com/eggtoopain/Neovim-Configuration-Tutorial
2023-04-22,lua,4534,4,A Neovim config designed from scratch to be understandable,LunarVim,Neovim-from-scratch,https://github.com/LunarVim/Neovim-from-scratch
2023-04-22,lua,19795,5,A community-driven modular vim/neovim distribution - The ultimate vimrc,SpaceVim,SpaceVim,https://github.com/SpaceVim/SpaceVim
2023-04-22,lua,15,0,Script for capturing images.,Project-Sloth,ps-camera,https://github.com/Project-Sloth/ps-camera