date,language,stargazers,starsToday,description,owner,name,url
2024-02-18,scala,37832,8,Apache Spark - A unified analytics engine for large-scale data processing,apache,spark,https://github.com/apache/spark
2024-02-18,scala,4416,0,Your favorite language gets closer to bare metal.,scala-native,scala-native,https://github.com/scala-native/scala-native
2024-02-18,scala,780,1,The Daml smart contract language,digital-asset,daml,https://github.com/digital-asset/daml
2024-02-18,scala,6197,2,Modern Load Testing as Code,gatling,gatling,https://github.com/gatling/gatling
2024-02-18,scala,253,0,An open-source toolkit for large-scale genomic analysis,projectglow,glow,https://github.com/projectglow/glow
2024-02-18,scala,41,0,workbench identity and access management,broadinstitute,sam,https://github.com/broadinstitute/sam
2024-02-18,scala,1998,0,Scala language server with rich IDE features 🚀,scalameta,metals,https://github.com/scalameta/metals
2024-02-18,scala,5524,2,"The Scala 3 compiler, also known as Dotty.",lampepfl,dotty,https://github.com/lampepfl/dotty
2024-02-18,scala,9036,1,"A Git platform powered by Scala with easy installation, high extensibility & GitHub API compatibility",gitbucket,gitbucket,https://github.com/gitbucket/gitbucket
2024-02-18,scala,3068,0,"Deequ is a library built on top of Apache Spark for defining ""unit tests for data"", which measure data quality in large datasets.",awslabs,deequ,https://github.com/awslabs/deequ
2024-02-18,scala,18,0,This new version of CSYE7200 is to replace the old version.,rchillyard,CSYE7200,https://github.com/rchillyard/CSYE7200
2024-02-18,scala,24,0,Rawls service for DSDE,broadinstitute,rawls,https://github.com/broadinstitute/rawls
2024-02-18,scala,2365,0,In-memory message queue with an Amazon SQS-compatible interface. Runs stand-alone or embedded.,softwaremill,elasticmq,https://github.com/softwaremill/elasticmq
2024-02-18,scala,4933,0,Simple and Distributed Machine Learning,microsoft,SynapseML,https://github.com/microsoft/SynapseML
2024-02-18,scala,225,0,"Open, Modular, Deep Learning Accelerator",apache,tvm-vta,https://github.com/apache/tvm-vta
2024-02-18,scala,6308,0,Apache OpenWhisk is an open source serverless cloud platform,apache,openwhisk,https://github.com/apache/openwhisk
2024-02-18,scala,5123,2,"Lightweight, modular, and extensible library for functional programming.",typelevel,cats,https://github.com/typelevel/cats
2024-02-18,scala,260,0,Apache Spark Connector for SQL Server and Azure SQL,microsoft,sql-spark-connector,https://github.com/microsoft/sql-spark-connector
2024-02-18,scala,0,0,Домашние работы курса ФИЛП 2024,filp-2024,exercises,https://github.com/filp-2024/exercises
2024-02-18,scala,55,0,A minimal quickstart ZIO application for writing a RESTful Web Service,zio,zio-quickstarts,https://github.com/zio/zio-quickstarts
2024-02-18,scala,659,0,An open protocol for secure data sharing,delta-io,delta-sharing,https://github.com/delta-io/delta-sharing
2024-02-18,scala,2932,0,Rocket Chip Generator,chipsalliance,rocket-chip,https://github.com/chipsalliance/rocket-chip
2024-02-18,scala,229,0,Enabling Continuous Data Processing with Apache Spark and Azure Event Hubs,Azure,azure-event-hubs-spark,https://github.com/Azure/azure-event-hubs-spark
2024-02-18,scala,11630,0,CMAK is a tool for managing Apache Kafka clusters,yahoo,CMAK,https://github.com/yahoo/CMAK
2024-02-18,scala,14329,3,"♞ lichess.org: the forever free, adless and open source chess server ♞",lichess-org,lila,https://github.com/lichess-org/lila