date,language,stargazers,starsToday,description,owner,name,url
2024-05-03,html,12732,9,Curso de HTML5 e CSS3,gustavoguanabara,html-css,https://github.com/gustavoguanabara/html-css
2024-05-03,html,1146,0,Character sheet templates created by the community for use in Roll20 VTT. Submit a ticket at roll20.net/help if critical hotfixes are to be requested.,Roll20,roll20-character-sheets,https://github.com/Roll20/roll20-character-sheets
2024-05-03,html,12252,3,This repo is for demonstration purposes only.,octocat,Spoon-Knife,https://github.com/octocat/Spoon-Knife
2024-05-03,html,67031,20,"12 weeks, 26 lessons, 52 quizzes, classic Machine Learning for all",microsoft,ML-For-Beginners,https://github.com/microsoft/ML-For-Beginners
2024-05-03,html,26883,3,30 Day Vanilla JS Challenge,wesbos,JavaScript30,https://github.com/wesbos/JavaScript30
2024-05-03,html,1475,0,,TheOdinProject,css-exercises,https://github.com/TheOdinProject/css-exercises
2024-05-03,html,9153,11,"A beautiful, simple, clean, and responsive Jekyll theme for academics",alshedivat,al-folio,https://github.com/alshedivat/al-folio
2024-05-03,html,8691,8,"A fast, clean, responsive Hugo theme.",adityatelange,hugo-PaperMod,https://github.com/adityatelange/hugo-PaperMod
2024-05-03,html,3818,2,This repository contains best profile readme's for your reference.,durgeshsamariya,awesome-github-profile-readme-templates,https://github.com/durgeshsamariya/awesome-github-profile-readme-templates
2024-05-03,html,1241,2,,SuperSimpleDev,html-css-course-2022,https://github.com/SuperSimpleDev/html-css-course-2022
2024-05-03,html,3834,9,"vCard is a fully responsive personal portfolio website, responsive for all devices.",codewithsadee,vcard-personal-portfolio,https://github.com/codewithsadee/vcard-personal-portfolio
2024-05-03,html,1632,4,Free and open-source admin dashboard template built with Tailwind CSS and Flowbite,themesberg,flowbite-admin-dashboard,https://github.com/themesberg/flowbite-admin-dashboard
2024-05-03,html,12996,3,A free simple responsive HTML email template,leemunroe,responsive-html-email-template,https://github.com/leemunroe/responsive-html-email-template
2024-05-03,html,2356,5,Check if people follows you back on Instagram.,davidarroyo1234,InstagramUnfollowers,https://github.com/davidarroyo1234/InstagramUnfollowers
2024-05-03,html,16624,2,Emoji for everyone. https://twemoji.twitter.com/,twitter,twemoji,https://github.com/twitter/twemoji
2024-05-03,html,30348,20,Awesome Docker Compose samples,docker,awesome-compose,https://github.com/docker/awesome-compose
2024-05-03,html,7819,4,Main Web Site (Online Books),RayTracing,raytracing.github.io,https://github.com/RayTracing/raytracing.github.io
2024-05-03,html,1092,2,"100+ mini web projects using HTML, CSS and JavaScript.",solygambas,html-css-javascript-projects,https://github.com/solygambas/html-css-javascript-projects
2024-05-03,html,22617,18,Mastering Bitcoin 3rd Edition - Programming the Open Blockchain,bitcoinbook,bitcoinbook,https://github.com/bitcoinbook/bitcoinbook
2024-05-03,html,904,5,AWS Certified Cloud Practitioner Short Notes And Practice Exams (CLF-C02),kananinirav,AWS-Certified-Cloud-Practitioner-Notes,https://github.com/kananinirav/AWS-Certified-Cloud-Practitioner-Notes
2024-05-03,html,8524,3,A curated list of awesome things related to Django,wsvincent,awesome-django,https://github.com/wsvincent/awesome-django
2024-05-03,html,986,3,"Learn how to build simple, responsive websites using HTML, CSS, and JavaScript",sahandghavidel,HTML-CSS-JavaScript-projects-for-beginners,https://github.com/sahandghavidel/HTML-CSS-JavaScript-projects-for-beginners
2024-05-03,html,4406,2,📘 Home Assistant User documentation,home-assistant,home-assistant.io,https://github.com/home-assistant/home-assistant.io
2024-05-03,html,365,2,RG35XX Custom Firmware Documentation,rg35xx-cfw,rg35xx-cfw.github.io,https://github.com/rg35xx-cfw/rg35xx-cfw.github.io
2024-05-03,html,6727,1,GitHub repo for the MDN Learning Area.,mdn,learning-area,https://github.com/mdn/learning-area