date,language,stargazers,starsToday,description,owner,name,url
2022-06-30,perl,0,0,Collection of Perl wrappers and related utilities for DE Apps integrated by Sheldon McKay,iPlantCollaborativeOpenSource,McKay_DE_utils,https://github.com/iPlantCollaborativeOpenSource/McKay_DE_utils
2022-06-30,perl,2,0,Perl interface to the Beeminder API,letolabs,WWW-Beeminder,https://github.com/letolabs/WWW-Beeminder
2022-06-30,perl,245,0,Holberton-style C code checker written in Perl,holbertonschool,Betty,https://github.com/holbertonschool/Betty
2022-06-30,perl,14284,7,"cloc counts blank lines, comment lines, and physical lines of source code in many programming languages.",AlDanial,cloc,https://github.com/AlDanial/cloc
2022-06-30,perl,1666,0,A utility for downloading TV and radio programmes from BBC iPlayer and BBC Sounds,get-iplayer,get_iplayer,https://github.com/get-iplayer/get_iplayer
2022-06-30,perl,0,0,Validate a name against sanctions lists,binary-com,perl-Data-Validate-Sanctions,https://github.com/binary-com/perl-Data-Validate-Sanctions
2022-06-30,perl,204,0,Spec and test data for the MaxMind DB file format,maxmind,MaxMind-DB,https://github.com/maxmind/MaxMind-DB
2022-06-30,perl,244,1,"The Open Charge Point Interface (OCPI) allows for a scalable, automated roaming setup between Charge Point Operators and e-Mobility Service Providers. It supports authorisation, charge point information exchange (incl transaction events), charge detail record exchange and finally, the exchange of smart-charging commands between parties.",ocpi,ocpi,https://github.com/ocpi/ocpi
2022-06-30,perl,573,1,Rapid prokaryotic genome annotation,tseemann,prokka,https://github.com/tseemann/prokka
2022-06-30,perl,1,0,,TMSWhite,G4030_Bugs,https://github.com/TMSWhite/G4030_Bugs
2022-06-30,perl,50,0,FreeBSD quarterly reports,freebsd,freebsd-quarterly,https://github.com/freebsd/freebsd-quarterly
2022-06-30,perl,228,1,FusionInventory Agent,fusioninventory,fusioninventory-agent,https://github.com/fusioninventory/fusioninventory-agent
2022-06-30,perl,1800,1,Client for PPP+SSL VPN tunnel services,adrienverge,openfortivpn,https://github.com/adrienverge/openfortivpn
2022-06-30,perl,929,1,Web application for archival and reading of manga/doujinshi. Lightweight and Docker-ready for NAS/servers.,Difegue,LANraragi,https://github.com/Difegue/LANraragi
2022-06-30,perl,49,0,cstyle-based JavaScript style checker,TritonDataCenter,jsstyle,https://github.com/TritonDataCenter/jsstyle
2022-06-30,perl,0,0,,binary-com,perl-Format-Util,https://github.com/binary-com/perl-Format-Util
2022-06-30,perl,0,0,,binary-com,perl-Data-Decimate,https://github.com/binary-com/perl-Data-Decimate
2022-06-30,perl,318,0,The Ensembl Variant Effect Predictor predicts the functional effects of genomic variants,Ensembl,ensembl-vep,https://github.com/Ensembl/ensembl-vep
2022-06-30,perl,2349,2,OWASP ModSecurity Core Rule Set (CRS) Project (Official Repository),SpiderLabs,owasp-modsecurity-crs,https://github.com/SpiderLabs/owasp-modsecurity-crs
2022-06-30,perl,773,1,"Ora2Pg is a free tool used to migrate an Oracle database to a PostgreSQL compatible schema. It connects your Oracle database, scan it automatically and extracts its structure or data, it then generates SQL scripts that you can load into PostgreSQL.",darold,ora2pg,https://github.com/darold/ora2pg
2022-06-30,perl,35,1,Collection of Perl cool snippets.,manwar,perl-cool-snippets,https://github.com/manwar/perl-cool-snippets
2022-06-30,perl,324,0,"A wrapper around Cutadapt and FastQC to consistently apply adapter and quality trimming to FastQ files, with extra functionality for RRBS data",FelixKrueger,TrimGalore,https://github.com/FelixKrueger/TrimGalore
2022-06-30,perl,208,0,KH Coder: for Quantitative Content Analysis or Text Mining,ko-ichi-h,khcoder,https://github.com/ko-ichi-h/khcoder
2022-06-30,perl,1500,1,ExifTool meta information reader/writer,exiftool,exiftool,https://github.com/exiftool/exiftool
2022-06-30,perl,231,0,,o0HalfLife0o,list,https://github.com/o0HalfLife0o/list