date,language,stargazers,starsToday,description,owner,name,url
2023-03-22,go,1269,266,现代化、开源的 Linux 服务器运维管理面板。,1Panel-dev,1Panel,https://github.com/1Panel-dev/1Panel
2023-03-22,go,115,21,饗賓餐旅線上訂位,zhong1016,feastogether,https://github.com/zhong1016/feastogether
2023-03-22,go,949,23,ChatGPT机器人在钉钉群聊中交互,eryajf,chatgpt-dingtalk,https://github.com/eryajf/chatgpt-dingtalk
2023-03-22,go,26203,8,"Consul is a distributed, highly available, and data center aware solution to connect and configure applications across dynamic, distributed infrastructure.",hashicorp,consul,https://github.com/hashicorp/consul
2023-03-22,go,1875,76,基于ChatGPT3.5 API实现的私有化web程序,869413421,chatgpt-web,https://github.com/869413421/chatgpt-web
2023-03-22,go,67374,32,"Gin is a HTTP web framework written in Go (Golang). It features a Martini-like API with much better performance -- up to 40 times faster. If you need smashing performance, get yourself some Gin.",gin-gonic,gin,https://github.com/gin-gonic/gin
2023-03-22,go,36620,17,"Terraform enables you to safely and predictably create, change, and improve infrastructure. It is an open source tool that codifies APIs into declarative configuration files that can be shared amongst team members, treated as code, edited, reviewed, and versioned.",hashicorp,terraform,https://github.com/hashicorp/terraform
2023-03-22,go,112,13,A tool to scrape the AWS ranges looking for a keyword in SSL certificate data.,jhaddix,awsScrape,https://github.com/jhaddix/awsScrape
2023-03-22,go,11535,33,"An open source, self-hosted implementation of the Tailscale control server",juanfont,headscale,https://github.com/juanfont/headscale
2023-03-22,go,2383,102,"OpenAI ChatGPT, GPT-3, GPT-4, DALL·E, Whisper API wrapper for Go",sashabaranov,go-openai,https://github.com/sashabaranov/go-openai
2023-03-22,go,4572,4,Open and extensible continuous delivery solution for Kubernetes. Powered by GitOps Toolkit.,fluxcd,flux2,https://github.com/fluxcd/flux2
2023-03-22,go,35399,55,"Git with a cup of tea, painless self-hosted git service",go-gitea,gitea,https://github.com/go-gitea/gitea
2023-03-22,go,12154,33,Fast and customizable vulnerability scanner based on simple YAML based DSL.,projectdiscovery,nuclei,https://github.com/projectdiscovery/nuclei
2023-03-22,go,9636,14,"High performance, self-hosted, newsletter and mailing list manager with a modern dashboard. Single binary app.",knadh,listmonk,https://github.com/knadh/listmonk
2023-03-22,go,15143,13,gRPC to JSON proxy generator following the gRPC HTTP spec,grpc-ecosystem,grpc-gateway,https://github.com/grpc-ecosystem/grpc-gateway
2023-03-22,go,1071,5,"CloudNativePG is a Kubernetes operator that covers the full lifecycle of a PostgreSQL database cluster with a primary/standby architecture, using native streaming replication",cloudnative-pg,cloudnative-pg,https://github.com/cloudnative-pg/cloudnative-pg
2023-03-22,go,12715,10,"Go Struct and Field validation, including Cross Field, Cross Struct, Map, Slice and Array diving",go-playground,validator,https://github.com/go-playground/validator
2023-03-22,go,23968,12,The Kubernetes Package Manager,helm,helm,https://github.com/helm/helm
2023-03-22,go,13457,11,An open and reliable container runtime,containerd,containerd,https://github.com/containerd/containerd
2023-03-22,go,10569,36,"A Lodash-style Go library based on Go 1.18+ Generics (map, filter, contains, find...)",samber,lo,https://github.com/samber/lo
2023-03-22,go,38600,120,A rule-based tunnel in Go.,Dreamacro,clash,https://github.com/Dreamacro/clash
2023-03-22,go,6856,4,PostgreSQL driver and toolkit for Go,jackc,pgx,https://github.com/jackc/pgx
2023-03-22,go,6629,7,Autoscaling components for Kubernetes,kubernetes,autoscaler,https://github.com/kubernetes/autoscaler
2023-03-22,go,4460,2,Prometheus instrumentation library for Go applications,prometheus,client_golang,https://github.com/prometheus/client_golang
2023-03-22,go,4818,6,The official Go client for Elasticsearch,elastic,go-elasticsearch,https://github.com/elastic/go-elasticsearch