date,language,stargazers,starsToday,description,owner,name,url
2022-02-01,css,32951,184,"Iconic font aggregator, collection, & patcher. 3,600+ icons, 50+ patched fonts: Hack, Source Code Pro, more. Glyph collections: Font Awesome, Material Design Icons, Octicons, & more",ryanoasis,nerd-fonts,https://github.com/ryanoasis/nerd-fonts
2022-02-01,css,5606,91,forkable Ethereum dev stack focused on fast product iterations,scaffold-eth,scaffold-eth,https://github.com/scaffold-eth/scaffold-eth
2022-02-01,css,11100,19,"50+ mini web projects using HTML, CSS & JS",bradtraversy,50projects50days,https://github.com/bradtraversy/50projects50days
2022-02-01,css,62,0,Curso de ingreso con JavaScript,octaviovillegas,CursoIngresoJS,https://github.com/octaviovillegas/CursoIngresoJS
2022-02-01,css,718,6,"Responsive Portfolio Website Using HTML, CSS & JavaScript",bedimcode,responsive-portfolio-website-Alexa,https://github.com/bedimcode/responsive-portfolio-website-Alexa
2022-02-01,css,576,10,FingerNFT是一款开源NFT市场，兼容Opensea、Rarible。,fingerchar,fingernft,https://github.com/fingerchar/fingernft
2022-02-01,css,206,0,Graphite gtk theme,vinceliuice,Graphite-gtk-theme,https://github.com/vinceliuice/Graphite-gtk-theme
2022-02-01,css,1939,11,,safak,youtube,https://github.com/safak/youtube
2022-02-01,css,2936,2,Accurately Locate Smartphones using Social Engineering,thewhiteh4t,seeker,https://github.com/thewhiteh4t/seeker
2022-02-01,css,45011,8,Modern CSS framework based on Flexbox,jgthms,bulma,https://github.com/jgthms/bulma
2022-02-01,css,106,0,,yumata,lampa,https://github.com/yumata/lampa
2022-02-01,css,3365,2,"Starter files, final projects and FAQ for my Advanced CSS course",jonasschmedtmann,advanced-css-course,https://github.com/jonasschmedtmann/advanced-css-course
2022-02-01,css,2434,0,"Practical Cryptography for Developers: Hashes, MAC, Key Derivation, DHKE, Symmetric and Asymmetric Ciphers, Public Key Cryptosystems, RSA, Elliptic Curves, ECC, secp256k1, ECDH, ECIES, Digital Signatures, ECDSA, EdDSA",nakov,Practical-Cryptography-for-Developers-Book,https://github.com/nakov/Practical-Cryptography-for-Developers-Book
2022-02-01,css,5315,3,A sample Spring-based application,spring-projects,spring-petclinic,https://github.com/spring-projects/spring-petclinic
2022-02-01,css,824,4,Master the creation of Modern UX/UI Websites,adrianhajdin,project_modern_ui_ux_gpt3,https://github.com/adrianhajdin/project_modern_ui_ux_gpt3
2022-02-01,css,2346,2,Awesome stuff for Obsidian,kmaasrud,awesome-obsidian,https://github.com/kmaasrud/awesome-obsidian
2022-02-01,css,1893,0,A minimal Jekyll Theme to host your resume (CV),sharu725,online-cv,https://github.com/sharu725/online-cv
2022-02-01,css,111,3,Colloid gtk theme for linux,vinceliuice,Colloid-gtk-theme,https://github.com/vinceliuice/Colloid-gtk-theme
2022-02-01,css,1705,0,High Quality web friendly icons,atisawd,boxicons,https://github.com/atisawd/boxicons
2022-02-01,css,1311,5,A GNOME theme for Firefox,rafaelmardojai,firefox-gnome-theme,https://github.com/rafaelmardojai/firefox-gnome-theme
2022-02-01,css,423,0,This project is for html & css practice. We made this for youtube tutorial purpose.,WebCifar,one-page-website-html-css-project-for-practice,https://github.com/WebCifar/one-page-website-html-css-project-for-practice
2022-02-01,css,24,2,A nice theme designed for Typora in Windows 11.,Fentaniao,Liquid,https://github.com/Fentaniao/Liquid
2022-02-01,css,1108,5,"Download and Convert YouTube, SoundCloud & Spotify in MP3 with full tags (title, artist, genre, cover, lyrics )",AllToMP3,alltomp3-app,https://github.com/AllToMP3/alltomp3-app
2022-02-01,css,103,1,Create a Responsive Personal Portfolio Website Using HTML CSS & JavaScript,bedimcode,responsive-portfolio-website-Ansel,https://github.com/bedimcode/responsive-portfolio-website-Ansel
2022-02-01,css,914,24,"Meticulously designed to make Obsidian feel native on desktop, mobile and tablet. You can customize colors, fonts and more with the companion plugin Minimal Theme Settings.",kepano,obsidian-minimal,https://github.com/kepano/obsidian-minimal