date,language,stargazers,starsToday,description,owner,name,url
2022-08-07,r,1516,1,R toolkit for single cell genomics,satijalab,seurat,https://github.com/satijalab/seurat
2022-08-07,r,47,0,tools for the analysis of color data in R,rmaia,pavo,https://github.com/rmaia/pavo
2022-08-07,r,239,0,ArchR : Analysis of Regulatory Chromatin in R (www.ArchRProject.com),GreenleafLab,ArchR,https://github.com/GreenleafLab/ArchR
2022-08-07,r,912,2,Make Complex Heatmaps,jokergoo,ComplexHeatmap,https://github.com/jokergoo/ComplexHeatmap
2022-08-07,r,3918,1,A collection of interactive courses for the swirl R package.,swirldev,swirl_courses,https://github.com/swirldev/swirl_courses
2022-08-07,r,628,0,Generate static html documentation for an R package,r-lib,pkgdown,https://github.com/r-lib/pkgdown
2022-08-07,r,313,0,"R toolkit for inference, visualization and analysis of cell-cell communication from single-cell data",sqjin,CellChat,https://github.com/sqjin/CellChat
2022-08-07,r,1038,1,Simple Features for R,r-spatial,sf,https://github.com/r-spatial/sf
2022-08-07,r,2751,0,A curated list of awesome network analysis resources.,briatte,awesome-network-analysis,https://github.com/briatte/awesome-network-analysis
2022-08-07,r,438,0,"phyloseq is a set of classes, wrappers, and tools (in R) to make it easier to import, store, and analyze phylogenetic sequencing data; and to reproducibly share that data and analysis with others. See the phyloseq front page:",joey711,phyloseq,https://github.com/joey711/phyloseq
2022-08-07,r,3588,1,R for data science: a book,hadley,r4ds,https://github.com/hadley/r4ds
2022-08-07,r,648,0,Visualization and annotation of phylogenetic trees,YuLab-SMU,ggtree,https://github.com/YuLab-SMU/ggtree
2022-08-07,r,433,0,Interactive viewing of spatial data in R,r-spatial,mapview,https://github.com/r-spatial/mapview
2022-08-07,r,563,0,"Robyn is an experimental, automated and open-sourced Marketing Mix Modeling (MMM) package from Facebook Marketing Science. It uses various machine learning techniques (Ridge regression, multi-objective evolutionary algorithm for hyperparameter optimisation, gradient-based optimisation for budget allocation etc.) to define media channel efficienc…",facebookexperimental,Robyn,https://github.com/facebookexperimental/Robyn
2022-08-07,r,0,0,Tool for validating the Cancer Data Service's (CDS) Metadata Template in R,CBIIT,CancerDataServices-SubmissionValidationR,https://github.com/CBIIT/CancerDataServices-SubmissionValidationR
2022-08-07,r,1020,0,Repel overlapping text labels away from each other.,slowkow,ggrepel,https://github.com/slowkow/ggrepel
2022-08-07,r,1033,0,brms R package for Bayesian generalized multivariate non-linear multilevel models using Stan,paul-buerkner,brms,https://github.com/paul-buerkner/brms
2022-08-07,r,662,0,A universal enrichment tool for interpreting omics data,YuLab-SMU,clusterProfiler,https://github.com/YuLab-SMU/clusterProfiler
2022-08-07,r,64,0,Dataset distribution for Seurat,satijalab,seurat-data,https://github.com/satijalab/seurat-data
2022-08-07,r,254,1,Equipment Loss Tracking,leedrake5,Russia-Ukraine,https://github.com/leedrake5/Russia-Ukraine
2022-08-07,r,4161,1,dplyr: A grammar of data manipulation,tidyverse,dplyr,https://github.com/tidyverse/dplyr
2022-08-07,r,650,0,Make working with dates in R just that little bit easier,tidyverse,lubridate,https://github.com/tidyverse/lubridate
2022-08-07,r,4749,1,Easy interactive web applications with R,rstudio,shiny,https://github.com/rstudio/shiny
2022-08-07,r,50,1,"rstudio::conf(2022, ""program"")",rstudio,rstudio-conf-2022-program,https://github.com/rstudio/rstudio-conf-2022-program
2022-08-07,r,2233,0,An interactive graphing library for R,plotly,plotly.R,https://github.com/plotly/plotly.R