date,language,stargazers,starsToday,description,owner,name,url
2024-04-12,lua,2841,2,,ThePrimeagen,init.lua,https://github.com/ThePrimeagen/init.lua
2024-04-12,lua,886,4,A community repository of common plugin specifications,AstroNvim,astrocommunity,https://github.com/AstroNvim/astrocommunity
2024-04-12,lua,83,4,I use Neovim (BTW),letieu,btw.nvim,https://github.com/letieu/btw.nvim
2024-04-12,lua,174,0,"Vape V4 for Roblox, because bored.",7GrandDadPGN,VapeV4ForRoblox,https://github.com/7GrandDadPGN/VapeV4ForRoblox
2024-04-12,lua,2710,4,Orgmode clone written in Lua for Neovim 0.9+.,nvim-orgmode,orgmode,https://github.com/nvim-orgmode/orgmode
2024-04-12,lua,922,9,Supercharge your Rust experience in Neovim! A heavily modified fork of rust-tools.nvim,mrcjkb,rustaceanvim,https://github.com/mrcjkb/rustaceanvim
2024-04-12,lua,2937,1,Jitsi Meet on Docker,jitsi,docker-jitsi-meet,https://github.com/jitsi/docker-jitsi-meet
2024-04-12,lua,15089,28,"An ebook reader application supporting PDF, DjVu, EPUB, FB2 and many more formats, running on Cervantes, Kindle, Kobo, PocketBook and Android devices",koreader,koreader,https://github.com/koreader/koreader
2024-04-12,lua,1888,8,Soho vibes for Neovim,rose-pine,neovim,https://github.com/rose-pine/neovim
2024-04-12,lua,13613,6,The Cloud-Native API Gateway,apache,apisix,https://github.com/apache/apisix
2024-04-12,lua,37409,13,🦍 The Cloud-Native API Gateway and AI Gateway.,Kong,kong,https://github.com/Kong/kong
2024-04-12,lua,308,0,Canary Server 13.x for OpenTibia community.,opentibiabr,canary,https://github.com/opentibiabr/canary
2024-04-12,lua,2646,9,Obsidian 🤝 Neovim,epwalsh,obsidian.nvim,https://github.com/epwalsh/obsidian.nvim
2024-04-12,lua,2531,8,Neovim file explorer: edit your filesystem like a buffer,stevearc,oil.nvim,https://github.com/stevearc/oil.nvim
2024-04-12,lua,7121,15,"Rime 配置：雾凇拼音 | 长期维护的简体词库",iDvel,rime-ice,https://github.com/iDvel/rime-ice
2024-04-12,lua,354,6,Highlight colors for neovim,brenoprata10,nvim-highlight-colors,https://github.com/brenoprata10/nvim-highlight-colors
2024-04-12,lua,1574,3,Lua port of the most famous vim colorscheme,ellisonleao,gruvbox.nvim,https://github.com/ellisonleao/gruvbox.nvim
2024-04-12,lua,11400,0,"Multi-layer Recurrent Neural Networks (LSTM, GRU, RNN) for character-level language models in Torch",karpathy,char-rnn,https://github.com/karpathy/char-rnn
2024-04-12,lua,442,1,"An extension for nvim-dap, providing default configurations for python and methods to debug individual test methods or classes.",mfussenegger,nvim-dap-python,https://github.com/mfussenegger/nvim-dap-python
2024-04-12,lua,161,10,A lightweight high-performance and radix tree based router for Lua/LuaJIT/OpenResty https://github.com/vm-001/gateways-routing-benchmark,vm-001,lua-radix-router,https://github.com/vm-001/lua-radix-router
2024-04-12,lua,284,3,"A public collection of mods for Sky: Children of the Light, the latest game by thatgamecompany!",thatskymod,Sky-CotL-Scripts,https://github.com/thatskymod/Sky-CotL-Scripts
2024-04-12,lua,167,1,Feedback & suggestions are welcomed here for ETHOS by FrSky,FrSkyRC,ETHOS-Feedback-Community,https://github.com/FrSkyRC/ETHOS-Feedback-Community
2024-04-12,lua,139,0,Tooling to run plugin tests with Kong and Kong Enterprise,Kong,kong-pongo,https://github.com/Kong/kong-pongo
2024-04-12,lua,6340,2,,xiaorouji,openwrt-passwall,https://github.com/xiaorouji/openwrt-passwall
2024-04-12,lua,119,0,nvim-cmp source for math calculation,hrsh7th,cmp-calc,https://github.com/hrsh7th/cmp-calc