date,language,stargazers,starsToday,description,owner,name,url
2022-02-09,perl,4253,0,A simple static site generator for photoessays,Jack000,Expose,https://github.com/Jack000/Expose
2022-02-09,perl,12503,5,Stack trace visualizer,brendangregg,FlameGraph,https://github.com/brendangregg/FlameGraph
2022-02-09,perl,362,0,ISO/IEC JTC1 SC22 WG21 paper scheduling and management,cplusplus,papers,https://github.com/cplusplus/papers
2022-02-09,perl,1020,1,This is the new home for ddclient. Ddclient is a Perl client used to update dynamic DNS entries for accounts on 'Dynamic DNS Network Services' free DNS service. It currently supports a lot of different routers and a few different services.,ddclient,ddclient,https://github.com/ddclient/ddclient
2022-02-09,perl,48,0,a perl library for sending email,rjbs,Email-Sender,https://github.com/rjbs/Email-Sender
2022-02-09,perl,1,0,Analysis code for MCRG,DeltaP,MCRG,https://github.com/DeltaP/MCRG
2022-02-09,perl,973,1,ModSecurity v3 Nginx Connector,SpiderLabs,ModSecurity-nginx,https://github.com/SpiderLabs/ModSecurity-nginx
2022-02-09,perl,2309,3,"Imapsync is an IMAP transfers tool. The purpose of imapsync is to migrate IMAP accounts or to backup IMAP accounts. IMAP is one of the three current standard protocols to access mailboxes, the two others are POP3 and HTTP with webmails, webmails are often tied to an IMAP server. Upstream website is",imapsync,imapsync,https://github.com/imapsync/imapsync
2022-02-09,perl,84,0,FreeRDP Manuals,awakecoding,FreeRDP-Manuals,https://github.com/awakecoding/FreeRDP-Manuals
2022-02-09,perl,379,0,Movable Type,movabletype,movabletype,https://github.com/movabletype/movabletype
2022-02-09,perl,534,0,Rapid prokaryotic genome annotation,tseemann,prokka,https://github.com/tseemann/prokka
2022-02-09,perl,952,1,"PacketFence is a fully supported, trusted, Free and Open Source network access control (NAC) solution. Boasting an impressive feature set including a captive-portal for registration and remediation, centralized wired and wireless management, powerful BYOD management options, 802.1X support, layer-2 isolation of problematic devices; PacketFence c…",inverse-inc,packetfence,https://github.com/inverse-inc/packetfence
2022-02-09,perl,264,0,Collection of standard plugins to discover and gather cloud-to-edge metrics and status across your whole IT infrastructure.,centreon,centreon-plugins,https://github.com/centreon/centreon-plugins
2022-02-09,perl,2061,3,"Policy-driven snapshot management and replication tools. Using ZFS for underlying next-gen storage. (Btrfs support plans are shelved unless and until btrfs becomes reliable.) Primarily intended for Linux, but BSD use is supported and reasonably frequently tested.",jimsalterjrs,sanoid,https://github.com/jimsalterjrs/sanoid
2022-02-09,perl,1601,3,Client for PPP+SSL VPN tunnel services,adrienverge,openfortivpn,https://github.com/adrienverge/openfortivpn
2022-02-09,perl,1189,0,"A simple guide (and example of configuration) to install i3 & its and essentials packages, then make them look eye candy.",addy-dclxvi,i3-starterpack,https://github.com/addy-dclxvi/i3-starterpack
2022-02-09,perl,710,1,Ásbrú Connection Manager is a user interface that helps organizing remote terminal sessions and automating repetitive tasks.,asbru-cm,asbru-cm,https://github.com/asbru-cm/asbru-cm
2022-02-09,perl,216,1,"The Open Charge Point Interface (OCPI) allows for a scalable, automated roaming setup between Charge Point Operators and e-Mobility Service Providers. It supports authorisation, charge point information exchange (incl transaction events), charge detail record exchange and finally, the exchange of smart-charging commands between parties.",ocpi,ocpi,https://github.com/ocpi/ocpi
2022-02-09,perl,306,0,"A wrapper around Cutadapt and FastQC to consistently apply adapter and quality trimming to FastQ files, with extra functionality for RRBS data",FelixKrueger,TrimGalore,https://github.com/FelixKrueger/TrimGalore
2022-02-09,perl,13435,7,"cloc counts blank lines, comment lines, and physical lines of source code in many programming languages.",AlDanial,cloc,https://github.com/AlDanial/cloc
2022-02-09,perl,3959,0,"Git-it is a (Mac, Win, Linux) Desktop App for Learning Git and GitHub",jlord,git-it-electron,https://github.com/jlord/git-it-electron
2022-02-09,perl,1304,2,"The book documenting the curl project, the curl tool, libcurl and more. Simply put: everything curl.",bagder,everything-curl,https://github.com/bagder/everything-curl
2022-02-09,perl,1,0,Geonetwork installer project,geonetwork,core-installer,https://github.com/geonetwork/core-installer
2022-02-09,perl,2569,3,A fast PostgreSQL Log Analyzer,darold,pgbadger,https://github.com/darold/pgbadger
2022-02-09,perl,5467,1,Nikto web server scanner,sullo,nikto,https://github.com/sullo/nikto