date,language,stargazers,starsToday,description,owner,name,url
2023-04-07,r,1758,0,R toolkit for single cell genomics,satijalab,seurat,https://github.com/satijalab/seurat
2023-04-07,r,5855,1,An implementation of the Grammar of Graphics in R,tidyverse,ggplot2,https://github.com/tidyverse/ggplot2
2023-04-07,r,4412,2,dplyr: A grammar of data manipulation,tidyverse,dplyr,https://github.com/tidyverse/dplyr
2023-04-07,r,1502,2,Statistical Rethinking Course for Jan-Mar 2023,rmcelreath,stat_rethinking_2023,https://github.com/rmcelreath/stat_rethinking_2023
2023-04-07,r,3917,1,R for data science: a book,hadley,r4ds,https://github.com/hadley/r4ds
2023-04-07,r,764,2,"Robyn is an experimental, automated and open-sourced Marketing Mix Modeling (MMM) package from Facebook Marketing Science. It uses various machine learning techniques (Ridge regression, multi-objective evolutionary algorithm for hyperparameter optimisation, gradient-based optimisation for budget allocation etc.) to define media channel efficienc…",facebookexperimental,Robyn,https://github.com/facebookexperimental/Robyn
2023-04-07,r,492,0,"phyloseq is a set of classes, wrappers, and tools (in R) to make it easier to import, store, and analyze phylogenetic sequencing data; and to reproducibly share that data and analysis with others. See the phyloseq front page:",joey711,phyloseq,https://github.com/joey711/phyloseq
2023-04-07,r,831,3,renv: Project environments for R.,rstudio,renv,https://github.com/rstudio/renv
2023-04-07,r,782,0,Repository for Programming Assignment 2 for R Programming on Coursera,rdpeng,ProgrammingAssignment2,https://github.com/rdpeng/ProgrammingAssignment2
2023-04-07,r,216,0,R toolkit for the analysis of single-cell chromatin data,stuart-lab,signac,https://github.com/stuart-lab/signac
2023-04-07,r,383,0,Accurate sample inference from amplicon data with single nucleotide resolution,benjjneb,dada2,https://github.com/benjjneb/dada2
2023-04-07,r,423,0,"R toolkit for inference, visualization and analysis of cell-cell communication from single-cell data",sqjin,CellChat,https://github.com/sqjin/CellChat
2023-04-07,r,237,0,,cole-trapnell-lab,monocle3,https://github.com/cole-trapnell-lab/monocle3
2023-04-07,r,1122,1,Simple Features for R,r-spatial,sf,https://github.com/r-spatial/sf
2023-04-07,r,899,0,R interface for Apache Spark,sparklyr,sparklyr,https://github.com/sparklyr/sparklyr
2023-04-07,r,0,0,Source repository for PUBH 7462 Assignment 7,jwolfson,7462-sepsis-monitor,https://github.com/jwolfson/7462-sepsis-monitor
2023-04-07,r,514,1,"GPT RStudio addins that enable GPT assisted coding, writing & analysis",MichelNivard,gptstudio,https://github.com/MichelNivard/gptstudio
2023-04-07,r,421,1,Inferring CNV from Single-Cell RNA-Seq,broadinstitute,infercnv,https://github.com/broadinstitute/infercnv
2023-04-07,r,102,0,,kpatel427,YouTubeTutorials,https://github.com/kpatel427/YouTubeTutorials
2023-04-07,r,2194,0,The Composer of ggplots,thomasp85,patchwork,https://github.com/thomasp85/patchwork
2023-04-07,r,947,0,"Read flat files (csv, tsv, fwf) into R",tidyverse,readr,https://github.com/tidyverse/readr
2023-04-07,r,1513,0,R Interface to Python,rstudio,reticulate,https://github.com/rstudio/reticulate
2023-04-07,r,245,0,R package for detecting doublets in single-cell RNA sequencing data,chris-mcginnis-ucsf,DoubletFinder,https://github.com/chris-mcginnis-ucsf/DoubletFinder
2023-04-07,r,1026,0,Make Complex Heatmaps,jokergoo,ComplexHeatmap,https://github.com/jokergoo/ComplexHeatmap
2023-04-07,r,1105,0,brms R package for Bayesian generalized multivariate non-linear multilevel models using Stan,paul-buerkner,brms,https://github.com/paul-buerkner/brms