date,language,stargazers,starsToday,description,owner,name,url
2023-05-03,scala,13065,12,"♞ lichess.org: the forever free, adless and open source chess server ♞",lichess-org,lila,https://github.com/lichess-org/lila
2023-05-03,scala,56478,47,Source code for Twitter's Recommendation Algorithm,twitter,the-algorithm,https://github.com/twitter/the-algorithm
2023-05-03,scala,633,1,A scala library to write Http apps.,zio,zio-http,https://github.com/zio/zio-http
2023-05-03,scala,2763,2,"Deequ is a library built on top of Apache Spark for defining ""unit tests for data"", which measure data quality in large datasets.",awslabs,deequ,https://github.com/awslabs/deequ
2023-05-03,scala,5932,0,"An open-source storage framework that enables building a Lakehouse architecture with compute engines including Spark, PrestoDB, Flink, Trino, and Hive and APIs",delta-io,delta,https://github.com/delta-io/delta
2023-05-03,scala,8649,1,"A fault tolerant, protocol-agnostic RPC system",twitter,finagle,https://github.com/twitter/finagle
2023-05-03,scala,16,0,n10n for nOTIFICATIOn,guardian,mobile-n10n,https://github.com/guardian/mobile-n10n
2023-05-03,scala,2866,2,A simple client for Android,xxf098,shadowsocksr-v2ray-trojan-android,https://github.com/xxf098/shadowsocksr-v2ray-trojan-android
2023-05-03,scala,4251,4,Simple and Distributed Machine Learning,microsoft,SynapseML,https://github.com/microsoft/SynapseML
2023-05-03,scala,3227,1,State of the Art Natural Language Processing,JohnSnowLabs,spark-nlp,https://github.com/JohnSnowLabs/spark-nlp
2023-05-03,scala,6040,2,Apache OpenWhisk is an open source serverless cloud platform,apache,openwhisk,https://github.com/apache/openwhisk
2023-05-03,scala,5313,5,"The Scala 3 compiler, also known as Dotty.",lampepfl,dotty,https://github.com/lampepfl/dotty
2023-05-03,scala,1883,2,Scala language server with rich IDE features,scalameta,metals,https://github.com/scalameta/metals
2023-05-03,scala,254,0,https://disneystreaming.github.io/smithy4s/,disneystreaming,smithy4s,https://github.com/disneystreaming/smithy4s
2023-05-03,scala,2569,0,Spark: The Definitive Guide's Code Repository,databricks,Spark-The-Definitive-Guide,https://github.com/databricks/Spark-The-Definitive-Guide
2023-05-03,scala,195,0,"Open, Modular, Deep Learning Accelerator",apache,tvm-vta,https://github.com/apache/tvm-vta
2023-05-03,scala,12680,2,"Build highly concurrent, distributed, and resilient message-driven applications on the JVM",akka,akka,https://github.com/akka/akka
2023-05-03,scala,38,0,Notebook service,DataBiosphere,leonardo,https://github.com/DataBiosphere/leonardo
2023-05-03,scala,755,0,The Daml smart contract language,digital-asset,daml,https://github.com/digital-asset/daml
2023-05-03,scala,3,0,"This is an Image transformation webservice where we can see 3 algorithms performing updates on images. It implements a contour for images, the Kuwahara blur filter and finally an algorithm I made myself called chartizate. The latter creates images where the foreground is written text.",jesperancinha,image-train-filters-web,https://github.com/jesperancinha/image-train-filters-web
2023-05-03,scala,21,0,Conversão Total para GTA San Andreas com foco numa estética verdadeiramente brasileira.,pulse-club,gta-brasil,https://github.com/pulse-club/gta-brasil
2023-05-03,scala,176,0,Helps to snipe hard to get reservations at restaurants that use resy,Alkaar,resy-booking-bot,https://github.com/Alkaar/resy-booking-bot
2023-05-03,scala,3550,1,Open-source high-performance RISC-V processor,OpenXiangShan,XiangShan,https://github.com/OpenXiangShan/XiangShan
2023-05-03,scala,6441,3,"The enterprise-grade behavioral data engine (web, mobile, server-side, webhooks), running cloud-natively on AWS and GCP",snowplow,snowplow,https://github.com/snowplow/snowplow
2023-05-03,scala,414,1,A visual tool to define and run real-time decision algorithms.,TouK,nussknacker,https://github.com/TouK/nussknacker