date,language,stargazers,starsToday,description,owner,name,url
2024-01-22,vue,3450,7,The sleekest looking WEBUI for qBittorrent made with Vuejs!,VueTorrent,VueTorrent,https://github.com/VueTorrent/VueTorrent
2024-01-22,vue,599,23,"Improve your Bilibili homepage by redesigning it, adding more features, and personalizing it to match your preferences. (English | ç®€ä½“ä¸­æ–‡ | æ­£é«”ä¸­æ–‡ | å»£æ±è©±)",hakadao,BewlyBewly,https://github.com/hakadao/BewlyBewly
2024-01-22,vue,3291,12,"â˜€ï¸ A vue3 admin template | vue3 admin/element plus admin/vite admin/vue3 template/vue3 åå°/vue3 æ¨¡æ¿/vue3 åå°ç®¡ç†ç³»ç»Ÿ",un-pany,v3-admin-vite,https://github.com/un-pany/v3-admin-vite
2024-01-22,vue,6982,10,An alternative privacy-friendly YouTube frontend which is efficient by design.,TeamPiped,Piped,https://github.com/TeamPiped/Piped
2024-01-22,vue,5626,32,Interface for Snapshot. Join us on Discord http://discord.snapshot.org,snapshot-labs,snapshot,https://github.com/snapshot-labs/snapshot
2024-01-22,vue,3036,18,A Modern Redis GUI Client,tiny-craft,tiny-rdm,https://github.com/tiny-craft/tiny-rdm
2024-01-22,vue,1148,93,"chatgpt web, midjourney, gpts,tts, whisper ä¸€å¥—uiå…¨æå®š",Dooy,chatgpt-web-midjourney-proxy,https://github.com/Dooy/chatgpt-web-midjourney-proxy
2024-01-22,vue,855,2,"Full featured Z-Wave Control Panel UI and MQTT gateway. Built using Nodejs, and Vue/Vuetify",zwave-js,zwave-js-ui,https://github.com/zwave-js/zwave-js-ui
2024-01-22,vue,22755,10,"Wiki.js | A modern and powerful wiki app built on Node.js",requarks,wiki,https://github.com/requarks/wiki
2024-01-22,vue,4392,4,,CareyWang,sub-web,https://github.com/CareyWang/sub-web
2024-01-22,vue,1847,7,ä¸ªäººä¸»é¡µï¼Œæˆ‘çš„ä¸ªäººä¸»é¡µï¼Œä¸ªäººä¸»é¡µæºç ï¼Œä¸»é¡µæ¨¡æ¿ï¼Œhomepage,imsyy,home,https://github.com/imsyy/home
2024-01-22,vue,2652,4,"A UI Library for Modern Web Apps, powered by Vue & TailwindCSS.",nuxt,ui,https://github.com/nuxt/ui
2024-01-22,vue,25943,13,é«˜é¢œå€¼çš„ç¬¬ä¸‰æ–¹ç½‘æ˜“äº‘æ’­æ”¾å™¨ï¼Œæ”¯æŒ Windows / macOS / Linux,qier222,YesPlayMusic,https://github.com/qier222/YesPlayMusic
2024-01-22,vue,4311,6,å°ç™½ç¾Šç½‘ç›˜ - Powered by é˜¿é‡Œäº‘ç›˜ã€‚,gaozhangmin,aliyunpan,https://github.com/gaozhangmin/aliyunpan
2024-01-22,vue,1324,1,"Obico is a community-built, open-source smart 3D printing platform used by makers, enthusiasts, and tinkerers around the world.",TheSpaghettiDetective,obico-server,https://github.com/TheSpaghettiDetective/obico-server
2024-01-22,vue,14254,10,"ğŸš€ A self-hostable personal dashboard built for you. Includes status-checking, widgets, themes, icon packs, a UI editor and tons more!",Lissy93,dashy,https://github.com/Lissy93/dashy
2024-01-22,vue,4499,2,"âœ WeChat Markdown Editor | ä¸€æ¬¾é«˜åº¦ç®€æ´çš„å¾®ä¿¡ Markdown ç¼–è¾‘å™¨ï¼šæ”¯æŒ Markdown è¯­æ³•ã€è‰²ç›˜å–è‰²ã€å¤šå›¾ä¸Šä¼ ã€ä¸€é”®ä¸‹è½½æ–‡æ¡£ã€è‡ªå®šä¹‰ CSS æ ·å¼ã€ä¸€é”®é‡ç½®ç­‰ç‰¹æ€§",doocs,md,https://github.com/doocs/md
2024-01-22,vue,3412,6,Lord of Large Language Models Web User Interface,ParisNeo,lollms-webui,https://github.com/ParisNeo/lollms-webui
2024-01-22,vue,84,1,A former speech-to-text app using the Web Speech API.,curtgrimes,webcaptioner,https://github.com/curtgrimes/webcaptioner
2024-01-22,vue,5266,6,A free and open source code snippets manager for developers,massCodeIO,massCode,https://github.com/massCodeIO/massCode
2024-01-22,vue,781,0,èŠ‹é“ç®¡ç†åå°ï¼ŒåŸºäº Vue3 + Element Plus å®ç°ï¼Œæ”¯æŒ RBAC åŠ¨æ€æƒé™ã€æ•°æ®æƒé™ã€SaaS å¤šç§Ÿæˆ·ã€Flowable å·¥ä½œæµã€ä¸‰æ–¹ç™»å½•ã€æ”¯ä»˜ã€çŸ­ä¿¡ã€å•†åŸç­‰åŠŸèƒ½ã€‚,yudaocode,yudao-ui-admin-vue3,https://github.com/yudaocode/yudao-ui-admin-vue3
2024-01-22,vue,85271,9,ğŸ‰ A magical vue admin https://panjiachen.github.io/vue-element-admin,PanJiaChen,vue-element-admin,https://github.com/PanJiaChen/vue-element-admin
2024-01-22,vue,5430,6,"A beautiful home server OS for self-hosting with an app store. Buy a pre-built Umbrel Home with umbrelOS, or install on a Raspberry Pi 4, any Ubuntu/Debian system, or a VPS.",getumbrel,umbrel,https://github.com/getumbrel/umbrel
2024-01-22,vue,8,0,"MOLGENIS EMX2, the latest version of the MOLGENIS data platform.",molgenis,molgenis-emx2,https://github.com/molgenis/molgenis-emx2
2024-01-22,vue,2,0,Web frontend for the Accentor music server,accentor,web,https://github.com/accentor/web