date,language,stargazers,starsToday,description,owner,name,url
2024-07-15,elixir,19103,7,"Simple, open source, lightweight (< 1 KB) and privacy-friendly web analytics alternative to Google Analytics.",plausible,analytics,https://github.com/plausible/analytics
2024-07-15,elixir,24054,24,"Elixir is a dynamic, functional language for building scalable and maintainable applications",elixir-lang,elixir,https://github.com/elixir-lang/elixir
2024-07-15,elixir,20992,2,Peace of mind from prototype to production,phoenixframework,phoenix,https://github.com/phoenixframework/phoenix
2024-07-15,elixir,6593,1,"Broadcast, Presence, and Postgres Changes via WebSockets",supabase,realtime,https://github.com/supabase/realtime
2024-07-15,elixir,1466,0,"A declarative, extensible framework for building Elixir applications.",ash-project,ash,https://github.com/ash-project/ash
2024-07-15,elixir,5990,0,"Rich, real-time user experiences with server-rendered HTML",phoenixframework,phoenix_live_view,https://github.com/phoenixframework/phoenix_live_view
2024-07-15,elixir,1050,0,Faker is a pure Elixir library for generating fake data.,elixirs,faker,https://github.com/elixirs/faker
2024-07-15,elixir,6484,2,Enterprise-ready zero-trust access platform built on WireGuard®.,firezone,firezone,https://github.com/firezone/firezone
2024-07-15,elixir,788,1,Lexical is a next-generation elixir language server,lexical-lsp,lexical,https://github.com/lexical-lsp/lexical
2024-07-15,elixir,824,0,"Open-source content management system (CMS) built with Phoenix LiveView. Faster render times to boost SEO performance, even for the most content-heavy pages.",BeaconCMS,beacon,https://github.com/BeaconCMS/beacon
2024-07-15,elixir,2546,0,Multi-dimensional arrays (tensors) and numerical definitions for Elixir,elixir-nx,nx,https://github.com/elixir-nx/nx
2024-07-15,elixir,156,0,Dynamic (multi)selection field for LiveView,maxmarcon,live_select,https://github.com/maxmarcon/live_select
2024-07-15,elixir,1302,0,Powerfully simple admin package for phoenix applications,aesmail,kaffy,https://github.com/aesmail/kaffy
2024-07-15,elixir,1053,1,Series (one-dimensional) and dataframes (two-dimensional) for fast and elegant data exploration in Elixir,elixir-explorer,explorer,https://github.com/elixir-explorer/explorer
2024-07-15,elixir,798,0,A pure Elixir implementation of Google Protobuf.,elixir-protobuf,protobuf,https://github.com/elixir-protobuf/protobuf