date,language,stargazers,starsToday,description,owner,name,url
2024-11-19,astro,2539,4,"A minimal, accessible and SEO-friendly Astro blog theme",satnaing,astro-paper,https://github.com/satnaing/astro-paper
2024-11-19,astro,967,0,"Astrofy is a free and open-source template for your Personal Portfolio Website built with Astro and TailwindCSS. Create in minutes a website with Blog, CV, Project Section, Store and RSS Feed.",manuelernestog,astrofy,https://github.com/manuelernestog/astrofy
2024-11-19,astro,44078,8,AdminLTE - Free admin dashboard template based on Bootstrap 5,ColorlibHQ,AdminLTE,https://github.com/ColorlibHQ/AdminLTE
2024-11-19,astro,3482,10,⭕️ AstroWind: A free template using Astro 4.0 and Tailwind CSS. Astro starter theme.,onwidget,astrowind,https://github.com/onwidget/astrowind
2024-11-19,astro,940,1,A simple Astro theme. Use it to create your blog or website.,chrismwilliams,astro-theme-cactus,https://github.com/chrismwilliams/astro-theme-cactus
2024-11-19,astro,583,1,"Astroplate is a free starter template built with Astro, TailwindCSS & TypeScript providing everything you need to jumpstart your Astro project. Get started with Astroplate and save yourself hours of work!",zeon-studio,astroplate,https://github.com/zeon-studio/astroplate
2024-11-19,astro,658,3,"📚 Openblog is an elegant, simple, and user-friendly blog. Focused on accessibility, SEO and performance.",danielcgilibert,blog-template,https://github.com/danielcgilibert/blog-template
2024-11-19,astro,1395,5,✨A static blog template built with Astro.,saicaca,fuwari,https://github.com/saicaca/fuwari
2024-11-19,astro,46,0,A bare-bones Astro template to get you deployed to Netlify fast!,netlify-templates,astro-quickstart,https://github.com/netlify-templates/astro-quickstart
2024-11-19,astro,3136,0,"An opinionated, actionable guide for software engineering interviews.",nas5w,interview-guide,https://github.com/nas5w/interview-guide
2024-11-19,astro,276,1,"Dante, a single-author blog and portfolio theme for Astro.js.",JustGoodUI,dante-astro-theme,https://github.com/JustGoodUI/dante-astro-theme