date,language,stargazers,starsToday,description,owner,name,url
2024-09-23,rust,73048,55,"An open-source remote desktop application designed for self-hosting, as an alternative to TeamViewer.",rustdesk,rustdesk,https://github.com/rustdesk/rustdesk
2024-09-23,rust,4683,51,"Secure & Modern All-in-One Mail Server (IMAP, JMAP, POP3, SMTP)",stalwartlabs,mail-server,https://github.com/stalwartlabs/mail-server
2024-09-23,rust,21731,13,egui: an easy-to-use immediate mode GUI in Rust that runs on both web and native,emilk,egui,https://github.com/emilk/egui
2024-09-23,rust,8143,6,"Foundry is a blazing fast, portable and modular toolkit for Ethereum application development written in Rust.",foundry-rs,foundry,https://github.com/foundry-rs/foundry
2024-09-23,rust,97004,40,Empowering everyone to build reliable and efficient software.,rust-lang,rust,https://github.com/rust-lang/rust
2024-09-23,rust,13068,18,"🧰 The Rust SQL Toolkit. An async, pure Rust SQL crate featuring compile-time checked queries without a DSL. Supports PostgreSQL, MySQL, and SQLite.",launchbadge,sqlx,https://github.com/launchbadge/sqlx
2024-09-23,rust,20627,89,"An extremely fast Python package and project manager, written in Rust.",astral-sh,uv,https://github.com/astral-sh/uv
2024-09-23,rust,2169,4,"A native Rust library for Delta Lake, with bindings into Python",delta-io,delta-rs,https://github.com/delta-io/delta-rs
2024-09-23,rust,17763,9,Create book from markdown files. Like Gitbook but implemented in Rust,rust-lang,mdBook,https://github.com/rust-lang/mdBook
2024-09-23,rust,4305,9,A Decentralized Operating System for ZK Applications,AleoNet,snarkOS,https://github.com/AleoNet/snarkOS
2024-09-23,rust,6984,7,🐚 An async & dynamic ORM for Rust,SeaQL,sea-orm,https://github.com/SeaQL/sea-orm
2024-09-23,rust,18374,10,"Anki's shared backend and web components, and the Qt frontend",ankitects,anki,https://github.com/ankitects/anki
2024-09-23,rust,14955,3,The Rust Programming Language,rust-lang,book,https://github.com/rust-lang/book
2024-09-23,rust,15157,5,A fast and secure runtime for WebAssembly,bytecodealliance,wasmtime,https://github.com/bytecodealliance/wasmtime
2024-09-23,rust,20334,26,🤖 Just a command runner,casey,just,https://github.com/casey/just
2024-09-23,rust,1432,6,IRC application written in Rust,squidowl,halloy,https://github.com/squidowl/halloy
2024-09-23,rust,15483,5,A Flash Player emulator written in Rust,ruffle-rs,ruffle,https://github.com/ruffle-rs/ruffle
2024-09-23,rust,12597,2,The Rust package manager,rust-lang,cargo,https://github.com/rust-lang/cargo
2024-09-23,rust,5996,1,"Sui, a next-generation smart contract platform with high throughput, low latency, and an asset-oriented programming model powered by the Move programming language",MystenLabs,sui,https://github.com/MystenLabs/sui
2024-09-23,rust,2146,7,Kani Rust Verifier,model-checking,kani,https://github.com/model-checking/kani
2024-09-23,rust,18121,16,An incremental parsing system for programming tools,tree-sitter,tree-sitter,https://github.com/tree-sitter/tree-sitter
2024-09-23,rust,27539,3,This is the Rust course used by the Android team at Google. It provides you the material to quickly teach Rust.,google,comprehensive-rust,https://github.com/google/comprehensive-rust
2024-09-23,rust,8651,22,Clash Nyanpasu～(∠・ω< )⌒☆​,libnyanpasu,clash-nyanpasu,https://github.com/libnyanpasu/clash-nyanpasu