date,language,stargazers,starsToday,description,owner,name,url
2022-12-24,svelte,58,3,A basic realtime chat app with Pocketbase and Svelte,fireship-io,pocketchat-tutorial,https://github.com/fireship-io/pocketchat-tutorial
2022-12-24,svelte,16267,18,"The most popular, free and open-source Tailwind CSS component library",saadeghi,daisyui,https://github.com/saadeghi/daisyui
2022-12-24,svelte,2502,1,Build and ship your app faster https://fireship.io,fireship-io,fireship.io,https://github.com/fireship-io/fireship.io
2022-12-24,svelte,128,2,A soup-to-nuts interactive tutorial on how to build apps with Svelte,sveltejs,learn.svelte.dev,https://github.com/sveltejs/learn.svelte.dev
2022-12-24,svelte,565,6,SvelteUI Monorepo,svelteuidev,svelteui,https://github.com/svelteuidev/svelteui
2022-12-24,svelte,12,1,,kanashter,bothermione-ao3wrapped,https://github.com/kanashter/bothermione-ao3wrapped
2022-12-24,svelte,49,0,Run primo on your own server to use it from anywhere & invite collaborators,primodotso,primo-server,https://github.com/primodotso/primo-server
2022-12-24,svelte,91,0,Create a custom league page for your Sleeper fantasy football league!,nmelhado,league-page,https://github.com/nmelhado/league-page
2022-12-24,svelte,102,3,SvelteKit Authentication Example,nstuyvesant,sveltekit-auth-example,https://github.com/nstuyvesant/sveltekit-auth-example
2022-12-24,svelte,5314,5,An open-source & self-hostable Heroku / Netlify alternative.,coollabsio,coolify,https://github.com/coollabsio/coolify
2022-12-24,svelte,3176,9,A collection of advanced CSS styles to create realistic-looking effects for the faces of Pokemon cards.,simeydotme,pokemon-cards-css,https://github.com/simeydotme/pokemon-cards-css
2022-12-24,svelte,2011,0,"Database manager for MySQL, PostgreSQL, SQL Server, MongoDB, SQLite and others. Runs under Windows, Linux, Mac or as web application",dbgate,dbgate,https://github.com/dbgate/dbgate
2022-12-24,svelte,572,2,"a tool that makes it effortless to transform and explore your datasets with SQL, powered by DuckDB",rilldata,rill-developer,https://github.com/rilldata/rill-developer
2022-12-24,svelte,2755,0,Svelte Material UI Components,hperrin,svelte-material-ui,https://github.com/hperrin/svelte-material-ui
2022-12-24,svelte,1399,0,UI framework with material components built with Svelte and Tailwind CSS,matyunya,smelte,https://github.com/matyunya/smelte
2022-12-24,svelte,466,1,"Sveltekit starter project created with sveltekit, typescript, tailwindcss, postcss, husky, and storybook. The project has the structure set up for the scaleable web application.",navneetsharmaui,sveltekit-starter,https://github.com/navneetsharmaui/sveltekit-starter
2022-12-24,svelte,1,0,The designsystem for Mattilsynet,Mattilsynet,designsystem,https://github.com/Mattilsynet/designsystem
2022-12-24,svelte,1361,2,A lightweight Svelte component library for building interactive node-based flow diagrams,open-source-labs,Svelvet,https://github.com/open-source-labs/Svelvet
2022-12-24,svelte,373,4,Project management for Obsidian,marcusolsson,obsidian-projects,https://github.com/marcusolsson/obsidian-projects
2022-12-24,svelte,387,1,This repository shows how Svelte and SvelteKit work together with TypeScript.,ivanhofer,sveltekit-typescript-showcase,https://github.com/ivanhofer/sveltekit-typescript-showcase
2022-12-24,svelte,43,2,A useful Development menu for FiveM,ImXirvin,xv-dev,https://github.com/ImXirvin/xv-dev
2022-12-24,svelte,1179,2,Unofficial Svelte port of the Headless UI component library,rgossiaux,svelte-headlessui,https://github.com/rgossiaux/svelte-headlessui
2022-12-24,svelte,236,1,✒︎ Simply Awesome Blog Starter built with SvelteKit and Love,kwchang0831,svelte-QWER,https://github.com/kwchang0831/svelte-QWER
2022-12-24,svelte,769,1,A pretty cool UI kit for Svelte,illright,attractions,https://github.com/illright/attractions
2022-12-24,svelte,27,2,An easily configurable and customizable blog starter for SvelteKit + Tailwind CSS,akiarostami,sveltekit-tailwind-blog-starter,https://github.com/akiarostami/sveltekit-tailwind-blog-starter