date,language,stargazers,starsToday,description,owner,name,url
2024-09-07,shell,8847,16,Autoware - the world's leading open-source software project for autonomous driving,autowarefoundation,autoware,https://github.com/autowarefoundation/autoware
2024-09-07,shell,923,127,Chris Titus Tech's Linux Toolbox - Linutil is a distro-agnostic toolbox designed to simplify everyday Linux tasks.,ChrisTitusTech,linutil,https://github.com/ChrisTitusTech/linutil
2024-09-07,shell,7279,44,"Qwen2 is the large language model series developed by Qwen team, Alibaba Cloud.",QwenLM,Qwen2,https://github.com/QwenLM/Qwen2
2024-09-07,shell,1605,0,Conda recipes for the bioconda channel.,bioconda,bioconda-recipes,https://github.com/bioconda/bioconda-recipes
2024-09-07,shell,265,1,Release tooling for OpenShift,openshift,release,https://github.com/openshift/release
2024-09-07,shell,45409,10,A Zsh theme,romkatv,powerlevel10k,https://github.com/romkatv/powerlevel10k
2024-09-07,shell,26400,8,"This repository started out as a learning in public project for myself and has now become a structured learning map for many in the community. We have 3 years under our belt covering all things DevOps, including Principles, Processes, Tooling and Use Cases surrounding this vast topic.",MichaelCade,90DaysOfDevOps,https://github.com/MichaelCade/90DaysOfDevOps
2024-09-07,shell,4484,1,Terraform version manager,tfutils,tfenv,https://github.com/tfutils/tfenv
2024-09-07,shell,5569,3,reconFTW is a tool designed to perform automated recon on a target domain by running the best set of tools to perform scanning and finding out vulnerabilities,six2dez,reconftw,https://github.com/six2dez/reconftw
2024-09-07,shell,78679,31,Node Version Manager - POSIX-compliant bash script to manage multiple active node.js versions,nvm-sh,nvm,https://github.com/nvm-sh/nvm
2024-09-07,shell,7864,4,Testing TLS/SSL encryption anywhere on any port,drwetter,testssl.sh,https://github.com/drwetter/testssl.sh
2024-09-07,shell,655,1,This repository provides a command line interface (CLI) utility that replicates an Amazon Managed Workflows for Apache Airflow (MWAA) environment locally.,aws,aws-mwaa-local-runner,https://github.com/aws/aws-mwaa-local-runner
2024-09-07,shell,14087,5,kaldi-asr/kaldi is the official location of the Kaldi project.,kaldi-asr,kaldi,https://github.com/kaldi-asr/kaldi
2024-09-07,shell,3123,1,"Security Onion is a free and open platform for threat hunting, enterprise security monitoring, and log management. It includes our own interfaces for alerting, dashboards, hunting, PCAP, detections, and case management. It also includes other tools such as osquery, CyberChef, Elasticsearch, Logstash, Kibana, Suricata, and Zeek.",Security-Onion-Solutions,securityonion,https://github.com/Security-Onion-Solutions/securityonion
2024-09-07,shell,21544,5,"Extendable version manager with support for Ruby, Node.js, Elixir, Erlang & more",asdf-vm,asdf,https://github.com/asdf-vm/asdf
2024-09-07,shell,18752,3,Node version management,tj,n,https://github.com/tj/n
2024-09-07,shell,13006,7,"Lynis - Security auditing tool for Linux, macOS, and UNIX-based systems. Assists with compliance testing (HIPAA/ISO27001/PCI DSS) and system hardening. Agentless, and installation optional.",CISOfy,lynis,https://github.com/CISOfy/lynis
2024-09-07,shell,3148,1,pre-commit git hooks to take care of Terraform configurations 🇺🇦,antonbabenko,pre-commit-terraform,https://github.com/antonbabenko/pre-commit-terraform
2024-09-07,shell,7698,4,"Sentry, feature-complete and packaged up for low-volume deployments and proofs-of-concept",getsentry,self-hosted,https://github.com/getsentry/self-hosted
2024-09-07,shell,7865,2,"Provides a simple way to run Selenium Grid with Chrome, Firefox, and Edge using Docker, making it easier to perform browser automation",SeleniumHQ,docker-selenium,https://github.com/SeleniumHQ/docker-selenium