date,language,stargazers,starsToday,description,owner,name,url
2024-12-06,haskell,23533,10,REST API for any Postgres database,PostgREST,postgrest,https://github.com/PostgREST/postgrest
2024-12-06,haskell,36550,5,"ShellCheck, a static analysis tool for shell scripts",koalaman,shellcheck,https://github.com/koalaman/shellcheck
2024-12-06,haskell,34924,20,Universal markup converter,jgm,pandoc,https://github.com/jgm/pandoc
2024-12-06,haskell,10503,2,"Dockerfile linter, validate inline bash, written in Haskell",hadolint,hadolint,https://github.com/hadolint/hadolint
2024-12-06,haskell,2624,1,🇪🇺 Wire back-end services,wireapp,wire-server,https://github.com/wireapp/wire-server
2024-12-06,haskell,3079,0,The core component that is used to participate in a Cardano decentralised blockchain.,IntersectMBO,cardano-node,https://github.com/IntersectMBO/cardano-node
2024-12-06,haskell,2727,2,Official haskell ide support via language server (LSP). Successor of ghcide & haskell-ide-engine.,haskell,haskell-language-server,https://github.com/haskell/haskell-language-server
2024-12-06,haskell,772,1,HTTP server & command-line for managing UTxOs and HD wallets in Cardano.,cardano-foundation,cardano-wallet,https://github.com/cardano-foundation/cardano-wallet
2024-12-06,haskell,1299,3,"Fast, portable and reliable dependency analysis for any codebase. Supports license & vulnerability scanning for large monoliths. Language-agnostic; integrates with 20+ build systems.",fossas,fossa-cli,https://github.com/fossas/fossa-cli
2024-12-06,haskell,3081,2,"Robust, fast, intuitive plain text accounting tool with CLI, TUI and web interfaces.",simonmichael,hledger,https://github.com/simonmichael/hledger
2024-12-06,haskell,3996,0,The Haskell Tool Stack,commercialhaskell,stack,https://github.com/commercialhaskell/stack
2024-12-06,haskell,7402,7,"SimpleX - the first messaging network operating without user identifiers of any kind - 100% private by design! iOS, Android and desktop apps 📱!",simplex-chat,simplex-chat,https://github.com/simplex-chat/simplex-chat