date,language,stargazers,starsToday,description,owner,name,url
2022-12-23,kotlin,3659,10,阅读3服务器版，桌面端，iOS可用。后端 Kotlin + Spring Boot + Vert.x + Coroutine ；前端 Vue.js + Element。麻烦点点star，关注一下公众号【假装大佬】,hectorqin,reader,https://github.com/hectorqin/reader
2022-12-23,kotlin,125,15,A framework to bootstrap the creation of catalog samples apps by removing all the boilerplate and dynamically including all available samples into a single activity.,google,casa-android,https://github.com/google/casa-android
2022-12-23,kotlin,5878,8,A collection of extension libraries for Jetpack Compose,google,accompanist,https://github.com/google/accompanist
2022-12-23,kotlin,2539,1,GraphQL for Java with Spring Boot made easy.,Netflix,dgs-framework,https://github.com/Netflix/dgs-framework
2022-12-23,kotlin,14102,15,Official Jetpack Compose samples.,android,compose-samples,https://github.com/android/compose-samples
2022-12-23,kotlin,4239,2,Kotlin multiplatform / multi-format serialization,Kotlin,kotlinx.serialization,https://github.com/Kotlin/kotlinx.serialization
2022-12-23,kotlin,9939,11,"Compose Multiplatform, a modern UI framework for Kotlin that makes building performant and beautiful user interfaces easy and enjoyable.",JetBrains,compose-jb,https://github.com/JetBrains/compose-jb
2022-12-23,kotlin,1386,7,Matsuri (茉莉) / V2Ray / universal proxy toolchain for Android / Fork of SagerNet,MatsuriDayo,Matsuri,https://github.com/MatsuriDayo/Matsuri
2022-12-23,kotlin,6743,5,Kotlin SQL Framework,JetBrains,Exposed,https://github.com/JetBrains/Exposed
2022-12-23,kotlin,43401,6,The Kotlin Programming Language.,JetBrains,kotlin,https://github.com/JetBrains/kotlin
2022-12-23,kotlin,5313,3,An anti-bikeshedding Kotlin linter with built-in formatter,pinterest,ktlint,https://github.com/pinterest/ktlint
2022-12-23,kotlin,2519,12,Community-driven collection of Jetpack Compose example code and tutorials  https://foso.github.io/compose,Foso,Jetpack-Compose-Playground,https://github.com/Foso/Jetpack-Compose-Playground
2022-12-23,kotlin,2963,6,Material Design file manager for Android,zhanghai,MaterialFiles,https://github.com/zhanghai/MaterialFiles
2022-12-23,kotlin,1636,2,Render your Android screens without a physical device or emulator,cashapp,paparazzi,https://github.com/cashapp/paparazzi
2022-12-23,kotlin,4010,6,provides metadata for networkIDs and chainIDs,ethereum-lists,chains,https://github.com/ethereum-lists/chains
2022-12-23,kotlin,5764,7,哔哩漫游，解除B站客户端番剧区域限制的Xposed模块，并且提供其他小功能。An Xposed module that unblocks bangumi area limit of BILIBILI with miscellaneous features.,yujincheng08,BiliRoaming,https://github.com/yujincheng08/BiliRoaming
2022-12-23,kotlin,7226,0,Uber's cross-platform mobile architecture framework.,uber,RIBs,https://github.com/uber/RIBs
2022-12-23,kotlin,1760,0,"VLC for Android, Android TV and ChromeOS",videolan,vlc-android,https://github.com/videolan/vlc-android
2022-12-23,kotlin,1239,6,"Series of Tutorials to learn about Jetpack Compose with subjects Material Widgets, Layout, SubcomposeLayout, custom layouts, State, custom rememberable, recomposition, LaunchedEffect, side-effects, Gesture, Animation, Navigation, Canvas, UIs like whatsapp and others.",SmartToolFactory,Jetpack-Compose-Tutorials,https://github.com/SmartToolFactory/Jetpack-Compose-Tutorials
2022-12-23,kotlin,16390,2,A gardening app illustrating Android development best practices with migrating a View-based app to Jetpack Compose.,android,sunflower,https://github.com/android/sunflower
2022-12-23,kotlin,116,3,Discord Rich Presence for Android. Made with jetpack compose and material3,dead8309,Kizzy,https://github.com/dead8309/Kizzy
2022-12-23,kotlin,4185,7,Development environment for Android Jetpack extension libraries under the androidx namespace. Synchronized with Android Jetpack's primary development branch on AOSP.,androidx,androidx,https://github.com/androidx/androidx
2022-12-23,kotlin,4762,1,mocking library for Kotlin,mockk,mockk,https://github.com/mockk/mockk
2022-12-23,kotlin,545,1,Mapbox Navigation SDK for Android,mapbox,mapbox-navigation-android,https://github.com/mapbox/mapbox-navigation-android
2022-12-23,kotlin,10617,3,Framework for quickly creating connected applications in Kotlin with minimal effort,ktorio,ktor,https://github.com/ktorio/ktor