date,language,stargazers,starsToday,description,owner,name,url
2022-02-25,php,7449,7,Firefly III: a personal finances manager,firefly-iii,firefly-iii,https://github.com/firefly-iii/firefly-iii
2022-02-25,php,4293,4,"An easy to use, free and open source laravel eCommerce platform to build your online shop in no time.",bagisto,bagisto,https://github.com/bagisto/bagisto
2022-02-25,php,3544,0,Main repository for pfSense,pfsense,pfsense,https://github.com/pfsense/pfsense
2022-02-25,php,2876,1,基于 Laravel 的后台系统构建工具 (Laravel Admin)，使用很少的代码快速构建一个功能完善的高颜值后台系统，内置丰富的后台常用组件，开箱即用，让开发者告别冗杂的HTML代码,jqhph,dcat-admin,https://github.com/jqhph/dcat-admin
2022-02-25,php,26526,3,The Symfony PHP framework,symfony,symfony,https://github.com/symfony/symfony
2022-02-25,php,4236,2,The Roundcube Webmail suite,roundcube,roundcubemail,https://github.com/roundcube/roundcubemail
2022-02-25,php,4835,1,A package to backup your Laravel app,spatie,laravel-backup,https://github.com/spatie/laravel-backup
2022-02-25,php,6117,7,A pure PHP library for reading and writing word processing documents,PHPOffice,PHPWord,https://github.com/PHPOffice/PHPWord
2022-02-25,php,4043,5,Moodle - the world's open source learning platform,moodle,moodle,https://github.com/moodle/moodle
2022-02-25,php,4826,1,Associate files with Eloquent models,spatie,laravel-medialibrary,https://github.com/spatie/laravel-medialibrary
2022-02-25,php,1718,1,Statamic 3: The Core Composer Package,statamic,cms,https://github.com/statamic/cms
2022-02-25,php,15634,5,A simple PHP API extension for DateTime.,briannesbitt,Carbon,https://github.com/briannesbitt/Carbon
2022-02-25,php,15992,5,Liberating Web Analytics. Star us on Github? +1. Matomo is the leading open alternative to Google Analytics that gives you full control over your data. Matomo lets you easily collect data from websites & apps and visualise this data and extract insights. Privacy is built-in. We love Pull Requests!,matomo-org,matomo,https://github.com/matomo-org/matomo
2022-02-25,php,2668,9,"World countries, states, regions, provinces, cities, towns in JSON, SQL, XML, YAML, and CSV. All Countries, States, Cities with ISO2, ISO3, Country Code, Phone Code, Capital, Native Language, Timezones, Latitude, Longitude, Region, Subregion, Flag Emoji, and Currency. #countries #states #cities",dr5hn,countries-states-cities-database,https://github.com/dr5hn/countries-states-cities-database
2022-02-25,php,2426,3,"Open Source Data & Experience Management Platform (PIM, MDM, CDP, DAM, DXP/CMS & Digital Commerce)",pimcore,pimcore,https://github.com/pimcore/pimcore
2022-02-25,php,3456,1,PHP library generating PDF files from UTF-8 encoded HTML,mpdf,mpdf,https://github.com/mpdf/mpdf
2022-02-25,php,10582,3,This is a collection of tutorials for learning how to use Docker with various tools. Contributions welcome.,docker,labs,https://github.com/docker/labs
2022-02-25,php,6713,3,Open Source eCommerce Platform on Symfony,Sylius,Sylius,https://github.com/Sylius/Sylius
2022-02-25,php,1228,2,"WordPress Develop, Git-ified. Synced from git://develop.git.wordpress.org/, including branches and tags! This repository is just a mirror of the WordPress subversion repository. Please include a link to a pre-existing ticket on https://core.trac.wordpress.org/ with every pull request.",WordPress,wordpress-develop,https://github.com/WordPress/wordpress-develop
2022-02-25,php,4300,4,"The most advanced frontend drag & drop page builder. Create high-end, pixel perfect websites at record speeds. Any theme, any page, any design.",elementor,elementor,https://github.com/elementor/elementor
2022-02-25,php,2279,3,Automatic multi-tenancy for Laravel. No code changes needed.,archtechx,tenancy,https://github.com/archtechx/tenancy
2022-02-25,php,4800,2,Free and Online Accounting Software,akaunting,akaunting,https://github.com/akaunting/akaunting
2022-02-25,php,9104,2,Doctrine Object Relational Mapper (ORM),doctrine,orm,https://github.com/doctrine/orm
2022-02-25,php,8626,5,HTML to PDF converter for PHP,dompdf,dompdf,https://github.com/dompdf/dompdf
2022-02-25,php,5110,1,A DOMPDF Wrapper for Laravel,barryvdh,laravel-dompdf,https://github.com/barryvdh/laravel-dompdf