date,language,stargazers,starsToday,description,owner,name,url
2022-02-20,php,26262,45,The Laravel Framework.,laravel,framework,https://github.com/laravel/framework
2022-02-20,php,17833,42,The classic email sending library for PHP,PHPMailer,PHPMailer,https://github.com/PHPMailer/PHPMailer
2022-02-20,php,5045,4,Instant Upgrades and Automated Refactoring of any PHP 5.3+ code,rectorphp,rector,https://github.com/rectorphp/rector
2022-02-20,php,5846,4,A free open source IT asset/license management system,snipe,snipe-it,https://github.com/snipe/snipe-it
2022-02-20,php,8173,2,"Library that provides collection, processing, and rendering functionality for PHP code coverage information.",sebastianbergmann,php-code-coverage,https://github.com/sebastianbergmann/php-code-coverage
2022-02-20,php,5877,2,Damn Vulnerable Web Application (DVWA),digininja,DVWA,https://github.com/digininja/DVWA
2022-02-20,php,4093,12,Home of the Joomla! Content Management System,joomla,joomla-cms,https://github.com/joomla/joomla-cms
2022-02-20,php,18329,28,"Nextcloud server, a safe home for all your data",nextcloud,server,https://github.com/nextcloud/server
2022-02-20,php,7645,1,"A customizable, open-source eCommerce platform built on WordPress. Build any commerce solution you can imagine.",woocommerce,woocommerce,https://github.com/woocommerce/woocommerce
2022-02-20,php,4996,3,Mautic: Open Source Marketing Automation Software.,mautic,mautic,https://github.com/mautic/mautic
2022-02-20,php,1179,1,Simple patches plugin for Composer,cweagans,composer-patches,https://github.com/cweagans/composer-patches
2022-02-20,php,10890,4,Voyager - The Missing Laravel Admin,the-control-group,voyager,https://github.com/the-control-group/voyager
2022-02-20,php,38,5,Quickly visit any route in your Laravel app,spatie,laravel-visit,https://github.com/spatie/laravel-visit
2022-02-20,php,8614,1,HTML to PDF converter for PHP,dompdf,dompdf,https://github.com/dompdf/dompdf
2022-02-20,php,18248,2,The PHP Unit Testing framework.,sebastianbergmann,phpunit,https://github.com/sebastianbergmann/phpunit
2022-02-20,php,1075,2,网易云音乐升级API,ZainCheung,netease-cloud-api,https://github.com/ZainCheung/netease-cloud-api
2022-02-20,php,2624,3,Community-based GPL-licensed network monitoring system,librenms,librenms,https://github.com/librenms/librenms
2022-02-20,php,10859,2,A pure PHP library for reading and writing spreadsheet files,PHPOffice,PhpSpreadsheet,https://github.com/PHPOffice/PhpSpreadsheet
2022-02-20,php,10114,1,"Mockery is a simple yet flexible PHP mock object framework for use in unit testing with PHPUnit, PHPSpec or any other testing framework. Its core goal is to offer a test double framework with a succinct API capable of clearly defining all possible object operations and interactions using a human readable Domain Specific Language (DSL).",mockery,mockery,https://github.com/mockery/mockery
2022-02-20,php,2773,10,"A collection of tools for rapidly building beautiful TALL stack interfaces, designed for humans.",laravel-filament,filament,https://github.com/laravel-filament/filament
2022-02-20,php,152,1,Google Ads API Client Library for PHP,googleads,google-ads-php,https://github.com/googleads/google-ads-php
2022-02-20,php,15057,3,"程序员如何优雅的挣零花钱，2.0版，升级为小书了。Most of this not work outside China , so no English translate",easychen,howto-make-more-money,https://github.com/easychen/howto-make-more-money
2022-02-20,php,3035,2,"Dolibarr ERP CRM is a modern software package to manage your company or foundation's activity (contacts, suppliers, invoices, orders, stocks, agenda, accounting, ...). It is open source software (written in PHP) and designed for small and medium businesses, foundations and freelancers. You can freely install, use and distribute it as a standalon…",Dolibarr,dolibarr,https://github.com/Dolibarr/dolibarr
2022-02-20,php,9063,5,A deployment tool written in PHP with support for popular frameworks out of the box,deployphp,deployer,https://github.com/deployphp/deployer
2022-02-20,php,9910,4,"All Submissions you make to Magento Inc. (""Magento"") through GitHub are subject to the following terms and conditions: (1) You grant Magento a perpetual, worldwide, non-exclusive, no charge, royalty free, irrevocable license under your applicable copyrights and patents to reproduce, prepare derivative works of, display, publically perform, subli…",magento,magento2,https://github.com/magento/magento2