date,language,stargazers,starsToday,description,owner,name,url
2023-03-27,haskell,20256,6,REST API for any Postgres database,PostgREST,postgrest,https://github.com/PostgREST/postgrest
2023-03-27,haskell,24,0,generate haskell types for Squeal from a running postgresql database.,mwotton,squealgen,https://github.com/mwotton/squealgen
2023-03-27,haskell,58,0,Prometheus.io Haskell client.,bitnomial,prometheus,https://github.com/bitnomial/prometheus
2023-03-27,haskell,16,0,Effectful Raw handler for Servant servers.,cdepillabout,servant-rawm,https://github.com/cdepillabout/servant-rawm
2023-03-27,haskell,87,0,Core types and utilities,diagrams,diagrams-core,https://github.com/diagrams/diagrams-core
2023-03-27,haskell,2694,7,SimpleX - the first messaging platform operating without user identifiers of any kind - 100% private by design! iOS and Android apps are released !,simplex-chat,simplex-chat,https://github.com/simplex-chat/simplex-chat
2023-03-27,haskell,2021,4,A data-parallel functional programming language,diku-dk,futhark,https://github.com/diku-dk/futhark
2023-03-27,haskell,2590,3,An advanced keyboard manager,kmonad,kmonad,https://github.com/kmonad/kmonad
2023-03-27,haskell,1529,5,A shell script which checks your $HOME for unwanted files and directories.,b3nj5m1n,xdg-ninja,https://github.com/b3nj5m1n/xdg-ninja
2023-03-27,haskell,2301,0,Official haskell ide support via language server (LSP). Successor of ghcide & haskell-ide-engine.,haskell,haskell-language-server,https://github.com/haskell/haskell-language-server
2023-03-27,haskell,0,0,"Slides of ""Game of Life: an Introduction to Haskell""",nicuveo,Slides_GameOfLife,https://github.com/nicuveo/Slides_GameOfLife
2023-03-27,haskell,2830,1,Mirror of the Glasgow Haskell Compiler. Please submit issues and patches to GHC's Gitlab instance (https://gitlab.haskell.org/ghc/ghc). First time contributors are encouraged to get started with the newcomers info (https://gitlab.haskell.org/ghc/ghc/wikis/contributing).,ghc,ghc,https://github.com/ghc/ghc
2023-03-27,haskell,72,0,Marlowe smart contract language Cardano implementation,input-output-hk,marlowe-cardano,https://github.com/input-output-hk/marlowe-cardano
2023-03-27,haskell,2447,11,The fastest way to develop full-stack web apps with React & Node.js.,wasp-lang,wasp,https://github.com/wasp-lang/wasp
2023-03-27,haskell,6,0,Integrations with Vinyl/Frames records.,composite-hs,composite,https://github.com/composite-hs/composite
2023-03-27,haskell,1438,0,The Plutus language implementation and tools,input-output-hk,plutus,https://github.com/input-output-hk/plutus
2023-03-27,haskell,6,0,This is scrive's common collection of function import we use the most.,scrive,scrive-prelude,https://github.com/scrive/scrive-prelude
2023-03-27,haskell,8,0,A simple cardano market place facilitating nft buy and sale.,dQuadrant,cardano-marketplace,https://github.com/dQuadrant/cardano-marketplace
2023-03-27,haskell,880,1,Learn Haskell basics in 4 pull requests,kowainik,learn4haskell,https://github.com/kowainik/learn4haskell
2023-03-27,haskell,2529,1,Koka language compiler and interpreter,koka-lang,koka,https://github.com/koka-lang/koka
2023-03-27,haskell,1499,1,Tunneling over websocket protocol - Static binary available,erebe,wstunnel,https://github.com/erebe/wstunnel
2023-03-27,haskell,202,0,The ledger implementation and specifications of the Cardano blockchain.,input-output-hk,cardano-ledger,https://github.com/input-output-hk/cardano-ledger
2023-03-27,haskell,553,0,A comprehensive Amazon Web Services SDK for Haskell.,brendanhay,amazonka,https://github.com/brendanhay/amazonka
2023-03-27,haskell,7149,1,"Compiler for Elm, a functional language for reliable webapps.",elm,compiler,https://github.com/elm/compiler
2023-03-27,haskell,28331,5,Universal markup converter,jgm,pandoc,https://github.com/jgm/pandoc